coordinates,created_at,hashtags,media,urls,favorite_count,id,in_reply_to_screen_name,in_reply_to_status_id,in_reply_to_user_id,lang,place,possibly_sensitive,quote_id,retweet_count,retweet_id,retweet_screen_name,source,text,tweet_url,user_created_at,user_id,user_default_profile_image,user_description,user_favourites_count,user_followers_count,user_friends_count,user_listed_count,user_location,user_name,user_screen_name,user_statuses_count,user_time_zone,user_urls,user_verified
"-79.35195726,43.69544687",Sat Jan 16 08:28:45 +0000 2021,,,https://www.instagram.com/p/CKGWL6yMqxr/?igshid=162zf2se2u5uh,0,1350359321914331136,,,,en,"Toronto, Ontario",false,,0,,,"<a href=""http://instagram.com"" rel=""nofollow"">Instagram</a>",G’MORNING good people .. it’s our Lockdown Party 🎉 I’ll start I’m bringing Beer as we are going to need it 🍻🍻🍻🍻 @ Party Central!! https://t.co/ojtGiL6Ddg,https://twitter.com/bubblybobbii/status/1350359321914331136,Wed Jan 26 15:51:34 +0000 2011,243226271,false,Product Tester & Reviewer💄 Social Media Influencer Book Worm 📖🐛 Netflix Addict📺 IG Follow me on IG @bobbijjo @bubblybobbii,2119,833,2441,52,"Guildwood, Toronto",Bobbi-Jo,bubblybobbii,23286,,https://vm.tiktok.com/ZMRxqqRak/,false
"-0.102589,51.5401",Sat Jan 16 10:50:00 +0000 2021,diaryofacreamaddict breakfast brunch saturday saturdaybreakfast weekend whippedcream cream lockdown lockdown2021 lockdownlife,,https://www.instagram.com/p/CKGmWX9HwNs/?igshid=1rt1n4tnu84io,0,1350394870649683968,,,,en,"Islington, London",false,,0,,,"<a href=""http://instagram.com"" rel=""nofollow"">Instagram</a>","Breakfast of a cream addict 

#diaryofacreamaddict 

#breakfast #brunch #saturday #saturdaybreakfast #weekend #whippedcream #cream #lockdown #lockdown2021 #lockdownlife @ Upper Street https://t.co/tGaHjORMbl",https://twitter.com/EmmaRoseHurst/status/1350394870649683968,Wed Oct 20 21:01:29 +0000 2010,205418837,false,"Ever curious, ever thinking strategy consultant
Interested in the psychology of people and businesses 
(and the esoteric world of health and nutrition)",585,423,297,60,London,Emma Rose Hurst,EmmaRoseHurst,4991,,http://erhblog.wordpress.com,false
"-71.0150608,42.36576817",Sat Jan 16 09:45:55 +0000 2021,mikeshot a319 myuniyedjourney lovethejourney,,https://www.instagram.com/p/CKGfA_yhSWs/?igshid=x1n7yjj4o2ml,0,1350378742615470080,,,,en,"Boston, MA",false,,0,,,"<a href=""http://instagram.com"" rel=""nofollow"">Instagram</a>","Hello, @flylogan!  @united brings me to Boston on a special COVID route from @flymco. #mikeshot #a319 #myuniyedjourney #lovethejourney @ Boston Logan International Airport https://t.co/UWKFHR31PE",https://twitter.com/Mike_J_Morgan/status/1350378742615470080,Tue Sep 09 17:31:56 +0000 2008,16206024,false,#avgeek & #entrepreneur who loves planes more than one should. I love @Boeing and fly only @united. I write an #avgeek blog you should read.,2155,1560,1675,95,"Norman, OK",Mike Morgan,Mike_J_Morgan,11780,,http://mikejmorgan.com,false
"-80.1219827,25.8620672",Sat Jan 16 10:44:53 +0000 2021,,,https://www.instagram.com/p/CKGlwyiAXso/?igshid=y2k3i35sf53g,0,1350393579064049670,,,,en,"Miami Beach, FL",false,,0,,,"<a href=""http://instagram.com"" rel=""nofollow"">Instagram</a>",Nice weekend.  Peace and love . And without pandemic please em Ford Lauderdale https://t.co/yGqO98aA3j,https://twitter.com/flavioinfoprati/status/1350393579064049670,Sat Mar 28 13:00:51 +0000 2009,27223683,false,"store assistant to Infopratic
looking to the future,communicative, cheerful, motivated by Buddhist, lover of life,family first!  faces death as a portal.",2220,352,2351,12,Pernambuco - Brasil,Infopratic Cursos,flavioinfoprati,19351,,http://infopraticesj.wix.com/infopratic#!home/mainPage,false
"16.41560835,48.1739745",Sat Jan 16 08:26:32 +0000 2021,covid19 corona covid,,http://dlvr.it/RqhVmq,0,1350358764751187969,,,,en,"Wien, Österreich",false,,0,,,"<a href=""https://dlvrit.com/"" rel=""nofollow"">dlvr.it</a>",🇦🇹 Chano italian &amp; steak in 1210 Wien - Falstaff https://t.co/4bGndqBPqp #covid19 #corona #covid,https://twitter.com/covid_watch/status/1350358764751187969,Wed Mar 18 16:28:15 +0000 2020,1240313872927653892,false,"Covid-19 Ticker für AT 🇦🇹, operated by @50n1cb00m | Quelle: @echobot | #Covid19at | Disclaimer: Links spiegeln nicht (zwingend) unseren Standpunkt wider.",223,213,143,9,Austria,Covid-19 Ö-Watch,covid_watch,33760,,https://sonicboom.agency/,false
"-121.9828,37.5457",Sat Jan 16 09:00:15 +0000 2021,stayathome desserted covid19stayathome,,https://www.instagram.com/p/CKGZXnBH6Ug7tFqNbbIdPsjZyOLCRtkK2HEgo80/?igshid=fe4q2ra54780,0,1350367250071629824,,,,en,"Fremont, CA",false,,0,,,"<a href=""http://instagram.com"" rel=""nofollow"">Instagram</a>","I decided to go for a walk by my office.  Eerily quiet at the office park due to #stayathome order. #desserted #covid19stayathome @ Fremont, California https://t.co/Y3A0YVgRYX",https://twitter.com/steve94010/status/1350367250071629824,Mon Jan 04 05:34:44 +0000 2010,101670868,false,"I am a dad, husband and company executive. On weekends, I am chauffeur to my kids and love it. Pura vida!",50,26,62,0,SF Bay Area,Steve,steve94010,333,,,false
"-73.8309,40.7",Sat Jan 16 05:08:21 +0000 2021,,,https://www.instagram.com/p/CKF_P65Jg9H/?igshid=inwxog5cdzbv,0,1350308887954681856,,,,en,"Queens, NY",false,,0,,,"<a href=""http://instagram.com"" rel=""nofollow"">Instagram</a>","COVID-19 update @ Queens, New York https://t.co/c6bKN8qvXq",https://twitter.com/johnnybebad666_/status/1350308887954681856,Mon Sep 09 05:59:59 +0000 2019,1170939664196354048,false,🔨support81 Harley-Davidson XL1200 CX Roadster HOG⸸⛧Satanist🦇goth goal oriented bassist?🎸metal💀extra acting s&m sex women only ct3475843316 Tri Technologies♌,9051,110,1070,1,"New York, NY",John Fitzgerald Kennedy Page®,johnnybebad666_,28982,,https://www.suicidegirls.com/join/?aid=1032495,false
"-6.2182605,53.25750732",Sat Jan 16 09:52:51 +0000 2021,,,,3,1350380484484804609,Claredaisy,1350378366503940096,217099872,en,"Dun Laoghaire-Rathdown, Ireland",,,0,,,"<a href=""http://tapbots.com/tweetbot"" rel=""nofollow"">Tweetbot for iΟS</a>","@Claredaisy Yeah.. they are thanking god now, but at the time they made us feel like shite for mask-wearing, social distancing and not going into peoples house.. They had been pretty much going as long as normal",https://twitter.com/gfarnan/status/1350380484484804609,Thu Jul 03 12:50:54 +0000 2008,15307815,false,One of the Bray 500. Clones man living in Dublin,1616,405,458,12,Dublin ,Gary Farnan,gfarnan,38836,,,false
"-116.54655,33.82364",Sat Jan 16 05:21:07 +0000 2021,PalmSprings COVID dolewhip tajin,,https://www.instagram.com/p/CKGAtZcASPM/?igshid=6a2j970szkpj,0,1350312101093519361,,,,en,"Palm Springs, CA",false,,0,,,"<a href=""http://instagram.com"" rel=""nofollow"">Instagram</a>","Friday Nights Out in #PalmSprings During #COVID: Going out for ice cream! God I miss Musical Nights @quadzps! 😭 Also, get the Piñada @lappertspalmsprings, #dolewhip + #tajin! ❤️❤️❤️ https://t.co/oQKOwVc2hF",https://twitter.com/KristMejia/status/1350312101093519361,Sat Jul 19 17:47:06 +0000 2014,2660056412,false,✊🏽💻 LatinX Marketing Creative 🌵🌁Palm Springs / San Francisco 👬🌮Gay Husband / Taco Addict,438,204,1072,31,San Francisco,Krist Mejia,KristMejia,1077,,https://www.instagram.com/kristmejia/,false
"2.1683,41.3894",Sat Jan 16 07:39:29 +0000 2021,love live grateful barcelona covid bathroomdesign interior,,https://www.instagram.com/p/CKGQixvhiwA/?igshid=9w6302e4lmo6,0,1350346922049953794,,,,en,"Barcelona, España",false,,0,,,"<a href=""http://instagram.com"" rel=""nofollow"">Instagram</a>","Currently busy making the best out of it 💋 LIFE that is...red lips and selfies 😁 #love #live #grateful #barcelona #covid #bathroomdesign #interior @ Barcelona, Spain https://t.co/mHJfgkcWOp",https://twitter.com/SeldaCar/status/1350346922049953794,Sat Nov 13 11:21:53 +0000 2010,215239524,false,"Fashion, Food, Travel, Fun & Friends (alias Welcome-to-my-life) :)) Instagram: SELDACAR",41,56283,98,80,Somewhere over the Ocean ,SeldaCar,SeldaCar,4238,,,false
"101.6928,2.9317",Sat Jan 16 04:36:15 +0000 2021,AneesaSyafaa babyfairandbeautiful babygirl 2ndchild anakbondaayah alhamdulillah stayathome,,https://www.instagram.com/p/CKF7k3apvpZM3jsPY4VthPZdy4R9Z4BBMIG6240/?igshid=cj53scqf1m49,0,1350300810584854529,,,,en,"Putrajaya, Wilayah Persekutuan Putrajaya",false,,0,,,"<a href=""http://instagram.com"" rel=""nofollow"">Instagram</a>","This is weekend.. I love to stay at home with bonda and abg anas.. 😍

#AneesaSyafaa #babyfairandbeautiful #babygirl #2ndchild #anakbondaayah #alhamdulillah #stayathome https://t.co/Q1RAxpI1wG",https://twitter.com/Syerie/status/1350300810584854529,Wed Feb 02 03:23:55 +0000 2011,246093488,false,"An Educator, Lecturer, Entrepreneur, Good as negotiator, Consultant in Business Start-Up, Baking and Cooking, Mix Pakistani + Malay, Muslim",8397,244,507,8,"ÜT: 2.189058,102.250404",Cik Cery,Syerie,13292,,http://syerie.wordpress.com/,false
"-76.8,17.9833",Sat Jan 16 06:27:15 +0000 2021,,,https://teespring.com/stores/vibestees-3 https://www.instagram.com/p/CHGVdQSlaYQ/?igshid=1m3434fbcoxd2,0,1350328745421258752,,,,en,Jamaica,false,,0,,,"<a href=""http://instagram.com"" rel=""nofollow"">Instagram</a>","Covid-19 (Song Bird)
A eye opener movie
Remember to support my teespring store.
Buy a shirt
https://t.co/pOIzA9l0r9 @ Kingston, Jamaica https://t.co/9NeeBeeFg2",https://twitter.com/crazyii7/status/1350328745421258752,Sun Sep 26 05:30:48 +0000 2010,195246768,false,"VibesTees company
we give you the best design for T-shirts. 
sell and distribute vibestees products contact: whatsapp 1876-583-4054
 https://t.co/AA1MY1uLS3",1298,964,1274,13,Jamaica,jason hickinson,crazyii7,8166,,https://teespring.com/stores/vibestees-3,false
"-117.458,34.0977",Sat Jan 16 06:48:53 +0000 2021,,,https://www.instagram.com/p/CKGKZdpAkzF/?igshid=oxt10ucx0wwc,0,1350334190290612224,,,,en,"Fontana, CA",false,,0,,,"<a href=""http://instagram.com"" rel=""nofollow"">Instagram</a>","His burning the coronavirus lol 😆😂🤣😅 @ Fontana, California https://t.co/yS66NE98bu",https://twitter.com/businesslaw2000/status/1350334190290612224,Mon Mar 03 14:44:23 +0000 2014,2370517224,false,HI I'M TRYING TO REACH A MILLION SUBSCRIBERS TO SNAPCHAT SCREEN NAME johnjames1973 TWITTER businesslaw2000 INSTAGRAM john James YOUTUBE TIKTOKJohnJames Sanchez,10,138,2195,4,The business world ,John James,businesslaw2000,4733,,,false
"-0.12485951,51.50538967",Sat Jan 16 10:11:01 +0000 2021,SouthKorea,,http://dlvr.it/RqhknY,0,1350385060206166016,,,,en,"London, England",false,,1,,,"<a href=""https://dlvrit.com/"" rel=""nofollow"">dlvr.it</a>",Two US military bases in #SouthKorea shelter in place amid extension of coronavirus curbs https://t.co/EXnDXTMT8W,https://twitter.com/BritishHeraldUK/status/1350385060206166016,Wed Feb 17 17:49:42 +0000 2010,115123902,false,Where Britain Meets the World® | The Official handle of #britishherald,344,133915,588,283,"London, United Kingdom",British Herald,BritishHeraldUK,57065,,http://www.britishherald.com,false
"-118.2445,34.0564",Sat Jan 16 05:26:07 +0000 2021,covid_19 dodgers losangeles foco,,https://www.instagram.com/p/CKGBSKzAaXl/?igshid=bm8fuewi87k9,0,1350313362022928384,,,,en,"Los Angeles, CA",false,,0,,,"<a href=""http://instagram.com"" rel=""nofollow"">Instagram</a>","#covid_19 #dodgers #losangeles #foco @ Los Angeles, California https://t.co/CeGcQPLVpH",https://twitter.com/AlexGillis1994/status/1350313362022928384,Mon Oct 17 02:28:33 +0000 2011,392460205,false,,82,53,318,2,,Alex Gillis,AlexGillis1994,427,,,false
"-4.25808324,55.85928589",Sat Jan 16 08:52:47 +0000 2021,Scotland Glasgow Stayathome Commute Coronavirus Scotrail Safety,,https://www.instagram.com/p/CKGY6-kh9Rj/?igshid=uzr5uyg7g14h,0,1350365371019128833,,,,en,"Glasgow, Scotland",false,,0,,,"<a href=""http://instagram.com"" rel=""nofollow"">Instagram</a>","I guess the 'stay at home' orders is working as the train back from work yesterday was empty 

#Scotland #Glasgow #Stayathome #Commute #Coronavirus #Scotrail #Safety @ Glasgow Central Station https://t.co/yva7Viytfl",https://twitter.com/AswadsWorld/status/1350365371019128833,Fri Apr 17 18:36:03 +0000 2009,32514248,false,A 29 year old who is looking for a new challange to take on & will do anything to achieve that goal.,108,249,2701,4,"Glasgow, Scotland",Aswad Choudhry,AswadsWorld,18264,,http://about.me/aswad.choudhry,false
"2.1683,41.3894",Sat Jan 16 06:03:51 +0000 2021,healthcare sanidad wallpaper streetart wallart bcnart covid_19,,https://www.instagram.com/p/CKGFmc6hFoH/?igshid=1tzl0wayguk1g,0,1350322858673770498,,,,en,"Barcelona, España",false,,0,,,"<a href=""http://instagram.com"" rel=""nofollow"">Instagram</a>","Happy helthcare!!! #healthcare #sanidad #wallpaper #streetart #wallart #bcnart #covid_19 en Barcelona, Spain https://t.co/0qG1ouLeey",https://twitter.com/quenosabes/status/1350322858673770498,Tue Jun 17 15:05:46 +0000 2008,15146526,false,,2961,220,207,28,"Arenys de Mar, España",Ruben H.,quenosabes,15511,,,false
"-73.56725453,45.75975883",Sat Jan 16 08:50:33 +0000 2021,,,http://dlvr.it/RqhYZx,0,1350364806935506947,,,,en,"Mascouche, Québec",false,,0,,,"<a href=""https://dlvrit.com/"" rel=""nofollow"">dlvr.it</a>",Fighting Stigma: 80% of Irish population will have received Covid-19 vaccine by September - Government predicts: Vaccine projections sent by Minister for Health Stephen Donnelly to TDs on Wednesday shows that Ireland is set to receive around 3.7 million… https://t.co/RUw6oe4y5V,https://twitter.com/StigmabaseN/status/1350364806935506947,Wed Sep 15 15:55:47 +0000 2010,191092262,false,Ireland — Scotland — Inuit —  Svenska  | Keeping up-to-date on global exclusion — Stigmabase is a canadian internet non-profit Initiative,0,1611,1297,110,Ireland | Scotland | Inuit | Skandinavien,Stigmabase | NORDIC,StigmabaseN,951806,,https://www.stigmabase.org/,false
"73.69949,24.58782",Sat Jan 16 09:15:04 +0000 2021,AshokLeyland AapkiJeetHamariJeet ColdStar DOST Covid LastMileConnector,https://twitter.com/ALIndiaOfficial/status/1350349073325334528/photo/1,https://www.instagram.com/p/CKGbfBaBBvc/?igshid=fqaj6tkbuvik,0,1350370977906126850,,,,en,"उदयपुर, भारत",false,,0,,,"<a href=""http://instagram.com"" rel=""nofollow"">Instagram</a>","Serving the Nation with Pride. Keeping India Safe. 

#AshokLeyland #AapkiJeetHamariJeet #ColdStar #DOST #Covid-19VaccineCarrier #LastMileConnector https://t.co/ULcXDNStyf @ Udaipur - The City of Lakes https://t.co/c5ziRnAGW2",https://twitter.com/Niranjanchoubi4/status/1350370977906126850,Wed Jun 21 02:47:41 +0000 2017,877357324133744641,false,Company Padam Motors Ashok Leyland,4938,49,380,0,Udaipur Rajasthan,पं. निर...!🚩🇮🇳,Niranjanchoubi4,975,,http://www.ashokleyland.com,false
"99.03451608,7.59672717",Sat Jan 16 06:31:39 +0000 2021,mooklantaecoresort kohlantalongbeach krabithailand covid_19 january2021,,https://www.instagram.com/p/CKGInq1BuA5/?igshid=r732eshx9n83,0,1350329852302393344,,,,en,"ศาลาด่าน, ประเทศไทย",false,,0,,,"<a href=""http://instagram.com"" rel=""nofollow"">Instagram</a>",Letting the pedestrians cross the road.... #mooklantaecoresort #kohlantalongbeach #krabithailand #covid_19 #january2021 @ Mook Lanta Eco Resort https://t.co/qS1bYfocSx,https://twitter.com/MookLantaEco/status/1350329852302393344,Mon Dec 09 09:02:11 +0000 2013,2237319872,false,Beautiful Thai Resort set in Tropical Gardens,27,79,136,1,Koh Lanta Yai,Mook Lanta Eco Resort,MookLantaEco,512,,http://www.mooklanta.com,false
"-1.93048239,53.60276332",Sat Jan 16 07:00:33 +0000 2021,,https://twitter.com/GBTrainJourneys/status/1350337126496235522/photo/1,https://j.mp/2Ndvsxf,1,1350337126496235522,,,,en,"Marsden, England",false,,1,,,"<a href=""https://dlvrit.com/"" rel=""nofollow"">dlvr.it</a>",Covid UK: How Piers Corbyn leads an anti-vaxxer movement that thinks jabs are a conspiracy - Daily Mail https://t.co/jGBY4Z1Yp0 https://t.co/w7luRRf6ZE,https://twitter.com/GBTrainJourneys/status/1350337126496235522,Fri Sep 26 12:19:28 +0000 2014,2785332587,false,Grab a copy of Bradshaw's and jump aboard alongside many other followers of Michael Portillo's travels around Britain (this is run by trainspotters not the BBC),25,1972,488,15,Great Britain,GB Railway Journeys,GBTrainJourneys,9163,,,false
"4.6556647,51.15595615",Sat Jan 16 06:29:16 +0000 2021,,,https://www.instagram.com/p/CKGIguUB85t/?igshid=1pl07y6uta5oe,0,1350329254798626816,,,,en,"Nijlen, België",false,,0,,,"<a href=""http://instagram.com"" rel=""nofollow"">Instagram</a>",Due to the COVID madness no wedding bells today. But the friendship and love of our friends is uplifting!!! Bedankt voor het super ontbijttafel !!! @ Ons huis onze thuis https://t.co/RiZIhI8lfe,https://twitter.com/Stijnv1/status/1350329254798626816,Sat Jul 18 10:59:20 +0000 2009,57908568,false,,1723,413,768,1,Nijlen,Stijn Verhaegen,Stijnv1,3577,,,false
"-5.24116444,55.89186337",Sat Jan 16 10:40:21 +0000 2021,argyllandbute argyllsecretcoast poems poemsofinstagram sea hills boat boatsboatsboats,,https://www.instagram.com/p/CKGlPtPjxNX/?igshid=1g7yv6sr92gv8,0,1350392440738471937,,,,en,"Kames, Scotland",false,,0,,,"<a href=""http://instagram.com"" rel=""nofollow"">Instagram</a>","Lockdown on the sea
no use to anyone
isolated or free? 
One thing for sure
not only he
to be anchored in twenty twentee. 

#argyllandbute #argyllsecretcoast #poems #poemsofinstagram #sea #hills #boat #boatsboatsboats https://t.co/pgEQIAoie0",https://twitter.com/Trail_Alba/status/1350392440738471937,Mon Jan 27 15:08:51 +0000 2020,1221812220834787329,false,"We are Trail Alba! our home is Scotland, Glasgow, the west and its rugged land and sea. We encourage you to visit Scotland with us #trailalba",141,66,102,0,,Trail Alba 🏴󠁧󠁢󠁳󠁣󠁴󠁿,Trail_Alba,118,,,false
"-1.4667,53.3833",Sat Jan 16 10:23:17 +0000 2021,stayalert staysafe Sheffield music stayhome ice fox,,https://www.instagram.com/p/CKGjSptDN4Q/?igshid=1fjcuw0p599pl,0,1350388144034742272,,,,en,"Sheffield, England",false,,0,,,"<a href=""http://instagram.com"" rel=""nofollow"">Instagram</a>",Snow melting after rain ☔. Snow prints of fox 🦊 #stayalert #staysafe #Sheffield #music #stayhome #ice #fox ❄️ @ Sheffield https://t.co/oHfN9MFY13,https://twitter.com/andrew_raine1/status/1350388144034742272,Sat Oct 05 22:09:08 +0000 2013,1939004953,false,,11026,877,1905,25,"Sheffield, England",Andrew Raine,andrew_raine1,43678,,https://soundcloud.com/andrew-raine-1,false
"0.6052,51.586",Sat Jan 16 08:16:36 +0000 2021,sainsburys burgers lockdown,,https://www.instagram.com/p/CKGUy2alwND/?igshid=1v7un9cndre1t,1,1350356264497373184,,,,en,"Rayleigh, East",false,,1,,,"<a href=""http://instagram.com"" rel=""nofollow"">Instagram</a>","""I'd like to thank the academy...""

#sainsburys #burgers #lockdown @ Rayleigh, Southend-On-Sea, United Kingdom https://t.co/hHzOzdfsrk",https://twitter.com/AlanMechem/status/1350356264497373184,Wed Aug 12 09:25:25 +0000 2009,64990168,false,"Chap that wrote The Man That Time Forgot, Stolen Tomorrow, Chimp Plan: Z, Retrospectacular but mostly a Smurf in 'Smurfs: The Lost Village'.",1020,846,1204,17,England,Alan Mechem,AlanMechem,4550,,http://www.alanmechem.com,false
"55.45725,-21.30799",Sat Jan 16 05:25:00 +0000 2021,,,https://www.instagram.com/p/CKGBJz1Jfl0/?igshid=1kkjzgmq8rhwd,0,1350313078001434625,,,,en,"Saint-Pierre, La Réunion",false,,0,,,"<a href=""http://instagram.com"" rel=""nofollow"">Instagram</a>","Join me every Thursday at 18h25, @mystudiodancefit for an amazing Zumba class.

With the respect of the protocol for covid-19. Take care of yourself, it still here. à My Studio Dancefit https://t.co/EmWBmKHYvb",https://twitter.com/salseromik/status/1350313078001434625,Fri Dec 28 09:24:40 +0000 2012,1041766124,false,,5,93,44,4,"Le Tampon, Ile de La Réunion",Michael Marmitte,salseromik,5359,,,false
"-95.3791764,29.6713158",Sat Jan 16 04:52:28 +0000 2021,music streams streaming STREETFAIREMGMT,,https://www.instagram.com/p/CKF9bq9ALSc/?igshid=1obgfwe7vvmus,0,1350304893769117696,,,,en,"Houston, TX",true,,0,,,"<a href=""http://instagram.com"" rel=""nofollow"">Instagram</a>","Appreciate what ever I can get during this pandemic feeling blessed #music #streams #streaming #STREETFAIREMGMT @ Southside, Houston https://t.co/sRujh1dV2Q",https://twitter.com/StreetFairekj88/status/1350304893769117696,Tue Mar 05 00:22:21 +0000 2013,1242505760,false,KANE JARRETT brand new #single  #OUTNOW #tidal #Link #below #STREETFAIREMGMT @unitedmasters @tunecore #ARTIST booking 219-902-3214 $$$$,2095,870,409,71,"Gary, IN",#STREETFAIREKANEJARRETT,StreetFairekj88,27557,,http://streetfairecbd.com,false
"-84.49048519,38.03514622",Sat Jan 16 07:22:49 +0000 2021,bbn vaccine socialresponsibility doyourpart endthispandemic,,https://www.instagram.com/p/CKGOo4aMcU1/?igshid=yqo6n4mn021n,0,1350342729566478337,,,,en,"Kentucky, USA",false,,1,,,"<a href=""http://instagram.com"" rel=""nofollow"">Instagram</a>",Thank you @ukhealthcare #bbn get your #vaccine #socialresponsibility #doyourpart #endthispandemic @ Woodland Park https://t.co/T150DNuiKr,https://twitter.com/DJ_VanLear/status/1350342729566478337,Thu Dec 18 11:09:51 +0000 2008,18213073,false,"DJ vanlear on itunes, 
UofKY BA 2004, CSUSB 2005 & 2021 ASU MBA Online
#BBN #yardi #OneSite #Analytics #Quanitative #Writing #HistoricalNonFiction #BOATS #1861",10619,758,540,34,ATL & KY,Dwight Stambaugh,DJ_VanLear,50217,,http://djvanlear.podomatic.com/,false
"29.4596195,-23.9081097",Sat Jan 16 06:06:50 +0000 2021,,,https://www.instagram.com/p/CKGF8Ycr8ru/?igshid=1c7tgn0of1i8c,0,1350323608325861377,,,,en,"Polokwane, South Africa",false,,0,,,"<a href=""http://instagram.com"" rel=""nofollow"">Instagram</a>","TagSneakers | TagClothing 
Weekend special edition Fila 
We're ready to serve you 
COVID-19 still with us take care 
All orders needs deposit 
Tagzero15 @ Tagzero15 Sneakers https://t.co/YuCaI5n9yE",https://twitter.com/tagzero15/status/1350323608325861377,Tue Jan 05 22:00:45 +0000 2016,4718727208,false,Retails,35,57,250,0,"Polokwane, South Africa",Tagzero15,tagzero15,267,,,false
"-73.86666667,40.75",Sat Jan 16 05:07:47 +0000 2021,,,https://www.instagram.com/p/CKF_Lq0JGM-/?igshid=go3mlonkb8rc,0,1350308746501771264,,,,en,"Queens, NY",false,,0,,,"<a href=""http://instagram.com"" rel=""nofollow"">Instagram</a>",COVID-19 update @ Queens County (New York) https://t.co/BDj1v5DRHf,https://twitter.com/johnnybebad666_/status/1350308746501771264,Mon Sep 09 05:59:59 +0000 2019,1170939664196354048,false,🔨support81 Harley-Davidson XL1200 CX Roadster HOG⸸⛧Satanist🦇goth goal oriented bassist?🎸metal💀extra acting s&m sex women only ct3475843316 Tri Technologies♌,9051,110,1070,1,"New York, NY",John Fitzgerald Kennedy Page®,johnnybebad666_,28982,,https://www.suicidegirls.com/join/?aid=1032495,false
"-4.629734,54.08989",Sat Jan 16 09:01:18 +0000 2021,coronavirus iom coronaupdate,,https://netc.im/Covid-19,0,1350367514367324160,,,,en,"Ballasalla, Isle of Man",false,,0,,,"<a href=""http://www.netcetera.co.uk"" rel=""nofollow"">IOM</a>","Coronavirus Daily Update: As at 15 Jan 2021, in the Isle of Man there have been 418 confirmed cases. #coronavirus #iom #coronaupdate https://t.co/WNfsczfk7J",https://twitter.com/iom/status/1350367514367324160,Mon Aug 27 14:51:27 +0000 2007,8463142,false,Local news for the Isle of Man - brought to you by Netcetera Managed Hosting,6,4428,1305,70,Isle of Man,Isle of Man,iom,36021,,https://netcetera.uk,false
"-1.53092524,52.40805627",Sat Jan 16 08:49:40 +0000 2021,balloondeliveries numberballoons coventryballoons balloonscoventry matthewlewisdisplays mattjblewis lockdown birthdayboy,,https://www.instagram.com/p/CKGYlAGg1eD/?igshid=11ldpe5r48x4c,0,1350364587363807232,,,,en,"Coventry, England",false,,0,,,"<a href=""http://instagram.com"" rel=""nofollow"">Instagram</a>",Simple and sellable. @greetingshouse #balloondeliveries #numberballoons #coventryballoons #balloonscoventry #matthewlewisdisplays #mattjblewis #lockdown #birthdayboy @ Matthew Lewis Displays https://t.co/ifLmGiGKCt,https://twitter.com/MattJBLewis/status/1350364587363807232,Mon Sep 14 17:11:08 +0000 2009,74205942,false,"Balloon printing, large scale balloon decor and amazing balloon drops. Big enough to handle it, small enough to care about it.",155,570,438,8,England,matthewlewisdisplays,MattJBLewis,2790,,http://www.matthewlewisdisplays.co.uk/,false
"-0.12485951,51.50538967",Sat Jan 16 09:52:03 +0000 2021,COVID19 AustralianOpen,,http://dlvr.it/RqhhKG,0,1350380284424830978,,,,en,"London, England",false,,1,,,"<a href=""https://dlvrit.com/"" rel=""nofollow"">dlvr.it</a>","Two #COVID19 cases found on #AustralianOpen flight, 24 players quarantined https://t.co/P4qQ0W6pt7",https://twitter.com/BritishHeraldUK/status/1350380284424830978,Wed Feb 17 17:49:42 +0000 2010,115123902,false,Where Britain Meets the World® | The Official handle of #britishherald,344,133915,588,283,"London, United Kingdom",British Herald,BritishHeraldUK,57065,,http://www.britishherald.com,false
"74.6391,26.4505",Sat Jan 16 06:31:24 +0000 2021,,,https://www.instagram.com/p/CKGIwNbApwN/?igshid=1xe90voxct1s1,2,1350329789182259200,,,,en,"अजमेर, भारत",false,,1,,,"<a href=""http://instagram.com"" rel=""nofollow"">Instagram</a>",Got Covid-19 vaccine first dose @ Ajmer https://t.co/trloGNJLUZ,https://twitter.com/physiosaraswat/status/1350329789182259200,Thu Jun 16 08:06:49 +0000 2011,318300067,false,,303,245,830,0,jaipur,Physio. Dr.Amit kumar saraswat,physiosaraswat,223,,,false
