coordinates,created_at,hashtags,media,urls,favorite_count,id,in_reply_to_screen_name,in_reply_to_status_id,in_reply_to_user_id,lang,place,possibly_sensitive,quote_id,retweet_count,retweet_id,retweet_screen_name,source,text,tweet_url,user_created_at,user_id,user_default_profile_image,user_description,user_favourites_count,user_followers_count,user_friends_count,user_listed_count,user_location,user_name,user_screen_name,user_statuses_count,user_time_zone,user_urls,user_verified
"-118.248217,34.036681",Sat Jan 16 16:19:14 +0000 2021,chasingangels conquer_la socialdistancing,,https://www.instagram.com/p/CKHMBrQhat9/?igshid=9rjtiwynsdxy,1,1350477722959679497,,,,en,"Los Angeles, CA",false,,0,,,"<a href=""http://instagram.com"" rel=""nofollow"">Instagram</a>","Social distancing is nothing new to us 
🤷🏻‍♂️ @trigram_visuals 
#chasingangels x #conquer_la #socialdistancing @ Downtown Los Angeles https://t.co/RWlqCrq3N3",https://twitter.com/corentin/status/1350477722959679497,Wed Dec 17 21:06:40 +0000 2008,18199791,false,"i take pics, talk about crypto, music, and NFTs. even my tweets have a french accent 🤷🏻‍♂️",1925,13991,1131,247,LA / NYC,corentin.sol,corentin,1098,,https://hoo.be/corentin/,true
"-81.32806152,48.47593351",Sat Jan 16 15:52:33 +0000 2021,,https://twitter.com/TimminsToday/status/1350471007186796544/photo/1,https://www.timminstoday.com/local-news/ontario-reports-more-than-3000-new-covid-cases-today-3267520?utm_source=dlvr.it&utm_medium=twitter,1,1350471007186796544,,,,en,"Timmins, Ontario",false,,0,,,"<a href=""https://dlvrit.com/"" rel=""nofollow"">dlvr.it</a>","Ontario reports more than 3,000 new COVID cases today https://t.co/JGaIAoL7ht https://t.co/Qp2Nc5bC8h",https://twitter.com/TimminsToday/status/1350471007186796544,Thu Oct 18 02:36:23 +0000 2012,887966294,false,We are an online local news source for Timmins and Northern Ontario.,19,1893,296,18,"Timmins, Ontario",TimminsToday.com,TimminsToday,33106,,http://www.timminstoday.com,false
"1.41567125,51.38903319",Sat Jan 16 17:33:30 +0000 2021,driftwoodstory massobservation diaryofamoocher friends margate socialdistancing,,https://www.instagram.com/p/CKHUhf6FSYz/?igshid=10bart7my4ru9,0,1350496411616423936,,,,en,"Margate, England",false,,0,,,"<a href=""http://instagram.com"" rel=""nofollow"">Instagram</a>","No Hugs please we’re British....!!
#driftwoodstory #massobservation #diaryofamoocher #friends #margate #socialdistancing @ Cliftonville, Kent, United Kingdom https://t.co/lXvVCuxQEj",https://twitter.com/driftwoodstory/status/1350496411616423936,Mon Nov 21 15:13:52 +0000 2011,417944488,false,Diary Of A Moocher,1708,293,139,11,"Margate, Kent",DRIFTWOODSTORY..,driftwoodstory,9454,,,false
"-2.50153743,52.63162952",Sat Jan 16 16:21:02 +0000 2021,,,https://j.mp/3svxatR,0,1350478175889891329,,,,en,"Ironbridge, England",false,,0,,,"<a href=""https://dlvrit.com/"" rel=""nofollow"">dlvr.it</a>",Coronavirus: NHS Vaccination letters for over 80s https://t.co/XOa0viMkmB,https://twitter.com/DailySHROPSHIRE/status/1350478175889891329,Sun May 06 13:29:20 +0000 2012,572628941,false,"All of the latest news, sport, and updates from the county of Shropshire (or Salop), UK",24,4574,1063,78,"Shropshire (Salop), UK",SHROPSHIRE,DailySHROPSHIRE,49947,,https://twitter.com/dailyshropshire,false
"-117.5392,33.86322",Sat Jan 16 17:35:43 +0000 2021,Corona LAtraffic,,http://bit.ly/10F395r,1,1350496969312100352,,,,en,"Corona, CA",false,,0,,,"<a href=""http://www.sigalert.com/Map.asp?region=Greater+Los+Angeles"" rel=""nofollow"">TTN LA traffic</a>","Accident, left lane blocked in #Corona on I-15 NB before Magnolia Ave, stopped traffic back to EL Cerrito Rd #LAtraffic https://t.co/e2e6MWkOvI",https://twitter.com/TotalTrafficLA/status/1350496969312100352,Wed Aug 12 21:43:18 +0000 2009,65171105,false,Providing you #LIVE #traffic updates for your #SoCal drive! Got a tip? Dial #250 and use the keyword “So Cal Traffic”,301,18767,610,687,Southern California,Total Traffic LA,TotalTrafficLA,294085,,https://www.ttwnetwork.com/,false
"0.52236557,51.27986935",Sat Jan 16 18:12:52 +0000 2021,bestfriends bestfriendsforever 25percentoff sale weekendsales brandnew unframed children friends friendship bubble covid_19 lockdown lockdown3,,https://www.instagram.com/p/CKHZCFJlgjq/?igshid=12n5soz5ttccq,0,1350506321431457792,,,,en,"Maidstone, South East",false,,0,,,"<a href=""http://instagram.com"" rel=""nofollow"">Instagram</a>","Best Friends Forever
#bestfriends #bestfriendsforever #25percentoff #sale #weekendsales #brandnew #unframed #children #friends #friendship #bubble #covid_19 #lockdown #lockdown3 @ Kent, United Kingdom https://t.co/SEi1NWxbCm",https://twitter.com/HazelMorris1/status/1350506321431457792,Mon May 16 19:33:44 +0000 2011,299845209,false,,34,8,38,0,"South East, England",Hazel Morris,HazelMorris1,171,,,false
"-0.3325,53.7443",Sat Jan 16 15:52:17 +0000 2021,,,https://www.instagram.com/p/CKHI8cZHcEe/?igshid=18po3mspr2wxa,17,1350470941734789121,,,,en,"Hull, England",false,,0,,,"<a href=""http://instagram.com"" rel=""nofollow"">Instagram</a>",@budgysmuggleruk sorting me out during Covid 🙌🏽 @ Kingston upon Hull https://t.co/FG2CpTH6VS,https://twitter.com/korbinsims/status/1350470941734789121,Sat Jul 11 12:48:21 +0000 2015,3275844204,false,Family is Everything 👶🏽 T.B.S   Instagram: korbinsims,4710,6557,148,37,"Wollongong, New South Wales",Korbin Sims,korbinsims,1491,,,true
"-97.79577473,27.5774133",Sat Jan 16 16:52:10 +0000 2021,vaccine covid19 STCN SouthTexasCommunityNews,,https://southtexascommunitynews.com/stcn/vaccination-clinic-reaches-limit,0,1350486012426940417,,,,en,"Bishop, TX",false,,0,,,"<a href=""http://www.squarespace.com"" rel=""nofollow"">Squarespace</a>","The limit was reached at 10:07 a.m. on Saturday, January 16. #vaccine #covid19 #STCN #SouthTexasCommunityNews Vaccination Clinic Reaches Limit  https://t.co/kXHgYzqu6H",https://twitter.com/CommunityTexas/status/1350486012426940417,Thu Dec 12 23:46:52 +0000 2019,1205272696688463872,false,"STCN provides news, traffic updates, weather forecasts and investigations for the Coastal Bend.",58,84,128,1,"Bishop, Texas",South Texas Community News,CommunityTexas,2262,,http://southtexascommunitynews.com,false
"30.93595505,-29.84915115",Sat Jan 16 18:03:03 +0000 2021,nicetoknowyah letsdoitagain southafrica lockdown level3 eatsleeprepeat withapinchof selflove,,https://www.instagram.com/p/CKHX6K_H7WV/?igshid=ucuoiq1wnmgu,0,1350503850499862533,,,,en,"Westville, South Africa",false,,0,,,"<a href=""http://instagram.com"" rel=""nofollow"">Instagram</a>",Just out here buying more disinfectant &amp; some basil pesto for dinner 🐙 #nicetoknowyah #letsdoitagain #southafrica #lockdown #level3 #eatsleeprepeat #withapinchof #selflove 💖 @ The Pavilion Shopping Centre https://t.co/OAL9e5VL48,https://twitter.com/angie_poo/status/1350503850499862533,Tue Nov 15 11:47:11 +0000 2011,413018670,false,You can't wait until life isn't hard anymore before you decide to be happy,138,144,73,10,South Africa - Durban,♡Angelique van Wyk♡,angie_poo,5192,,,false
"-78.2581,38.3809",Sat Jan 16 16:22:06 +0000 2021,,,https://www.instagram.com/p/CKHMWnVDXNB/?igshid=1xx4vco1bh59n,7,1350478445227044864,,,,en,"Virginia, USA",false,,0,,,"<a href=""http://instagram.com"" rel=""nofollow"">Instagram</a>","Got my vaccine yesterday and now I have this weird wireless network everywhere I go!  Appalling!  It isn't even password protected! @ Madison, Virginia https://t.co/vMREH4e6gL",https://twitter.com/Badger_Fi/status/1350478445227044864,Sun Mar 16 01:26:52 +0000 2008,14155593,false,Lead Coms Engineer - Wifi Architect - CWNE #250 - CCNA - ECSE Design - ECSE Advanced - Follower of Christ - #hamradio W4LAN - #CiscoChampion '17-'21 🏆,3477,1859,959,65,"Madison, Virginia",Mitch Dickey - 🦡📶,Badger_Fi,10780,,https://badger-fi.com,false
"21.008333,52.232222",Sat Jan 16 15:36:02 +0000 2021,,,https://www.youtube.com/watch?v=xlteiu-KevA,0,1350466852623945734,,,,en,"Warszawa, Polska",false,,0,,,"<a href=""https://tapbots.com/tweetbot/"" rel=""nofollow"">Twitter for iPhone 12 Pro Max </a>",Covid vaccination: A bittersweet moment for Indias health workers https://t.co/x5coDseCPB,https://twitter.com/pidybi/status/1350466852623945734,Sat Mar 30 17:25:49 +0000 2013,1316862031,false,🤷‍♂️,221,570,590,250,Poland 🌍👈,𝔓𝔦𝔬𝔱𝔯,pidybi,633670,,,false
"-117.225354,32.878285",Sat Jan 16 17:55:29 +0000 2021,,,https://www.instagram.com/p/CKHXCoKB2sR/?igshid=vul747x2ssr3,1,1350501943714729984,,,,en,"San Diego, CA",false,,0,,,"<a href=""http://instagram.com"" rel=""nofollow"">Instagram</a>",Happy to have gotten my first stick of the Moderna vaccine today. @ Ucsd Jacobs Medical Center https://t.co/worcC4FmyJ,https://twitter.com/SDBillEadie/status/1350501943714729984,Tue Mar 30 05:24:35 +0000 2010,127770996,false,"Bill Eadie is a staff theatre reviewer for https://t.co/POYRoqhKis and https://t.co/4xJduJU3Fl; Member, American Theatre Critics Association @Theatre_Critics",1812,377,285,7,"San Diego, CA",Bill Eadie,SDBillEadie,948,,http://www.facebook.com/pages/Bill-Eadies-San-Diego-theatre-reviews/113696131981178?ref=ts,false
"-117.86784137,33.7472759",Sat Jan 16 17:15:43 +0000 2021,oralemojo santaana tacotuesday tacos mulitas keto craftbeer hiddengems supportlocal,,https://www.instagram.com/p/CKHSfXyJIux/?igshid=131p58trqyso0,0,1350491936214437897,,,,en,"Santa Ana, CA",false,,0,,,"<a href=""http://instagram.com"" rel=""nofollow"">Instagram</a>","Catch Us Today 

Enjoy Your Weekend 🍻

@missionbarsa 

Time: 5-10PM

Wear a Mask and Drink Local 

#oralemojo #santaana #tacotuesday #tacos #mulitas #keto #craftbeer #hiddengems #supportlocal @ Mission Bar https://t.co/fyC60pLXCc",https://twitter.com/MojoOrale/status/1350491936214437897,Thu Nov 26 22:05:46 +0000 2020,1332083051703062528,false,Our Orale Mojo unique authentic Mexican-Salvadorian recipes make our food worthy. Join us and take your taste buds through our one of a kind salsa journey!,1,3,9,0,,OraleMojo,MojoOrale,272,,,false
"-5.35338121,36.1456753",Sat Jan 16 15:54:48 +0000 2021,Gibraltar Market Instalike Monochrome Empty Lockdown COVIDー19 MobilePhotography Samsung Note9,,https://www.instagram.com/p/CKHJO3mFG-U/?igshid=115ok2hs1imgf,0,1350471575439634433,,,,en,Gibraltar,false,,0,,,"<a href=""http://instagram.com"" rel=""nofollow"">Instagram</a>",Empty and closed. #Gibraltar #Market #Instalike #Monochrome #Empty #Lockdown #COVIDー19 #MobilePhotography #Samsung #Note9 @ Public Market  Gibraltar https://t.co/HnxuK7i7iU,https://twitter.com/DJDiaz88/status/1350471575439634433,Tue Dec 20 18:27:10 +0000 2011,442067779,false,"#LUFC & #RangersFC Supporter, Music Enthusiast and Photographer. Also Writer for @nodqdotcom & Social Media Coordinator for @lynxfcgib.",72872,1609,2649,41,Gibraltar,David J. Díaz,DJDiaz88,54017,,,false
"-73.99858658,40.79087064",Sat Jan 16 17:19:16 +0000 2021,mask january2021 dad wearamask,,https://www.instagram.com/p/CKHS5k_Fjqh/?igshid=nt3bc6zbml61,1,1350492831291482113,,,,en,"Guttenberg, NJ",true,,0,,,"<a href=""http://instagram.com"" rel=""nofollow"">Instagram</a>","Hey, please wear your #mask we are watching you.😂 #january2021 #dad #wearamask @ Guttenberg/North Bergen Waterfront Park https://t.co/hfDLUNIsgT",https://twitter.com/AbhiDaniel13/status/1350492831291482113,Fri Feb 12 04:58:14 +0000 2016,4900312449,false,,12186,39,16,1,"Guttenberg, NJ",Abhinav Dani アビダニ13,AbhiDaniel13,6361,,https://linktr.ee/Abhi13dani,false
"-64.77824,46.08835",Sat Jan 16 17:04:45 +0000 2021,,,https://www.instagram.com/p/CKHRPR1FVst/?igshid=iv8lbd3hupcl,0,1350489178182705154,,,,en,"Moncton, New Brunswick",false,,0,,,"<a href=""http://instagram.com"" rel=""nofollow"">Instagram</a>","Nothing like those close unrestricted family connections during COVID, not @ Moncton, New Brunswick https://t.co/buxZWZmq9i",https://twitter.com/wornesw/status/1350489178182705154,Mon Apr 27 09:50:20 +0000 2009,35709313,false,"Helping families earn more income and become properly protected, debt free and financially independent.",105,151,183,4,"Dieppe,NB, Canada",Wayne Wornes,wornesw,1248,,http://www.primerica.com/waynewornes,false
"-73.67958542,42.72940331",Sat Jan 16 18:20:30 +0000 2021,RPI LetsStaySafeRPI Rensselaer HigherEd SAChat,,https://covid19.rpi.edu/students https://www.instagram.com/p/CKHZ5uHp1Uq/?igshid=sgaih2qu2zct,0,1350508240841437195,,,,en,"Troy, NY",false,,0,,,"<a href=""http://instagram.com"" rel=""nofollow"">Instagram</a>",With #RPI Move-In 📦 just a week away visit  https://t.co/W4p5Y5207B for updated info &amp; FAQs. See you soon! #LetsStaySafeRPI 😷 #Rensselaer #HigherEd #SAChat @ Rensselaer Polytechnic Institute https://t.co/DVEVilid9x,https://twitter.com/RPIPeterK/status/1350508240841437195,Mon Dec 24 03:09:09 +0000 2018,1077038438736687104,false,"Vice President for Student Life, #Rensselaer Polytechnic Institute (@RPI) You Are Welcome Here. You Belong Here. We Support You Here. #RPI #LetsGoRed 🔴",1084,558,791,6,"RPI, Troy, NY 12180",Dr. Peter Konwerski,RPIPeterK,11007,,https://studentlife.rpi.edu,false
"1.43354416,38.9093352",Sat Jan 16 17:40:04 +0000 2021,ibiza ibiza2021 winter walks bbq lockdown,,https://www.instagram.com/p/CKHVRjDrqhd/?igshid=1n03wld41c0kc,0,1350498066256846848,,,,en,"Eivissa, España",false,,0,,,"<a href=""http://instagram.com"" rel=""nofollow"">Instagram</a>","Best lockdown day yet. Found a new pool, had a sneaky visitor and bbq’d. Banging ✌️
.
.
.
#ibiza #ibiza2021 #winter #walks #bbq #lockdown @ Ibiza https://t.co/gbNUUlOwTk",https://twitter.com/djfhurst/status/1350498066256846848,Mon Sep 14 19:41:06 +0000 2009,74242261,false,"Lucky Life Music Director, DJ & Producer bookings : info@luckylifeibiza.com",1241,390,858,16,Ibiza,Ben Fhurst,djfhurst,1592,,https://www.mixcloud.com/benfhurst/,false
"-79.2709729,43.813507",Sat Jan 16 15:46:03 +0000 2021,,https://twitter.com/LuckyArulHomes/status/1350469372435857409/photo/1,http://dlvr.it/RqjW5p,0,1350469372435857409,,,,en,"Toronto, Ontario",false,,0,,,"<a href=""https://dlvrit.com/"" rel=""nofollow"">dlvr.it</a>",MLC Pandemic Webinar Series: Pandemic City https://t.co/6Iz9htvbI8 https://t.co/XD6ZIuFbwT,https://twitter.com/LuckyArulHomes/status/1350469372435857409,Wed Nov 02 23:28:09 +0000 2011,403756676,false,"Your Home Sold GUARANTEED! Get your FREE report @arulhome.ca or call 416-518-9782
🏡Broker of Record
📍C21 Innovative LAH Team Realty",15,158,459,7,"2855 Markham Rd #203, Toronto",Arul Sivasubramaniam,LuckyArulHomes,12286,,http://arulhome.ca,false
"-113.5016,53.5415",Sat Jan 16 16:57:39 +0000 2021,workingfromhome,,https://www.instagram.com/p/CKHQbA2Mbvp/?igshid=171ngob1lpi6o,0,1350487389509189633,,,,en,"Edmonton, Alberta",false,,0,,,"<a href=""http://instagram.com"" rel=""nofollow"">Instagram</a>","My order came in the mail yesterday and it made my day lol #workingfromhome @ Edmonton, Alberta https://t.co/samaHZJc6E",https://twitter.com/thaismrsouza/status/1350487389509189633,Sun Dec 02 14:01:30 +0000 2012,984687169,false,,1683,80,84,17,Canada,Thaís,thaismrsouza,1937,,,false
"-82.46511698,27.96237625",Sat Jan 16 17:07:14 +0000 2021,,,https://www.instagram.com/p/CKHRhRqBOHC/?igshid=x58euwz4nrmg,0,1350489802072854530,,,,en,"Tampa, FL",false,,0,,,"<a href=""http://instagram.com"" rel=""nofollow"">Instagram</a>","Had a great time celebrating Brendan’s 35th at Rocco last night.  I recommend the wine flight and mozzarella cart.  Understandably, they got rid of shot glasses to reduce COVID transmission. @ Rocca Tampa https://t.co/mojQlt3dtz",https://twitter.com/BerwynLooper/status/1350489802072854530,Tue Mar 24 01:20:38 +0000 2009,26143304,false,"Futures Trader. (Bad) Influencer. Advocate for Free Markets and Free Speech. Influences: Jesse Livermore, Conor Larkin, Sebastian d'Anconia, and Edmond Dantes.",6460,1960,2393,68,Chicago,berwynlooper,BerwynLooper,23295,,http://jawbuck.com,false
"-118.23916119,34.03311058",Sat Jan 16 15:26:05 +0000 2021,strangerthingsdriveintoexperience yangchow,,https://www.instagram.com/p/CKHF8Tlp-wK6SlDE0dPgzJXX6vz-xtMiFOdlqE0/?igshid=1acqfoueq1c66,0,1350464346284040194,,,,en,"Los Angeles, CA",false,,0,,,"<a href=""http://instagram.com"" rel=""nofollow"">Instagram</a>",Pandemic experiential events 😷🚗🧇 🚲🎲🐲🥡🥢#strangerthingsdriveintoexperience #yangchow @ Stranger Things Drive Into Experience https://t.co/tDTxOXPtlI,https://twitter.com/BrendenPHill/status/1350464346284040194,Sat Dec 12 05:40:24 +0000 2009,96284479,false,"A born Hoosier out west making movies, saving cats, trying to save the ocean, and watching more sports than should be humanly possible.",5020,583,1771,7,"Los Angeles by way of Indy, IN",Brenden Patrick Hill,BrendenPHill,3961,,https://itunes.apple.com/us/movie/walter/id965024064,false
"-81.32806152,48.47593351",Sat Jan 16 15:46:03 +0000 2021,,https://twitter.com/TimminsToday/status/1350469370489626629/photo/1,https://www.timminstoday.com/coronavirus-covid-19-local-news/ontario-reports-more-than-3000-new-covid-cases-today-3267520?utm_source=dlvr.it&utm_medium=twitter,1,1350469370489626629,,,,en,"Timmins, Ontario",false,,1,,,"<a href=""https://dlvrit.com/"" rel=""nofollow"">dlvr.it</a>","Ontario reports more than 3,000 new COVID cases today https://t.co/bBDA3iETy4 https://t.co/VUWECKyyh5",https://twitter.com/TimminsToday/status/1350469370489626629,Thu Oct 18 02:36:23 +0000 2012,887966294,false,We are an online local news source for Timmins and Northern Ontario.,19,1893,296,18,"Timmins, Ontario",TimminsToday.com,TimminsToday,33106,,http://www.timminstoday.com,false
"-80.8627,35.4072",Sat Jan 16 18:21:09 +0000 2021,,,https://www.instagram.com/p/CKHZ-t7JHY8/?igshid=9qxapqiousur,0,1350508406390591491,,,,en,"Huntersville, NC",false,,0,,,"<a href=""http://instagram.com"" rel=""nofollow"">Instagram</a>","This pandemic has me feeling like... @ Huntersville, North Carolina https://t.co/0sTeAMKEaq",https://twitter.com/NomiBurton/status/1350508406390591491,Mon Feb 21 21:04:14 +0000 2011,255677245,false,"I'm a burrito enthusiast & content creator. A girl that does radio, VOs, TV, marketing & social media. A host on the Does Anybody Care podcast.",5008,1230,776,45,"Charlotte, NC",Nomi Burton,NomiBurton,21223,,http://nowyounomi.com,false
"-79.7164011,43.7742911",Sat Jan 16 18:05:01 +0000 2021,Covid19 Health India NEWS,,http://dlvr.it/Rqjq4T,0,1350504345763160065,,,,en,"Brampton, Ontario",false,,1,,,"<a href=""https://dlvrit.com/"" rel=""nofollow"">dlvr.it</a>","Covaxin efficacy meets WHO standards, safe to use: Joint Drugs Controller: Allaying the apprehensions associated with the safety of the vaccine developed by Bharat Biotech, S. Eswara Reddy, Joint Drugs Controller, Central… https://t.co/R54ChJW48o #Covid19 #Health #India #NEWS",https://twitter.com/Weeklyvoice/status/1350504345763160065,Tue Mar 30 17:43:21 +0000 2010,127943720,false,Most Trusted News in North America’s South Asian Communities Since 1997,172,498,299,11,Toronto,Weekly Voice,Weeklyvoice,37048,,http://www.Weeklyvoice.com,false
"-83.5,33",Sat Jan 16 17:30:15 +0000 2021,linkinbio,,https://www.instagram.com/p/CKHTqUJg8YB/?igshid=l3xfbid581gt,0,1350495596516429824,,,,en,"Georgia, USA",false,,0,,,"<a href=""http://instagram.com"" rel=""nofollow"">Instagram</a>","Had to Blame It On COVID 😷 Why im ducking shawty‼️‼️

“COVID FLOW” OUT NOW ON YOUTUBE 

#linkinbio @ Georgia https://t.co/uqZKJhUBfo",https://twitter.com/tayepac/status/1350495596516429824,Mon Apr 13 00:06:54 +0000 2009,30755709,false,“IMMA LIVE FOREVER!” 📚 MGMT: @ayoosnoop_,16639,1382,467,6,UNDRRTD ,U STILL KNOW THEM I DONT,tayepac,67693,,https://linktr.ee/tayepac,false
"-97.61843072,35.50420537",Sat Jan 16 16:25:50 +0000 2021,,,https://www.instagram.com/p/CKHMx5cBrxX/?igshid=15m07jfcx07da,0,1350479382788366339,,,,en,"Oklahoma City, OK",true,,0,,,"<a href=""http://instagram.com"" rel=""nofollow"">Instagram</a>",My new view master tattoo portfolio. Please wipe down with alcohol and wear a mask for the ultimate viewing experience @ Tornado Tattoo https://t.co/R4Uxpo2a1G,https://twitter.com/tornadotattoo/status/1350479382788366339,Tue Mar 10 19:42:37 +0000 2009,23640548,false,"With over 30 years of combined experience, our award winning artists have created many unique and commemorative tattoos for individuals from all walks of life",214,564,202,15,405-601-4445,Tornado Tattoo,tornadotattoo,3485,,http://www.tornadotattoo.com,false
"-77.0485755,44.1950409",Sat Jan 16 17:00:41 +0000 2021,,,https://www.deseronto.ca/blog/2021/1/16/rto-9-covid-19-tourism-adaptation-fund,0,1350488152901890049,,,,en,"Deseronto, Ontario",false,,0,,,"<a href=""http://www.squarespace.com"" rel=""nofollow"">Squarespace</a>",RTO 9 - COVID-19 Tourism Adaptation Fund  https://t.co/PpMtK1oDrV,https://twitter.com/Deseronto1/status/1350488152901890049,Thu May 03 06:17:27 +0000 2012,569734741,false,Town of Deseronto information and events. Visit Deseronto's website at https://t.co/fw3dd3OdAR.,72,394,158,20,"Deseronto, Ontario, Canada",deseronto@deseronto.ca,Deseronto1,916,,http://www.deseronto.ca,false
"-2.54043113,51.32903643",Sat Jan 16 17:05:05 +0000 2021,lockdown2021,,https://www.instagram.com/p/CKHRRYGjVVNScZ4VZreg1gLK_ustbgK8iOEdnA0/?igshid=9jhrf3bn8ik8,0,1350489260860825603,,,,en,"Clutton, England",false,,0,,,"<a href=""http://instagram.com"" rel=""nofollow"">Instagram</a>","Lockdown life ! Stuck in with more wine lol🙈😩🍷🐈‍⬛ #lockdown2021 @ Clutton, Bath And North East Somerset, United Kingdom https://t.co/YcmpPZK5ww",https://twitter.com/KellyMarieHicks/status/1350489260860825603,Sat May 07 13:08:11 +0000 2011,294607780,false,,106,203,561,3,Bath,Kelly Marie Kitchen Interiors,KellyMarieHicks,4382,,http://kellymariekitchens.com,false
"0.45232581,51.55853515",Sat Jan 16 18:10:33 +0000 2021,,,https://www.instagram.com/p/CKHYlhjghlRwU7C0mCCqvaxTgYLMbrj_wdKS2c0/?igshid=1u4pb1mi7lb2z,0,1350505734811824128,,,,en,"Basildon, East",false,,0,,,"<a href=""http://instagram.com"" rel=""nofollow"">Instagram</a>",Most awaited # Covid19 # Vaccine # Finally Vaccinated 😃 @ Basildon Hospital https://t.co/51cq78zOVn,https://twitter.com/ranjan0000006/status/1350505734811824128,Thu Sep 18 19:29:55 +0000 2014,2817696884,false,Physiotherapist,626,98,635,0,"London, England",Santosh Ranjan,ranjan0000006,77,,,false
"-1.93048239,53.60276332",Sat Jan 16 15:56:33 +0000 2021,,https://twitter.com/GBTrainJourneys/status/1350472013194829835/photo/1,https://j.mp/3oSm8wq,0,1350472013194829835,,,,en,"Marsden, England",false,,0,,,"<a href=""https://dlvrit.com/"" rel=""nofollow"">dlvr.it</a>",Laurence Fox shows off Covid face mask 'exemption badge' he bought from Amazon - Daily Mail https://t.co/l7z8oEI88V https://t.co/IBbkBAw0K0,https://twitter.com/GBTrainJourneys/status/1350472013194829835,Fri Sep 26 12:19:28 +0000 2014,2785332587,false,Grab a copy of Bradshaw's and jump aboard alongside many other followers of Michael Portillo's travels around Britain (this is run by trainspotters not the BBC),25,1972,488,15,Great Britain,GB Railway Journeys,GBTrainJourneys,9163,,,false
"-75.55259177,39.75945138",Sat Jan 16 16:24:26 +0000 2021,,,https://www.instagram.com/p/CKHMnzIFMKYoqTrfGT0ELruvHupoeuzIKnYhpU0/?igshid=1855620rc9cno,2,1350479030311534599,,,,en,"Delaware, USA",false,,0,,,"<a href=""http://instagram.com"" rel=""nofollow"">Instagram</a>","January 16, 2021 for those losing track of time. A lot warmer on my walk today. Be safe, stay healthy, wear a mask. @ Brandywine Park https://t.co/gCiqREtzfB",https://twitter.com/yankees1958/status/1350479030311534599,Sat Jan 26 10:33:05 +0000 2008,12714752,false,🙏🏼 for 🇺🇦 🚫 NFTS. 🚫Magats 🚫 🚫 BOTS 🚫CRYPTO 🚫 LISTS 🚫 DMs. Women’s Rights. I do Vet and 86 problems. Ukrainian Descent. 🇺🇦 Cats. Recipes to share!,605254,15879,16266,17,Delaware,Lenny ✨ the Chef ☮️,yankees1958,122263,,,false
"-1.4434845,53.2346985",Sat Jan 16 15:46:48 +0000 2021,,,https://www.instagram.com/p/CKHIUIMs9-i/?igshid=ze2v8cidncb8,1,1350469560537935873,,,,en,"Chesterfield, England",false,,0,,,"<a href=""http://instagram.com"" rel=""nofollow"">Instagram</a>","Order the best Italian style pizzas and pastas until 8pm tonight!!!
Don’t miss our lockdown offer buy one get one half price (pizzas only) collection or delivery via citygrab
📞01246380035📞 @ Nonnas Chesterfield Ltd https://t.co/x8krEHSUKN",https://twitter.com/NonnasChesfield/status/1350469560537935873,Wed Aug 03 12:33:16 +0000 2011,347825849,false,"Founded 2009, Nonnas Chesterfield We love Italian food, wines, cocktails & we serve a mean cappuccino too! https://t.co/xfgZlhEXJk",490,1949,1130,37,"Chatsworth Road, Chesterfield",Nonnas Chesterfield,NonnasChesfield,1796,,http://www.nonnas.co.uk/chesterfield.php,false
"80.20863241,13.02944974",Sat Jan 16 15:59:08 +0000 2021,,,https://www.instagram.com/p/CKHJucUjnMmMYWre4teuQY5gVFJvn4JsfI1tf40/?igshid=12xialc9zl7t9,1,1350472666197749765,,,,en,"चेन्नई, भारत",false,,0,,,"<a href=""http://instagram.com"" rel=""nofollow"">Instagram</a>",Meet up after long quarantine break with them.. ONLY FOR THALAPATHY MASTER 🔥🔥🔥❤️🔥 @ Kasi  Theatre https://t.co/E9X1NUKiJX,https://twitter.com/Richyaju/status/1350472666197749765,Sun Mar 13 15:03:31 +0000 2011,265440265,false,"My Passion/Profession:  A Film Maker and An actor..

❤️❤️ *My God Is An Awesome God* ❤️❤️",2864,68,530,1,"Chennai, India",John Richard,Richyaju,224,,,false
