coordinates,created_at,hashtags,media,urls,favorite_count,id,in_reply_to_screen_name,in_reply_to_status_id,in_reply_to_user_id,lang,place,possibly_sensitive,quote_id,retweet_count,retweet_id,retweet_screen_name,source,text,tweet_url,user_created_at,user_id,user_default_profile_image,user_description,user_favourites_count,user_followers_count,user_friends_count,user_listed_count,user_location,user_name,user_screen_name,user_statuses_count,user_time_zone,user_urls,user_verified
"-1.93048239,53.60276332",Tue Jan 19 07:05:33 +0000 2021,,https://twitter.com/GBTrainJourneys/status/1351425545767055361/photo/1,https://j.mp/35U81iH,0,1351425545767055361,,,,en,"Marsden, England",false,,0,,,"<a href=""https://dlvrit.com/"" rel=""nofollow"">dlvr.it</a>","More than 45,000 people in Florida are overdue for their second coronavirus vaccine dose - Daily Mail https://t.co/F3XPqR8h8u https://t.co/SrclHTIasI",https://twitter.com/GBTrainJourneys/status/1351425545767055361,Fri Sep 26 12:19:28 +0000 2014,2785332587,false,Grab a copy of Bradshaw's and jump aboard alongside many other followers of Michael Portillo's travels around Britain (this is run by trainspotters not the BBC),25,1972,488,15,Great Britain,GB Railway Journeys,GBTrainJourneys,9163,,,false
"-0.29002,51.6188",Tue Jan 19 07:15:47 +0000 2021,Lockdown Edgware UnitedKingdom zerowaste free,,https://olioex.com/food-waste-in/-/-/4218537#,0,1351428124580442113,,,,en,"Harrow, London",false,,0,,,"<a href=""https://olioex.com"" rel=""nofollow"">OLIO Articles Plugin</a>","""BT Concero Extra cordless Hand set. #Lockdown..."" in #Edgware #UnitedKingdom https://t.co/u7j6LbfwSB #zerowaste #free",https://twitter.com/WhatsOnOLIO/status/1351428124580442113,Thu Jan 26 15:18:56 +0000 2017,824637752574488576,false,"OLIO's Little Helper here letting you know about all the items being shared on the @OLIO_ex app. 🥕

Download the free app today and start sharing! :)",488,1117,1628,5,,Seen on OLIO,WhatsOnOLIO,1206009,,http://olioex.com,false
"-80.1939,25.7739",Tue Jan 19 10:03:04 +0000 2021,Google Miami Covid19 Miami,https://twitter.com/trendsmetadata/status/1351470219777232897/photo/1,http://www.google.com/m/search?&q=Pistons+vs+Heat https://twitter.com/search/?q=Pistons+vs+Heat,0,1351470219777232897,,,,en,"Miami, FL",false,,0,,,"<a href=""https://trendsmetadata.com"" rel=""nofollow"">trendsmetadata</a>","20K+ #Google searches 4 Pistons vs Heat 2h old https://t.co/DyVTfmp1ii https://t.co/9syFZpjann 
#Miami 🌅 7:08 🌆 17:54 EST
#Covid19
#Miami-DadeCounty 01/16/2021
New CS 2408 14DCSΔ +11.8%
New D 33 14DDΔ +7.3% https://t.co/IPx1zQmja9",https://twitter.com/trendsmetadata/status/1351470219777232897,Sun May 01 03:42:17 +0000 2011,290889806,false,Media Metadata Viewpoint Convergence.,27,3370,3073,365,,data about data,trendsmetadata,248515,,http://trendsmetadata.com,false
"-2.82406553,51.58043122",Tue Jan 19 10:32:51 +0000 2021,homeschooling,,https://www.instagram.com/p/CKOSxTmBQ_B/?igshid=8s983wzen3mj,1,1351477715392733185,,,,en,"Magor, Wales",false,,0,,,"<a href=""http://instagram.com"" rel=""nofollow"">Instagram</a>","Kitchen assistant today, food all weighed and chopped ready for my sons food  preparation and nutrition practical #homeschooling @ Magor with Undy, Monmouthshire https://t.co/9wwkokcMZz",https://twitter.com/susanmwales/status/1351477715392733185,Sat Jan 03 19:13:47 +0000 2015,2957579070,false,Naturopathic Nutrition advisor #Naturopathic #Nutritional #Therapy #Nutritionist #Holistic,1203,199,503,6,South Wales,Healing foods,susanmwales,1142,,https://susanmonk.org,false
"-1.8484485,54.86048",Tue Jan 19 08:07:08 +0000 2021,noexcuses onlinecoaching stayconnected,,https://www.instagram.com/p/CKOCGGRH7_r/?igshid=1agncsfz1z91,0,1351441046094413825,,,,en,"Consett, England",false,,0,,,"<a href=""http://instagram.com"" rel=""nofollow"">Instagram</a>","Working from home isn’t all bad - assisted by @bowie_thestaffy during this morning’s Zoom PT sessions 😂

#noexcuses #onlinecoaching #stayconnected @ Fit2The Core Training Systems https://t.co/Xsbek6z8b0",https://twitter.com/Fit2TheCoreUK/status/1351441046094413825,Fri Aug 11 07:33:49 +0000 2017,895911113879150593,false,Sports Therapist and owner @ Fit2The Core Training Systems Ltd - Sports Massage Therapist - Heart Surgery Survivor,4145,118,279,0,"Consett, UK",Darren Cutler,Fit2TheCoreUK,1305,,https://www.fit2thecore.uk,false
"-73.56725453,45.75975883",Tue Jan 19 05:37:32 +0000 2021,,,http://dlvr.it/RqsTXx,0,1351403398722011136,,,,en,"Mascouche, Québec",false,,0,,,"<a href=""https://dlvrit.com/"" rel=""nofollow"">dlvr.it</a>",Fighting Stigma: Covid-19 advice sent by text to 1511 arrivals from Brazil amid new strain: Ms Aquino agrees that migrant communities can become confused by mixed health messaging around Covid-19 coming from Ireland and their country ... https://t.co/VYo3TWHQS4,https://twitter.com/StigmabaseN/status/1351403398722011136,Wed Sep 15 15:55:47 +0000 2010,191092262,false,Ireland — Scotland — Inuit —  Svenska  | Keeping up-to-date on global exclusion — Stigmabase is a canadian internet non-profit Initiative,0,1611,1297,110,Ireland | Scotland | Inuit | Skandinavien,Stigmabase | NORDIC,StigmabaseN,951806,,https://www.stigmabase.org/,false
"-118.2445,34.0564",Tue Jan 19 10:12:34 +0000 2021,razInLA AboveTheDrain Reflections sink,,https://www.instagram.com/p/CKOQcyIplMh/?igshid=1lgeo2m8r1ifz,0,1351472614015987714,,,,en,"Los Angeles, CA",false,,0,,,"<a href=""http://instagram.com"" rel=""nofollow"">Instagram</a>","We're at this point in the pandemic. #razInLA #AboveTheDrain #Reflections #sink @ Los Angeles, California https://t.co/7YHzkKVbkl",https://twitter.com/drazowsky/status/1351472614015987714,Mon Dec 22 22:23:16 +0000 2008,18319079,false,I #teach #improvise #direct host @ADDComedyPod https://t.co/MSLhEQ83lp ex @SecondCity Artistic Director. I did a @TEDx Talk https://t.co/rQ9yl38308,33016,3697,2995,109,"los angeles, ca",David Razowsky,drazowsky,34446,,http://www.davidrazowsky.com,false
"-73.56725453,45.75975883",Tue Jan 19 06:36:03 +0000 2021,,,http://dlvr.it/RqscB5,0,1351418122616541184,,,,en,"Mascouche, Québec",false,,0,,,"<a href=""https://dlvrit.com/"" rel=""nofollow"">dlvr.it</a>","Fighting Stigma: 'Schools don't need extra infection control measures' despite Covid-19 variants: This included Dr Abigail Collins, a public health consultant and the HSE Covid-19 lead on schools, and Dr Kevin Kelleher, the HSE assistant national ... https://t.co/9XlhxTGjBf",https://twitter.com/StigmabaseN/status/1351418122616541184,Wed Sep 15 15:55:47 +0000 2010,191092262,false,Ireland — Scotland — Inuit —  Svenska  | Keeping up-to-date on global exclusion — Stigmabase is a canadian internet non-profit Initiative,0,1611,1297,110,Ireland | Scotland | Inuit | Skandinavien,Stigmabase | NORDIC,StigmabaseN,951806,,https://www.stigmabase.org/,false
"-122.285939,37.823158",Tue Jan 19 04:30:13 +0000 2021,mtaylor769 curlyhairstyles covidhairdontcare,,https://www.instagram.com/p/CKNpRTnBqpg/?igshid=jrlfg5hf3dvq,0,1351386457118801920,,,,en,"Oakland, CA",false,,0,,,"<a href=""http://instagram.com"" rel=""nofollow"">Instagram</a>","Got the mullet tamed by @michelevoncolorbox this afternoon. Covid guidelines were followed, and I’m gorgeous again ✨💇🏻‍♂️ #mtaylor769 #curlyhairstyles #covidhairdontcare @ Clawson https://t.co/BdkgRuTjbJ",https://twitter.com/mtaylor769/status/1351386457118801920,Mon Jan 05 10:50:21 +0000 2009,18629180,false,"Gen-X'er, Drummer, Programmer, Tinkerer, Sports Fanatic",842,170,460,5,"Oakland, CA",Mike Taylor,mtaylor769,2778,,http://www.linkedin.com/in/mtaylor769,false
"-73.56725453,45.75975883",Tue Jan 19 07:35:03 +0000 2021,,,http://dlvr.it/Rqslgn,0,1351432972210110464,,,,en,"Mascouche, Québec",false,,0,,,"<a href=""https://dlvrit.com/"" rel=""nofollow"">dlvr.it</a>","Fighting Stigma: Ireland has greater access to vaccines through EU, Donohoe says: ... to secure the quantities of vaccines that is important for the health of Ireland if our efforts are represented by the European Commission,” he said. https://t.co/XotrMLeqBo",https://twitter.com/StigmabaseN/status/1351432972210110464,Wed Sep 15 15:55:47 +0000 2010,191092262,false,Ireland — Scotland — Inuit —  Svenska  | Keeping up-to-date on global exclusion — Stigmabase is a canadian internet non-profit Initiative,0,1611,1297,110,Ireland | Scotland | Inuit | Skandinavien,Stigmabase | NORDIC,StigmabaseN,951806,,https://www.stigmabase.org/,false
"-90.10973,29.90276",Tue Jan 19 05:30:37 +0000 2021,,,https://www.instagram.com/p/CKNwLxVFLsg/?igshid=czda9zbrvyq4,2,1351401656810950656,,,,en,"Marrero, LA",false,,0,,,"<a href=""http://instagram.com"" rel=""nofollow"">Instagram</a>","Today, I received my first dose of the Pfizer COVID-19 Vaccine. We’ve lost too much to this virus to not do all we can to protect ourselves and our communities. @ Marrero, Louisiana https://t.co/0n1pDP0X8x",https://twitter.com/RepKyleGreen/status/1351401656810950656,Fri Feb 27 01:51:09 +0000 2009,22093382,false,Official Twitter account of Louisiana state Representative Kyle Green. Proudly serving the 83rd District in the @louisianahouse of Representatives.,19,967,353,20,"Marrero, LA",Rep. Kyle Green,RepKyleGreen,192,,https://house.louisiana.gov/H_Reps/members?ID=83,false
"-123.08135748,49.22408604",Tue Jan 19 04:31:37 +0000 2021,MarineDebrisTeam MarineDebris MarineConservation ProtectWhatYouLove SSCS SeaShepherdYVR,,https://www.instagram.com/p/CKNpbiSDUbu/?igshid=13ud69h7loed2,0,1351386807896825858,,,,en,"Vancouver, British Columbia",false,,0,,,"<a href=""http://instagram.com"" rel=""nofollow"">Instagram</a>","Our volunteers took advantage of the break in the weather to do a Covid safe beach clean! 

#MarineDebrisTeam #MarineDebris #MarineConservation #ProtectWhatYouLove #SSCS #SeaShepherdYVR @ English Bay Beach https://t.co/vtxIr3sF4N",https://twitter.com/SeaShepherdYVR/status/1351386807896825858,Mon Jan 18 17:41:46 +0000 2016,4824685413,false,"Official Twitter page of Sea Shepherd Vancouver UCST. Conservation in action. 
Defend. Conserve. Protect.
https://t.co/4Z0jNkmRd9",1411,310,419,6,"Vancouver, British Columbia",Sea Shepherd Vancouver UCST,SeaShepherdYVR,1531,,https://www.seashepherd.org/get-involved,false
"-81.4129,28.304",Tue Jan 19 05:06:09 +0000 2021,tourism tourists kissimmee oldtownkissimmee,,https://www.instagram.com/p/CKNtYheBt5f/?igshid=1uxi7xvy22rs6,0,1351395500470259712,,,,en,"Kissimmee, FL",false,,0,,,"<a href=""http://instagram.com"" rel=""nofollow"">Instagram</a>","Ah... the glittering lights of Old Town!

Lighthouse for Tourists and Covid?

#tourism #tourists #kissimmee #oldtownkissimmee @ Kissimmee, Florida https://t.co/5c1o914WDw",https://twitter.com/JBeaverton/status/1351395500470259712,Wed Jun 13 19:24:22 +0000 2012,607560981,false,"Freelancer (he/him) interested in #CraftBeer #StarTrek #RetroGaming #Lego #StarWars

Let's all just have fun... (please)

https://t.co/PcGBIMxpfl",39193,876,2338,71,"Orlando, FL",Jay Beaverton,JBeaverton,21097,,https://www.youtube.com/c/JamesBeaver,false
"-4.629734,54.08989",Tue Jan 19 09:02:21 +0000 2021,coronavirus iom coronaupdate,,https://netc.im/Covid-19,0,1351454940615618560,,,,en,"Ballasalla, Isle of Man",false,,0,,,"<a href=""http://www.netcetera.co.uk"" rel=""nofollow"">IOM</a>","Coronavirus Daily Update: As at 18 Jan 2021, in the Isle of Man there have been 432 confirmed cases. #coronavirus #iom #coronaupdate https://t.co/WNfsczfk7J",https://twitter.com/iom/status/1351454940615618560,Mon Aug 27 14:51:27 +0000 2007,8463142,false,Local news for the Isle of Man - brought to you by Netcetera Managed Hosting,6,4428,1305,70,Isle of Man,Isle of Man,iom,36021,,https://netcetera.uk,false
"-3.05651665,53.78666997",Tue Jan 19 09:24:34 +0000 2021,,,https://www.instagram.com/p/CKOK9HegPg9/?igshid=als9zceh9jam,0,1351460530293129216,,,,en,"South Shore, England",false,,0,,,"<a href=""http://instagram.com"" rel=""nofollow"">Instagram</a>",Just posted a photo @ Corona  Blackpool https://t.co/cWwA7ohnkg,https://twitter.com/coronablackpool/status/1351460530293129216,Sat May 29 11:09:49 +0000 2010,149472072,false,"Our official twitter page
Pleasure Beach Blackpool. 
Deals coming up. 
Best rates: 01253 342586 Or
https://t.co/UeBRN5kL0S",3180,840,987,10,Blackpool South Beach ,Coronablackpool,coronablackpool,3762,,http://www.coronahotelblackpool.co.uk,false
"55.2741,25.1994",Tue Jan 19 04:48:13 +0000 2021,besafe vaccine dubailife nmc DHA covid19 UAE vaccinated,,https://www.instagram.com/p/CKNrVCVDDQS/?igshid=jurhlvhh0zq8,0,1351390986916818944,,,,en,"دبي, الامارات العربية المتحدة",true,,0,,,"<a href=""http://instagram.com"" rel=""nofollow"">Instagram</a>","It's time to fight back, Walk the talk and play safe.. #besafe #vaccine #dubailife #nmc #DHA #covid19 #UAE #vaccinated @ Dubai, United Arab Emirates https://t.co/zTcF3TuiMX",https://twitter.com/anoopanil/status/1351390986916818944,Fri Jul 10 13:26:29 +0000 2009,55559975,false,"Seller with a soul.. 
Socialist, Humanist & Liberal 4 sure! 
Loves Food, Technology and Common Man..",183,178,803,2,"Dubai, United Arab Emirates",Anoop Anil Devan,anoopanil,376,,http://imageofthesoul.blogspot.com,false
"-1.969,52.476",Tue Jan 19 09:24:03 +0000 2021,lockdown watercolourartist watercolour warleywoods,,https://www.instagram.com/p/CKOK5b5jYkS/?igshid=122ayqcr4hm7s,0,1351460404346707969,,,,en,"West Bromwich, England",false,,0,,,"<a href=""http://instagram.com"" rel=""nofollow"">Instagram</a>","‘Yellow Woods’ Lockdown 3.0 please project Day 13 18th Jan #lockdown #watercolourartist #watercolour #warleywoods @ Bearwood, West Midlands https://t.co/Jevj2U4mic",https://twitter.com/johnpnewman1/status/1351460404346707969,Sun Jan 01 12:04:18 +0000 2012,452093129,false,"Experienced Architect and Landscape Designer, Visiting Tutor at BCU, Watercolour Artist and Gardener.  Keen on sustainable solutions to design challenges.",931,136,288,4,"Bearwood, West Midlands, UK",Red Bear Landscape Ltd,johnpnewman1,674,,http://redbearlandscape.com,false
"-118.2445,34.0564",Tue Jan 19 10:15:41 +0000 2021,razInLA AboveTheDrain Reflections sink,,https://www.instagram.com/p/CKOQznzpbes/?igshid=efs7lxiu4h8h,1,1351473397746683904,,,,en,"Los Angeles, CA",false,,0,,,"<a href=""http://instagram.com"" rel=""nofollow"">Instagram</a>","We're at this point in the pandemic. #razInLA #AboveTheDrain #Reflections #sink @ Los Angeles, California https://t.co/AUt9tmbF9F",https://twitter.com/drazowsky/status/1351473397746683904,Mon Dec 22 22:23:16 +0000 2008,18319079,false,I #teach #improvise #direct host @ADDComedyPod https://t.co/MSLhEQ83lp ex @SecondCity Artistic Director. I did a @TEDx Talk https://t.co/rQ9yl38308,33016,3697,2995,109,"los angeles, ca",David Razowsky,drazowsky,34446,,http://www.davidrazowsky.com,false
"-0.12485951,51.50538967",Tue Jan 19 08:00:02 +0000 2021,,,http://dlvr.it/Rqsph3,0,1351439259543093248,,,,en,"London, England",false,,1,,,"<a href=""https://dlvrit.com/"" rel=""nofollow"">dlvr.it</a>",Britain to review lockdown curbs in mid-February: Lewis https://t.co/iXVYxkqm43,https://twitter.com/BritishHeraldUK/status/1351439259543093248,Wed Feb 17 17:49:42 +0000 2010,115123902,false,Where Britain Meets the World® | The Official handle of #britishherald,344,133915,588,283,"London, United Kingdom",British Herald,BritishHeraldUK,57065,,http://www.britishherald.com,false
"-87.66177893,41.95452749",Tue Jan 19 04:28:17 +0000 2021,,,https://www.instagram.com/p/CKNpDECFyqp/?igshid=1dcguusymolsj,0,1351385968683708417,,,,en,"Chicago, IL",false,,0,,,"<a href=""http://instagram.com"" rel=""nofollow"">Instagram</a>",Winter pandemic running is such fun 😆. At least the cemetery isn’t crowded. And none of the residents has complained yet! @ Graceland Cemetery &amp; Arboretum https://t.co/0s5wpNWHSX,https://twitter.com/Tambreet/status/1351385968683708417,Tue Mar 20 19:36:04 +0000 2007,1663241,false,,6528,281,685,19,,Jordan McClure,Tambreet,15732,,,false
"21.008333,52.232222",Tue Jan 19 05:33:06 +0000 2021,,,https://www.rt.com/news/512903-who-panel-covid-pandemic-handling/,0,1351402281783144453,,,,en,"Warszawa, Polska",false,,0,,,"<a href=""https://tapbots.com/tweetbot/"" rel=""nofollow"">Twitter for iPhone 12 Pro Max </a>",Global pandemic alert system not fit for purpose: WHO report critical... https://t.co/ZgzmqteVNE,https://twitter.com/pidybi/status/1351402281783144453,Sat Mar 30 17:25:49 +0000 2013,1316862031,false,🤷‍♂️,221,570,590,250,Poland 🌍👈,𝔓𝔦𝔬𝔱𝔯,pidybi,633670,,,false
"79.16561365,12.93793807",Tue Jan 19 10:31:40 +0000 2021,robotics arduino edtech covid_19 technology diy thinkinlab electronics,,https://www.instagram.com/p/CKOSoHgDHPo/?igshid=1vu5nafc7uo8w,0,1351477416741376000,,,,en,"वेल्लुर, भारत",false,,0,,,"<a href=""http://instagram.com"" rel=""nofollow"">Instagram</a>","Hands on Electronics training

#robotics #arduino #edtech #covid_19 #technology #diy #thinkinlab #electronics @ Thinkin Lab https://t.co/ebiEAFgIWQ",https://twitter.com/LabThinkin/status/1351477416741376000,Thu Jun 11 15:53:57 +0000 2020,1271108361421905926,false,"Edutech Company. 
Robotics. 
Internet of Things.
PCB Designing.
Hands on Science & Math. 
Electronics.

Empanelled with EDII-TN for ATL awareness webinar",39,13,17,0,"Vellore, India",Thinkin_Lab,LabThinkin,35,,http://www.thinkinlab.com,false
"-0.12485951,51.50538967",Tue Jan 19 08:37:02 +0000 2021,Biden Trump,,http://dlvr.it/RqswDP,0,1351448570671452163,,,,en,"London, England",false,,1,,,"<a href=""https://dlvrit.com/"" rel=""nofollow"">dlvr.it</a>",#Biden to prevent #Trump’s plan to remove COVID-19 European travel restrictions https://t.co/qApPVLsNvM,https://twitter.com/BritishHeraldUK/status/1351448570671452163,Wed Feb 17 17:49:42 +0000 2010,115123902,false,Where Britain Meets the World® | The Official handle of #britishherald,344,133915,588,283,"London, United Kingdom",British Herald,BritishHeraldUK,57065,,http://www.britishherald.com,false
"-0.12485951,51.50538967",Tue Jan 19 06:14:02 +0000 2021,,,http://dlvr.it/RqsYT7,0,1351412583480217605,,,,en,"London, England",false,,1,,,"<a href=""https://dlvrit.com/"" rel=""nofollow"">dlvr.it</a>",For seventh straight day China records over 100 new coronavirus cases https://t.co/LJfOJy2TNl,https://twitter.com/BritishHeraldUK/status/1351412583480217605,Wed Feb 17 17:49:42 +0000 2010,115123902,false,Where Britain Meets the World® | The Official handle of #britishherald,344,133915,588,283,"London, United Kingdom",British Herald,BritishHeraldUK,57065,,http://www.britishherald.com,false
"0.12147,51.44931",Tue Jan 19 09:49:45 +0000 2021,lockdown,,https://www.instagram.com/p/CKON1uqhfOB/?igshid=1oj5o9cxbvfw1,1,1351466871665684480,,,,en,"Bexley, London",false,,0,,,"<a href=""http://instagram.com"" rel=""nofollow"">Instagram</a>",Sunday walks w/ @laurenxalexandria 🐕 🥶 #lockdown @ Danson Park https://t.co/pGhe9K8rw0,https://twitter.com/craigbrown93/status/1351466871665684480,Tue Jan 18 11:50:31 +0000 2011,239773717,false,| chαrltσn αthlєtíc fαn | ín σrdєr tσ вє írrєplαcєвlє σnє must вє díffєrєnt | Lauren♥️|,362,102,400,3,,♬ ¢яαιg вяσωη ♬,craigbrown93,5090,,,false
"-0.13608912,51.50413561",Tue Jan 19 09:50:32 +0000 2021,,,http://dlvr.it/Rqt7jX,0,1351467066004393985,,,,en,"London, England",false,,1,,,"<a href=""https://dlvrit.com/"" rel=""nofollow"">dlvr.it</a>","Peter Rhodes on the grey pound, revisiting the 1950s and the two nations created by Covid: Tui, the UK's biggest tour operator says half of its online bookers are now ... If straight actors are banned from gay roles, why should gay actors play ... https://t.co/Yum1dMsYbb",https://twitter.com/StigmabaseO/status/1351467066004393985,Thu Apr 29 13:56:48 +0000 2010,138418838,false,Americas — United Kingdom  | Keeping up-to-date on global exclusion — Stigmabase is a canadian internet non-profit Initiative. Founded in 2010,0,4142,3742,262,Americas | United Kingdom,Stigmabase | ORG,StigmabaseO,1828239,,https://www.stigmabase.org/,false
"35.0209024,-15.8126577",Tue Jan 19 05:21:48 +0000 2021,,,https://www.instagram.com/p/CKNvCqvBXtz/?igshid=1aq6bqymglp29,0,1351399438108012545,,,,en,Malawi,false,,0,,,"<a href=""http://instagram.com"" rel=""nofollow"">Instagram</a>","Day 6 of 25 day Push up, Fighting against Covid-19 @ Myuziki Pusha Entertainment https://t.co/xEFUeNJF5G",https://twitter.com/Biggie_Lu/status/1351399438108012545,Mon Jan 31 06:08:20 +0000 2011,245237916,false,"Musician, Tv Host, Event Planner/Organizeer.

biggielu90@gmail.com",1585,2761,2435,6,"BLANTYRE, MW",11 JUNE #AMAPIANOWINTERVIBES,Biggie_Lu,14557,,https://mikozinet.com/album-zonse-ndi-nthawi-by-biggie-lu/,false
"-73.56725453,45.75975883",Tue Jan 19 09:33:04 +0000 2021,,,http://dlvr.it/Rqt53t,0,1351462671766310914,,,,en,"Mascouche, Québec",false,,0,,,"<a href=""https://dlvrit.com/"" rel=""nofollow"">dlvr.it</a>",Fighting Stigma: Cabinet considers €91m plan for GPs and pharmacists to vaccinate 1.5m people: Department of Health review finds no evidence of exploitation of student nurses · Read More · Coronavirus · Daily Today · Latest Ireland · Most Read in ... https://t.co/xQcf1xFCtz,https://twitter.com/StigmabaseN/status/1351462671766310914,Wed Sep 15 15:55:47 +0000 2010,191092262,false,Ireland — Scotland — Inuit —  Svenska  | Keeping up-to-date on global exclusion — Stigmabase is a canadian internet non-profit Initiative,0,1611,1297,110,Ireland | Scotland | Inuit | Skandinavien,Stigmabase | NORDIC,StigmabaseN,951806,,https://www.stigmabase.org/,false
"-74.0064,40.7142",Tue Jan 19 11:05:54 +0000 2021,friends quarantine newmusic,,https://www.instagram.com/p/CKOWjWMM4YH/?igshid=85h72klaas4j,0,1351486034236698624,,,,en,"Manhattan, NY",false,,0,,,"<a href=""http://instagram.com"" rel=""nofollow"">Instagram</a>","“FRIENDS” Thank you Jacob Evans for letting me get with this beat posted @jacobevansdrums #friends #quarantine #newmusic @ New York, New York https://t.co/R03R7DlzZP",https://twitter.com/eddiearjun/status/1351486034236698624,Fri Apr 03 11:53:44 +0000 2009,28546760,false,"• Explorations in Guitar Music • In this phase, the latest creations you see are made using beats found on IG. Join me on this journey.",740,784,918,14,NYC,Eddie Arjun,eddiearjun,1261,,https://linktr.ee/EddieArjun,false
"-1.31348909,51.74768066",Tue Jan 19 09:48:04 +0000 2021,,,https://twitter.com/SkyNews/status/1351463819059605505,0,1351466446795251713,,,,en,"Cumnor, England",false,1351463819059605505,0,,,"<a href=""http://tapbots.com/tweetbot"" rel=""nofollow"">Tweetbot for iΟS</a>","Sunday? Isolation is down to 5 days, now??? https://t.co/tVRCJv13Bi",https://twitter.com/Steve_Irv/status/1351466446795251713,Wed Jun 02 09:01:57 +0000 2010,150978926,false,"Ex-RAF. Oxford, London, Gran Can, Belfast.",3644,749,748,16,Oxford,Steve,Steve_Irv,89686,,,false
"-73.92441926,40.76332046",Tue Jan 19 06:42:53 +0000 2021,dudewithsign RepostDay5 WorkFromHome WorkFromHomeLife JCBAlikeThaT Tings,,https://www.instagram.com/p/CKN4dCAn8ZP/?igshid=kyikakxd8jfi,0,1351419842985865216,,,,en,"Queens, NY",false,,0,,,"<a href=""http://instagram.com"" rel=""nofollow"">Instagram</a>","#dudewithsign 
#RepostDay5
#WorkFromHome
#WorkFromHomeLife 
#JCBAlikeThaT
#2020 #Tings @ Soho, Manhattan https://t.co/vYPOwL658r",https://twitter.com/JCBA/status/1351419842985865216,Fri Apr 10 14:05:03 +0000 2009,30221116,false,"Verified Red- JADE CHRISTOPHER BENTLEY ADAMS, Proud Father of 2 & @JCBA_Mrs is my lovely wife --»Knighted The Inked One 22/11/12 by seppi WEBSITE below",12325,6517,6764,47,UAE /|7|\ /|8|\ /|20|\ /|23|\,JCBA,JCBA,51876,,http://shorturl.at/exEX9,false
"-88.4261,41.3647",Tue Jan 19 04:57:18 +0000 2021,hair hairstyles haircolor hairtransformation hairgoals dark brunette covid_19 sucks mask masklife winter love beauty,,https://www.instagram.com/p/CKNsXlfg0DM/?igshid=1mq3zntv8uxf,0,1351393271076024322,,,,en,"Morris, IL",false,,0,,,"<a href=""http://instagram.com"" rel=""nofollow"">Instagram</a>","Beautiful transition into dark for winter 

@redken 

#hair #hairstyles #haircolor #hairtransformation #hairgoals #dark #brunette #covid_19 #sucks #mask #masklife #winter #love #beauty @ Morris, Illinois https://t.co/dBgLkJu3ZH",https://twitter.com/Pilonmom/status/1351393271076024322,Sat Jun 27 05:13:00 +0000 2009,51353913,false,Master balayage artist working at @trimz salon in  Morris Illinois,9,10,0,0,,Ashley marie,Pilonmom,50,,,false
"-117.566,33.8753",Tue Jan 19 08:04:26 +0000 2021,,,https://www.instagram.com/p/CKOBySQBq-5/?igshid=quvuu42wa2pc,0,1351440366373896192,,,,en,"Corona, CA",false,,0,,,"<a href=""http://instagram.com"" rel=""nofollow"">Instagram</a>","Just posted a photo @ Corona, California https://t.co/QhxgUs75xb",https://twitter.com/mvargocooks/status/1351440366373896192,Thu May 14 23:39:49 +0000 2009,40119378,false,"Disney. Food. Travel. Cook. Music. More @disney.  Head of #D23 is the best job in the world.  thankful, dreamer & wishes",2263,557,946,38,Corona,Michael Vargo,mvargocooks,2234,,,false
"-73.56725453,45.75975883",Tue Jan 19 09:33:04 +0000 2021,,,http://dlvr.it/Rqt53g,0,1351462669673402377,,,,en,"Mascouche, Québec",false,,0,,,"<a href=""https://dlvrit.com/"" rel=""nofollow"">dlvr.it</a>","Fighting Stigma: UPDATE 1-Morocco reports its first case of UK coronavirus variant, bans more flights: Rabat, Jan 18 (Reuters) - Morocco's health ministry confirmed on Monday its first ... port of Tangier in a Moroccan national returning from Ireland via… https://t.co/zs74FMLDUe",https://twitter.com/StigmabaseN/status/1351462669673402377,Wed Sep 15 15:55:47 +0000 2010,191092262,false,Ireland — Scotland — Inuit —  Svenska  | Keeping up-to-date on global exclusion — Stigmabase is a canadian internet non-profit Initiative,0,1611,1297,110,Ireland | Scotland | Inuit | Skandinavien,Stigmabase | NORDIC,StigmabaseN,951806,,https://www.stigmabase.org/,false
