coordinates,created_at,hashtags,media,urls,favorite_count,id,in_reply_to_screen_name,in_reply_to_status_id,in_reply_to_user_id,lang,place,possibly_sensitive,quote_id,retweet_count,retweet_id,retweet_screen_name,source,text,tweet_url,user_created_at,user_id,user_default_profile_image,user_description,user_favourites_count,user_followers_count,user_friends_count,user_listed_count,user_location,user_name,user_screen_name,user_statuses_count,user_time_zone,user_urls,user_verified
"-79.6145,44.3857",Tue Jan 19 21:07:12 +0000 2021,homeschooling remotelearning educationmatters,,https://www.instagram.com/p/CKPbXWWszxQ/?igshid=pxc5rpy3kpov,0,1351637354142969857,,,,en,"Innisfil, Ontario",false,,0,,,"<a href=""http://instagram.com"" rel=""nofollow"">Instagram</a>","Shout out to the teachers sticking with us through this!
How is your homeschooling experience in your home?

.

.

.

#homeschooling #remotelearning #educationmatters @ Kempenfelt Bay https://t.co/Ta2lhQwznc",https://twitter.com/barriehometown/status/1351637354142969857,Tue Mar 26 16:33:45 +0000 2019,1110580609334894592,false,"It's always your move!

Fascilitating your Real Estate Buying, Selling, and Investing needs in my Hometown and throughout my Family's Region.",98,12,163,0,"Barrie, Ontario",Evan J Allary,barriehometown,143,,http://hockinghomes.com,false
"-79.81854,36.10369",Tue Jan 19 21:28:47 +0000 2021,,,https://www.instagram.com/p/CKPd1gnDuya/?igshid=1m0bxjnzkigiz,0,1351642785443684354,,,,en,"Greensboro, NC",false,,0,,,"<a href=""http://instagram.com"" rel=""nofollow"">Instagram</a>","Due to social distancing guidelines, we have booked up most of our times for larger bridal parties for January. @ Songbirds Bridal, Formal &amp; Consignments https://t.co/9tGHLFylk0",https://twitter.com/Songbirds_NC/status/1351642785443684354,Mon Jul 28 15:17:19 +0000 2014,2687746082,false,"Welcome to Songbirds Bridal, Formal & Consignments where you can find amazing deals on BRAND NEW & Gently Used clothing, bridal, and formals!",8,68,60,0,2610 Lawndale Dr Greensboro NC,Songbirds,Songbirds_NC,683,,http://www.ShopSongbirds.com,false
"0.29683475,51.61614277",Tue Jan 19 21:38:32 +0000 2021,,,https://j.mp/3iraTc5,0,1351645243112779777,,,,en,"Brentwood, East",false,,0,,,"<a href=""https://dlvrit.com/"" rel=""nofollow"">dlvr.it</a>",Tories vote down protections for NHS in trade deals on deadliest day in pandemic - The London Economic https://t.co/IYQNhKTcoQ,https://twitter.com/BRENTW00D/status/1351645243112779777,Mon Dec 23 20:32:37 +0000 2013,2259377648,false,"All of the latest news, sport, weather and updates from the town of #Brentwood in #Essex, UK",101,1956,852,67,"Brentwood, UK",BRENTWOOD,BRENTW00D,27979,,https://twitter.com/brentw00d,false
"-122.419,37.7793",Tue Jan 19 21:31:29 +0000 2021,dinnerparty covid_19,,https://www.instagram.com/p/CKPeJZPBv4e/?igshid=1pntkpk3lru6n,0,1351643466971951105,,,,en,"San Francisco, CA",false,,0,,,"<a href=""http://instagram.com"" rel=""nofollow"">Instagram</a>","I miss designing tables for my dinner parties. I always had a different theme/color scheme. Le sigh #dinnerparty #covid_19 @ San Francisco, California https://t.co/YaRT27V6Zz",https://twitter.com/EmillioM1/status/1351643466971951105,Sun Mar 13 15:53:58 +0000 2016,709044840403755008,false,"Events-Experience Planner, Writer & Cook (Pronoun-My Name). Bylines @nytimes @NYMag @HuffPost @Medium @qz @InterviewMag & others.",1002,126,364,8,"San Francisco, CA",EmillioMesa,EmillioM1,1734,,,false
"-119.13497,36.29785",Tue Jan 19 21:41:50 +0000 2021,,,https://www.instagram.com/p/CKPfVJmJFMl/?igshid=196xescubecd9,0,1351646071638945800,,,,en,"Exeter, CA",false,,0,,,"<a href=""http://instagram.com"" rel=""nofollow"">Instagram</a>","Beginning 1/19/21, our cross country preseason conditioning will resume.  Remember that all COVID-19 guidelines must be followed, including the daily covid check-in. Participation is voluntary. https://t.co/gBP3kd09Ka",https://twitter.com/EuhsAthletics/status/1351646071638945800,Thu Nov 20 04:48:34 +0000 2014,2904774678,false,,65,369,14,1,,EUHS Athletics,EuhsAthletics,3044,,,false
"-119.13497,36.29785",Tue Jan 19 21:42:39 +0000 2021,,,https://www.instagram.com/p/CKPfbI1pzjx/?igshid=17fpaxrzmcct4,0,1351646277117898757,,,,en,"Exeter, CA",false,,0,,,"<a href=""http://instagram.com"" rel=""nofollow"">Instagram</a>","Beginning 1/19/21, our football preseason conditioning will resume.  Remember that all COVID-19 guidelines must be followed, including the daily covid check-in. Participation is voluntary. https://t.co/91usJ7dlle",https://twitter.com/EuhsAthletics/status/1351646277117898757,Thu Nov 20 04:48:34 +0000 2014,2904774678,false,,65,369,14,1,,EUHS Athletics,EuhsAthletics,3044,,,false
"-6.4392699,53.41043",Tue Jan 19 21:18:40 +0000 2021,lockdown walk zoom red reflections traffic covid19 5klimit,,https://www.instagram.com/p/CKPcraTM_mD/?igshid=1e7rm51agsb0f,0,1351640243481489408,,,,en,"Fingal, Ireland",false,,0,,,"<a href=""http://instagram.com"" rel=""nofollow"">Instagram</a>",No #lockdown #walk tonight as in-line #zoom meeting but fortunately got this image on the way home - loving the #red #reflections and lack of #traffic #covid19 #5klimit @ Clonee https://t.co/m4Ty2Kdazi,https://twitter.com/jedi_vincent/status/1351640243481489408,Tue Feb 10 22:06:50 +0000 2009,20551121,false,dubliner with a healthly disrespect for himself / gp / running / painting / photos,3338,460,1884,49,Dublin,ronan mcloughlin,jedi_vincent,10384,,http://www.facebook.com/ronmcphotos,false
"-73.99767,40.74261",Tue Jan 19 20:47:50 +0000 2021,lube,,https://www.instagram.com/p/CKPZJX9AhN_/?igshid=ryh18lqf8e2s,1,1351632483872346116,,,,en,"Manhattan, NY",true,,1,,,"<a href=""http://instagram.com"" rel=""nofollow"">Instagram</a>",Yay! We finally got some Sliquid in. It's been difficult to get during the pandemic. #lube @ Purple Passion https://t.co/NfHcqFRrvV,https://twitter.com/_PurplePassion_/status/1351632483872346116,Thu Nov 11 19:38:34 +0000 2010,214594203,false,BDSM/Fetish/SexToy shop in Chelsea neighborhood of NYC. Clean and friendly!,798,2613,1345,60,NYC,Purple Passion NYC,_PurplePassion_,5122,,http://www.purplepassion.com,false
"-0.1094,51.5141",Tue Jan 19 19:58:19 +0000 2021,strongwomen strongmindset spinehealth strongbacksoftfrontwildheart onlinecourselaunch sirilakshmiyoga,,https://www.instagram.com/p/CKPTe3gFktN/?igshid=xm2bizrawvqw,1,1351620020699357190,,,,en,"City of London, London",false,,0,,,"<a href=""http://instagram.com"" rel=""nofollow"">Instagram</a>","Don’t let lockdown stop you ... #strongwomen #strongmindset #spinehealth #strongbacksoftfrontwildheart #onlinecourselaunch #sirilakshmiyoga @ London, United Kingdom https://t.co/cwz99GHcFw",https://twitter.com/indirasiri/status/1351620020699357190,Mon Apr 13 13:43:38 +0000 2009,30866265,false,"Kundalini Yoga teacher, therapist/ energy healer, Metamorphic Technique practitioner, Inclusive Yoga. passionate about getting everyone healthy & have fun",9342,478,507,24,London,indirasiri,indirasiri,15565,,http://www.sirilakshmi.co.uk,false
"-77.6204,43.1557",Tue Jan 19 20:00:38 +0000 2021,CovidMemorial Covid covid_19 RIP,,https://www.instagram.com/p/CKPTwALhtz2B13pyRqxERMKojl60wf5QHOtOqI0/?igshid=9yz8wyd4b204,0,1351620604483555328,,,,en,"New York, USA",false,,0,,,"<a href=""http://instagram.com"" rel=""nofollow"">Instagram</a>","R.I.P. 🙏🙏🙏 

#CovidMemorial #Covid #covid_19 #RIP🙏 @ Rochester, New York https://t.co/WF385vCBwd",https://twitter.com/FanSince1988WWE/status/1351620604483555328,Fri Aug 07 00:57:19 +0000 2015,3406384695,false,"Pro Wrestling Fan Since 1988. Gentleman navigating through life. Currently binge watching #SellingSunset on @Netflix 
#Transman #AEW #WWE #FFBallers",1917,36,394,0,"Rochester, NY",FanSince1988,FanSince1988WWE,420,,,false
"13.401251,52.518391",Tue Jan 19 20:44:15 +0000 2021,corona lifewithkids,,https://www.instagram.com/p/CKPYvS5B8GZ/?igshid=3te4uy8f7yr2,1,1351631580217937926,,,,en,"Berlin, Deutschland",false,,0,,,"<a href=""http://instagram.com"" rel=""nofollow"">Instagram</a>","...somehow I feel ready for the harder lockdown!
#corona #lifewithkids @ Berlin, Germany https://t.co/sF57mdkTLB",https://twitter.com/JakobEbert/status/1351631580217937926,Tue Nov 17 22:36:57 +0000 2009,90737737,false,"I truly enjoy telling stories with bold, unique and sensitive imagery. Filmmaking and much more... #supagraf #onsetwithj",1969,796,1875,83,"Berlin, Deutschland",Jakob Ebert,JakobEbert,5109,,http://www.jakobebert.com,false
"-118.2445,34.0564",Tue Jan 19 20:26:16 +0000 2021,firefighter modernavaccineforcovid19,,https://www.instagram.com/p/CKPWrssgFwA/?igshid=1i6dn6ihoyxud,11,1351627056271011842,,,,en,"Los Angeles, CA",false,,3,,,"<a href=""http://instagram.com"" rel=""nofollow"">Instagram</a>","Boom! Thank you @carbonhealth staff &amp; the #firefighter volunteers 🙏🏽Vaccine #1: Done! ❤️ #modernavaccineforcovid19 @ Los Angeles, California https://t.co/docYQmWyHx",https://twitter.com/theguiceman/status/1351627056271011842,Thu Apr 09 09:17:42 +0000 2009,29951832,false,Quite possibly the world's first personal juicer! Granola Gangster. Tennis fan. Yogi Athlete.,290,827,548,14,"West Hollywood, CA",Gregory Howell,theguiceman,2083,,http://www.g-lixir.com,false
"2.1683,41.3894",Tue Jan 19 19:53:08 +0000 2021,techno tech music live ableton rave after mountain love freedom covid pumpupthejam party barcelona spain,,https://www.instagram.com/p/CKPS40TgGlG/?igshid=tycp0t6w9a3i,1,1351618715167690753,,,,en,"Barcelona, España",false,,0,,,"<a href=""http://instagram.com"" rel=""nofollow"">Instagram</a>","#techno #tech #music #live #ableton #rave #after #mountain #love #freedom #covid #pumpupthejam #party #barcelona #spain en Barcelona, Spain https://t.co/YvEqleKBqL",https://twitter.com/estebanstarfish/status/1351618715167690753,Tue Apr 16 13:58:20 +0000 2019,1118151642698928128,false,PHOTOGRAPHER // FILMMAKER Barcelona.,2840,84,232,0,"Barcelona, Cataluña",ESTEBANSTARFISH // KRNS,estebanstarfish,941,,https://www.instagram.com/estebanstarfish/,false
"-81.32806152,48.47593351",Tue Jan 19 20:35:04 +0000 2021,,https://twitter.com/TimminsToday/status/1351629268317401089/photo/1,https://www.timminstoday.com/coronavirus-covid-19-local-news/covid-19-vaccine-rollout-adverse-events-being-watched-but-no-one-has-needed-hospitalization-3275264?utm_source=dlvr.it&utm_medium=twitter,1,1351629268317401089,,,,en,"Timmins, Ontario",false,,0,,,"<a href=""https://dlvrit.com/"" rel=""nofollow"">dlvr.it</a>",COVID-19 vaccine rollout: Adverse events being watched but no one has needed hospitalization https://t.co/eECvLSNHv2 https://t.co/NnK6xOrWD1,https://twitter.com/TimminsToday/status/1351629268317401089,Thu Oct 18 02:36:23 +0000 2012,887966294,false,We are an online local news source for Timmins and Northern Ontario.,19,1893,296,18,"Timmins, Ontario",TimminsToday.com,TimminsToday,33106,,http://www.timminstoday.com,false
"-1.26666667,50.66666667",Tue Jan 19 19:50:41 +0000 2021,,,https://www.instagram.com/p/CKPSm9nJsC2/?igshid=dqjkq81vqn5z,0,1351618098126848002,,,,en,"South East, England",false,,0,,,"<a href=""http://instagram.com"" rel=""nofollow"">Instagram</a>","First Jab a week ago, work so busy its frightening, more and more have covid, why is it so busy everywhere? Please everyone try harder, we all want to live.Newport Isle of Wight. @ Isle of Wight https://t.co/SpT77TYydg",https://twitter.com/JayneGoosebumps/status/1351618098126848002,Tue May 18 17:15:04 +0000 2010,145313524,false,"Paranormal investigator with Goosebumps on the Isle of Wight, Reiki Master.Ordained in the Universal Life Church for handfasting, etc  jaynehotlips@hotmail.com",3,81,89,1,isle of wight uk,Jayne Wetherall,JayneGoosebumps,167,,https://twitter.com/settings/profile,false
"-0.33948975,51.750789",Tue Jan 19 22:16:02 +0000 2021,,,http://dlvr.it/RqwT1B,0,1351654678296055808,,,,en,"Saint Albans, East",false,,0,,,"<a href=""https://dlvrit.com/"" rel=""nofollow"">dlvr.it</a>","Almost a Third of Recovered COVID-19 Patients Return To Hospital In Five Months, One In Eight Die https://t.co/iEtOmvrh1R",https://twitter.com/BroadenMyView/status/1351654678296055808,Thu Nov 27 11:06:00 +0000 2008,17675384,false,Join personal conversations with personal viewpoints with new people to broaden your view that helps you find your #Innovation & #Creativity at an #IdeaCafe ;-),1,2601,2030,710,St Albans Herts UK,Idea Cafes In Action,BroadenMyView,157859,,http://myinnovationspace.com/about,false
"5.55,52.31666667",Tue Jan 19 20:34:33 +0000 2021,lockdown avondklok aadpakvis,,https://www.instagram.com/p/CKPXoXFFtoC/?igshid=1ibn6hrxk5qzq,0,1351629139258736640,,,,en,"Zeewolde, Nederland",false,,0,,,"<a href=""http://instagram.com"" rel=""nofollow"">Instagram</a>","Anno 2036

#lockdown
#avondklok 
#aadpakvis @ Netherlands https://t.co/S42fpzjKwH",https://twitter.com/rhodanos/status/1351629139258736640,Sun Oct 18 18:07:16 +0000 2009,83410416,false,,11,17,182,0,Rotterdam,G@ngSt@rr,rhodanos,5071,,,false
"-71.21594,42.76936",Tue Jan 19 20:34:56 +0000 2021,,,https://www.instagram.com/p/CKPXrM3BrOu/?igshid=8kcypjnp5rq8,2,1351629237254459392,,,,en,"Salem, NH",false,,0,,,"<a href=""http://instagram.com"" rel=""nofollow"">Instagram</a>","We would like to thank our awesome neighbors, Ocean State Job Lot, for their donation of PPE!

We are grateful to have kind and generous neighbors like them who are ensuring our health and safety! @ Ocean State Job Lot https://t.co/CqYKf1zOX0",https://twitter.com/SalemNHPolice/status/1351629237254459392,Thu Sep 22 14:17:49 +0000 2011,378019460,false,"This is the official Twitter account for the Salem, New Hampshire Police Department. This account is not monitored 24/7. Dial 911 for emergencies.",182,5869,299,122,"Salem, N.H.",SalemPD,SalemNHPolice,2000,,http://townofsalem.org/departments/police-department.html,false
"-1.8199448,52.44634121",Tue Jan 19 21:04:56 +0000 2021,AcocksGreen AcocksGreenVillage,,https://www.instagram.com/p/CKPbG2bjg6i/?igshid=oo49f7zbwaua,0,1351636785839960067,,,,en,"Birmingham, England",false,,0,,,"<a href=""http://instagram.com"" rel=""nofollow"">Instagram</a>",#AcocksGreen #AcocksGreenVillage in another lockdown. Very quiet. @ Acocks Green Village-Birmingham https://t.co/9VeEMeSqD5,https://twitter.com/ellrbrown/status/1351636785839960067,Mon Nov 30 22:34:09 +0000 2009,93726008,false,Birmingham based photographer. Photos in the Birmingham Mail. @birminghamweare person with passion and regular contributor.,46866,1314,1870,59,Birmingham,Elliott Brown,ellrbrown,71883,,https://www.yourplaceyourspace.net/peoplewithpassion/ElliottBrown,false
"-105.473,39.4056",Tue Jan 19 22:35:14 +0000 2021,grateful,,https://www.instagram.com/p/CKPlcM8Lhb3/?igshid=1mpehszi8or4z,0,1351659509085851651,,,,en,"Colorado, USA",false,,0,,,"<a href=""http://instagram.com"" rel=""nofollow"">Instagram</a>","Tuesdays we both work from home.  This is what our lunch break looked like!  And yes, the commute is worth it!!!  #grateful @ Bailey, Colorado https://t.co/qRGwleANMi",https://twitter.com/athleteonfire/status/1351659509085851651,Sun Oct 20 22:01:37 +0000 2013,1976587867,false,"Everyone is an athlete, some just don't know it yet. #athlete #adventurer #entrepreneur @becomingultra",2269,995,1014,57,"Colorado, USA",Scott C Jones,athleteonfire,6094,,http://athleteonfire.com,false
"-119.12850023,36.29751913",Tue Jan 19 21:38:07 +0000 2021,,,https://www.instagram.com/p/CKPe5zApRso/?igshid=vth0mb6x8s2o,0,1351645137923940352,,,,en,"Exeter, CA",false,,0,,,"<a href=""http://instagram.com"" rel=""nofollow"">Instagram</a>","Beginning 1/20/21, our boys basketball preseason conditioning will resume.  Remember that all COVID-19 guidelines must be followed, including the daily covid check-in. Participation is voluntary. @ Kaweah High School https://t.co/MM0AT7Ais1",https://twitter.com/EuhsAthletics/status/1351645137923940352,Thu Nov 20 04:48:34 +0000 2014,2904774678,false,,65,369,14,1,,EUHS Athletics,EuhsAthletics,3044,,,false
"-2.32752883,53.43069458",Tue Jan 19 21:40:50 +0000 2021,,,,0,1351645819481579524,samuelruback,1351631891384954885,19084691,en,"Sale, England",,,0,,,"<a href=""http://tapbots.com/tweetbot"" rel=""nofollow"">Tweetbot for iΟS</a>","@samuelruback Think it’s a combination - VVD injury, a natural drop off after 3 big seasons, covid meaning they probably haven’t been able to change the squad as much as teams need to, intensity of the season meaning teams can’t play 100mph all the time, other teams being slightly better etc.",https://twitter.com/KarateJesus44/status/1351645819481579524,Sat May 15 17:18:18 +0000 2010,144225517,false,That's me in the corner.,3048,2172,494,55,Manchester,Karate Jesus,KarateJesus44,67102,,,false
"-1.717726,54.901576",Tue Jan 19 21:30:10 +0000 2021,beatcovidne covid coviduk lockdown,https://twitter.com/philrobson01/status/1351643134585942020/photo/1,,0,1351643134585942020,,,,en,"Crookgate Bank, England",false,,0,,,"<a href=""https://onloft.com/tweetlogix"" rel=""nofollow"">Tweetlogix</a>","#beatcovidne #covid #coviduk #lockdown 
Vaccinations compared between countries https://t.co/yRHaMBWXCp",https://twitter.com/philrobson01/status/1351643134585942020,Sat Dec 05 18:38:09 +0000 2009,94844044,false,Tired of misinformation or zero information from the UK government. Looking  for reliable resources on Twitter and doing my own research.,1323,134,227,11,"ÜT: 55.036801,-1.535692",phil robson,philrobson01,242,,,false
"-1.717725,54.901547",Tue Jan 19 20:26:37 +0000 2021,bbcnews beatcovidne covid coviduk lockdown,https://twitter.com/philrobson01/status/1351627142723989511/photo/1,,0,1351627142723989511,,,,en,"Crookgate Bank, England",false,,0,,,"<a href=""https://onloft.com/tweetlogix"" rel=""nofollow"">Tweetlogix</a>","#bbcnews #beatcovidne #covid #coviduk #lockdown 
The UK officially and by a long way the worst impacted for deaths in the world. Now is not the time to demand answers but we owe it to those who have passed and their families to independantly analyze and explain one day. https://t.co/VHtnoX4dlo",https://twitter.com/philrobson01/status/1351627142723989511,Sat Dec 05 18:38:09 +0000 2009,94844044,false,Tired of misinformation or zero information from the UK government. Looking  for reliable resources on Twitter and doing my own research.,1323,134,227,11,"ÜT: 55.036801,-1.535692",phil robson,philrobson01,242,,,false
"-72.5981195,44.15253213",Tue Jan 19 22:28:23 +0000 2021,,,https://www.instagram.com/p/CKPjoIoACuP/?igshid=1xndsfcz7vopa,0,1351657786317402112,,,,en,"Montpelier, VT",false,,0,,,"<a href=""http://instagram.com"" rel=""nofollow"">Instagram</a>",Sleepy look 💤😴 la Quarantine https://t.co/NdbZzptM8L,https://twitter.com/OfficialMihnea/status/1351657786317402112,Sun May 15 17:27:25 +0000 2016,731898796108591106,false,Scoala 179 🔜 LGCTC (LGRCAT) 😇💜,482,228,1206,0,"Bucurestii-Noi, România", Mihnea Doar Mihnea ,OfficialMihnea,7693,,https://www.youtube.com/channel/UCfXRL4Gz3jRpzAzLo81rxyQ,false
"-78.196119,43.9723939",Tue Jan 19 20:28:17 +0000 2021,,,https://northumberland897.ca/the-drive-time/2021/1/19/drive-time-january-15-cobourg-mayor-john-henderson-discusses-the-current-lockdown,0,1351627561449750537,,,,en,"Cobourg, Ontario",false,,0,,,"<a href=""http://www.squarespace.com"" rel=""nofollow"">Squarespace</a>",Drive Time - January 15 : Cobourg Mayor John Henderson discusses the current lockdown  https://t.co/iVKAWGBaBj,https://twitter.com/trulylocal897/status/1351627561449750537,Mon Nov 26 21:23:42 +0000 2012,972745747,false,"Northumberland 89.7 FM is a truly local radio station for the residents of Northumberland County, by the residents of Northumberland County.",309,1863,667,24,"Northumberland County, ON",Northumberland 89.7,trulylocal897,12335,,http://www.northumberland897.ca,false
"-6.26174338,53.34411666",Tue Jan 19 19:34:32 +0000 2021,,https://twitter.com/RebelDublin/status/1351614036501176320/photo/1,http://dlvr.it/Rqw3jr,0,1351614036501176320,,,,en,"Dublin City, Ireland",false,,0,,,"<a href=""https://dlvrit.com/"" rel=""nofollow"">dlvr.it</a>","Looking for clear, up-to-date information on coronavirus and Ireland's response to it? Sign up to our newsletter: Our hugely popular newsletter brings you the latest Irish and international developments. https://t.co/qSgBu39VpB https://t.co/b8iNjj7xqu",https://twitter.com/RebelDublin/status/1351614036501176320,Tue Feb 23 15:00:23 +0000 2016,702145987217899520,false,"Discover all about our beloved Dublin from Ireland's history to tourist attractions... humorously.
Use the Hashtag #RebelDublin",34,275,53,14,"Dublin City, Ireland",Rebel Dublin,RebelDublin,8601,,http://rebeldublin.ie,false
"-0.10226432,51.57558519",Tue Jan 19 20:46:33 +0000 2021,,https://twitter.com/MusicNewsWeb/status/1351632160768229376/photo/1,http://Music-News.com http://dlvr.it/RqwFtF,6,1351632160768229376,,,,en,"Tottenham, London",false,,4,,,"<a href=""https://dlvrit.com/"" rel=""nofollow"">dlvr.it</a>",https://t.co/cGbkkwFHAS Michael Buble: 'Covid-19 lockdown has been the greatest time of my life' https://t.co/yBTwZEEmhQ https://t.co/OJ9iUXxyah,https://twitter.com/MusicNewsWeb/status/1351632160768229376,Tue Mar 31 10:32:34 +0000 2009,27847155,false,"https://t.co/zDtI3JDr0v features #news, #reviews, #gigs, #interviews, #competitions, latest releases & #gossip. #musicnews https://t.co/2atsooDt52",23122,59020,43123,526,London,Music-News.com,MusicNewsWeb,126159,,https://www.facebook.com/musicnewsweb,false
"-97.78165698,31.44843289",Tue Jan 19 20:03:11 +0000 2021,Google Texas Covid19 Texas,https://twitter.com/trendsmetadata/status/1351621245406752773/photo/1,http://www.google.com/m/search?&q=Joe+Exotic https://twitter.com/search/?q=Joe+Exotic,0,1351621245406752773,,,,en,"Texas, USA",false,,0,,,"<a href=""https://trendsmetadata.com"" rel=""nofollow"">trendsmetadata</a>","50K+ #Google searches 4 Joe Exotic 4h old https://t.co/egIIRLTwsO https://t.co/gMVtOeSgzp 
#Texas 🌅 7:29 🌆 17:54 CST
#Covid19
#Texas 01/18/2021
New CS 11590 14DCSΔ +15.3%
New D 46 14DDΔ +13.7% https://t.co/OOSbX1TewE",https://twitter.com/trendsmetadata/status/1351621245406752773,Sun May 01 03:42:17 +0000 2011,290889806,false,Media Metadata Viewpoint Convergence.,27,3370,3073,365,,data about data,trendsmetadata,248515,,http://trendsmetadata.com,false
"-5.9812119,54.5539645",Tue Jan 19 20:00:32 +0000 2021,Newry,,http://newrytimes.com/2021/01/19/voluntary-community-and-social-economy-sector-covid-recovery-fund-reopens/,0,1351620577283465216,,,,en,"Belfast, Northern Ireland",false,,0,,,"<a href=""https://www.hootsuite.com"" rel=""nofollow"">Hootsuite Inc.</a>","Communities Minister Deirdre Hargey has announced the opening of a second phase, worth £1m, of the Voluntary, Community and Social Economy Sector (VCSE) Covid Recovery Fund.

Read more &gt;&gt; https://t.co/27OLCNH1c2

#Newry",https://twitter.com/NewryTimes/status/1351620577283465216,Fri Nov 18 02:18:13 +0000 2011,415228549,false,Latest news in #Newry and Mourne: https://t.co/BLqm8IajQ3,269,6559,4062,51,Newry,Newry Times,NewryTimes,17290,,http://www.newrytimes.com,false
"-87.26831,41.60151",Tue Jan 19 21:19:21 +0000 2021,nwi nwindiana,,https://www.instagram.com/p/CKPcwXpgknG/?igshid=15ivnj6mwvtm3,0,1351640412016922625,,,,en,"Gary, IN",false,,0,,,"<a href=""http://instagram.com"" rel=""nofollow"">Instagram</a>",Mask Up and come up and laugh and/or perform Wednesday nights. Limited capacity to allow for social distancing. #nwi #nwindiana @ D Performance Comedy Theatre https://t.co/wQJDQPEeq7,https://twitter.com/KingDavidLane/status/1351640412016922625,Tue Feb 24 07:52:09 +0000 2009,21737845,false,Comedian. Improv. Wrestling With Problems. Well Suited Theater Co-Owner. King David Komedy. NWI Rugby. MillerBeach PerforMance Theater Co-Owner. $KingDavidLane,16754,3080,3066,113,"Lake Station, IN",King David Lane,KingDavidLane,93181,,http://KingDavidLane.com,false
"-80.1418,26.1358",Tue Jan 19 22:31:59 +0000 2021,,,https://www.instagram.com/p/CKPlEajBpx-/?igshid=1bsn3kfoy7s19,2,1351658690223501315,,,,en,"Fort Lauderdale, FL",false,,0,,,"<a href=""http://instagram.com"" rel=""nofollow"">Instagram</a>","Lit a candle for all those we have lost to COVID and made a wish for peace and healing in our country.  ♥️ @ Fort Lauderdale, Florida https://t.co/3Hn6HZqUD3",https://twitter.com/SWLaguna/status/1351658690223501315,Fri Jan 08 19:04:07 +0000 2010,103060719,false,Philanthropy and Social Impact,422,1490,1290,29,New York NY,Steven Wozencraft (he/him),SWLaguna,2318,,,false
"-84.03622627,41.89882729",Tue Jan 19 20:00:05 +0000 2021,internet home workfromhome school lenaweecounty,,https://www.instagram.com/p/CKPTr7-BVvO/?igshid=3tf8gxtcw6xd,0,1351620466662805506,,,,en,"Adrian, MI",false,,0,,,"<a href=""http://instagram.com"" rel=""nofollow"">Instagram</a>","Got #internet ?
When shopping for a #home we understand how important the internet coverage is when you #workfromhome &amp; #school from home.
✅ out our handy #lenaweecounty internet guide 😁 @ REMAX Main Street Realty https://t.co/t2DQBWwgy2",https://twitter.com/TheRisingTeamMI/status/1351620466662805506,Thu Sep 29 14:10:03 +0000 2016,781496265372688384,false,"The #1 #RealEstateTeam in Lenawee County MI. Providing Real Estate Services to Adrian MI, Lenawee County and SE Michigan.",2,108,182,5,"Adrian, MI",The Rising Team,TheRisingTeamMI,244,,http://www.TheRisingTeam.com,false
"-84.50528562,38.02288369",Tue Jan 19 20:57:44 +0000 2021,vaccine,,https://www.instagram.com/p/CKPaSNkFVds/?igshid=6kzmwg6g6x9d,0,1351634973665718278,,,,en,"Kentucky, USA",false,,0,,,"<a href=""http://instagram.com"" rel=""nofollow"">Instagram</a>",Let’s do this! #vaccine @ Kroger Field https://t.co/jI9FeuduBp,https://twitter.com/akyclassroom/status/1351634973665718278,Wed Jan 07 01:36:36 +0000 2015,2961815767,false,Teacher. Friend. Kentucky girl.,1564,75,117,0,"Kentucky, USA",Robin Foster,akyclassroom,1329,,http://akentuckyclassroom.com,false
