coordinates,created_at,hashtags,media,urls,favorite_count,id,in_reply_to_screen_name,in_reply_to_status_id,in_reply_to_user_id,lang,place,possibly_sensitive,quote_id,retweet_count,retweet_id,retweet_screen_name,source,text,tweet_url,user_created_at,user_id,user_default_profile_image,user_description,user_favourites_count,user_followers_count,user_friends_count,user_listed_count,user_location,user_name,user_screen_name,user_statuses_count,user_time_zone,user_urls,user_verified
"-122.45780103,37.66049194",Tue Jan 19 18:00:52 +0000 2021,,,https://twitter.com/NBCNews/status/1351535830607785985,0,1351590465372450817,,,,en,"South San Francisco, CA",true,1351535830607785985,0,,,"<a href=""http://tapbots.com/tweetbot"" rel=""nofollow"">Tweetbot for iΟS</a>",The statistics dance continues and y’all gonna eat this up and quote it. https://t.co/JITpJstCe2,https://twitter.com/ReasonablePete/status/1351590465372450817,Thu Apr 30 06:18:51 +0000 2009,36610807,false,I’d probably be dead if I was basic. SCIENTIA,9691,430,314,11,San Francisco,NEIL THEGRASS TYSON,ReasonablePete,51667,,http://NASA.gov,false
"-0.11677265,51.50571074",Tue Jan 19 18:09:05 +0000 2021,,,https://www.instagram.com/p/CKPG-ylFFZH/?igshid=1dlu188zd26iy,0,1351592532434628620,southbankcentre,,17185109,en,"Lambeth, London",false,,0,,,"<a href=""http://instagram.com"" rel=""nofollow"">Instagram</a>","@southbankcentre’s lights burning bright through the lockdown glum - bringing the party we all long for just now. Soon come 🤞🏽
💡💥🥂💃🏽❤️🧡💛💚💙💜 @ Southbank Centre https://t.co/KicgWLpCzc",https://twitter.com/bakulp/status/1351592532434628620,Thu Apr 30 23:00:39 +0000 2009,36803247,false,"Lucky to do what I love & love what I do... Arts & culture curator, producer, writer, PR.",30603,938,2234,30,worldly worlding,Bakul Patki 💙,bakulp,19769,,http://www.bakulpatki.com,false
"-118.24209778,34.05308364",Tue Jan 19 18:04:06 +0000 2021,,,https://www.instagram.com/p/CKPGaYyJuLhi_X4l_dSKl8hhXBUg1tIHrz11mU0/?igshid=1q72bp0bpjrbf,1,1351591276651704326,,,,en,"Los Angeles, CA",false,,0,,,"<a href=""http://instagram.com"" rel=""nofollow"">Instagram</a>","Working from home .. they say! Lol @ Venice Beach, Los Angeles https://t.co/LCoBt9d92X",https://twitter.com/JoyceMiranda/status/1351591276651704326,Wed Mar 25 06:41:34 +0000 2009,26447285,false,"📍LA•Mexico City. Simple•HAPPY•Honest• enjoys life,fashion,TRIPS & more. instagram : @joycemirandagunt",345,449,947,13,Aqui y Alla ,Joyce Miranda,JoyceMiranda,29258,,,false
"-84.1906172,39.75411409",Tue Jan 19 18:35:55 +0000 2021,,,https://www.swarmapp.com/c/8WZEeQGkd1L,0,1351599286035898372,,,,en,"Dayton, OH",false,,0,,,"<a href=""http://foursquare.com"" rel=""nofollow"">Foursquare</a>","COVID messed with the wrong guy. Kicked its ass and donating convalescent plasma to beat it in other people. (@ Community Blood Center / Community Tissue Services in Dayton, OH) https://t.co/Mvh0JBqKtG",https://twitter.com/ljgonya/status/1351599286035898372,Tue Oct 20 02:59:59 +0000 2009,83754930,false,,4143,77,243,1,,Jeffery Gonya,ljgonya,3412,,,false
"-5.9812286,54.5539407",Tue Jan 19 18:00:31 +0000 2021,northernirelandbusiness newry,,https://www.tallpaulmarketing.com/ni-lockdown-legends-pet-spiders-junk-food-late-nights-furlough-and-lockdown-kelly-mcgookin/,0,1351590375849394179,,,,en,"Belfast, Northern Ireland",false,,0,,,"<a href=""https://www.hootsuite.com"" rel=""nofollow"">Hootsuite Inc.</a>","Another unique story in the new series, Lockdown Legends, about local woman Kelly McGookin - Kelly's Virtual Solutions - on her incredible first year in business. 

Read more &gt;&gt; https://t.co/pN4mEYnLRz

#northernirelandbusiness #newry",https://twitter.com/NewryTimes/status/1351590375849394179,Fri Nov 18 02:18:13 +0000 2011,415228549,false,Latest news in #Newry and Mourne: https://t.co/BLqm8IajQ3,269,6559,4062,51,Newry,Newry Times,NewryTimes,17290,,http://www.newrytimes.com,false
"-0.23492,51.37509",Tue Jan 19 19:04:13 +0000 2021,,,https://fuelbigdata.com/blog/f/covid19-only-stops-growth-in-full-lockdown?blogcategory=Covid19+Investigation https://www.instagram.com/p/CKPNSjNAYIJ/?igshid=budvfg9vlqur,0,1351606405451689984,,,,en,"Sutton, London",false,,0,,,"<a href=""http://instagram.com"" rel=""nofollow"">Instagram</a>","https://t.co/WQfAvi31IW

Link for latest Covid19 pandemic Analysis @ Worcester Park https://t.co/3z5blzVwEe",https://twitter.com/jpacerqueira/status/1351606405451689984,Sun Mar 22 17:21:01 +0000 2009,25845734,false,Big Data & Data Science Consultant | #BigDataAnalytics  #MachineLearning #Spark #Kafka #h2o.ai #Tensorflow | @London From.Portugal.Braga :),1901,386,852,20,London UK,JPAC,jpacerqueira,2696,,http://fuelbigdata.com,false
"-70.7408919,-34.13698724",Tue Jan 19 19:14:02 +0000 2021,,,https://www.instagram.com/p/CKPOao_ruU3CPcyboWuicOaLhpTbkai__ObwUI0/?igshid=85nru4qg6xg0,0,1351608876173582336,,,,en,"Rancagua, Chile",false,,0,,,"<a href=""http://instagram.com"" rel=""nofollow"">Instagram</a>",Covid Times en Cesfam 4 NP https://t.co/RczGnbo2P4,https://twitter.com/C_Diazzz/status/1351608876173582336,Thu Mar 29 20:24:56 +0000 2012,540338865,false,👨🏾‍⚕️🏳️‍🌈💪🏾🥰🐶🐱,697,81,204,0,"Rancagua, Chile",Claudio Díaz S.,C_Diazzz,661,,,false
"-77.0367,38.8951",Tue Jan 19 18:28:30 +0000 2021,podcast zmbsqd zombieapocalypse comics quarantine nvrdun isolation corona,,http://www.deadonpictures.com/ https://www.instagram.com/p/CKPJMHSpXw5/?igshid=1l1hbmzecprcr,0,1351597419742433280,,,,en,"Washington, DC",false,,0,,,"<a href=""http://instagram.com"" rel=""nofollow"">Instagram</a>","Link in the Bio for Full Eps.: 
https://t.co/113UTT7PSI
SUBSCRIBE, LIKE, SHARE, COMMENT 
#podcast
#zmbsqd 
#zombieapocalypse
@glennericnelson
@deadonpictures
#comics 
#quarantine 
#nvrdun
#isolation 
#corona https://t.co/NQ9TvBVgCX",https://twitter.com/glennericnelson/status/1351597419742433280,Tue Apr 07 17:53:10 +0000 2009,29500943,false,,29,400,2152,7,,Glenn Nelson,glennericnelson,5692,,http://www.deadonpictures.com/,false
"-77.01177895,38.99217785",Tue Jan 19 19:25:05 +0000 2021,,,http://ow.ly/s19i30rsZG6,23,1351611656569290753,,,,en,"Silver Spring, MD",false,,6,,,"<a href=""https://www.hootsuite.com"" rel=""nofollow"">Hootsuite Inc.</a>","Starting next week, you* can get a Covid-19 vaccine** at one of three Giants in MoCo (downtown Silver Spring, Burtonsville, and Kentlands)

*if you’re over 75
*if they have enough

https://t.co/teEpzTw6ae",https://twitter.com/justupthepike/status/1351611656569290753,Tue Aug 26 16:48:20 +0000 2008,15999017,false,"(mostly) MD housing policy @ggwash; also ice cream, pit bulls, and emo. just out here getting cuter. he/they. COMING SOON: @montgomerymall2",64163,13112,1873,313,silver spring,dan reed 🦀🏳️‍🌈👋🏾,justupthepike,26425,,https://linktr.ee/justupthepike,true
"-79.7164011,43.7742911",Tue Jan 19 18:36:32 +0000 2021,Covid19 Health India NEWS,,http://dlvr.it/RqvvD9,0,1351599438788063232,,,,en,"Brampton, Ontario",false,,1,,,"<a href=""https://dlvrit.com/"" rel=""nofollow"">dlvr.it</a>","6.31 lakh vaccinated so far, no serious AEFI on Tuesday: India has vaccinated 6.31 lakh healthcare workers since the commencement of the nation-wide vaccination drive on January 16, the Health Ministry said on Tuesday.… https://t.co/3M0GRAQAvW #Covid19 #Health #India #NEWS",https://twitter.com/Weeklyvoice/status/1351599438788063232,Tue Mar 30 17:43:21 +0000 2010,127943720,false,Most Trusted News in North America’s South Asian Communities Since 1997,172,498,299,11,Toronto,Weekly Voice,Weeklyvoice,37048,,http://www.Weeklyvoice.com,false
"-75.35628055,40.68644186",Tue Jan 19 18:50:18 +0000 2021,dutchsprings aerialpark aquapark bethlehem vaccine scuba scubadiving,,https://www.instagram.com/p/CKPLswsFvPU/?igshid=1ajp3xp8m79g2,1,1351602904206106628,,,,en,"Pennsylvania, USA",false,,1,,,"<a href=""http://instagram.com"" rel=""nofollow"">Instagram</a>",First Moderna shot.  Second on 2/16.  Getting ready for the summer.  #dutchsprings #aerialpark #aquapark #bethlehem #vaccine #scuba #scubadiving @ Dutch Springs https://t.co/XK9VXh95xn,https://twitter.com/DutchSprings/status/1351602904206106628,Mon Jan 12 19:19:04 +0000 2009,18911369,false,The largest inland SCUBA diver's amusement park,100,1344,746,66,"Bethlehem, PA",DutchSprings,DutchSprings,5094,,http://www.dutchsprings.com,false
"-73.89842097,40.64068857",Tue Jan 19 18:39:28 +0000 2021,,,https://www.swarmapp.com/c/fWoTmXFiOzP,0,1351600176851542022,,,,en,"Brooklyn, NY",false,,0,,,"<a href=""http://foursquare.com"" rel=""nofollow"">Foursquare</a>","With mom as she gets the first dose of the COVID vaccine! (@ Canarsie High School in Brooklyn, NY) https://t.co/GAzGEy75tM",https://twitter.com/SeamusCampbell/status/1351600176851542022,Wed Mar 18 01:20:24 +0000 2009,24999101,false,"Personal acct, Politico, Nerdfighter, Techie, NYer, @XavierHS, @FordhamNYC, and @GSPMgwu Alum.

Opinions are my own. RTs mean nothing. Has fun taking on trolls.",952,1358,1304,45,"Brooklyn, NY",Seamus Campbell,SeamusCampbell,30955,,http://seamuscampbell.nyc,false
"1.2977,52.6292",Tue Jan 19 18:56:57 +0000 2021,guitarteacherlife guitarteacher norwich norfolk homesweethome workingfromhome alcove mylittlealcove desksetup desk onlineguitarclasses,,https://www.instagram.com/p/CKPMdd_sPzG/?igshid=1ocluxli325w1,0,1351604575942406145,,,,en,"Norwich, England",false,,1,,,"<a href=""http://instagram.com"" rel=""nofollow"">Instagram</a>","My little alcove!
Messy yes but just how I like it!
#guitarteacherlife #guitarteacher #norwich #norfolk #homesweethome #workingfromhome #alcove #mylittlealcove #desksetup #desk #onlineguitarclasses @ Norwich, Norfolk https://t.co/iaW13KgOrw",https://twitter.com/cramoguitar/status/1351604575942406145,Thu Jun 23 09:58:23 +0000 2011,322533792,false,Guitar teacher from Norwich. Check out my Youtube videos here https://t.co/yIp386JrZt,10464,203,841,6,"Norwich, England",Paul Crame,cramoguitar,2478,,http://www.guitarlessonsnorwich.com,false
"-123.2624,44.5636",Tue Jan 19 18:52:39 +0000 2021,coronavirusvacccine thelifeofamother beautifulyoukathleen,,https://www.instagram.com/p/CKPKtq5Bz20kh1dbUdHofvXMb3sjmlTnSDQiOg0/?igshid=xym03s0b9cce,0,1351603496555057160,,,,en,"Corvallis, OR",false,,0,,,"<a href=""http://instagram.com"" rel=""nofollow"">Instagram</a>",California friends... some great information here for your vaccines. 💗 Help those who need it please. Thank you. #coronavirusvacccine #thelifeofamother #beautifulyoukathleen https://t.co/TYG5ZY7OX0,https://twitter.com/katbite/status/1351603496555057160,Thu May 14 17:12:39 +0000 2009,40037566,false,Savvy Curls Curling Headband. You'll love it. $2.00 discount. Please use CLIENT CODE: kats1  https://t.co/SFU8tdu3A4,2823,264,391,14,"Pre: 33.331431,-111.72882",Kathleen L. Shelfer,katbite,12601,,http://www.katbite.wordpress.com,false
"120.97308,14.22414",Tue Jan 19 18:19:57 +0000 2021,SoloVision covid_19 maskup universe WiseKing,,https://www.instagram.com/p/CKPIObmB_2l/?igshid=11dtdr3kjr1pf,0,1351595264465723393,,,,en,"Silang, Rehiyon ng CALABARZON",true,,0,,,"<a href=""http://instagram.com"" rel=""nofollow"">Instagram</a>",#SoloVision Be calm and obey all the safety protocols. This one too shall pass. #covid_19 is alive and working. #maskup and protect yourself and the #universe  #WiseKing @ 𝙒𝙀𝘼𝙍 𝙔𝙊𝙐𝙍 𝙈𝘼𝙎𝙆 https://t.co/9vWyQv4vti,https://twitter.com/iamsolovision/status/1351595264465723393,Wed Oct 13 05:32:48 +0000 2010,202047962,false,"Digitally, I'm the voice of #Elmina - Central Region.     || Educationist || Digital Marketer || Visionary ||",1087,932,3023,17,Ghana,SoloVision - Digital Marketer on Facebook,iamsolovision,27065,,http://linktr.ee/solovision,false
"-111.95062191,33.39610197",Tue Jan 19 18:39:37 +0000 2021,,,http://CircuitSpecialists.com https://www.swarmapp.com/c/b8st3D89z2u,0,1351600214596005891,,,,en,"Tempe, AZ",false,,0,,,"<a href=""http://foursquare.com"" rel=""nofollow"">Foursquare</a>","Working from home today (@ https://t.co/PmfOlLDRe1 in Tempe, AZ) https://t.co/2sKPKsalIK",https://twitter.com/KOA789/status/1351600214596005891,Wed Dec 31 05:22:42 +0000 2008,18499969,false,,18,220,251,7,"Chandler, AZ",Chandler AZ Weather,KOA789,181610,,,false
"-80.07418,26.46437",Tue Jan 19 17:58:47 +0000 2021,homeoffice wfh work tuesday feelslikemonday taxes payrollcompany employmentagemcy staffing agencylife,,https://www.instagram.com/p/CKPFzfalHgN/?igshid=1ppp983yic0gq,0,1351589937422893057,,,,en,"Delray Beach, FL",false,,0,,,"<a href=""http://instagram.com"" rel=""nofollow"">Instagram</a>","Emailing our entire team W2 or 1099 Tax Forms for @balancesolutiongroup! 

#homeoffice #wfh #work #tuesday #feelslikemonday #taxes #payrollcompany #employmentagemcy #staffing #agencylife @ Delray Beach, Florida https://t.co/80oOyEtPAy",https://twitter.com/KimmieBBags/status/1351589937422893057,Tue Mar 10 14:13:38 +0000 2009,23595620,false,All things Kimmie B!,1444,895,724,96,"Hollywood, FL",Kimmie B.,KimmieBBags,18785,,http://www.kimmiebbags.com,false
"11.26094,47.44189",Tue Jan 19 18:26:48 +0000 2021,quarantine cat catlife catsofinstagram misternibbles lazy,,https://www.instagram.com/p/CKPJA0Mlq-T/?igshid=drzez4m164ox,0,1351596991478788096,,,,en,"Mittenwald, Deutschland",false,,0,,,"<a href=""http://instagram.com"" rel=""nofollow"">Instagram</a>",#quarantine be like ... #cat #catlife #catsofinstagram #misternibbles #lazy @ Mittenwald https://t.co/yPMowJkiWv,https://twitter.com/DJIGSAW/status/1351596991478788096,Tue Mar 24 16:14:46 +0000 2009,26265830,false,"Also check my ""regular"" homepage at https://t.co/EAf4z8cXRv or visit my Facebook page! Full BIO is on my Soundcloud profile 🎧",17,110,305,5,Mittenwald,DJIGSAW,DJIGSAW,7531,,http://soundcloud.com/djigsaw,false
"-84.1562,33.0531",Tue Jan 19 18:17:26 +0000 2021,covidvacccine herdimmunity,,https://www.instagram.com/p/CKPH8JhF_eeMfOOb-wUQF_4RzIF9MX_kceN1Ho0/?igshid=bywh1e8o5dea,1,1351594633688723458,,,,en,"Barnesville, GA",false,,0,,,"<a href=""http://instagram.com"" rel=""nofollow"">Instagram</a>","Doing my part to get to that herd immunity we need in the states. If you haven’t gotten it done and are able, please take the 20 mins it takes to get it done. #covidvacccine #herdimmunity https://t.co/Q3ix63L4TV",https://twitter.com/FTKong/status/1351594633688723458,Mon Dec 12 05:22:31 +0000 2011,434680721,false,"Playing the ball as it lies, No other way to get down! Swing Tips with Freddie Kong, Forum Leader @Hackersparadise!",3738,550,442,31,O-Town,The_Kong,FTKong,11557,,http://www.thehackersparadise.com,false
"-79.7164011,43.7742911",Tue Jan 19 18:08:03 +0000 2021,India NEWS,,http://dlvr.it/Rqvpjj,0,1351592270395392000,,,,en,"Brampton, Ontario",false,,1,,,"<a href=""https://dlvrit.com/"" rel=""nofollow"">dlvr.it</a>",Expert panel recommends Phase 1 trial of nasal Covid-19 vaccine: The Subject Expert Committee (SEC) of the Central Drugs Standard Control Organisation (CDSCO) on Tuesday recommended Bharat Biotech’s intranasal vaccine for coronavirus for… https://t.co/cSBSJ9dDca #India #NEWS,https://twitter.com/Weeklyvoice/status/1351592270395392000,Tue Mar 30 17:43:21 +0000 2010,127943720,false,Most Trusted News in North America’s South Asian Communities Since 1997,172,498,299,11,Toronto,Weekly Voice,Weeklyvoice,37048,,http://www.Weeklyvoice.com,false
"-112.0777,33.4482",Tue Jan 19 18:11:44 +0000 2021,Snoopy LoungePants,,https://www.instagram.com/p/CKPHSHVjhhzUzXhxSryCmp8uEO1TE_a5TNLzNE0/?igshid=1eguxw3sb8kud,1,1351593196388839431,,,,en,"Phoenix, AZ",false,,0,,,"<a href=""http://instagram.com"" rel=""nofollow"">Instagram</a>","Working from home attire. 
#Snoopy socks &amp; #LoungePants 

These are the most comfy lounge/pj pants. I need more!!! @ Phoenix, Arizona https://t.co/Eoi5a3ialv",https://twitter.com/BindyShay/status/1351593196388839431,Tue Mar 10 00:19:31 +0000 2009,23529350,false,"And now these 3 remain: faith, hope, & love. But the greatest of these is love. 
1 Cor 13:13",159413,784,551,10,"Phoenix, AZ",BindyShay 🌻🏳️‍🌈,BindyShay,41911,,,false
"-122.45780103,37.66049194",Tue Jan 19 18:05:15 +0000 2021,,,,0,1351591566876372995,,,,en,"South San Francisco, CA",,,0,,,"<a href=""http://tapbots.com/tweetbot"" rel=""nofollow"">Tweetbot for iΟS</a>","If you had a positive test and a month later died of a heart attack, you are counted as a pandemic death. The obsession with origin tracing has made us use too large of a broom to collect these statistics. They are fundamentally flawed.",https://twitter.com/ReasonablePete/status/1351591566876372995,Thu Apr 30 06:18:51 +0000 2009,36610807,false,I’d probably be dead if I was basic. SCIENTIA,9691,430,314,11,San Francisco,NEIL THEGRASS TYSON,ReasonablePete,51667,,http://NASA.gov,false
"-95.37902069,42.02453995",Tue Jan 19 18:39:28 +0000 2021,,,https://www.swarmapp.com/c/cBZ0pl3MpHA,0,1351600178017562629,,,,en,"Iowa, USA",false,,0,,,"<a href=""http://foursquare.com"" rel=""nofollow"">Foursquare</a>","Tested positive for COVID!! (@ New Crawford County Memorial Hospital in Denison, IA) https://t.co/CLTNZEJ9wo",https://twitter.com/onlychild30ish/status/1351600178017562629,Mon Oct 06 14:55:55 +0000 2008,16614585,false,Technical geek that's been saving the world one PC at a time for the past 25 years,2852,39,115,2,"Denison, IA",onlychild30ish,onlychild30ish,19532,,,false
"-82.40371209,34.83977824",Tue Jan 19 18:42:15 +0000 2021,,,https://www.swarmapp.com/c/7w57nTnKNQA,0,1351600878776700934,,,,en,"Greenville, SC",false,,0,,,"<a href=""http://foursquare.com"" rel=""nofollow"">Foursquare</a>","10am on a Tuesday = no wait for a COVID test. Works for me. (@ South Carolina Department of Health and Environmental Control (DHEC) in Greenville, SC) https://t.co/rSjJXAr4uM",https://twitter.com/ChrisStrub/status/1351600878776700934,Sun Feb 21 01:10:55 +0000 2010,116060961,false,"As @GivingDayGuy, I produce/host live video for massive nonprofit fundraisers ✈️🇺🇸 - Bookable for 2022, DMs Open▪️ CEO, @IAmHereLLC ▪️ @50States100Days 📚",98632,16843,1329,1182,"#FlyTheWStudio, Greenville SC",Chris Strub 🇺🇦,ChrisStrub,145850,,http://www.teamstrub.com,true
"-87.687672,41.975166",Tue Jan 19 18:42:31 +0000 2021,,,https://www.instagram.com/p/CKNsR_RJweP/?igshid=1legqrhlbsknk,0,1351600945227034632,,,,en,"Chicago, IL",false,,0,,,"<a href=""http://instagram.com"" rel=""nofollow"">Instagram</a>",At the Cook County Jail standing for brothers and sisters to be provided with proper medical treatment from COVID 19 @ Lincoln Square https://t.co/Xs9TNqcR4B,https://twitter.com/Prisonspeaks/status/1351600945227034632,Thu Nov 25 21:24:35 +0000 2010,219780324,false,Mark A. Clements was sentence to die in prison. he was tortured to confess to a crime he did not commit. Mark can be reached at 847 276 1382.,85580,2119,4849,36,"Illinois, USA",Mark A. Clements,Prisonspeaks,38149,,http://www.nodeathpenalty.org,false
"-117.21884,32.875988",Tue Jan 19 18:36:11 +0000 2021,,,https://www.swarmapp.com/c/6b7s6kdbB5k,0,1351599352473669633,,,,en,"San Diego, CA",false,,0,,,"<a href=""http://foursquare.com"" rel=""nofollow"">Foursquare</a>","I'm at UCSD Health: Drive-Up COVID-19 Testing in San Diego, CA https://t.co/YvPXmqVup2",https://twitter.com/Sabrinalovesit/status/1351599352473669633,Tue Jun 30 03:08:04 +0000 2009,52283921,false,I own Brushed...by Sabrina on 4283 Mission Blvd. Suite 5 sd ca 92109. I offer airbrush tanning and salon services. (619) 787-5161 Come check me out:),44,240,212,11,on the beach in pacific beach,sabrina orchid,Sabrinalovesit,22878,,,false
"-0.1989,51.542",Tue Jan 19 18:45:07 +0000 2021,VisitPortobello ShopSafely WearAMask HandsFaceSpace,https://twitter.com/visitportobello/status/1351601600914194437/photo/1,,3,1351601600914194437,,,,en,"Brent, London",false,,1,,,"<a href=""https://www.hootsuite.com"" rel=""nofollow"">Hootsuite Inc.</a>","If you #VisitPortobello to buy essential items, please #ShopSafely: wash or sanitise your hands regularly for at least 20 seconds, wear a face covering - even outdoors, and stay at least 6 feet away from those outside your own household at all times. #WearAMask #HandsFaceSpace https://t.co/y5uosqoeZm",https://twitter.com/visitportobello/status/1351601600914194437,Mon Jul 05 15:54:35 +0000 2010,163115921,false,"OFFICIAL news & information about 150+ year old Portobello & Golborne Market in Ladbroke Grove & Notting Hill, London W10 & W11 #visitportobello #LYLM2020",11857,8416,1911,193,"London W11 1AN, England",Portobello & Golborne Market,visitportobello,25534,,https://linktr.ee/VisitPortobello,false
"-88.02422482,41.88760376",Tue Jan 19 17:53:06 +0000 2021,,,,4,1351588508281020417,,,,en,"Lombard, IL",,,0,,,"<a href=""http://tapbots.com/tweetbot"" rel=""nofollow"">Tweetbot for iΟS</a>",Corporate security admin lockdown for laptops is just a never-ending headache when you have development responsibilities. The policies are always designed around folks who don’t need to install new software regularly or tinker with environment variables and they’re always wrong.,https://twitter.com/crimsonruari/status/1351588508281020417,Tue Jul 28 20:50:42 +0000 2009,61015432,false,"International Bread Policy pundit. Amateur smith, folk musician, baker, photographer, dancer, writer. Burned Out Con Organizer. Tech Generalist. He/Him",80527,729,671,28,"Lombard, IL",Jacob Dawson,crimsonruari,134538,,,false
"-0.269321,51.62636",Tue Jan 19 18:39:27 +0000 2021,,,https://www.swarmapp.com/c/0JJALi2rZo9,0,1351600175219937286,,,,en,"Barnet, London",false,,0,,,"<a href=""http://foursquare.com"" rel=""nofollow"">Foursquare</a>","Mums first vaccine 💉 jab (@ Cullimore Pharmacy in Edgware, England) https://t.co/KWrMyYyoqO",https://twitter.com/aroundthehouses/status/1351600175219937286,Wed Feb 18 12:37:13 +0000 2009,21191528,false,A realist not a fantasist although I read fantasy books. All comments are my own. I go against the grain and don’t just agree with people! #beingme #photography,30318,11314,9555,235,Hertfordshire,MarksMusings,aroundthehouses,84166,,,false
"-111.49259583,33.10290527",Tue Jan 19 19:17:00 +0000 2021,,,https://twitter.com/MarlowNYC/status/1351598671897518081,0,1351609621513793536,,,,en,"San Tan Valley, AZ",false,1351598671897518081,0,,,"<a href=""http://tapbots.com/tweetbot"" rel=""nofollow"">Tweetbot for iΟS</a>",Absolute garbage stance @tacobell. https://t.co/afaPpwrJFC,https://twitter.com/Sonikku_a2/status/1351609621513793536,Tue Jun 12 21:49:20 +0000 2018,1006654709325680641,false,Old ass nerd. | He/Him | 👉 Made the 'Hey Siri I’m Getting Pulled Over' Shortcut | Space! 🚀 | 🇺🇸🏳️‍🌈🏳️‍⚧️,4768,923,375,8,"San Tan Valley, AZ",🇺🇦 Robert Petersen,Sonikku_a2,61331,,https://www.reddit.com/r/shortcuts/comments/9huqiw/getting_pulled_over_by_police/,false
"-77.10905,17.9387",Tue Jan 19 18:07:56 +0000 2021,spinit spinitfraternity illuminuzspinit 20spinit jerryspinit jerryspinitvevo jerryspinitbookings laugh spinitnation fun vibes,,https://www.instagram.com/p/CKPGlG6BdP1/?igshid=rj3h6dkldhlq,0,1351592242818002945,,,,en,Jamaica,false,,0,,,"<a href=""http://instagram.com"" rel=""nofollow"">Instagram</a>",Me after taking the vaccine 💉 🤣🤣🤣🤣🤣🤣🤣🤣🤣🤣🤣🤣🤣 🔥🔥🔥🔥🔥🔥👉🔺👈 #spinit #spinitfraternity #illuminuzspinit #20spinit #jerryspinit #jerryspinitvevo #jerryspinitbookings #laugh #spinitnation #fun #vibes https://t.co/QZ3g31Fb9h,https://twitter.com/jerryspinit/status/1351592242818002945,Sun Feb 13 05:48:09 +0000 2011,251469577,false,Support my music today! You will be listening to my music more often in the near future! 💯Check who I am signed with💯👉🔺👈 #spinit,1001,807,788,5,"Kingston, Jamaica",jerryspinit_spinitfraternity,jerryspinit,4953,,https://music.apple.com/us/album/rich-life-single/1557826405,false
"-3.1867,51.4853",Tue Jan 19 18:40:31 +0000 2021,cupcakesofinstagram cakesofinstagram cardiffcupcakesdelivered cardiffcupcakes wedeliverhappiness cardiff cardiffbay pinkcupcakes lockdown lockdownbirthday lockdowngifts,,https://www.instagram.com/p/CKPKk-FgUb7/?igshid=1lm60sw291yst,0,1351600442669748229,,,,en,"Cardiff, Wales",false,,0,,,"<a href=""http://instagram.com"" rel=""nofollow"">Instagram</a>","Today's gift boxes done and dusted 
#cupcakesofinstagram #cakesofinstagram #cardiffcupcakesdelivered #cardiffcupcakes #wedeliverhappiness #cardiff #cardiffbay #pinkcupcakes #lockdown #lockdownbirthday #lockdowngifts https://t.co/9Xl5ChsDge",https://twitter.com/CupCakeCardiff/status/1351600442669748229,Mon Mar 21 19:11:23 +0000 2011,269953555,false,"Producer of small batch baked goods. We bake great Cupcakes, Cronuts & Brownies. Food Awards Wales 2017 Finalist. 2 x Great Taste Award winner 2021.",2318,3758,444,45,Cardiff,Cup & Cake Bakery,CupCakeCardiff,6138,,http://www.cupandcakebakery.co.uk,false
"-104.79699552,38.89199018",Tue Jan 19 18:35:57 +0000 2021,,,https://www.swarmapp.com/c/5DgkF6kGXy7,0,1351599292826472448,,,,en,"Colorado Springs, CO",false,,0,,,"<a href=""http://foursquare.com"" rel=""nofollow"">Foursquare</a>","Moving out.  Damn Covid (@ University Of Colorado Colorado Springs in Colorado Springs, CO) https://t.co/Yia7rofVAi",https://twitter.com/bigbroncosfan/status/1351599292826472448,Thu Mar 29 19:45:42 +0000 2007,2884161,false,"Colorado native. I love my family, the Broncos & Rockies but not in that order. I love all things digital. Please support my son’s fight against leukemia.",63106,2190,4744,121,"Boulder, CO","Hi, I am Daniel",bigbroncosfan,38218,,https://www.gofundme.com/uu8x9-help-jack-fight-cancer,false
