coordinates,created_at,hashtags,media,urls,favorite_count,id,in_reply_to_screen_name,in_reply_to_status_id,in_reply_to_user_id,lang,place,possibly_sensitive,quote_id,retweet_count,retweet_id,retweet_screen_name,source,text,tweet_url,user_created_at,user_id,user_default_profile_image,user_description,user_favourites_count,user_followers_count,user_friends_count,user_listed_count,user_location,user_name,user_screen_name,user_statuses_count,user_time_zone,user_urls,user_verified
"7.47641088,9.0767482",Sat Jan 16 14:57:33 +0000 2021,talesofforeva2021,,https://www.instagram.com/p/CKHCrU7FEke/?igshid=19qvgu6fhjnc6,0,1350457166730326018,,,,en,"Abuja, Nigeria",false,,0,,,"<a href=""http://instagram.com"" rel=""nofollow"">Instagram</a>","I am not a ninja. Covid-19 is real but more real is our victory by The Blood. We are set to 🔥 up everywhere for #talesofforeva2021 The DISRUPTOR styled by @baldonclothiers @ Wuse II, Abuja https://t.co/yGhF2A7iHg",https://twitter.com/McFrank1010/status/1350457166730326018,Mon Aug 11 16:12:02 +0000 2014,2739994341,false,"Professional, Classy & Prepared Compere/Emcee.Director of Ceremonies.For Bookings: 08068216935, 08187194155",2273,292,797,0,"Federal Capital Territory, Nig",Frank Oyakhilome ,McFrank1010,4154,,,false
"-2.14492192,53.43776961",Sat Jan 16 13:40:34 +0000 2021,,,https://www.instagram.com/p/CKG53mfBV27HjtCwxtXKc2ojftdGJfLmWtWots0/?igshid=8p9n1tpi1t2b,1,1350437795349852160,,,,en,"North West, England",false,,0,,,"<a href=""http://instagram.com"" rel=""nofollow"">Instagram</a>",Lockdown walks.......because we are going mental!!!!! 🐶🐴🌳🍂🌧🧤🧣🥾 @ Reddish Vale Country Park https://t.co/WYQDG68S5c,https://twitter.com/loznethan/status/1350437795349852160,Tue Mar 31 22:04:59 +0000 2009,27975524,false,🧘🏼‍♀️ mets un peu d'amour dans ton coeur 🧘🏼‍♀️,1569,202,411,1,"Stockport, England",EL,loznethan,5136,,,false
"0.30351,51.62065",Sat Jan 16 13:48:11 +0000 2021,checkin safe staywell stayindoors lockdown uk wet cold snow januaryblues,,https://www.instagram.com/p/CKG6vTCBZfp/?igshid=kx8fi9ixwjsp,12,1350439708229296131,,,,en,"Brentwood, East",false,,1,,,"<a href=""http://instagram.com"" rel=""nofollow"">Instagram</a>","As good as it get's this cold, wet lockdown Saturday.. hope everyone is keeping well &amp; safe ❤️ #checkin #safe #staywell #stayindoors #lockdown #uk #wet #cold #snow #januaryblues @ Brentwood, UK https://t.co/Qmjsl4LRda",https://twitter.com/curvybridesAl/status/1350439708229296131,Sat Apr 09 07:26:40 +0000 2011,279428797,false,TV Presenter,1727,1847,480,8,"Brentwood, Essex",Alison Law,curvybridesAl,2287,,,false
"0.595,50.856",Sat Jan 16 14:26:41 +0000 2021,lockdown hastingsincolour sea hastings,,https://www.instagram.com/p/CKG_JZfhSR0/?igshid=aobc9s6lhzxh,0,1350449399596519426,,,,en,"Hastings, England",false,,0,,,"<a href=""http://instagram.com"" rel=""nofollow"">Instagram</a>",A Rough Sea #lockdown #hastingsincolour #sea-side #hastings @ Rock-a-Nore https://t.co/lOU2B7BM64,https://twitter.com/alwaysred/status/1350449399596519426,Thu Feb 26 22:31:43 +0000 2009,22072741,false,"My own view from the very bottom, but trying to look up : RT does not represent opinion, it’s always your choice!",3071,502,639,79,The Coast,Alwaysred,alwaysred,48696,,,false
"-75.06897268,40.16216216",Sat Jan 16 14:20:33 +0000 2021,,,https://twitter.com/DrTomFrieden/status/1350095968834899968,0,1350447855111172102,LMorelandPatch,1350441917587329025,161057913,en,PHILADELPHIA,false,1350095968834899968,0,,,"<a href=""http://www.tweetcaster.com"" rel=""nofollow"">TweetCaster for Android</a>",@LMorelandPatch cool. let's all go eat inside olive garden https://t.co/arGIQszKeY,https://twitter.com/PhillyPartTwo/status/1350447855111172102,Mon Jan 25 21:49:08 +0000 2010,108416118,false,"Writer, marketer, broadcaster, Philadelphian, Orangeman, liberal.
TV, music, grammar judger.
PHL SYR ALB ICT CHI DC BOS
@apartmentguide @rentdotcom @visitphilly",22728,1012,678,76,PA Congressional District 04,Michael MPH 🇺🇸 ✌🏼,PhillyPartTwo,91081,,https://www.instagram.com/phillyparttwo,false
"-1.80027,51.06954",Sat Jan 16 15:09:51 +0000 2021,,,https://www.instagram.com/p/CKHEFgsDXlw/?igshid=1ka55rxymsq2y,0,1350460263586271232,,,,en,"Salisbury, England",false,,0,,,"<a href=""http://instagram.com"" rel=""nofollow"">Instagram</a>","Blow dried my hair and put on some makeup this morning.... but we’re still on Lockdown here in the UK. 😂 
So since I cannot go out and have fun, I sat down and filmed another video for youtube :) @ Salisbury, Wiltshire https://t.co/cGSuZ2iNpG",https://twitter.com/TotallyTony/status/1350460263586271232,Wed Jun 24 15:17:44 +0000 2009,50332423,false,"Cosmetics Enthusiast & Occasional Vlogger 
Daily Story Posts on Instagram: @totallytonyinsta",7251,359,679,9,"South West, England",TotallyTony,TotallyTony,6958,,https://youtu.be/59lcIVTju5g,false
"-73.5973,45.4812",Sat Jan 16 15:12:13 +0000 2021,snowmageddon lockdown winter snowstorm missyou taichi chill westmountpark capturethemoment inthistogether wintersports,,https://www.instagram.com/p/CKHDmpqnqXR/?igshid=usxiwdxvu0v,1,1350460855842865159,,,,en,"Westmount, Québec",false,,1,,,"<a href=""http://instagram.com"" rel=""nofollow"">Instagram</a>",I miss touching you. Only the snowflakes ❄️ touch my face and ruin my mascara. 😢 #snowmageddon #lockdown #winter #snowstorm #missyou #taichi #chill #westmountpark #capturethemoment #inthistogether #wintersports https://t.co/fwjNdIdRmY,https://twitter.com/esperanza4hire/status/1350460855842865159,Wed Dec 10 05:46:38 +0000 2008,18013411,false,"Humanitarian junkie,TEDx speaker,changing the world with he(art)Founder  @skateboard4hope Act like you give a fuck https://t.co/vIP4NsgtsA",8069,1392,2916,78,"Montreal, Quebec, Canada",Betty Esperanza,esperanza4hire,18288,,https://linktr.ee/skateboardsforhope,false
"-3.2345681,51.56832883",Sat Jan 16 12:13:03 +0000 2021,diptyque anthropologie workfromhome workfromhomelife saturday saturdayvibes saturdaymorning,,https://www.instagram.com/p/CKGv2oJg2VB/?igshid=a0p3tlz2f69r,0,1350415769373433856,,,,en,"Caerphilly, Wales",false,,0,,,"<a href=""http://instagram.com"" rel=""nofollow"">Instagram</a>","Desk life complete thanks to @diptyque  &amp; @anthropologie 
Home working your way 💫
#diptyque #anthropologie #workfromhome #workfromhomelife #saturday #saturdayvibes #saturdaymorning @ Home https://t.co/sj2dqz5iTh",https://twitter.com/DionneLS/status/1350415769373433856,Sat Feb 05 15:18:44 +0000 2011,247783267,false,Marketing Guru To The Stars (Ish). Do'er of STUFF,8211,344,627,6,"Here, there & home",Dionne Sylvester,DionneLS,10892,,,false
"-80.3019894,43.1668169",Sat Jan 16 12:47:04 +0000 2021,,,https://twitter.com/DavidBegnaud/status/1350306766811086851,0,1350424328651866112,,,,en,"Brantford, Ontario",false,1350306766811086851,0,,,"<a href=""http://tapbots.com/tweetbot"" rel=""nofollow"">Tweetbot for iΟS</a>",Why do republicans want their constituents to die? https://t.co/mdDIZurVp3,https://twitter.com/aricguite/status/1350424328651866112,Sun Oct 04 21:06:09 +0000 2009,79830214,false,"I'm a photographer based in Toronto, ON. I like my kids, streetcars, and my beagle Jack. Expect photos of all three.#BLM",277,502,774,18,"Leslieville, Toronto",Aric Guité,aricguite,13780,,http://www.aricguite.com,false
"-0.1094,51.5141",Sat Jan 16 13:42:25 +0000 2021,socialdistancing,,https://www.instagram.com/p/CKG6E6BJPnT5mrnpRWlZjiNPRPJnKRTBcRN1VE0/?igshid=8duvwbvkdrzh,1,1350438258543628290,,,,en,"City of London, London",false,,0,,,"<a href=""http://instagram.com"" rel=""nofollow"">Instagram</a>","There she goes, breaking #socialdistancing rules!! Honestly.... @ London, United Kingdom https://t.co/QyiINiSaot",https://twitter.com/Penmantration/status/1350438258543628290,Sun Oct 10 22:06:59 +0000 2010,201024228,false,,207,73,202,0,London,Colin Penman,Penmantration,381,,,false
"0.6517,51.5485",Sat Jan 16 13:12:31 +0000 2021,norahjones singer singing video cover music love lovetosing microphone dontknowwhy lockdown singingcover singingvideos,,https://www.instagram.com/p/CKGtKlnnvNm/?igshid=44cg6b8jye6c,2,1350430733018427392,,,,en,"Southend-on-Sea, East",false,,1,,,"<a href=""http://instagram.com"" rel=""nofollow"">Instagram</a>","First video with my new equipment - link in bio for full video ❤️
-
-
-
#norahjones #singer #singing #video #cover #music #love #lovetosing #microphone #dontknowwhy #lockdown #singingcover #singingvideos @ Leigh-on-Sea https://t.co/ncdux0yZyB",https://twitter.com/eleanorahudsonx/status/1350430733018427392,Mon Oct 13 13:58:19 +0000 2014,2827489666,false,"Singer, dancer & actress. Recording artist. Represented by @JNorthAssociate",3164,508,1101,3,,Eleanor Hudson,eleanorahudsonx,1778,,http://www.spotlight.com/6573-5644-5128,false
"-0.0833333,51.0333",Sat Jan 16 12:11:39 +0000 2021,foodporn soup bullietbourbon,,https://www.instagram.com/p/CKGvsVGnFAd/?igshid=6v5oy9j8t3w7,0,1350415415843844096,,,,en,"South East, England",false,,0,,,"<a href=""http://instagram.com"" rel=""nofollow"">Instagram</a>",Finding creative ways to drink during lockdown. Bourbon French Onion Soup with Smoked @gubbeen #foodporn #soup #bullietbourbon @ Ardingly https://t.co/4F7UKrS66V,https://twitter.com/ForageSussex/status/1350415415843844096,Tue Apr 21 10:14:42 +0000 2009,33865538,false,"Foraging, Cooking, and Photography enthusiast. Eat something wild every day. Do something wild every day.",134,1791,175,49,"High Weald, Sussex",David Fennings,ForageSussex,3001,,http://www.foragesussex.com,false
"-79.3872,43.648",Sat Jan 16 14:34:31 +0000 2021,covidalert covid pandemiclife,,https://www.instagram.com/p/CKHAC2bHDEl/?igshid=1l6l1d8biu4jv,2,1350451369384292357,,,,en,"Toronto, Ontario",false,,0,,,"<a href=""http://instagram.com"" rel=""nofollow"">Instagram</a>","So this popped up on my phone when I was just drifting off to sleep last night. So fun! Time to get tested again. #covidalert #covid #pandemiclife @ Toronto, Ontario https://t.co/0CCtsqsuz1",https://twitter.com/PattyInHD/status/1350451369384292357,Tue Jun 05 06:28:31 +0000 2012,599880961,false,Founder/editor online intersectional feminist mag @NastyWomenPress. 🏳️‍🌈 Freelance writer married to an nb hottie. YXE ➡️ YVR ➡️ YYZ. she/her,43691,704,4538,29,"Toronto, Ontario",Patty’s keeping her mask on indefinitely,PattyInHD,15366,,https://linktr.ee/pattyinhd,false
"103.84,1.3",Sat Jan 16 11:25:46 +0000 2021,,,https://twitter.com/KKMPutrajaya/status/1350393278688972802,1,1350403871617679362,,,,en,"中区, 新加坡",true,1350393278688972802,0,,,"<a href=""http://www.samruston.co.uk"" rel=""nofollow"">Flamingo for Android</a>",My god 4k?! Like UHD TV isit?! https://t.co/31gvsrTLKP,https://twitter.com/ecownomics/status/1350403871617679362,Wed Sep 02 04:11:39 +0000 2009,70879081,false,You have 2 cows. You sell them to me and buy my bull.,566,435,540,3,Singapore,Yello yello dirty fello,ecownomics,37347,,,false
"-82.37519979,33.21930546",Sat Jan 16 13:56:51 +0000 2021,,,https://www.instagram.com/p/CKG7u1nJ9wz/?igshid=r30kly7rug7q,0,1350441892056424455,,,,en,"Georgia, USA",false,,0,,,"<a href=""http://instagram.com"" rel=""nofollow"">Instagram</a>","Administering the Moderna COVID-19 mRNA vaccine earlier this week to patients at Wrens Physician Group in Wrens, GA, under the direction of my wonderful Med-Peds attending physician, Dr. Nancy Cox, MD. https://t.co/PAgt53eFXE",https://twitter.com/ReynoldsJackson/status/1350441892056424455,Sun Jul 17 01:36:02 +0000 2011,336858324,false,Med-Peds Resident Physician @ University of Arizona College of Medicine | Insatiable Autodidact | Musician | Urbanist | Vegan,8665,183,158,8,"Phoenix, AZ, USA","Jackson David Reynolds, MD",ReynoldsJackson,32132,,http://tinyurl.com/JDR1994,false
"-74.0064,40.7142",Sat Jan 16 12:17:05 +0000 2021,,,https://www.instagram.com/p/CKGwUFvBsNV/?igshid=c9oaeo0iva3d,0,1350416785443586049,,,,en,"Manhattan, NY",false,,0,,,"<a href=""http://instagram.com"" rel=""nofollow"">Instagram</a>",Just posted a photo @ Quarantine https://t.co/iPWPbW6pAS,https://twitter.com/officiallipgame/status/1350416785443586049,Wed Nov 19 16:15:27 +0000 2008,17488879,false,"Film Writer/Director/Producer. Author, Put Your Dreams First. Award-winning creative. 6-time Voice Arts Award nominee. Viral # inventor. IG: @officiallipgame",4147,4854,2665,164,Dena/Yay Area/BKNY/Worldwide,Thembisa S. Mshaka,officiallipgame,92929,,https://www.facebook.com/Thembisa-S-Mshaka-167818647051051/?fref=ts&hc_location=ufi,false
"0.01617302,51.58344855",Sat Jan 16 11:43:41 +0000 2021,walk lockdown snaresbrook london chill cold winter beany asos skinnyjeans insta instagay gayinsta lgbt gaylondon,,https://www.instagram.com/p/CKGsfecnFRG/?igshid=j4ibn8331wgz,0,1350408377021693953,,,,en,"Ilford, London",false,,0,,,"<a href=""http://instagram.com"" rel=""nofollow"">Instagram</a>","❄️☕️ 🤷‍♂️
•
•
•
•
•
#walk #lockdown #snaresbrook #london #chill #cold #winter #beany #asos #skinnyjeans #insta #instagay #gayinsta #lgbt #gaylondon @ Snaresbrook Eagle Pond https://t.co/egE0YBNDvM",https://twitter.com/ScottyDavies91/status/1350408377021693953,Tue Sep 15 23:24:38 +0000 2009,74589063,false,"Singer, Actor, Assistant Venue Manager Barbican. 🍸💋",2895,384,298,5,"London, England",Scott Davies,ScottyDavies91,1379,,,false
"-1.38906812,53.81135163",Sat Jan 16 13:56:47 +0000 2021,golf ping pinggolf newgolf,,https://www.instagram.com/p/CKG7ucVF2yZ/?igshid=1gyt4c7ur2wny,0,1350441875623333891,,,,en,"Yorkshire and The Humber, England",false,,0,,,"<a href=""http://instagram.com"" rel=""nofollow"">Instagram</a>",The latest @pingtour G425 driver coming very soon to @thegolfroomgarforth. Available for fitting as soon as lockdown is over! #golf #ping #pinggolf #newgolf @ The Golf Room Garforth https://t.co/GErjLa4cFk,https://twitter.com/thegolfroomGGC/status/1350441875623333891,Tue Oct 16 06:38:49 +0000 2018,1052086440706957312,false,The Golf Room is based at Garforth Golf Club in Leeds. Golf retail - Coaching - Custom fitting - Club repairs - TrackMan 4 - Indoor simulator - PXG North Hub,103,439,259,1,"Garforth, England ",The Golf Room | Garforth Golf Club,thegolfroomGGC,1458,,http://www.thegolfroomgarforth.co.uk,false
"-4.46744442,55.8113141",Sat Jan 16 13:16:32 +0000 2021,time lego harrypotter lockdown covid_19,,https://www.instagram.com/p/CKG3HYWroww/?igshid=twtrgaqjlm61,1,1350431745011830785,,,,en,"Scotland, United Kingdom",false,,1,,,"<a href=""http://instagram.com"" rel=""nofollow"">Instagram</a>",Here we go‼️ #time #lego #harrypotter #lockdown #covid_19 @ Gleniffer Braes https://t.co/biQIr4HAdo,https://twitter.com/Ryker5/status/1350431745011830785,Mon Jun 22 22:11:10 +0000 2009,49784915,false,Live long n prosper!,31132,250,651,12,"Paisley, Scotland",Ginger Nugget,Ryker5,10157,,,false
"101.68533359,2.74555949",Sat Jan 16 14:17:26 +0000 2021,staysafe stayathome kelantan pkp mco picsartedits picsart,,https://www.instagram.com/p/CKG-Fy0lYmK/?igshid=1o5okyxpcpy4i,0,1350447073032810496,,,,en,"Sepang, Selangor",false,,0,,,"<a href=""http://instagram.com"" rel=""nofollow"">Instagram</a>","These trying times, be a positive charge -- Lead &amp; Light the Way.

#staysafe #stayathome #kelantan #pkp #mco  #picsartedits #picsart #1601 #4029 @ Capsule Transit https://t.co/V7STUMuwb5",https://twitter.com/zee_yusoff/status/1350447073032810496,Sun Jun 06 07:26:48 +0000 2010,152554697,false,The Parliament of Tweets 🏴,9330,579,814,51,Sandakan,em_yusoff,zee_yusoff,20197,,,false
"29.5,-24",Sat Jan 16 11:26:21 +0000 2021,covid_19 doctor,,https://www.instagram.com/p/CKGqgm-Agy_/?igshid=2bqh5w1ovl40,0,1350404017629908992,,,,en,South Africa,false,,0,,,"<a href=""http://instagram.com"" rel=""nofollow"">Instagram</a>","Lets stay safe 

Hydrate
Take supplements 
#covid_19 -#doctor @ Limpopo https://t.co/2NMXJr0Wfo",https://twitter.com/tshidzi1/status/1350404017629908992,Sun Nov 14 18:11:25 +0000 2010,215707623,false,skin aesthetics & woman’s health        Instagram @drtshidzi,181,196,292,1,Thohoyandou,drtshidzi,tshidzi1,748,,,false
"-0.973,51.4541",Sat Jan 16 13:47:25 +0000 2021,covid_19 lockdownlife beard beardstyle pogonophile thisisme bigbloke,,https://www.instagram.com/p/CKG6p3uAkTFkv8FwCCMDUiaRtQ1Q1aHaWCbLms0/?igshid=1r00mknlg26af,0,1350439519103934464,,,,en,"Reading, England",false,,1,,,"<a href=""http://instagram.com"" rel=""nofollow"">Instagram</a>","Head shaved, showered, beard treated and no where to go. #covid_19 #lockdownlife #beard #beardstyle #pogonophile #thisisme #bigbloke @ Reading, England https://t.co/nHvOF9b62v",https://twitter.com/MattieClark/status/1350439519103934464,Thu Feb 05 21:19:17 +0000 2009,20189562,false,Excel guru. lover of music especially live. Collector and connoisseur of vinyl. Gooner through and through,1274,74,392,1,"Reading, Berkshire",Matt Clark,MattieClark,380,,,false
"-1.4667,53.3833",Sat Jan 16 11:32:08 +0000 2021,conceptualillustration covid19vacccine editorialillustration,,https://www.instagram.com/p/CKGrK5Xn9o-/?igshid=180sdlvdy6wr7,1,1350405470582829056,,,,en,"Sheffield, England",false,,0,,,"<a href=""http://instagram.com"" rel=""nofollow"">Instagram</a>","A conceptual illustration for the Covid-19 vaccines. 

#conceptualillustration 
#covid19vacccine 
#editorialillustration @ Sheffield https://t.co/n0EQWBQUBE",https://twitter.com/InspirebyKim/status/1350405470582829056,Sat Jul 25 17:16:34 +0000 2015,3293243941,false,Kimberley Kay. Author and Illustrator of Ski A to Z. Joy promoter. #inspirebykim #illustrator #authorillustrator #aoimember #skiatoz #skiing #ski #skiart,408,31,75,1,"Sheffield, England",Inspire by Kim,InspirebyKim,611,,http://www.inspirebykim.com,false
"-3.46456672,50.58070225",Sat Jan 16 11:53:02 +0000 2021,,,https://j.mp/38P4S5S,0,1350410731557056516,,,,en,"Dawlish, England",false,,0,,,"<a href=""https://dlvrit.com/"" rel=""nofollow"">dlvr.it</a>",Did we see a Christmas coronavirus spike? https://t.co/yEnYHQf5tP,https://twitter.com/Daily_DEVON/status/1350410731557056516,Fri May 04 13:43:22 +0000 2012,570841463,false,"Follow for up to the minute news and sport from the county of #Devon, UK",6,3398,1143,60,"Devon, UK",DEVON,Daily_DEVON,69071,,https://twitter.com/daily_devon,false
"-74.0064,40.7142",Sat Jan 16 13:32:11 +0000 2021,,,https://www.instagram.com/p/CKG46LGB9RZ/?igshid=gmhlwrccj9jr,2,1350435683660308483,,,,en,"Manhattan, NY",false,,0,,,"<a href=""http://instagram.com"" rel=""nofollow"">Instagram</a>","Woke up to family building a snowman back in Essex. After a week in quarantine I may have officially lost the plot!  Wall picture by 10yr old niece Isabella. @ New York, New York https://t.co/DOU44m43lU",https://twitter.com/twinnstweets/status/1350435683660308483,Thu Feb 19 18:54:44 +0000 2009,21327119,false,"Comments, views, rants, and reviews of my adventures living between the UK and USA - Two nations separated by a common language!",2791,476,1136,13,London/NYC ,Ian Twinn,twinnstweets,3993,,,false
"-75.06897268,40.16216216",Sat Jan 16 14:13:05 +0000 2021,racism coronavirus essentialworkers openschools openAmerica covid19,,https://twitter.com/danielas_bot/status/1349759559607443456,0,1350445977250000901,,,,en,PHILADELPHIA,false,1349759559607443456,0,,,"<a href=""http://www.tweetcaster.com"" rel=""nofollow"">TweetCaster for Android</a>",The overwhelming #racism of our response to #coronavirus is simply ghastly. The people most exposed as servers and drivers and factory hands and nurses and nannies and #essentialworkers are very much not the same color as those clamoring to #openschools &amp; #openAmerica. #covid19 https://t.co/oF8HwlIvQM,https://twitter.com/PhillyPartTwo/status/1350445977250000901,Mon Jan 25 21:49:08 +0000 2010,108416118,false,"Writer, marketer, broadcaster, Philadelphian, Orangeman, liberal.
TV, music, grammar judger.
PHL SYR ALB ICT CHI DC BOS
@apartmentguide @rentdotcom @visitphilly",22728,1012,678,76,PA Congressional District 04,Michael MPH 🇺🇸 ✌🏼,PhillyPartTwo,91081,,https://www.instagram.com/phillyparttwo,false
"0.04968474,51.5447969",Sat Jan 16 14:58:02 +0000 2021,,https://twitter.com/Maiden_News/status/1350457286993481733/photo/1,https://j.mp/2N7dpsh,0,1350457286993481733,,,,en,"Stratford, London",false,,0,,,"<a href=""https://dlvrit.com/"" rel=""nofollow"">dlvr.it</a>",Westbury father Lee Tilley is in induced coma with Covid-19 virus - Wiltshire Times https://t.co/v4SRbOdTIH https://t.co/n8hSCRT6nA,https://twitter.com/Maiden_News/status/1350457286993481733,Tue May 15 08:21:52 +0000 2012,580683982,false,Latest online news *mentions* about Eddie and the Iron Maiden boys. Made by Maiden fans from their homeland of Stratford/East Ham,4,911,169,10,Stratford,Iron Maiden News,Maiden_News,6023,,http://fb.com/maidenxmas,false
"101.5983,3.1581",Sat Jan 16 14:49:50 +0000 2021,lockdownart lockdownart stayathome,,https://www.instagram.com/p/CKHByu8pzXC/?igshid=1cpcgzmp2pkty,0,1350455224205533184,,,,en,"Sungai Buloh, Selangor",false,,0,,,"<a href=""http://instagram.com"" rel=""nofollow"">Instagram</a>","Another night; another #lockdownart. I do really like the 968 Club Sport. The @911_rebels continues... I think.  
•
•
•
•
•
•
•
#lockdownart #stayathome
@porsche @911_rebels @ Petaling Jaya, Malaysia https://t.co/jxKXS57nex",https://twitter.com/53by11/status/1350455224205533184,Mon Jan 04 03:37:03 +0000 2010,101648221,false,See. Seek. Learn. Apply. The bike mechanic who can't seem to not shoot self in foot.,1512,33,198,11,Malaysia,scrutineer.the,53by11,3085,,,false
"-2.959,51.615",Sat Jan 16 13:59:02 +0000 2021,january lockdownwalks lockdown walk nature naturewalk,,https://www.instagram.com/p/CKG7-3CBl9V/?igshid=irk25ury33t2,1,1350442439920807940,,,,en,"Caerleon, Wales",false,,0,,,"<a href=""http://instagram.com"" rel=""nofollow"">Instagram</a>","January can be such a grey month, especially in the current climate. Today the sun is shining here and we found some natural beauty down the road. 💚
&gt;
&gt;
&gt;
#january #lockdownwalks #lockdown #walk #nature #naturewalk https://t.co/8qUPzHGo9B",https://twitter.com/Charity_Case_/status/1350442439920807940,Sun Jun 14 20:54:26 +0000 2009,47172347,false,"European, Librarian, literature lover, netballer, mum, wife. Tory hater although trying to steer clear of politics, failing miserably at that.",16076,143,318,5,Wales,Fiona Harris 🇪🇺,Charity_Case_,6182,,,false
"-0.90099634,51.54126993",Sat Jan 16 14:39:58 +0000 2021,pre pre,,https://www.instagram.com/p/CKHAqlyMx_c/?igshid=1869ryzs6ayr9,1,1350452743010398208,,,,en,"Henley-on-Thames, England",false,,0,,,"<a href=""http://instagram.com"" rel=""nofollow"">Instagram</a>","Back when it was allowed - gluhwein + glimmer of hospitality + sun

#pre-lockdown
#pre-curfew @ Phyllis Court Club https://t.co/JpwUBdGR6g",https://twitter.com/lucyhyslop/status/1350452743010398208,Tue Nov 25 02:15:13 +0000 2008,17608972,false,"Curating @heckfieldplace Ex co-director @PortEliotFest. F/lance journo Monocle 24, Telegraph, Nat Geo Traveller, BCB Lunch With Lucy. Edited #wlfm book",4056,2173,1248,97,,lucy hyslop,lucyhyslop,11050,,http://lucyhyslop.com,false
"-0.148883,51.44555482",Sat Jan 16 14:59:59 +0000 2021,Datenight lockdown samgyupsal koreanbbq londonfoodie balhamfoodie thekinoys gaycouple foodie lockdowneating tgif koreanfood,,https://www.instagram.com/p/CKHC9Q-HHKd/?igshid=r2fs4se6no61,0,1350457779270656003,,,,en,"Wandsworth, London",false,,0,,,"<a href=""http://instagram.com"" rel=""nofollow"">Instagram</a>","#Datenight during #lockdown - #samgyupsal at home. 👨🏻‍🤝‍👨🏼🇰🇷🥢🍢 #koreanbbq
-
#londonfoodie #balhamfoodie #thekinoys #gaycouple #foodie #lockdowneating #tgif #koreanfood @ Balham, London, England https://t.co/xBzMy3BQ6O",https://twitter.com/kinoyblog/status/1350457779270656003,Sat Feb 09 14:03:21 +0000 2013,1163033958,false,Self confessed food and coffee addicts. We judge (& blog) what we eat! Authors: @itsmekaleb & @itsjheydclloyd l Instagram - @kinoyblog l E: emailkinoy@gmail.com,308,325,448,25,"London, UK",Kinoy Blog,kinoyblog,2465,,http://www.facebook.com/kinoyblog,false
"-3.003,53.35",Sat Jan 16 12:47:24 +0000 2021,,,https://www.instagram.com/p/CKGzyGeBmUV/?igshid=e1yh3h35oo9o,0,1350424413611515905,,,,en,"Birkenhead, England",false,,0,,,"<a href=""http://instagram.com"" rel=""nofollow"">Instagram</a>","Continuing post COVID recovery with gentle stroll - 1st day for a week that weather encouraged going outside @ Spital, Merseyside https://t.co/FErUWJQREw",https://twitter.com/lcbenno/status/1350424413611515905,Thu Oct 22 20:48:54 +0000 2009,84420761,false,,664,24,55,0,"The Wirral, UK",Leigh Bennett,lcbenno,1318,,,false
"-1.13333,52.6333",Sat Jan 16 14:00:30 +0000 2021,bike ride davesgym 20minutefitness training homegym gym weights ironman triathlon fitness corona covid_19,,https://www.instagram.com/p/CKG8Jn1Hun2/?igshid=1klnuxemptyfy,1,1350442810072330240,,,,en,"Leicester, England",false,,0,,,"<a href=""http://instagram.com"" rel=""nofollow"">Instagram</a>","Bike Sesh Complete! #bike #ride #davesgym #20minutefitness #training #homegym #gym #weights #ironman #triathlon #fitness #corona #covid_19 @ Leicester, United Kingdom https://t.co/TTMQLh0Lrj",https://twitter.com/david_a_ellis/status/1350442810072330240,Fri May 18 20:38:39 +0000 2012,584141695,false,"Ironman, Marathon man, Triathlete. Owner and founder of #20minutefitness",71,146,174,14,Leicester,David Ellis,david_a_ellis,2243,,,false
