coordinates,created_at,hashtags,media,urls,favorite_count,id,in_reply_to_screen_name,in_reply_to_status_id,in_reply_to_user_id,lang,place,possibly_sensitive,quote_id,retweet_count,retweet_id,retweet_screen_name,source,text,tweet_url,user_created_at,user_id,user_default_profile_image,user_description,user_favourites_count,user_followers_count,user_friends_count,user_listed_count,user_location,user_name,user_screen_name,user_statuses_count,user_time_zone,user_urls,user_verified
"-84.38224283,33.75184465",Tue Jan 19 14:31:29 +0000 2021,,,https://www.instagram.com/p/CKOuFDDB7NoxO_9lwQuSZXjOao4RqAfAkXMJK40/?igshid=1ia9e208a5u9o,0,1351537768673980420,,,,en,"Atlanta, GA",false,,0,,,"<a href=""http://instagram.com"" rel=""nofollow"">Instagram</a>",☑️DONE - Dose 1: Modern a Covid-19 Vaccine @ GradyHealth https://t.co/RoGij2SKdI,https://twitter.com/Linski1971/status/1351537768673980420,Tue Nov 29 02:50:44 +0000 2011,423910862,false,,453,46,75,0,,Lynne Alston-Leonard,Linski1971,968,,,false
"-94.5809,39.1022",Tue Jan 19 12:59:47 +0000 2021,covidvaccine vaccine covid,,https://www.instagram.com/p/CKOjldfp8yS/?igshid=1u8yr2tc6jol,0,1351514693152731137,,,,en,"Kansas City, MO",false,,0,,,"<a href=""http://instagram.com"" rel=""nofollow"">Instagram</a>","Round 2 of the vaccine is done!! Doing our part to protect ourselves and others :) #covidvaccine #vaccine #covid @ Kansas City, Missouri https://t.co/D3MsiYKuVe",https://twitter.com/thekhill9/status/1351514693152731137,Thu Mar 26 02:10:49 +0000 2009,26662848,false,"In a world where you can be anything, be kind. Keep moving forward.
Founder of the @t22penpals 💌",2783,374,245,5,"Kansas City, MO",Kelsey Hill,thekhill9,16615,,http://www.instagram.com/thekhill9,false
"-82.94167,40.10949",Tue Jan 19 14:22:21 +0000 2021,,,https://innovations.stanford.edu/wearables https://www.instagram.com/p/CKOs4oig-7l/?igshid=1avhdrd6yxio0,0,1351535472846073860,,,,en,"Westerville, OH",false,,0,,,"<a href=""http://instagram.com"" rel=""nofollow"">Instagram</a>","Determine if u have covid a lot earlier- 9 days before symptoms? have a smart watch? (apple, fitbit, garmen, motiv)

use this link: https://t.co/yrrcIcwzXS @ Kanodia MD https://t.co/Rb2988MSys",https://twitter.com/KanodiaMD/status/1351535472846073860,Sat Apr 04 18:47:52 +0000 2009,28846767,false,,79,231,124,7,"Columbus, OH",Anup Kanodia,KanodiaMD,920,,http://kanodiamd.com,false
"-79.448911,43.647013",Tue Jan 19 14:04:50 +0000 2021,realtorlife secondact,,https://www.instagram.com/p/CKOrB6ChfSA/?igshid=scmy30nikgre,0,1351531063785508865,,,,en,"Toronto, Ontario",false,,0,,,"<a href=""http://instagram.com"" rel=""nofollow"">Instagram</a>",#realtorlife in the time of Covid. #secondact @ Roncesvalles Village https://t.co/d4ODKDzoW2,https://twitter.com/LisaBednarski/status/1351531063785508865,Sun Nov 23 14:11:30 +0000 2008,17572914,false,"Realtor w/ the BREL team; recovering communicator; Tweets r/ passions: Toronto, Roncy, Springsteen, sights, travel, politics, feminism, BlueJays, nieces, my dog",54981,1668,3354,86,"Toronto, Ontario, Canada",Lisa Bednarski,LisaBednarski,28979,,http://www.getwhatyouwant.ca,false
"-90.25888691,29.98789102",Tue Jan 19 12:04:19 +0000 2021,wearamask my2ndCity fromLAtoLA tellmesomethingslick,,https://www.instagram.com/p/CKOdPPmhS2H5UbumXg4UYarSAXu9LJvat_NyzM0/?igshid=vpj9cotxtrsr,0,1351500735243055107,,,,en,"Kenner, LA",false,,0,,,"<a href=""http://instagram.com"" rel=""nofollow"">Instagram</a>","It’s the upgrade for me ✨✨ Thank you NOLA, you’re always missed 🖤💛 #wearamask #my2ndCity #fromLAtoLA #tellmesomethingslick @ Louis Armstrong New Orleans International Airport https://t.co/Rk84DtSZ7V",https://twitter.com/iamvjones/status/1351500735243055107,Thu Dec 30 14:25:47 +0000 2010,232202109,false,"You’ve seen it done, but not like this! Follow us @verbalslick #tellmesomethingslick",224,88,193,1,"New Orleans, LA",VJ,iamvjones,1333,,http://verbalslick.com,false
"-0.1094,51.5141",Tue Jan 19 14:25:32 +0000 2021,weird abesapien newyearnewme,,https://www.instagram.com/p/CKOtZkgFVD6/?igshid=p1j498qyduyj,0,1351536273966690306,,,,en,"City of London, London",false,,0,,,"<a href=""http://instagram.com"" rel=""nofollow"">Instagram</a>","Lockdown getting weird AF. How's yours going?
#weird #abesapien #newyearnewme @ London, United Kingdom https://t.co/HRPjPgTHNJ",https://twitter.com/Lyndonimus/status/1351536273966690306,Tue Oct 21 09:12:32 +0000 2008,16883390,false,"Don't go diving, I'm a puddle. Cuts hair.",600,213,374,19,Laaahndaaaahn,Lyndonimus,Lyndonimus,3914,,,false
"77.19102783,28.5974128",Tue Jan 19 14:05:04 +0000 2021,,,http://dlvr.it/RqtzxG,0,1351531123659051016,,,,en,"नई दिल्ली, भारत",false,,1,,,"<a href=""https://dlvrit.com/"" rel=""nofollow"">dlvr.it</a>","INNR — Pakistan approves Oxford-AstraZeneca vaccine: The AstraZeneca vaccine is being prepared in India, which has strained ... Brazil hasn't approved a single vaccine yet, and independent health ... View article... https://t.co/OQ2GHgNTh3",https://twitter.com/StigmabaseA/status/1351531123659051016,Sat May 29 17:26:03 +0000 2010,149585330,false,Australia - New Zealand — 日本語  — 中国 — 한국말 |  Keeping up-to-date on global exclusion — Stigmabase is a canadian internet non-profit Initiative. Founded in 2010.,0,2908,1275,139,Asia | Australia - Pacific,Stigmabase | ASIA,StigmabaseA,1550032,,https://www.stigmabase.org/,false
"-80.1936,25.7751",Tue Jan 19 14:39:15 +0000 2021,,,https://www.instagram.com/p/CKOu-DTMBBR/?igshid=1rqpbqp8uucfw,75,1351539726189273090,,,,en,"Miami, FL",false,,1,,,"<a href=""http://instagram.com"" rel=""nofollow"">Instagram</a>","On that pre-covid summer daydream. @ Miami, Florida https://t.co/0StF96d2jA",https://twitter.com/rafaeldlf/status/1351539726189273090,Sun Dec 26 01:21:37 +0000 2010,230577989,false,Actor,2920,137465,1076,274,Earth,Rafael De La Fuente,rafaeldlf,12701,,http://every.org,true
"-81.73295,28.02232",Tue Jan 19 12:39:56 +0000 2021,NOISundays,https://twitter.com/BruhThahLu/status/1350860205567913984/photo/1,https://www.instagram.com/p/CKOhUHVFied/?igshid=134ewzdrvuv13,0,1351509699565416448,,,,en,"Winter Haven, FL",false,,0,,,"<a href=""http://instagram.com"" rel=""nofollow"">Instagram</a>","Smallpox vaccine triggered AIDS virus. @wesleymuhammad  #NOISundays https://t.co/31y2oum8D0 @ Winter Haven, Florida https://t.co/4zfFiLHz2Y",https://twitter.com/BrotherRichard/status/1351509699565416448,Thu Apr 30 23:00:43 +0000 2009,36803269,false,I am a student  of The Honorable Minister Louis Farrakhan,12711,888,892,18,"Atlanta, GA",Brother Richard Muhammad,BrotherRichard,87382,,http://Www.Brotherrichardx.online,false
"0.66508719,51.54717027",Tue Jan 19 13:58:02 +0000 2021,Leigh,,https://bit.ly/2LL0NXy,0,1351529351301394437,,,,en,"Southend-on-Sea, East",false,,0,,,"<a href=""https://dlvrit.com/"" rel=""nofollow"">dlvr.it</a>",#Leigh Covid: New walk through test centre opens in town https://t.co/uOtfDVRmQz,https://twitter.com/Southend0nSea/status/1351529351301394437,Sat Feb 02 18:53:30 +0000 2013,1143139626,false,Local news from the #Southend area of #Essex⁣ since 2013⁣ ⁣ ▪️ Shoeburyness⁣⁣ ▪️ Leigh⁣⁣ ▪️ Westcliff⁣⁣ ▪️ Rochford⁣⁣ ▪️ Thorpe Bay⁣⁣ ▪️ Hadleigh⁣⁣ ▪️ Eastwood,100,9181,2651,82,"Southend-on-Sea, UK",City of Southend-On-Sea,Southend0nSea,46993,,https://twitter.com/southend0nsea,false
"29.4596195,-23.9081097",Tue Jan 19 12:01:15 +0000 2021,,,https://www.instagram.com/p/CKOc4yYrXRR/?igshid=1vpbezq173741,0,1351499964791328770,,,,en,"Polokwane, South Africa",false,,0,,,"<a href=""http://instagram.com"" rel=""nofollow"">Instagram</a>","TagSneakers | TagClothing 
Tuesday timeline Jordan 23
Place your order now by using our social media platforms 
We're ready to serve you 
COVID-19 still with us take care 
All orders needs deposit 
Tagzero15 https://t.co/c126dOFxQm",https://twitter.com/tagzero15/status/1351499964791328770,Tue Jan 05 22:00:45 +0000 2016,4718727208,false,Retails,35,57,250,0,"Polokwane, South Africa",Tagzero15,tagzero15,267,,,false
"-73.56725453,45.75975883",Tue Jan 19 11:31:32 +0000 2021,,,http://dlvr.it/RqtSqk,0,1351492486535909380,,,,en,"Mascouche, Québec",false,,0,,,"<a href=""https://dlvrit.com/"" rel=""nofollow"">dlvr.it</a>","Fighting Stigma: The Latest: Biden won't end pandemic travel restrictions: ... to lift coronavirus travel restrictions for Europe, the U.K., Ireland and Brazil. ... She added, “In fact, we plan to strengthen public health measures around ... But Reeves… https://t.co/Tqjc5YSYqE",https://twitter.com/StigmabaseN/status/1351492486535909380,Wed Sep 15 15:55:47 +0000 2010,191092262,false,Ireland — Scotland — Inuit —  Svenska  | Keeping up-to-date on global exclusion — Stigmabase is a canadian internet non-profit Initiative,0,1611,1297,110,Ireland | Scotland | Inuit | Skandinavien,Stigmabase | NORDIC,StigmabaseN,951806,,https://www.stigmabase.org/,false
"-0.16479721,51.45363391",Tue Jan 19 11:50:21 +0000 2021,northcoteroad hope lockdown stayathome covid london streetart streetphotography graffiti,,https://www.instagram.com/p/CKObo3QH10c/?igshid=1ee0llujz92sd,0,1351497221582303232,,,,en,"Wandsworth, London",false,,0,,,"<a href=""http://instagram.com"" rel=""nofollow"">Instagram</a>","@faracharityshops and a little bit of hope on Northcote Road. Yes please. 

#northcoteroad #hope #lockdown #stayathome #covid #london #streetart #streetphotography #graffiti @ Northcote, London https://t.co/kMYZkOinlM",https://twitter.com/SChanUK/status/1351497221582303232,Tue May 18 07:58:38 +0000 2010,145162337,false,London. Food. Music. Travelling. Hiking. All my loves in no particular order.,401,299,307,29,"London, England",Steph Chan,SChanUK,5116,,,false
"-72.90755868,43.11296721",Tue Jan 19 14:15:32 +0000 2021,strattonmountain strattonmountainresort ilovermont skibikeskibikeskiandrepeat skigirl,,https://www.instagram.com/p/CKOsQSOBZ8VdieZC0lYMNqdXOmwATFpcdsQgq80/?igshid=r437zbrwd8wp,2,1351533758437085188,,,,en,"Vermont, USA",false,,0,,,"<a href=""http://instagram.com"" rel=""nofollow"">Instagram</a>",Good morning Stratton Mountain!  Day 16 riding the gondy Covid style.   #strattonmountain #strattonmountainresort #ilovermont #skibikeskibikeskiandrepeat #skigirl @ Stratton Mountain Resort https://t.co/nryz9qdpW9,https://twitter.com/trabrown44/status/1351533758437085188,Mon Nov 10 19:55:32 +0000 2008,17293469,false,Cherish the important things in life. Choose happiness everyday. Volunteer to change the world. Be true. Be you. We are.,802,562,1341,31,"Madison, NJ ",Tracy Brown,trabrown44,1570,,https://www.linkedin.com/in/tracybrowncisco,false
"-5.81751112,54.59342793",Tue Jan 19 12:44:49 +0000 2021,,,,1,1351510927322083329,,,,en,"Dundonald, Northern Ireland",,,0,,,"<a href=""http://tapbots.com/tweetbot"" rel=""nofollow"">Tweetbot for iΟS</a>","I opted to take advantage on the HMRC COVID pay your tax bill in 12 instalments thing. 

Several instalments have been debited. They keep emailing me to remind me to pay my tax bill by the end of January. 🙄

Why are government IT systems so bad. How hard is an account flag.",https://twitter.com/IanRobinson/status/1351510927322083329,Sun Jun 01 11:26:57 +0000 2008,14970812,false,"Writer, walker, atheist, Apple enthusiast, cinema lover, hobby musician, science junkie, perpetual maths student, cricket fan, chess patzer.",1637,3372,2698,285,"Dundonald, Belfast, UK",Ian Robinson,IanRobinson,257451,,http://www.canicula.com/wp/,false
"19.0503,47.4719",Tue Jan 19 14:18:50 +0000 2021,selfie me work homeoffice stayhome bloggerlife fashionblogger menswear eyewear picoftheday gaborszakacsblog,,https://www.instagram.com/p/CKOsocPj_kW/?igshid=67viyk6qr8zq,0,1351534586518528000,,,,en,"Budapest, Magyarország",false,,1,,,"<a href=""http://instagram.com"" rel=""nofollow"">Instagram</a>","Before Zoom meeting, I'm ready 🤓🤳📸 #selfie #me #work #homeoffice #stayhome #bloggerlife #fashionblogger #menswear #eyewear #picoftheday #gaborszakacsblog @Budapest, Hungary https://t.co/kwxjKk8r0d",https://twitter.com/gaborszakacs/status/1351534586518528000,Thu Jul 21 15:29:28 +0000 2011,339730720,false,"Blogger, writer, fashion editor",1923,111,98,56,,Gabor Szakacs,gaborszakacs,3496,,http://gaborszakacs.blog.hu,false
"-111.07427917,45.67070719",Tue Jan 19 12:03:04 +0000 2021,,,http://dlvr.it/RqtYqy,1,1351500418753302533,,,,en,"Bozeman, MT",false,,1,,,"<a href=""https://dlvrit.com/"" rel=""nofollow"">dlvr.it</a>","Despite pandemic, city of Bozeman reports stable finances https://t.co/S04Jqn4Kvd",https://twitter.com/bozchron/status/1351500418753302533,Wed Mar 04 00:33:58 +0000 2009,22707076,false,The official Twitter feed for the Bozeman Daily Chronicle.,92,21678,1279,468,"Bozeman, Montana",Bozeman Daily Chronicle,bozchron,104266,,http://bozemandailychronicle.com/,false
"-76.98369399,38.8956604",Tue Jan 19 12:22:43 +0000 2021,,,https://twitter.com/VinceCoglianese/status/1351481329888718849,3,1351505365343600646,,,,en,"Washington, DC",false,1351481329888718849,0,,,"<a href=""http://tapbots.com/tweetbot"" rel=""nofollow"">Tweetbot for iΟS</a>","Why I think $2000 stimulus checks are a terrible idea when we could be spending that money on enhanced UI, in one stat: https://t.co/HOv0iuSGNS",https://twitter.com/Alexa_MRo/status/1351505365343600646,Sun Mar 21 18:40:57 +0000 2010,125111405,false,"Lawyer. Eppur si muove. Views are my own, not my employer's.",6248,553,3872,7,"Washington, DC",Alexandra R.,Alexa_MRo,17399,,,false
"-73.775,41.15",Tue Jan 19 13:02:12 +0000 2021,,,https://www.instagram.com/p/CKOjxvepMS7/?igshid=1tzavxjl0xzlz,0,1351515301683343363,,,,en,"Pleasantville, NY",false,,0,,,"<a href=""http://instagram.com"" rel=""nofollow"">Instagram</a>","COVID-19 update @ Westchester County, New York https://t.co/wiIPSrdGXD",https://twitter.com/johnnybebad666_/status/1351515301683343363,Mon Sep 09 05:59:59 +0000 2019,1170939664196354048,false,🔨support81 Harley-Davidson XL1200 CX Roadster HOG⸸⛧Satanist🦇goth goal oriented bassist?🎸metal💀extra acting s&m sex women only ct3475843316 Tri Technologies♌,9051,110,1070,1,"New York, NY",John Fitzgerald Kennedy Page®,johnnybebad666_,28982,,https://www.suicidegirls.com/join/?aid=1032495,false
"-0.1094,51.5141",Tue Jan 19 14:46:24 +0000 2021,fyp foryoupage lockdown housecleaning washing nice feelings,,https://www.instagram.com/p/CKOvvTGnlUv/?igshid=9qvfvgyxp7m0,0,1351541525956620288,,,,en,"City of London, London",true,,0,,,"<a href=""http://instagram.com"" rel=""nofollow"">Instagram</a>","half day home working.... productive house cleaning day #fyp #foryoupage #lockdown #housecleaning #washing #nice #feelings @ London, United Kingdom https://t.co/Ps7XAGaBcN",https://twitter.com/liam3896/status/1351541525956620288,Sun Jan 09 20:22:38 +0000 2011,236102284,false,"Well What Can I Say:  Your Typical Classy London Lad,  MISSON:- Next Upcoming Social Media Influencer, Actor or Presenter Going To Live Everyday As It Comes.",13655,441,1322,10,"London, England",Non-average Unicorn,liam3896,16049,,https://www.youtube.com/user/liamwheartyoffical,false
"-81.32806152,48.47593351",Tue Jan 19 13:06:33 +0000 2021,,https://twitter.com/TimminsToday/status/1351516394798518274/photo/1,https://www.timminstoday.com/coronavirus-covid-19-local-news/covid-19-here-are-the-5-things-ontario-should-do-now-to-make-ltc-homes-safer-oma-prez-says-3273515?utm_source=dlvr.it&utm_medium=twitter,0,1351516394798518274,,,,en,"Timmins, Ontario",false,,0,,,"<a href=""https://dlvrit.com/"" rel=""nofollow"">dlvr.it</a>","COVID-19: Here are the 5 things Ontario should do now to make LTC homes safer, OMA prez says https://t.co/xAnsPPkLl5 https://t.co/bncmsvOtFq",https://twitter.com/TimminsToday/status/1351516394798518274,Thu Oct 18 02:36:23 +0000 2012,887966294,false,We are an online local news source for Timmins and Northern Ontario.,19,1893,296,18,"Timmins, Ontario",TimminsToday.com,TimminsToday,33106,,http://www.timminstoday.com,false
"-1.75552859,51.88745922",Tue Jan 19 11:38:11 +0000 2021,supportsmallbusiness virtualpa cotswoldbeautysalon smallbusinessuk ineedhelp workingfromhome,,https://www.instagram.com/p/CKOaPyAJhbg/?igshid=1ccao4yywai38,0,1351494159362789377,,,,en,"Bourton-on-the-Water, England",false,,0,,,"<a href=""http://instagram.com"" rel=""nofollow"">Instagram</a>","Can anyone recommend a Virtual PA?
#supportsmallbusiness #virtualpa #cotswoldbeautysalon #smallbusinessuk #ineedhelp #workingfromhome @ Beautylicious Bourton https://t.co/o98QFqE3Fs",https://twitter.com/beautyliciousbn/status/1351494159362789377,Sat Oct 08 20:16:05 +0000 2011,387298794,false,"Beauty salon within the George Moore Community Centre, Bourton on the Water, Gloucestershire covering a wide range of Beauty and Holistic therapies.",24,247,379,6,Bourton on the Water,Beautylicious,beautyliciousbn,1075,,http://www.beautylicious-bourton.com,false
"-84.67248089,34.04996719",Tue Jan 19 11:55:37 +0000 2021,,,https://www.instagram.com/p/CKOcPtolMhr/?igshid=5hmdthpzg2fd,0,1351498545778446337,,,,en,"Acworth, GA",false,,0,,,"<a href=""http://instagram.com"" rel=""nofollow"">Instagram</a>","Im so dam EXCITED 😜 pls lord don’t let this pandemic impact one our dream vacations 👙🍾💋 @ Cobblestone Golf Course | Acworth, GA https://t.co/BSMgq3v3fp",https://twitter.com/teedixon3/status/1351498545778446337,Tue Apr 21 17:58:30 +0000 2009,33981775,false,"California raised, Viriginia Beach built, Baltimore fortified, Atlanta home! unapologetically free 🕊🕊🐾",2261,281,633,14,ATL,tee dixon,teedixon3,26340,,,false
"31.07976,-29.73196",Tue Jan 19 12:08:46 +0000 2021,ivtherapy ivdripumhlanga driptherapy health covid19 serenityhnb,,https://www.instagram.com/p/CKOdv2JgCUx/?igshid=1764c7yxbdff7,0,1351501852748226560,,,,en,"Umhlanga, South Africa",false,,0,,,"<a href=""http://instagram.com"" rel=""nofollow"">Instagram</a>","Vitamin Therapy Drips @serenityhnb

#ivtherapy #ivdripumhlanga #driptherapy #health #covid19 #serenityhnb @ Serenity Laser &amp; Aesthetics https://t.co/sWOnFePlSA",https://twitter.com/SerenityThe1/status/1351501852748226560,Fri Mar 15 11:20:21 +0000 2013,1269482444,false,"Salon in Umhlanga. Specialising in Hair Nails & Beauty 
Bbm : 7B59E917
0837264899
0315663289",10,604,1855,0,"Umhlanga, South Africa",SerenityHNB,SerenityThe1,1816,,http://www.serenityhnb.com,false
"-81.46947294,28.42487824",Tue Jan 19 13:28:03 +0000 2021,,,https://www.instagram.com/p/CKOm0icjDli/?igshid=loasq7yn0pwt,0,1351521807732535300,,,,en,"Florida, USA",false,,0,,,"<a href=""http://instagram.com"" rel=""nofollow"">Instagram</a>","It’s the day of the show* y’all. 

*Covid test @ Orange County Convention Center https://t.co/LrY9UAfMmQ",https://twitter.com/lalalalaurs/status/1351521807732535300,Wed Feb 11 15:57:59 +0000 2009,20598398,false,,64171,316,971,19,"New York, NY",Lauren,lalalalaurs,31839,,https://linktr.ee/Lalalalaurs,false
"-0.12485951,51.50538967",Tue Jan 19 11:34:02 +0000 2021,,,http://dlvr.it/RqtTH7,0,1351493112363794432,,,,en,"London, England",false,,1,,,"<a href=""https://dlvrit.com/"" rel=""nofollow"">dlvr.it</a>",ONS: Around 1 in 8 people in England had COVID-19 antibodies last month https://t.co/X10v3BTBAh,https://twitter.com/BritishHeraldUK/status/1351493112363794432,Wed Feb 17 17:49:42 +0000 2010,115123902,false,Where Britain Meets the World® | The Official handle of #britishherald,344,133915,588,283,"London, United Kingdom",British Herald,BritishHeraldUK,57065,,http://www.britishherald.com,false
"-0.1094,51.5141",Tue Jan 19 13:10:50 +0000 2021,homeschooling funtimes almurphy,,https://www.instagram.com/p/CKOk2oZH_3H/?igshid=xlggq2t24egw,0,1351517475968409602,,,,en,"City of London, London",false,,0,,,"<a href=""http://instagram.com"" rel=""nofollow"">Instagram</a>","Al Murphy Homeschool Activity Worksheet coloured in by Iris, age 9 although put 10 because she is next week. #homeschooling #funtimes #almurphy @ London, United Kingdom https://t.co/mETCWP1jiZ",https://twitter.com/mcandrewphoto/status/1351517475968409602,Tue Nov 20 23:08:45 +0000 2012,961380986,false,Photographer Father Pizza Beer BBQ Bikes Castigers Yorkshireman  - no particular order © Chris McAndrew - Rep - Mark Gibson https://t.co/6PDFjaxwfx,22148,441,540,10,East Seventeen London,Chris McAndrew 📷,mcandrewphoto,9987,,http://www.mcandrewphoto.com,false
"-78.619776,35.826772",Tue Jan 19 14:23:55 +0000 2021,TerbetGroup RaleighRealEstate covidvacccine,,https://www.instagram.com/p/CKOtNsXHc65/?igshid=1glactcqtv31w,0,1351535867861504006,,,,en,"Raleigh, NC",false,,0,,,"<a href=""http://instagram.com"" rel=""nofollow"">Instagram</a>",Bob and I just got our COVID Vaccine! Praying our Country can get back to normal and no more COVID! #TerbetGroup #RaleighRealEstate #covidvacccine @ Duke Health https://t.co/7XQOGevt1t,https://twitter.com/IdaTerbet/status/1351535867861504006,Wed Apr 29 11:30:49 +0000 2009,36336547,false,"Top Producer in the Triangle for 30 years over 10,000 homes! Passionate about her faith,family,community, Carolina Panthers , NC State, Duke,TarHeels !",517,2236,3089,101,"Raleigh/Cary/Apex/WF, NC",The Ida Terbet Group,IdaTerbet,4084,,http://www.IdaTerbet.com,false
"101.7105,3.1588",Tue Jan 19 12:02:07 +0000 2021,PrayForMalaysia StaySafeStayHealthy StayStrongTogetherMalaysia,,https://www.instagram.com/p/CKOc_Iwhat0/?igshid=1fj7j6u721s1x,0,1351500180886069249,,,,en,"Bandar Kuala Lumpur, Wilayah Persekutuan Kuala Lumpur",false,,0,,,"<a href=""http://instagram.com"" rel=""nofollow"">Instagram</a>","🦠 COVID-19 UPDATES 19 JAN 2021 

New cases 3631
Deaths 14
Total Cases 165,371

#PrayForMalaysia 
#StaySafeStayHealthy 
#StayStrongTogetherMalaysia @ Kuala Lumpur, Malaysia https://t.co/rg98i7RbuW",https://twitter.com/Jazzbebo8888/status/1351500180886069249,Thu Jan 23 11:22:53 +0000 2020,1220305808518332416,false,"FIVE RIVERS RESOURCES SDN BHD (1350952-H) MANAGING DIRECTOR
FB: Jazzmine Kaur 
PAGE: Five Rivers Resources
IG: @fiveriversresources",6466,248,4703,0,"KUALA LUMPUR, MALAYSIA",MS JAZZMINE KAUR,Jazzbebo8888,8411,,http://www.fiveriversresources.com,false
"-0.12485951,51.50538967",Tue Jan 19 13:36:32 +0000 2021,UK,,http://dlvr.it/RqttkW,0,1351523940322082816,,,,en,"London, England",false,,1,,,"<a href=""https://dlvrit.com/"" rel=""nofollow"">dlvr.it</a>","COVID situation in #UK is intense in spite of drop in infections, PM tells ministers https://t.co/NnAX6zzEPG",https://twitter.com/BritishHeraldUK/status/1351523940322082816,Wed Feb 17 17:49:42 +0000 2010,115123902,false,Where Britain Meets the World® | The Official handle of #britishherald,344,133915,588,283,"London, United Kingdom",British Herald,BritishHeraldUK,57065,,http://www.britishherald.com,false
"-81.03275,34.00763",Tue Jan 19 14:24:22 +0000 2021,covid19,,https://www.instagram.com/p/CKOtQ_fHKgB/?igshid=5l8rjmn1oy5h,1,1351535978532495361,UofSCNursing,,3460379121,en,"South Carolina, USA",false,,0,,,"<a href=""http://instagram.com"" rel=""nofollow"">Instagram</a>","@uofscnursing faculty at #covid19 vaccination training this am. My first shift is 1/30. Yay!
P.S. what is up with my hair??? @ Prisma Health Baptist Hospital https://t.co/XRECY5Icdy",https://twitter.com/wickster55/status/1351535978532495361,Wed Oct 28 14:41:49 +0000 2015,4061231897,false,"Dr. Wick! Nurse scientist focused on adherence to and side effects of oral targeted therapy. Crazy old cat lady, soccer fanatic, sci fi nerd. Tweets my own.",19764,493,598,6,"Columbia, SC",Dr. Karen Wickersham,wickster55,2480,,,false
"-2.14944444,53.40833333",Tue Jan 19 14:34:13 +0000 2021,stockport Childrenscarboot whiteelephantcarboot parentlife homeschooling keepingthementertained rainyday,,https://www.instagram.com/p/CKOuZJWhMGv/?igshid=5qnz4uy2aoyv,1,1351538457315692545,,,,en,"Stockport, England",false,,1,,,"<a href=""http://instagram.com"" rel=""nofollow"">Instagram</a>","Good for rainy days 🌧☔
.
Indoor scavenger hunt
.
#stockport #Childrenscarboot #whiteelephantcarboot #parentlife #homeschooling #keepingthementertained #rainyday @ Stockport https://t.co/GTG43qH26r",https://twitter.com/Whiteelephantc1/status/1351538457315692545,Wed Feb 26 11:17:27 +0000 2020,1232625657429053440,false,Childrens car boot and table top sale within the stockport area. Giving parents an opportunity to sell Babies & Childrens preloved items,795,162,1243,0,"Stockport, England",Whiteelephantcarboot,Whiteelephantc1,846,,http://www.whiteelephantcarboot.co.uk,false
"-3.9433018,51.61979364",Tue Jan 19 12:24:25 +0000 2021,postlockdown dj swanseamusic housemusic gardenparty 100oldskool,,https://www.instagram.com/p/CKOfiaFDpXKO4vpHLo2OBHIy587ZUBRADnN17E0/?igshid=1k21vyp6yopov,1,1351505794446073857,,,,en,"Swansea, Wales",false,,0,,,"<a href=""http://instagram.com"" rel=""nofollow"">Instagram</a>","100% Old Skool Raffle for a post Lockdown party, at a date and venue of your choice. #postlockdown #dj #swanseamusic #housemusic #gardenparty #100oldskool @ Swansea City https://t.co/h0boin6hsm",https://twitter.com/daveyb291181/status/1351505794446073857,Thu Dec 16 14:23:54 +0000 2010,227315028,false,"Family, friends, sport, music, food and festival's",3935,457,1542,0,"Swansea, Wales",David James Begley,daveyb291181,1022,,,false
"-81.73295,28.02232",Tue Jan 19 12:50:20 +0000 2021,NOISundays,https://twitter.com/LaRoyaHMuhammad/status/1350854841229258754/photo/1,https://www.instagram.com/p/CKOigVSlKXJ/?igshid=r8eny0gi7lun,0,1351512314260942849,,,,en,"Winter Haven, FL",false,,0,,,"<a href=""http://instagram.com"" rel=""nofollow"">Instagram</a>","Do you know, family who a major contributor to these immuno-castration vaccines is? Pfizer! ⁦@wesleymuhammad⁩ #NOISundays https://t.co/ijnUKe2ZVp @ Winter Haven, Florida https://t.co/CclZq6e4o1",https://twitter.com/BrotherRichard/status/1351512314260942849,Thu Apr 30 23:00:43 +0000 2009,36803269,false,I am a student  of The Honorable Minister Louis Farrakhan,12711,888,892,18,"Atlanta, GA",Brother Richard Muhammad,BrotherRichard,87382,,http://Www.Brotherrichardx.online,false
