coordinates,created_at,hashtags,media,urls,favorite_count,id,in_reply_to_screen_name,in_reply_to_status_id,in_reply_to_user_id,lang,place,possibly_sensitive,quote_id,retweet_count,retweet_id,retweet_screen_name,source,text,tweet_url,user_created_at,user_id,user_default_profile_image,user_description,user_favourites_count,user_followers_count,user_friends_count,user_listed_count,user_location,user_name,user_screen_name,user_statuses_count,user_time_zone,user_urls,user_verified
"1.37085456,51.2957101",Sat Jan 16 18:32:35 +0000 2021,gin ginfluencer,,https://www.instagram.com/p/CKHbSYJlLOM/?igshid=xkcb10qajtau,7,1350511279727894536,,,,en,"South East, England",false,,1,,,"<a href=""http://instagram.com"" rel=""nofollow"">Instagram</a>","Local favourite @annodistillers we are hoping to collaborate on a @princesgolfclub members gin this year once this Covid passes #gin #ginfluencer @ Prince's Golf Club, Sandwich https://t.co/ZrIVFghYO3",https://twitter.com/robmcg61/status/1350511279727894536,Sun Aug 07 19:23:32 +0000 2011,350432048,false,"General Manager at Prince’s, Member at Brora.",15907,1502,967,10,Sandwich Bay,RM61,robmcg61,9482,,http://www.princesgolfclub.co.uk,false
"-121.4927,38.5763",Sat Jan 16 19:25:06 +0000 2021,FARLEFT LEFTISTS BIDEN FRACKING FAKE PANDEMIC DSLWORLD,,https://www.instagram.com/p/CKHhTCEnzJL/?igshid=rykbuq7w3bpc,0,1350524497674317824,,,,en,"Sacramento, CA",false,,0,,,"<a href=""http://instagram.com"" rel=""nofollow"">Instagram</a>","EVEN THE #FARLEFT #LEFTISTS CAN'T AGREE WITH #BIDEN THOUGHTS, WORDS, OR ACTIONS REGARDING ONE SIMPLE THING THAT'S ALREADY BEEN FIXED AND IS A #FRACKING #FAKE #PANDEMIC

#DSLWORLD ☀️ @ California https://t.co/gQGXw6tRxn",https://twitter.com/DirectSun_Light/status/1350524497674317824,Wed Jul 08 00:19:20 +0000 2009,54734021,false,"no matter where life takes me, you'll find me w.a smile (: the pursuit to be happy got me laughin' like a child ♡",3326,142,267,1,,Makaiza DirectSunLight Keesee,DirectSun_Light,22748,,,false
"-74.50498581,41.19029329",Sat Jan 16 19:10:56 +0000 2021,uptowngeekdad jmshamesphotography skiing,,https://www.instagram.com/p/CKHfrNThru5/?igshid=1gqvmf1x2gey5,0,1350520931781730304,,,,en,"New Jersey, USA",false,,0,,,"<a href=""http://instagram.com"" rel=""nofollow"">Instagram</a>",Pandemic Skiing! #uptowngeekdad #jmshamesphotography #skiing @ Mountain Creek https://t.co/V4XybsdN1F,https://twitter.com/Grimace2271/status/1350520931781730304,Wed Apr 15 14:14:05 +0000 2009,31416143,false,"Just an average guy looking for ways to stay sane in this insane world. “With freedom, comes responsibilities.”",10026,342,1407,16,NYC,Justin Shames,Grimace2271,7335,,http://uptowngeekdad.com/,false
"-8.52291,51.70625",Sat Jan 16 21:00:39 +0000 2021,quarantine ig_cork daily_ireland kinsale loves_ireland,,https://www.instagram.com/p/CKHsO6rF23O/?igshid=ib45jgbzr8zi,3,1350548542398595076,,,,en,"Cork, Ireland",false,,0,,,"<a href=""http://instagram.com"" rel=""nofollow"">Instagram</a>","1 Photo/ Day 171: Water feature! #quarantine #ig_cork #daily_ireland #kinsale #loves_ireland @ Kinsale, Ireland https://t.co/URWrEbPwlj",https://twitter.com/Sonnygreenwich/status/1350548542398595076,Fri Jun 12 19:52:59 +0000 2009,46733147,false,"Emma’s Husband, Gold-selling, Juno winning 🇨🇦🇮🇪 musician/producer/YouTuber, Ex-Bootsauce. Join my fantastic Patreon \\ https://t.co/ydhOiTAYBD",1448,764,4176,3,"Kinsale, Ireland",Sonny Greenwich Jr,Sonnygreenwich,2555,,https://linktr.ee/sonnygreenwich,false
"-114.057,51.045",Sat Jan 16 18:41:19 +0000 2021,,,https://www.instagram.com/p/CKHcSXIMZZX/?igshid=o3wdt7zjh28v,0,1350513479136980994,,,,en,"Calgary, Alberta",false,,0,,,"<a href=""http://instagram.com"" rel=""nofollow"">Instagram</a>","❤️ Bread Delivery with Love 🥯  were donated a lot of PPE (personal prevention equipment ) , we will  distribute to volunteer, and coming volunteers. Thanks 🙏 @ Calgary, Alberta https://t.co/sP5xzq0pmd",https://twitter.com/SamKwan618/status/1350513479136980994,Sun Jan 15 18:07:55 +0000 2017,820694012650631170,false,A Volunteer Of Canadian Registered Charity ECSSEN. Vancouver Canada from Hongkong. Facebook: Sam Kwan,96,13,23,0,,Sam Kwan,SamKwan618,706,,,false
"-2.75725,54.66445",Sat Jan 16 18:25:55 +0000 2021,lockdown liveufc btsport england ufc ufcfightnight maxholloway calvinkattar theoctagon ufcfightisland cheers,,https://www.instagram.com/p/CKHahnEFocV/?igshid=1fdejkwvh3925,0,1350509603696553984,,,,en,"Penrith, England",false,,0,,,"<a href=""http://instagram.com"" rel=""nofollow"">Instagram</a>","So for tonight’s #lockdown entertainment #liveufc on #btsport at a decent time in #england for once #ufc #ufcfightnight #maxholloway meets #calvinkattar in #theoctagon on #ufcfightisland #cheers @ Penrith, Cumbria https://t.co/HeHEpYuEKZ",https://twitter.com/nigelairey/status/1350509603696553984,Thu Nov 29 00:39:16 +0000 2012,977289451,false,Leave the children at home.......this is rock n' roll baby!,35823,333,563,30,Penrith Cumbria,Nigel,nigelairey,4693,,,false
"103.8677444,1.3553794",Sat Jan 16 19:39:02 +0000 2021,,,http://dlvr.it/Rqk1Kt,0,1350528004208775168,,,,en,"东北区, 新加坡",false,,0,,,"<a href=""https://dlvrit.com/"" rel=""nofollow"">dlvr.it</a>",Norway Vaccine Fatalities Among People 75 and Older Rise to 29 https://t.co/ZIbWaNq2FY,https://twitter.com/VishnoiSays/status/1350528004208775168,Sat Oct 10 12:18:47 +0000 2009,81342472,false,Asia markets,384,1006,824,41,,Abhishek,VishnoiSays,9311,,,false
"-0.27388889,51.44944444",Sat Jan 16 19:59:35 +0000 2021,,,https://www.instagram.com/p/CKHlPkyAIRs/?igshid=1rs4s7zfi5p7b,0,1350533174799921154,,,,en,"Richmond, London",false,,0,,,"<a href=""http://instagram.com"" rel=""nofollow"">Instagram</a>",Lockdown walk: yearning for a bit of wilderness after a week of WFH! @ Richmond Park https://t.co/YcUSnhkq49,https://twitter.com/maxderosee/status/1350533174799921154,Tue Jan 05 22:19:39 +0000 2010,102182891,false,"Director of architecture practice, DE ROSEE SA, with Claire Sa.
Follow @deroseesa for practice tweets.",386,333,243,14,London,Max de Rosee,maxderosee,1119,,http://www.deroseesa.com,false
"3.53114158,6.44238183",Sat Jan 16 19:29:48 +0000 2021,,,https://www.instagram.com/p/CKHh1frh1Xu/?igshid=36j97y91pxig,0,1350525680887459841,,,,en,"Victoria Island, Nigeria",false,,0,,,"<a href=""http://instagram.com"" rel=""nofollow"">Instagram</a>","Stay Safe out there guys 

Covid 19 is real @ Chevron,Lekki Peninsula https://t.co/SduEFgfKK3",https://twitter.com/whalemouth1/status/1350525680887459841,Sun Aug 28 23:25:32 +0000 2011,363941975,false,"STAND-UP COMEDIAN, ACTOR, FILMMAKER, FUTURE HUSBAND GEOLOGIST",1167,3494,2008,19,"ÜT: 5.790964,6.448962",WHALE MOUTH COMEDIAN,whalemouth1,8793,,http://www.whalemouthtv.com,false
"-73.56300186,45.49987026",Sat Jan 16 21:19:31 +0000 2021,News Montreal,,http://dlvr.it/RqkCS7,0,1350553293815103488,,,,en,"Montréal, Québec",false,,2,,,"<a href=""https://dlvrit.com/"" rel=""nofollow"">dlvr.it</a>","Quebec Is Getting Nearly 90,000 Less Pfizer Vaccines Than Expected By Next Month https://t.co/ykIcsuKB2Z #News #Montreal",https://twitter.com/mtlblog/status/1350553293815103488,Sat Sep 08 19:16:28 +0000 2012,811533451,false,"Welcome to Montreal’s digital downtown. Find out what's happening, where to go, and what to see — then choose your own adventure.🎡 Contact us at website below!",115076,133129,212,570,Montreal,MTL Blog,mtlblog,54586,,https://www.mtlblog.com/contact-us,true
"-4.309626,55.852472",Sat Jan 16 20:33:19 +0000 2021,,,http://news.sky.com/story/covid-19-astrazeneca-on-track-to-deliver-two-million-vaccine-doses-a-week-by-mid-february-as-it-calls-for-priority-access-12186734,0,1350541664033648641,,,,en,"Glasgow, Scotland",false,,0,,,"<a href=""http://oysttyer.github.io/oysttyer/"" rel=""nofollow"">oysttyer</a>","💾 ⓈⓀⓎ ⓉⒺⒸⒽ PM promises 24/7 jabs 'as soon as we can', as AstraZeneca on target for 2m doses a week - https://t.co/6HbnxCDYPY",https://twitter.com/_cirrus_minor_/status/1350541664033648641,Sat Sep 12 16:02:12 +0000 2009,73672052,false,"Most days  i'm a bot who resides in a Raspberry Pi Model B, cron  and #!/bin/bash are my best pals. Every other Saturday i  frequent the Penny Arcade. #watp",586,943,1327,175,"46.869100,103.848242",OnFileNotWanted,_cirrus_minor_,400288,,http://cirrusuk.wordpress.com,false
"-74.46848886,39.35713404",Sat Jan 16 21:31:32 +0000 2021,,,https://bit.ly/38NIlX4 http://cage-fights.com,0,1350556317602123778,,,,en,"Chelsea Heights, NJ",false,,0,,,"<a href=""https://dlvrit.com/"" rel=""nofollow"">dlvr.it</a>",MMA fighters struggle during the COVID-19 pandemic - KRQE News 13: MMA fighters struggle during the COVID-19 pandemic  KRQE News 13 https://t.co/MhZWJJmqwi via https://t.co/RnBkpWuMmh,https://twitter.com/NewJerseyMMA/status/1350556317602123778,Fri Sep 21 16:16:32 +0000 2012,838127347,false,Fighting News and Views from around the Web. MMA Community for Fighters and Fans,0,3403,2508,31,"Trenton, NJ",Cage-Fights.com NJ,NewJerseyMMA,12576,,http://cage-fights.com,false
"-6.43972222,53.39555556",Sat Jan 16 21:23:50 +0000 2021,tree theme nightphotography iphone,,https://www.instagram.com/p/CKHu4zBnrM-/?igshid=1hnzl9kirkjw1,0,1350554379221393414,,,,en,"Fingal, Ireland",false,,0,,,"<a href=""http://instagram.com"" rel=""nofollow"">Instagram</a>","Continuing the #lockdown#covid walks and the #tree #theme - loving the #nightphotography mode in the #iphone @ Ongar, Dublin https://t.co/EcxTMaHbOn",https://twitter.com/jedi_vincent/status/1350554379221393414,Tue Feb 10 22:06:50 +0000 2009,20551121,false,dubliner with a healthly disrespect for himself / gp / running / painting / photos,3338,460,1884,49,Dublin,ronan mcloughlin,jedi_vincent,10384,,http://www.facebook.com/ronmcphotos,false
"20.55541992,38.26554556",Sat Jan 16 19:43:19 +0000 2021,divein diving boatlife diveboat scubadiving ocean waterbaby greece mediterranean sea missthis covid lockdown takemeback islandlife,,https://www.instagram.com/p/CKHjYaSMKRX/?igshid=1jtgk0nnowffe,2,1350529083910848517,,,,en,"Πύλαρος, Ελλάς",false,,0,,,"<a href=""http://instagram.com"" rel=""nofollow"">Instagram</a>","The moment lockdown ends 💦

#divein #diving #boatlife #diveboat #scubadiving #ocean #waterbaby #greece #mediterranean #sea #missthis #covid #lockdown #takemeback #islandlife @ Kefalonia Greece https://t.co/dYzFpuDUGm",https://twitter.com/Scuba_Siren/status/1350529083910848517,Mon Nov 26 15:17:18 +0000 2012,972140172,false,"PADI MSDT #scuba instructor, #freediver, #surfer & writer. #Shark fanatic, passionate conservationist & avid traveller. Instagram: @Scuba_Siren",820,1851,943,91,"Sami, Greece",☮ Poppy Julianna ☮,Scuba_Siren,6358,,http://scubasiren.blogspot.co.uk/,false
"-1.31362821,51.74758911",Sat Jan 16 18:55:34 +0000 2021,,,,1,1350517066110029824,,,,en,"Cumnor, England",,,1,,,"<a href=""http://tapbots.com/tweetbot"" rel=""nofollow"">Tweetbot for iΟS</a>","I see a well-known bell-end has bought a badge saying he is exempt from wearing a mask. Maybe the lanyard will protect him from covid, instead…",https://twitter.com/Steve_Irv/status/1350517066110029824,Wed Jun 02 09:01:57 +0000 2010,150978926,false,"Ex-RAF. Oxford, London, Gran Can, Belfast.",3644,749,748,16,Oxford,Steve,Steve_Irv,89686,,,false
"-0.1094,51.5141",Sat Jan 16 20:36:27 +0000 2021,mervebayindir millinery editorial hat fashion style stayhome staysafe lockdownstyle fashion accesories,,https://www.instagram.com/p/CKHpdryLDA0/?igshid=13rjvm17oevm6,0,1350542455716757511,,,,en,"City of London, London",false,,0,,,"<a href=""http://instagram.com"" rel=""nofollow"">Instagram</a>","“Knock knock ✊ ✊ ✊” 

🤍🖤🤍🖤🤍
#mervebayindir millinery for @neighbor.magazine editorial 

🖤🤍🖤🤍🖤
#millinery #2020 #editorial #hat #fashion #style #stayhome #staysafe #lockdownstyle #fashion #accesories https://t.co/8bojupjYc5",https://twitter.com/MerveBayindirUK/status/1350542455716757511,Tue Aug 16 12:51:25 +0000 2016,765531409717030913,false,"All the hats, millinery, fascinators and headpieces seen in this profile are designed and created by Merve Bayindir Millinery.",77,36,3,13,"London, England",Merve Bayındır,MerveBayindirUK,1151,,http://mervebayindir.com,false
"-4.46744442,55.8113141",Sat Jan 16 20:29:57 +0000 2021,Harrypotter lego covid_19,,https://www.instagram.com/p/CKHot-jrWZH/?igshid=1ccdlnr6vg3r4,0,1350540819439050754,,,,en,"Scotland, United Kingdom",false,,0,,,"<a href=""http://instagram.com"" rel=""nofollow"">Instagram</a>",The hall is complete #Harrypotter #lego #covid_19 @ Gleniffer Braes https://t.co/IfLI7ggWMZ,https://twitter.com/Ryker5/status/1350540819439050754,Mon Jun 22 22:11:10 +0000 2009,49784915,false,Live long n prosper!,31132,250,651,12,"Paisley, Scotland",Ginger Nugget,Ryker5,10157,,,false
"-55.17978289,5.83469504",Sat Jan 16 20:08:25 +0000 2021,food takeout indianfood curry roti foodporn friends,,https://www.instagram.com/p/CKHmQXala7V/?igshid=ynis3u962mgz,0,1350535400218112002,,,,en,Suriname,false,,0,,,"<a href=""http://instagram.com"" rel=""nofollow"">Instagram</a>","When you go for take out and you meet your friend spontaneously, get yourself a drink while waiting for your food 🥳🥳small social moments in Covid times 🥰 #food #takeout #indianfood #curry #roti #foodporn #friends https://t.co/pouow64z73",https://twitter.com/ruthsinkeler/status/1350535400218112002,Tue Jul 13 21:36:36 +0000 2010,166320113,false,Ondernemer in Suriname sinds 2015 na 32 jaar Nederland. Trainer|Spreker| Schrijver van Sexy Leiderschap boek. Tweet uitgesproken mening en over mijn bedrijf.,922,531,518,57,"Paramaribo, tweets Dutch & Eng",Ruth L. Sinkeler,ruthsinkeler,5045,,https://ruthsinkeler.com/,false
"-1.14803769,52.94088818",Sat Jan 16 21:47:18 +0000 2021,,,https://twitter.com/Ian_Fraser/status/1350514126871801858,1,1350560283270459399,,,,en,"Nottingham, England",false,1350514126871801858,1,,,"<a href=""http://tapbots.com/tweetbot"" rel=""nofollow"">Tweetbot for iΟS</a>","Sea shanties, funny, interesting animal videos. All part of my spare time in lockdown 3.0. https://t.co/L9wdVpsXYR",https://twitter.com/cllrtobyneal/status/1350560283270459399,Wed Nov 03 00:22:50 +0000 2010,211343974,false,Executive Member for Housing & Human Resources. Labour Councillor for Berridge Ward @mynottingham. GMB member,1901,1791,1310,35,Nottingham,🌈Toby Neal says Join a Union,cllrtobyneal,11350,,,false
"-74.0647,40.7114",Sat Jan 16 20:54:36 +0000 2021,,,https://www.instagram.com/p/CKHrieGh8UG/?igshid=zvxohv3dqsq9,0,1350547020092620800,,,,en,"Jersey City, NJ",false,,0,,,"<a href=""http://instagram.com"" rel=""nofollow"">Instagram</a>","Throw back shot of @andrew.maisonette . I can't wait to get back to shooting... be safe everyone, just had a friend put in a coma because of covid... let's just wait. @ Jersey City, New Jersey https://t.co/eIRHiwKri8",https://twitter.com/BernardGPhotog/status/1350547020092620800,Sun Jan 18 23:04:50 +0000 2015,2984839756,false,DM twitter/MM/IG for your photo shoot with me!  NY/NJ area. https://t.co/QHvPu7KvTs - https://t.co/UeyeWDtvEc - www.instagram.bernardgphotography1.0,63872,2246,2975,20,"Manhattan, NY",BernardG Photography,BernardGPhotog,3916,,https://instagram.com/bernardgphotography1.0,false
"-77.59,37.38",Sat Jan 16 23:54:49 +0000 2021,,,https://www.instagram.com/p/CKIAJLfgeUYtxU2bNAm_zGsGcRM3z-oR29IO8A0/?igshid=14ldi48r5da1d,1,1350592372376276994,,,,en,"Virginia, USA",false,,0,,,"<a href=""http://instagram.com"" rel=""nofollow"">Instagram</a>","Changes in Longitude, Traveling during covid-19. Aaron Jetsetter Sutherland shares about luxury travel Traveling on a budget and so much more. @ Chesterfield County, Virginia https://t.co/5m0bP3zWHs",https://twitter.com/SabrinaMerriman/status/1350592372376276994,Wed Jan 06 01:22:25 +0000 2010,102228794,false,"Google me!!! https://t.co/MOgirO913Y 
https://t.co/7FY5D7AaUO 
https://t.co/3ayZjMFRLk 
https://t.co/BswFDbzckV",33,253,274,19,World Wide/ International,Sabrina Merriman,SabrinaMerriman,21403,,http://www.InnoCentBeautyCollections.com,false
"-73.56725453,45.75975883",Sat Jan 16 22:36:33 +0000 2021,,,http://dlvr.it/RqkLT2,0,1350572676243361792,,,,en,"Mascouche, Québec",false,,0,,,"<a href=""https://dlvrit.com/"" rel=""nofollow"">dlvr.it</a>","Fighting Stigma: How did Ireland jump from low Covid base to world's highest infection rate?: The Government went against the advice of the National Public Health ... Four days before Christmas, as a third wave was declared, chief medical ... https://t.co/lyTzLiOyJV",https://twitter.com/StigmabaseN/status/1350572676243361792,Wed Sep 15 15:55:47 +0000 2010,191092262,false,Ireland — Scotland — Inuit —  Svenska  | Keeping up-to-date on global exclusion — Stigmabase is a canadian internet non-profit Initiative,0,1611,1297,110,Ireland | Scotland | Inuit | Skandinavien,Stigmabase | NORDIC,StigmabaseN,951806,,https://www.stigmabase.org/,false
"-120.06906733,47.83531003",Sat Jan 16 23:44:28 +0000 2021,,,https://www.instagram.com/p/CKH--oNgRhi/?igshid=why33hxmc60o,0,1350589769122770957,,,,en,"Washington, USA",false,,0,,,"<a href=""http://instagram.com"" rel=""nofollow"">Instagram</a>",Sometimes you just need a little getaway during a pandemic. Thankful for our winery friends that are providing safe ways to enjoy wine and being away from home. Cheers! 🍷😷🍷 @ Mellisoni Vineyards https://t.co/bJx4id2LZw,https://twitter.com/SSFCFOTY13/status/1350589769122770957,Wed Jul 08 20:32:58 +0000 2009,55019353,false,"Sounders, Cougs, M’s, you can usually find me in the produce aisle or a farmers market. Lover of wine and traveling the world. 🐈 dad he/him",113248,1749,1866,89,"Seattle, WA",Mark 🇺🇦,SSFCFOTY13,134958,,,false
"-0.46369,52.13921",Sat Jan 16 23:16:31 +0000 2021,,,https://www.instagram.com/p/CKH7xRYn9s4/?igshid=14u5o8vh02bpw,0,1350582735677624320,,,,en,"Bedford, England",false,,0,,,"<a href=""http://instagram.com"" rel=""nofollow"">Instagram</a>","Shagadelic baby yeah! Who knew Bedford was the home of reimagined movies? What creative stuff have you been doing in lockdown? @ Bedford, Bedfordshire, United Kingdom https://t.co/tgyPoHLdSC",https://twitter.com/RonYellonART/status/1350582735677624320,Sat Jan 04 20:30:42 +0000 2020,1213558304938442752,false,"Contemporary artist in Bedford UK. 
Acrylic paintings - Giclée prints - Commissions 
Eclectic styles: Abstract, Experiential & Re-imaginings
Gallery & Store at",78,44,82,1,"Bedford, England",Ron,RonYellonART,304,,http://www.RonYellonART.com,false
"-73.80412,41.18762",Sat Jan 16 22:35:34 +0000 2021,,,https://www.instagram.com/p/CKH3GAOrwpQ/?igshid=1q54lpmm8m4b0,0,1350572430142664707,,,,en,"Chappaqua, NY",false,,0,,,"<a href=""http://instagram.com"" rel=""nofollow"">Instagram</a>","...and this bunch is DONE👏🏼WITH👏🏼SELF👏🏼QUARANTINE👏🏼 @ Millwood, New York https://t.co/XzP5h6BkOn",https://twitter.com/ang_byrne/status/1350572430142664707,Tue Jun 24 19:06:53 +0000 2008,15222925,false,Midwest 👉🏼 NYC 👉🏼 Suburbia,1450,407,772,24,"Chappaqua, NY",Angela Mae,ang_byrne,10585,,,false
"-73.56725453,45.75975883",Sun Jan 17 01:33:33 +0000 2021,,,http://dlvr.it/RqkdKF,0,1350617220682903553,,,,en,"Mascouche, Québec",false,,0,,,"<a href=""https://dlvrit.com/"" rel=""nofollow"">dlvr.it</a>",Fighting Stigma: Q&amp;A: Covid-19 new variants in Ireland - everything you need to know: What does this mean for public health policy and restrictions during the pandemic? So opening up economies after lockdown; cold weather driving ... https://t.co/zfY5OlU1Rv,https://twitter.com/StigmabaseN/status/1350617220682903553,Wed Sep 15 15:55:47 +0000 2010,191092262,false,Ireland — Scotland — Inuit —  Svenska  | Keeping up-to-date on global exclusion — Stigmabase is a canadian internet non-profit Initiative,0,1611,1297,110,Ireland | Scotland | Inuit | Skandinavien,Stigmabase | NORDIC,StigmabaseN,951806,,https://www.stigmabase.org/,false
"-86.775194,36.161907",Sun Jan 17 01:25:53 +0000 2021,LiveStreamMusic Rock Alternative,,https://www.StreetJelly.com/-Wolff,0,1350615293312307202,,,,en,"Nashville, TN",false,,0,,,"<a href=""http://www.StreetJelly.com"" rel=""nofollow"">StreetJelly</a>",#LiveStreamMusic -Wolff Rock the Lockdown !! https://t.co/LEbfFmvSkX #Rock #Alternative,https://twitter.com/StreetJelly/status/1350615293312307202,Mon Mar 19 01:15:00 +0000 2012,528993213,false,Live streaming musicians everywhere. Do you Jelly?,279,1344,1777,75,"Sevierville / Knoxville, TN",StreetJelly,StreetJelly,54543,,http://StreetJelly.com,false
"-96.70641571,40.77570753",Sat Jan 16 23:14:23 +0000 2021,,,https://www.instagram.com/p/CKH7iVgBBdA/?igshid=1f5kik354jbgf,0,1350582198597021697,,,,en,"Lincoln, NE",false,,0,,,"<a href=""http://instagram.com"" rel=""nofollow"">Instagram</a>",COVID sux found the cure for the virus! @ Lincoln Escape Room https://t.co/MQO4e3zgfS,https://twitter.com/402EscapeRoom/status/1350582198597021697,Sat May 30 03:05:21 +0000 2015,3230235570,false,An escape room is a physical puzzle adventure that challenges your mind--Solve a series of puzzles and find hidden clues to escape in under 60 minutes!,14,173,97,2,"3700 S 9th St Lincoln, NE",Lincoln Escape Room,402EscapeRoom,15458,,http://lincolnescaperoom.com,false
"-94.6765,39.1068",Sun Jan 17 01:03:36 +0000 2021,wearamask 100daysofmasks gochiefs,,https://www.instagram.com/p/CKIICNlsemYZlIhXCbgn1W_UEQzEY8Ksj3aCbg0/?igshid=2xkgdmphn0vh,0,1350609683455893507,,,,en,"Kansas, USA",false,,0,,,"<a href=""http://instagram.com"" rel=""nofollow"">Instagram</a>","Day 28 - Go Chiefs!!
#wearamask #100daysofmasks #gochiefs @ Kansas City, Kansas https://t.co/XSG18Vxc2w",https://twitter.com/casper_karla/status/1350609683455893507,Tue Jan 28 17:28:24 +0000 2014,2315835553,false,,75,17,41,0,,Karla Casper,casper_karla,98,,,false
"-78.3066356,44.2929283",Sun Jan 17 01:00:22 +0000 2021,Shoutoutsaturday TeamPtbo,https://twitter.com/ptbochamber/status/1350608872386519040/photo/1,,1,1350608872386519040,,,,en,"Peterborough, Ontario",false,,1,,,"<a href=""https://www.hootsuite.com"" rel=""nofollow"">Hootsuite Inc.</a>","#Shoutoutsaturday

Do you know a front line or essential worker?
Give them a SHOUT OUT  in the comments⬇️⬇️

👏Thank you to all the workers💪💪 out there keeping us safe, healthy and fed.

To everyone who risks their health for us at home, thank you 🙏

#TeamPtbo https://t.co/7HAh5Q9Xsx",https://twitter.com/ptbochamber/status/1350608872386519040,Wed Dec 02 15:46:49 +0000 2009,94114408,false,"The Chamber acts as a catalyst to enhance business growth and opportunity, innovation, partnerships and a diverse Business Community. #strengtheningbusiness",5587,7864,1919,223,"Ontario, Canada",PKChamber,ptbochamber,15695,,https://linktr.ee/pkchamber,false
"-77.0367,38.8951",Sat Jan 16 22:30:28 +0000 2021,Inauguration2021 lockdown officialtdcent dmv tdcphotography fox5dc,,https://www.instagram.com/p/CKH2gtBh44q/?igshid=f83eg6wx1f5c,1,1350571145850982401,,,,en,"Washington, DC",false,,0,,,"<a href=""http://instagram.com"" rel=""nofollow"">Instagram</a>","Today our city is lockdown for #Inauguration2021 #lockdown #officialtdcent #dmv #tdcphotography 
January 16, 2021
 @fox5dc #fox5dc 
Photo by @curtiscarroll9547 @ Washington D.C. https://t.co/nB3NaZS3Sh",https://twitter.com/StudiosTdc/status/1350571145850982401,Thu Apr 09 17:09:39 +0000 2020,1248296983627956227,false,"Get to know me, and you will see, I'm a blessing ✌👑
.
$tdcent",1700,118,516,0,"Washington, DC",Mr. Igotyou,StudiosTdc,911,,https://onlyfans.com/tdc_ent1,false
"-90.070864,29.948479",Sun Jan 17 00:02:04 +0000 2021,,,https://www.instagram.com/p/CKIA_nQnQHZ/?igshid=krzho1xgob6t,0,1350594197967892484,,,,en,"New Orleans, LA",false,,0,,,"<a href=""http://instagram.com"" rel=""nofollow"">Instagram</a>",Regina King 🥰🥰🥰🥰🥰🥰🥰🥰🥰 every network should have a Regina marathon @bouncetv @ Quarantine Nola 2020 https://t.co/E47ZApr3zK,https://twitter.com/princesshoped/status/1350594197967892484,Sun Feb 14 00:33:44 +0000 2010,114062044,false,Myasthenia Gravis ❄️Graves disease Twin Mama FinerWoman 💙🕊 #WhoDat🖤💛⚜️ LSU'05 Agribusiness-South Baton Rouge Native ✊🏿I cuss alot,351296,2369,3338,19,"New Orleans, LA",Little Red Corvette,princesshoped,279130,,https://gofund.me/795e7adc,false
"-73.60015869,45.57175504",Sun Jan 17 00:11:17 +0000 2021,stayhome morijasmine,,https://www.instagram.com/p/CKH5-cpjjx7/?igshid=sdtbzxzesk25,1,1350596518403858435,,,,en,"Montréal, Québec",false,,0,,,"<a href=""http://instagram.com"" rel=""nofollow"">Instagram</a>",Pj’s are the new night-out attire! Loving my new pure silk pyjama set from @morijasmine_official Link in Bio to discover this lovely local brand! 🤍 #stayhome with #morijasmine @ Greater Montreal https://t.co/Z8klBXgg3o,https://twitter.com/eliinthewalkin/status/1350596518403858435,Mon Jan 27 01:26:33 +0000 2014,2312786406,false,"Fashion Blogger born in Colombia | Living in Montreal | In Love with NY| Fashion, Travel & $hopping are my thing..! eliggarcia on IG & Snapchat!",363,337,226,30,,EliGGarcia,eliinthewalkin,3257,,http://www.eliinthewalk-in.com,false
"-6.03333333,57.4",Sun Jan 17 00:20:29 +0000 2021,lockdown outandabout hiddenscotland winterscenes,,https://www.instagram.com/p/CKIDGgcL2o9/?igshid=qvphdss4bjuf,0,1350598833496076291,,,,en,"Scotland, United Kingdom",false,,0,,,"<a href=""http://instagram.com"" rel=""nofollow"">Instagram</a>","Hitting the trail

#lockdown #outandabout #hiddenscotland #winterscenes @ Raasay https://t.co/sbL0uikKVW",https://twitter.com/Davedaveydave/status/1350598833496076291,Tue Jun 07 16:27:21 +0000 2011,312755295,false,"City boy turned island dweller.  Enemy of the people, saboteur and maudlin drunk. 

I aim to misbehave.",5208,209,1889,4,"Inverarish, Scotland",David Carslaw,Davedaveydave,4392,,http://Flickr.com/raasayweb,false
