coordinates,created_at,hashtags,media,urls,favorite_count,id,in_reply_to_screen_name,in_reply_to_status_id,in_reply_to_user_id,lang,place,possibly_sensitive,quote_id,retweet_count,retweet_id,retweet_screen_name,source,text,tweet_url,user_created_at,user_id,user_default_profile_image,user_description,user_favourites_count,user_followers_count,user_friends_count,user_listed_count,user_location,user_name,user_screen_name,user_statuses_count,user_time_zone,user_urls,user_verified
"-93.2982,37.2153",Thu Sep 23 19:15:39 +0000 2021,,,https://www.columbiamissourian.com/news/state_news/missouri-physicians-worried-about-rise-in-severe-complications-among-covid-19-positive-pregnant-women/article_f2a93a8a-1b27-11ec-b1fe-4f6e7de1d5ef.html,0,1441119084804907009,,,,en,"Missouri, USA",false,,0,,,"<a href=""https://help.twitter.com/en/using-twitter/how-to-tweet#source-labels"" rel=""nofollow"">heapevents.info</a>","Missouri Physicians Worried About Rise In Severe Complications Among Covid Positive Pregnant Women ☝ 🙂 
 https://t.co/UuXogmMi1f",https://twitter.com/heapevents/status/1441119084804907009,Sat Jan 09 15:58:46 +0000 2021,1347935690332495877,false,just heap of US events,0,7,25,1,,heapevents.info,heapevents,21294,,https://www.heapevents.info/,false
"151.783,-32.9167",Fri Sep 24 01:10:39 +0000 2021,covid lockdown love blessed thankful,,https://www.instagram.com/p/CUL3ksNJ2aJ/?utm_medium=twitter,0,1441208426009350144,,,,en,"Newcastle, New South Wales",false,,0,,,"<a href=""http://instagram.com"" rel=""nofollow"">Instagram</a>","Lockdown mornings 😘Love ya babe 🥰 #covid #lockdown #love #blessed #thankful 🙏😷 @ Stockton, New South Wales, Australia https://t.co/lY7WWV0Q4y",https://twitter.com/mnstylin/status/1441208426009350144,Thu Mar 12 11:02:12 +0000 2009,23931133,false,"Passionate about life, God, Sal & my boys. I love connecting with people & connecting them to God.",607,260,111,15,,Matt Nichols,mnstylin,9021,,,false
"-123.12316786,49.3158291",Fri Sep 24 00:05:07 +0000 2021,,,http://dlvr.it/S89fCB,0,1441191933116702727,,,,en,"North Vancouver, British Columbia",false,,1,,,"<a href=""https://dlvrit.com/"" rel=""nofollow"">dlvr.it</a>","AMGMT — Aid for AIDS Wants Your Unused HIV Meds, Now More Than Ever: Donations dropped 70% due to COVID-19, and Americans on HIV treatment today have fewer unused meds, says the nonprofit's founder. View article... https://t.co/AdKNMVjBn1",https://twitter.com/StigmabaseE/status/1441191933116702727,Fri Sep 03 15:34:08 +0000 2010,186478529,false,Español - Português | Keeping up-to-date on global exclusion — Stigmabase is a canadian internet non-profit Initiative,0,1969,857,151,Las Américas | España,Stigmabase | ES,StigmabaseE,1037261,,https://www.stigmabase.org/,false
"-123.12316786,49.3158291",Fri Sep 24 00:05:03 +0000 2021,,,http://dlvr.it/S89f72,0,1441191915953614864,,,,en,"North Vancouver, British Columbia",false,,1,,,"<a href=""https://dlvrit.com/"" rel=""nofollow"">dlvr.it</a>","AMGMT — As COVID-19 cases rise, Idaho organizations continue to fight misinformation aimed at Latinos: As misinformation continues to target the Latino population, La Perrona Radio has worked with the South Central Public Health District and other health… https://t.co/EyBqngSEEv",https://twitter.com/StigmabaseE/status/1441191915953614864,Fri Sep 03 15:34:08 +0000 2010,186478529,false,Español - Português | Keeping up-to-date on global exclusion — Stigmabase is a canadian internet non-profit Initiative,0,1969,857,151,Las Américas | España,Stigmabase | ES,StigmabaseE,1037261,,https://www.stigmabase.org/,false
"-77.02848481,38.99605469",Thu Sep 23 22:09:04 +0000 2021,,,http://sourceofthespring.news/S896W1,3,1441162725845975044,,,,en,"Silver Spring, MD",false,,1,,,"<a href=""https://dlvrit.com/"" rel=""nofollow"">dlvr.it</a>","Events Calendar: FREE COVID-19 Tests + Vaccines in Montgomery County, MD https://t.co/NiYJloMqfT",https://twitter.com/SourcetheSpring/status/1441162725845975044,Fri Jul 08 20:12:30 +0000 2016,751509284362522624,false,"The latest Local and Breaking Community News for Silver Spring & Takoma Park, MD. News Tips: https://t.co/47KI8iaOkO",18221,4830,464,72,"Silver Spring, MD",Source of the Spring,SourcetheSpring,27568,,http://www.sourceofthespring.com,false
"8.6709,50.1154",Thu Sep 23 23:46:24 +0000 2021,PHOTOBOMB memories tbt,,https://www.instagram.com/p/CULt523jALqExMV5Ga5TWtH0MvxhPSSk6tm9-80/?utm_medium=twitter,0,1441187221843767298,,,,en,"Frankfurt am Main, Deutschland",false,,0,,,"<a href=""http://instagram.com"" rel=""nofollow"">Instagram</a>","Good old days before coRONA times. 
#PHOTOBOMB #memories #tbt @ Frankfurt, Germany https://t.co/KSz15NQAPB",https://twitter.com/_imsrs_/status/1441187221843767298,Sat Jun 30 21:37:29 +0000 2012,623241228,false,#9/11 #virgo ❤️ #mrworldwide #qatar قطر #GYMaholic #traveller ✈️ ✌️✌,76,273,201,8,,♔Just A(• _ •)Human♔,_imsrs_,3105,,https://www.instagram.com/justa.human_/,false
"100.67705078,13.76598429",Fri Sep 24 00:01:41 +0000 2021,,,http://dlvr.it/S89czr,0,1441191070725914630,,,,en,"สะพานสูง, ประเทศไทย",false,,0,,,"<a href=""https://dlvrit.com/"" rel=""nofollow"">dlvr.it</a>","HKGMT —   China's 'zero tolerance' COVID-19 policy to safeguard the country to withstand epidemic ...: Shortly after Harbin, capital of Heilongjiang Province reported three positive COVID-19 cases on Tuesday, the city's anti-epidemic group announced… https://t.co/PD0fsI4gAC",https://twitter.com/StigmabaseU/status/1441191070725914630,Tue Oct 26 15:04:54 +0000 2010,208056970,false,Asia — भारत  — Türkçe — Čeština — ελληνικά | Keeping up-to-date on global exclusion — Stigmabase is a canadian internet non-profit Initiative,0,2528,2405,117,WORLDWIDE,Stigmabase | UN,StigmabaseU,1607140,,https://www.stigmabase.org/,false
"28.112736,-25.74765013",Thu Sep 23 17:49:35 +0000 2021,simmzlings youtubechannel comedy mjolo mjolothepandemic comedyskits,,https://www.instagram.com/p/CULFCYUL7_4/?utm_medium=twitter,0,1441097427323293699,,,,en,"Pretoria, South Africa",false,,0,,,"<a href=""http://instagram.com"" rel=""nofollow"">Instagram</a>","MJOLO THE PANDEMIC
Full Video on YouTube ‼‼‼
LINK IN BIO Watch it Now!!!!!
📽:@aobakwe_15

#simmzlings #youtubechannel #comedy #mjolo #mjolothepandemic #comedyskits @ Madeira Isles Security Complex https://t.co/5hG4gVYoHu",https://twitter.com/simmzlings/status/1441097427323293699,Tue Mar 05 20:30:14 +0000 2019,1103029974934736899,false,"Focus on your goals
MC               
For Booking 
Email :mashimane062158@gmail.com

       
  
Subscribe To my YouTube channel",19458,955,776,0,"Pretoria, South Africa",Simphiwe Maphumulo,simmzlings,202,,https://youtu.be/li4s4t1D9EA,false
"-0.13608912,51.50413561",Thu Sep 23 19:00:02 +0000 2021,,,http://dlvr.it/S88SKw,0,1441115157334089730,,,,en,"London, England",false,,1,,,"<a href=""https://dlvrit.com/"" rel=""nofollow"">dlvr.it</a>","Travel agent warning to same-sex couples after being asked to book Maldives trip: And with more long-haul destinations opening up to UK holidaymakers following the lockdown, he has issued a warning to those who are unaware that any affection ... https://t.co/t9zquBRIUo",https://twitter.com/StigmabaseO/status/1441115157334089730,Thu Apr 29 13:56:48 +0000 2010,138418838,false,Americas — United Kingdom  | Keeping up-to-date on global exclusion — Stigmabase is a canadian internet non-profit Initiative. Founded in 2010,0,4143,3742,262,Americas | United Kingdom,Stigmabase | ORG,StigmabaseO,1828864,,https://www.stigmabase.org/,false
"-123.12713019,49.24963985",Fri Sep 24 00:01:33 +0000 2021,,,http://dlvr.it/S89cxD,0,1441191037184069640,,,,en,"Vancouver, British Columbia",false,,1,,,"<a href=""https://dlvrit.com/"" rel=""nofollow"">dlvr.it</a>","KRGMT —   S.Korea urges more testing over fear of holiday COVID-19 surge: South Korean authorities warned people returning from a holiday to get tested even for the mildest COVID-19 type symptoms, especially before ... View article... https://t.co/jxrUvDM9q0",https://twitter.com/StigmabaseU/status/1441191037184069640,Tue Oct 26 15:04:54 +0000 2010,208056970,false,Asia — भारत  — Türkçe — Čeština — ελληνικά | Keeping up-to-date on global exclusion — Stigmabase is a canadian internet non-profit Initiative,0,2528,2405,117,WORLDWIDE,Stigmabase | UN,StigmabaseU,1607140,,https://www.stigmabase.org/,false
"-111.07427917,45.67070719",Fri Sep 24 00:39:03 +0000 2021,,,http://dlvr.it/S89mqB,3,1441200471104884736,,,,en,"Bozeman, MT",false,,0,,,"<a href=""https://dlvrit.com/"" rel=""nofollow"">dlvr.it</a>","Health care workers deal with burnout, shortages amid latest COVID-19 surge in Montana https://t.co/VsYkw8KgLU",https://twitter.com/bozchron/status/1441200471104884736,Wed Mar 04 00:33:58 +0000 2009,22707076,false,The official Twitter feed for the Bozeman Daily Chronicle.,92,21690,1279,468,"Bozeman, Montana",Bozeman Daily Chronicle,bozchron,104285,,http://bozemandailychronicle.com/,false
"-5.9811392,54.5538617",Thu Sep 23 18:05:03 +0000 2021,NIbusiness Belfast,,https://www.tallpaulmarketing.com/ni-business-tenants-protection-extended-until-march-2022/,0,1441101317066293248,,,,en,"Belfast, Northern Ireland",false,,0,,,"<a href=""https://www.hootsuite.com"" rel=""nofollow"">Hootsuite Inc.</a>","Northern Ireland Finance Minister Conor Murphy has extended emergency protection for NI business tenants having difficulty paying rent on commercial leases as a result of the pandemic until March 2022.

Read more &gt;&gt; https://t.co/UTxRGqI7k9

#NIbusiness #Belfast",https://twitter.com/TallPaulNI/status/1441101317066293248,Mon May 15 09:47:43 +0000 2017,864054679013076992,false,Freelance 📝 #Copywriter 💻 #ContentWriter 📲 #BlogWriter.           Get my weekly newsletter Paul of Duty: Modern Marketing by clicking the link below. 👇,542,304,870,2,"Belfast, Northern Ireland",Paul Malone,TallPaulNI,594,,http://www.tallpaulmarketing.com/newsletter,false
"-117.6241,34.0261",Thu Sep 23 22:19:23 +0000 2021,,,https://www.instagram.com/p/CULj-K7PAxE/?utm_medium=twitter,0,1441165322157887497,,,,en,"Ontario, CA",true,,0,,,"<a href=""http://instagram.com"" rel=""nofollow"">Instagram</a>","For those of us received Pfizer BioNtech vaccine it’s “BOOSTER” time! @ Ontario, California https://t.co/bw9LIOFV0b",https://twitter.com/MrCInCali/status/1441165322157887497,Tue Mar 03 19:32:56 +0000 2009,22664654,false,"My tweets are my liberal opinions on issues & topics of interest to me. Retweets are an endorsement, unless otherwise said. #StrongerTogether #HR4-VRA 🏳️‍🌈",8474,315,1001,10,"Southern California, USA",MrC 🤎🗳🕊⚖️,MrCInCali,20698,,,false
"-2.11834885,52.50207168",Thu Sep 23 19:06:14 +0000 2021,NHS,,https://www.instagram.com/p/CULN3aFImTj4_BHCO5xfvwyfUGDDAmldisMFi80/?utm_medium=twitter,1,1441116716981899270,,,,en,"Dudley, England",false,,0,,,"<a href=""http://instagram.com"" rel=""nofollow"">Instagram</a>",Thanks my #NHS. Reward for no sick leave during pandemic. I am glad I can help. @ Russells Hall Hospital https://t.co/BylXof0Di9,https://twitter.com/Biggs010/status/1441116716981899270,Wed Mar 18 10:42:58 +0000 2009,25054694,false,"Proud Socialist, father, inspiring and kind person, Staff Nurse at #RussellsHallHospital , passionate, love #BelowDeck own a #midori ALL VIEWS ARE MY OWN",6877,1256,5000,29,"ÜT: 52.4445832,-2.1321759",Dominic Allan,Biggs010,11496,,,false
"16.41560835,48.1739745",Thu Sep 23 22:35:03 +0000 2021,corona covid19 covid,,http://dlvr.it/S89DBm,0,1441169266150035457,,,,en,"Wien, Österreich",false,,0,,,"<a href=""https://dlvrit.com/"" rel=""nofollow"">dlvr.it</a>",🇦🇹 Long Covid Behandlung https://t.co/OCEME9eKro #corona #covid19 #covid,https://twitter.com/covid_watch/status/1441169266150035457,Wed Mar 18 16:28:15 +0000 2020,1240313872927653892,false,"Covid-19 Ticker für AT 🇦🇹, operated by @50n1cb00m | Quelle: @echobot | #Covid19at | Disclaimer: Links spiegeln nicht (zwingend) unseren Standpunkt wider.",223,213,143,9,Austria,Covid-19 Ö-Watch,covid_watch,33785,,https://sonicboom.agency/,false
"-77.0487329,44.1953988",Thu Sep 23 18:33:16 +0000 2021,,,https://www.deseronto.ca/blog/2021/8/16/covid-19-vaccine-pop-up-clinic-djykz,1,1441108421688758274,,,,en,"Deseronto, Ontario",false,,1,,,"<a href=""http://www.squarespace.com"" rel=""nofollow"">Squarespace</a>",COVID-19 Vaccine Pop-Up Clinic - October 15  https://t.co/s2w15x9AMW,https://twitter.com/Deseronto1/status/1441108421688758274,Thu May 03 06:17:27 +0000 2012,569734741,false,Town of Deseronto information and events. Visit Deseronto's website at https://t.co/fw3dd3OdAR.,72,393,158,20,"Deseronto, Ontario, Canada",deseronto@deseronto.ca,Deseronto1,918,,http://www.deseronto.ca,false
"-122.7756216,45.5064511",Thu Sep 23 23:27:33 +0000 2021,,https://twitter.com/EarlPdxPearl/status/1441182479574974466/photo/1,http://dlvr.it/S89Svg,1,1441182479574974466,,,,en,"West Slope, OR",false,,1,,,"<a href=""https://dlvrit.com/"" rel=""nofollow"">dlvr.it</a>",FDA Panel Member On COVID Vaccines: ‘Heart Attacks Happen 71 Times More Often….’ https://t.co/dxcpbKtyw8 https://t.co/OdidY9wRCO,https://twitter.com/EarlPdxPearl/status/1441182479574974466,Wed Aug 12 02:52:34 +0000 2009,64914137,false,"Oregon Republican Christian Conservative focused on truth about Left Wing Radical @RepBlumenauer ,   #Trump Supporter.  #DrainTheSwamp",27,18705,22444,353,"Portland, OR",Earl Pearl,EarlPdxPearl,49325,,http://www.judicialwatch.org/,false
"-0.13608912,51.50413561",Thu Sep 23 17:03:06 +0000 2021,,,http://dlvr.it/S885XK,0,1441085728197267458,,,,en,"London, England",false,,1,,,"<a href=""https://dlvrit.com/"" rel=""nofollow"">dlvr.it</a>","Sharing vaccines is in our self-interest as nobody is safe until everybody is - The Mirror: ... now her only interest in the brief has been to score cheap political points and make offensive comments about race, media and gay rights. https://t.co/GgRGCwyTMA",https://twitter.com/StigmabaseO/status/1441085728197267458,Thu Apr 29 13:56:48 +0000 2010,138418838,false,Americas — United Kingdom  | Keeping up-to-date on global exclusion — Stigmabase is a canadian internet non-profit Initiative. Founded in 2010,0,4143,3742,262,Americas | United Kingdom,Stigmabase | ORG,StigmabaseO,1828864,,https://www.stigmabase.org/,false
"-74.14566856,40.54589666",Thu Sep 23 19:52:11 +0000 2021,,,https://www.instagram.com/p/CULTIIxLpx7/?utm_medium=twitter,0,1441128280438968322,,,,en,"Staten Island, NY",false,,0,,,"<a href=""http://instagram.com"" rel=""nofollow"">Instagram</a>","Confirmed Covid-19 Case
9/23/21 @ I.S. 24 Myra S Barnes https://t.co/t5lO9PZ5mI",https://twitter.com/24prideofgk/status/1441128280438968322,Thu Aug 18 21:04:56 +0000 2016,766380380106715136,false,Official Page for Myra S. Barnes I.S.24 We are the Pride of Great Kills.  FB & Instagram: @24PrideofGK,601,674,182,9,"Staten Island, NY",I.S. 24,24prideofgk,1486,,http://www.barnes24.org,false
"-73.56725453,45.75975883",Thu Sep 23 19:24:32 +0000 2021,,,http://dlvr.it/S88Xcv,0,1441121322692603905,,,,en,"Mascouche, Québec",false,,0,,,"<a href=""https://dlvrit.com/"" rel=""nofollow"">dlvr.it</a>","Fighting Stigma: Cash worries, isolation and mental health: Most serious pandemic impacts on Irish emigrant ...: MEMBERS of the Irish emigrant community worldwide faced increased financial struggles, isolation and mental health concerns due to the… https://t.co/KNvYOEorLz",https://twitter.com/StigmabaseN/status/1441121322692603905,Wed Sep 15 15:55:47 +0000 2010,191092262,false,Ireland — Scotland — Inuit —  Svenska  | Keeping up-to-date on global exclusion — Stigmabase is a canadian internet non-profit Initiative,0,1610,1297,111,Ireland | Scotland | Inuit | Skandinavien,Stigmabase | NORDIC,StigmabaseN,952244,,https://www.stigmabase.org/,false
"-83.02733,40.08172",Thu Sep 23 18:30:26 +0000 2021,,,https://www.instagram.com/p/CULJxF4L7BK/?utm_medium=twitter,2,1441107704987021321,,,,en,"Riverlea, OH",false,,0,,,"<a href=""http://instagram.com"" rel=""nofollow"">Instagram</a>","I work from home, so my cable/internet wires are my life line. A sumac tree in the garden succumbed to the winds &amp; now my connection to the outside world hangs in the balance. @ Riverlea, Ohio https://t.co/hLhGvD7XXb",https://twitter.com/JosefMatulich/status/1441107704987021321,Thu Jan 10 15:25:37 +0000 2013,1076885569,false,"Writer, artist, ex-mime, The Alley Vintage&Costume, Kit's husband, Aidan's Dad. Author: Arcanum Faire trilogy & #SquirrelApocalypse. Cafeteria witch. #INTJ",11025,6555,7004,79,"Worthington, OH",Josef Matulich: guy who writes funny/scary stuff.,JosefMatulich,20914,,https://dalmatianalley.wordpress.com/,false
"-77.03678133,38.89459749",Thu Sep 23 17:43:49 +0000 2021,,,https://www.instagram.com/p/CULEbq6p3sa/?utm_medium=twitter,0,1441095975548850180,,,,en,"Washington, DC",false,,0,,,"<a href=""http://instagram.com"" rel=""nofollow"">Instagram</a>",Updates Information About COVID-19 @ USA https://t.co/s3qB6T2MIb,https://twitter.com/AfricanDaddi/status/1441095975548850180,Mon Oct 12 12:30:56 +0000 2020,1315630889104281600,false,Fashion 🏪 USA (African Daddi) Involved In The Sells Of A Variety Of Top Products Ranging From The Latest 👗👕Shoes👟👠 💍👜🕶⌚️.👉Link In 👇👇Bio For Discounts,141,171,1719,0,"Houston, TX",African Daddi🇨🇲🇺🇸,AfricanDaddi,444,,http://www.africandaddi.com,false
"-80.13115215,25.77822445",Thu Sep 23 16:57:00 +0000 2021,nickiminaj injection injections covid covid19 vaccine vaccines shots lol jokes nofilter,,https://www.instagram.com/p/CUK_E_bre7s/?utm_medium=twitter,0,1441084192780025861,,,,en,"Miami Beach, FL",false,,0,,,"<a href=""http://instagram.com"" rel=""nofollow"">Instagram</a>","If you look like this don’t worry about what’s in the covid vaccine injections 💉🍑🦠😷😂😂😂

#nickiminaj #injection #injections #covid #covid19 #vaccine #vaccines #shots #lol #jokes #nofilter @ South Beach, Miami https://t.co/U708qBUoLe",https://twitter.com/samuelhall/status/1441084192780025861,Mon Jan 26 20:07:51 +0000 2009,19553876,false,Realtor in Miami. I live where you vacation ☀️ @MiamiParties #MiamiParties | https://t.co/6sIK96uhOn | https://t.co/YzpA5bq3XG,88,1068,2020,49,"Miami Beach, Florida",Sam Hall,samuelhall,7036,,http://www.SamHallRealEstate.com,false
"-74.0085268,40.711964",Thu Sep 23 20:02:19 +0000 2021,,,https://nypan.org/about/news-and-updates/2021/9/23/the-days-of-full-covid-coverage-are-over,1,1441130830286372864,,,,en,"Manhattan, NY",false,,0,,,"<a href=""http://www.squarespace.com"" rel=""nofollow"">Squarespace</a>",The days of full covid coverage are over.  https://t.co/ZUJLbfNSrr,https://twitter.com/NYPANetwork/status/1441130830286372864,Sun Dec 04 14:57:11 +0000 2016,805425725683732480,false,"https://t.co/eMJCPGPcIN

NYPAN is an alliance of chapters & affiliates committed to progressive change across the Empire State. 👊🏻👊🏼👊🏽👊🏾👊🏿",6764,3367,1154,45,New York,New York Progressive Action Network,NYPANetwork,5659,,https://nypan.org/,false
"-122.7756216,45.5064511",Thu Sep 23 22:30:04 +0000 2021,,https://twitter.com/EarlPdxPearl/status/1441168014364188683/photo/1,http://dlvr.it/S89BtS,3,1441168014364188683,,,,en,"West Slope, OR",false,,2,,,"<a href=""https://dlvrit.com/"" rel=""nofollow"">dlvr.it</a>","Report: Ivermectin Obliterated 97% Of Covid Cases In Delhi, India https://t.co/qHfmeWXUBD https://t.co/zYxA62uoa4",https://twitter.com/EarlPdxPearl/status/1441168014364188683,Wed Aug 12 02:52:34 +0000 2009,64914137,false,"Oregon Republican Christian Conservative focused on truth about Left Wing Radical @RepBlumenauer ,   #Trump Supporter.  #DrainTheSwamp",27,18705,22444,353,"Portland, OR",Earl Pearl,EarlPdxPearl,49325,,http://www.judicialwatch.org/,false
"174.76889633,-41.28916835",Thu Sep 23 23:05:03 +0000 2021,,,https://tinyurl.com/yez2xp5z,0,1441176814630572039,,,,en,"Wellington City, New Zealand",false,,0,,,"<a href=""http://github.com/tonytw1/rsstotwitter"" rel=""nofollow"">rssclient</a>","Victoria University of Wellington - COVID, by any other name https://t.co/bQMnHzVRty",https://twitter.com/wellynews/status/1441176814630572039,Thu May 01 18:34:02 +0000 2008,14617718,false,Just a small shell script. Trawling for news and goings on from around the Welly webspace. Also available as an RSS feed https://t.co/E2ANMZVLAN,91,2969,588,102,"Wellington, New Zealand",Wellynews 💙💛,wellynews,47296,,https://wellington.gen.nz,false
"-82.5353,27.3373",Thu Sep 23 20:09:56 +0000 2021,vaccine theshot covidvacccine couch,,https://www.instagram.com/p/CULVKFwrRiR/?utm_medium=twitter,1,1441132748580720642,,,,en,"Sarasota, FL",false,,0,,,"<a href=""http://instagram.com"" rel=""nofollow"">Instagram</a>","On the couch. Day 2 was a little rough. Trying to dig up some energy. I think one more nap should do it. 
#vaccine #theshot #covidvacccine #couch @ Sarasota, Florida https://t.co/1w8Sz63X4D",https://twitter.com/RealBrianGould/status/1441132748580720642,Fri Feb 07 16:01:50 +0000 2014,2332069808,false,God | Proud father | Go Blue,1635,234,264,9,"Sarasota, Florida",Brian Gould,RealBrianGould,9713,,,false
"-74.0085268,40.711964",Thu Sep 23 20:02:20 +0000 2021,,,https://nypan.org/about/news-and-updates/2021/9/23/the-days-of-full-covid-coverage-are-over,1,1441130832400314374,,,,en,"Manhattan, NY",false,,3,,,"<a href=""http://www.squarespace.com"" rel=""nofollow"">Squarespace</a>",The days of full covid coverage are over.  https://t.co/ViLkeDCofL,https://twitter.com/gwalbro/status/1441130832400314374,Tue Mar 27 13:08:13 +0000 2018,978619701701103616,false,Founder and co-chair of NYPAN; 2016 Bernie delegate; Founding member of the WFP; Retired Legal Aid Attorney & UAW Local Union Officer.,856,423,354,0,"Brooklyn, NY",George Albro,gwalbro,2874,,,false
"-96.98250353,32.76676387",Fri Sep 24 00:53:23 +0000 2021,,,https://www.instagram.com/p/CUL1mMsszlySj7XL8Tg0IstLcEjvh6bhYb0pT40/?utm_medium=twitter,0,1441204077774344192,,,,en,"Grand Prairie, TX",false,,0,,,"<a href=""http://instagram.com"" rel=""nofollow"">Instagram</a>","Got to meet @ilizas but we couldn’t touch or hug, darn you covid. She had the cutest little belly! @ The Texas Trust CU Theatre https://t.co/7rLYH3RPF5",https://twitter.com/judyann_tx/status/1441204077774344192,Fri Jan 28 18:06:54 +0000 2011,244181371,false,903 🏠  Cardiac & Stroke IMC 🩺 30 👩🏻‍⚕️ *tweets are my own* definitely not associated w/ my place of employment,1032,356,1140,0,Tejas,Judy Palacios,judyann_tx,17960,,,false
"-92.302,38.4623",Thu Sep 23 17:30:24 +0000 2021,,,https://www.columbiatribune.com/story/news/2021/09/22/gda-covid-19-vaccine-doses-columbia-boone-county-missouri-vaccinations-coronavirus/118922792/,0,1441092597787680774,,,,en,"Missouri, USA",false,,0,,,"<a href=""https://help.twitter.com/en/using-twitter/how-to-tweet#source-labels"" rel=""nofollow"">heapevents.info</a>","Gda Covid Vaccine Doses Columbia Boone County Missouri Vaccinations Coronavirus ☝ 😐 
 https://t.co/Qs8masCd4C",https://twitter.com/heapevents/status/1441092597787680774,Sat Jan 09 15:58:46 +0000 2021,1347935690332495877,false,just heap of US events,0,7,25,1,,heapevents.info,heapevents,21294,,https://www.heapevents.info/,false
"-74.14566856,40.54589666",Thu Sep 23 17:03:44 +0000 2021,,,https://www.instagram.com/p/CUK_2OAL-Qr/?utm_medium=twitter,0,1441085889749258250,,,,en,"Staten Island, NY",false,,0,,,"<a href=""http://instagram.com"" rel=""nofollow"">Instagram</a>","2 potential Covid-19 cases
9/23/21 @ I.S. 24 Myra S Barnes https://t.co/q7959Uink8",https://twitter.com/24prideofgk/status/1441085889749258250,Thu Aug 18 21:04:56 +0000 2016,766380380106715136,false,Official Page for Myra S. Barnes I.S.24 We are the Pride of Great Kills.  FB & Instagram: @24PrideofGK,601,674,182,9,"Staten Island, NY",I.S. 24,24prideofgk,1486,,http://www.barnes24.org,false
"-117.1585,32.7155",Thu Sep 23 17:30:09 +0000 2021,,,https://www.instagram.com/p/CULBkKmprnf/?utm_medium=twitter,1,1441092537918255110,,,,en,"San Diego, CA",false,,0,,,"<a href=""http://instagram.com"" rel=""nofollow"">Instagram</a>","So grateful and blessed for another dance around the sun 💃🏻✨🤍🙏🏽🥰 #923 
⠀⠀⠀⠀⠀⠀⠀⠀⠀
📹 taken pre-pandemic
live 🎶 by @meganddiamusic
💃🏻 lessons by @k_dizzie @ San Diego, California https://t.co/h6mHJSOtlH",https://twitter.com/joyacamaisa/status/1441092537918255110,Sun Jan 25 08:34:26 +0000 2009,19482004,false,♎️ ENFP Enneagram 2,95,459,1513,8,San Diego / Los Angeles,Joya Camaisa,joyacamaisa,4445,,,false
"-73.94892827,40.74464274",Thu Sep 23 21:50:52 +0000 2021,,,https://twitter.com/MorePerfectUS/status/1441140528481964033,1,1441158146475446272,,,,en,"Queens, NY",false,1441140528481964033,2,,,"<a href=""http://tapbots.com/tweetbot"" rel=""nofollow"">Tweetbot for iΟS</a>",Honestly fuck this. https://t.co/jdZ8CS8Lxb,https://twitter.com/ARPdidTHAT/status/1441158146475446272,Wed May 19 04:58:26 +0000 2010,145518909,false,♑️☼ ♌️☽ ♊️↑ he/they,140657,5499,3693,111,"Bedford-Stuyvesant, NY",jay,ARPdidTHAT,126402,,https://www.plancpills.org/,false
"-80.4699,35.6674",Fri Sep 24 00:13:47 +0000 2021,,,https://www.instagram.com/p/CULxEH9rOpK/?utm_medium=twitter,368,1441194112649027591,,,,en,"Salisbury, NC",false,,5,,,"<a href=""http://instagram.com"" rel=""nofollow"">Instagram</a>","Long line today to raise funds for a Salisbury police officer laid low by COVID-19. Best $20 hamburger ever. @ Salisbury, North Carolina https://t.co/Xat6HXrjlr",https://twitter.com/DGodfatherMoody/status/1441194112649027591,Sat Jan 02 17:04:24 +0000 2010,101265941,false,"Kelli’s guy, Erin and Robyn's dad, lead turn announcer for Motor Racing Network, host of Sirius XM Speedway on Sirius/XM NASCAR Radio. All comments are my own.",12061,123954,790,1348,"Salisbury, NC",Dave Moody,DGodfatherMoody,73919,,,false
