coordinates,created_at,hashtags,media,urls,favorite_count,id,in_reply_to_screen_name,in_reply_to_status_id,in_reply_to_user_id,lang,place,possibly_sensitive,quote_id,retweet_count,retweet_id,retweet_screen_name,source,text,tweet_url,user_created_at,user_id,user_default_profile_image,user_description,user_favourites_count,user_followers_count,user_friends_count,user_listed_count,user_location,user_name,user_screen_name,user_statuses_count,user_time_zone,user_urls,user_verified
"-1.5881112,55.0125301",Thu Sep 23 09:00:09 +0000 2021,,https://twitter.com/VPActivitiesNSU/status/1440964189787463683/video/1,http://ow.ly/cohQ50G0ox7,0,1440964189787463683,,,,en,"Longbenton, England",false,,0,,,"<a href=""https://www.hootsuite.com"" rel=""nofollow"">Hootsuite Inc.</a>","ℹ️ Don't miss out on the BIG EVENTS! 🥳
Over two thirds of 18-30 year olds have already had their 1st COVID jab! It's easy to get yours done quickly so you don't miss out on anything! 👉 https://t.co/utuLLVsR3v https://t.co/6fBogeq7Gn",https://twitter.com/VPActivitiesNSU/status/1440964189787463683,Mon Jun 28 18:42:08 +0000 2021,1409582839818080256,false,Vice President Activities at Northumbria Students Union. I'm here to represent Northumbria students and help you get involved in activities within the union.,10,29,85,0,Newcastle upon Tyne,James Slater,VPActivitiesNSU,24,,http://mynsu.co.uk,false
"-69,45.5",Thu Sep 23 10:22:51 +0000 2021,,,https://www.instagram.com/p/CUKR-MzrrFx/?utm_medium=twitter,0,1440985003052224512,,,,en,"Maine, USA",false,,0,,,"<a href=""http://instagram.com"" rel=""nofollow"">Instagram</a>",The view from our Deck yesterday over Penobscot Bay in Maine.  This Pandemic is giving us the chance to be in Maine at our summer House for 4 months. @ Maine https://t.co/tVISCKoqfK,https://twitter.com/Bill_Agee/status/1440985003052224512,Tue Apr 21 17:08:05 +0000 2009,33966458,false,"Senior VP & General Counsel | Private Equity Investors (High Equity) | Offices in New York, Princeton, Boston, Washington D.C., and Paris",344,27,58,0,,"William P. Agee, Esq.",Bill_Agee,495,,,false
"-99.12826538,19.47743572",Thu Sep 23 14:27:32 +0000 2021,,,http://dlvr.it/S87bpS,0,1441046578983104514,,,,en,"Gustavo A. Madero, Distrito Federal",false,,0,,,"<a href=""https://dlvrit.com/"" rel=""nofollow"">dlvr.it</a>","AMD  — Aid for AIDS Wants Your Unused HIV Meds, Now More Than Ever: Donations dropped 70% due to COVID-19, and Americans on HIV treatment today have fewer unused meds, says the nonprofit's founder. View article... https://t.co/V535REWQTs",https://twitter.com/StigmabaseO/status/1441046578983104514,Thu Apr 29 13:56:48 +0000 2010,138418838,false,Americas — United Kingdom  | Keeping up-to-date on global exclusion — Stigmabase is a canadian internet non-profit Initiative. Founded in 2010,0,4143,3742,262,Americas | United Kingdom,Stigmabase | ORG,StigmabaseO,1828864,,https://www.stigmabase.org/,false
"144.6507138,-37.9027413",Thu Sep 23 09:15:27 +0000 2021,covid19vic,,https://portal.cvms.vic.gov.au https://vaccine.wfltaylor.com,0,1440968041391476737,,,,en,"Melbourne, Victoria",false,,0,,,"<a href=""https://vaccine.wfltaylor.com"" rel=""nofollow"">Vaccine Radar</a>","64 Pfizer vaccine appointments have just been added to the Wyndham Indoor Vaccination Centre – Eagle Stadium vaccine hub, starting from 24-09-2021 08:15 AM.

Book at https://t.co/00ni7hhrRr.
Check https://t.co/NEYRsTeuAR for the latest data.

#covid19vic",https://twitter.com/VaccineRadarBot/status/1440968041391476737,Tue Sep 14 23:36:08 +0000 2021,1437923115204440065,false,"Tweets when Pfizer appointments are added to the booking portal.

This bot is not associated or endorsed by the Victorian Government.",1,23,0,1,Victoria,Vaccine Radar Bot,VaccineRadarBot,748,,https://vaccine.wfltaylor.com,false
"-3.4664453,50.7422779",Thu Sep 23 06:54:05 +0000 2021,,https://twitter.com/FENews/status/1440932466185814019/photo/1,http://dlvr.it/S86FPx,1,1440932466185814019,,,,en,"Exeter, England",false,,1,,,"<a href=""https://dlvrit.com/"" rel=""nofollow"">dlvr.it</a>",A once-in-a-generation opportunity for SME productivity: Few of us will forget the Monday evening in March last year when the Prime Minister announced that the country was going into lockdown. For businesses leaders it triggered the greatest challenge of… https://t.co/GGlngOXSn5 https://t.co/dS2BfC8dye,https://twitter.com/FENews/status/1440932466185814019,Tue Jan 13 14:20:55 +0000 2009,18939006,false,"Thought Leadership, Good News, Events, Videos & Podcasts in #FEVoices #EdTech #Apprenticeships #Skills #FE #HE #FutureofWork & #Employability @FECareers",46702,31401,20928,478,UK,FE News - The #FutureofEducation News Channel,FENews,115750,,https://linktr.ee/fenews,false
"121.45584,14.27269",Thu Sep 23 09:43:05 +0000 2021,Amen GodIsGood,,https://www.instagram.com/p/CUKNa5xhWNH/?utm_medium=twitter,0,1440974996315197442,,,,en,"Pagsanjan, Rehiyon ng CALABARZON",false,,0,,,"<a href=""http://instagram.com"" rel=""nofollow"">Instagram</a>","Despite of this pandemic, God will remain good at all times! Taste &amp; see His goodness 🙏 #Amen #GodIsGood @ Pagsanjan https://t.co/PtauhflQkP",https://twitter.com/NoloLopezTV/status/1440974996315197442,Mon Sep 21 02:15:53 +0000 2009,75935884,false,Jesus 1st 🙏 |Actor| Singer-Songwriter|Model |Motivational Speaker| Host| Vlogger| WCOPA2017 Multimedalist |Clasher At GMA7  #NoLoFied,920,1834,468,44,"Manila, Philippines",Nolo Lopez,NoloLopezTV,21047,,http://youtube.com/NoloLopezTV,false
"2.15481,41.39203",Thu Sep 23 05:30:21 +0000 2021,COVID,,http://rt.com/news/535588-australia-lockdown-record-protests/,0,1440911394052968449,,,,en,"Barcelona, España",false,,0,,,"<a href=""https://tapbots.com/tweetbot/"" rel=""nofollow"">Twitter for iPhone 12 Pro Max </a>","Melbourne, reeling from protests against #COVID - 19 restrictions, sets new... https://t.co/G5w7zijCBt",https://twitter.com/pidybi/status/1440911394052968449,Sat Mar 30 17:25:49 +0000 2013,1316862031,false,🤷‍♂️,219,569,590,250,Poland 🌍👈,𝔓𝔦𝔬𝔱𝔯,pidybi,633666,,,false
"-79.7164011,43.7742911",Thu Sep 23 06:25:33 +0000 2021,Featured India NEWS World,,http://dlvr.it/S86B4q,2,1440925283557597185,,,,en,"Brampton, Ontario",false,,1,,,"<a href=""https://dlvrit.com/"" rel=""nofollow"">dlvr.it</a>","From 2004 tsunami to Covid-19: A timeline of Quad elevation: By Nikhila Natarajan New York, Sep 23 (IANS) Nearly 17 years after the deadly 2004 tsunami, when outgoing Japanese Prime Minister Yoshihide Suga, Indian Prime… https://t.co/D6zECN9WIQ #Featured #India #NEWS #World",https://twitter.com/Weeklyvoice/status/1440925283557597185,Tue Mar 30 17:43:21 +0000 2010,127943720,false,Most Trusted News in North America’s South Asian Communities Since 1997,172,494,299,11,Toronto,Weekly Voice,Weeklyvoice,37110,,http://www.Weeklyvoice.com,false
"-0.12485951,51.50538967",Thu Sep 23 05:50:03 +0000 2021,Olympics Beijing,,http://dlvr.it/S865mb,0,1440916350298300416,,,,en,"London, England",false,,1,,,"<a href=""https://dlvrit.com/"" rel=""nofollow"">dlvr.it</a>",#Olympics-USOPC will require COVID-19 vaccine for all US athletes at #Beijing Games https://t.co/lnhzwND3Q6,https://twitter.com/BritishHeraldUK/status/1440916350298300416,Wed Feb 17 17:49:42 +0000 2010,115123902,false,Where Britain Meets the World® | The Official handle of #britishherald,350,133883,607,283,"London, United Kingdom",British Herald,BritishHeraldUK,57106,,http://www.britishherald.com,false
"-1.0778778,53.9747249",Thu Sep 23 07:45:07 +0000 2021,OnlyInYork,https://twitter.com/jrtheatre/status/1440945306452078593/photo/1,https://www.josephrowntreetheatre.co.uk/whats-on/concert/yorkshires-got-talent-live/1439,1,1440945306452078593,,,,en,"York, England",false,,1,,,"<a href=""http://jrtheatre.co.uk/"" rel=""nofollow"">JRT Event Tweeter</a>","Yorkshire’s Got Talent – LIVE!
  -- Joseph Rowntree Theatre

Sunday

The lockdown talent show finally goes live!

https://t.co/yAkpMUyXzQ

@VisitYork #OnlyInYork https://t.co/6gA157cKES",https://twitter.com/jrtheatre/status/1440945306452078593,Mon Aug 10 12:01:58 +0000 2009,64387190,false,York’s Joseph Rowntree Theatre is a vibrant hub of live entertainment hosting all sorts of productions from panto to musicals in a stunning art deco building.,571,1713,243,42,"York, UK",Joseph Rowntree Theatre,jrtheatre,9378,,http://josephrowntreetheatre.co.uk,true
"-0.97887502,51.45619815",Thu Sep 23 15:03:33 +0000 2021,human love space office support,,https://bit.ly/3hXyqT2,0,1441055642978979841,,,,en,"Reading, England",false,,0,,,"<a href=""https://dlvrit.com/"" rel=""nofollow"">dlvr.it</a>","Over lockdown, many of us have had to get used to a new way of working, with the great majority of employers adhering the new Working From Home regulations. While working from home comes with a few advantages – think… https://t.co/qsxXJs25DW #human #love #space #office #support",https://twitter.com/nevans1984/status/1441055642978979841,Mon Feb 01 14:59:15 +0000 2010,110437198,false,"Cybersecurity activist! Shouting loud about the worlds Cyber crimes, but also the more positive things in a working life.",53,89,273,10,"51.461729,-1.014563",Nick Evans,nevans1984,2903,,https://www.linkedin.com/in/nicholasjevans/,false
"138.59035,-34.96673",Thu Sep 23 10:24:55 +0000 2021,,,https://terrywhitechemmart.com.au/health-services/covid-19-vaccination https://www.instagram.com/p/CUKSNiDFG-X/?utm_medium=twitter,0,1440985523741503489,,,,en,"Adelaide, South Australia",false,,0,,,"<a href=""http://instagram.com"" rel=""nofollow"">Instagram</a>",https://t.co/Z5nTz0Gk1f.   Thank you Glenunga Cricket club for sharing @ TerryWhite Chemmart Cumberland Park Pharmacy https://t.co/tXFRZ1kNlM,https://twitter.com/terrywhitecumb1/status/1440985523741503489,Mon Apr 13 15:22:34 +0000 2020,1249719567640743937,false,"TWCM  Cumberland Pharmacy shop 3,4,5,&6 350 Goodwood Road Cumberland Park SA 5041 Phone  08-8271 6663
fax 08 7109 0068  Cumberland@aussiediscountchemist.com.au",20,10,35,0,Cumberland Park SA 5041,terrywhitecumberlandparkpharmacy,terrywhitecumb1,686,,https://www.facebook.com/Terrywhitecumberlandpark/,false
"-0.12485951,51.50538967",Thu Sep 23 06:47:03 +0000 2021,UK,,http://dlvr.it/S86Ddd,0,1440930695275167751,,,,en,"London, England",false,,1,,,"<a href=""https://dlvrit.com/"" rel=""nofollow"">dlvr.it</a>",#UK pub operator Mitchells sales top pre-pandemic level on pent-up demand https://t.co/TNZlxUPoKM,https://twitter.com/BritishHeraldUK/status/1440930695275167751,Wed Feb 17 17:49:42 +0000 2010,115123902,false,Where Britain Meets the World® | The Official handle of #britishherald,350,133883,607,283,"London, United Kingdom",British Herald,BritishHeraldUK,57106,,http://www.britishherald.com,false
"144.6507138,-37.9027413",Thu Sep 23 09:21:25 +0000 2021,covid19vic,,https://portal.cvms.vic.gov.au https://vaccine.wfltaylor.com,0,1440969541207556097,,,,en,"Melbourne, Victoria",false,,0,,,"<a href=""https://vaccine.wfltaylor.com"" rel=""nofollow"">Vaccine Radar</a>","95 Pfizer vaccine appointments have just been added to the Wyndham Indoor Vaccination Centre – Eagle Stadium vaccine hub, starting from 24-09-2021 08:15 AM.

Book at https://t.co/00ni7hhrRr.
Check https://t.co/NEYRsTeuAR for the latest data.

#covid19vic",https://twitter.com/VaccineRadarBot/status/1440969541207556097,Tue Sep 14 23:36:08 +0000 2021,1437923115204440065,false,"Tweets when Pfizer appointments are added to the booking portal.

This bot is not associated or endorsed by the Victorian Government.",1,23,0,1,Victoria,Vaccine Radar Bot,VaccineRadarBot,748,,https://vaccine.wfltaylor.com,false
"-77.83643405,34.1981982",Thu Sep 23 14:18:37 +0000 2021,,,https://www.cnn.com/2021/09/21/us/covid-vaccine-billboard-funeral-home-ad-agency-trnd/index.html,0,1441044337257746432,,,,en,WILMINGTON,false,,0,,,"<a href=""http://www.tweetcaster.com"" rel=""nofollow"">TweetCaster for Android</a>","Gives a whole new meaning to the term  ""black humor"" (maybe based on the vehicle color as well as the type of business).

'Funeral home' ad spreads message for the unvaccinated - CNN - https://t.co/qlNDkpply4",https://twitter.com/DrJFamPhysn/status/1441044337257746432,Fri Aug 26 16:11:11 +0000 2011,362561191,false,"Family physician with a subspecialty certification in Adolescent Medicine. In office & virtual - high quality, cost-effective healthcare for whole family.",2,46,41,1,"Leland, North Carolina USA",Robert R Johnson Jr,DrJFamPhysn,1405,,http://www.wilmingtonhealth.com,false
"-122.124,37.8438",Thu Sep 23 15:47:24 +0000 2021,bmwcca e28 e46 e30 e24 m3 635csi,,https://www.instagram.com/p/CUK3HG-J73U/?utm_medium=twitter,0,1441066678037663748,,,,en,"Moraga, CA",false,,0,,,"<a href=""http://instagram.com"" rel=""nofollow"">Instagram</a>","More unpublished CCA pics from before the pandemic in 2020. #bmwcca #e28 #e46 #2002 #e30 #e24 #m3 #635csi @ Moraga, California https://t.co/6QfxIjLP00",https://twitter.com/ItzGeorge/status/1441066678037663748,Sun Apr 22 08:58:19 +0000 2012,560243766,false,35mm preferably,32878,360,912,47,"San Rafael, CA",George Barahona,ItzGeorge,22233,,http://www.georgebarahona.com,false
"77.28395629,28.68671919",Thu Sep 23 11:42:21 +0000 2021,DGFT SEIS,,https://www.instagram.com/p/CUKbEU6vhl8/?utm_medium=twitter,0,1441005009395662860,,,,en,"नई दिल्ली, भारत",false,,0,,,"<a href=""http://instagram.com"" rel=""nofollow"">Instagram</a>","Due to Covid-19 hit, #DGFT reduces the #SEIS Incentive Rates from 7% to 5-3%.
The important service sector of business industries has been removed &amp; a new Appendix is issued in favour of new SEIS incentive rates. https://t.co/DQRQHJxNAH",https://twitter.com/Pointaxindia/status/1441005009395662860,Sun Aug 01 03:58:29 +0000 2021,1421681494821535744,false,"#Pointax your Digital Tax Consultant.
We serve Registration, Tax Consultancy, Accounting, Book-Keeping, Foriegn Trade Policy & Other Professional Services.",5,11,40,0,"Delhi, India",Pointax,Pointaxindia,43,,https://linktr.ee/pointax,false
"103.76165056,1.46171399",Thu Sep 23 07:41:26 +0000 2021,,,https://www.instagram.com/p/CUJ_f3GBm8tqdPR-zTW0R4av-ewTzCLExyb_bI0/?utm_medium=twitter,0,1440944381884715010,,,,en,"Johor Bahru, Johor",false,,0,,,"<a href=""http://instagram.com"" rel=""nofollow"">Instagram</a>","Alhamdulillah. Fully complete vaccine for AstraZeneca!
1st Dose - 06 July 2021
2nd Dose - 07 Sept 2021
And 14Days complete! @ PPV Persada Johor https://t.co/0jZxRpVIEB",https://twitter.com/hzrh_/status/1440944381884715010,Sat Mar 20 16:37:16 +0000 2010,124805639,false,I'm a fat girl and I hate it! Hazirah / 29 years old / Johor DT / Married with @akiiee_ ♡ Instagram : @hzrh_,24,82,93,0,in your Heart. ♥,Hazirah Ali Hanafiah,hzrh_,15570,,http://www.facebook.com/hazirahmohdalihanafiah,false
"-84.34,33.5786",Thu Sep 23 13:05:01 +0000 2021,,,https://www.instagram.com/p/CUKkh8zLaVr/?utm_medium=twitter,0,1441025814007590915,,,,en,"Morrow, GA",false,,0,,,"<a href=""http://instagram.com"" rel=""nofollow"">Instagram</a>","Fragrance Free SATIN HANDS Shea HAND SANITIZER​ @ Morrow, Georgia https://t.co/Ftdkb8RQAZ",https://twitter.com/tondasstyles/status/1441025814007590915,Mon Jun 28 00:31:08 +0000 2010,160369974,false,,318,102,358,1,,tbeaty,tondasstyles,3521,,,false
"-106.6699,35.09567",Thu Sep 23 16:05:24 +0000 2021,CommissionsYCorridos,,https://www.instagram.com/p/CUK5K67pvos/?utm_medium=twitter,1,1441071207189827590,,,,en,"Albuquerque, NM",false,,0,,,"<a href=""http://instagram.com"" rel=""nofollow"">Instagram</a>","Join me. Hear some poems. Buy a book. I'll sign it. Wear a mask. See you there. 

@treasurehousebooks 
#CommissionsYCorridos @ Treasure House Books &amp; Gifts https://t.co/v85qn8SJMx",https://twitter.com/HakimBe/status/1441071207189827590,Fri Jun 26 04:44:19 +0000 2009,50925602,false,Daddy & Albuquerque Poet Laureate  2012-2014. Visit me site. Check out me book SWEAR at https://t.co/ojCrYEPy2b. Give me a hug! *opinions are ... human.*,21360,4667,3434,107,"Albuquerque, NM",Hakim Bellamy,HakimBe,43592,,http://www.hakimbe.tumblr.com,false
"80.5728507,7.16915324",Thu Sep 23 15:50:22 +0000 2021,,,https://www.instagram.com/p/CUK3c42htaq/?utm_medium=twitter,0,1441067426100224000,,,,en,Sri Lanka,false,,0,,,"<a href=""http://instagram.com"" rel=""nofollow"">Instagram</a>",Explosion box in different size and layers can be customized suprise your lovrd ones in  this lockdown to gift them when they are far and out of your reach to show them that you remember @ Teddys Boutique https://t.co/WpCehTjo8M,https://twitter.com/bubblytalks/status/1441067426100224000,Fri Feb 25 10:50:21 +0000 2011,257410984,false,ⅈ ꪖꪑ ꪀꪮ𝕥 ρꫀ𝕣ᠻꫀᥴ𝕥 ᥇ꪊ𝕥 ડꪮꪑꫀ ડ𝕥ꪮ𝕣ⅈꫀડ ꪖ𝕣ꫀ ꪑꪊᥴꫝ ᥇ꫀ𝕥𝕥ꫀ𝕣 ᭙ⅈ𝕥ꫝ ꪶⅈ𝕥𝕥ꪶꫀ ⅈꪑρꫀ𝕣ᠻꫀᥴ𝕥ⅈꪮꪀ  #bubblytalks,24213,629,564,2,Sri Lanka,KolaLu,bubblytalks,29118,,https://instagram.com/bubblytalks?utm_medium=copy_link,false
"-61.51666667,10.66666667",Thu Sep 23 13:56:30 +0000 2021,carnival cure covid19,,https://www.instagram.com/p/CUKqa-xLQt5/?utm_medium=twitter,1,1441038769776439296,,,,en,Trinidad and Tobago,false,,0,,,"<a href=""http://instagram.com"" rel=""nofollow"">Instagram</a>","Time to go outside and play ...

#carnival #cure #covid19 @ Trinidad and Tobago https://t.co/wQJQ9itco9",https://twitter.com/CandelaINFINITI/status/1441038769776439296,Sun May 09 01:58:58 +0000 2021,1391211013236723712,false,"Actress, Singer-Songwriter,
Music Publisher, Film Location Scout & Creative Director.
Book 1-646-470-9346",211,102,681,3,Worldwide,CANDELA INFINITI,CandelaINFINITI,114,,https://linktr.ee/candela.infiniti,false
"-0.08355112,51.51122224",Thu Sep 23 16:24:12 +0000 2021,,,https://www.instagram.com/p/CUK7UlWIV_B/?utm_medium=twitter,4,1441075940151345154,,,,en,"City of London, London",false,,0,,,"<a href=""http://instagram.com"" rel=""nofollow"">Instagram</a>","Looking forward to the awards tonight with the craft guild.of chefs lots of hero's who have gone above and beyond during the pandemic @ Sky Garden, 35th Floor - London https://t.co/vaNCRylfiH",https://twitter.com/tottenhamchef/status/1441075940151345154,Tue Oct 08 13:26:43 +0000 2013,704992463,false,"Executive Head Chef @TottenhamHotspur I have a tireless passion for food.I am committed to using great produce and locally sourced, Essex boy at heart",1725,1400,1400,10,Essex,Mark Reynolds,tottenhamchef,874,,,false
"-82.44547069,43.02702703",Thu Sep 23 12:02:17 +0000 2021,foxandfriends,,https://whdh.com/entertainment/country-singer-dierks-bentley-cancels-concert-at-xfinity-center-in-mansfield-following-positive-covid-19-test-in-his-touring-party,0,1441010026609512449,,,,en,"Sarnia, Ontario",true,,0,,,"<a href=""http://www.tweetcaster.com"" rel=""nofollow"">TweetCaster for Android</a>",RT @7News: Country singer Dierks Bentley cancels concert at Xfinity Center in Mansfield following positive COVID-19 test in his touring party https://t.co/BOEVWvjdPy #foxandfriends,https://twitter.com/PortCityPisces/status/1441010026609512449,Sun Feb 22 18:25:34 +0000 2009,21584887,false,"painter, graphic artist, progressive dem",18608,1821,2342,187,southeastern michigan,PortCityPisces,PortCityPisces,227493,,https://twitter.com,false
"-0.12485951,51.50538967",Thu Sep 23 06:58:03 +0000 2021,Japan,,http://dlvr.it/S86Fpc,0,1440933461733240835,,,,en,"London, England",false,,1,,,"<a href=""https://dlvrit.com/"" rel=""nofollow"">dlvr.it</a>",#Japan pub-chain leader urges new PM to help eateries hit by COVID-19 https://t.co/w9uMg5R5Va,https://twitter.com/BritishHeraldUK/status/1440933461733240835,Wed Feb 17 17:49:42 +0000 2010,115123902,false,Where Britain Meets the World® | The Official handle of #britishherald,350,133883,607,283,"London, United Kingdom",British Herald,BritishHeraldUK,57106,,http://www.britishherald.com,false
"39.94367123,21.32189997",Thu Sep 23 16:25:36 +0000 2021,,,https://www.swarmapp.com/c/b9xe8QVle09,0,1441076290258448387,,,,en,"مكة المكرمة, المملكة العربية السعودية",true,,0,,,"<a href=""https://www.swarmapp.com"" rel=""nofollow"">Foursquare Swarm</a>","I'm at COVID-19 Vaccine Center in Mecca, Makkah https://t.co/ePJqVMfaL0",https://twitter.com/NoNa_Mrwan/status/1441076290258448387,Fri Jan 19 17:31:23 +0000 2018,954405942468251649,false,#UQUHP38 specialist 🩹| #volunteer | cancer ♋️ | @UQUMSC | @PHHI_HC ✨ متخرجة اقلكم 🦦🎓⚡️,14145,762,821,0,Makkah Al Mukarrama,NoNa✨🕷,NoNa_Mrwan,9653,,https://curiouscat.me/NoNa_Mrwan,false
"-86.2552,41.6726",Thu Sep 23 16:02:54 +0000 2021,southbend indiana ourrevolutionindiana townhall calltoaction nupesdoitbetter kappaalphapsi comunitydevelopment aarpfunds caresact covid_19 weneedaction,,https://www.instagram.com/p/CUK44s7gTRF/?utm_medium=twitter,1,1441070577612099586,,,,en,"South Bend, IN",false,,1,,,"<a href=""http://instagram.com"" rel=""nofollow"">Instagram</a>","#southbend #indiana #ourrevolutionindiana #townhall #calltoaction #nupesdoitbetter #kappaalphapsi #comunitydevelopment #aarpfunds #caresact #covid_19 #weneedaction @ South Bend, Indiana https://t.co/v5YWn1r8KW",https://twitter.com/iamhenrydavisjr/status/1441070577612099586,Wed Oct 27 22:45:39 +0000 2010,208773595,false,"Councilman Elect -2nd district of #SouthBend, IN. Husband,father, son, brother. Romans 8:28 || I agree with Jesus. RT not endorsements #Faith #Family #Community",5757,4682,1758,64,South Bend,"Henry Davis, Jr.",iamhenrydavisjr,22471,,https://www.henrydavisjr.com,false
"-75.1428517,38.7695159",Thu Sep 23 11:00:28 +0000 2021,,,https://delawarelibraries.libcal.com/event/7580628,0,1440994470032510981,,,,en,"Lewes, DE",false,,0,,,"<a href=""https://www.hootsuite.com"" rel=""nofollow"">Hootsuite Inc.</a>","On Sat, Oct 23 at 7 PM join us for a live performance of Gravediggers, the tale of two men digging a grave in the context of the worldwide pandemic. Humor, suspense, pathos, &amp; a surprise ending make for a powerful evening of reader's theatre.
Register now: https://t.co/eV8uSZoLwn",https://twitter.com/Leweslibrary/status/1440994470032510981,Mon Sep 21 20:11:49 +0000 2009,76128888,false,"The first town in the first state's public library and community center. Located in beautiful Lewes, Delaware.",409,1661,739,43,"ÜT: 38.694986,-75.219998",Lewes Library,Leweslibrary,2245,,https://lewes.lib.de.us/,false
"144.9669,-37.7488",Thu Sep 23 07:42:58 +0000 2021,,,https://www.instagram.com/p/CUJ_rH2Bq2V/?utm_medium=twitter,0,1440944766363975689,,,,en,"Melbourne, Victoria",false,,0,,,"<a href=""http://instagram.com"" rel=""nofollow"">Instagram</a>","The wine for your pandemic! Should give away a bottle with every jab. @ Coburg, Victoria, Australia https://t.co/GhRkPglcwa",https://twitter.com/roy_rgr70179/status/1440944766363975689,Thu Dec 05 19:00:43 +0000 2013,2231897220,false,A GIF is continually 🚶‍♀️ into the same room and forgetting what you went there for.,22203,345,758,2,Australia,Roy Greer,roy_rgr70179,14914,,,false
"-118.4026,33.8873",Thu Sep 23 13:20:27 +0000 2021,,,https://www.cnbc.com/2021/09/23/norway-becomes-the-first-central-bank-to-hike-rates-post-covid.html https://www.instagram.com/p/CUKmTBNlzVR/?utm_medium=twitter,0,1441029699094917127,,,,en,"Manhattan Beach, CA",false,,0,,,"<a href=""http://instagram.com"" rel=""nofollow"">Instagram</a>","Norway hikes rates, becoming the first central bank in the developed world to do so

https://t.co/wOVDqM6lfI @ Manhattan Beach, California https://t.co/q0FQFGCqAG",https://twitter.com/ALTMONEYFUND/status/1441029699094917127,Sat Aug 31 23:01:27 +0000 2013,1717002582,false,JOHN CHALEKSON --ALT MONEY FUND LP -- #Crypto #Currency/#SILVER #Hedge #Fund: https://t.co/94Ex48cCfw https://t.co/NXPVUfgbkA  tel (888) 8-HEDGE-FUND,2205,1173,4973,13,info@altmoneyfund.com,THE SILVER VIGILANTE ™️ ⭐⭐⭐⭐⭐,ALTMONEYFUND,17368,,https://www.facebook.com/realjohnchalekson,false
"85.31297846,27.71620041",Thu Sep 23 15:13:19 +0000 2021,,,http://Pvt.Ltd https://www.instagram.com/p/CUKzNW7P-Z6/?utm_medium=twitter,0,1441058099108978696,,,,en,Nepal,false,,0,,,"<a href=""http://instagram.com"" rel=""nofollow"">Instagram</a>","Good News from Nepal 🤗❤️🇳🇵🙏

Nepal reopens issuing on-arrival visas for tourists, removing the quarantine requirements for foreign tourists who have got both doses of Covid-19 vaccine. @ Spiritual Excursion https://t.co/rJhDIiDEUj. https://t.co/s9h93ZYStL",https://twitter.com/BLamsla/status/1441058099108978696,Tue Feb 12 13:15:21 +0000 2019,1095310389804359680,false,"I am local tour operator from Nepal.I Organize Nepla, Bhutan & Tibet tour and Trekking program.
WhatsApp:+977-9851231090",191,209,1172,3,Nepal,Badri Lamsal ( Mountain Guide),BLamsla,1312,,http://www.spiritualexcursion.com,false
"85.31297846,27.71620041",Thu Sep 23 14:40:38 +0000 2021,,,http://Pvt.Ltd https://www.instagram.com/p/CUKveGzsoQv/?utm_medium=twitter,0,1441049875450269700,,,,en,Nepal,false,,0,,,"<a href=""http://instagram.com"" rel=""nofollow"">Instagram</a>","Good News from Nepal 🤗❤️🇳🇵🙏

Nepal reopens issuing on-arrival visas for tourists, removing the quarantine requirements for foreign tourists who have got both doses of Covid-19 vaccine. @ Spiritual Excursion https://t.co/rJhDIiVfLR. https://t.co/M5er3OiRPb",https://twitter.com/BLamsla/status/1441049875450269700,Tue Feb 12 13:15:21 +0000 2019,1095310389804359680,false,"I am local tour operator from Nepal.I Organize Nepla, Bhutan & Tibet tour and Trekking program.
WhatsApp:+977-9851231090",191,209,1172,3,Nepal,Badri Lamsal ( Mountain Guide),BLamsla,1312,,http://www.spiritualexcursion.com,false
