coordinates,created_at,hashtags,media,urls,favorite_count,id,in_reply_to_screen_name,in_reply_to_status_id,in_reply_to_user_id,lang,place,possibly_sensitive,quote_id,retweet_count,retweet_id,retweet_screen_name,source,text,tweet_url,user_created_at,user_id,user_default_profile_image,user_description,user_favourites_count,user_followers_count,user_friends_count,user_listed_count,user_location,user_name,user_screen_name,user_statuses_count,user_time_zone,user_urls,user_verified
"-81.3892251,28.565398",Thu Sep 23 08:09:53 +0000 2021,drfauci congress covid19 rondesantis florida government,,https://www.instagram.com/p/CUKCu4eAmsV/?utm_medium=twitter,0,1440951540903251970,,,,en,"Orlando, FL",true,,0,,,"<a href=""http://instagram.com"" rel=""nofollow"">Instagram</a>",PSA!! People think before you act! Using fear to make policies is just plain WRONG!!! #drfauci #congress #covid19 #rondesantis #florida #government @ GFBC TV &amp; Media LLC https://t.co/AlVJGbOYnL,https://twitter.com/GFBCENTERTAIN/status/1440951540903251970,Fri Jul 06 13:18:31 +0000 2012,628453323,false,"IG: @gfbcTv GFBC Media & TV is a full service Agency, Artiste Management, Bookings, Consulting, Digital, Promotion, Publishing Empire. 🌎📺📹📡",117,380,2508,9,"66 W. Flagler St Miami, FL.",GFBCTVMEDIA,GFBCENTERTAIN,4534,,http://www.gfbc.tv,false
"25.86123144,-24.8719672",Thu Sep 23 09:56:58 +0000 2021,,,https://play.spotify.com/album/4ndeGRraTJVvQRgtU86enp https://www.instagram.com/p/CUKN97MLMdj/?utm_medium=twitter,0,1440978490652696581,,,,en,Botswana,false,,0,,,"<a href=""http://instagram.com"" rel=""nofollow"">Instagram</a>","Bakgethwa Gospel Group's new single ""Coronavirus"" is now available on Spotify.
https://t.co/vQLCUVgPWN @ Ramotswa, Botswana https://t.co/Iy1Mtnr8NU",https://twitter.com/realbigbiggie/status/1440978490652696581,Mon Jun 08 11:47:27 +0000 2009,45548090,false,"My new compilation album ""Golden Door Eleven"" is officially out! Have you listened to it yet?

Download/Stream it on Apple Music, Amazon Music and Spotify.",8346,814,2479,28,Botswana,Big Biggie,realbigbiggie,6855,,https://about.me/nathanielmoikabi,false
"-79.7164011,43.7742911",Thu Sep 23 07:51:03 +0000 2021,Covid19 Health,,http://dlvr.it/S86Nm2,0,1440946800555298820,,,,en,"Brampton, Ontario",false,,1,,,"<a href=""https://dlvrit.com/"" rel=""nofollow"">dlvr.it</a>","Global Covid-19 caseload tops 230 mn: The global coronavirus caseload has topped 230 million, while the deaths have surged to more than 4.71 million and vaccinations soared to over 5.98 billion, according to the Johns Hopkins… https://t.co/iyxzmswpWZ #Covid19 #Health",https://twitter.com/Weeklyvoice/status/1440946800555298820,Tue Mar 30 17:43:21 +0000 2010,127943720,false,Most Trusted News in North America’s South Asian Communities Since 1997,172,494,299,11,Toronto,Weekly Voice,Weeklyvoice,37110,,http://www.Weeklyvoice.com,false
"28.04426568,-26.17683528",Thu Sep 23 13:45:02 +0000 2021,,,http://dlvr.it/S87Sgv,0,1441035883881250822,,,,en,"Johannesburg, South Africa",false,,1,,,"<a href=""https://dlvrit.com/"" rel=""nofollow"">dlvr.it</a>","Partnering to get back on track to end AIDS by 2030: While we have made much progress in the global AIDS response, our work is not done. The COVID-19 pandemic is disrupting HIV and other essential services. We are ... View article... https://t.co/CD6wMbCUts",https://twitter.com/StigmabaseO/status/1441035883881250822,Thu Apr 29 13:56:48 +0000 2010,138418838,false,Americas — United Kingdom  | Keeping up-to-date on global exclusion — Stigmabase is a canadian internet non-profit Initiative. Founded in 2010,0,4143,3742,262,Americas | United Kingdom,Stigmabase | ORG,StigmabaseO,1828864,,https://www.stigmabase.org/,false
"28.04482862,-26.14113864",Thu Sep 23 09:03:34 +0000 2021,,,https://cathca.org/mild https://www.instagram.com/p/CUKI5khtXqr/?utm_medium=twitter,0,1440965050118774789,,,,en,"Johannesburg, South Africa",false,,0,,,"<a href=""http://instagram.com"" rel=""nofollow"">Instagram</a>",What is Mild Covid-19 Disease? Read the Guide for Primary Healthcare Workers - go to https://t.co/nDned5k8fL covid/ @ St Vincent School for the Deaf https://t.co/bDXwZo66MS,https://twitter.com/CathHealthSA/status/1440965050118774789,Sun Oct 12 17:36:32 +0000 2014,2825437829,false,Catholic Health Care South Africa,30,231,398,4,SouthAfrica Botswana Swaziland,Catholic Health Care,CathHealthSA,466,,http://www.cathca.co.za,false
"-0.12485951,51.50538967",Thu Sep 23 06:52:03 +0000 2021,,,http://dlvr.it/S86FCT,1,1440931951888662528,,,,en,"London, England",false,,1,,,"<a href=""https://dlvrit.com/"" rel=""nofollow"">dlvr.it</a>",New Zealand’s Ardern says lockdowns can end with high vaccine uptake https://t.co/JcJhxnh8Te,https://twitter.com/BritishHeraldUK/status/1440931951888662528,Wed Feb 17 17:49:42 +0000 2010,115123902,false,Where Britain Meets the World® | The Official handle of #britishherald,350,133883,607,283,"London, United Kingdom",British Herald,BritishHeraldUK,57106,,http://www.britishherald.com,false
"88.3631176,22.47289",Thu Sep 23 06:21:43 +0000 2021,LetsFightCorona Coronavirus Covid19 StayHomeStaySafe Weshallovercome SparshDiagnosticCentre BhaloTheko,https://twitter.com/info_sparsh/status/1440924319018885122/photo/1,,0,1440924319018885122,,,,en,"कोलकाता, भारत",false,,0,,,"<a href=""https://www.hootsuite.com"" rel=""nofollow"">Hootsuite Inc.</a>",Tip of the Day: How to protect your child from Covid 19 #LetsFightCorona #Coronavirus #Covid19 #StayHomeStaySafe #Weshallovercome #SparshDiagnosticCentre #BhaloTheko https://t.co/ZwZTGJHgQt,https://twitter.com/info_sparsh/status/1440924319018885122,Wed Apr 08 05:01:09 +0000 2015,3146537265,false,Bhalo Theko,2,42,12,0,Kolkata,Sparsh,info_sparsh,519,,http://www.sparshdiagnostica.com,false
"-0.14367274,51.55141874",Thu Sep 23 09:02:03 +0000 2021,,,http://dlvr.it/S86Zzy,0,1440964669204623372,,,,en,"Camden Town, London",false,,0,,,"<a href=""https://dlvrit.com/"" rel=""nofollow"">dlvr.it</a>","APUK — Travel agent warning to same-sex couples after being asked to book Maldives trip: And with more long-haul destinations opening up to UK holidaymakers following the lockdown, he has issued a warning to those who are unaware that any affection ...… https://t.co/IOtzqIVMmQ",https://twitter.com/StigmabaseO/status/1440964669204623372,Thu Apr 29 13:56:48 +0000 2010,138418838,false,Americas — United Kingdom  | Keeping up-to-date on global exclusion — Stigmabase is a canadian internet non-profit Initiative. Founded in 2010,0,4143,3742,262,Americas | United Kingdom,Stigmabase | ORG,StigmabaseO,1828864,,https://www.stigmabase.org/,false
"-78.6184969,42.9266302",Thu Sep 23 13:02:15 +0000 2021,PPE,https://twitter.com/MDSAssociatesIn/status/1441025118034145284/photo/1,http://ow.ly/csUq50Gfbo5,0,1441025118034145284,,,,en,"New York, USA",false,,0,,,"<a href=""https://www.hootsuite.com"" rel=""nofollow"">Hootsuite Inc.</a>","MDS helps you identify and purchase the right general duty work gloves for every job. We have endless combinations of materials, coatings and safety ratings. #PPE https://t.co/aAgCjMz3JH https://t.co/Ruonp9eZBd",https://twitter.com/MDSAssociatesIn/status/1441025118034145284,Fri Apr 20 13:48:59 +0000 2012,558649664,false,,21,115,276,0,,MDS Associates Inc.,MDSAssociatesIn,1045,,,false
"145.333,-37.9333",Thu Sep 23 06:52:00 +0000 2021,spring victoria melbourne australia lockdown fauna flora blossom garden birds birdsofaustralia birdsofinstagram nature wildlide belgravesouth,,https://www.instagram.com/p/CUJ514elY5x/?utm_medium=twitter,2,1440931938546724864,,,,en,"Melbourne, Victoria",false,,0,,,"<a href=""http://instagram.com"" rel=""nofollow"">Instagram</a>",Springtime in the backyard #spring #victoria #melbourne #australia #lockdown #fauna #flora #blossom #garden #birds #birdsofaustralia #birdsofinstagram #nature #wildlide #belgravesouth https://t.co/bL6s7cnDA9,https://twitter.com/JoshDyson/status/1440931938546724864,Sun Mar 22 21:45:07 +0000 2009,25887158,false,VP UX & Design @Marketplacer_ | Fan of native flora & fauna | OffGrid Dreamer,97,107,334,10,Melbourne,Josh Dyson,JoshDyson,904,,http://joshdyson.com,false
"-6.30799525,49.92046925",Thu Sep 23 14:24:42 +0000 2021,wfhsetup worklifebalance videocalls,,https://www.instagram.com/p/CUKtph-tSuF/?utm_medium=twitter,1,1441045865838219264,,,,en,"South West, England",false,,0,,,"<a href=""http://instagram.com"" rel=""nofollow"">Instagram</a>",Working from home on a Thursday afternoon #wfhsetup #worklifebalance #videocalls @ Newfort House Luxury Self Catering https://t.co/Fse0xiVWwk,https://twitter.com/Tonkertim/status/1441045865838219264,Tue Jan 20 20:36:52 +0000 2009,19255799,false,"Follow my mad tour DJ, Promoter and Media Tech Geek, Gay, who loves the music but not the politics, living on an Island https://t.co/Dhs3LK4HjA",1766,3372,2975,54,"Isles of Scilly, Cornwall",Tim Jones,Tonkertim,17057,,http://www.timjonesmusic.co.uk,false
"-74.19353323,40.92189284",Thu Sep 23 16:02:25 +0000 2021,strongman blessed finally,,https://www.instagram.com/p/CUK41PQLAbi/?utm_medium=twitter,0,1441070459349516289,,,,en,"Paterson, NJ",false,,0,,,"<a href=""http://instagram.com"" rel=""nofollow"">Instagram</a>",Well earlier today I was able to get the second dose of the Covid-19 Pfizer Vaccine from Walgreens. #strongman #blessed #finally @ Walgreens https://t.co/WiQXNOQDSS,https://twitter.com/blazing_matt/status/1441070459349516289,Fri Apr 26 05:05:06 +0000 2019,1121641328050204672,false,"21, single, dancer, New Jersey, and gamer",208,25,179,0,"Paterson, NJ",Matthew,blazing_matt,128,,,false
"-0.29954,51.41226",Thu Sep 23 12:54:52 +0000 2021,NPLQ RLSS Lifeguard Training Competency Test Swimming Qualification BeALifeguard DavidLloyd Kingston DMswimming covid19 coronavirus,,https://www.instagram.com/p/CUKjXQmKuV6/?utm_medium=twitter,0,1441023260020264966,,,,en,"Kingston upon Thames, London",false,,0,,,"<a href=""http://instagram.com"" rel=""nofollow"">Instagram</a>","📝 Lifeguard Competency Test
📍David Lloyd, Kingston

#NPLQ #RLSS #Lifeguard #Training #Competency #Test #Swimming #Qualification #BeALifeguard #DavidLloyd #Kingston #DMswimming #covid19 #coronavirus https://t.co/yoA5vkeHmU",https://twitter.com/DMswimming5/status/1441023260020264966,Wed Sep 12 22:35:16 +0000 2018,1040005952496459779,false,👨🏼‍🏫Lifeguard Trainer Assessor 🕵🏼‍♂️Lifeguard Recruiter 📍SW London/Surrey,43,166,105,1,"London, England",DM Swimming,DMswimming5,75,,http://www.facebook.com/DMswimming,false
"85.31297846,27.71620041",Thu Sep 23 14:42:05 +0000 2021,,,http://Pvt.Ltd https://www.instagram.com/p/CUKvor3oTmn/?utm_medium=twitter,0,1441050242879737856,,,,en,Nepal,false,,0,,,"<a href=""http://instagram.com"" rel=""nofollow"">Instagram</a>","Good News from Nepal 🤗❤️🇳🇵🙏

Nepal reopens issuing on-arrival visas for tourists, removing the quarantine requirements for foreign tourists who have got both doses of Covid-19 vaccine. @ Spiritual Excursion https://t.co/rJhDIiDEUj. https://t.co/IJdUGaxsvw",https://twitter.com/BLamsla/status/1441050242879737856,Tue Feb 12 13:15:21 +0000 2019,1095310389804359680,false,"I am local tour operator from Nepal.I Organize Nepla, Bhutan & Tibet tour and Trekking program.
WhatsApp:+977-9851231090",191,209,1172,3,Nepal,Badri Lamsal ( Mountain Guide),BLamsla,1312,,http://www.spiritualexcursion.com,false
"-1.5073978,53.8257419",Thu Sep 23 13:43:40 +0000 2021,,,https://www.instagram.com/p/CUKo9Fos8_Q/?utm_medium=twitter,0,1441035540422221834,,,,en,"Leeds, England",false,,0,,,"<a href=""http://instagram.com"" rel=""nofollow"">Instagram</a>","So many people missed out with Lockdown last year, we’re already working hard on baby bauble prints (and assorted other Christmas items). We get booked up very quickly, so make sure you call soon! @ Jackrabbits Pottery https://t.co/d1y3gnTDAM",https://twitter.com/JackrabbitsPots/status/1441035540422221834,Sat Jan 04 22:33:46 +0000 2014,2276735418,false,Leeds’s original paint-your-own pottery studio.,245,836,812,12,"633a Roundhay Road, Leeds, LS8",Jackrabbits Pottery,JackrabbitsPots,1426,,http://www.jackrabbitspottery.com,false
"144.9669,-37.7488",Thu Sep 23 11:19:10 +0000 2021,,,https://www.instagram.com/p/CUKYanwBvMX/?utm_medium=twitter,0,1440999173302767619,,,,en,"Melbourne, Victoria",false,,0,,,"<a href=""http://instagram.com"" rel=""nofollow"">Instagram</a>","Looking forward to the hairdressers. Damn you Covid! @ Coburg, Victoria, Australia https://t.co/4ktKBeyqvp",https://twitter.com/roy_rgr70179/status/1440999173302767619,Thu Dec 05 19:00:43 +0000 2013,2231897220,false,A GIF is continually 🚶‍♀️ into the same room and forgetting what you went there for.,22203,345,758,2,Australia,Roy Greer,roy_rgr70179,14914,,,false
"-123.01936819,49.44648095",Thu Sep 23 14:50:05 +0000 2021,,,http://dlvr.it/S87glb,0,1441052255831027723,,,,en,"Greater Vancouver A, British Columbia",false,,0,,,"<a href=""https://dlvrit.com/"" rel=""nofollow"">dlvr.it</a>",CAD — How Weak Safety Net Policies Exacerbate Regional and Racial Inequality: The economic crisis brought on by the COVID-19 pandemic made painfully clear the depth and pervasiveness of economic insecurity and inequality in the United ... View article... https://t.co/A63KboUcEU,https://twitter.com/StigmabaseO/status/1441052255831027723,Thu Apr 29 13:56:48 +0000 2010,138418838,false,Americas — United Kingdom  | Keeping up-to-date on global exclusion — Stigmabase is a canadian internet non-profit Initiative. Founded in 2010,0,4143,3742,262,Americas | United Kingdom,Stigmabase | ORG,StigmabaseO,1828864,,https://www.stigmabase.org/,false
"145.333,-37.9333",Thu Sep 23 06:45:38 +0000 2021,blackcockatoo birds birdsofaustralia birdsofinstagram spring garden belgravesouth australia lockdown fauna nature wildlife,,https://www.instagram.com/p/CUJ5HNclNFl/?utm_medium=twitter,2,1440930336641372164,,,,en,"Melbourne, Victoria",false,,0,,,"<a href=""http://instagram.com"" rel=""nofollow"">Instagram</a>","Some special visitors to the garden today #blackcockatoo #birds #birdsofaustralia #birdsofinstagram #spring #garden #belgravesouth #australia #lockdown #fauna #nature #wildlife @ Belgrave South, Victoria, Australia https://t.co/gni1fuvrCx",https://twitter.com/JoshDyson/status/1440930336641372164,Sun Mar 22 21:45:07 +0000 2009,25887158,false,VP UX & Design @Marketplacer_ | Fan of native flora & fauna | OffGrid Dreamer,97,107,334,10,Melbourne,Josh Dyson,JoshDyson,904,,http://joshdyson.com,false
"-84.31765,34.007033",Thu Sep 23 13:22:18 +0000 2021,siennaclaire 8yrsold 3rdgrade multiplication division earlyalgebra homeschooling unschooling,,https://www.instagram.com/p/CUKmgdkFGBu/?utm_medium=twitter,0,1441030162523430913,,,,en,"Roswell, GA",false,,0,,,"<a href=""http://instagram.com"" rel=""nofollow"">Instagram</a>",Math is def her strongest subject! 🧮 💕#siennaclaire #8yrsold #3rdgrade #multiplication #division #earlyalgebra #homeschooling #unschooling @rightstartmathematics @ Martin's Landing https://t.co/PJNXKvZgKZ,https://twitter.com/FlowerSculptor/status/1441030162523430913,Wed Aug 27 00:51:38 +0000 2008,16005338,false,"Custom, unique flower sculptures, designed to fit your space perfectly. For more info about my services: https://t.co/lRrFPioLok",316,339,481,12,"iPhone: 33.751415,-84.353004",::: Shelli Wheeler :::,FlowerSculptor,4088,,,false
"-111.074249,45.6706102",Thu Sep 23 16:05:04 +0000 2021,,,http://dlvr.it/S87wV5,49,1441071122598948868,,,,en,"Bozeman, MT",false,,12,,,"<a href=""https://dlvrit.com/"" rel=""nofollow"">dlvr.it</a>",AP:  Medical providers challenge law banning vaccine requirements https://t.co/FJ4d40tdTQ,https://twitter.com/bozchron/status/1441071122598948868,Wed Mar 04 00:33:58 +0000 2009,22707076,false,The official Twitter feed for the Bozeman Daily Chronicle.,92,21690,1279,468,"Bozeman, Montana",Bozeman Daily Chronicle,bozchron,104285,,http://bozemandailychronicle.com/,false
"-81.73182156,30.38278824",Thu Sep 23 13:27:29 +0000 2021,,,https://www.instagram.com/p/CUKnGnxFPUZ/?utm_medium=twitter,0,1441031467442872320,,,,en,"Westside, FL",false,,0,,,"<a href=""http://instagram.com"" rel=""nofollow"">Instagram</a>","Drive Thru Food Giveaway
Thursday, September 23, 2021
1:30PM - 5:30PM or until the supply has been exhausted.

Mask and Social Distancing will be observed. Please stay in your vehicle. https://t.co/JkG6mJEblX",https://twitter.com/stpaulamejax/status/1441031467442872320,Mon Oct 27 00:20:24 +0000 2014,2846014215,false,"Rev. Willie N. Barnes, Jr. ~ Senior Pastor ~ We are Sharing Christ & Meeting Needs! Sunday Service Live Stream: https://t.co/Obj49BV9cA",767,539,361,2,"6910 New Kings Rd, Jax FL",St Paul AMEC Jax,stpaulamejax,420,,https://stpaulamejax.com,false
"149.23265,-35.3550899",Thu Sep 23 12:06:38 +0000 2021,noms lemon delicious lockdown,,https://www.instagram.com/p/CUKd2Kih8VS/?utm_medium=twitter,0,1441011120551178246,,,,en,"Queanbeyan, New South Wales",false,,0,,,"<a href=""http://instagram.com"" rel=""nofollow"">Instagram</a>","Lemon delicious. Helped by toddler. #noms @growcookeat #lemon #delicious #lockdown @ Queanbeyan, New South Wales https://t.co/Ppr9PR5NyP",https://twitter.com/mlobastov/status/1441011120551178246,Sat Jun 06 10:47:04 +0000 2009,45108147,false,"Deputy Manager, CEIST, Law, ANU, Russian Orthodox, guinea pig, chickens, festivals, orange husband, interpreter, cat, Wildcare, mama",1566,587,834,40,"Queanbeyan, New South Wales",Marina Lobastov,mlobastov,12188,,http://about.me/mlobastov,false
"135.8404541,-34.70379994",Thu Sep 23 08:57:03 +0000 2021,,https://twitter.com/EyreTribune/status/1440963409881681926/photo/1,https://www.portlincolntimes.com.au/story/7443058/towns-play-waiting-game-after-covid-exposure/?src=rss,0,1440963409881681926,,,,en,"Port Lincoln, South Australia",false,,0,,,"<a href=""https://dlvrit.com/"" rel=""nofollow"">dlvr.it</a>",Towns play waiting game after COVID exposure https://t.co/4B0xvuZCGa https://t.co/m8e1sA6kuQ,https://twitter.com/EyreTribune/status/1440963409881681926,Thu Jun 28 13:34:12 +0000 2012,621068028,false,"Unofficial acct! I'm an automated bot posting local news & sport from Cleve, Cowell and Kimba. See @eptribune for official account.",0,97,11,1,"Cleve, South Australia",EyrePeninsulaTribune,EyreTribune,6419,,http://www.eyretribune.com.au/,false
"-3.031,53.478",Thu Sep 23 14:42:48 +0000 2021,facemask facemasks covid_19 corona coronavirus antivaxx pandemic railway fence openeyegallery protest irresponsible liverpool dailylife,,https://www.instagram.com/p/CUI0w4asUNZ/?utm_medium=twitter,0,1441050419946471427,,,,en,"Seaforth, England",true,,0,,,"<a href=""http://instagram.com"" rel=""nofollow"">Instagram</a>","Don’t take offence 
#facemask #facemasks #covid_19 #corona #coronavirus #antivaxx #pandemic #railway #fence #openeyegallery #protest #irresponsible #liverpool #dailylife @ Waterloo, Merseyside https://t.co/PlfozsdQkn",https://twitter.com/reggieheights/status/1441050419946471427,Tue Oct 15 17:51:55 +0000 2019,1184164953248407552,true,"Dosser from Bootle, writes a bit when he can be arsed and takes some photies.",4589,60,204,0,liverpool,reggiefromtheheights,reggieheights,1646,,,false
"-120.3099,47.42301",Thu Sep 23 04:59:41 +0000 2021,,,https://www.instagram.com/p/CUJs_O8roif/?utm_medium=twitter,0,1440903676894273545,,,,en,"Wenatchee, WA",false,,0,,,"<a href=""http://instagram.com"" rel=""nofollow"">Instagram</a>",Did some basket weaving - was gifted some COVID (art). Fun times! @collapse_gallery @ Collapse Contemporary Art Gallery https://t.co/zk5o7cOjki,https://twitter.com/KristenHosey/status/1440903676894273545,Sun Sep 08 08:46:45 +0000 2013,1819128882,false,"Restless Wanderer, Dr-Nurse, Global Health Nerd, Dreamer. Part-time healer, warrior dragon.",12,68,112,8,,Kristen Hosey,KristenHosey,1158,,,false
"-76.43608172,40.03603604",Thu Sep 23 09:01:43 +0000 2021,,,https://sports.yahoo.com/olympics-vaccine-mandate-team-usa-000712477.html,0,1440964585301872646,,,,en,"Mountville, PA",true,,0,,,"<a href=""http://www.myplume.com/"" rel=""nofollow"">Plume for Android</a>","Team USA will mandate vaccination for Winter Olympic athletes - https://t.co/aZhvy5Qgsy

The USOPC revealed a new policy that requires all Winter Olympic hopefuls to be vaccinated by Dec. 1.",https://twitter.com/TheRealMischief/status/1440964585301872646,Wed May 13 16:51:34 +0000 2009,39789727,false,"Don't get life & bullshit mixed up...... 98% of you clowns have a better internet life than a #RealLife I choke midgets, smurfs, & kick small dogs......",248,1114,3144,25,"Arkham Asylum/Bat Cave, PA",OG Crazy Norm,TheRealMischief,43720,,,false
"36.821945,-1.292066",Thu Sep 23 07:35:39 +0000 2021,,,,0,1440942927077855235,KenyansOnReddit,1440942925895114753,1269598733878079500,en,"Nairobi, Kenya",,,0,,,"<a href=""https://twitter.com/hermoand"" rel=""nofollow"">Kenyans On Reddit</a>",quarantine in kenya There are multiple travel guidelines so if i can get the current guidelines that would be helpful - [2/2],https://twitter.com/KenyansOnReddit/status/1440942927077855235,Sun Jun 07 11:55:21 +0000 2020,1269598733878079488,false,"Come join your fellow Kenyans™ on Reddit 👉 https://t.co/jgE8q6ov1E 

- #TopReply
- #rKenyaModLog
- #RemovedByMods
- #DeletedByAuthor
- #rKenyaVideo",796,253,17,3,Nairobi,Kenyans On Reddit 🇰🇪,KenyansOnReddit,44989,,https://reddit.com/r/kenya,false
"-84.51789636,39.08059692",Thu Sep 23 13:28:22 +0000 2021,,,,0,1441031689535307802,JuryReporter,1441031120829755393,430361738,en,"Covington, KY",,,0,,,"<a href=""http://tapbots.com/tweetbot"" rel=""nofollow"">Tweetbot for iΟS</a>","@JuryReporter I truly deeply do not understand.  

A cashier in a store told a woman that “the vaccines” were causing miscarriages which also isnt true but the woman was all really then I’m so glad my daughter didn’t get one! She is getting married! WHAT her wedding may spray mass death then",https://twitter.com/KYCara/status/1441031689535307802,Fri Jun 15 21:48:09 +0000 2012,609462982,false,"Kentucky*, bourbon, yoga & feminism are for everybody/ kynector/attorney/LMT #BBN #BLM #berea 
/ she series",27677,4294,1812,113,"Covington via Floyd County, KY",Cara Stewart,KYCara,121946,,,false
"-111.07427917,45.67070719",Thu Sep 23 22:33:02 +0000 2021,,,http://dlvr.it/S89Cdf,1,1441168760837001226,,,,en,"Bozeman, MT",false,,0,,,"<a href=""https://dlvrit.com/"" rel=""nofollow"">dlvr.it</a>",3 more COVID-19 deaths reported in Gallatin County https://t.co/WoMrDGvUwP,https://twitter.com/bozchron/status/1441168760837001226,Wed Mar 04 00:33:58 +0000 2009,22707076,false,The official Twitter feed for the Bozeman Daily Chronicle.,92,21690,1279,468,"Bozeman, Montana",Bozeman Daily Chronicle,bozchron,104285,,http://bozemandailychronicle.com/,false
"-77.59533,43.15543",Fri Sep 24 00:33:04 +0000 2021,dinoandfriends Fickle933 covidvacccine covidsucks,,https://www.instagram.com/p/CULzRRgsx-e/?utm_medium=twitter,0,1441198965538447362,,,,en,"New York, USA",false,,0,,,"<a href=""http://instagram.com"" rel=""nofollow"">Instagram</a>","He sounds amazing! The show is dedicated to all healthcare workers. If not for the , he wouldn't have survived 3 weeks in an ICU with Covid! Glad he's still here!! #dinoandfriends #Fickle933 #covidvacccine  #covidsucks https://t.co/R3R7jMgd8H",https://twitter.com/fickledino/status/1441198965538447362,Wed Oct 15 02:29:15 +0000 2008,16752739,false,"Radio guy, On Air & sales. Too old to get a real job. Lover of Live music, Rochester, golf, riding bikes and animals!",12297,1654,2148,41,"Rochester, NY",Dino Kay,fickledino,21223,,http://about.me/dinokay,false
"144.98203,-37.83426",Fri Sep 24 00:07:44 +0000 2021,DomainRd,,https://www.instagram.com/p/CULwXtBhd6n/?utm_medium=twitter,0,1441192592851361797,,,,en,"Melbourne, Victoria",false,,0,,,"<a href=""http://instagram.com"" rel=""nofollow"">Instagram</a>","Getting picnic coffees from the cafes on #DomainRd and having difficulty social distancing. At least most people were wearing face masks (but by no means all, especially as many drank their coffees outside the cafes) https://t.co/WbSplAZ0wi",https://twitter.com/chrismbr/status/1441192592851361797,Sun May 18 13:16:52 +0000 2008,14820495,false,"design-history-art-theatre-film-food-gym-music etc etc oh yes, and architecture!",24283,408,173,39,Melbourne mostly,Chris Rodda,chrismbr,41230,,http://www.lowrezmelbourne.com,false
"-97.7308176,30.3338914",Thu Sep 23 21:34:22 +0000 2021,COVID19 COVID_19 COVID coronavirus politics txlege txed,,https://onlinelibrary.wiley.com/toc/14679221/2021/42/5,1,1441153993611386882,,,,en,"Austin, TX",false,,2,,,"<a href=""https://www.hootsuite.com"" rel=""nofollow"">Hootsuite Inc.</a>","FREE Special Issue:The Political Psychology of COVID‐19 

https://t.co/CaUR2EC3jq

#COVID19 #COVID_19 #COVID #coronavirus #politics #txlege #txed",https://twitter.com/SanAntoReview/status/1441153993611386882,Mon Jun 29 00:07:00 +0000 2020,1277393037157634049,false,"International literary, arts and ideas journal. Nonprofit. Always read free at https://t.co/dJII9XzWF8.",1608,1162,3904,21,"Austin, TX, USA",San Antonio Review,SanAntoReview,4686,,https://bio.link/sanantonioreview,false
"-105.044,38.8405",Thu Sep 23 19:01:21 +0000 2021,,,https://www.csindy.com/news/the-arts-are-emerging-stronger-from-pandemic-challenges/article_e8838238-1b2a-11ec-960d-73134f11c665.html,0,1441115486586953735,,,,en,"Colorado, USA",false,,0,,,"<a href=""https://help.twitter.com/en/using-twitter/how-to-tweet#source-labels"" rel=""nofollow"">heapevents.info</a>","The Arts Are Emerging Stronger From Pandemic Challenges ☝ 😐 
 https://t.co/H1LaTBL5Uj",https://twitter.com/heapevents/status/1441115486586953735,Sat Jan 09 15:58:46 +0000 2021,1347935690332495877,false,just heap of US events,0,7,25,1,,heapevents.info,heapevents,21294,,https://www.heapevents.info/,false
