coordinates,created_at,hashtags,media,urls,favorite_count,id,in_reply_to_screen_name,in_reply_to_status_id,in_reply_to_user_id,lang,place,possibly_sensitive,quote_id,retweet_count,retweet_id,retweet_screen_name,source,text,tweet_url,user_created_at,user_id,user_default_profile_image,user_description,user_favourites_count,user_followers_count,user_friends_count,user_listed_count,user_location,user_name,user_screen_name,user_statuses_count,user_time_zone,user_urls,user_verified
"-74.0007613,40.7207559",Fri Nov 19 21:09:10 +0000 2021,,,https://www.encmoments.com/home/kktn3mdbth29c34-lht4j-ka2jd-dw965-jnzb8-w2lnm-y6xdn-63t4x-zb6m3-cs6tg,0,1461803763258298377,,,,en,"Manhattan, NY",false,,0,,,"<a href=""http://www.squarespace.com"" rel=""nofollow"">Squarespace</a>",The Lenoir County COVID-19 Update (Nov. 19)   https://t.co/lrmQDJC39E,https://twitter.com/JuniousSmithIII/status/1461803763258298377,Sat Aug 20 17:21:51 +0000 2011,358882289,false,"Jack of all trades, master of a couple. Nine Dime born and raised, Quarter Deuce living.  Founder of ENC Moments. Writer at The Wake Weekly.",2171,2738,527,32,North Carolina,JS3,JuniousSmithIII,43240,,http://encmoments.com,false
"-0.04710493,53.56984681",Fri Nov 19 19:36:52 +0000 2021,SUFC AwayDays Southend Grimsby,,https://www.instagram.com/p/CWeCrSEI7Me/?utm_medium=twitter,1,1461780533474697222,,,,en,"Grimsby, England",false,,0,,,"<a href=""http://instagram.com"" rel=""nofollow"">Instagram</a>","First away game post Covid 😍😍
Grimsby away! C’man you blues! Love a Friday night game under the floodlights!💙 #SUFC #AwayDays #Southend #Grimsby @ Grimsby Town - Blundell Park https://t.co/mXIPGYNZmW",https://twitter.com/liannewiles/status/1461780533474697222,Mon Apr 06 17:30:10 +0000 2009,29247508,false,Twenty-eight. Qualified Dispensing Optician. Gunner. Shrimper. Photographer. Ale connoisseur. Wine Devotee.,3960,994,1250,26,"Benfleet, England",Lianne Wiles,liannewiles,69683,,http://www.youtube.com/user/blondelianne,false
"-117.4035636,47.6692699",Fri Nov 19 20:15:09 +0000 2021,ThanksgivingBreak AstroWorld gonzaga gonzagau zags,https://twitter.com/GonzagaBulletin/status/1461790166725582851/video/1,,14,1461790166725582851,,,,en,"Spokane, WA",false,,3,,,"<a href=""https://www.hootsuite.com"" rel=""nofollow"">Hootsuite Inc.</a>","❤️Welcome to the Bulletin Board!😏

This week host @sydneymfluker breaks down the @GonzagaU COVID-19 testing requirement for #ThanksgivingBreak 🦃

🚨We also take a dive into who should take responsibility for the #AstroWorld event.

#gonzaga #gonzagau #zags https://t.co/2LukvfrwjM",https://twitter.com/GonzagaBulletin/status/1461790166725582851,Fri Oct 08 19:23:53 +0000 2010,200226156,false,"The official student newspaper of @gonzagau. Written for Zags, by Zags. Tips: bulletin@zagmail.gonzaga.edu",417,3838,288,75,Gonzaga University,The Gonzaga Bulletin,GonzagaBulletin,8067,,http://www.gonzagabulletin.com/,false
"-72.66276246,41.70621572",Sat Nov 20 03:04:05 +0000 2021,Work Job JustOverBroke Green Opportunity Dinero,https://twitter.com/LeeTyler/status/1461893079749718023/photo/1,http://dlvr.it/SCrjH0,0,1461893079749718023,,,,en,"Wethersfield, CT",false,,0,,,"<a href=""https://dlvrit.com/"" rel=""nofollow"">dlvr.it</a>",KBHRS looking to hire more than 80 workers for department and partners #Work #Job #JustOverBroke #Green #Opportunity #Dinero [Video]: Kern Behavioral Health and Recovery Services is holding two career fairs this week and Director Stacy Kuwahara tells me… https://t.co/jJ5kF6CcKc https://t.co/ppU3gzcbdT,https://twitter.com/LeeTyler/status/1461893079749718023,Mon Sep 08 22:56:27 +0000 2008,16193678,false,"Environmentalist, natural health researcher, raise property value. call me 917.282.6285",56,243,382,5,"New Jersey, USA",LeeTyler,LeeTyler,26455,,http://NatEcosystem.com,false
"-73.692001,40.6819",Sat Nov 20 03:01:57 +0000 2021,SouthernStateParkway,,http://511ny.org/EventDetails/TRANSCOM/ORI241361609,0,1461892542564347905,,,,en,"North Valley Stream, NY",false,,0,,,"<a href=""https://511ny.org"" rel=""nofollow"">511NY-Tweets</a>",Construction on #SouthernStateParkway EB from Exit 15 - North Corona Avenue to Exit 20S - Grand Avenue https://t.co/AiwuCLu8f3,https://twitter.com/511NY/status/1461892542564347905,Thu Jun 25 17:22:38 +0000 2009,50706690,false,Traffic & transit updates for all of New York State provided by New York State 511. Visit the website for more feeds.,0,3678,193,251,New York State,511 New York,511NY,5560459,,http://twitter.511ny.org,false
"-115.149,36.1675",Sat Nov 20 01:50:39 +0000 2021,vaccine covidvacccine covid_19 covid stopthespread slowthespread,,https://www.instagram.com/p/CWetdlplL2N/?utm_medium=twitter,0,1461874601227657219,,,,en,"Las Vegas, NV",false,,0,,,"<a href=""http://instagram.com"" rel=""nofollow"">Instagram</a>","Shot one, done. 💉 😷 
#vaccine #covidvacccine #covid_19 #covid #stopthespread #slowthespread @ Las Vegas, Nevada https://t.co/sRHNI6dfwl",https://twitter.com/mikeinvegas9/status/1461874601227657219,Thu Apr 23 02:15:32 +0000 2009,34494785,false,,4461,178,1455,8,"Las Vegas, NV",Mike,mikeinvegas9,2001,,,false
"-111.36519847,39.61517932",Sat Nov 20 00:50:02 +0000 2021,Finance Success Leadership Career Work Entrepreneur Business Goals Dreams Profit Money Like Follow Wealth Mentorship WorkFromHome,,,2,1461859342936854536,,,,en,"Utah, USA",,,0,,,"<a href=""https://www.hootsuite.com"" rel=""nofollow"">Hootsuite Inc.</a>","Trust is one of the most critical elements of a successful partnership (business, marriage, charitable organizations, parenting, etc)

#Finance #Success #Leadership #Career #Work #Entrepreneur #Business #Goals #Dreams #Profit #Money #Like #Follow #Wealth #Mentorship #WorkFromHome",https://twitter.com/MichaelGRunyan/status/1461859342936854536,Wed Feb 13 23:38:35 +0000 2019,1095829618827833345,false,#ChildofGod #Husband #Father #USCitizen #Entrepreneur #Leader #Mentor / Seeking Ppl 2 Change the World 🌎 — Training 6+ & 7+figures/yr,17131,668,463,2,United States,Mike Runyan / #LeadershipREVOLUTION,MichaelGRunyan,8219,,http://www.LeadershipRevolution.Vision,false
"-4.66281062,55.54235804",Fri Nov 19 19:58:11 +0000 2021,,,https://www.instagram.com/p/CWeFHrqo63a/?utm_medium=twitter,0,1461785897398067212,,,,en,"Troon, Scotland",false,,0,,,"<a href=""http://instagram.com"" rel=""nofollow"">Instagram</a>",Finally we made it to the LOL comedy night after lockdown cancellations!! @ Troon Concert Hall https://t.co/EX8sOmsSwB,https://twitter.com/Maritza16/status/1461785897398067212,Sun Jun 07 17:27:47 +0000 2009,45379325,false,"NHS Team Lead, Community Educator, and Radio Presenter,",491,406,700,5,"Glasgow, Scotland",Maritza Duncan,Maritza16,1390,,http://maritzaduncan.com,false
"-71.6667,-35.4333",Fri Nov 19 21:09:37 +0000 2021,plussize plussizechile plussizemodel plussizemalemodel plussizemale plussizefashion plussizemen menplussize XLMen xlfashion xlstyle beardedlifestyle instabear,,https://www.instagram.com/p/CWeNTFYrPpP/?utm_medium=twitter,0,1461803874302541833,,,,en,"Talca, Chile",false,,0,,,"<a href=""http://instagram.com"" rel=""nofollow"">Instagram</a>","Work from home realness
.
.
.
.#plussize #plussizechile #plussizemodel #plussizemalemodel #plussizemale #plussizefashion #plussizemen #menplussize #XLMen #xlfashion #xlstyle #beardedlifestyle #instabear en Talca, Chile https://t.co/amslWNxwss",https://twitter.com/TheKyayo/status/1461803874302541833,Fri May 01 18:40:32 +0000 2009,37009170,false,"Gordito Sonriente y Positivista, Vet, Gamer, Geek, TikToker, Otaku, Dog y Cat Lover, #AbrazosGratis, #PlusSize #BodyPositive, #PlusSizeChile",10038,285,582,7,"Talca, Chile",The K'Yayo,TheKyayo,10159,,https://linktr.ee/TheKyayo,false
"-77.0364,38.8951",Fri Nov 19 20:30:49 +0000 2021,,,https://www.thestkittsnevisobserver.com/virus-deaths-down-17-in-americas-covid-19-not-yet-endemic-more/,0,1461794109069443080,,,,en,"Washington, DC",false,,0,,,"<a href=""https://help.twitter.com/en/using-twitter/how-to-tweet#source-labels"" rel=""nofollow"">heapevents.info</a>","Virus Deaths Down In Americas Covid Not Yet Endemic More ☝ 🙂 
 https://t.co/BXAIAW94ht",https://twitter.com/heapevents/status/1461794109069443080,Sat Jan 09 15:58:46 +0000 2021,1347935690332495877,false,just heap of US events,0,7,25,1,,heapevents.info,heapevents,21296,,https://www.heapevents.info/,false
"-117.515,33.81863",Sat Nov 20 01:25:43 +0000 2021,Corona LAtraffic,,http://bit.ly/10F395r,0,1461868325642846210,,,,en,"Corona, CA",false,,0,,,"<a href=""http://www.sigalert.com/Map.asp?region=Greater+Los+Angeles"" rel=""nofollow"">TTN LA traffic</a>","Crash middle lane in #Corona on I-15 SB before Cajalco Rd, stopped traffic back to Magnolia Ave #LAtraffic https://t.co/e2e6MWkOvI",https://twitter.com/TotalTrafficLA/status/1461868325642846210,Wed Aug 12 21:43:18 +0000 2009,65171105,false,Providing you #LIVE #traffic updates for your #SoCal drive! Got a tip? Dial #250 and use the keyword “So Cal Traffic”,301,18778,610,687,Southern California,Total Traffic LA,TotalTrafficLA,294251,,https://www.ttwnetwork.com/,false
"-79.29448005,43.69369369",Fri Nov 19 19:35:18 +0000 2021,,,,20,1461780138551611399,,,,en,"Toronto, Ontario",,,6,,,"<a href=""http://www.tweetcaster.com"" rel=""nofollow"">TweetCaster for Android</a>",How many discredited myths can counsellor Whitehead pass off as fact in the same meeting? It's clear from research that population density is not a risk factor for covid transmission. The risk of poverty &amp; racialization &amp; having to work in person is being conflated with density.,https://twitter.com/pothen/status/1461780138551611399,Thu Feb 19 01:20:14 +0000 2009,21263260,false,"Car-free dad of 3. Adversary of Paisley Paver. Land use & environmental law, policy & gov. relations. Tweets aren't advice or the view of my client. he/him",14722,3216,1196,74,"Danforth East, Toronto",Phil Pothen,pothen,81683,,http://pothen.ca,false
"-87.65678763,41.94845799",Sat Nov 20 00:34:01 +0000 2021,christkindlemarket wrigleyville glüewine christmas tistheseason boosted covidbooster wearamask,,https://www.instagram.com/p/CWeksFHrPh4/?utm_medium=twitter,0,1461855315540992003,,,,en,"Chicago, IL",false,,0,,,"<a href=""http://instagram.com"" rel=""nofollow"">Instagram</a>","Went to the Christkindle Market and then got boosted! 
Happy Weekend! 
🎄❤💚
.
.
.
#christkindlemarket #wrigleyville #glüewine #christmas #tistheseason #boosted #covidbooster #wearamask @ Christkindlmarket Wrigleyville https://t.co/Fxe9RMfuJz",https://twitter.com/smbels/status/1461855315540992003,Fri Jun 20 12:22:50 +0000 2014,2578584944,false,"stage manager, coffee consumer, wine drinker, Hufflepuff; she/her",335658,449,1380,46,"Chicago, IL",Angi,smbels,5050,,http://www.unpopularhotties.com,false
"-73.69159,40.68203",Sat Nov 20 04:05:43 +0000 2021,ValleyStream traffic,,http://bit.ly/11xKLzq,0,1461908589275197442,,,,en,"North Valley Stream, NY",false,,0,,,"<a href=""http://www.sigalert.com/Map.asp?region=New+York"" rel=""nofollow"">TTN NYC traffic</a>","Overturned vehicle in #ValleyStream on The Southern St Pkwy EB before Corona Ave/X15, stopped traffic back to Vly Stream St Pk Rd/X15a #traffic https://t.co/cLJ9IKsg5n",https://twitter.com/TotalTrafficNYC/status/1461908589275197442,Tue May 26 14:58:42 +0000 2009,42640432,false,"Total Traffic Network delivers real-time traffic via in-car and portable navigation, broadcast media, wireless, & Internet. Call Tips Hands-Free to 212-377-7757",10,5498,348,203,New York City & New Jersey,Total Traffic NYC,TotalTrafficNYC,729980,,http://totaltraffic.com/LocalTraffic/New%20York/,false
"-86.5963,34.7123",Fri Nov 19 20:43:07 +0000 2021,backday backpose workoutpics mirrormirror gymshark gymrat workoutvideos workoutplan latspread gymspiration gymstyle workfromhome cbum,,https://www.instagram.com/p/CWeKRCWrPYi/?utm_medium=twitter,3,1461797206026072077,,,,en,"Huntsville, AL",false,,0,,,"<a href=""http://instagram.com"" rel=""nofollow"">Instagram</a>","the era of mullets &amp; thick backs…

#backday #backpose #workoutpics #mirrormirror #gymshark #gymrat #workoutvideos #workoutplan #latspread #gymspiration #gymstyle #workfromhome #cbum @ Huntsville, Alabama https://t.co/emPsaL4zDK",https://twitter.com/ReavisLuke/status/1461797206026072077,Wed May 21 23:53:54 +0000 2014,2558013147,false,i workout,3185,233,253,2,"Huntsville, AL",Mr. Kreavís,ReavisLuke,2722,,https://www.youtube.com/channel/UCsY1-cfw1mUn0W8J4CWAzuQ,false
"-79.29448005,43.69369369",Fri Nov 19 19:36:57 +0000 2021,HamOnt,,,3,1461780556195246080,,,,en,"Toronto, Ontario",,,0,,,"<a href=""http://www.tweetcaster.com"" rel=""nofollow"">TweetCaster for Android</a>",How many discredited myths can Cllr. Whitehead peddle in one meeting? It's clear from research that population density is not a risk factor for covid transmission. The risk of poverty &amp; racialization &amp; having to work in person is being conflated with density. #HamOnt,https://twitter.com/pothen/status/1461780556195246080,Thu Feb 19 01:20:14 +0000 2009,21263260,false,"Car-free dad of 3. Adversary of Paisley Paver. Land use & environmental law, policy & gov. relations. Tweets aren't advice or the view of my client. he/him",14722,3216,1196,74,"Danforth East, Toronto",Phil Pothen,pothen,81683,,http://pothen.ca,false
"-80.4298,34.0198",Fri Nov 19 22:35:44 +0000 2021,mouse pad computer laptop mac electronics oppositon intro the lyrical genius ep flow the lg,,https://www.instagram.com/p/CWeXJtfF4Z3/?utm_medium=twitter,0,1461825548372656136,,,,en,"South Carolina, USA",false,,0,,,"<a href=""http://instagram.com"" rel=""nofollow"">Instagram</a>","Special shout-out to the Work from Home Employees, First Generation Billionaire has you covered. #mouse #pad #computer #laptop #mac #electronics #oppositon #intro #the #lyrical #genius #ep #flow #the #lg https://t.co/9gdYXsOSIK",https://twitter.com/FLOW_The_LG/status/1461825548372656136,Fri May 04 17:48:45 +0000 2012,571022797,false,Follow and Listen to Orlando's words. Who the hell is Orlando? The Lyrical Genius.,5827,49,410,0,"Dalzell, SC",F.L.O.W. The L.G.,FLOW_The_LG,490,,https://unitedmasters.com/f-l-o-w-the-l-g,false
"-73.66615,40.68258",Sat Nov 20 03:50:43 +0000 2021,WestHempstead traffic,,http://bit.ly/11xKLzq,0,1461904815492059144,,,,en,"Malverne Park Oaks, NY",false,,0,,,"<a href=""http://www.sigalert.com/Map.asp?region=New+York"" rel=""nofollow"">TTN NYC traffic</a>","Accident in road construction area in #WestHempstead on The Southern St Pkwy EB at Hempstead Ave/X17, stopped traffic back to Corona Ave/X15 #traffic https://t.co/cLJ9IKsg5n",https://twitter.com/TotalTrafficNYC/status/1461904815492059144,Tue May 26 14:58:42 +0000 2009,42640432,false,"Total Traffic Network delivers real-time traffic via in-car and portable navigation, broadcast media, wireless, & Internet. Call Tips Hands-Free to 212-377-7757",10,5498,348,203,New York City & New Jersey,Total Traffic NYC,TotalTrafficNYC,729980,,http://totaltraffic.com/LocalTraffic/New%20York/,false
"-73.98459,40.73717",Sat Nov 20 03:41:21 +0000 2021,,,https://www.instagram.com/p/CWe6IJpNJMx/?utm_medium=twitter,0,1461902457307496451,,,,en,"Manhattan, NY",false,,0,,,"<a href=""http://instagram.com"" rel=""nofollow"">Instagram</a>",I went to a bar to meet @chrisbedell and @noodles_soup and prove that I show up to things. Then I left 5 minutes later. So apparently post-pandemic I am spontaneous but not THAT spontaneous. @ Barfly NY https://t.co/XhLFs0xfKL,https://twitter.com/shlokes/status/1461902457307496451,Mon May 04 20:34:23 +0000 2009,37752251,false,An American-Canadian-Indian-Bahraini Wellesley woman: it's complicated. She/her. All opinions are my own. They are also complicated.,341,149,96,6,"New York, NY",Shloka,shlokes,15021,,http://popculturescribe.blogspot.com,false
"2.15531,41.3936",Fri Nov 19 21:41:04 +0000 2021,,,http://rt.com/news/540801-orban-hungary-anti-vaccination-covid-warning/,0,1461811788211789833,,,,en,"Barcelona, España",false,,0,,,"<a href=""https://tapbots.com/tweetbot/"" rel=""nofollow"">Twitter for iPhone 12 Pro Max </a>","Itll be jab or death for anti - vaxxers, Orban predicts https://t.co/NxltZIcLfX",https://twitter.com/pidybi/status/1461811788211789833,Sat Mar 30 17:25:49 +0000 2013,1316862031,false,🤷‍♂️,219,569,590,250,Poland 🌍👈,𝔓𝔦𝔬𝔱𝔯,pidybi,633666,,,false
"-93.26439809,44.97740065",Fri Nov 19 23:44:33 +0000 2021,,https://twitter.com/EconomicMN/status/1461842866032971777/photo/1,http://dlvr.it/SCrNgG,0,1461842866032971777,,,,en,"Minneapolis, MN",false,,0,,,"<a href=""https://dlvrit.com/"" rel=""nofollow"">dlvr.it</a>",U.S. advisers support COVID boosters for all adults https://t.co/NRk1PDk8re https://t.co/8vKsCmF3ZD,https://twitter.com/EconomicMN/status/1461842866032971777,Wed Jan 28 20:23:03 +0000 2009,19673347,false,"#Minnesota regional planning, transit and economic development news. For more news follow @BusinessMN 🚄",6,2346,1805,63,"Minneapolis, MN",Finance and Commerce Economy,EconomicMN,2529,,https://finance-commerce.com/category/news/economic-development/,false
"151.18887,-33.88127",Sat Nov 20 02:53:41 +0000 2021,,,https://www.instagram.com/p/CWe0n51Pswh/?utm_medium=twitter,1,1461890463833677829,,,,en,"Sydney, New South Wales",false,,0,,,"<a href=""http://instagram.com"" rel=""nofollow"">Instagram</a>","That post-lockdown, fresh hair feeling after finally getting an appointment at your fave salon. @ Stevie English Hair https://t.co/xZMiAwrXIo",https://twitter.com/helenperris/status/1461890463833677829,Sun Apr 26 11:52:41 +0000 2009,35450747,false,Singer/Songwriter/Musician/Actor/Teacher/Mother of Mr16 & Mr9/Wife of @smperris /Empath/Feminist/Insomniac/Chocoholic/pronouns: she/her,5977,1419,1094,97,Sydney,Helen Perris,helenperris,85969,,http://helenperrismusic.com,false
"-93.2254226,44.0657981",Fri Nov 19 21:18:26 +0000 2021,COVID19 Vaccine BoosterShot Pfizer VaccinesSaveLives VaccinesWork RoadTrip,,https://www.swarmapp.com/c/5ge91Dd0icn,0,1461806092451782659,,,,en,"Owatonna, MN",false,,0,,,"<a href=""http://foursquare.com"" rel=""nofollow"">Foursquare</a>","#COVID19 #Vaccine #BoosterShot #Pfizer #VaccinesSaveLives #VaccinesWork #RoadTrip (at @Walgreens in Owatonna, MN) https://t.co/28kTGrlOJ0",https://twitter.com/MatthewMorse6/status/1461806092451782659,Sun Nov 25 00:39:28 +0000 2012,969074094,false,"Man for all seasons/ Renaissance man/ raconteur/ advocate..........

Unknown followers:  Please extend me the courtesy of introducing yourself.",6714,149,193,10,"White Bear Lake, Minnesota",Matthew Morse,MatthewMorse6,3872,,http://matthewmorsecodified.blogspot.com,false
"121.61194735,31.21706289",Sat Nov 20 03:18:38 +0000 2021,cherisheverymoment,,https://www.instagram.com/p/CWe3h-clUgz/?utm_medium=twitter,0,1461896741616185346,,,,en,"上海, 中华人民共和国",false,,0,,,"<a href=""http://instagram.com"" rel=""nofollow"">Instagram</a>","Getting the 3rd COVID immunization shot, while walking back home , seeing these “old street gangs” playing Chinese chess, life is so precious and vividly… #cherisheverymoment @ Zhangjiang, Shanghai, China https://t.co/rfQwajWeqs",https://twitter.com/samtao1/status/1461896741616185346,Fri Sep 16 17:42:11 +0000 2011,374647840,false,,8,8,76,0,YVR,sam tao,samtao1,453,,,false
"-124.10516739,41.79870354",Sat Nov 20 01:57:42 +0000 2021,niceday redwoods norcal nature roadtrip fungi socialdistancing pandemic part2 crescentcity california photooftheday,,https://www.instagram.com/p/CWeuRAoJWBQ/?utm_medium=twitter,0,1461876372998078465,,,,en,"California, USA",false,,0,,,"<a href=""http://instagram.com"" rel=""nofollow"">Instagram</a>",#niceday #redwoods #norcal #nature #roadtrip #2021 #fungi #socialdistancing #pandemic #part2 #crescentcity #california #photooftheday @ Jedediah Smith Redwoods State Park https://t.co/mh71OYRnto,https://twitter.com/troymocean/status/1461876372998078465,Mon Sep 15 23:11:38 +0000 2008,16303534,false,CD + Copywriter + Ad fan,440,118,454,11,"Chicago + Los Angeles, mang.",troymocean,troymocean,3338,,http://troyhutchinson.com,false
"-94.6025696,39.099041",Sat Nov 20 00:14:24 +0000 2021,,,https://untp.beer/s/c1100361062,1,1461850378484469767,,,,en,"Kansas City, MO",false,,0,,,"<a href=""https://untappd.com"" rel=""nofollow"">Untappd</a>",Beer for the beer god. Bottles for the bottle throne. Joke about nurgle for good measure - Drinking a Corona Extra by @GrupoModelo_MX @ Chef Tito American Fusion  — https://t.co/vXk8IEkZXF,https://twitter.com/JoshBecka/status/1461850378484469767,Tue Aug 07 16:54:11 +0000 2012,743279107,false,"I grew up once, I didn't like it. (He/Him/Dude/that one Jerk) …open to commissions",77000,494,467,3,"Kansas City, MO",beerholder bbq and hobbies,JoshBecka,3975,,,false
