coordinates,created_at,hashtags,media,urls,favorite_count,id,in_reply_to_screen_name,in_reply_to_status_id,in_reply_to_user_id,lang,place,possibly_sensitive,quote_id,retweet_count,retweet_id,retweet_screen_name,source,text,tweet_url,user_created_at,user_id,user_default_profile_image,user_description,user_favourites_count,user_followers_count,user_friends_count,user_listed_count,user_location,user_name,user_screen_name,user_statuses_count,user_time_zone,user_urls,user_verified
"-118.35201089,34.19649364",Fri Nov 19 15:26:42 +0000 2021,,,https://www.instagram.com/p/CWdmDeNpwmk/?utm_medium=twitter,0,1461717578435411977,,,,en,"Burbank, CA",false,,0,,,"<a href=""http://instagram.com"" rel=""nofollow"">Instagram</a>",Wow very last seat on the plane. This is a first. They must have needed my pandemic weight to balance the plane LOL @ Hollywood Burbank Airport - BUR https://t.co/hOzyeb2626,https://twitter.com/JoromeMelendez/status/1461717578435411977,Tue May 12 15:11:02 +0000 2009,39518752,false,Chasing the dream in the city of stars https://t.co/aa1jpEnaGg | https://t.co/o8Ung2i6c3 | https://t.co/EHfmwupARv | me@jorome.com,6268,267,1372,6,"Koreatown, Los Angeles",Jorome Melendez,JoromeMelendez,5854,,http://jorome.com,false
"-73.9293,42.8041",Fri Nov 19 17:41:22 +0000 2021,,,https://www.instagram.com/p/CWd1d5Qre9d/?utm_medium=twitter,1,1461751467598036994,,,,en,"Schenectady, NY",false,,0,,,"<a href=""http://instagram.com"" rel=""nofollow"">Instagram</a>","I hate having to, but as I'm still not feeling good after getting the Covid booster and flu shot this week, I'm going to cancel tonight's stream and rest up. See you all on Monday for more Omori ❤️ https://t.co/Oii9N5A9l3",https://twitter.com/BlockbusterChck/status/1461751467598036994,Tue Feb 03 20:42:34 +0000 2009,20002168,false,"Scottish Twitch streamer living in US, part of Glitch Co & WatchUs teams, Voice Actress, Singer, Happily married, Cat Mum of Belle & Sora, GAD & IBS Warrior!!",11479,921,535,14,"Schenectady, NY",🎬 Blockbuster_Chick 🎬,BlockbusterChck,13965,,https://www.twitch.tv/blockbuster_chick,false
"-79.7164011,43.7742911",Fri Nov 19 08:41:34 +0000 2021,Covid19 Health India NEWS,,http://dlvr.it/SCnsJJ,0,1461615621762732032,,,,en,"Brampton, Ontario",false,,1,,,"<a href=""https://dlvrit.com/"" rel=""nofollow"">dlvr.it</a>","India logs 11,106 new Covid-19 cases, 459 deaths: In the last 24 hours, India registered 11,106 new coronavirus cases and 459 deaths, the Ministry of Health and Family Welfare said in its latest update on Friday. With the… https://t.co/k9cIP3oVWP #Covid19 #Health #India #NEWS",https://twitter.com/Weeklyvoice/status/1461615621762732032,Tue Mar 30 17:43:21 +0000 2010,127943720,false,Most Trusted News in North America’s South Asian Communities Since 1997,172,494,299,11,Toronto,Weekly Voice,Weeklyvoice,37110,,http://www.Weeklyvoice.com,false
"-73.56725453,45.75975883",Fri Nov 19 19:01:03 +0000 2021,,,http://dlvr.it/SCqjqL,0,1461771521769160711,,,,en,"Mascouche, Québec",false,,0,,,"<a href=""https://dlvrit.com/"" rel=""nofollow"">dlvr.it</a>",Fighting Stigma: Northern Ireland unlikely to face another lockdown – chief medical officer — Irish Examiner: Northern Ireland's chief medical officer (CMO) Michael McBride has said he does not think the region is facing the prospect of another… https://t.co/QYHDeyRYnP,https://twitter.com/StigmabaseN/status/1461771521769160711,Wed Sep 15 15:55:47 +0000 2010,191092262,false,Ireland — Scotland — Inuit —  Svenska  | Keeping up-to-date on global exclusion — Stigmabase is a canadian internet non-profit Initiative,0,1610,1297,111,Ireland | Scotland | Inuit | Skandinavien,Stigmabase | NORDIC,StigmabaseN,952244,,https://www.stigmabase.org/,false
"-83.06543559,42.35121207",Fri Nov 19 15:40:02 +0000 2021,bathroomselfie memyselfieandi thirdmanrecords bigbudpress wearamask peoplearedumbasfuck probablyyou useyourbrain itsfun washyourhands washyourbutts TGIF moo,,https://www.instagram.com/p/CWdnlD_LIx5/?utm_medium=twitter,0,1461720934860083204,,,,en,"Detroit, MI",false,,0,,,"<a href=""http://instagram.com"" rel=""nofollow"">Instagram</a>",Happy Friday - wear a mask! #bathroomselfie #memyselfieandi #thirdmanrecords #bigbudpress #wearamask #peoplearedumbasfuck #probablyyou #useyourbrain #itsfun #washyourhands #washyourbutts #TGIF #moo https://t.co/kQqKRQqdOY,https://twitter.com/kaitlan4/status/1461720934860083204,Thu Aug 19 21:25:14 +0000 2010,180529157,false,Educated. Employed. Aquarius.,49519,407,1131,26,West Michigan ,Kaitlan,kaitlan4,31254,,,false
"-2.07967504,49.18396095",Fri Nov 19 12:03:47 +0000 2021,morningcommute jersey channelislands surprise longuevillemanor covid19 coronavirus sthelier,,https://www.instagram.com/p/CWdOmENAXh4/?utm_medium=twitter,0,1461666511966195713,,,,en,"Saint Helier, Bailiwick of Jersey",false,,0,,,"<a href=""http://instagram.com"" rel=""nofollow"">Instagram</a>","SURPRISE! I’m in Jersey (the Channel Island not the state)

#morningcommute #jersey #channelislands #surprise #longuevillemanor #covid19 #coronavirus #sthelier @ Longueville Manor Hotel and Restaurant https://t.co/afOsnUJTM6",https://twitter.com/beecee/status/1461666511966195713,Thu Apr 24 08:00:38 +0000 2008,14508711,false,A cautionary tale. Former Writer on 06:37 train to Maidstone. Award winning romcom author. Head of Storytelling at W2O. Will write for gig tickets and/or boots,25092,2909,2996,142,London/Tumblr,Brigid Coady 🌈,beecee,81608,,http://www.brigidcoady.com,false
"-122.4369529,37.7620213",Fri Nov 19 16:52:46 +0000 2021,,,https://mobile311.sfgov.org/reports/14634198,0,1461739235963125761,,,,en,"Castro, San Francisco",true,,0,,,"<a href=""https://www.poopscoop.io/"" rel=""nofollow"">ThePoopScoopSF</a>","""Human excrement on the sidewalk behind the westbound muni tunnel fence"" (Corona Heights, D8) https://t.co/byHlkNKoMM",https://twitter.com/PoopScoopSF/status/1461739235963125761,Fri Mar 08 22:43:58 +0000 2019,1104150794914344960,false,"Get the Scoop on Poop. Automatic tweets of 💩💩💩 reports in San Francisco. 

143 poops reported in the last 48 hours and 42 already marked closed by @SF311.",402,430,127,8,"San Francisco, CA",Get the Scoop on Poop,PoopScoopSF,135340,,https://poopscoop.io,false
"-0.12485951,51.50538967",Fri Nov 19 07:27:36 +0000 2021,Mexico coronavirus,,http://dlvr.it/SCnh5t,0,1461597007567486979,,,,en,"London, England",false,,1,,,"<a href=""https://dlvrit.com/"" rel=""nofollow"">dlvr.it</a>",#Mexico sends some minors to US to get #coronavirus vaccine https://t.co/OVFZ0g4WpR,https://twitter.com/BritishHeraldUK/status/1461597007567486979,Wed Feb 17 17:49:42 +0000 2010,115123902,false,Where Britain Meets the World® | The Official handle of #britishherald,350,133883,607,283,"London, United Kingdom",British Herald,BritishHeraldUK,57106,,http://www.britishherald.com,false
"-0.12485951,51.50538967",Fri Nov 19 11:10:36 +0000 2021,Taiwan COVID19,,http://dlvr.it/SCpGk3,0,1461653125803036683,,,,en,"London, England",false,,1,,,"<a href=""https://dlvrit.com/"" rel=""nofollow"">dlvr.it</a>",#Taiwan acknowledges room to improve in #COVID19 response https://t.co/vnRh1T1v6M,https://twitter.com/BritishHeraldUK/status/1461653125803036683,Wed Feb 17 17:49:42 +0000 2010,115123902,false,Where Britain Meets the World® | The Official handle of #britishherald,350,133883,607,283,"London, United Kingdom",British Herald,BritishHeraldUK,57106,,http://www.britishherald.com,false
"-84.42732451,39.16029977",Fri Nov 19 16:10:36 +0000 2021,covidvacccine covid covidbooster,,https://www.instagram.com/p/CWdrE6WrsCM/?utm_medium=twitter,0,1461728623120076803,,,,en,"Cincinnati, OH",false,,0,,,"<a href=""http://instagram.com"" rel=""nofollow"">Instagram</a>",Look who got his upgrade! #covidvacccine #covid #covidbooster @ Kroger Marketplace https://t.co/24z7yj1JDx,https://twitter.com/MrGuilt/status/1461728623120076803,Tue Jan 23 22:05:29 +0000 2007,689253,false,"First Generation Geek. Food, cats, pens and bikes. Pronouns: he/him",3957,1044,914,98,"Cincinnati, Ohio",Mr. Guilt,MrGuilt,78356,,https://identities.mrguilt.com/,false
"-0.12485951,51.50538967",Fri Nov 19 11:10:34 +0000 2021,mandatoryvaccinations,,http://dlvr.it/SCpGgG,0,1461653118202957826,,,,en,"London, England",false,,1,,,"<a href=""https://dlvrit.com/"" rel=""nofollow"">dlvr.it</a>","Austria to enter lockdown, bring in #mandatoryvaccinations https://t.co/f9YriVUWwz",https://twitter.com/BritishHeraldUK/status/1461653118202957826,Wed Feb 17 17:49:42 +0000 2010,115123902,false,Where Britain Meets the World® | The Official handle of #britishherald,350,133883,607,283,"London, United Kingdom",British Herald,BritishHeraldUK,57106,,http://www.britishherald.com,false
"-0.13608912,51.50413561",Fri Nov 19 16:41:08 +0000 2021,,,http://dlvr.it/SCqK7y,0,1461736307063885825,,,,en,"London, England",false,,1,,,"<a href=""https://dlvrit.com/"" rel=""nofollow"">dlvr.it</a>",Gay Simpsons' character Smithers gets first boyfriend five years after coming out on the cartoon: U.K. · Latest headlines World News You Mag Event Books Mail Shop Property Horoscopes Blogs Motoring Covid-19 · News · Latest Headlines Supply Chain ... https://t.co/0DeFOBhZON,https://twitter.com/StigmabaseO/status/1461736307063885825,Thu Apr 29 13:56:48 +0000 2010,138418838,false,Americas — United Kingdom  | Keeping up-to-date on global exclusion — Stigmabase is a canadian internet non-profit Initiative. Founded in 2010,0,4143,3742,262,Americas | United Kingdom,Stigmabase | ORG,StigmabaseO,1828864,,https://www.stigmabase.org/,false
"77.06728826,28.27976165",Fri Nov 19 18:07:36 +0000 2021,Property Gurgaon 2BHK Apartment Flat ForSale Sohna Residential,,http://prpt.in/P68189768,0,1461758068413321223,,,,en,"गुड़गांव, भारत",false,,0,,,"<a href=""http://www.propertywala.com/"" rel=""nofollow"">PropertyWala.com</a>","Just Pay 20% Now and 80% On Registry --- Godrej #Property #Gurgaon | 20:80 Payment Plan @Lockdown? #2BHK #Apartment #Flat #ForSale #Sohna #Residential
https://t.co/l8BvnHAVPZ",https://twitter.com/propertiesindia/status/1461758068413321223,Sat Nov 07 11:03:49 +0000 2009,88164343,false,India's Premium Real Estate Network,0,5708,23,359,India,PropertyWala.com,propertiesindia,2325518,,http://www.propertywala.com,false
"124.41965707,9.829813",Fri Nov 19 07:08:34 +0000 2021,,,https://www.instagram.com/p/CWctDIUPDc2/?utm_medium=twitter,0,1461592219996110854,,,,en,"Canduay, Rehiyon ng Gitnang Visayas",false,,0,,,"<a href=""http://instagram.com"" rel=""nofollow"">Instagram</a>","Covid brought traveling to a standstill and helped the nature rest and heal. Now that we see ease in restrictions, I hope that we all renew our pledge in preserving the environment. @ Can-Umantad Falls Candijay, Bohol https://t.co/4uY57IUUve",https://twitter.com/jrmnmrj/status/1461592219996110854,Thu Mar 04 04:43:37 +0000 2010,119620015,false,Green Tea 🍵 | Lacto-Ovo Vegetarian | Green Activist 🌱,1222,357,391,1,"Manila, PH 🇵🇭",JRMN,jrmnmrj,15453,,,false
"-0.1094,51.5141",Fri Nov 19 10:19:03 +0000 2021,australia covid_19 lockdown,,https://www.instagram.com/p/CWdC2IAs9WV/?utm_medium=twitter,0,1461640152678346756,,,,en,"City of London, London",false,,0,,,"<a href=""http://instagram.com"" rel=""nofollow"">Instagram</a>","#australia #covid_19 #lockdown @ London, United Kingdom https://t.co/HbhCD7ELCd",https://twitter.com/dips411/status/1461640152678346756,Thu Dec 30 22:15:35 +0000 2010,232343774,false,BA,161,58,103,3,"Wandsworth, London",Dipo,dips411,1599,,,false
"174.78955147,-41.30557265",Fri Nov 19 12:50:00 +0000 2021,,,https://wellingtonsoftball.org.nz/newsarticle/109866,0,1461678141630554117,,,,en,"Wellington City, New Zealand",false,,0,,,"<a href=""http://github.com/tonytw1/rsstotwitter"" rel=""nofollow"">rssclient</a>",Wellington Softball Association Inc. - ALERT - Covid Testing Centre at Velodrome https://t.co/ATYIVZFOty,https://twitter.com/wellynews/status/1461678141630554117,Thu May 01 18:34:02 +0000 2008,14617718,false,Just a small shell script. Trawling for news and goings on from around the Welly webspace. Also available as an RSS feed https://t.co/E2ANMZVLAN,91,2969,588,102,"Wellington, New Zealand",Wellynews 💙💛,wellynews,47297,,https://wellington.gen.nz,false
"116.52099609,40.01709786",Fri Nov 19 05:03:07 +0000 2021,,,http://dlvr.it/SCnNrT,1,1461560647259344903,,,,en,"北京, 中华人民共和国",false,,2,,,"<a href=""https://dlvrit.com/"" rel=""nofollow"">dlvr.it</a>","ZHNR — Fatigue and frustration as China presses strict zero-Covid strategy: The cost and pain of the strategy have been felt especially acutely by the 210,000 residents of Ruili, a Chinese city on the border with Myanmar ... View article... https://t.co/nBZqbHUX6l",https://twitter.com/StigmabaseU/status/1461560647259344903,Tue Oct 26 15:04:54 +0000 2010,208056970,false,Asia — भारत  — Türkçe — Čeština — ελληνικά | Keeping up-to-date on global exclusion — Stigmabase is a canadian internet non-profit Initiative,0,2528,2405,117,WORLDWIDE,Stigmabase | UN,StigmabaseU,1607140,,https://www.stigmabase.org/,false
"89.6358,27.4757",Fri Nov 19 08:08:49 +0000 2021,,,https://www.instagram.com/p/CWcz8Z9rJEY/?utm_medium=twitter,1,1461607382065238018,,,,en,Bhutan,false,,0,,,"<a href=""http://instagram.com"" rel=""nofollow"">Instagram</a>","Perks of working from home..!! 😋😘..
Happy International Mens Day folks…!!
Love you Wifey..❤️❤️ @ Thimphu, Bhutan https://t.co/lmm4tkNzST",https://twitter.com/bharatbugss/status/1461607382065238018,Thu May 06 02:53:19 +0000 2010,140660133,false,Co-Founder & CEO at ABIT Pvt. Limited,9,66,111,1,Thimphu Bhutan,Bharat Thapa,bharatbugss,389,,https://www.abit.bt,false
"-111.8349363,41.7101909",Fri Nov 19 14:08:34 +0000 2021,,https://twitter.com/OsoTaxService/status/1461697914263064580/photo/1,http://www.OsoTax.com,0,1461697914263064580,,,,en,"Logan, UT",false,,0,,,"<a href=""https://dlvrit.com/"" rel=""nofollow"">dlvr.it</a>","https://t.co/j63MD2MZVU More people are dying in car crashes in the pandemic even though commuting to work has decreased, a troubling trend that could be reversed with the help of new federal funds. OSO TAX SERVICE https://t.co/lgWjDXuKUy",https://twitter.com/OsoTaxService/status/1461697914263064580,Thu Jun 11 13:01:05 +0000 2009,46380873,false,"Oso Tax Service
Business and personal taxes  Bookkeeping 
Income Tax Preparation
https://t.co/0hNKzBIN1Q",97,86,327,1,"Utah, USA",Oso Tax Service,OsoTaxService,4872,,http://www.OsoTax.com/mobile,false
"-59.6136369,13.0956607",Fri Nov 19 10:04:41 +0000 2021,COVID19 vaccination myBarbadosLottery GetVaxxed PlaySafe KeepSafe,,https://www.instagram.com/p/CWdBMwIrM5T/?utm_medium=twitter,0,1461636537821671427,,,,en,Barbados,false,,0,,,"<a href=""http://instagram.com"" rel=""nofollow"">Instagram</a>","Join us in Independence Square this Friday, 19 November 2021 for your #COVID19 #vaccination.
Let’s beat COVID-19 together!
#myBarbadosLottery #GetVaxxed #PlaySafe #KeepSafe @ Independence Square https://t.co/ZhqXxNqVOw",https://twitter.com/bajanreporter/status/1461636537821671427,Thu Feb 26 12:22:14 +0000 2009,22002722,false,Licensed To Thrill - https://t.co/DsrKu1ecrc  Encourage friends and family (you too) to join the Bajan Reporter Irregulars https://t.co/8pH68A08Uh,336,3525,1723,128,"ÜT: 13.101833,-59.600669",BajanReporter.com,bajanreporter,37750,,,false
"115.21666667,-8.65",Fri Nov 19 09:45:08 +0000 2021,,,https://www.instagram.com/p/CWc-91mlPXg/?utm_medium=twitter,1,1461631619266191360,,,,en,"Denpasar Timur, Indonesia",false,,0,,,"<a href=""http://instagram.com"" rel=""nofollow"">Instagram</a>",I’ve been off social media for a while so here’s some random slice of life photos in case you want to catch up on Bali post(?)-pandemic lyfe. @ Bali https://t.co/OLBsZRIanr,https://twitter.com/CharlieKnoles/status/1461631619266191360,Sat May 11 17:27:36 +0000 2013,1421188940,false,The happiest person on earth.,19892,2398,870,79,"Bali, Indonesia",Charlie Knoles,CharlieKnoles,3975,,http://meditationteacher.org,false
"-81.99782137,26.54984394",Fri Nov 19 16:50:06 +0000 2021,Decorilla BeforeandAfter,https://twitter.com/AlmostHomeFL/status/1461738566002769923/photo/1,http://dlvr.it/SCqLH2 http://www.AlmostHomeFL.com,6,1461738566002769923,,,,en,"Cape Coral, FL",false,,0,,,"<a href=""https://dlvrit.com/"" rel=""nofollow"">dlvr.it</a>","Before &amp; After: Cozy Backyard Home Office She Shed Design: Working from home is a reality to many, as well as the challenges that come along with it. Lacking adequate space to focus on… https://t.co/j4cYOuqXRd #Decorilla #BeforeandAfter via @Decorilla https://t.co/37sC57U67M https://t.co/K8IpXoiodb",https://twitter.com/AlmostHomeFL/status/1461738566002769923,Fri May 29 13:31:54 +0000 2009,43329683,false,"Marketing Professionals Who Sell Real Estate
Michelle Richard Broker / Owner
Mortgage Advisor NMLS# 752955 
Province Mortgage Associates, Inc NMLS#2861",130991,5956,5338,33,"Cape Coral, Florida",Almost Home,AlmostHomeFL,35415,,https://www.AlmostHomeFL.com/,false
"-79.7164011,43.7742911",Fri Nov 19 11:43:06 +0000 2021,Covid19 Health,,http://dlvr.it/SCpMlt,0,1461661304729452544,,,,en,"Brampton, Ontario",false,,1,,,"<a href=""https://dlvrit.com/"" rel=""nofollow"">dlvr.it</a>","Germany’s daily Covid-19 infections reach record high of 65,000: The number of daily Covid-19 infections in Germany continued to rise strongly, exceeding 65,000 for the first time since the pandemic began, the Robert Koch Institute… https://t.co/jq7d3A3deT #Covid19 #Health",https://twitter.com/Weeklyvoice/status/1461661304729452544,Tue Mar 30 17:43:21 +0000 2010,127943720,false,Most Trusted News in North America’s South Asian Communities Since 1997,172,494,299,11,Toronto,Weekly Voice,Weeklyvoice,37110,,http://www.Weeklyvoice.com,false
"-0.1703936,51.36384",Fri Nov 19 13:01:33 +0000 2021,bestadvice covid19 Tips Leadership Management Motivation Innovation Business mentalhealth workplacehealth HR healthandsafety employeewellbeing mentalwellbeing wellbeing workplacewellbeing hr healthtech TherapistsConnect,https://twitter.com/AnthonyLSavage/status/1461681048979398657/photo/1,,0,1461681048979398657,,,,en,"Sutton, London",false,,0,,,"<a href=""https://www.hootsuite.com"" rel=""nofollow"">Hootsuite Inc.</a>",Feedback Friday! Great work team! #bestadvice #covid19 #Tips #Leadership #Management #Motivation #Innovation #Business #mentalhealth #workplacehealth #HR #healthandsafety #employeewellbeing #mentalwellbeing #wellbeing #workplacewellbeing #hr #healthtech #TherapistsConnect https://t.co/QeU0Nsbjqn,https://twitter.com/AnthonyLSavage/status/1461681048979398657,Tue Nov 20 16:31:58 +0000 2012,960767672,false,Occupational Mental Health & Wellbeing Entrepreneur Medical Services Manager @Sparta_Health Absence Rehabilitation Benefits Fitness Engagement Human Resources,4,319,649,5,"London, England",Anthony Savage,AnthonyLSavage,1864,,http://www.linkedin.com/in/anthonysavage,false
"116.52099609,40.01709786",Fri Nov 19 05:03:08 +0000 2021,,,http://dlvr.it/SCnNrh,0,1461560652791574535,,,,en,"北京, 中华人民共和国",false,,1,,,"<a href=""https://dlvrit.com/"" rel=""nofollow"">dlvr.it</a>",ZHNR — Video of pet corgi being beaten with crowbar while owner was in quarantine draws outrage in China: One of the top comments on Chinese social media criticized the ... China bans Tibetan children from taking Tibetan language classes in and out of… https://t.co/xdkWeLLcKq,https://twitter.com/StigmabaseU/status/1461560652791574535,Tue Oct 26 15:04:54 +0000 2010,208056970,false,Asia — भारत  — Türkçe — Čeština — ελληνικά | Keeping up-to-date on global exclusion — Stigmabase is a canadian internet non-profit Initiative,0,2528,2405,117,WORLDWIDE,Stigmabase | UN,StigmabaseU,1607140,,https://www.stigmabase.org/,false
"-0.12485951,51.50538967",Fri Nov 19 07:27:34 +0000 2021,Pfizer COVID19,,http://dlvr.it/SCnh5Q,0,1461597000596557824,,,,en,"London, England",false,,1,,,"<a href=""https://dlvrit.com/"" rel=""nofollow"">dlvr.it</a>","#Pfizer, U.S. ink $5.29 deal over possible #COVID19 treatment https://t.co/io8kHslKFf",https://twitter.com/BritishHeraldUK/status/1461597000596557824,Wed Feb 17 17:49:42 +0000 2010,115123902,false,Where Britain Meets the World® | The Official handle of #britishherald,350,133883,607,283,"London, United Kingdom",British Herald,BritishHeraldUK,57106,,http://www.britishherald.com,false
"-0.07939436,51.47496745",Fri Nov 19 10:54:19 +0000 2021,covid_19 vax vaccinetruthadvocate booster,,https://www.instagram.com/p/CWdG4R4oLbh/?utm_medium=twitter,0,1461649030723817476,,,,en,"Camberwell, London",false,,0,,,"<a href=""http://instagram.com"" rel=""nofollow"">Instagram</a>","She is triple :) @nhsengland #covid_19 #vax #vaccinetruthadvocate #booster @ London, Unιted Kingdom https://t.co/hpxfV9guav",https://twitter.com/ianmhm/status/1461649030723817476,Mon Mar 23 11:10:01 +0000 2009,25983459,false,"Opera Singer (Tenor), Associate Lecturer & Vocal Tutor, Make-Up / Hair / SFX/ Prosthetics MUA #opera #makeup #pop #musicaltheatre #chichester #brunel #london",30650,3477,4999,63,London,Ian Massa-Harris-McFeely (he/him),ianmhm,47346,,https://linktr.ee/Ianmhm,false
"-122.31822,47.6588",Fri Nov 19 19:18:16 +0000 2021,,,https://www.instagram.com/p/CWeAjl4P7cH/?utm_medium=twitter,0,1461775854221017092,,,,en,"Seattle, WA",false,,0,,,"<a href=""http://instagram.com"" rel=""nofollow"">Instagram</a>",Covid vaccine booster selfie: ✔️… @ UW Medicine https://t.co/UCqkuCsOqz,https://twitter.com/jesushidalgoc/status/1461775854221017092,Mon Dec 19 23:49:03 +0000 2011,441315046,false,"@UWSpanPort graduate student and @uw_translation project assistant.
Former contributing writer at @Cap_Hill_Times & former news intern at @seattleweekly",1261,704,2449,13,"Seattle, WA",jesús hidalgo,jesushidalgoc,4503,,http://www.jesushidalgo.me,false
"-73.56725453,45.75975883",Fri Nov 19 14:02:12 +0000 2021,,,http://dlvr.it/SCppS4,0,1461696311632093184,,,,en,"Mascouche, Québec",false,,0,,,"<a href=""https://dlvrit.com/"" rel=""nofollow"">dlvr.it</a>","Fighting Stigma: Northern Ireland unlikely to face another lockdown – chief medical officer — Evening Standard: However, Sir Michael McBride said some further restrictions could not be ruled out if action is not taken now. Northern Ireland's chief… https://t.co/IpUETnDa6a",https://twitter.com/StigmabaseN/status/1461696311632093184,Wed Sep 15 15:55:47 +0000 2010,191092262,false,Ireland — Scotland — Inuit —  Svenska  | Keeping up-to-date on global exclusion — Stigmabase is a canadian internet non-profit Initiative,0,1610,1297,111,Ireland | Scotland | Inuit | Skandinavien,Stigmabase | NORDIC,StigmabaseN,952244,,https://www.stigmabase.org/,false
"-73.56725453,45.75975883",Fri Nov 19 15:01:42 +0000 2021,,,http://dlvr.it/SCq0Vw,0,1461711284747997185,,,,en,"Mascouche, Québec",false,,0,,,"<a href=""https://dlvrit.com/"" rel=""nofollow"">dlvr.it</a>",Fighting Stigma: Northern Ireland unlikely to face another lockdown – chief medical officer — Express &amp; Star: Northern Ireland's chief medical officer (CMO) Sir Michael McBride has said he does not think the region is facing the prospect of another ... https://t.co/0IddmTo1Ob,https://twitter.com/StigmabaseN/status/1461711284747997185,Wed Sep 15 15:55:47 +0000 2010,191092262,false,Ireland — Scotland — Inuit —  Svenska  | Keeping up-to-date on global exclusion — Stigmabase is a canadian internet non-profit Initiative,0,1610,1297,111,Ireland | Scotland | Inuit | Skandinavien,Stigmabase | NORDIC,StigmabaseN,952244,,https://www.stigmabase.org/,false
"100.61750345,13.80737303",Fri Nov 19 15:54:48 +0000 2021,savechiangmai,,https://www.instagram.com/p/CWdpRQWPXP9/?utm_medium=twitter,1,1461724649532928010,,,,en,"บางกะปิ, ประเทศไทย",false,,0,,,"<a href=""http://instagram.com"" rel=""nofollow"">Instagram</a>","At some point this is silly. Surrounded by at leaat 2,000 people drinking beer but have to wear a mask to have a piss. At least you can drink beer in Bangkok. #savechiangmai @ 76 Garage https://t.co/EIGpeS6ymB",https://twitter.com/duncanriley/status/1461724649532928010,Sun Mar 04 07:57:24 +0000 2007,809866,false,"ดันแคนไรลีย์.  Senior writer at @SiliconANGLE, Australian abroad and founder, Chiang Mai News in English

https://t.co/Hy4HGNRYiz",4326,11022,10464,563,"Chiang Mai, Thailand",Duncan Riley,duncanriley,68686,,http://www.siliconangle.com,true
"-79.7164011,43.7742911",Fri Nov 19 12:43:06 +0000 2021,Canada Featured,,http://dlvr.it/SCpXqy,0,1461676404475523075,,,,en,"Brampton, Ontario",false,,1,,,"<a href=""https://dlvrit.com/"" rel=""nofollow"">dlvr.it</a>","Canada sees increasing daily Covid-19 cases in past days: Canada reported 1,827 new Covid-19 cases, bringing the cumulative total to 1,758,706 cases, including 1,705,513 recoveries and 29,448 deaths, according to state media channel.… https://t.co/xKu5UlmDZF #Canada #Featured",https://twitter.com/Weeklyvoice/status/1461676404475523075,Tue Mar 30 17:43:21 +0000 2010,127943720,false,Most Trusted News in North America’s South Asian Communities Since 1997,172,494,299,11,Toronto,Weekly Voice,Weeklyvoice,37110,,http://www.Weeklyvoice.com,false
