coordinates,created_at,hashtags,media,urls,favorite_count,id,in_reply_to_screen_name,in_reply_to_status_id,in_reply_to_user_id,lang,place,possibly_sensitive,quote_id,retweet_count,retweet_id,retweet_screen_name,source,text,tweet_url,user_created_at,user_id,user_default_profile_image,user_description,user_favourites_count,user_followers_count,user_friends_count,user_listed_count,user_location,user_name,user_screen_name,user_statuses_count,user_time_zone,user_urls,user_verified
"-84.38054014,33.77837645",Fri Nov 19 16:08:23 +0000 2021,wfh friday vibes party mood fun early mwah enjoy guys love u all and bless me,,https://www.instagram.com/p/CWdq0jglPA9/?utm_medium=twitter,1,1461728068603715588,,,,en,"Atlanta, GA",false,,0,,,"<a href=""http://instagram.com"" rel=""nofollow"">Instagram</a>",#wfh #friday #vibes #🖤 #🤍 #❤️ #party #mood #fun #early #mwah #enjoy #guys #love #u #all #and #bless #me #🙏🏻 @ Home Sweet Home :) https://t.co/4dikYy0pK5,https://twitter.com/PatroRosalin/status/1461728068603715588,Sat Dec 28 03:49:20 +0000 2019,1210769618467348480,false,Love recognizes no barriers #MayaAngelo,2307,163,1630,2,"Georgia, USA",Rosalin Patro,PatroRosalin,2166,,https://www.linkedin.com/in/rosalin-patro-90b840105,false
"-78.86,35.37",Fri Nov 19 13:27:20 +0000 2021,wfh bedhead wokeuplikethis sleep friday noglamourhere,,https://www.instagram.com/p/CWdYZGSrs4u/?utm_medium=twitter,0,1461687535755829248,,,,en,"North Carolina, USA",false,,0,,,"<a href=""http://instagram.com"" rel=""nofollow"">Instagram</a>","The roll out of bed time to work look 😂 

#wfh #bedhead #wokeuplikethis #sleep #friday #noglamourhere @ Harnett County, North Carolina https://t.co/SKkyN9a7sP",https://twitter.com/babygrlmaylasia/status/1461687535755829248,Mon Apr 19 16:08:32 +0000 2010,134841658,false,"Currently saving the world one computer fix at a time! My best advice to everyone is the universe is listening and GOD is waiting so LOVE, LOVE, LOVE",195,66,130,1,north carolina,Maylasia Epperson,babygrlmaylasia,379,,,false
"-74,41.925",Fri Nov 19 16:53:46 +0000 2021,thankyouscience teammoderna getvaxxed covid_19 vaccine protecteachother,,https://www.instagram.com/p/CWdwBUdFr1w/?utm_medium=twitter,0,1461739488636403715,,,,en,"Kingston, NY",false,,0,,,"<a href=""http://instagram.com"" rel=""nofollow"">Instagram</a>","BOOSTED. 
#thankyouscience #teammoderna #getvaxxed #covid_19 #vaccine #protecteachother @ Kingston, New York https://t.co/p2g1HqzPUf",https://twitter.com/MScogginsART/status/1461739488636403715,Sat Jun 14 21:14:37 +0000 2008,15119906,false,Drawing King,15378,1413,3584,52,"Greenpoint, Brooklyn",Michael Scoggins (he/him),MScogginsART,12810,,http://projectpapyrophilia.com,false
"14.44749561,35.88317301",Fri Nov 19 13:04:03 +0000 2021,Malta Taxi Chauffeur,https://twitter.com/Cab4Now/status/1461681678137446405/photo/1,http://dlvr.it/SCpcVH,0,1461681678137446405,,,,en,Malta,false,,0,,,"<a href=""https://dlvrit.com/"" rel=""nofollow"">dlvr.it</a>",Coronavirus UK: unions warn over lack of sick pay for gig economy workers https://t.co/DRvfrHQac2 #Malta #Taxi #Chauffeur https://t.co/RfSnV6y7zG,https://twitter.com/Cab4Now/status/1461681678137446405,Fri Aug 27 20:57:00 +0000 2010,183762958,false,"🇬🇧 UK & Malta's Favourite Chauffeur, Private Hire, Taxi & Minicab Website Since 2010. Free airport transfers for patrons in Malta - https://t.co/4P1DfZJSc3 | 🇲🇹",25252,10286,164,143,London,Cab4Now.com,Cab4Now,117427,,https://Cab4Now.com,false
"-121.571,47.3917",Fri Nov 19 18:45:50 +0000 2021,,,https://www.scientificamerican.com/article/the-covid-cancer-effect/,0,1461767689534599168,,,,en,"Washington, USA",false,,0,,,"<a href=""https://help.twitter.com/en/using-twitter/how-to-tweet#source-labels"" rel=""nofollow"">heapevents.info</a>","The Covid Cancer Effect ☝ 😐 
 https://t.co/Y8Sa0cNdYG",https://twitter.com/heapevents/status/1461767689534599168,Sat Jan 09 15:58:46 +0000 2021,1347935690332495877,false,just heap of US events,0,7,25,1,,heapevents.info,heapevents,21296,,https://www.heapevents.info/,false
"121.12302871,14.57376865",Fri Nov 19 09:56:06 +0000 2021,thankyouverymaersk gratefulthankfulblessed happyholidays2021,,https://www.instagram.com/p/CWdAN_0PSvJuDzKf9Kw5O5vLMhmf96O4oqXiEs0/?utm_medium=twitter,0,1461634378614902797,,,,en,"Cainta, Rehiyon ng CALABARZON",false,,0,,,"<a href=""http://instagram.com"" rel=""nofollow"">Instagram</a>","And it's my 6th time!!!😀 Maersk Holiday hamper and Maersk Covid Care kit.😊💖🎄🌟

#thankyouverymaersk😍❤
#gratefulthankfulblessed🙏
#happyholidays2021🎄🎊⭐ @ Robles Subdivision Cainta Rizal https://t.co/M9WAw4M0w9",https://twitter.com/Florencehappy10/status/1461634378614902797,Sun Jun 23 11:35:43 +0000 2013,1540784324,false,Nothing happens by chance because everything happens for a reason.,88,37,359,0,"Pasig City, National Capital R",Loren Ruiz,Florencehappy10,318,,,false
"-0.60851859,51.71290549",Fri Nov 19 16:24:16 +0000 2021,covıd vaccine booster thankyou,,https://www.instagram.com/p/CWdso_KMDpO/?utm_medium=twitter,0,1461732063053287431,,,,en,"Chesham, South East",false,,0,,,"<a href=""http://instagram.com"" rel=""nofollow"">Instagram</a>",#covıd #vaccine #booster all done. @nhs #thankyou @ Chess Medical Centre https://t.co/hqiUnHeBrb,https://twitter.com/traveltried123/status/1461732063053287431,Mon Jan 05 19:58:24 +0000 2009,18643125,false,Travel Agent who loves to Travel!,976,483,2138,12,Chesham,Elaine Kane,traveltried123,1628,,,false
"17.639437,59.858782",Fri Nov 19 16:20:39 +0000 2021,tgif,,https://www.instagram.com/p/CWdsOoPs1or/?utm_medium=twitter,0,1461731152457342976,,,,en,"Uppsala, Sverige",false,,0,,,"<a href=""http://instagram.com"" rel=""nofollow"">Instagram</a>","Beautiful walk home from work #tgif @ Uppsala, Sweden https://t.co/52Szwmaten",https://twitter.com/andyplanckSE/status/1461731152457342976,Wed Apr 29 05:52:01 +0000 2009,36299609,false,"caretaker. Self releasing Artist.  Theologian, musician, married to Sarah. producing Once upon a storytime podcast,",4868,244,784,7,"Uppsala, Sweden",Andreas Lindholm,andyplanckSE,3562,,https://open.spotify.com/album/1B7Hin72bAsDApCGu0aN4D,false
"-111.744,32.886",Fri Nov 19 14:44:58 +0000 2021,shout happy birthday sister loveyou covid,,https://www.instagram.com/p/CWdhR3MpCb6/?utm_medium=twitter,0,1461707074207985669,,,,en,"Casa Grande, AZ",false,,0,,,"<a href=""http://instagram.com"" rel=""nofollow"">Instagram</a>","#shout out #happy 51 #birthday to my #sister #loveyou bunches and I hope you have lots of fun this year since #covid messed up your 50th last year 💕🎂🎊🎈 @ Casa Grande, Arizona https://t.co/xylgHwH7HW",https://twitter.com/msphilarican/status/1461707074207985669,Sat Jun 16 23:33:23 +0000 2018,1008130446104788993,false,,391,72,305,0,"Casa Grande, AZ",msphilarican,msphilarican,2165,,,false
"-79.7164011,43.7742911",Fri Nov 19 10:43:04 +0000 2021,Covid19 Health,,http://dlvr.it/SCpBJQ,0,1461646198113144832,,,,en,"Brampton, Ontario",false,,1,,,"<a href=""https://dlvrit.com/"" rel=""nofollow"">dlvr.it</a>","Developing Covaxin was an enormous challenge: Bharat Biotech: Bharat Biotech Director, V. Krishna Mohan, has said developing the Covaxin in “just 10 months” was an enormous challenge. Addressing a session on Thursday at the Bengaluru… https://t.co/3x0W9BXQ0p #Covid19 #Health",https://twitter.com/Weeklyvoice/status/1461646198113144832,Tue Mar 30 17:43:21 +0000 2010,127943720,false,Most Trusted News in North America’s South Asian Communities Since 1997,172,494,299,11,Toronto,Weekly Voice,Weeklyvoice,37110,,http://www.Weeklyvoice.com,false
"1.54236944,52.27484722",Fri Nov 19 17:24:35 +0000 2021,booster covid_19 pfizer cutlershillpharmacy halesworth,,https://www.instagram.com/p/CWdzi-TMPlQ/?utm_medium=twitter,0,1461747245481541637,,,,en,"Darsham, England",false,,0,,,"<a href=""http://instagram.com"" rel=""nofollow"">Instagram</a>","…all vacc’d up…
#booster
#covid_19 
#pfizer 
#cutlershillpharmacy
#halesworth @ Darsham https://t.co/bB8R66yrV8",https://twitter.com/mikednew/status/1461747245481541637,Thu Jun 27 10:17:07 +0000 2013,1550306167,false,Music:folk/classical 🎼 Retired RBS manager 💷RWBRFC VP 🏉 Speedway Swindon Robins 🏍💨 Archaeology enthusiast 🏺 Lives glorious Suffolk 🏡,32012,384,1024,22,"Darsham, England",🏴󠁧󠁢󠁷󠁬󠁳󠁿 Michael New 🏴󠁧󠁢󠁷󠁬󠁳󠁿,mikednew,21687,,,false
"-94.9316,32.2561",Fri Nov 19 14:05:08 +0000 2021,,,https://www.instagram.com/p/CWdctzdLj5e/?utm_medium=twitter,1,1461697049016127494,,,,en,"Texas, USA",false,,0,,,"<a href=""http://instagram.com"" rel=""nofollow"">Instagram</a>","They are trying to kill off the population quick. Covid didn't work, small pox will do damage. God's angry and busy 🙏🙏🙏 @ New London, Texas https://t.co/xkraBqXwpz",https://twitter.com/Marilyn43591908/status/1461697049016127494,Thu May 06 10:12:48 +0000 2021,1390248089982746624,false,"❤ Love Jesus ❤ family ❤ Country🇺🇲 ❤ Country Music 🎶
I #vote for the #person that knows how too run the #Country and #Loves #America. #Pro #Life and #Pro #2A",2172,504,750,0,"Texas, USA",Marilyn King,Marilyn43591908,4255,,,false
"-73.56725453,45.75975883",Fri Nov 19 14:02:13 +0000 2021,,,http://dlvr.it/SCppSX,0,1461696317248266245,,,,en,"Mascouche, Québec",false,,0,,,"<a href=""https://dlvrit.com/"" rel=""nofollow"">dlvr.it</a>","Fighting Stigma: Masks should be worn in outdoor congregated settings, says health chief — Irish Examiner: When asked if he thought that Ireland would have to impose a lockdown as had been done in Austria, Dr Henry said he hoped not and pointed out that… https://t.co/M7bOMMY6BW",https://twitter.com/StigmabaseN/status/1461696317248266245,Wed Sep 15 15:55:47 +0000 2010,191092262,false,Ireland — Scotland — Inuit —  Svenska  | Keeping up-to-date on global exclusion — Stigmabase is a canadian internet non-profit Initiative,0,1610,1297,111,Ireland | Scotland | Inuit | Skandinavien,Stigmabase | NORDIC,StigmabaseN,952244,,https://www.stigmabase.org/,false
"-52.707222,47.5675",Fri Nov 19 14:01:26 +0000 2021,spiritofnewfoundland itsnotchristmaswithoutspirit,,https://www.instagram.com/p/CWdcS5zLWAq/?utm_medium=twitter,3,1461696120569024512,,,,en,"St. John's, Newfoundland and Labrador",false,,2,,,"<a href=""http://instagram.com"" rel=""nofollow"">Instagram</a>","Oh what a night! Preshow Opening Night. All I want for Christmas Is My two vaccines. #spiritofnewfoundland #itsnotchristmaswithoutspirit @ St. John's, Newfoundland and Labrador https://t.co/qJQ0sWbaVI",https://twitter.com/spiritofnl/status/1461696120569024512,Thu Jun 24 15:48:02 +0000 2010,159146059,false,A dynamic musical theatre company located downtown in the 120+ year old Masonic Temple. Catering. Screech-Ins. Event Venue. #ItsNotChristmasWithoutSpirit,267,1851,445,15,St. John's Newfoundland,Spirit of Newfoundand Prod.,spiritofnl,1276,,http://www.spiritofnewfoundland.com,false
"124.6034868,8.40300864",Fri Nov 19 09:35:37 +0000 2021,wfh,,https://www.instagram.com/p/CWc90ljvde5/?utm_medium=twitter,0,1461629222779240450,,,,en,"Lungsod ng Cagayan de Oro, Rehiyon ng Hilagang Mindanao",false,,0,,,"<a href=""http://instagram.com"" rel=""nofollow"">Instagram</a>","Life is good especially on a Friday. 

#wfh @ Southpoint Subdivision Cagayan de oro https://t.co/JJhiZMBZSr",https://twitter.com/earlieboms/status/1461629222779240450,Tue Jul 10 13:04:07 +0000 2012,631967977,false,MAGIS | food | travel | style | risk taker | adventure | small but terrible | family | friends | YOLO | celebrating life | manila | city of golden friendship,496,114,517,13,"Quezon City, Metro Manila",earl boms,earlieboms,3039,,,false
"-77.53823402,37.57794189",Fri Nov 19 16:54:04 +0000 2021,,https://twitter.com/cafedarkness/status/1461739565606178818/photo/1,,2,1461739565606178818,,,,en,"Richmond, VA",false,,0,,,"<a href=""http://tapbots.com/tweetbot"" rel=""nofollow"">Tweetbot for iΟS</a>",I love working in my office so I can spend 1/2 a day upgrading my computer software versus just working from home and getting things done. Very efficient. BETTER TOGETHER INDEED https://t.co/2MsTG4mvkk,https://twitter.com/cafedarkness/status/1461739565606178818,Wed Jul 08 17:54:50 +0000 2009,54971723,false,read a book,22531,1588,442,71,"Richmond, Va",Cafe Darkness,cafedarkness,56387,,,false
"-73.56725453,45.75975883",Fri Nov 19 16:01:08 +0000 2021,,,http://dlvr.it/SCqBCt,0,1461726241816383491,,,,en,"Mascouche, Québec",false,,0,,,"<a href=""https://dlvrit.com/"" rel=""nofollow"">dlvr.it</a>","Fighting Stigma: Fresh Northern Ireland lockdown 'unlikely' but more restrictions not ruled out, medical chief says — ITV: Northern Ireland chief medical officer Sir Michael McBride says further restrictions cannot be ruled out if action is not taken… https://t.co/IVTSfG8Zv8",https://twitter.com/StigmabaseN/status/1461726241816383491,Wed Sep 15 15:55:47 +0000 2010,191092262,false,Ireland — Scotland — Inuit —  Svenska  | Keeping up-to-date on global exclusion — Stigmabase is a canadian internet non-profit Initiative,0,1610,1297,111,Ireland | Scotland | Inuit | Skandinavien,Stigmabase | NORDIC,StigmabaseN,952244,,https://www.stigmabase.org/,false
"-0.72725,51.52239",Fri Nov 19 09:05:26 +0000 2021,catsofinstagram naughtycats,,https://www.instagram.com/p/CWc6au4oR9FXB-_h5xsmW-4C7TbQGkPYEESBTA0/?utm_medium=twitter,0,1461621627393912835,,,,en,"Maidenhead, South East",false,,0,,,"<a href=""http://instagram.com"" rel=""nofollow"">Instagram</a>","The joy of working from home. You see things you’ve been missing and understand how things disappear, get on the floor or how come you find paw print everywhere #catsofinstagram #naughtycats https://t.co/YSD0xO3NWh",https://twitter.com/MrTanoG/status/1461621627393912835,Wed Dec 08 05:37:31 +0000 2010,224119762,false,"me, myself and I ... I've got everything from my life, I'm lucky...that's the reason why I moan a lot",5689,109,528,0,"London, England",Tano Gangemi,MrTanoG,2457,,,false
"138.867,35.1",Fri Nov 19 14:57:17 +0000 2021,live enjoy life sunsets adventures journey traveling,,https://www.instagram.com/p/CWdisHjhg9bv-P09DFLdNcmq62wD2CYtsSgJzU0/?utm_medium=twitter,0,1461710174343733252,,,,en,静岡 沼津市,false,,0,,,"<a href=""http://instagram.com"" rel=""nofollow"">Instagram</a>","Thank God this is my last day in quarantine! I have so much life to live! #live #enjoy #life #sunsets #adventures #journey #traveling @ Numazu, Shizuoka https://t.co/ioYJLwZBXJ",https://twitter.com/wendywilltravel/status/1461710174343733252,Thu Sep 10 13:29:27 +0000 2020,1304049243049668608,false,"Hi, Wendy Shields here: vlogger, adventureseeker, ✈ worldtraveler, teacher,🍎 life long learner 📚 Mom of 4, animal lover, spontaneity encouraged, fun, outgoing",156,7,36,0,"Numazu-shi, Shizuoka",Wendywilltravel,wendywilltravel,513,,,false
"-79.7164011,43.7742911",Fri Nov 19 12:13:03 +0000 2021,Covid19 Health,,http://dlvr.it/SCpSH7,0,1461668844662304770,,,,en,"Brampton, Ontario",false,,1,,,"<a href=""https://dlvrit.com/"" rel=""nofollow"">dlvr.it</a>","Greece tightens restrictions for unvaccinated amid new Covid-19 wave: Greece will further toughen restrictions for the unvaccinated, banning their entry to more indoor spaces from Monday, as part of efforts to combat the fourth wave of… https://t.co/pLyO3Z9CRy #Covid19 #Health",https://twitter.com/Weeklyvoice/status/1461668844662304770,Tue Mar 30 17:43:21 +0000 2010,127943720,false,Most Trusted News in North America’s South Asian Communities Since 1997,172,494,299,11,Toronto,Weekly Voice,Weeklyvoice,37110,,http://www.Weeklyvoice.com,false
"-77.0367,38.8951",Fri Nov 19 12:27:20 +0000 2021,Rittenhouse Covid,,https://www.instagram.com/p/CWdRh2bFyoO/?utm_medium=twitter,0,1461672439256170507,,,,en,"Washington, DC",false,,0,,,"<a href=""http://instagram.com"" rel=""nofollow"">Instagram</a>",#Rittenhouse #Covid @ Washington D.C. https://t.co/1Ko5CiU80x,https://twitter.com/BVodkasoda/status/1461672439256170507,Tue Jan 12 03:09:11 +0000 2021,1348829298447298562,false,"#Pro2A #Libertarian #BackTheBlue #RedPilled #Liberty #Freedom #IFBAP 
**Live and Work In Washington DC**",16097,1531,4996,4,"Washington, DC",Brand VodkaSoda 2.0 🇺🇲🏳️‍🌈🍸,BVodkasoda,13151,,,false
"50.05157619,26.49235794",Fri Nov 19 04:55:36 +0000 2021,,,https://www.instagram.com/p/CWcd1NItYm7/?utm_medium=twitter,1,1461558757024956419,,,,en,"سيهات, المملكة العربية السعودية",false,,0,,,"<a href=""http://instagram.com"" rel=""nofollow"">Instagram</a>","MMR!
No, it’s not a vaccine!
It’s the Mysterious Masked Runner, appearing in a corniche near you! 😬😬 @ Saihat Al Ghadeer Corniche https://t.co/eqWki1xhiX",https://twitter.com/mohdessa/status/1461558757024956419,Wed May 13 12:55:54 +0000 2009,39743960,false,"Father of 3 princesses, critical care consultant, a passionate medical educator & researcher, and a marathon runner - in that particular order!",10832,2325,621,10,"Sihat, Kingdom of Saudi Arabia",Mohammed Abdrab Alnabi,mohdessa,6579,,,false
"31.00059056,-29.82903345",Fri Nov 19 09:40:52 +0000 2021,,,http://Ask.me https://www.instagram.com/p/CWc-eXUgENk/?utm_medium=twitter,0,1461630543813128193,,,,en,"Durban, South Africa",false,,0,,,"<a href=""http://instagram.com"" rel=""nofollow"">Instagram</a>","Gerard Chendriah 067 070 8404 
Get your Black Friday Deal done today and beat the price increases. 
Save a massive 25% on all items everything is on special. 
https://t.co/mSlnqrZS4C hoe you can lockdown these prices...stokvel 2022 https://t.co/JMZhLr7oox",https://twitter.com/GerardChendriah/status/1461630543813128193,Tue May 31 04:33:57 +0000 2016,737502351347453954,false,"@SK7 Superkleen KZN 
@amc cookware with Gerard 
@dc and gls primary cooperative #gratitude #perspective
no self entitlement",18,40,174,0,"Durban, South Africa",Gerard Chendriah,GerardChendriah,445,,,false
"72.8764,19.0627",Fri Nov 19 14:13:50 +0000 2021,gym gymmotivation health bandra,,https://www.instagram.com/p/CWddtwiMUzU/?utm_medium=twitter,5,1461699238115618820,,,,en,"मुंबई, भारत",false,,0,,,"<a href=""http://instagram.com"" rel=""nofollow"">Instagram</a>","Planning to get into shape post the lockdown. What about you guys? #gym #gymmotivation #health #bandra @ Mumbai, Maharashtra https://t.co/2vxe2opIpy",https://twitter.com/Vishhman/status/1461699238115618820,Sat Nov 14 11:24:29 +0000 2009,89918990,false,"ｖｉｓｈａｌｍ．ｅｔｈ Father, Actor, Entrepreneur, Airplane Lover. India's 1st Actor to release & sell an NFT",7276,21769,2265,131,"ÜT: 19.121244,72.823749",Vishalm.eth,Vishhman,5483,,https://linktr.ee/VishalMalhotra,true
"-0.1094,51.5141",Fri Nov 19 15:14:01 +0000 2021,southbank bankside blackfriarsbridge,,https://www.instagram.com/p/CWdkmgcg-Zp/?utm_medium=twitter,0,1461714384527441929,,,,en,"City of London, London",false,,0,,,"<a href=""http://instagram.com"" rel=""nofollow"">Instagram</a>","An unexpected post-pandemic joy for me: rediscovering how much I love London #southbank #bankside #blackfriarsbridge @ London, United Kingdom https://t.co/GnezGAjmxj",https://twitter.com/govpol/status/1461714384527441929,Mon May 23 13:27:57 +0000 2011,303815144,false,"Governance @UniofLeicester. Working mother, Norn Ironer, hypermobile Ehlers-Danlos, passionate about #flexibleworking. Married to @ollybenson. Views all mine.",1824,199,799,1,"Rugby, England",Alison Benson,govpol,1050,,,false
"-73.6197588,45.51950705",Fri Nov 19 09:27:05 +0000 2021,,https://twitter.com/stigmabase/status/1461627075052204035/photo/1,http://dlvr.it/SCnzDp,0,1461627075052204035,,,,en,"Montréal, Québec",false,,0,,,"<a href=""https://dlvrit.com/"" rel=""nofollow"">dlvr.it</a>",TW : Unpacking parents' reasons for not vaccinating their children: why it matters: Read more: Low trust in authorities affects vaccine uptake: evidence from 22 African countriesThe second reason relates to the impact of social exclusion. Exclusion can… https://t.co/wieO4HEW6C https://t.co/kefC9JBCiw,https://twitter.com/stigmabase/status/1461627075052204035,Wed Sep 01 21:06:16 +0000 2010,185789961,false,Dedicated to Education | Keeping up-to-date on global exclusion — Serving the truth — Stigmabase is a canadian internet non-profit Initiative. Founded in 2010,0,962,689,71,Worldwide,STIGMABASE | EDU,stigmabase,820492,,https://www.stigmabase.org/,false
"-0.10271911,51.5447395",Fri Nov 19 13:26:54 +0000 2021,unionchapel vacination jab delayedgratification,,https://www.instagram.com/p/CWdYWEXsrrZ/?utm_medium=twitter,0,1461687430453547016,,,,en,"Islington, London",false,,0,,,"<a href=""http://instagram.com"" rel=""nofollow"">Instagram</a>","Thanks to Covid it has been a long, long wait to experience the ethereal voice of @obadiah11 (Frazey Ford) once again. But her #unionchapel gig was worth every #vacination #jab #delayedgratification @ Union Chapel https://t.co/eK6Kphzo41",https://twitter.com/philipmudd/status/1461687430453547016,Mon Mar 02 23:18:24 +0000 2009,22551308,false,"flâneur: now focusing on thinking, drinking and putting art things on walls. (Note: I am NOT the former Deputy Director of the CIA Counterterrorist Center)",908,638,258,8,London,philip mudd,philipmudd,489,,,false
"-94.63416406,39.0990991",Fri Nov 19 16:05:36 +0000 2021,,,https://twitter.com/UnifiedGovt/status/1461724347454812160,0,1461727367831994373,,,,en,"Avondale, MO",false,1461724347454812160,0,,,"<a href=""http://www.tweetcaster.com"" rel=""nofollow"">TweetCaster for Android</a>",The Dotte is the only place in the metro with a mask order still in place methinks https://t.co/UCEHJyt2kj,https://twitter.com/patricskywalker/status/1461727367831994373,Thu Oct 15 06:07:15 +0000 2009,82552310,false,"I'm pretty good at sick burns to show how great I am... well, better then you.",634,301,350,10,"Overland Park, KS",Patric Garrison,patricskywalker,17312,,,false
"124.65599519,8.48166149",Fri Nov 19 07:20:12 +0000 2021,,,https://www.instagram.com/p/CWcuYUvPpf_/?utm_medium=twitter,0,1461595147423019012,,,,en,"Lungsod ng Cagayan de Oro, Rehiyon ng Hilagang Mindanao",false,,0,,,"<a href=""http://instagram.com"" rel=""nofollow"">Instagram</a>",Trying to order foodies. First time to go out w/ no face shield. Nakakapanibago hehe 😷 @ Limketkai Center https://t.co/0otYWQjbY4,https://twitter.com/gracegal/status/1461595147423019012,Mon Mar 24 01:40:18 +0000 2008,14204778,false,housewife/homemaker. Loves beautiful country kitchen. Tech enthusiast.,1707,352,2264,3,"Cagayan De Oro City, Northern Mindanao",Grace Galang💻📱⌚️🖥,gracegal,7233,,,false
"-0.10226432,51.57558519",Fri Nov 19 16:17:07 +0000 2021,IamTomWalker TomWalker,https://twitter.com/MusicNewsWeb/status/1461730263508025346/photo/1,http://Music-News.com http://dlvr.it/SCqFBB,4,1461730263508025346,,,,en,"Tottenham, London",false,,3,,,"<a href=""https://dlvrit.com/"" rel=""nofollow"">dlvr.it</a>","https://t.co/cGbkkwFHAS Tom Walker: 'It was quite hard writing songs in lockdown, I’m not gonna lie' #IamTomWalker @IamTomWalker #TomWalker https://t.co/vZsVJXVMUU https://t.co/4WMODTghCo",https://twitter.com/MusicNewsWeb/status/1461730263508025346,Tue Mar 31 10:32:34 +0000 2009,27847155,false,"https://t.co/zDtI3JDr0v features #news, #reviews, #gigs, #interviews, #competitions, latest releases & #gossip. #musicnews https://t.co/2atsooDt52",23174,59055,43364,526,London,Music-News.com,MusicNewsWeb,126270,,https://www.facebook.com/musicnewsweb,false
"4.8982,52.3769",Fri Nov 19 09:02:39 +0000 2021,,,https://www.instagram.com/p/CWc6Gl1rJz-/?utm_medium=twitter,0,1461620927012220930,,,,en,"Amsterdam, Nederland",false,,0,,,"<a href=""http://instagram.com"" rel=""nofollow"">Instagram</a>","The tranquil canals and streets of Amsterdam at night amid COVID lockdown @ Amsterdam, Netherlands https://t.co/m8LRYH17TO",https://twitter.com/tqdays/status/1461620927012220930,Wed Jul 15 06:42:25 +0000 2009,56948150,false,Aerospace Engineer. Gateway Safety Manager at NASA’s Johnson Space Center. Former ISS Flight Controller and ISS Safety Panel Chairman. Embry-Riddle DAB ‘98.,2448,398,1337,21,"Houston, TX",Tremayne D,tqdays,2168,,,false
"-111.074249,45.6706102",Fri Nov 19 19:24:03 +0000 2021,,,http://dlvr.it/SCqnfb,2,1461777307111018496,,,,en,"Bozeman, MT",false,,0,,,"<a href=""https://dlvrit.com/"" rel=""nofollow"">dlvr.it</a>",AP:  Canada approves Pfizer's COVID-19 vaccine for kids https://t.co/8P7FnRKhVy,https://twitter.com/bozchron/status/1461777307111018496,Wed Mar 04 00:33:58 +0000 2009,22707076,false,The official Twitter feed for the Bozeman Daily Chronicle.,92,21691,1279,468,"Bozeman, Montana",Bozeman Daily Chronicle,bozchron,104285,,http://bozemandailychronicle.com/,false
"-81.3886,41.4311",Fri Nov 19 12:37:17 +0000 2021,view,,https://www.instagram.com/p/CWdSqpTrZ5i/?utm_medium=twitter,0,1461674943469572102,,,,en,"Chagrin Falls, OH",false,,0,,,"<a href=""http://instagram.com"" rel=""nofollow"">Instagram</a>","Current #view working from home as it gets lighter outside. @ Chagrin Falls, Ohio https://t.co/pm9MjtrFAi",https://twitter.com/EricAndFazio/status/1461674943469572102,Wed Jan 13 18:30:07 +0000 2021,1349423442211319809,false,Gay CA man now in NE Ohio; Staunch Democrat; Theatre nerd; DJ for WKHR FM Sundays 1-3pm; PATRIOT,5062,185,237,1,"Chagrin Falls, OH",Eric Patriot O.,EricAndFazio,7079,,,false
"-117.868184,33.601926",Fri Nov 19 17:27:58 +0000 2021,,,https://www.instagram.com/p/CWdz7gUvh-V/?utm_medium=twitter,0,1461748096170405897,,,,en,"Newport Beach, CA",false,,0,,,"<a href=""http://instagram.com"" rel=""nofollow"">Instagram</a>",Just posted a photo @ Corona del Mar https://t.co/a91p5qUgwO,https://twitter.com/ToniPage_RSIR/status/1461748096170405897,Sun Jul 17 19:40:01 +0000 2016,754762600139718656,false,Providing unlimited support and guidance for my clients.,512,119,674,12,"Kirkland, WA",Toni Page Realogics Sotheby's,ToniPage_RSIR,306,,,false
