coordinates,created_at,hashtags,media,urls,favorite_count,id,in_reply_to_screen_name,in_reply_to_status_id,in_reply_to_user_id,lang,place,possibly_sensitive,quote_id,retweet_count,retweet_id,retweet_screen_name,source,text,tweet_url,user_created_at,user_id,user_default_profile_image,user_description,user_favourites_count,user_followers_count,user_friends_count,user_listed_count,user_location,user_name,user_screen_name,user_statuses_count,user_time_zone,user_urls,user_verified
"-80.15328806,26.12609983",Fri Nov 19 15:00:52 +0000 2021,,,https://www.instagram.com/p/CWdjGJVr1Ly/?utm_medium=twitter,0,1461711076689653770,,,,en,"Fort Lauderdale, FL",false,,0,,,"<a href=""http://instagram.com"" rel=""nofollow"">Instagram</a>",Covid -19 Shots. Flu Shots. We're doing them both tomorrow @newmtolive along with @modco.did.it @faithinflorida @aetna @cvs @healthfoundationbrowardcounty @zro_aka1955 @ New Mount Olive Baptist Church https://t.co/ODIC9SjoBj,https://twitter.com/newmtolive/status/1461711076689653770,Sun Nov 14 03:14:45 +0000 2010,215498230,false,The Mount Olive Baptist Church Family recognizes the blessing of the Internet and we are thankful that we can use this vehicle to reach the lost for Christ.,34,539,5,3,Ft Lauderdale FL. 33313,New Mt Olive Baptist,newmtolive,7683,,http://mountolive.org,false
"-115.17009844,36.11747825",Fri Nov 19 14:45:03 +0000 2021,,,https://www.instagram.com/p/CWdhSY_p0rYJ02DqUM4fAHwaac8MZNjbpBLnNI0/?utm_medium=twitter,0,1461707094491484163,corona,,289900457,en,"Paradise, NV",false,,0,,,"<a href=""http://instagram.com"" rel=""nofollow"">Instagram</a>",@corona @bbowlvegas @ Brooklyn Bowl Las Vegas https://t.co/0G5VH3Uk96,https://twitter.com/SPIDY930/status/1461707094491484163,Sat Aug 21 20:08:18 +0000 2010,181284480,false,wild and crazy guy...collector of toys,21662,642,2554,51,"Henderson, NV",Joseph Gonzalez,SPIDY930,48812,,http://www.facebook.com/joseph.gonzalez.14855,false
"-118.33421767,34.01075924",Fri Nov 19 17:57:40 +0000 2021,,,https://www.instagram.com/p/CWd3VP-vxyy/?utm_medium=twitter,0,1461755569912516608,,,,en,"Los Angeles, CA",false,,0,,,"<a href=""http://instagram.com"" rel=""nofollow"">Instagram</a>","We’ll be here until 4pm, pass along the word. 
Free Walk Up COVID Testing 
3540 w Martin Luther King Blvd. @ Bus Riders Union https://t.co/CvwODMNIJs",https://twitter.com/FightSoulCities/status/1461755569912516608,Tue Jul 31 16:09:57 +0000 2012,728704266,false,"The Fight for the Soul of the Cities is an international vision for urban organizing powered by the Labor/Community Strategy Center (LCSC), the BRU & the CRC.",4231,1371,1386,24,3546 w MLK Blvd LA CA 90008,FFSC,FightSoulCities,7448,,https://linktr.ee/TheStrategyCenter,false
"31.047,-17.8294",Fri Nov 19 18:12:10 +0000 2021,Child_of_God,,https://www.instagram.com/p/CWd4_JJoJ1A/?utm_medium=twitter,0,1461759217354825732,,,,en,"Harare, Zimbabwe",false,,0,,,"<a href=""http://instagram.com"" rel=""nofollow"">Instagram</a>","Love lockdown #Child_of_God @ Harare, Zimbabwe https://t.co/XjzNDbXljH",https://twitter.com/witnesschibanda/status/1461759217354825732,Mon Sep 03 13:50:45 +0000 2012,800455681,false,Living in a world that come with plan B,525,208,948,0,,witness Chibanda,witnesschibanda,229,,,false
"-79.7164011,43.7742911",Fri Nov 19 18:18:04 +0000 2021,ArtAndCulture PaintingSculpture,,http://dlvr.it/SCqbfT,0,1461760701370830849,,,,en,"Brampton, Ontario",false,,1,,,"<a href=""https://dlvrit.com/"" rel=""nofollow"">dlvr.it</a>","Of the pandemic and other miseries: Artist Ranjan Kaul is presenting his fourth solo exhibition titled ‘Ringside View’ that tells the story of contemporary times through the painter’s eyes at Open Palm Court Gallery,… https://t.co/BJqeyQIN3x #ArtAndCulture #PaintingSculpture",https://twitter.com/Weeklyvoice/status/1461760701370830849,Tue Mar 30 17:43:21 +0000 2010,127943720,false,Most Trusted News in North America’s South Asian Communities Since 1997,172,494,299,11,Toronto,Weekly Voice,Weeklyvoice,37110,,http://www.Weeklyvoice.com,false
"121.1117,14.3113",Fri Nov 19 14:26:28 +0000 2021,SelfieNiBigNose WorkFromHome,,https://www.instagram.com/p/CWdfKUuvv36/?utm_medium=twitter,0,1461702419902046213,,,,en,"Lungsod ng Santa Rosa, Rehiyon ng CALABARZON",false,,0,,,"<a href=""http://instagram.com"" rel=""nofollow"">Instagram</a>","Everyone needs a little push sometimes.💪

👌💯👌💯👌💯👌💯👌💯👌💯👌

#SelfieNiBigNose👃
#WorkFromHome👨‍💻 @ Santa Rosa, Laguna https://t.co/J4S6qNILag",https://twitter.com/patchotXXV/status/1461702419902046213,Wed Sep 10 23:11:54 +0000 2014,2802580782,false,"TRAVELER,  DOG LOVER,  PERFECT LOVER💯👌",445,14,142,0,Alabang,Patrick Angelo Cloa,patchotXXV,821,,http://www.facebook.com,false
"-0.10381294,51.57533849",Fri Nov 19 13:00:05 +0000 2021,youthmusiccharity,https://twitter.com/MusicNewsWeb/status/1461680680283164675/photo/1,http://Music-News.com http://dlvr.it/SCpbkL,6,1461680680283164675,,,,en,"Tottenham, London",false,,3,,,"<a href=""https://dlvrit.com/"" rel=""nofollow"">dlvr.it</a>",https://t.co/cGbkkwFHAS Youth Music launches post-pandemic fund to Recharge music-making - #youthmusiccharity @youthmusic https://t.co/GTylMPokLr https://t.co/FFk6B3fH5w,https://twitter.com/MusicNewsWeb/status/1461680680283164675,Tue Mar 31 10:32:34 +0000 2009,27847155,false,"https://t.co/zDtI3JDr0v features #news, #reviews, #gigs, #interviews, #competitions, latest releases & #gossip. #musicnews https://t.co/2atsooDt52",23174,59055,43364,526,London,Music-News.com,MusicNewsWeb,126270,,https://www.facebook.com/musicnewsweb,false
"-122.9094,49.2043",Fri Nov 19 16:41:10 +0000 2021,tgif friday wfh yvr vancouver kelowna breathe nofilter,,https://www.instagram.com/p/CWdukxKPMW4/?utm_medium=twitter,0,1461736316312375299,,,,en,"New Westminster, British Columbia",false,,0,,,"<a href=""http://instagram.com"" rel=""nofollow"">Instagram</a>","Happy Friday morning and TGIF! Let’s all plow through our four days of work volume in the next eight hours 😊
#tgif #friday #wfh #yvr #vancouver #kelowna #breathe #nofilter @ New Westminster, British Columbia https://t.co/ycxQHzxBLD",https://twitter.com/karlklann/status/1461736316312375299,Tue Mar 10 05:06:23 +0000 2009,23559346,false,"Rediscovered my inner-introvert. An avid reader, loves: to cook (and eat!) music, writing, dogs, Vancouver, and being outside as much as I can!",999,303,1028,39,"Vancouver, British Columbia",Karl Klann 🇺🇦🇺🇦,karlklann,4082,,http://www.karlklann.ca,false
"-81.5221273,41.4403648",Fri Nov 19 14:12:38 +0000 2021,,,https://www.cnn.com/2021/11/19/health/covid-vaccine-boosters-fda-cdc/index.html,1,1461698939716046858,,,,en,"Warrensville Heights, OH",false,,0,,,"<a href=""http://klinkerapps.com"" rel=""nofollow"">Talon Android</a>","Time to upgrade my 5G to Skynet

https://t.co/D2HrmeRn90",https://twitter.com/The_BirdGod/status/1461698939716046858,Sat Apr 25 23:57:37 +0000 2009,35346567,false,A man that will rise from the ashes | He/Him | LGBTQ+ Ally | Pro-Science | Pro-Choice | Pro-Wrestling | Unapologetic Atheist | Read Umineko,5398,66,128,12,The Land,"BirdGod, Elden Lord",The_BirdGod,40739,,,false
"-122.59481775,45.58828941",Fri Nov 19 17:47:43 +0000 2021,planeday pdx flying covid beenalongtime yikes,,https://www.instagram.com/p/CWd2MPsPD0g/?utm_medium=twitter,1,1461753063698579463,,,,en,"Portland, OR",false,,0,,,"<a href=""http://instagram.com"" rel=""nofollow"">Instagram</a>",Been a LOOOOOONG  time since I’ve done this. Wish me luck! 😰#planeday #pdx #flying #covid #beenalongtime #yikes @ Portland International Airport https://t.co/5aKxfAwO7M,https://twitter.com/andrealrosales/status/1461753063698579463,Fri May 03 20:43:28 +0000 2013,1400684604,false,"She/her. 🇲🇽🇺🇸 Illustrator, graphic designer, & comic artist! DC/Milestone Initiative Artist // Links: https://t.co/KOliN5Eue5",181649,1908,4991,44,"Portland, OR",Andrea Rosales @ Tacoma Springfest!,andrealrosales,54799,,http://andrearosales.com,false
"123.90836835,10.32177588",Fri Nov 19 08:52:01 +0000 2021,vax 1stdosedone covidvacccine pbb vaccine,,https://www.instagram.com/p/CWc44mJDsld/?utm_medium=twitter,0,1461618251998371842,,,,en,"Lungsod ng Cebu, Rehiyon ng Gitnang Visayas",false,,0,,,"<a href=""http://instagram.com"" rel=""nofollow"">Instagram</a>","My boys 1st Covid vax. 
.
PBB
.
#vax #1stdosedone💉✔️ #covidvacccine #pbb #vaccine @ IEC Pavilion https://t.co/CHlwuXwzkl",https://twitter.com/ceciliabarcoma/status/1461618251998371842,Thu Jan 12 04:12:04 +0000 2012,461741857,false,simple. energetic. fun to be with. love challenges. not a quitter. loyal friend. bestfriend.  adventurous.,374,68,97,8,"cebu, philippines",cecilia barcoma,ceciliabarcoma,1228,,,false
"-74.0007613,40.7207559",Fri Nov 19 09:42:02 +0000 2021,nanotechnology nano,,https://nano-magazine.com/news/2021/11/19/scientists-develop-promising-vaccine-method-against-recurrent-uti,1,1461630837175336961,,,,en,"Manhattan, NY",false,,0,,,"<a href=""http://www.squarespace.com"" rel=""nofollow"">Squarespace</a>",Scientists develop promising vaccine method against recurrent UTI  https://t.co/3ses4Ffx9H  #nanotechnology #nano,https://twitter.com/nanomagazine/status/1461630837175336961,Thu Oct 15 13:00:26 +0000 2009,82611327,false,The Magazine for Small Science. NANO Magazine features the latest developments in nanotechnology applications.,2,16906,1488,532,"London, England",NANO Magazine,nanomagazine,3756,,http://www.nanomagazine.co.uk,false
"-73.57497,45.48277",Fri Nov 19 11:56:49 +0000 2021,,,https://www.instagram.com/p/CWdOCU4LyOy/?utm_medium=twitter,1,1461664760269844485,,,,en,"Montréal, Québec",false,,0,,,"<a href=""http://instagram.com"" rel=""nofollow"">Instagram</a>",Corona Theatre. Our first concert since 2019. The Damn Truth did not disappoint. @ Théâtre Corona https://t.co/rtPvRva1Ip,https://twitter.com/fitnesscrazed/status/1461664760269844485,Fri Sep 24 20:40:12 +0000 2010,194715291,false,"Personal Training Specialist,Powerwalking Coach, Healthy Eating and Weight Loss Coach. Contact me to help you reach your health goals! dfosterlarocque@gmail.com",60,172,151,4,"Montreal, QC",Donna FosterLarocque,fitnesscrazed,2231,,http://www.donnafoster.ca,false
"-2.600849,51.454144",Fri Nov 19 14:42:51 +0000 2021,glassanimals bristol o2academy dreamland live music neon,,https://www.instagram.com/p/CWdhCNgMYM3/?utm_medium=twitter,0,1461706540243570693,,,,en,"Bristol, England",false,,0,,,"<a href=""http://instagram.com"" rel=""nofollow"">Instagram</a>","It feels so good to be back, can’t think of many other bands other than @glassanimals to bring in the post covid gigs
.
.
.
#glassanimals #bristol #o2academy #dreamland #live #music #neon @ O2 Academy Bristol https://t.co/lQKeNCf9tv",https://twitter.com/jamiehoner/status/1461706540243570693,Sun Dec 11 15:34:12 +0000 2011,434214899,false,Triangles are my favourite shape ∆ #CFC,8910,146,317,4,Chipping Sodbury,Jamie Hone,jamiehoner,3539,,http://jamehone.tumblr.com,false
"18.44123434,-33.92632593",Fri Nov 19 18:14:32 +0000 2021,,,http://dlvr.it/SCqbCh,0,1461759815567302660,,,,en,"Cape Town, South Africa",false,,0,,,"<a href=""https://dlvrit.com/"" rel=""nofollow"">dlvr.it</a>","📰 In the News | 24m COVID vaccines administered in SA so far; death toll rises to 89,489 https://t.co/DNTurFfpKo ... | @capeNews",https://twitter.com/CapeTown/status/1461759815567302660,Sat Sep 22 06:08:16 +0000 2007,9027872,false,Curated Cape Town since 2007 | Fiercely Independent | Conversational @iAmnotMany - Entrepreneur & Digital Content Strategist - Limited Promos🕯⁽ᴰᵉᵉ⁾,13086,367070,53388,1025,"Cape Town, South Africa",Cape Town 🌩️,CapeTown,96769,,https://linktr.ee/capetown,false
"1.59065,52.15785",Fri Nov 19 14:30:58 +0000 2021,,,https://www.instagram.com/p/CWdfq-yIYt3/?utm_medium=twitter,0,1461703551110029319,,,,en,"Aldeburgh, England",false,,0,,,"<a href=""http://instagram.com"" rel=""nofollow"">Instagram</a>",Sod Postman Pat. That is one special delivery service! Covid safe doorstep delivery from @susie_medland 💓💓 @ Aldeburgh https://t.co/0hh7lIINtw,https://twitter.com/kirstycomments/status/1461703551110029319,Wed Apr 21 11:59:08 +0000 2010,135473334,false,,682,50,179,2,"Aldeburgh, England",Kirsty Lou John,kirstycomments,2255,,,false
"-97.68668923,30.38244125",Fri Nov 19 23:21:49 +0000 2021,,,https://www.swarmapp.com/c/iaUNQNVCNe1,0,1461837143333130248,,,,en,"Austin, TX",false,,0,,,"<a href=""http://foursquare.com"" rel=""nofollow"">Foursquare</a>","My Covid-19  vaccine booster (@ CVS pharmacy - @cvs_extra in Austin, TX w/ @ashleyhookem) https://t.co/T90jU4JNzs",https://twitter.com/TXLonghornPride/status/1461837143333130248,Fri Jul 25 17:33:11 +0000 2014,2680095020,false,"President of the Austin chapter of the National Federation Of The Blind Of Texas, MSW & BSW degrees, disability rights advocate and Texas longhorns sports fan.",58285,543,165,28,"austin, Tx",jonathan franks 🤘🏼👨🏼‍🦯,TXLonghornPride,50626,,,false
"144.9956,-37.769",Fri Nov 19 21:53:49 +0000 2021,melbourne northcote melbournelockdown morningwalk sharebike,,https://www.instagram.com/p/CWeSW3mhLXW/?utm_medium=twitter,0,1461814998997639172,,,,en,"Melbourne, Victoria",true,,0,,,"<a href=""http://instagram.com"" rel=""nofollow"">Instagram</a>","3 random share bikes, parked outside a share house in Northcote. We are getting back to “Peak Melbourne” post lockdown! 

#melbourne #northcote #melbournelockdown #morningwalk #sharebike @ Northcote, Victoria https://t.co/cYuNWIPnGg",https://twitter.com/simmo_dwyer/status/1461814998997639172,Mon Mar 23 13:41:58 +0000 2020,1242084116167680007,false,"Queer inner Melbourne lefty, mature age design student.",20622,3027,5001,3,Wurundjeri Woi-wurrung land,Simon Simon Simon,simmo_dwyer,6196,,,false
"-124.10516739,41.79870354",Fri Nov 19 23:41:32 +0000 2021,redwoods nature norcal roadtrip pandemic part2 socialdistancing photooftheday,,https://www.instagram.com/p/CWeer2CPy-X/?utm_medium=twitter,2,1461842108227141632,,,,en,"California, USA",false,,0,,,"<a href=""http://instagram.com"" rel=""nofollow"">Instagram</a>","#redwoods #nature #norcal #roadtrip #2021 
#pandemic #part2 #socialdistancing #photooftheday @ Jedediah Smith Redwoods State Park https://t.co/umZeXT98HU",https://twitter.com/troymocean/status/1461842108227141632,Mon Sep 15 23:11:38 +0000 2008,16303534,false,CD + Copywriter + Ad fan,440,118,454,11,"Chicago + Los Angeles, mang.",troymocean,troymocean,3338,,http://troyhutchinson.com,false
"2.1557,41.39497",Fri Nov 19 20:36:22 +0000 2021,COVID,,http://rt.com/news/540796-netherlands-canceled-operations-covid-surges/,0,1461795505697083406,,,,en,"Barcelona, España",false,,0,,,"<a href=""https://tapbots.com/tweetbot/"" rel=""nofollow"">Twitter for iPhone 12 Pro Max </a>",Dutch hospitals ditching operations as #COVID surges https://t.co/VP56XfJNgf,https://twitter.com/pidybi/status/1461795505697083406,Sat Mar 30 17:25:49 +0000 2013,1316862031,false,🤷‍♂️,219,569,590,250,Poland 🌍👈,𝔓𝔦𝔬𝔱𝔯,pidybi,633666,,,false
"-117.515,33.81863",Sat Nov 20 01:55:44 +0000 2021,Corona LAtraffic,,http://bit.ly/10F395r,0,1461875878414237696,,,,en,"Corona, CA",false,,0,,,"<a href=""http://www.sigalert.com/Map.asp?region=Greater+Los+Angeles"" rel=""nofollow"">TTN LA traffic</a>","Crash right shoulder in #Corona on I-15 SB before Cajalco Rd, stopped traffic back to Magnolia Ave #LAtraffic https://t.co/e2e6MWkOvI",https://twitter.com/TotalTrafficLA/status/1461875878414237696,Wed Aug 12 21:43:18 +0000 2009,65171105,false,Providing you #LIVE #traffic updates for your #SoCal drive! Got a tip? Dial #250 and use the keyword “So Cal Traffic”,301,18778,610,687,Southern California,Total Traffic LA,TotalTrafficLA,294251,,https://www.ttwnetwork.com/,false
"-117.515,33.81863",Sat Nov 20 01:50:43 +0000 2021,Corona LAtraffic,,http://bit.ly/10F395r,1,1461874618252337160,,,,en,"Corona, CA",false,,0,,,"<a href=""http://www.sigalert.com/Map.asp?region=Greater+Los+Angeles"" rel=""nofollow"">TTN LA traffic</a>","Crash fastrak lanes in #Corona on I-15 SB before Cajalco Rd, stopped traffic back to Magnolia Ave #LAtraffic https://t.co/e2e6MWkOvI",https://twitter.com/TotalTrafficLA/status/1461874618252337160,Wed Aug 12 21:43:18 +0000 2009,65171105,false,Providing you #LIVE #traffic updates for your #SoCal drive! Got a tip? Dial #250 and use the keyword “So Cal Traffic”,301,18778,610,687,Southern California,Total Traffic LA,TotalTrafficLA,294251,,https://www.ttwnetwork.com/,false
"-73.692001,40.6819",Sat Nov 20 01:07:52 +0000 2021,SouthernStateParkway,,http://511ny.org/EventDetails/TRANSCOM/ORI241361009,0,1461863833157488646,,,,en,"North Valley Stream, NY",false,,0,,,"<a href=""https://511ny.org"" rel=""nofollow"">NYRegions</a>",Construction on #SouthernStateParkway WB from Exit 15 - North Corona Avenue to Exit 13S - Central Avenue https://t.co/MIucFgqkLt,https://twitter.com/511nyLongIsland/status/1461863833157488646,Thu Jun 25 18:45:29 +0000 2009,50729679,false,Traffic & transit updates for the Long Island area provided by New York State 511. Visit the website for more feeds.,0,2049,0,115,Long Island,511NY - Long Island,511nyLongIsland,366250,,http://twitter.511ny.org/,false
"-77.88514756,34.18018018",Sat Nov 20 02:51:56 +0000 2021,,,http://abc11.com,0,1461890023427555329,,,,en,WILMINGTON,false,,0,,,"<a href=""http://www.tweetcaster.com"" rel=""nofollow"">TweetCaster for Android</a>","Worrisome headline, with details.  Hopefully folks will heed it ...

NC coronavirus update November 19: Unvaccinated North Carolinians more than 25 times more likely to die from COVID | https://t.co/QDTLe2PcNR - https://abc11.comnc-covid-19-vaccine-booster-testing/11252831/",https://twitter.com/DrJFamPhysn/status/1461890023427555329,Fri Aug 26 16:11:11 +0000 2011,362561191,false,"Family physician with a subspecialty certification in Adolescent Medicine. In office & virtual - high quality, cost-effective healthcare for whole family.",2,46,41,1,"Leland, North Carolina USA",Robert R Johnson Jr,DrJFamPhysn,1405,,http://www.wilmingtonhealth.com,false
"36.821945,-1.292066",Sat Nov 20 02:21:08 +0000 2021,SantoriniChallenge,,https://www.reddit.com/r/Kenya/comments/qxlcgl/,0,1461882270650937349,,,,en,"Nairobi, Kenya",true,,0,,,"<a href=""https://twitter.com/hermoand"" rel=""nofollow"">Kenyans On Reddit</a>","✦ [ #SantoriniChallenge ] ● News

Scientists mystified, wary, as Africa avoids COVID disaster

https://t.co/fqyN1iSy3M",https://twitter.com/KenyansOnReddit/status/1461882270650937349,Sun Jun 07 11:55:21 +0000 2020,1269598733878079488,false,"Come join your fellow Kenyans™ on Reddit 👉 https://t.co/jgE8q6ov1E 

- #TopReply
- #rKenyaModLog
- #RemovedByMods
- #DeletedByAuthor
- #rKenyaVideo",796,254,17,3,Nairobi,Kenyans On Reddit 🇰🇪,KenyansOnReddit,44989,,https://reddit.com/r/kenya,false
"127.01648,37.51502",Sat Nov 20 03:46:45 +0000 2021,happyweekend 마스크 wearamask dust 미세먼지 pollution airqualityindex seoulsearching seoulkorea korea 일상 seoullife seoulcity airpollution dontgooutside,,https://www.instagram.com/p/CWe6vwLvvs7/?utm_medium=twitter,0,1461903818673868802,,,,en,대한민국 강남구,false,,0,,,"<a href=""http://instagram.com"" rel=""nofollow"">Instagram</a>","Not sure which to believe but 🤮 !!! ⁣
.⁣
.⁣
.⁣
.⁣
.⁣
#happyweekend #마스크 #wearamask #dust #미세먼지 #pollution #airqualityindex #seoulsearching #seoulkorea #korea #일상 #seoullife #seoulcity #airpollution #dontgooutside https://t.co/10qfT54nju",https://twitter.com/vinnieflores/status/1461903818673868802,Thu Mar 05 22:25:07 +0000 2009,22989615,false,"Guam native, Taekwondo loving, former teacher, Fulbright alum, beagle dad, Tesla owner, int’l ed advocate who loves Korea and creating student opportunities",313,82,127,0,"Seoul, ROK",Vincent Flores,vinnieflores,471,,,false
"-121.72903408,36.47774558",Fri Nov 19 20:00:50 +0000 2021,wearamask,,https://www.instagram.com/p/CWeFbKCPuqT/?utm_medium=twitter,1,1461786563629703175,,,,en,"Carmel Valley Village, CA",false,,0,,,"<a href=""http://instagram.com"" rel=""nofollow"">Instagram</a>",#wearamask and drink Pinot 🍷 - I am pouring today at the @windy_oaks_estate_cv Tasting Room in the Carmel Valley Village and I have the new 2019 Wild Yeast Pinot open! 🍷☀️ @ Windy Oaks Carmel Valley https://t.co/ovmYgrZfKQ,https://twitter.com/grapelive/status/1461786563629703175,Thu Aug 20 15:31:41 +0000 2009,67343155,false,"wine professional, wine blogger, soccer fan, former motorsport historian & foodie on the Monterey Bay blogging about wine & travel at https://t.co/4cuglYEMVl",265463,2222,3556,84,"Carmel, CA",Kerry Winslow,grapelive,53000,,http://www.grapelive.com,false
"-73.692001,40.6819",Sat Nov 20 01:07:52 +0000 2021,SouthernStateParkway,,http://511ny.org/EventDetails/TRANSCOM/ORI241361009,0,1461863832943480834,,,,en,"North Valley Stream, NY",false,,0,,,"<a href=""https://511ny.org"" rel=""nofollow"">511NY-Tweets</a>",Construction on #SouthernStateParkway WB from Exit 15 - North Corona Avenue to Exit 13S - Central Avenue https://t.co/HDaHCZZlCp,https://twitter.com/511NY/status/1461863832943480834,Thu Jun 25 17:22:38 +0000 2009,50706690,false,Traffic & transit updates for all of New York State provided by New York State 511. Visit the website for more feeds.,0,3678,193,251,New York State,511 New York,511NY,5560459,,http://twitter.511ny.org,false
"-95.3694,29.7602",Fri Nov 19 23:36:25 +0000 2021,,,http://www.oneupadvertising.com https://www.instagram.com/p/CWeeGPSL0dr/?utm_medium=twitter,0,1461840819128729601,,,,en,"Houston, TX",false,,0,,,"<a href=""http://instagram.com"" rel=""nofollow"">Instagram</a>","Personalized Promotional Hand Sanitizer 

Put your logo company on Promotional items 

https://t.co/WCenZ7txVF 

Call Now 713 478 4812 @ Houston, Texas https://t.co/yzXPf4hBR8",https://twitter.com/photographyusa/status/1461840819128729601,Wed Jul 08 15:40:26 +0000 2009,54931507,false,Firefighter 🚒  👨‍🚒,14130,441,1531,3,"Houston, TX",Armando Castañeda,photographyusa,3660,,http://www.oneupadvertising.com,false
"-87.6501,41.85",Fri Nov 19 22:01:10 +0000 2021,,,https://herald-review.com/news/state-and-regional/illinois-sees-uptick-in-youth-covid-19-cases-school-outbreaks-heading-into-thanksgiving-break/article_a3f9bcce-8729-59fb-816c-5231e780dff7.html,0,1461816849306460162,,,,en,"Chicago, IL",false,,0,,,"<a href=""https://help.twitter.com/en/using-twitter/how-to-tweet#source-labels"" rel=""nofollow"">heapevents.info</a>","State And Regional Illinois Sees Uptick In Youth Covid Cases School Outbreaks Heading Into Thanksgiving Break ☝ 😐 
 https://t.co/L7djA5tkZn",https://twitter.com/heapevents/status/1461816849306460162,Sat Jan 09 15:58:46 +0000 2021,1347935690332495877,false,just heap of US events,0,7,25,1,,heapevents.info,heapevents,21296,,https://www.heapevents.info/,false
"-90.40201,38.54497",Sat Nov 20 00:29:02 +0000 2021,,,https://www.instagram.com/p/CWekHm5gupJmZBGEpvY2sFRZrZZxY6sKI_QPCA0/?utm_medium=twitter,0,1461854059577724939,,,,en,"Sunset Hills, MO",false,,0,,,"<a href=""http://instagram.com"" rel=""nofollow"">Instagram</a>","This just happened ❤️! 
Mi niña tan bonita got her first vaccine dose and we couldn’t be more prouder 👏🏽👏🏽👏🏽 @ Sunset Hills, Missouri https://t.co/vld6SjrX6Y",https://twitter.com/Tink1378J/status/1461854059577724939,Fri Oct 14 18:15:08 +0000 2016,786993759871459328,false,Wife and mother of 2!,711,32,47,3,"St Louis, MO",Tink,Tink1378J,5504,,,false
"-73.692001,40.6819",Sat Nov 20 03:01:56 +0000 2021,SouthernStateParkway,,http://511ny.org/EventDetails/TRANSCOM/ORI241361609,0,1461892540479717379,,,,en,"North Valley Stream, NY",false,,0,,,"<a href=""https://511ny.org"" rel=""nofollow"">NYRegions</a>",Construction on #SouthernStateParkway EB from Exit 15 - North Corona Avenue to Exit 20S - Grand Avenue https://t.co/6my5GkrY4M,https://twitter.com/511nyLongIsland/status/1461892540479717379,Thu Jun 25 18:45:29 +0000 2009,50729679,false,Traffic & transit updates for the Long Island area provided by New York State 511. Visit the website for more feeds.,0,2049,0,115,Long Island,511NY - Long Island,511nyLongIsland,366250,,http://twitter.511ny.org/,false
"104.83343889,15.2686447",Fri Nov 19 20:34:44 +0000 2021,,,https://www.instagram.com/p/CWeJTplh-W5/?utm_medium=twitter,0,1461795097478148104,,,,en,"อุบลราชธานี, ประเทศไทย",false,,0,,,"<a href=""http://instagram.com"" rel=""nofollow"">Instagram</a>",Get some COVID @ เเม็กโค https://t.co/sBXtZY1xgs,https://twitter.com/0x511aNA/status/1461795097478148104,Sun Oct 30 02:54:05 +0000 2011,401122698,false,"Lost Ark / Dota2 noob player. Anastasia AKA ana.
Fans​ of​ @OGesports and /JerAx​/Anathan​ Pham/Ceb/Topson/n0tail/
actor : Mads Mikkelsen",511,159,132,5,"US: 15.259075,104.852449",Aye End Aye and her DreamOG🌻,0x511aNA,12660,,,false
"76.74368,30.68409",Sat Nov 20 03:13:35 +0000 2021,covid_19 MegaVaccinationCamp covid_19 corona,,https://www.instagram.com/p/CWe28-DJrAR/?utm_medium=twitter,4,1461895472013062144,,,,en,"मोहाली, भारत",false,,0,,,"<a href=""http://instagram.com"" rel=""nofollow"">Instagram</a>","#covid_19 #MegaVaccinationCamp is being organized by @mohaliadministration .

21 November Saturday and 20th November Sunday

Please refer to the image for details.

#covid_19  #corona @ Mohali, Chandigarh https://t.co/ixSDDGZ6bW",https://twitter.com/dcmohali/status/1461895472013062144,Thu Jun 20 05:24:19 +0000 2019,1141577496787222528,false,"Official page of Deputy Commissioner & District Magistrate, Mohali.",149,7327,27,9,"Mohali, India",DC Mohali,dcmohali,350,,http://sasnagar.gov.in,false
