coordinates,created_at,hashtags,media,urls,favorite_count,id,in_reply_to_screen_name,in_reply_to_status_id,in_reply_to_user_id,lang,place,possibly_sensitive,quote_id,retweet_count,retweet_id,retweet_screen_name,source,text,tweet_url,user_created_at,user_id,user_default_profile_image,user_description,user_favourites_count,user_followers_count,user_friends_count,user_listed_count,user_location,user_name,user_screen_name,user_statuses_count,user_time_zone,user_urls,user_verified
"-73.855,45.51972222",Tue Jun 08 14:20:39 +0000 2021,lockdownlife memes,,https://www.instagram.com/p/CP3MIKhgVQ2/?utm_medium=twitter,0,1402269345997336577,,,,en,"Laval, Québec",false,,0,,,"<a href=""http://instagram.com"" rel=""nofollow"">Instagram</a>","Well well well, fast forward to the first lockdown with kids 24/24 hours a day 😅 some call it a kind of mental torture 🤪🤯 I will say it’s a mixture of fun moments and total nightmare 🤣😂 #lockdownlife #memes @ Île Bigras https://t.co/HC3xHTZKXy",https://twitter.com/audreyfrenchsmi/status/1402269345997336577,Mon Oct 05 09:10:07 +0000 2009,79973200,false,Shamanic Alchemy & Empath Warrior 🇫🇷🇬🇧🇨🇦,142,156,298,19,Berkshire England,Audrey Boulanger,audreyfrenchsmi,4521,,https://www.instagram.com/audrey_french_smile,false
"0.05173177,52.28036162",Tue Jun 08 14:21:04 +0000 2021,,https://twitter.com/DailyCAMBRIDGE/status/1402269451375030275/photo/1,https://j.mp/2SaBYHV,0,1402269451375030275,,,,en,"Oakington, England",false,,0,,,"<a href=""https://dlvrit.com/"" rel=""nofollow"">dlvr.it</a>",Covid-19: Daughters say NHS worker mum is their 'hero' https://t.co/oBzg9DRYSG https://t.co/2xYtqX6jzc,https://twitter.com/DailyCAMBRIDGE/status/1402269451375030275,Sun May 06 16:02:57 +0000 2012,572760485,false,"Latest news, sport, and updates from the county of Cambridgeshire (Cambs), UK",2,3296,1348,57,"Cambridgeshire (Cambs), UK",CAMBRIDGESHIRE,DailyCAMBRIDGE,62089,,https://twitter.com/dailycambridgeshire,false
"-95.30262287,32.33782959",Tue Jun 08 17:19:20 +0000 2021,,,https://twitter.com/GregAbbott_TX/status/1402022555960086531,0,1402314313667338241,,,,en,"Tyler, TX",false,1402022555960086531,0,,,"<a href=""http://tapbots.com/tweetbot"" rel=""nofollow"">Tweetbot for iΟS</a>",What about protecting your citizens from the people who callously don’t care that they might spread a deadly and life altering virus?  Can we have freedom from the ignorant?  The misled?  The willful idiots?  Why pander to those who don’t care about others? https://t.co/4ONnIDk2yR,https://twitter.com/MikeAustin/status/1402314313667338241,Fri May 16 22:58:37 +0000 2008,14805327,false,Dad. Doc. Dork. He/Him.,10492,191,101,10,"Tyler, TX",MikeAustin,MikeAustin,10147,,,false
"120.5987931,15.43216402",Tue Jun 08 13:03:28 +0000 2021,workout work workfromhome wfh cause not applause live lifequotes lifecoach express expressyourself impress impression_shots,,https://www.instagram.com/p/CP3DS9og78d/?utm_medium=twitter,0,1402249923429425152,,,,en,"Lungsod ng Tarlac, Rehiyon ng Gitnang Luzon",false,,0,,,"<a href=""http://instagram.com"" rel=""nofollow"">Instagram</a>","“Work for a cause, not for applause. Live life to express, not to impress.”

#workout #work #workfromhome #wfh #cause #not #applause #live #lifequotes #lifecoach #express #expressyourself #impress #impression_shots https://t.co/oKdhnCnOrQ",https://twitter.com/princejayz1/status/1402249923429425152,Mon Aug 13 05:38:08 +0000 2012,754509056,false,"I am simple, kind, handsome and of course lovable.. :)",1456,170,471,1,Philippines,Jayson Absalon,princejayz1,10537,,https://www.facebook.com/jayson.absalon,false
"-117.537555,33.880653",Tue Jun 08 14:41:19 +0000 2021,,,https://apli.us/7Yr,0,1402274544308703241,,,,en,"Corona, CA",false,,0,,,"<a href=""http://www.recruitology.com"" rel=""nofollow"">Recruitology</a>","Want to work at Confidential? We're hiring in Corona, CA! Details: https://t.co/eBPxhgdxWs Veterinanjobs",https://twitter.com/NWJS_jobs/status/1402274544308703241,Thu Feb 28 23:58:33 +0000 2019,1101270461986496512,false,Find local jobs now.,0,502,23,2,,Nationwide Job Search,NWJS_jobs,417800,,https://www.nationwidejobsearch.com,false
"77.60032028,12.95268745",Tue Jun 08 13:13:33 +0000 2021,Nifty Sipgrab UnitingPeopleWithThePossibilities,,http://dlvr.it/S1JbQZ,0,1402252460119318531,,,,en,"Bengaluru South, India",false,,0,,,"<a href=""https://dlvrit.com/"" rel=""nofollow"">dlvr.it</a>",Glenmark says post-marketing study of COVID-19 antiviral Fabiflu supports the drug safety and effectiveness https://t.co/NZGu7pO7NW #Nifty #Sipgrab #UnitingPeopleWithThePossibilities,https://twitter.com/sipgrab/status/1402252460119318531,Tue Feb 28 12:12:15 +0000 2017,836549573048848384,false,Wealth management firm| Option Trading Expert | Option Strategy maker| 360° financial planner | compelete range of financial products | Market buzz updater!!,272,267,94,2,"Bengaluru, India",SipGrab,sipgrab,43338,,http://www.Sipgrab.com,false
"77.65212771,12.8898216",Tue Jun 08 16:38:40 +0000 2021,Nifty Sipgrab UnitingPeopleWithThePossibilities,,http://dlvr.it/S1KGwd,0,1402304077250236418,,,,en,"Bengaluru South, India",false,,0,,,"<a href=""https://dlvrit.com/"" rel=""nofollow"">dlvr.it</a>",The Tell: The Fed’s COVID-era municipal lending program worked for Illinois https://t.co/tntdm940oq #Nifty #Sipgrab #UnitingPeopleWithThePossibilities,https://twitter.com/sipgrab/status/1402304077250236418,Tue Feb 28 12:12:15 +0000 2017,836549573048848384,false,Wealth management firm| Option Trading Expert | Option Strategy maker| 360° financial planner | compelete range of financial products | Market buzz updater!!,272,267,94,2,"Bengaluru, India",SipGrab,sipgrab,43338,,http://www.Sipgrab.com,false
"77.63237648,12.93354386",Tue Jun 08 16:57:33 +0000 2021,Nifty sipgrab,,http://dlvr.it/S1KL1Z,0,1402308829572780034,,,,en,"Bengaluru South, India",false,,0,,,"<a href=""https://dlvrit.com/"" rel=""nofollow"">dlvr.it</a>",CDC COVID-19 study shows mRNA vaccines reduce risk of infection by 91 percent for fully vaccinated people https://t.co/gyXHfbUZgC #Nifty #sipgrab,https://twitter.com/sipgrab/status/1402308829572780034,Tue Feb 28 12:12:15 +0000 2017,836549573048848384,false,Wealth management firm| Option Trading Expert | Option Strategy maker| 360° financial planner | compelete range of financial products | Market buzz updater!!,272,267,94,2,"Bengaluru, India",SipGrab,sipgrab,43338,,http://www.Sipgrab.com,false
"-121.51919287,38.36830882",Tue Jun 08 12:08:20 +0000 2021,alhamdulillah blessed staysafe stayhome throwback,,https://www.instagram.com/p/CP28-zipwGr/?utm_medium=twitter,0,1402236047183028225,,,,en,"California, USA",false,,0,,,"<a href=""http://instagram.com"" rel=""nofollow"">Instagram</a>","29.05.2021 - 08.06.2021. I’m back ! Alhamdulillah after 11 days quarantine . Please stay safe everyone . 😉💪🏼

.
.
.
.

#alhamdulillah #blessed #staysafe #stayhome #throwback @ Sons Of Anarchy Clubhouse https://t.co/A5L01tqs77",https://twitter.com/shameerazhar/status/1402236047183028225,Sun Jul 10 18:45:57 +0000 2011,332958437,false,"Thanking God everyday for my family, my health, my trials, my success, my tears, my laughter...everything which makes me and matures me ☺",396,262,327,6,"Selangor, Malaysia",Shameer Azhar,shameerazhar,5348,,,false
"-73.80859594,40.74743042",Tue Jun 08 16:46:23 +0000 2021,kissenapark wahm kissenalake workathomemom workfromhome,,https://www.instagram.com/p/CP3czljDnLH/?utm_medium=twitter,0,1402306021486432264,,,,en,"Queens, NY",false,,0,,,"<a href=""http://instagram.com"" rel=""nofollow"">Instagram</a>",Omg can’t see 3rd egg today this is 4 th time she has moved them and I can’t see #3 #kissenapark #wahm #kissenalake #workathomemom #workfromhome @ Kissena Park https://t.co/0rIm0rVSvx,https://twitter.com/NewYorkMikeG/status/1402306021486432264,Sun Oct 12 00:46:03 +0000 2008,16702299,false,"Coach,Retired NYPD Det Teaching Future Entrepreneurs 2 create Fun Money 😀😀😀",196,1528,4451,119,"Queens, NY",Michael Geddes,NewYorkMikeG,16201,,http://www.newyorkmike.com,false
"-90.01798,35.13875",Tue Jun 08 15:31:36 +0000 2021,,,https://www.instagram.com/p/CP3UPy1LGML/?utm_medium=twitter,0,1402287199215882241,,,,en,"Memphis, TN",false,,0,,,"<a href=""http://instagram.com"" rel=""nofollow"">Instagram</a>",Hey Mane…AIN’T NO MO COVID…SO LET’S RAP…IN MEMPHIS!!! I’ll be there with a flavor profile that is exceptional! @ House of Mtenzi Museum https://t.co/8LybfzNXwo,https://twitter.com/Cappuccinomeeks/status/1402287199215882241,Mon Mar 04 00:54:08 +0000 2013,1240177152,false,Eddie Meeks is a true veteran of the music industry. Eddie Meeks has been releasing records for 30+ years and still going strong.,7697,742,237,33,IG: @SOUTH_MEMPHIS_MEEKS,For The GARD So Loved The World 🌍,Cappuccinomeeks,14149,,http://eddiemeeks.bandcamp.com,false
"-73.97235966,40.76888109",Tue Jun 08 16:20:34 +0000 2021,,https://twitter.com/IceAirNewYork/status/1402299523649572866/photo/1,http://dlvr.it/S1KCyT,0,1402299523649572866,,,,en,"Manhattan, NY",false,,0,,,"<a href=""https://dlvrit.com/"" rel=""nofollow"">dlvr.it</a>",HVAC Manufacturers Look Ahead to a Post-COVID World https://t.co/2tDkQTOI7t https://t.co/1QGpf60Ce5,https://twitter.com/IceAirNewYork/status/1402299523649572866,Mon Nov 26 17:15:15 +0000 2018,1067104509732769792,false,Proud to Install & Service Ice Air in the NYC area! Looking to replace your PTAC unit? Call us today. 646-727-9322,0,17,0,1,"New York, USA",Ice Air New York City,IceAirNewYork,3408,,https://www.facebook.com/IceAirNewYorkCity/,false
"101.52642644,3.06592092",Tue Jun 08 12:20:05 +0000 2021,astrazeneca vaccinationdone,,https://www.instagram.com/p/CP2-VGmNte3/?utm_medium=twitter,2,1402239001998901250,,,,en,"Bandar Petaling Jaya, Selangor",false,,0,,,"<a href=""http://instagram.com"" rel=""nofollow"">Instagram</a>","Alhamdulilah my mama she done her 1st dose of vaccine 💉 #astrazeneca  ✅ 🤲🏼🤗😘 #vaccinationdone✔️ @ IDCC Convention Centre, Shah Alam https://t.co/V1zCqdyFjS",https://twitter.com/ElliaSahan/status/1402239001998901250,Mon Oct 19 16:43:53 +0000 2015,3948919933,false,"BEAUTY CONSULTANT 💉👱🏼‍♀️@mediiskinstudio 👨‍⚕ #sitizoner 1997 till now 🧕🏻 “Buatlah ibumu seperti raja, maka rezekimu akan seperti raja2👩‍🍳🍪 ellcookies",15885,465,1446,9,Shah alam,ELSA 🧖‍♀️🇲🇾💍,ElliaSahan,44119,,https://www.instagram.com/ell_sahan/,false
"80.18960521,13.02855682",Tue Jun 08 16:53:26 +0000 2021,,,,0,1402307795941163008,subiksharaman,1401903745500209153,1218364375,en,"चेन्नई, भारत",,,0,,,"<a href=""http://tapbots.com/tweetbot"" rel=""nofollow"">Tweetbot for iΟS</a>",@subiksharaman Arey what help. I bungled. Tell them to wear a mask nd distance. They still are at the risk of contacting COVID. 45 days away from the second dose do a antibody test to quantify,https://twitter.com/Murugzopthalmix/status/1402307795941163008,Sun Apr 26 16:18:08 +0000 2009,35497791,false,"Full time ophthalmologist ,Part time vocalist Small time cyclist ,All time motor cyclist 
Get the drift  it’s a gift 🔱",7,393,257,5,"13.073666,80.228086",murugz ophthalmix,Murugzopthalmix,6192,,,false
"77.65212771,12.8898216",Tue Jun 08 15:49:08 +0000 2021,Nifty Sipgrab UnitingPeopleWithThePossibilities,,http://dlvr.it/S1K70Y,0,1402291614165340161,,,,en,"Bengaluru South, India",false,,0,,,"<a href=""https://dlvrit.com/"" rel=""nofollow"">dlvr.it</a>","Coronavirus Update: New U.S. COVID-19 cases and deaths tick higher, while CDC’s ‘real-world’ study shows Pfizer, Moderna vaccines reduce infection risk by 91% https://t.co/V6qCJ0P8dn #Nifty #Sipgrab #UnitingPeopleWithThePossibilities",https://twitter.com/sipgrab/status/1402291614165340161,Tue Feb 28 12:12:15 +0000 2017,836549573048848384,false,Wealth management firm| Option Trading Expert | Option Strategy maker| 360° financial planner | compelete range of financial products | Market buzz updater!!,272,267,94,2,"Bengaluru, India",SipGrab,sipgrab,43338,,http://www.Sipgrab.com,false
"90.4667,26.55",Tue Jun 08 17:32:50 +0000 2021,,,https://www.instagram.com/p/CP3iHu-D8sE/?utm_medium=twitter,0,1402317711531720704,,,,en,"आसाम, भारत",false,,0,,,"<a href=""http://instagram.com"" rel=""nofollow"">Instagram</a>","Chirang District COVID-19 Update
Date 8th June @ Sidli, Assam, India https://t.co/5QLNUGkCWj",https://twitter.com/chirangnow/status/1402317711531720704,Mon May 03 04:06:20 +0000 2021,1389068648808165381,false,"Hi Guys ! Welcome to the Chirang Now Twitter Page. 
We are here to help you with sharing news update.
Feel free to DM us 👍",3,7,18,0,,Chirangnow,chirangnow,33,,,false
"-77.4525633,37.5480168",Tue Jun 08 18:01:05 +0000 2021,,,https://www.instagram.com/p/CP3lWx-FwxICe-vEC7bBk7SDDKGhGBwkGHwbVQ0/?utm_medium=twitter,0,1402324819002204165,,,,en,"Richmond, VA",false,,0,,,"<a href=""http://instagram.com"" rel=""nofollow"">Instagram</a>",Back in the office after 450 days of working from home.   Kind of feels good to not be in the house and it is still a ghost town on campus.  (dreading the # of messages on the phone) https://t.co/es4IcwFCDh,https://twitter.com/RodneyDyer/status/1402324819002204165,Mon Dec 19 01:48:23 +0000 2011,440475972,false,"He/Him.  Husband, Father, Full Professor, Director @vcuenvs, PI @Dyerlab, Population Geneticist, Programmer, Zymergist, Fermentationist, Frolfer.  #firstgen",845,178,438,1,Richmond Virginia,Rodney,RodneyDyer,838,,http://rodneydyer.com,false
"-0.13608912,51.50413561",Tue Jun 08 18:44:06 +0000 2021,,,http://dlvr.it/S1KgjS,0,1402335643234037762,,,,en,"London, England",false,,0,,,"<a href=""https://dlvrit.com/"" rel=""nofollow"">dlvr.it</a>","HIV Vaccines Market to Witness Huge Growth by 2028 | Top Manufacturers – AlphaVax, Antigen ...: The HIV Vaccines Market report contains vital information to prepare market players to face ... Europe (UK, Germany, France and the rest of Europe) https://t.co/dcaaBiWSKV",https://twitter.com/StigmabaseO/status/1402335643234037762,Thu Apr 29 13:56:48 +0000 2010,138418838,false,Americas — United Kingdom  | Keeping up-to-date on global exclusion — Stigmabase is a canadian internet non-profit Initiative. Founded in 2010,0,4144,3743,262,Americas | United Kingdom,Stigmabase | ORG,StigmabaseO,1828446,,https://www.stigmabase.org/,false
"-96.81999874,32.85060977",Tue Jun 08 20:04:33 +0000 2021,,,https://www.instagram.com/p/CP3zfJ3H4KU/?utm_medium=twitter,0,1402355892306202625,,,,en,"Dallas, TX",false,,0,,,"<a href=""http://instagram.com"" rel=""nofollow"">Instagram</a>",Why do adults get vaccines when they've been exposed and spread everything to their babies? @ Inwood Village https://t.co/rhSd3JKCam,https://twitter.com/ac_grindl/status/1402355892306202625,Tue Jan 20 01:06:49 +0000 2009,19212401,false,"My vision board, anthology, ensemble, composite, analects, connectivism, hypertexts in one dream called Words Will Never hurt Me. Safe, secure, true story.",328,185,260,6,United States,AC Grindl,ac_grindl,2458,,https://acgrindl.com,false
"-77.0364,38.8951",Tue Jun 08 19:30:26 +0000 2021,,,https://www.mrt.com/news/article/What-the-pandemic-has-stolen-from-Black-America-16228725.php,0,1402347302992363522,,,,en,"Washington, DC",false,,0,,,"<a href=""https://help.twitter.com/en/using-twitter/how-to-tweet#source-labels"" rel=""nofollow"">heapevents.info</a>","What The Pandemic Has Stolen From Black America ☝ 😕 
 https://t.co/bMtutQNiCE",https://twitter.com/heapevents/status/1402347302992363522,Sat Jan 09 15:58:46 +0000 2021,1347935690332495877,false,just heap of US events,0,7,25,1,,heapevents.info,heapevents,21254,,https://www.heapevents.info/,false
"103.8677444,1.3553794",Tue Jun 08 18:35:32 +0000 2021,,,http://dlvr.it/S1Kdtt,0,1402333487340785664,,,,en,"东北区, 新加坡",false,,0,,,"<a href=""https://dlvrit.com/"" rel=""nofollow"">dlvr.it</a>",U.K. Sends Military to Covid Hotspots to Help Tackle Variant https://t.co/byMXDW2zuf,https://twitter.com/VishnoiSays/status/1402333487340785664,Sat Oct 10 12:18:47 +0000 2009,81342472,false,Asia markets,384,1006,824,41,,Abhishek,VishnoiSays,9311,,,false
"-122.62228389,45.50460398",Tue Jun 08 18:47:13 +0000 2021,,,https://www.instagram.com/p/CP3qolDLIiO/?utm_medium=twitter,0,1402336429498421259,,,,en,"Portland, OR",false,,0,,,"<a href=""http://instagram.com"" rel=""nofollow"">Instagram</a>",Only two pokes.  They did all the labs today. I have to go get my shingles vaccine now. @ Richmond Clinic OHSU https://t.co/mQBCXt89KQ,https://twitter.com/handsxred/status/1402336429498421259,Sun Jul 22 04:05:45 +0000 2007,7633872,false,She/her. Makeup/Skincare. True Crime. Indigenous. Eel River Myaamia/Potawotami. Two Spirit. Demisexual. Autistic. Disabled. CPTSD. INFJ-T.,97,715,62,33,"Portland, OR",𝖑𝖚𝖓𝖆 𝖌𝖗𝖆𝖞,handsxred,43892,,https://beacons.page/hands.red,false
"-86.36020432,41.96312376",Tue Jun 08 22:05:21 +0000 2021,AUedu ausba auwellness stayinghealthy teampichot goexplore getoutdoors michigan michigansgreatsouthwest covid19,,https://www.instagram.com/p/CP4BTrVh6QK/?utm_medium=twitter,0,1402386289731674115,,,,en,"Berrien Springs, MI",false,,0,,,"<a href=""http://instagram.com"" rel=""nofollow"">Instagram</a>","Dedicated tram from Chan Shun Hall, walking every day, rain or shine. Today, rain.

#AUedu #ausba #auwellness #stayinghealthy #teampichot #goexplore #getoutdoors #michigan #michigansgreatsouthwest #covid19 https://t.co/Ehk1UFqbki",https://twitter.com/kimberlypichot/status/1402386289731674115,Mon Apr 05 17:20:52 +0000 2010,129870226,false,Business consultant & coach helping founders maintain sustainable growth. Associate Professor of Marketing @ Andrews University.,736,378,1644,14,"Berrien Springs, MI",Kimberly Pichot,kimberlypichot,1365,,https://about.me/kimpichot,false
"-116.78597689,47.67285792",Tue Jun 08 21:01:59 +0000 2021,family hiking nature homeschool scavengerhunt,,https://www.instagram.com/p/CP36Duhrscz/?utm_medium=twitter,0,1402370346016198659,,,,en,"Coeur d'Alene, ID",false,,0,,,"<a href=""http://instagram.com"" rel=""nofollow"">Instagram</a>",Tubbs hill hike #family #hiking #nature #homeschool #scavengerhunt @ Lake Coeur d'Alene https://t.co/b59BXI05Dq,https://twitter.com/HomemakerStrong/status/1402370346016198659,Sun Jul 02 17:24:30 +0000 2017,881564249968988161,false,Homemaking is a way of life. Join me on my journey. Follows/likes do not equal endorsements. #homemaker #wife #caregiver #momlife #vintage #combatvetwife,17159,3400,2845,16,"North Idaho, USA",The Strong Homemaker,HomemakerStrong,7909,,http://thestronghomemaker.com,false
"-73.56725453,45.75975883",Tue Jun 08 20:42:11 +0000 2021,,,http://dlvr.it/S1L4FG,0,1402365359689142276,,,,en,"Mascouche, Québec",false,,0,,,"<a href=""https://dlvrit.com/"" rel=""nofollow"">dlvr.it</a>","Fighting Stigma: Coronavirus: When will the UK be fully vaccinated against Covid?: Since then, more than 40 million British adults have had a jab, with health secretary Matt Hancock telling his fellow MPs in Parliament on Monday that ... https://t.co/ToEimKTwIW",https://twitter.com/StigmabaseN/status/1402365359689142276,Wed Sep 15 15:55:47 +0000 2010,191092262,false,Ireland — Scotland — Inuit —  Svenska  | Keeping up-to-date on global exclusion — Stigmabase is a canadian internet non-profit Initiative,0,1611,1297,110,Ireland | Scotland | Inuit | Skandinavien,Stigmabase | NORDIC,StigmabaseN,951942,,https://www.stigmabase.org/,false
"-73.5391442,40.6785784",Tue Jun 08 22:26:03 +0000 2021,BeerMenus,,https://www.beermenus.com/places/63010-classic-beverage-bellmore?b_id=413446&utm_content=beer-413446&utm_medium=serving-share&utm_source=twitter,0,1402391501099909131,,,,en,"North Bellmore, NY",false,,0,,,"<a href=""https://www.beermenus.com"" rel=""nofollow"">BeerMenus </a>",Corona Hard Seltzer Limonada Variety cans now available. https://t.co/EigXPspTxc @beverageclassic #BeerMenus,https://twitter.com/BeverageClassic/status/1402391501099909131,Fri Apr 19 23:37:59 +0000 2019,1119384677356384257,false,"Classic Beverage in North Bellmore has everything you need from the breweries of New York to Belgium. Cases, kegs, samplings and swag.",50,25,43,0,"North Bellmore, NY",Classic Beverage,BeverageClassic,1954,,http://WWW.CLASSIC-BEVERAGE.COM,false
"-1.46989346,52.91765398",Tue Jun 08 20:05:03 +0000 2021,Derbyshire,,https://j.mp/3crQi5C,0,1402356015828406275,,,,en,"Derby, England",false,,0,,,"<a href=""https://dlvrit.com/"" rel=""nofollow"">dlvr.it</a>",Almost 50 coronavirus cases recorded in latest update for #Derbyshire https://t.co/JzcyDhzsK6,https://twitter.com/DailyDERBYS/status/1402356015828406275,Thu Jul 19 23:35:31 +0000 2012,705994686,false,"Follow for all of the latest news, sport, weather, and updates from around the county of Derbyshire (Derbys), UK",4,3063,959,50,"Derbyshire, UK",DERBYSHIRE,DailyDERBYS,88140,,https://twitter.com/dailyderbys,false
"123.902138,10.3107984",Tue Jun 08 18:42:39 +0000 2021,,,,0,1402335281781432321,,,,en,"Lungsod ng Cebu, Rehiyon ng Gitnang Visayas",,,0,,,"<a href=""http://www.myplume.com/"" rel=""nofollow"">Plume for Android</a>",So happy my laptop 💻 was back to it's normal state w/o the WFH LOCKDOWN this morning. Makes my work smoother. RDOT kaya this 12th? We'll see.,https://twitter.com/bubblyluchz/status/1402335281781432321,Fri Nov 20 19:55:19 +0000 2009,91412713,false,"Beauty isn't about having a pretty face, it's about having a pretty mind, a pretty heart, and a pretty soul.
★Kalog •Hilarious😂 
♡Naughty
★Sweet 😋 BISDAK",9512,385,255,55,🌍,𝕷𝖚𝖈𝖍𝖎𝖊™ 💋💐,bubblyluchz,57812,,,false
"-93.27959739,37.14621147",Tue Jun 08 17:58:02 +0000 2021,,,https://www.instagram.com/p/CP3lAdHDKe4/?utm_medium=twitter,0,1402324052895797253,,,,en,"Missouri, USA",false,,0,,,"<a href=""http://instagram.com"" rel=""nofollow"">Instagram</a>",Preparing for a COVID-19 update from Cox Health. @ Cox Medical Center-South https://t.co/TVmFborp88,https://twitter.com/ericthephotog1/status/1402324052895797253,Mon Dec 09 14:34:50 +0000 2019,1204046641407365127,false,"KOLR, KOZL, KRBK I'm a Photojournalist. Springfield, MO - Southwest Missouri - North Central Arkansas",10,111,888,1,"Springfield, MO",Eric Redus,ericthephotog1,319,,https://www.ozarksfirst.com/author/eric-redus/,true
"-73.63589,40.68933",Tue Jun 08 20:45:45 +0000 2021,Hempstead traffic,,http://bit.ly/11xKLzq,0,1402366258356568064,,,,en,"Lakeview, NY",false,,0,,,"<a href=""http://www.sigalert.com/Map.asp?region=New+York"" rel=""nofollow"">TTN NYC traffic</a>","Accident in #Hempstead on The Southern St Pkwy EB at Peninsula Blvd/X19, stopped traffic back to Corona Ave/X15 #traffic https://t.co/cLJ9IKsg5n",https://twitter.com/TotalTrafficNYC/status/1402366258356568064,Tue May 26 14:58:42 +0000 2009,42640432,false,"Total Traffic Network delivers real-time traffic via in-car and portable navigation, broadcast media, wireless, & Internet. Call Tips Hands-Free to 212-377-7757",10,5495,348,203,New York City & New Jersey,Total Traffic NYC,TotalTrafficNYC,729832,,http://totaltraffic.com/LocalTraffic/New%20York/,false
"-73.56725453,45.75975883",Tue Jun 08 21:41:10 +0000 2021,,,http://dlvr.it/S1LC88,0,1402380204140482565,,,,en,"Mascouche, Québec",false,,0,,,"<a href=""https://dlvrit.com/"" rel=""nofollow"">dlvr.it</a>","Fighting Stigma: I've never been shy about calling out Covid offenders, says Health Minister when quizzed about ...: Download the Belfast Telegraph App. Get quick and easy access to the latest Northern Ireland news, sport, business and opinion with the… https://t.co/bRkwJtnpHZ",https://twitter.com/StigmabaseN/status/1402380204140482565,Wed Sep 15 15:55:47 +0000 2010,191092262,false,Ireland — Scotland — Inuit —  Svenska  | Keeping up-to-date on global exclusion — Stigmabase is a canadian internet non-profit Initiative,0,1611,1297,110,Ireland | Scotland | Inuit | Skandinavien,Stigmabase | NORDIC,StigmabaseN,951942,,https://www.stigmabase.org/,false
"72.9097582,19.00117717",Tue Jun 08 19:07:06 +0000 2021,Sipgrab UnitingPeopleWithThePossibilities,,http://dlvr.it/S1KmKZ,0,1402341434762567683,,,,en,"मुंबई, भारत",false,,0,,,"<a href=""https://dlvrit.com/"" rel=""nofollow"">dlvr.it</a>","Pricey homes, cheap airfare: Canada rejigs inflation measures for post-pandemic life https://t.co/4aReZ0u1gU #Sipgrab #UnitingPeopleWithThePossibilities",https://twitter.com/sipgrab/status/1402341434762567683,Tue Feb 28 12:12:15 +0000 2017,836549573048848384,false,Wealth management firm| Option Trading Expert | Option Strategy maker| 360° financial planner | compelete range of financial products | Market buzz updater!!,272,267,94,2,"Bengaluru, India",SipGrab,sipgrab,43338,,http://www.Sipgrab.com,false
"0.493,52.304",Tue Jun 08 22:05:26 +0000 2021,,,https://www.instagram.com/p/CP4BUeIDkwaDgI9Y1j9dTPjIOKzPKNY47Zpfug0/?utm_medium=twitter,0,1402386311269523460,,,,en,"Red Lodge, England",false,,0,,,"<a href=""http://instagram.com"" rel=""nofollow"">Instagram</a>","Update: Quarantine sucks. I don’t want to go back to work. And all I want is my wife and son in my arms again.👍🏻 @ Red Lodge, Suffolk https://t.co/ifEj8JqVgN",https://twitter.com/maguire_sell_16/status/1402386311269523460,Sat Oct 10 03:59:32 +0000 2015,3914952683,false,Winning is a habit....it just takes time./23/ @USAirForce ✈️🇺🇸 sc:maguiresell_116 IG: maguiresell TikTok: sellmaguire_116,6387,260,535,0,"Lakenheath, England",Maguire Sell,maguire_sell_16,5494,,https://www.instagram.com/maguiresell_2016/,false
