coordinates,created_at,hashtags,media,urls,favorite_count,id,in_reply_to_screen_name,in_reply_to_status_id,in_reply_to_user_id,lang,place,possibly_sensitive,quote_id,retweet_count,retweet_id,retweet_screen_name,source,text,tweet_url,user_created_at,user_id,user_default_profile_image,user_description,user_favourites_count,user_followers_count,user_friends_count,user_listed_count,user_location,user_name,user_screen_name,user_statuses_count,user_time_zone,user_urls,user_verified
"-112.03587781,41.08108108",Wed Jun 09 02:53:44 +0000 2021,,,https://twitter.com/TheTNHoller/status/1402408416228806663,0,1402458863857664003,,,,en,"Washington Terrace, UT",false,1402408416228806663,0,,,"<a href=""http://www.tweetcaster.com"" rel=""nofollow"">TweetCaster for Android</a>",Holy fuxking stupid batman https://t.co/7LJ1TQqK2s,https://twitter.com/dante801/status/1402458863857664003,Wed Oct 07 22:46:33 +0000 2009,80699027,false,Slava Ukraini🇺🇦 🎷 𝐔𝐓𝐀𝐇 𝐉𝐀𝐙𝐙 🎷 ✭ 𝗗𝗔𝗟𝗟𝗔𝗦 𝗖𝗢𝗪𝗕𝗢𝗬𝗦 ✭ 🖕𝙍𝙖𝙘𝙞𝙨m 🖕🏼 🄰🄽🅃🄸🅅🄰🅇🅇🄴🅁🅂 #freedumb #𝕎𝕠𝕞𝕖𝕟𝕤ℝ𝕚𝕘𝕙𝕥𝕤🖕🏼Elon Musk🖕🏼religion Republicans dgaf about you!,7852,120,638,6,ỮŦΔĦ,Derek 🇺🇦,dante801,11178,,,false
"-73.56725453,45.75975883",Wed Jun 09 02:39:41 +0000 2021,,,http://dlvr.it/S1Ln7T,0,1402455328462016512,,,,en,"Mascouche, Québec",false,,0,,,"<a href=""https://dlvrit.com/"" rel=""nofollow"">dlvr.it</a>","Fighting Stigma: Seizure of illegal medicines up 58% in past year, says regulator: The HPRA said there were 56,876 units of Covid-19 medicines detained, “the majority of which related to traditional Chinese medicine not approved or ... https://t.co/zgRo3tgMUj",https://twitter.com/StigmabaseN/status/1402455328462016512,Wed Sep 15 15:55:47 +0000 2010,191092262,false,Ireland — Scotland — Inuit —  Svenska  | Keeping up-to-date on global exclusion — Stigmabase is a canadian internet non-profit Initiative,0,1611,1297,110,Ireland | Scotland | Inuit | Skandinavien,Stigmabase | NORDIC,StigmabaseN,951942,,https://www.stigmabase.org/,false
"126.98244019,37.54274326",Wed Jun 09 04:04:38 +0000 2021,,,http://dlvr.it/S1LwDF,0,1402476709241266176,,,,en,대한민국 용산구,false,,1,,,"<a href=""https://dlvrit.com/"" rel=""nofollow"">dlvr.it</a>","KRNR — Korea mistakenly registers ineligible people for COVID-19 vaccine: South Korea mistakenly opened up COVID-19 vaccine appointments on Monday for tens of thousands of people who were not yet eligible, leading to ... View article... https://t.co/Go7eR4qIoL",https://twitter.com/StigmabaseU/status/1402476709241266176,Tue Oct 26 15:04:54 +0000 2010,208056970,false,Asia — भारत  — Türkçe — Čeština — ελληνικά | Keeping up-to-date on global exclusion — Stigmabase is a canadian internet non-profit Initiative,0,2528,2405,117,WORLDWIDE,Stigmabase | UN,StigmabaseU,1606909,,https://www.stigmabase.org/,false
"-100.983,25.4333",Wed Jun 09 02:53:25 +0000 2021,Saltillo Coahuila Mexico HomeTown HomeSweetHome COVID19Mexico COVID19 Coronavirus Quarantine QuarantineMexico Cuarentena CuarentenaMexico QuedateEnCasa StayAtHome,,https://www.instagram.com/p/CP4iRtNFcxc/?utm_medium=twitter,1,1402458786632286211,,,,en,"Saltillo, Coahuila de Zaragoza",false,,0,,,"<a href=""http://instagram.com"" rel=""nofollow"">Instagram</a>","Quarantine Day 437: Out For Blood!
.
#Saltillo #Coahuila #Mexico #HomeTown #HomeSweetHome #COVID19Mexico #COVID19 #Coronavirus #Quarantine #QuarantineMexico #Cuarentena #CuarentenaMexico #QuedateEnCasa #StayAtHome https://t.co/Rg8Ge1Yi6H",https://twitter.com/RedMapleExLT/status/1402458786632286211,Sun Apr 14 13:33:11 +0000 2013,1351877840,false,🍁Red Maple co-founder 💊💉🥫Quality Management System & Food Safety consultant 🧟‍♀️🚀🧛🏻‍♂️ Sci-fi & Horror enthusiast 📬redmaple@redmaple.com.mx,44631,2095,639,181,"Saltillo, Coahuila de Zaragoza",Red Maple,RedMapleExLT,156705,,http://www.redmaple.com.mx,false
"-123.12713019,49.24963985",Wed Jun 09 01:07:07 +0000 2021,,,http://dlvr.it/S1Lckv,0,1402432032693624834,,,,en,"Vancouver, British Columbia",false,,1,,,"<a href=""https://dlvrit.com/"" rel=""nofollow"">dlvr.it</a>",KRGMT —   Suppressed travel demand in South Korean has “exploded”: “With main travel destinations lifting quarantine requirements for vaccinated travellers and South Korean airlines reportedly planning to resume ... View article... https://t.co/CZAiaafuBx,https://twitter.com/StigmabaseU/status/1402432032693624834,Tue Oct 26 15:04:54 +0000 2010,208056970,false,Asia — भारत  — Türkçe — Čeština — ελληνικά | Keeping up-to-date on global exclusion — Stigmabase is a canadian internet non-profit Initiative,0,2528,2405,117,WORLDWIDE,Stigmabase | UN,StigmabaseU,1606909,,https://www.stigmabase.org/,false
"-73.56725453,45.75975883",Tue Jun 08 23:40:08 +0000 2021,,,http://dlvr.it/S1LSkV,0,1402410144672063488,,,,en,"Mascouche, Québec",false,,0,,,"<a href=""https://dlvrit.com/"" rel=""nofollow"">dlvr.it</a>","Fighting Stigma: Coronavirus: 271 new cases confirmed, 77 patients in hospital: Meanwhile, tribute has been paid to healthcare workers as the confirmed ... None were described in Northern Ireland Department of Health data as ... https://t.co/V6lIec7sUs",https://twitter.com/StigmabaseN/status/1402410144672063488,Wed Sep 15 15:55:47 +0000 2010,191092262,false,Ireland — Scotland — Inuit —  Svenska  | Keeping up-to-date on global exclusion — Stigmabase is a canadian internet non-profit Initiative,0,1611,1297,110,Ireland | Scotland | Inuit | Skandinavien,Stigmabase | NORDIC,StigmabaseN,951942,,https://www.stigmabase.org/,false
"-73.56725453,45.75975883",Wed Jun 09 00:40:35 +0000 2021,,,http://dlvr.it/S1LZJB,0,1402425355860774917,,,,en,"Mascouche, Québec",false,,0,,,"<a href=""https://dlvrit.com/"" rel=""nofollow"">dlvr.it</a>","Fighting Stigma: Covid vaccines: Three million doses have been administered in Ireland: More than 50% of the adult population have received one dose, while around 25% have received two doses and are fully vaccinated. Minster for Health ... https://t.co/QBVW8QF4Io",https://twitter.com/StigmabaseN/status/1402425355860774917,Wed Sep 15 15:55:47 +0000 2010,191092262,false,Ireland — Scotland — Inuit —  Svenska  | Keeping up-to-date on global exclusion — Stigmabase is a canadian internet non-profit Initiative,0,1611,1297,110,Ireland | Scotland | Inuit | Skandinavien,Stigmabase | NORDIC,StigmabaseN,951942,,https://www.stigmabase.org/,false
"-73.95,40.65",Wed Jun 09 00:26:40 +0000 2021,David Vs Goliath Covid,,https://www.instagram.com/p/CP4Re4fD3j1/?utm_medium=twitter,0,1402421856175591427,,,,en,"Brooklyn, NY",false,,0,,,"<a href=""http://instagram.com"" rel=""nofollow"">Instagram</a>","#David #Vs #Goliath = #Covid  🤣🤣🤣🤣 @ Brooklyn, New York https://t.co/vb1rxiKbcR",https://twitter.com/Fabolous93085/status/1402421856175591427,Wed Mar 25 05:02:37 +0000 2009,26435030,false,#Dominican #Gamer #Madden #Top500 player #MusicLover #Gamer4Life #IloveGaming❤,1017,349,575,11,Puerto Plata City/Brooklyn Ny,🇩🇴FaBoLoUS93085🇩🇴,Fabolous93085,42507,,http://www.FaceBook.com/fabolous93085,false
"73.69949,24.58782",Wed Jun 09 02:08:22 +0000 2021,yellowrose rose loveislove pridemonth morning walking workout stayfit stayblessed stayhomestaysafe,,https://www.instagram.com/p/CP4dHjxDX_i/?utm_medium=twitter,0,1402447447306158083,,,,en,"उदयपुर, भारत",false,,0,,,"<a href=""http://instagram.com"" rel=""nofollow"">Instagram</a>",Morning sunny vibes b beautiful flowers 💐 ❤️ #yellowrose #rose #loveislove #pridemonth #morning #walking #workout #stayfit #stayblessed #stayhomestaysafe @ Udaipur - The City of Lakes https://t.co/p05Nh31vYk,https://twitter.com/martinamotwani/status/1402447447306158083,Fri Aug 13 11:11:39 +0000 2010,177910477,false,I am Martina Motwani .Explore me in #singer #Singing #artist  #music #DigitalMarketer #DigitalMarketing #FoodBlogger #freelancing,3486,2120,1623,127,"Udaipur, India",Martina Motwani,martinamotwani,35894,,http://www.martinamotwani.com,false
"85.13760358,25.55303374",Wed Jun 09 02:48:04 +0000 2021,Nifty Sipgrab UnitingPeopleWithThePossibilities,,http://Investing.com http://dlvr.it/S1Lnkj,0,1402457437156696064,,,,en,"Patna, India",false,,0,,,"<a href=""https://dlvrit.com/"" rel=""nofollow"">dlvr.it</a>",Nifty Scaled Life Time High on RBI Put and India's Progress of COVID Herd Immunity - https://t.co/nEjBBhA7G4 India https://t.co/dFC1vQoARN #Nifty #Sipgrab #UnitingPeopleWithThePossibilities,https://twitter.com/sipgrab/status/1402457437156696064,Tue Feb 28 12:12:15 +0000 2017,836549573048848384,false,Wealth management firm| Option Trading Expert | Option Strategy maker| 360° financial planner | compelete range of financial products | Market buzz updater!!,272,267,94,2,"Bengaluru, India",SipGrab,sipgrab,43338,,http://www.Sipgrab.com,false
"-76.614,39.2944",Wed Jun 09 02:10:26 +0000 2021,tttt Tuesday TellTheTruthTuesday TheTruth CoronaVirus Covid Pandemic Vaccine TheRona,,https://www.instagram.com/p/CP4dWx_Jt9L/?utm_medium=twitter,0,1402447966363918336,,,,en,"Baltimore, MD",false,,0,,,"<a href=""http://instagram.com"" rel=""nofollow"">Instagram</a>","Test Dummies
#tttt #Tuesday #TellTheTruthTuesday #TheTruth #CoronaVirus #Covid-19 #Pandemic #Vaccine #TheRona @ Baltimore, Maryland https://t.co/1LCRbN6Y3j",https://twitter.com/DugarBop/status/1402447966363918336,Thu Sep 01 05:07:12 +0000 2011,365878017,false,Same Shit Different Toilet U Know How It Is,4041,72,117,0,"Bodymore, Murdaland",D. Foote,DugarBop,6971,,,false
"77.60342187,12.9355363",Wed Jun 09 01:36:04 +0000 2021,Nifty Sipgrab UnitingPeopleWithThePossibilities,,http://dlvr.it/S1LgfW,0,1402439318044434438,,,,en,"Bengaluru South, India",false,,0,,,"<a href=""https://dlvrit.com/"" rel=""nofollow"">dlvr.it</a>",Loan defaults rise in rural India amid 2nd Covid wave https://t.co/QJAWiiw0Da #Nifty #Sipgrab #UnitingPeopleWithThePossibilities,https://twitter.com/sipgrab/status/1402439318044434438,Tue Feb 28 12:12:15 +0000 2017,836549573048848384,false,Wealth management firm| Option Trading Expert | Option Strategy maker| 360° financial planner | compelete range of financial products | Market buzz updater!!,272,267,94,2,"Bengaluru, India",SipGrab,sipgrab,43338,,http://www.Sipgrab.com,false
"-123.04986139,49.22826439",Wed Jun 09 00:04:32 +0000 2021,,,http://dlvr.it/S1LVy4,0,1402416285829406720,,,,en,"Vancouver, British Columbia",false,,1,,,"<a href=""https://dlvrit.com/"" rel=""nofollow"">dlvr.it</a>","ZHGMT —   South China Province Locks Down As Delta Covid Variant Surges: The city has cited the Delta variant of the coronavirus, first detected in India, as a driver behind the uptick in cases it has reported since the latter part of ... View article... https://t.co/r2S2JVnWe9",https://twitter.com/StigmabaseU/status/1402416285829406720,Tue Oct 26 15:04:54 +0000 2010,208056970,false,Asia — भारत  — Türkçe — Čeština — ελληνικά | Keeping up-to-date on global exclusion — Stigmabase is a canadian internet non-profit Initiative,0,2528,2405,117,WORLDWIDE,Stigmabase | UN,StigmabaseU,1606909,,https://www.stigmabase.org/,false
"72.6167,23.0333",Wed Jun 09 01:13:55 +0000 2021,,,https://www.instagram.com/p/CP4Wz2jp_M-/?utm_medium=twitter,1,1402433746935201795,,,,en,"Ahmadabad City, India",false,,0,,,"<a href=""http://instagram.com"" rel=""nofollow"">Instagram</a>","HNJ Films Is Ready To Help You In This Pandemic Situation. 

 Auditions Have Begun For The 

TV Show,Movies, Web Series &amp; Album Songs

Call &amp; What's up Using  7383646992 @ Ahmedabad, India https://t.co/8E7frjob19",https://twitter.com/HnjInfo/status/1402433746935201795,Sat Jul 01 16:02:23 +0000 2017,881181197858070529,false,,1,83,100,0,"Ahmadabad City, India",HNJ Films Entertainment,HnjInfo,123,,,false
"147.367837,-42.87485",Wed Jun 09 01:28:50 +0000 2021,vaccinationdone,,https://www.instagram.com/p/CP4YmN1na7e/?utm_medium=twitter,4,1402437500518473732,,,,en,"Hobart, Tasmania",false,,0,,,"<a href=""http://instagram.com"" rel=""nofollow"">Instagram</a>","First COVID jab done! #vaccinationdone✔️ @ Bellerive, Tasmania, Australia https://t.co/qOanLw8CkA",https://twitter.com/ElectricAdv/status/1402437500518473732,Sun Jul 10 02:12:34 +0000 2011,332576430,false,"Computer Programmer still living in the 80's, home brew developer and lover of anything retro On Youtube at https://t.co/K8xkL763J0",6355,683,842,22,Tasmania Australia,Tony Cruise,ElectricAdv,30547,,http://www.electricadventures.net,false
"77.22217788,28.63213091",Wed Jun 09 01:33:04 +0000 2021,Nifty Sipgrab UnitingPeopleWithThePossibilities,,http://dlvr.it/S1LgHX,0,1402438565062008834,,,,en,"नई दिल्ली, भारत",false,,0,,,"<a href=""https://dlvrit.com/"" rel=""nofollow"">dlvr.it</a>","Centre's Covid vaccine spend could rise to Rs 50,000 crore https://t.co/TP1DxE7zvM #Nifty #Sipgrab #UnitingPeopleWithThePossibilities",https://twitter.com/sipgrab/status/1402438565062008834,Tue Feb 28 12:12:15 +0000 2017,836549573048848384,false,Wealth management firm| Option Trading Expert | Option Strategy maker| 360° financial planner | compelete range of financial products | Market buzz updater!!,272,267,94,2,"Bengaluru, India",SipGrab,sipgrab,43338,,http://www.Sipgrab.com,false
"72.8764,19.0627",Wed Jun 09 03:45:15 +0000 2021,morningclick monsoon rain workfromhome climate beautiful mumbairains mumbai_igers oneplus6,,https://www.instagram.com/p/CP4oNbJnC49/?utm_medium=twitter,0,1402471829139124229,,,,en,"मुंबई, भारत",false,,0,,,"<a href=""http://instagram.com"" rel=""nofollow"">Instagram</a>","How is one supposed to work in this setup? 
#morningclick #monsoon #rain #workfromhome #climate #beautiful #mumbairains #mumbai_igers  #oneplus6 @ Mumbai, Maharashtra https://t.co/pywlJYDcKx",https://twitter.com/shah_mihir92/status/1402471829139124229,Tue Aug 06 18:27:44 +0000 2013,1650902268,false,Entrepreneur|| Investor || Day Trader || Dog Lover🐶 || Virgo♍,584,183,11,8,Mumbai,mihir shah,shah_mihir92,671,,,false
"-123.04986139,49.22826439",Wed Jun 09 02:10:34 +0000 2021,,,http://dlvr.it/S1Lkmk,0,1402448000387977219,,,,en,"Vancouver, British Columbia",false,,1,,,"<a href=""https://dlvrit.com/"" rel=""nofollow"">dlvr.it</a>","ZHGMT —   S. China's Guangdong imposes stricter travel restrictions; more cities to launch nucleic acid testing: South China's Guangdong province is imposing stricter travel restrictions after more COVID-19 cases were reported in several cities,… https://t.co/TBFtmFThj9",https://twitter.com/StigmabaseU/status/1402448000387977219,Tue Oct 26 15:04:54 +0000 2010,208056970,false,Asia — भारत  — Türkçe — Čeština — ελληνικά | Keeping up-to-date on global exclusion — Stigmabase is a canadian internet non-profit Initiative,0,2528,2405,117,WORLDWIDE,Stigmabase | UN,StigmabaseU,1606909,,https://www.stigmabase.org/,false
"35.145264,31.625321",Wed Jun 09 04:12:33 +0000 2021,savepalestina freepalestine savegaza mahapatih212,,https://www.instagram.com/p/CP4rVTbjw5I/?utm_medium=twitter,0,1402478699442802689,,,,en,,false,,0,,,"<a href=""http://instagram.com"" rel=""nofollow"">Instagram</a>","saat CORO menebar hoax
Covid19 is conspiracy

#savepalestina 
#freepalestine 
#savegaza 
#mahapatih212 @ Palestine https://t.co/1sujKUDBxp",https://twitter.com/aanandreans_/status/1402478699442802689,Sun Oct 11 03:12:08 +0000 2015,3854202553,false,Kita adalah Pribadi yang MENYENANGKAN bagi orang2 yg MENCINTAI KITA,1487,15,56,0,Palestine,Aan AndreanS,aanandreans_,307,,http://youtube.com/mahapatih212_official,false
"-75.4,39.92",Wed Jun 09 01:01:27 +0000 2021,Delco Covid19 LetsGo ItsNotOver DelcoPA DelawareCounty,,https://www.instagram.com/p/CP4Vdfsry7pDzWnh35CeDvGC_sxxivnBfbxFGo0/?utm_medium=twitter,0,1402430606735183872,,,,en,"Upper Providence Township, PA",false,,0,,,"<a href=""http://instagram.com"" rel=""nofollow"">Instagram</a>","This week in #Delco
#Covid19 Testing sites &amp; pop-ups!
#LetsGo we need 💯% vaccinations!
#ItsNotOver 
#DelcoPA
#DelawareCounty @ Delaware County, Pennsylvania https://t.co/i4S9xTH7Gj",https://twitter.com/duane19015/status/1402430606735183872,Wed Aug 19 16:49:44 +0000 2009,67050432,false,Father|Son|Brother|#T1D|#Blogger|#IPT1963| ⭐️ΙΦΘ🐎🏹| #Mentor,1469,1199,1946,28,"Chester, PA - Philadelphia, PA",DuaneB1963,duane19015,33517,,https://fundraising.stjude.org/site/TR?fr_id=122604&pg=team&team_id=254199,false
"103.84634446,1.28545523",Wed Jun 09 04:18:51 +0000 2021,WFH staycation,,https://www.instagram.com/p/CP4sDgSlJMR/?utm_medium=twitter,0,1402480285506224128,,,,en,"中区, 新加坡",false,,0,,,"<a href=""http://instagram.com"" rel=""nofollow"">Instagram</a>","When #WFH means work from hotel. #staycation 😎 @ PARKROYAL COLLECTION Pickering, Singapore https://t.co/P7BBqjfani",https://twitter.com/sinandservice/status/1402480285506224128,Tue Aug 05 12:43:29 +0000 2008,15735361,false,Sports. Technology. Writing.,13,259,297,19,Singapore,M. Farhan Rais,sinandservice,5344,,http://www.mfarhanrais.com,false
"77.65212771,12.8898216",Wed Jun 09 01:20:34 +0000 2021,Nifty Sipgrab UnitingPeopleWithThePossibilities,,http://dlvr.it/S1Lf3m,0,1402435420026150916,,,,en,"Bengaluru South, India",false,,0,,,"<a href=""https://dlvrit.com/"" rel=""nofollow"">dlvr.it</a>","The Tell: Tech stocks that soared during pandemic are far from played out, says $9.5 billion fund manager https://t.co/9pxSqTELXC #Nifty #Sipgrab #UnitingPeopleWithThePossibilities",https://twitter.com/sipgrab/status/1402435420026150916,Tue Feb 28 12:12:15 +0000 2017,836549573048848384,false,Wealth management firm| Option Trading Expert | Option Strategy maker| 360° financial planner | compelete range of financial products | Market buzz updater!!,272,267,94,2,"Bengaluru, India",SipGrab,sipgrab,43338,,http://www.Sipgrab.com,false
"-123.12713019,49.24963985",Wed Jun 09 02:10:35 +0000 2021,,,http://dlvr.it/S1Lkmq,0,1402448003948965888,,,,en,"Vancouver, British Columbia",false,,1,,,"<a href=""https://dlvrit.com/"" rel=""nofollow"">dlvr.it</a>",KRGMT —   North Korea's Isolation Is Deepening: North Korea is ready to make any economic sacrifices prevent COVID-19 from penetrating the country. The North Korean leadership understands that ... View article... https://t.co/prVrFJyiFC,https://twitter.com/StigmabaseU/status/1402448003948965888,Tue Oct 26 15:04:54 +0000 2010,208056970,false,Asia — भारत  — Türkçe — Čeština — ελληνικά | Keeping up-to-date on global exclusion — Stigmabase is a canadian internet non-profit Initiative,0,2528,2405,117,WORLDWIDE,Stigmabase | UN,StigmabaseU,1606909,,https://www.stigmabase.org/,false
"-77.02848481,38.99605469",Wed Jun 09 00:47:03 +0000 2021,,,http://sourceofthespring.news/S1LZvZ,0,1402426984529948675,,,,en,"Silver Spring, MD",false,,0,,,"<a href=""https://dlvrit.com/"" rel=""nofollow"">dlvr.it</a>",Events Calendar: Healing Through Art: Coping with COVID Loss (ONLINE) https://t.co/9zE0l19Ia6,https://twitter.com/SourcetheSpring/status/1402426984529948675,Fri Jul 08 20:12:30 +0000 2016,751509284362522624,false,"The latest Local and Breaking Community News for Silver Spring & Takoma Park, MD. News Tips: https://t.co/47KI8iaOkO",18215,4828,464,72,"Silver Spring, MD",Source of the Spring,SourcetheSpring,27545,,http://www.sourceofthespring.com,false
"-122.419,37.7793",Tue Jun 08 23:56:15 +0000 2021,,,https://www.instagram.com/p/CP4OACPsCCD/?utm_medium=twitter,2,1402414199326793728,,,,en,"San Francisco, CA",false,,0,,,"<a href=""http://instagram.com"" rel=""nofollow"">Instagram</a>","Airport lounges in the times of COVID sure look a lot different, but at least there’s still free drinks. @ San Francisco, California https://t.co/vyFd0iY01E",https://twitter.com/jennifer_lyn215/status/1402414199326793728,Thu Mar 20 17:50:34 +0000 2008,14185675,false,"Full time banshee, part time musician.",14948,256,717,9,"California, baby!",jenkneefurr (she/her),jennifer_lyn215,82502,,,false
"-104.80398178,38.79974365",Wed Jun 09 00:29:21 +0000 2021,,,,0,1402422530649034752,,,,en,"Colorado Springs, CO",,,0,,,"<a href=""http://127.0.0.1/testapp"" rel=""nofollow"">TMTwitService</a>","Rider Alert: Crash on Route 11. Expect delays on 11. Missed stop(s): Corona/Montrose
Corona/Cheyenne Rd [Route 11]",https://twitter.com/MountainMetro/status/1402422530649034752,Fri Nov 01 16:50:12 +0000 2013,2168750677,false,"Mountain Metro Transit offers safe, economical public transportation services in the Pikes Peak Region, including Metro Rides and Metro Mobility.",1150,1077,683,35,"Colorado Springs, CO",Mountain Metro,MountainMetro,6909,,http://mmtransit.com,false
"-113.29177319,53.55521176",Wed Jun 09 03:04:06 +0000 2021,covidarm moderna,,https://www.instagram.com/p/CP4jf9zgcCX/?utm_medium=twitter,0,1402461475608879107,,,,en,"Strathcona County, Alberta",false,,0,,,"<a href=""http://instagram.com"" rel=""nofollow"">Instagram</a>",Can you tell which arm got the vaccine? 😂 #covidarm #moderna @ Drealee Fitness + Dance https://t.co/YfyVJlesNw,https://twitter.com/_1drealee/status/1402461475608879107,Sat Oct 12 02:26:51 +0000 2013,1955482308,false,"Owner of DREALEE | Fitness + Dance, Director of Drea Lee Dance Company",208,233,295,8,"Las Vegas, LA, Edmonton",DREA LEE,_1drealee,1503,,http://www.drealee.com,false
"-71.0565,42.3577",Wed Jun 09 01:47:19 +0000 2021,wfh,,https://www.instagram.com/p/CP4atqSlEbX/?utm_medium=twitter,0,1402442150432935939,,,,en,"Boston, MA",false,,0,,,"<a href=""http://instagram.com"" rel=""nofollow"">Instagram</a>","New #wfh setup. Here for 3 more months. @ Boston, Massachusetts https://t.co/snuZtjnYb5",https://twitter.com/EmmaSerend1p1ty/status/1402442150432935939,Mon Jun 15 04:26:32 +0000 2009,47258706,false,Twitch Streamer of Educational Content / Creative Technologist / CS&EE,904,266,313,5,"Cambridge, MA","Emma Serendipity, BS in Computer Engineering Tech",EmmaSerend1p1ty,754,,http://www.twitch.tv/emmaserendipity,false
"77.60342187,12.9355363",Wed Jun 09 02:13:06 +0000 2021,Nifty Sipgrab UnitingPeopleWithThePossibilities,,http://dlvr.it/S1Lkz4,0,1402448639436357634,,,,en,"Bengaluru South, India",false,,0,,,"<a href=""https://dlvrit.com/"" rel=""nofollow"">dlvr.it</a>",Cautious cos cut loans by Rs 1.7 lakh cr amid Covid https://t.co/ie3Qf9HhjF #Nifty #Sipgrab #UnitingPeopleWithThePossibilities,https://twitter.com/sipgrab/status/1402448639436357634,Tue Feb 28 12:12:15 +0000 2017,836549573048848384,false,Wealth management firm| Option Trading Expert | Option Strategy maker| 360° financial planner | compelete range of financial products | Market buzz updater!!,272,267,94,2,"Bengaluru, India",SipGrab,sipgrab,43338,,http://www.Sipgrab.com,false
"-73.56725453,45.75975883",Wed Jun 09 02:39:38 +0000 2021,,,http://dlvr.it/S1Ln7F,0,1402455317317783557,,,,en,"Mascouche, Québec",false,,0,,,"<a href=""https://dlvrit.com/"" rel=""nofollow"">dlvr.it</a>","Fighting Stigma: Hopes for rapid recovery in Irish shops bolstered by evidence from Britain: In Ireland, the latest figures on the numbers on the pandemic unemployment payments will be eagerly awaited for signs about the the health of the ... https://t.co/NsOAg20MGH",https://twitter.com/StigmabaseN/status/1402455317317783557,Wed Sep 15 15:55:47 +0000 2010,191092262,false,Ireland — Scotland — Inuit —  Svenska  | Keeping up-to-date on global exclusion — Stigmabase is a canadian internet non-profit Initiative,0,1611,1297,110,Ireland | Scotland | Inuit | Skandinavien,Stigmabase | NORDIC,StigmabaseN,951942,,https://www.stigmabase.org/,false
"-73.56725453,45.75975883",Wed Jun 09 01:40:12 +0000 2021,,,http://dlvr.it/S1Lh3B,0,1402440360308084738,,,,en,"Mascouche, Québec",false,,0,,,"<a href=""https://dlvrit.com/"" rel=""nofollow"">dlvr.it</a>","Fighting Stigma: How close is Ireland to herd immunity?: ""It's really important to get the level of vaccination as high as is possible in the community,"" said Professor Emer Shelley, Dean of Public Health in the ... https://t.co/5SxPROq6It",https://twitter.com/StigmabaseN/status/1402440360308084738,Wed Sep 15 15:55:47 +0000 2010,191092262,false,Ireland — Scotland — Inuit —  Svenska  | Keeping up-to-date on global exclusion — Stigmabase is a canadian internet non-profit Initiative,0,1611,1297,110,Ireland | Scotland | Inuit | Skandinavien,Stigmabase | NORDIC,StigmabaseN,951942,,https://www.stigmabase.org/,false
"-0.13608912,51.50413561",Wed Jun 09 00:40:38 +0000 2021,,,http://dlvr.it/S1LZJr,0,1402425369731362819,,,,en,"London, England",false,,1,,,"<a href=""https://dlvrit.com/"" rel=""nofollow"">dlvr.it</a>","UK cuts risk 'resurgence' of Aids pandemic, MPs and campaigners warn: It is also signed by the directors of Médecins Sans Frontières, Frontline Aids, StopAids, Results UK and other leading HIV and international development ... https://t.co/91MdXAXG6P",https://twitter.com/StigmabaseO/status/1402425369731362819,Thu Apr 29 13:56:48 +0000 2010,138418838,false,Americas — United Kingdom  | Keeping up-to-date on global exclusion — Stigmabase is a canadian internet non-profit Initiative. Founded in 2010,0,4144,3743,262,Americas | United Kingdom,Stigmabase | ORG,StigmabaseO,1828446,,https://www.stigmabase.org/,false
