coordinates,created_at,hashtags,media,urls,favorite_count,id,in_reply_to_screen_name,in_reply_to_status_id,in_reply_to_user_id,lang,place,possibly_sensitive,quote_id,retweet_count,retweet_id,retweet_screen_name,source,text,tweet_url,user_created_at,user_id,user_default_profile_image,user_description,user_favourites_count,user_followers_count,user_friends_count,user_listed_count,user_location,user_name,user_screen_name,user_statuses_count,user_time_zone,user_urls,user_verified
"-0.17988195,51.562662",Tue Jun 08 07:12:00 +0000 2021,morningcommute tuesday beautiful covid19 coronavirus lockdown London,,https://www.instagram.com/p/CP2afcCFoze/?utm_medium=twitter,0,1402161472302579714,,,,en,"Camden Town, London",false,,0,,,"<a href=""http://instagram.com"" rel=""nofollow"">Instagram</a>","Beautiful Tuesday morning. How you doin’? 

#morningcommute #tuesday #beautiful #covid19 #coronavirus #lockdown #London @ Hampstead, United Kingdom https://t.co/PA2ZiOtPAS",https://twitter.com/beecee/status/1402161472302579714,Thu Apr 24 08:00:38 +0000 2008,14508711,false,A cautionary tale. Former Writer on 06:37 train to Maidstone. Award winning romcom author. Head of Storytelling at W2O. Will write for gig tickets and/or boots,25088,2909,2996,142,London/Tumblr,Brigid Coady 🌈,beecee,81608,,http://www.brigidcoady.com,false
"-1.46989346,52.91765398",Tue Jun 08 10:54:06 +0000 2021,,,https://j.mp/3zdp3Fu,0,1402217363961892875,,,,en,"Derby, England",false,,0,,,"<a href=""https://dlvrit.com/"" rel=""nofollow"">dlvr.it</a>",Covid travel restrictions: 'We took the risk of going to Portugal' https://t.co/A3r7TZdR5s,https://twitter.com/DailyDERBYS/status/1402217363961892875,Thu Jul 19 23:35:31 +0000 2012,705994686,false,"Follow for all of the latest news, sport, weather, and updates from around the county of Derbyshire (Derbys), UK",4,3063,959,50,"Derbyshire, UK",DERBYSHIRE,DailyDERBYS,88140,,https://twitter.com/dailyderbys,false
"77.64174463,12.95271294",Tue Jun 08 09:04:58 +0000 2021,vaccinated delltechnologies iwork4dell covid_19 staysafe stayhome,,https://www.instagram.com/p/CP2oAO1nc5H/?utm_medium=twitter,0,1402189899252613121,,,,en,"Bengaluru South, India",false,,0,,,"<a href=""http://instagram.com"" rel=""nofollow"">Instagram</a>",#vaccinated Thanks to #delltechnologies #iwork4dell #covid_19 #staysafe #stayhome @ Dell International Services India Private Limited https://t.co/s6QkXAEjcg,https://twitter.com/sdevank1/status/1402189899252613121,Sun Sep 13 06:13:41 +0000 2009,73828077,false,,147,83,433,0,Bangalore,Karthikeyan Devan,sdevank1,203,,,false
"-122.56977969,45.51147537",Tue Jun 08 05:31:49 +0000 2021,oakleys mask manicmonday aloha pdx,,https://www.instagram.com/p/CP2Pm-Vh4Ph/?utm_medium=twitter,0,1402136259678638087,,,,en,"Portland, OR",false,,0,,,"<a href=""http://instagram.com"" rel=""nofollow"">Instagram</a>",It is rare I get a photo these days without my #oakleys on.  For better hallway vision 😎Yes I still am required to wear #mask in the office.  #manicmonday #aloha from #pdx @ Montavilla Neighborhood https://t.co/1ABr2k8W87,https://twitter.com/Benchewan/status/1402136259678638087,Thu May 08 19:52:04 +0000 2008,14704893,false,,2638,83,145,7,,Benchewan,Benchewan,6848,,,false
"-2.26524925,53.20474628",Tue Jun 08 11:23:14 +0000 2021,,,https://www.instagram.com/p/CP230wfrkfE/?utm_medium=twitter,6,1402224695869685761,,,,en,"Macclesfield, England",false,,1,,,"<a href=""http://instagram.com"" rel=""nofollow"">Instagram</a>",What a delicious &amp; delightful time I had at @clonteropera for James Pearson’s ‘swinging out of lockdown’ show. I’m so grateful to be playing live music again and with such a killing band too! Long may it continue 🎹 🎙 🎷 🥁 https://t.co/vgNVqZTll9,https://twitter.com/EmmaSmith_Music/status/1402224695869685761,Wed Aug 23 10:32:15 +0000 2017,900304672199725056,false,"Jazz Singer 🫀Jewish-adhd-londoner 🎩 Vintage style not values., 1/3rd of The Puppini Sisters, A proud ‘Ronnie Scott’s Allstar’. Pre-order my new album here 👇",523,1255,117,3,,Emma Smith,EmmaSmith_Music,562,,https://twitter.com/settings/profile,false
"144.883,-37.85",Tue Jun 08 10:23:20 +0000 2021,,,https://www.instagram.com/p/CP2w-GqhgZv/?utm_medium=twitter,0,1402209621801066500,,,,en,"Melbourne, Victoria",false,,0,,,"<a href=""http://instagram.com"" rel=""nofollow"">Instagram</a>","Snoozes on a cold wet winters night in Melbourne lockdown #4 @ Newport, Victoria, Australia https://t.co/QizImkEJCd",https://twitter.com/Brendan2601/status/1402209621801066500,Thu Aug 20 12:00:57 +0000 2009,67295467,false,Live to ride !,12750,117,364,5,"Newport, Melbourne",Brendan Sayer,Brendan2601,1615,,,false
"-0.1758048,51.5561691",Tue Jun 08 10:50:03 +0000 2021,,https://twitter.com/fashionheaveni/status/1402216346851713029/photo/1,,0,1402216346851713029,,,,en,"Camden Town, London",false,,0,,,"<a href=""https://www.hootsuite.com"" rel=""nofollow"">Hootsuite Inc.</a>","Catch Lisa Miller on s2, ep 2 of Raw Talent podcast who brings us hope and excitement with teasers of some of the product innovations going on within the European apparel industry and the opportunities these will create as we navigate through the impact of COVID. https://t.co/5jkDLdbqzW",https://twitter.com/fashionheaveni/status/1402216346851713029,Tue Mar 23 13:29:24 +0000 2010,125658839,false,"Across the global Fashion, Home and Luxury Industries we deliver expertise in Recruitment, Brand Consulting, Coaching and Trend Intelligence.",678,974,388,99,London,Fashion Heaven Inc.,fashionheaveni,8281,,http://www.fashionheaveninc.com/podcast,false
"-73.56725453,45.75975883",Tue Jun 08 05:39:06 +0000 2021,,,http://dlvr.it/S1HK74,0,1402138094422269954,,,,en,"Mascouche, Québec",false,,0,,,"<a href=""https://dlvrit.com/"" rel=""nofollow"">dlvr.it</a>","Fighting Stigma: Covid death risk significantly higher for men, actuarial body says: ... are male, according to the analysis by the Society of Actuaries in Ireland. ... The pressure on the health service continues to ease, with the number of ... https://t.co/CX1f22jQ5l",https://twitter.com/StigmabaseN/status/1402138094422269954,Wed Sep 15 15:55:47 +0000 2010,191092262,false,Ireland — Scotland — Inuit —  Svenska  | Keeping up-to-date on global exclusion — Stigmabase is a canadian internet non-profit Initiative,0,1611,1297,110,Ireland | Scotland | Inuit | Skandinavien,Stigmabase | NORDIC,StigmabaseN,951942,,https://www.stigmabase.org/,false
"77.22217788,28.63213091",Tue Jun 08 08:45:33 +0000 2021,Nifty Sipgrab UnitingPeopleWithThePossibilities,,http://dlvr.it/S1HnHj,0,1402185014150721536,,,,en,"नई दिल्ली, भारत",false,,0,,,"<a href=""https://dlvrit.com/"" rel=""nofollow"">dlvr.it</a>",Delhi HC asks Centre to consider allowing RWAs to run COVID-19 vaccination camps with private hospitals https://t.co/hDqkh1Adlq #Nifty #Sipgrab #UnitingPeopleWithThePossibilities,https://twitter.com/sipgrab/status/1402185014150721536,Tue Feb 28 12:12:15 +0000 2017,836549573048848384,false,Wealth management firm| Option Trading Expert | Option Strategy maker| 360° financial planner | compelete range of financial products | Market buzz updater!!,272,267,94,2,"Bengaluru, India",SipGrab,sipgrab,43338,,http://www.Sipgrab.com,false
"77.22217788,28.63213091",Tue Jun 08 11:11:04 +0000 2021,Nifty Sipgrab UnitingPeopleWithThePossibilities,,http://dlvr.it/S1JCtH,0,1402221634572804096,,,,en,"नई दिल्ली, भारत",false,,0,,,"<a href=""https://dlvrit.com/"" rel=""nofollow"">dlvr.it</a>",WTO panel considers easing protections on COVID-19 vaccines https://t.co/DAdwpErfu7 #Nifty #Sipgrab #UnitingPeopleWithThePossibilities,https://twitter.com/sipgrab/status/1402221634572804096,Tue Feb 28 12:12:15 +0000 2017,836549573048848384,false,Wealth management firm| Option Trading Expert | Option Strategy maker| 360° financial planner | compelete range of financial products | Market buzz updater!!,272,267,94,2,"Bengaluru, India",SipGrab,sipgrab,43338,,http://www.Sipgrab.com,false
"-0.12485951,51.50538967",Tue Jun 08 11:11:03 +0000 2021,,,http://dlvr.it/S1JCt0,1,1402221629522911237,,,,en,"London, England",false,,1,,,"<a href=""https://dlvrit.com/"" rel=""nofollow"">dlvr.it</a>","Johnson &amp; Johnson, fourth vaccine approved by Kuwait https://t.co/RZeCy6U9NQ",https://twitter.com/BritishHeraldUK/status/1402221629522911237,Wed Feb 17 17:49:42 +0000 2010,115123902,false,Where Britain Meets the World® | The Official handle of #britishherald,344,133895,588,283,"London, United Kingdom",British Herald,BritishHeraldUK,57066,,http://www.britishherald.com,false
"17.37858529,40.53793088",Tue Jun 08 10:32:09 +0000 2021,italia europa moderna vaccine covid,,https://www.instagram.com/p/CP2x-lmlKjo/?utm_medium=twitter,0,1402211839874842625,,,,en,"Grottaglie, Puglia",false,,0,,,"<a href=""http://instagram.com"" rel=""nofollow"">Instagram</a>","Grazie #italia #europa #moderna #vaccine #covid now let’s do our best to give vaccines to everyone in the world to get to a new more responsible new normal @ Puglia, Italy https://t.co/5i3H0tI5m1",https://twitter.com/vincebelpiede/status/1402211839874842625,Mon Apr 30 11:58:19 +0000 2007,5650952,false,"🇮🇹 🇺🇸 🤓 #SaaS 

@sharedocview Get leads and analytics sharing docs via links

 @calendbook get more calendar bookings 

Lived in 10 countries 60 visited",1820,4138,4991,181,Online,Vincenzo Belpiede,vincebelpiede,20079,,https://www.vincenzobelpiede.com/,false
"100.61416626,13.80372069",Tue Jun 08 08:10:33 +0000 2021,boybietimelife covid_19 covidvacccine astrazeneca,,https://www.instagram.com/p/CP2hxryH7rC/?utm_medium=twitter,0,1402176208289284102,,,,en,"ลาดพร้าว, ประเทศไทย",false,,0,,,"<a href=""http://instagram.com"" rel=""nofollow"">Instagram</a>","Completed for first dose. 

#boybietimelife 
#covid_19 #covidvacccine #astrazeneca 

08:06:2564 @ CentralFestival EastVille https://t.co/LewxPwueEv",https://twitter.com/RhApITHy/status/1402176208289284102,Sat Apr 26 14:05:06 +0000 2008,14544925,false,"A little human who without myself. I graduated from Faculty of Law, TU and I'm a civil official (legal officer) @ Rice Department of Kingdom of Thailand.",634,202,139,5,Surin,ⓡⓗⓐⓟⓘⓣⓗⓘⓦⓐⓣⓣ,RhApITHy,11700,,http://www.facebook.com/aurora.boybie,false
"77.60032028,12.95268745",Tue Jun 08 07:59:02 +0000 2021,Nifty Sipgrab UnitingPeopleWithThePossibilities,,http://dlvr.it/S1HfVc,0,1402173309437976576,,,,en,"Bengaluru South, India",false,,0,,,"<a href=""https://dlvrit.com/"" rel=""nofollow"">dlvr.it</a>",Madras High Court orders Tamil Nadu to set uniform COVID-19 rules for carmakers https://t.co/qh3Tgc54p3 #Nifty #Sipgrab #UnitingPeopleWithThePossibilities,https://twitter.com/sipgrab/status/1402173309437976576,Tue Feb 28 12:12:15 +0000 2017,836549573048848384,false,Wealth management firm| Option Trading Expert | Option Strategy maker| 360° financial planner | compelete range of financial products | Market buzz updater!!,272,267,94,2,"Bengaluru, India",SipGrab,sipgrab,43338,,http://www.Sipgrab.com,false
"79.4167,28.35",Tue Jun 08 09:54:14 +0000 2021,beautiful bareilly stayhome trevel instapic besafe picture loveyourself love nature,,https://www.instagram.com/p/CP2tpDFlQRP/?utm_medium=twitter,0,1402202298667909121,,,,en,"बरेली, भारत",false,,0,,,"<a href=""http://instagram.com"" rel=""nofollow"">Instagram</a>","Beautiful day in Bareilly 

.

.

.
#beautiful #bareilly #stayhome #trevel #instapic #besafe #picture #loveyourself #love #nature @ Bareilly https://t.co/HkIU24W637",https://twitter.com/djajeet/status/1402202298667909121,Sun Apr 11 17:26:17 +0000 2010,131893759,false,https://t.co/XQ2AV7H2xl  https://t.co/woMyYSy1dj  Web- https://t.co/h7G1pDkpOt Email- djajeet.pbt@gmail.com More info- +9198375,51,99,18,0,"Pilbhit, India",Dj Montu,djajeet,207,,http://www.djmontu.com,false
"100.9309878,12.9366966",Tue Jun 08 06:44:04 +0000 2021,,https://twitter.com/Proactivpattaya/status/1402154440434454531/photo/1,http://dlvr.it/S1HSCn,0,1402154440434454531,,,,en,"อ.บางละมุง, จ.ชลบุรี",false,,0,,,"<a href=""https://dlvrit.com/"" rel=""nofollow"">dlvr.it</a>","Twitter Said to Seek More Time From Government to Comply With New IT Rules Due to COVID-19 Pandemic: Twitter is learnt to have approached the government seeking more time to comply with the new IT rules. According to sources, the micro-blogging site has… https://t.co/Al1wFqc4Yr https://t.co/bOxNHf0kZR",https://twitter.com/Proactivpattaya/status/1402154440434454531,Wed Mar 05 12:33:23 +0000 2014,2373691687,false,"⭐⭐⭐⭐⭐ We are a small, dedicated and hard working team of digital marketers. We are organised, friendly and passionate about what we do. #WebDesign #SEO  🇹🇭",3833,6751,6769,198,"Pattaya, Thailand",Proactive Marketing - Web Design & SEO Company,Proactivpattaya,21973,,http://proactivemarketing.solutions,false
"88.3715,22.544217",Tue Jun 08 11:13:50 +0000 2021,WeAreVaccinated COVID19,,https://www.instagram.com/p/CP22v2ht4WO/?utm_medium=twitter,0,1402222330215124992,,,,en,"कोलकाता, भारत",false,,0,,,"<a href=""http://instagram.com"" rel=""nofollow"">Instagram</a>","#WeAreVaccinated against #COVID19 @ Don Bosco School, Park Circus https://t.co/7nvnNNiU2b",https://twitter.com/SubhasisDey/status/1402222330215124992,Mon Sep 28 08:33:34 +0000 2009,77962610,false,"Created in His image, washed by His blood, used for His service.",64,160,373,0,Kolkata,Subhasis Dey,SubhasisDey,279,,http://www.facebook.com/subhasisdey,false
"101.5931,3.0642",Tue Jun 08 10:13:22 +0000 2021,,,https://www.instagram.com/p/CP2v1NCspvl/?utm_medium=twitter,0,1402207116518203393,,,,en,"Damansara, Selangor",false,,0,,,"<a href=""http://instagram.com"" rel=""nofollow"">Instagram</a>",COVID-19 UPDATES 8 June 2021. @ Subang Jaya https://t.co/G558dCle08,https://twitter.com/Jazzbebo8888/status/1402207116518203393,Thu Jan 23 11:22:53 +0000 2020,1220305808518332416,false,"FIVE RIVERS RESOURCES SDN BHD (1350952-H) MANAGING DIRECTOR
FB: Jazzmine Kaur 
PAGE: Five Rivers Resources
IG: @fiveriversresources",6466,248,4703,0,"KUALA LUMPUR, MALAYSIA",MS JAZZMINE KAUR,Jazzbebo8888,8411,,http://www.fiveriversresources.com,false
"121.06444,14.54251",Tue Jun 08 09:00:29 +0000 2021,GotVaccinated Sinovac,,https://www.instagram.com/p/CP2nfQqMQlL/?utm_medium=twitter,1,1402188774126272513,,,,en,"Pateros, Pambansang Punong Rehiyon",false,,0,,,"<a href=""http://instagram.com"" rel=""nofollow"">Instagram</a>","Join the Resistance! Let us help each other to fight for CoVid-19. Have vaccinated! 💉 Always wear Face Shield and Mask 💯👌🏻 Stay Safe and God Bless everyone! 😇 #GotVaccinated #Sinovac @ Pateros, Metro Manila, Philippines https://t.co/LjnbPrbEvw",https://twitter.com/VitoRobleSantos/status/1402188774126272513,Sat Aug 23 17:33:32 +0000 2014,2759547318,false,Spontaneous ✨ Vlogger 📸 Please do Like and Subscribe my Youtube Channel ⬇️⬇️⬇️,6873,350,215,1,#TeamBreezyManila,VITO,VitoRobleSantos,6181,,https://www.youtube.com/c/VitoRobleSantos,false
"-73.47935661,45.6677507",Tue Jun 08 07:39:05 +0000 2021,,,http://dlvr.it/S1Hbs5,0,1402168286855397377,,,,en,"Varennes, Québec",false,,0,,,"<a href=""https://dlvrit.com/"" rel=""nofollow"">dlvr.it</a>","Fighting Stigma : 2021 virtual summer camps in Ireland: Our guide to the best and most popular: Live online camps for children and teenagers are not new. They did not first appear in 2020 due to the pandemic. This summer, The Irish Times will ... https://t.co/oG506m0sNj",https://twitter.com/StigmabaseN/status/1402168286855397377,Wed Sep 15 15:55:47 +0000 2010,191092262,false,Ireland — Scotland — Inuit —  Svenska  | Keeping up-to-date on global exclusion — Stigmabase is a canadian internet non-profit Initiative,0,1611,1297,110,Ireland | Scotland | Inuit | Skandinavien,Stigmabase | NORDIC,StigmabaseN,951942,,https://www.stigmabase.org/,false
"6.841298,46.45970252",Tue Jun 08 10:42:23 +0000 2021,jemevaccine cbsbrito cbsway,,https://www.instagram.com/p/CP2zJlRhplh/?utm_medium=twitter,0,1402214418100928514,,,,en,"Vevey, Suisse",false,,0,,,"<a href=""http://instagram.com"" rel=""nofollow"">Instagram</a>",Get vaxxed kids. Not only is it the only way we’re gonna beat ‘rona’ but you can also use it as a convenient excuse for poor fitness. (and we can end Covid Twitter) #jemevaccine #cbsbrito #cbsway à Salle del Castillo https://t.co/lynuRzJ3ov,https://twitter.com/cbsbrito/status/1402214418100928514,Thu Oct 17 13:39:02 +0000 2013,1966824702,false,"JOURNALIST, ENTREPRENEUR, HISTORIAN, CAMPAIGNER. Other defining qualities 2B confirmed. MA_Historical Research_University of Roehampton @UORHumanities",870,170,197,100,Switzerland,Carlos Brito Suisse,cbsbrito,20170,,https://ch.linkedin.com/in/carlosbritosuisse,false
"77.58477235,12.9831459",Tue Jun 08 06:08:05 +0000 2021,Nifty Sipgrab UnitingPeopleWithThePossibilities,,http://dlvr.it/S1HN4V,0,1402145385766735877,,,,en,"बैंगलुरु, भारत",false,,0,,,"<a href=""https://dlvrit.com/"" rel=""nofollow"">dlvr.it</a>",Diagnostic services provider shares dip amid falling covid cases https://t.co/QJrmymGT5j #Nifty #Sipgrab #UnitingPeopleWithThePossibilities,https://twitter.com/sipgrab/status/1402145385766735877,Tue Feb 28 12:12:15 +0000 2017,836549573048848384,false,Wealth management firm| Option Trading Expert | Option Strategy maker| 360° financial planner | compelete range of financial products | Market buzz updater!!,272,267,94,2,"Bengaluru, India",SipGrab,sipgrab,43338,,http://www.Sipgrab.com,false
"77.22217788,28.63213091",Tue Jun 08 06:27:33 +0000 2021,Nifty Sipgrab UnitingPeopleWithThePossibilities,,http://dlvr.it/S1HQMt,0,1402150285431119884,,,,en,"नई दिल्ली, भारत",false,,0,,,"<a href=""https://dlvrit.com/"" rel=""nofollow"">dlvr.it</a>",Covid 19: HSS volunteers in US worked in 27 states with authorities to make vaccination drives successful https://t.co/vyRUbmWaGf #Nifty #Sipgrab #UnitingPeopleWithThePossibilities,https://twitter.com/sipgrab/status/1402150285431119884,Tue Feb 28 12:12:15 +0000 2017,836549573048848384,false,Wealth management firm| Option Trading Expert | Option Strategy maker| 360° financial planner | compelete range of financial products | Market buzz updater!!,272,267,94,2,"Bengaluru, India",SipGrab,sipgrab,43338,,http://www.Sipgrab.com,false
"83.48976,20.70638",Tue Jun 08 05:03:31 +0000 2021,vaccinationdone vaccinated ᴠᴀᴄᴄɪɴᴇssᴀᴠᴇʟɪᴠᴇs vaccinatedandhappy vaccin,,https://www.instagram.com/p/CP2MXxQFZL7/?utm_medium=twitter,0,1402129138903916545,,,,en,"बलनगिर, भारत",false,,0,,,"<a href=""http://instagram.com"" rel=""nofollow"">Instagram</a>","Im vaccinated against covid-19

#vaccinationdone✔️ #vaccinated 
#ᴠᴀᴄᴄɪɴᴇssᴀᴠᴇʟɪᴠᴇs #vaccinatedandhappy #vaccin 😊😊😊 @ Rajendra College Balangir https://t.co/pczW5p8Qlj",https://twitter.com/ajitmishra213/status/1402129138903916545,Mon Mar 18 15:47:31 +0000 2013,1278090721,false,"Facebook 👉 https://t.co/CpdVyWXVVr












Instagram 👉 https://t.co/9fkgGzKmgj",320,30,309,0,"Balangir, India",Ajit Mishra,ajitmishra213,95,,,false
"101.71216091,3.15486421",Tue Jun 08 05:48:33 +0000 2021,EmoNightKL,,https://www.instagram.com/p/CP2RheqJglF/?utm_medium=twitter,0,1402140469493219330,,,,en,"Bandar Kuala Lumpur, Wilayah Persekutuan Kuala Lumpur",false,,0,,,"<a href=""http://instagram.com"" rel=""nofollow"">Instagram</a>","I wonder when we'd be able to do this again. Kyo was definitely one of the best venues for #EmoNightKL . I wonder what's happened to it since the lockdown. 

📷@rmzairi @ Kyo KL https://t.co/AI7bjmpAwV",https://twitter.com/DarrenTeh/status/1402140469493219330,Tue May 26 01:18:52 +0000 2009,42532304,false,Vocal-izer of @ahmband | @AHMRecords | #Lokalah @rakitamy Saturdays 2pm-4pm | #PopUpStage @aforadio 8pm Thursdays | The Rockstar's Guide on @syokcast,511,1469,758,15,Kuala Lumpur,Darren AHM,DarrenTeh,18640,,http://www.facebook.com/anhonestmistake,false
"-73.56725453,45.75975883",Tue Jun 08 08:38:33 +0000 2021,,,http://dlvr.it/S1HmSP,0,1402183254145335299,,,,en,"Mascouche, Québec",false,,0,,,"<a href=""https://dlvrit.com/"" rel=""nofollow"">dlvr.it</a>","Fighting Stigma: Covid death risk in Ireland significantly higher for men than women, research finds: Covid-19 affects men in Ireland more severely than women through a ... risk-assessment guidelines for healthcare workers from the Health Service ... https://t.co/Jen9YGyEQm",https://twitter.com/StigmabaseN/status/1402183254145335299,Wed Sep 15 15:55:47 +0000 2010,191092262,false,Ireland — Scotland — Inuit —  Svenska  | Keeping up-to-date on global exclusion — Stigmabase is a canadian internet non-profit Initiative,0,1611,1297,110,Ireland | Scotland | Inuit | Skandinavien,Stigmabase | NORDIC,StigmabaseN,951942,,https://www.stigmabase.org/,false
"0.1195,51.5033",Tue Jun 08 09:00:55 +0000 2021,,,https://app.quuu.co/r/mEwvE,0,1402188882175741952,,,,en,"Eltham, London",false,,0,,,"<a href=""https://www.hootsuite.com"" rel=""nofollow"">Hootsuite Inc.</a>",Sustainable Packaging in the Time of Corona https://t.co/iZSvJA2UtD,https://twitter.com/NadunEgodage/status/1402188882175741952,Sun Apr 19 19:42:52 +0000 2009,33291730,false,"➟ Currently saying yes to new adventures⁣⁣ 🧭
• Sri Lankan 🇱🇰 • Geek • OpenSource • MusicLover • Photographer • Traveller",792,1520,1078,2,"Panadura, Sri Lanka",ℕ𝕒𝕕𝕦𝕟 𝔼𝕘𝕠𝕕𝕒𝕘𝕖,NadunEgodage,8883,,https://linktr.ee/nadunegodage,false
"101.65901988,3.11524518",Tue Jun 08 09:18:24 +0000 2021,shaffiqerwin vaccine astrazeneca covid_19,,https://www.instagram.com/p/CP2pighM8GQ/?utm_medium=twitter,1,1402193281514192897,,,,en,"Kuala Lumpur, Wilayah Persekutuan Kuala Lumpur",false,,0,,,"<a href=""http://instagram.com"" rel=""nofollow"">Instagram</a>","1st dose DONE✅
.
#shaffiqerwin #vaccine #astrazeneca #covid_19 @ Main Examination Building, University of Malaya https://t.co/YH1Xek3eeB",https://twitter.com/ShaffiqErwin/status/1402193281514192897,Sun Dec 26 07:29:17 +0000 2010,230657528,false,tempat luahan isi hati sebenar,5389,1180,80,12,Kuala Lumpur,Shaffiq Erwin,ShaffiqErwin,30797,,https://youtu.be/sqyKrZewbfk,false
"-73.56725453,45.75975883",Tue Jun 08 09:39:04 +0000 2021,,,http://dlvr.it/S1HwrN,0,1402198481935077377,,,,en,"Mascouche, Québec",false,,0,,,"<a href=""https://dlvrit.com/"" rel=""nofollow"">dlvr.it</a>","Fighting Stigma: Cost of responding to Covid in Northern Ireland tops £6.2bn, Audit Office says: Mr Donnelly said that three quarters of the total Stormont Executive spend was across three departments: £1.06 billion by the Department of Health ... https://t.co/18GDrdtCQa",https://twitter.com/StigmabaseN/status/1402198481935077377,Wed Sep 15 15:55:47 +0000 2010,191092262,false,Ireland — Scotland — Inuit —  Svenska  | Keeping up-to-date on global exclusion — Stigmabase is a canadian internet non-profit Initiative,0,1611,1297,110,Ireland | Scotland | Inuit | Skandinavien,Stigmabase | NORDIC,StigmabaseN,951942,,https://www.stigmabase.org/,false
"77.22217788,28.63213091",Tue Jun 08 08:45:35 +0000 2021,Nifty Sipgrab UnitingPeopleWithThePossibilities,,http://dlvr.it/S1HnJm,0,1402185025114689539,,,,en,"नई दिल्ली, भारत",false,,0,,,"<a href=""https://dlvrit.com/"" rel=""nofollow"">dlvr.it</a>",Why did govt use COVID-19 data as 'propaganda tool' rather than to stop virus: Priyanka Gandhi https://t.co/DhBdGRphuI #Nifty #Sipgrab #UnitingPeopleWithThePossibilities,https://twitter.com/sipgrab/status/1402185025114689539,Tue Feb 28 12:12:15 +0000 2017,836549573048848384,false,Wealth management firm| Option Trading Expert | Option Strategy maker| 360° financial planner | compelete range of financial products | Market buzz updater!!,272,267,94,2,"Bengaluru, India",SipGrab,sipgrab,43338,,http://www.Sipgrab.com,false
"-121.8865,37.3376",Tue Jun 08 04:47:32 +0000 2021,vaccine,,https://www.instagram.com/p/CP2KirzFvCu/?utm_medium=twitter,0,1402125116188811267,,,,en,"San Jose, CA",false,,0,,,"<a href=""http://instagram.com"" rel=""nofollow"">Instagram</a>","#vaccine @ Bay Area, California https://t.co/bxLVJQEjxQ",https://twitter.com/gomezchevete/status/1402125116188811267,Mon Oct 20 23:49:43 +0000 2014,2868301364,false,"Instagram: gomezchevete_
snapchat: chevete.s
youtube: gomezchevete
tiktok: chevetegomez",48,19469,28,118,"bay area,ca",silvestre gomez,gomezchevete,7373,,http://youtu.be/rgz1vfIGi1s,false
"77,21",Tue Jun 08 06:56:46 +0000 2021,helth covid_19 corona instagram ngo twitter humanity disease covid death,,https://www.instagram.com/p/CP2ZUZ9pdh4/?utm_medium=twitter,0,1402157636489994247,,,,en,"महाराष्ट्र, भारत",false,,0,,,"<a href=""http://instagram.com"" rel=""nofollow"">Instagram</a>","In This Pandemic Covid-19 2nd Wave Please Help People. They Can't Get Oxygen. Leg of oxygen they die. 
#helth #covid_19 #corona #instagram #ngo #twitter #humanity #disease #covid #death @ India https://t.co/ul3vGic6Mb",https://twitter.com/WashimGBE/status/1402157636489994247,Sun Jan 19 17:45:44 +0000 2020,1218952390465871872,false,"I❦to Upload For 🧠 Peace
🇼‌🇪‌🇱‌🇨‌🇴‌🇲‌🇪‌
✯✯✯You get here✯✯✯
°Animal photography🦁
°Extinct Animal🦥
°Nature Beauty🌳",44,3,1,0,"Goalpra,Assam,India",Washim Akram Ahmed,WashimGBE,213,,https://www.instagram.com/washim_akram_ahmed,false
