coordinates,created_at,hashtags,media,urls,favorite_count,id,in_reply_to_screen_name,in_reply_to_status_id,in_reply_to_user_id,lang,place,possibly_sensitive,quote_id,retweet_count,retweet_id,retweet_screen_name,source,text,tweet_url,user_created_at,user_id,user_default_profile_image,user_description,user_favourites_count,user_followers_count,user_friends_count,user_listed_count,user_location,user_name,user_screen_name,user_statuses_count,user_time_zone,user_urls,user_verified
"-0.10226432,51.57558519",Tue Jun 08 07:08:05 +0000 2021,,https://twitter.com/MusicNewsWeb/status/1402160484900499457/photo/1,http://Music-News.com http://dlvr.it/S1HWHR,3,1402160484900499457,,,,en,"Tottenham, London",false,,3,,,"<a href=""https://dlvrit.com/"" rel=""nofollow"">dlvr.it</a>",https://t.co/cGbkkwFHAS Jonas Blue battled COVID-19 twice during pandemic https://t.co/C3awGCxGHa https://t.co/rSeDE47SHy,https://twitter.com/MusicNewsWeb/status/1402160484900499457,Tue Mar 31 10:32:34 +0000 2009,27847155,false,"https://t.co/zDtI3JDr0v features #news, #reviews, #gigs, #interviews, #competitions, latest releases & #gossip. #musicnews https://t.co/2atsooDt52",23142,59025,43269,526,London,Music-News.com,MusicNewsWeb,126190,,https://www.facebook.com/musicnewsweb,false
"77.219672,28.631747",Tue Jun 08 07:05:21 +0000 2021,lockdown2021 lockdownlife,,https://www.instagram.com/p/CP2aUG2nX7o/?utm_medium=twitter,0,1402159798284652545,,,,en,"नई दिल्ली, भारत",false,,0,,,"<a href=""http://instagram.com"" rel=""nofollow"">Instagram</a>","When you utilise your time during lockdown as a gardener, then even your balcony turns out to be a mini garden #lockdown2021 #lockdownlife @ Delhi, India https://t.co/ZSwU5BoeUM",https://twitter.com/Anand_Journ/status/1402159798284652545,Sat Mar 05 13:51:57 +0000 2011,261213549,false,"Assistant Editor, @TheNewIndian_in, ex-@Ians_india, from the land of oldest civilisation Magadh Grandson of 1971 Indo-Pak war hero. Cover CBI, ED, NIA, Congress",38830,2163,1192,17,"New Delhi, Gaya, Bhojpur (Ara)",Anand Singh,Anand_Journ,19212,,https://muckrack.com/anand-singh-andy,true
"-0.13608912,51.50413561",Tue Jun 08 11:39:07 +0000 2021,,,http://dlvr.it/S1JJdt,0,1402228695079686147,,,,en,"London, England",false,,1,,,"<a href=""https://dlvrit.com/"" rel=""nofollow"">dlvr.it</a>","UCSF QBI and University College, London Identify Mutations in “UK” Strain of Coronavirus SARS ...: UCSF QBI and University College, London Identify Mutations in “U.K.” Strain ... advantage, as has been observed for HIV, and other pandemic viruses. https://t.co/A7MK9ynUTk",https://twitter.com/StigmabaseO/status/1402228695079686147,Thu Apr 29 13:56:48 +0000 2010,138418838,false,Americas — United Kingdom  | Keeping up-to-date on global exclusion — Stigmabase is a canadian internet non-profit Initiative. Founded in 2010,0,4144,3743,262,Americas | United Kingdom,Stigmabase | ORG,StigmabaseO,1828446,,https://www.stigmabase.org/,false
"72.6167,23.0333",Tue Jun 08 06:10:03 +0000 2021,Ahmedabad workfromhome,,https://www.instagram.com/p/CP2T_GWn3Ui/?utm_medium=twitter,0,1402145883500822528,,,,en,"Ahmadabad City, India",true,,0,,,"<a href=""http://instagram.com"" rel=""nofollow"">Instagram</a>","where ahmedabadis speaks their mind. 

thank you #Ahmedabad Mirror for covering!

#workfromhome @ Ahmedabad, India https://t.co/esKT6VhDum",https://twitter.com/kandarp/status/1402145883500822528,Thu Jan 29 21:17:37 +0000 2009,19735018,false,Founder & Director at Web & Mobile App. Development company providing services to all tech startups.,20,221,108,8,"Ahmedabad, India",Kandarp Bhatt,kandarp,291,,https://www.zealousweb.com,false
"80.22861973,12.83331645",Tue Jun 08 04:54:09 +0000 2021,,,https://www.instagram.com/p/CP2LTFbtfv5/?utm_medium=twitter,0,1402126779800764422,,,,en,"चेंगलपट्टू, भारत",false,,0,,,"<a href=""http://instagram.com"" rel=""nofollow"">Instagram</a>","The more you give and care for others it comes back in abundance, so do share and care for others at these COVID times!!🙏🙏🙏 @ SIPCOT IT Park https://t.co/hY5TenZ9le",https://twitter.com/Gaura2000/status/1402126779800764422,Fri Nov 13 11:49:39 +0000 2009,89681783,false,"Simple Guy enjoy the company of good people and friends, Love adventure a lot. Likes & RT doesn’t imply my endorsements.",473,249,177,4,"Chennai, India",Harikrishna Gaura,Gaura2000,3728,,https://twitter.com/Gaura2000,false
"77.22217788,28.63213091",Tue Jun 08 11:28:05 +0000 2021,Nifty Sipgrab UnitingPeopleWithThePossibilities,,http://dlvr.it/S1JGhx,0,1402225916659462148,,,,en,"नई दिल्ली, भारत",false,,0,,,"<a href=""https://dlvrit.com/"" rel=""nofollow"">dlvr.it</a>",Akhilesh Yadav welcomes Centre's decision to provide free Covid-19 vaccines to states https://t.co/x3kOOjZ4e7 #Nifty #Sipgrab #UnitingPeopleWithThePossibilities,https://twitter.com/sipgrab/status/1402225916659462148,Tue Feb 28 12:12:15 +0000 2017,836549573048848384,false,Wealth management firm| Option Trading Expert | Option Strategy maker| 360° financial planner | compelete range of financial products | Market buzz updater!!,272,267,94,2,"Bengaluru, India",SipGrab,sipgrab,43338,,http://www.Sipgrab.com,false
"101.71334572,3.15448737",Tue Jun 08 08:59:32 +0000 2021,Sinovac,,https://www.instagram.com/p/CP2nYarnBYx/?utm_medium=twitter,1,1402188535277539330,,,,en,"Bandar Kuala Lumpur, Wilayah Persekutuan Kuala Lumpur",false,,0,,,"<a href=""http://instagram.com"" rel=""nofollow"">Instagram</a>","I received my first dose of vaccine today...
Thank you KPJ for having me...

#Sinovac 💉 @ Kuala Lumpur Convention Centre - KLCC https://t.co/679U3nirLg",https://twitter.com/ivan_z84/status/1402188535277539330,Tue Dec 22 15:45:19 +0000 2009,98660660,false,I live my life to the fullest...!!,134,82,23,1,Petaling Jaya,Irwan Zaharuddin,ivan_z84,3205,,https://www.facebook.com/ivanz84,false
"-0.13608912,51.50413561",Tue Jun 08 08:38:09 +0000 2021,,,http://dlvr.it/S1HmNh,0,1402183154056646661,,,,en,"London, England",false,,1,,,"<a href=""https://dlvrit.com/"" rel=""nofollow"">dlvr.it</a>","One AstraZeneca Covid vaccine dose gives 80% lower death risk: English data: Four decades on, where's the HIV vaccine? More people than ever now have access to medications called antiretroviral therapy or ART, which when ... https://t.co/l3WlyqbhHp",https://twitter.com/StigmabaseO/status/1402183154056646661,Thu Apr 29 13:56:48 +0000 2010,138418838,false,Americas — United Kingdom  | Keeping up-to-date on global exclusion — Stigmabase is a canadian internet non-profit Initiative. Founded in 2010,0,4144,3743,262,Americas | United Kingdom,Stigmabase | ORG,StigmabaseO,1828446,,https://www.stigmabase.org/,false
"144.80499744,13.43389013",Tue Jun 08 06:46:08 +0000 2021,covidproblems,,https://www.instagram.com/p/CP2YHRVtdzA/?utm_medium=twitter,1,1402154961572700163,,,,en,"Mangilao, GU",false,,0,,,"<a href=""http://instagram.com"" rel=""nofollow"">Instagram</a>",Having to wait till 4 more people want the Johnson &amp; Johnson vaccine before they will open a new pack #covidproblems @ University of Guam Calvo Field House https://t.co/fDphJ9ykLU,https://twitter.com/duanemgeorge/status/1402154961572700163,Tue Aug 30 11:26:38 +0000 2011,364809461,false,Copy editor extraordinarie. Journalist. Wordsmith. Poker player. Grumpy old man. Somewhat of an asshole. Smart ass. Bitter.,527,146,46,8,Guam,The Dzer,duanemgeorge,1013,,http://instagram.com/dzerland,false
"-73.56725453,45.75975883",Tue Jun 08 10:39:05 +0000 2021,,,http://dlvr.it/S1J6FN,0,1402213584277368836,,,,en,"Mascouche, Québec",false,,0,,,"<a href=""https://dlvrit.com/"" rel=""nofollow"">dlvr.it</a>","Fighting Stigma: Covid death risk in Ireland significantly higher for men than women, research finds: The pressure on the health service continues to ease, with the number of hospitalised patients falling to 69 and ICU numbers to 26. Taoiseach Micheál ... https://t.co/KrH89bbdYh",https://twitter.com/StigmabaseN/status/1402213584277368836,Wed Sep 15 15:55:47 +0000 2010,191092262,false,Ireland — Scotland — Inuit —  Svenska  | Keeping up-to-date on global exclusion — Stigmabase is a canadian internet non-profit Initiative,0,1611,1297,110,Ireland | Scotland | Inuit | Skandinavien,Stigmabase | NORDIC,StigmabaseN,951942,,https://www.stigmabase.org/,false
"32.57186838,0.31646315",Tue Jun 08 09:33:45 +0000 2021,,,https://www.instagram.com/p/CP2rTCRLOJn/?utm_medium=twitter,0,1402197145508265984,,,,en,"Kampala, Uganda",true,,0,,,"<a href=""http://instagram.com"" rel=""nofollow"">Instagram</a>",Kip yo 😷 mask up pls at all times pls🙏 covid is real. Lets stay safe🇺🇬 @djronniedpro1 @ Djronnie Dpro https://t.co/PcWBhkkCe0,https://twitter.com/djronniedpro1/status/1402197145508265984,Fri Aug 12 12:21:47 +0000 2011,353647174,false,born and raised in Kampala Uganda. currently atop deejay in Uganda.for booking contact:+ 256 757 785 723 / lubegaronnie06@gmail.com,589,322,989,0,Uganda,djronniedpro,djronniedpro1,1705,,,false
"72.8764,19.0627",Tue Jun 08 09:12:33 +0000 2021,jk bro covid_19 vaccination firstdose,,https://www.instagram.com/p/CP2o3gEgcCd/?utm_medium=twitter,21,1402191807400796162,,,,en,"मुंबई, भारत",false,,4,,,"<a href=""http://instagram.com"" rel=""nofollow"">Instagram</a>","I’m ready for some partial hugs! 😉

#jk #bro #covid_19 
#vaccination #firstdose @ Mumbai, Maharashtra https://t.co/o7xZr8r38E",https://twitter.com/Panawasthy_31/status/1402191807400796162,Wed May 06 08:11:18 +0000 2015,3238465407,false,,8285,11356,57,23,"Mumbai, India",Pankhuri Awasthy,Panawasthy_31,3260,,,false
"120.99521601,14.4416013",Tue Jun 08 07:47:59 +0000 2021,sinovac covid19 vaccinated,,https://www.instagram.com/p/CP2fMZYliMm/?utm_medium=twitter,0,1402170527985410048,,,,en,"Lungsod ng Las Piñas, Pambansang Punong Rehiyon",false,,0,,,"<a href=""http://instagram.com"" rel=""nofollow"">Instagram</a>","I Took My BEST SHOT!💉
.
.
.
.
.
#sinovac #covid19 #vaccinated @ Las Pinas City https://t.co/PjQvqitXxw",https://twitter.com/jc_abe/status/1402170527985410048,Mon Apr 06 14:34:30 +0000 2009,29210745,false,I smile with my teeth showing 24/7. :D,906,137,228,25,Las Piñas City,jc abe,jc_abe,10422,,http://gossipkid.tumblr.com/,false
"100.53938207,13.80314935",Tue Jun 08 08:19:10 +0000 2021,vaccinationdone covidvacccine astrazeneca vaccinated covid_19,,https://www.instagram.com/p/CP2iwtanbSM/?utm_medium=twitter,0,1402178373116477444,,,,en,"จตุจักร, ประเทศไทย",false,,0,,,"<a href=""http://instagram.com"" rel=""nofollow"">Instagram</a>",1st dose done! #vaccinationdone✔️ #covidvacccine #astrazeneca 💉💉💉🦠🦠🦠 #vaccinated #covid_19 @ สถานีกลางบางซื่อ • 𝙱𝚊𝚗𝚐 𝚂𝚞𝚎 𝙶𝚛𝚊𝚗𝚍 𝚂𝚝𝚊𝚝𝚒𝚘𝚗 https://t.co/Jgh4UU6GdS,https://twitter.com/BoyBerryIam/status/1402178373116477444,Thu Jun 17 03:10:20 +0000 2010,156499181,false,,31,136,0,6,Thailand,BoyBerry Iam,BoyBerryIam,3362,,,false
"-2.3125217,53.4462851",Tue Jun 08 08:15:55 +0000 2021,,,https://www.instagram.com/p/CP2iY70h2-j/?utm_medium=twitter,0,1402177558955712514,,,,en,"Urmston, England",false,,0,,,"<a href=""http://instagram.com"" rel=""nofollow"">Instagram</a>","The post lockdown transformations are still in full swing 

Highlights and restyle for @holly_louise_7 🙌🏾😍 @ The Hair Sanctuary https://t.co/fyJHAkjdE1",https://twitter.com/ThHairSanctuary/status/1402177558955712514,Fri Feb 08 14:50:08 +0000 2013,1160383651,false,🇬🇧 Manchesters finest| Award winning experts - Weaves|Colours|Texture Release ⭐️⭐️⭐️ ⭐️ rated good salon guide,10973,620,900,82,"Manchester,UK",The Hair Sanctuary,ThHairSanctuary,8506,,http://www.thehairsanctuaryltd.com,false
"77.22217788,28.63213091",Tue Jun 08 08:09:07 +0000 2021,Nifty Sipgrab UnitingPeopleWithThePossibilities,,http://dlvr.it/S1Hh7V,0,1402175844802383873,,,,en,"नई दिल्ली, भारत",false,,0,,,"<a href=""https://dlvrit.com/"" rel=""nofollow"">dlvr.it</a>","Free vaccines, food to cost India an additional $11 billion https://t.co/N3EGcvjDtl #Nifty #Sipgrab #UnitingPeopleWithThePossibilities",https://twitter.com/sipgrab/status/1402175844802383873,Tue Feb 28 12:12:15 +0000 2017,836549573048848384,false,Wealth management firm| Option Trading Expert | Option Strategy maker| 360° financial planner | compelete range of financial products | Market buzz updater!!,272,267,94,2,"Bengaluru, India",SipGrab,sipgrab,43338,,http://www.Sipgrab.com,false
"36.81666667,-1.28333333",Tue Jun 08 11:44:55 +0000 2021,,,https://www.instagram.com/p/CP26SJvJipY/?utm_medium=twitter,0,1402230152231333891,,,,en,"Nairobi, Kenya",false,,0,,,"<a href=""http://instagram.com"" rel=""nofollow"">Instagram</a>","Okaaaaay,.... who is ready? 'COVID-19 on the flame'
🔥🔥🔥🔥 @ Nairobi https://t.co/HZEDvAYQyI",https://twitter.com/sirantonio254/status/1402230152231333891,Wed Jan 13 10:19:06 +0000 2021,1349299861322166272,false,"Ambassador, Prevention & Social Behaviour Change | Workplace Wellness Consultant | Father | Humanitarian

#10millioncondom",287,149,105,0,"Nairobi, Kenya",Sir Antonio Braizeniv,sirantonio254,501,,http://www.sirantonio.org,false
"-77.02422,38.91684",Tue Jun 08 04:48:59 +0000 2021,,,https://www.instagram.com/p/CP2KtOWLA7x/?utm_medium=twitter,0,1402125478845165573,,,,en,"Washington, DC",false,,0,,,"<a href=""http://instagram.com"" rel=""nofollow"">Instagram</a>",Caught up with Travis earlier today at Nellie’s. First time in a bar since Covid. @ Nellie's Sports Bar https://t.co/PQ2bmwMiAL,https://twitter.com/DArscorpius/status/1402125478845165573,Mon Oct 26 18:39:40 +0000 2009,85381785,false,"Custom Sportswear(Unitees), 6’9” Rebel, Artist, Graphics, Networking & Social Media (Darscorpius). Co-Founder of BRUHS DC Support Black artists & businesses",2009,1181,1650,10,"Washington, DC",DARRELL JOHNSON,DArscorpius,12772,,http://www.luvyourshirts.com,false
"0.64086,51.7993499",Tue Jun 08 09:09:58 +0000 2021,essexdentist dentistry dentalreview googlereviews happydentist,,https://www.instagram.com/p/CP2oksmJBiI/?utm_medium=twitter,0,1402191158311362562,,,,en,"Witham, East",false,,0,,,"<a href=""http://instagram.com"" rel=""nofollow"">Instagram</a>","A lovely review from a patient - it makes wearing all the extra PPE worth it! 🤗🥵😁

#essexdentist #dentistry #dentalreview #googlereviews #happydentist @ Cairn Brae Dental Practice https://t.co/cGrPtpOHzk",https://twitter.com/cairnbraedental/status/1402191158311362562,Mon Jan 21 07:27:52 +0000 2013,1108343659,false,"High-quality dental care in Witham, Essex 😁 🦷
Implants, modern cosmetic & general dentistry for the whole family 👪
01376 501688 | info@cairnbraedental.co.uk",0,36,30,0,"2 Maldon Road, Witham, CM8 2AB",Cairn Brae Dental Practice,cairnbraedental,71,,http://www.cairnbraedental.co.uk,false
"77.58477235,12.9831459",Tue Jun 08 06:30:02 +0000 2021,Nifty Sipgrab UnitingPeopleWithThePossibilities,,http://dlvr.it/S1HQfR,0,1402150911070195712,,,,en,"बैंगलुरु, भारत",false,,0,,,"<a href=""https://dlvrit.com/"" rel=""nofollow"">dlvr.it</a>","Covid propels India pharma sales in May; Glenmark, Cipla, Alkem outperform https://t.co/F0hguRmXbq #Nifty #Sipgrab #UnitingPeopleWithThePossibilities",https://twitter.com/sipgrab/status/1402150911070195712,Tue Feb 28 12:12:15 +0000 2017,836549573048848384,false,Wealth management firm| Option Trading Expert | Option Strategy maker| 360° financial planner | compelete range of financial products | Market buzz updater!!,272,267,94,2,"Bengaluru, India",SipGrab,sipgrab,43338,,http://www.Sipgrab.com,false
"77.60032028,12.95268745",Tue Jun 08 10:19:04 +0000 2021,Nifty Sipgrab UnitingPeopleWithThePossibilities,,http://dlvr.it/S1J2q5,0,1402208550047207433,,,,en,"Bengaluru South, India",false,,0,,,"<a href=""https://dlvrit.com/"" rel=""nofollow"">dlvr.it</a>",Air travel demand picks up as COVID-19 cases decline https://t.co/35G8eMx2MJ #Nifty #Sipgrab #UnitingPeopleWithThePossibilities,https://twitter.com/sipgrab/status/1402208550047207433,Tue Feb 28 12:12:15 +0000 2017,836549573048848384,false,Wealth management firm| Option Trading Expert | Option Strategy maker| 360° financial planner | compelete range of financial products | Market buzz updater!!,272,267,94,2,"Bengaluru, India",SipGrab,sipgrab,43338,,http://www.Sipgrab.com,false
"-1.15946732,50.65433016",Tue Jun 08 09:49:03 +0000 2021,,,https://j.mp/3pvKIV7,0,1402200994113490971,,,,en,"Sandown, England",false,,0,,,"<a href=""https://dlvrit.com/"" rel=""nofollow"">dlvr.it</a>",Covid jabs to be offered to Islanders aged 25 and over https://t.co/IQp303MsmD,https://twitter.com/DailyIOW/status/1402200994113490971,Mon Jul 16 17:11:22 +0000 2012,637204629,false,"All of the latest news, weather, and general updates from the Isle of Wight, UK",14,5119,866,47,"Isle of Wight, UK",ISLE OF WIGHT,DailyIOW,46550,,https://twitter.com/dailyiow,false
"77.60032028,12.95268745",Tue Jun 08 05:31:03 +0000 2021,Nifty Sipgrab UnitingPeopleWithThePossibilities,,http://dlvr.it/S1HJJV,0,1402136065859751936,,,,en,"Bengaluru South, India",false,,0,,,"<a href=""https://dlvrit.com/"" rel=""nofollow"">dlvr.it</a>",Tata Steel BSL sets up 100-bed COVID hospital in Odisha https://t.co/QFa0k9TzyU #Nifty #Sipgrab #UnitingPeopleWithThePossibilities,https://twitter.com/sipgrab/status/1402136065859751936,Tue Feb 28 12:12:15 +0000 2017,836549573048848384,false,Wealth management firm| Option Trading Expert | Option Strategy maker| 360° financial planner | compelete range of financial products | Market buzz updater!!,272,267,94,2,"Bengaluru, India",SipGrab,sipgrab,43338,,http://www.Sipgrab.com,false
"-77.02422,38.91684",Tue Jun 08 04:50:08 +0000 2021,,,https://www.instagram.com/p/CP2K1nsrXVC/?utm_medium=twitter,0,1402125768516411392,,,,en,"Washington, DC",false,,0,,,"<a href=""http://instagram.com"" rel=""nofollow"">Instagram</a>","If I drank I would’ve have a much better time but getting to hang with friends after a pandemic:
Priceless. @ Nellie's Sports Bar https://t.co/uLer1BIdAh",https://twitter.com/DArscorpius/status/1402125768516411392,Mon Oct 26 18:39:40 +0000 2009,85381785,false,"Custom Sportswear(Unitees), 6’9” Rebel, Artist, Graphics, Networking & Social Media (Darscorpius). Co-Founder of BRUHS DC Support Black artists & businesses",2009,1181,1650,10,"Washington, DC",DARRELL JOHNSON,DArscorpius,12772,,http://www.luvyourshirts.com,false
"-73.56725453,45.75975883",Tue Jun 08 09:39:05 +0000 2021,,,http://dlvr.it/S1HwtB,0,1402198484908871684,,,,en,"Mascouche, Québec",false,,0,,,"<a href=""https://dlvrit.com/"" rel=""nofollow"">dlvr.it</a>","Fighting Stigma: Irish Examiner view: Investing in a fairer society for Ireland after the pandemic: We have spent billions on the fight against this deadly virus; we should be prepared to make the same level of investment in health, housing, and ... https://t.co/TU6W7M7sOG",https://twitter.com/StigmabaseN/status/1402198484908871684,Wed Sep 15 15:55:47 +0000 2010,191092262,false,Ireland — Scotland — Inuit —  Svenska  | Keeping up-to-date on global exclusion — Stigmabase is a canadian internet non-profit Initiative,0,1611,1297,110,Ireland | Scotland | Inuit | Skandinavien,Stigmabase | NORDIC,StigmabaseN,951942,,https://www.stigmabase.org/,false
"72.82305568,18.92595353",Tue Jun 08 06:20:02 +0000 2021,,,https://www.instagram.com/p/CP2VIPUJmgt/?utm_medium=twitter,0,1402148396060790787,,,,en,"मुंबई, भारत",false,,0,,,"<a href=""http://instagram.com"" rel=""nofollow"">Instagram</a>","Thanks to Savex management, being responsible employer and steping a fight against CORONA @ Nariman Point https://t.co/HNgLPNopxN",https://twitter.com/aditya19168410/status/1402148396060790787,Tue Jan 14 07:52:20 +0000 2014,2280907030,false,I love myself,16,38,242,0,"Kalyan Dombivali, India",Aditya Ravindra Modak,aditya19168410,449,,,false
"-73.56725453,45.75975883",Tue Jun 08 05:39:08 +0000 2021,,,http://dlvr.it/S1HK9G,0,1402138099908374529,,,,en,"Mascouche, Québec",false,,0,,,"<a href=""https://dlvrit.com/"" rel=""nofollow"">dlvr.it</a>","Fighting Stigma: Northern Ireland postcodes that recorded no new coronavirus cases in the last week: ... figures released by the Department of Health on Monday, a total of 523 individuals tested positive for the virus throughout Northern Ireland from May… https://t.co/RhJsvkOU82",https://twitter.com/StigmabaseN/status/1402138099908374529,Wed Sep 15 15:55:47 +0000 2010,191092262,false,Ireland — Scotland — Inuit —  Svenska  | Keeping up-to-date on global exclusion — Stigmabase is a canadian internet non-profit Initiative,0,1611,1297,110,Ireland | Scotland | Inuit | Skandinavien,Stigmabase | NORDIC,StigmabaseN,951942,,https://www.stigmabase.org/,false
"77.22217788,28.63213091",Tue Jun 08 08:09:05 +0000 2021,Nifty Sipgrab UnitingPeopleWithThePossibilities,,http://dlvr.it/S1Hh4f,0,1402175837290385414,,,,en,"नई दिल्ली, भारत",false,,0,,,"<a href=""https://dlvrit.com/"" rel=""nofollow"">dlvr.it</a>","COVID fatality rate among docs one of the lowest in Karnataka, says state health minister https://t.co/mSdT6C28Eg #Nifty #Sipgrab #UnitingPeopleWithThePossibilities",https://twitter.com/sipgrab/status/1402175837290385414,Tue Feb 28 12:12:15 +0000 2017,836549573048848384,false,Wealth management firm| Option Trading Expert | Option Strategy maker| 360° financial planner | compelete range of financial products | Market buzz updater!!,272,267,94,2,"Bengaluru, India",SipGrab,sipgrab,43338,,http://www.Sipgrab.com,false
"-0.61128817,51.70562364",Tue Jun 08 10:43:04 +0000 2021,,,https://j.mp/2Sl2aj1,0,1402214589484310537,,,,en,"Chesham, South East",false,,0,,,"<a href=""https://dlvrit.com/"" rel=""nofollow"">dlvr.it</a>",Child viral infections increasing - parents urged to get their children a PCR Covid-19 test if unwell https://t.co/kewqqmWOQw,https://twitter.com/DailyBUCKS/status/1402214589484310537,Thu May 10 17:38:53 +0000 2012,576422672,false,"All of the latest news, sport, and updates from the county of Buckinghamshire (Bucks), UK",7,7112,1036,100,"Buckinghamshire (Bucks), UK",BUCKINGHAMSHIRE,DailyBUCKS,65513,,https://twitter.com/dailybucks,false
"-4.309626,55.852472",Tue Jun 08 04:33:13 +0000 2021,,,http://news.sky.com/story/covid-19-dating-apps-are-going-to-offer-perks-for-users-who-get-a-vaccine-12326685,0,1402121514141589509,,,,en,"Glasgow, Scotland",false,,1,,,"<a href=""http://oysttyer.github.io/oysttyer/"" rel=""nofollow"">oysttyer</a>",💾 ⓈⓀⓎ ⓉⒺⒸⒽ Dating apps are going to offer perks for users who get a coronavirus vaccine - https://t.co/zcZVYig0qG,https://twitter.com/_cirrus_minor_/status/1402121514141589509,Sat Sep 12 16:02:12 +0000 2009,73672052,false,"Most days  i'm a bot who resides in a Raspberry Pi Model B, cron  and #!/bin/bash are my best pals. Every other Saturday i  frequent the Penny Arcade. #watp",586,943,1325,175,"46.869100,103.848242",OnFileNotWanted,_cirrus_minor_,400302,,http://cirrusuk.wordpress.com,false
"76.9667,11",Tue Jun 08 11:29:28 +0000 2021,,,https://simplicity.in/coimbatore/english/health/3199/COVID-19-2564-new-cases-and-26-deaths-reported-in-Coimbatore-District-today https://www.instagram.com/p/CP24ieJsBG1/?utm_medium=twitter,1,1402226266363731969,,,,en,"कोयम्बटूर, भारत",false,,0,,,"<a href=""http://instagram.com"" rel=""nofollow"">Instagram</a>","COVID-19: 2,564 new cases and 26 deaths reported in Coimbatore District, today

https://t.co/QPq4W46ATN https://t.co/HKMfleDZOP",https://twitter.com/simplicitycbe/status/1402226266363731969,Wed Jul 27 08:39:00 +0000 2016,758220129054265344,false,"Best hyperlocal news platform to Explore News, Events, Sports, Govt. Notifications & Jobs about Coimbatore in realtime. Check our app for instant updates",628,14385,142,35,"Coimbatore, India",SimpliCityCoimbatore,simplicitycbe,79637,,https://www.simplicity.in,false
"7.6777,45.0702",Tue Jun 08 13:42:44 +0000 2021,viruscinese covid19 coronavirus ivermectina,,https://www.instagram.com/p/CP3Hyhbp5Hn/?utm_medium=twitter,0,1402259803204882441,,,,en,"Torino, Piemonte",false,,0,,,"<a href=""http://instagram.com"" rel=""nofollow"">Instagram</a>","#viruscinese #covid19 #coronavirus #ivermectina @ Turin, Italy https://t.co/IiDlK3Dol6",https://twitter.com/albertomasoero1/status/1402259803204882441,Tue Nov 27 17:11:35 +0000 2012,974279714,false,#nuovaevangelizzazione,787,69,97,2,"Torino, Piemonte",Alberto Masoero,albertomasoero1,1323,,,false
"25.12775,46.52669",Tue Jun 08 11:46:53 +0000 2021,,,https://www.instagram.com/p/CP26gzwnuM2/?utm_medium=twitter,0,1402230646823604227,,,,en,"Praid, România",false,,0,,,"<a href=""http://instagram.com"" rel=""nofollow"">Instagram</a>","Book your 'Work from Home' stay or just come and relax at The Magic Cottage and The Kicsi House, both to be found @airbnb or message Rosie by Whatsapp 00918290947633.
Airbnb link in bio 🌟
Superhost 22 times in a row 🌟 https://t.co/Snp92qYz9E",https://twitter.com/rosiesretreats/status/1402230646823604227,Wed May 25 15:24:16 +0000 2011,305054685,false,"Rosie's Retreat, Udaipur.
The Magic Cottage, Praid, Transylvania, Romania.
Airbnb Superhost 26 times in a row.",3288,2178,4958,12,India and Transylvania.,Rosie Cornwallis,rosiesretreats,14483,,http://www.udaipur-homestay.com,false
