coordinates,created_at,hashtags,media,urls,favorite_count,id,in_reply_to_screen_name,in_reply_to_status_id,in_reply_to_user_id,lang,place,possibly_sensitive,quote_id,retweet_count,retweet_id,retweet_screen_name,source,text,tweet_url,user_created_at,user_id,user_default_profile_image,user_description,user_favourites_count,user_followers_count,user_friends_count,user_listed_count,user_location,user_name,user_screen_name,user_statuses_count,user_time_zone,user_urls,user_verified
"106.6815,10.77",Tue Jul 27 06:45:54 +0000 2021,lockdown hochiminhcity directive16 covid_19,,https://www.instagram.com/p/CR0hitPidNy/?utm_medium=twitter,0,1419911908749201416,,,,en,"Hồ Chí Minh, Việt Nam",false,,0,,,"<a href=""http://instagram.com"" rel=""nofollow"">Instagram</a>","When tennis was still “allowed”.⁣
Two months ago🙃⁣
⁣
#lockdown #hochiminhcity #directive16 #covid_19 ⁣
⁣
And wow Naomi Osaka lost! No medals for her in home soil🥲 @ Ho Chi Minh City, Vietnam https://t.co/xOWK2K1aSG",https://twitter.com/shelleyMASHA/status/1419911908749201416,Mon Mar 21 03:40:55 +0000 2011,269610006,false,"🇨🇳/🇯🇵/🇨🇦 Travel/Food/Fitness/Fashion/Partying BEACH LOVER 🏖👙🏝 All I wanna do is dance! 😌 Chinese Canadian, living in Shanghai 🙈 Cuddle me up!!🙋🏼",5,36,40,3,"Shanghai, China",Shelley,shelleyMASHA,898,,,false
"-86.71624368,36.04342651",Tue Jul 27 14:39:30 +0000 2021,,,,0,1420031095744208908,,,,en,"Nashville, TN",,,0,,,"<a href=""http://tapbots.com/tweetbot"" rel=""nofollow"">Tweetbot for iΟS</a>",I still wear my mask at the grocery stores and inside places with large crowds.  Is anyone surprised the honor system didn’t work and COVID is spreading rampant again when half the country refuses to get vaxxed because they want to own the libs for Trump losing?,https://twitter.com/jamfan40/status/1420031095744208908,Sun May 08 22:58:59 +0000 2011,295390785,false,"Southern Illinois Salukis, Chicago Cubs, Chicago Bears, Chicago Bulls, Chicago Blackhawks",310,1609,3708,82,"Nashville, TN",Jeff,jamfan40,195995,,,false
"-0.12485951,51.50538967",Tue Jul 27 11:37:04 +0000 2021,,,http://dlvr.it/S4W4Nf,0,1419985183462203392,,,,en,"London, England",false,,1,,,"<a href=""https://dlvrit.com/"" rel=""nofollow"">dlvr.it</a>","COVID-19 curbs to be lifted in Australia’s Victoria, to continue in Sydney https://t.co/GnITXJ0RMS",https://twitter.com/BritishHeraldUK/status/1419985183462203392,Wed Feb 17 17:49:42 +0000 2010,115123902,false,Where Britain Meets the World® | The Official handle of #britishherald,344,133893,588,283,"London, United Kingdom",British Herald,BritishHeraldUK,57066,,http://www.britishherald.com,false
"-79.717096,43.390621",Tue Jul 27 11:49:22 +0000 2021,vinylrecords pcvrecords,,https://www.instagram.com/p/CR1FxHQlIHp/?utm_medium=twitter,1,1419988279433256962,,,,en,"Oakville, Ontario",false,,0,,,"<a href=""http://instagram.com"" rel=""nofollow"">Instagram</a>",Picked this in opened version in my record shop pre COVID.  Found it on my rush shelf.  Do I have toooooo many records? 😂.  Jazz is such a pick me up. #vinylrecords thanks #pcvrecords @ Bronte https://t.co/oVjWLv7GN2,https://twitter.com/5MinuteBI/status/1419988279433256962,Sun Oct 26 18:08:39 +0000 2014,2845528751,false,"Cloud Solution Architect (Data&AI) at Microsoft Canada Inc. Editor-In-Chief https://t.co/Mi2hS4j8L2 Tweets=my views, not the views of my employer",4246,393,982,77,Canada,Steve Young,5MinuteBI,5106,,http://5minutebi.com,false
"-2,54",Tue Jul 27 13:48:10 +0000 2021,NicsChallenge50 consultantlife one2onediet workingfromhome sharingbestpractices tribeofmentors strongertogetherchallenge peersupport connection,,https://www.instagram.com/p/CR1S1pViZG1/?utm_medium=twitter,1,1420018177010978824,,,,en,"Yorkshire and The Humber, England",false,,0,,,"<a href=""http://instagram.com"" rel=""nofollow"">Instagram</a>",#NicsChallenge50 #consultantlife #one2onediet #workingfromhome #sharingbestpractices #tribeofmentors #strongertogetherchallenge #peersupport #connection @ United Kingdom https://t.co/HDezv4fKen,https://twitter.com/one2onediet_FRs/status/1420018177010978824,Sat Jan 18 14:33:18 +0000 2014,2297995585,false,Award-winning Top 15 #One2OneDiet business. 21 yrs experience. Weight loss support (online or Face2Face). Small Biz start-up (recruiting now). #believeyoucan,143,489,276,9,United Kingdom,Believe You Can | Nic & Stu FR,one2onediet_FRs,2790,,http://Linktr.ee/NicAndStu,false
"2.15293,41.39464",Tue Jul 27 13:52:26 +0000 2021,Business fastcompany,,http://tinyurl.com/yfjdnvp4,0,1420019248420773888,,,,en,"Barcelona, España",false,,0,,,"<a href=""https://tapbots.com/tweetbot/"" rel=""nofollow"">Twitter for iPhone 12 Pro Max </a>",#Business The restaurant industry has a shortage of women leaders. But the pandemic might change that https://t.co/24Skl97ePN #fastcompany,https://twitter.com/pidybi/status/1420019248420773888,Sat Mar 30 17:25:49 +0000 2013,1316862031,false,🤷‍♂️,219,569,590,250,Poland 🌍👈,𝔓𝔦𝔬𝔱𝔯,pidybi,633666,,,false
"114.1600333,22.28114292",Tue Jul 27 10:23:31 +0000 2021,,,https://www.instagram.com/p/CR078IVLjdv/?utm_medium=twitter,0,1419966672266567688,,,,en,"中西區, 香港",false,,0,,,"<a href=""http://instagram.com"" rel=""nofollow"">Instagram</a>",Lunch mid week with nephew (fresh out of quarantine) and niece👦🏻👧🏻Then came back again for the weekend buffet😋 @ Cipriani Hong Kong https://t.co/dSZxO7rvRC,https://twitter.com/golfess/status/1419966672266567688,Fri Jul 11 17:01:51 +0000 2008,15393806,false,Trace my pictorial foodsteps as I eat my way through Hong Kong and around the world!,2,342,276,9,Hong Kong,golfess,golfess,2482,,https://instagram.com/golfess,false
"-104.98360001,39.7391",Tue Jul 27 14:09:40 +0000 2021,,,https://www.instagram.com/p/CR1V0nUL8PNS9WWa75dWf1Xu6_CqSKF9IHf-y00/?utm_medium=twitter,0,1420023588799799314,,,,en,"Denver, CO",false,,0,,,"<a href=""http://instagram.com"" rel=""nofollow"">Instagram</a>","Second Covid Summer 
🇲🇽 🏝 ✈️ ⛰👰 🏜 🇺🇸 @ Denver, Colorado https://t.co/kMOcFoSIwX",https://twitter.com/justomexicano/status/1420023588799799314,Tue Nov 24 17:27:31 +0000 2009,92319991,false,"Evolución, mano dura y oportunidades iguales para todos :). Forza Milan sempre ! ❤️🖤",5090,136,740,6,La Ciudad Blanca,Justo Fonz,justomexicano,11031,,,false
"-1.22409,52.76895",Tue Jul 27 10:16:44 +0000 2021,vaccine terrytwojabs alljabbedupandreadytogo,,https://www.instagram.com/p/CR07KytsL-Q/?utm_medium=twitter,0,1419964968510832645,,,,en,"Loughborough, England",false,,0,,,"<a href=""http://instagram.com"" rel=""nofollow"">Instagram</a>","CAPTAIN COVID, INDESTRUCTIBLE💪🏼 All jabbed up and ready to go💉🧬 #vaccine #terrytwojabs #alljabbedupandreadytogo @ Loughborough https://t.co/2R0LoVHQfk",https://twitter.com/AlexCuffy26/status/1419964968510832645,Thu Feb 05 21:55:05 +0000 2015,3020574755,false,Audio describer for Alan March sport at Leicester City home fixtures,5596,137,1204,2,Loughborough,Alex Cuthbert,AlexCuffy26,1739,,,false
"121.0328475,14.6608848",Tue Jul 27 07:56:48 +0000 2021,,,https://www.instagram.com/p/CR0rJVxHG-n3U4cu8Jop8bbYyXjJQvA6R6VbGo0/?utm_medium=twitter,0,1419929751410511874,,,,en,"Lungsod ng Quezon, Pambansang Punong Rehiyon",false,,0,,,"<a href=""http://instagram.com"" rel=""nofollow"">Instagram</a>","... Guess who got his vaccine yesterday 💉 💕 @ North Towers, Sm City North Edsa https://t.co/xlBGdkATVG",https://twitter.com/onemegabriel/status/1419929751410511874,Fri Jul 31 10:59:43 +0000 2009,61746652,false,I'll take control. because I can.,1331,42,423,0,,ross gabriel,onemegabriel,4692,,,false
"-4.309626,55.852472",Tue Jul 27 04:33:14 +0000 2021,,,http://news.sky.com/story/biontech-using-covid-jab-technology-to-develop-effective-malaria-vaccine-12364977,0,1419878523519578117,,,,en,"Glasgow, Scotland",false,,1,,,"<a href=""http://oysttyer.github.io/oysttyer/"" rel=""nofollow"">oysttyer</a>",💾 ⓈⓀⓎ ⓉⒺⒸⒽ BioNTech using COVID jab technology to develop effective malaria vaccine - https://t.co/fivpwCm535,https://twitter.com/_cirrus_minor_/status/1419878523519578117,Sat Sep 12 16:02:12 +0000 2009,73672052,false,"Most days  i'm a bot who resides in a Raspberry Pi Model B, cron  and #!/bin/bash are my best pals. Every other Saturday i  frequent the Penny Arcade. #watp",586,943,1326,175,"46.869100,103.848242",OnFileNotWanted,_cirrus_minor_,400302,,http://cirrusuk.wordpress.com,false
"-1.8443,50.7403",Tue Jul 27 06:55:37 +0000 2021,covid_19 covidvacccine ᴠᴀᴄᴄɪɴᴇssᴀᴠᴇʟɪᴠᴇs love wellbeing,,https://www.instagram.com/p/CR0kJmQsKEp/?utm_medium=twitter,0,1419914354351394838,,,,en,"Bournemouth, England",false,,0,,,"<a href=""http://instagram.com"" rel=""nofollow"">Instagram</a>","Get vaccinated.  Please 🙏❤️
.
#covid_19 #covidvacccine #ᴠᴀᴄᴄɪɴᴇssᴀᴠᴇʟɪᴠᴇs #love #wellbeing @ Queen's Park, Bournemouth https://t.co/uaJYf2NrQD",https://twitter.com/milbourn_mark/status/1419914354351394838,Tue Sep 25 22:22:09 +0000 2012,846325087,false,Sharp as a marble 🤔 I’ve climbed Everest loads of times and I invented entropy 😁🎸🎤🎹🇬🇧,16428,597,2747,4,"Bournemouth, England",Mark Milbourn,milbourn_mark,23626,,,false
"138.66463474,-34.93609673",Tue Jul 27 10:21:44 +0000 2021,,,https://www.instagram.com/p/CR07vL7MC5FAv42u0SRFZhYt7_O2BqL-GlG0w40/?utm_medium=twitter,0,1419966225187278849,,,,en,"Adelaide, South Australia",false,,0,,,"<a href=""http://instagram.com"" rel=""nofollow"">Instagram</a>",Lockdown walks to @lockwoodgeneral for coffee &amp; hot choc @ Lockwood General https://t.co/Oq0IcwQodY,https://twitter.com/James_Trimble/status/1419966225187278849,Sat Jun 05 11:01:24 +0000 2010,152212782,false,Real Estate chap in South Australia. #realestate; Adelaide via London & Sydney. Also tweets on #cricket #rugby & #Cycling 🏴󠁧󠁢󠁥󠁮󠁧󠁿in🇦🇺,9601,2380,870,64,"Adelaide, South Australia",James Trimble,James_Trimble,11446,,http://www.rh.com.au/join-us,false
"67.0762467,24.82920477",Tue Jul 27 08:38:03 +0000 2021,,,https://www.swarmapp.com/c/kfGKeoQKYN4,0,1419940132895948802,,,,en,"سندھ, پاکستان",false,,0,,,"<a href=""http://foursquare.com"" rel=""nofollow"">Foursquare</a>",Day 2 of quarantine (@ 57B - @niazcorp in Karachi) https://t.co/xpr8KRiJV7,https://twitter.com/niazicorp/status/1419940132895948802,Sun Aug 16 17:21:26 +0000 2009,66151405,false,Retweets are NOT endorsements. All views expressed here are privately held and if you don't like them go look elsewhere.,47,147,90,6,Karachi,Aamir Niazi,niazicorp,3892,,,false
"-77.5820908,35.262204",Tue Jul 27 09:13:19 +0000 2021,,,https://www.neusenews.com/index/2021/7/26/covid-19-cases-rapidly-increasing-in-unvaccinated-north-carolinians-hospitalizations-doubled-in-two-weeks,0,1419949008286531584,,,,en,"Kinston, NC",false,,0,,,"<a href=""http://www.squarespace.com"" rel=""nofollow"">Squarespace</a>",COVID-19 cases rapidly increasing in unvaccinated North Carolinians; hospitalizations doubled in two weeks  https://t.co/qLsJLgGuo0,https://twitter.com/NeuseNews/status/1419949008286531584,Tue Apr 10 03:18:40 +0000 2018,983544768285298688,false,"Hyper-local news with no pop-ups, no AP news and no online subscription fees. No kidding! Subscribe (for free) to our Neuse Newsletter delivered daily at 7 am.",375,1362,95,7,"Kinston, NC",Neuse News,NeuseNews,9228,,https://linktr.ee/neusenews,false
"145.0032,-37.8215",Tue Jul 27 11:24:51 +0000 2021,StreetArt YarraRiver socialdistancing Richmond collingwood Melbourne IloveMelbourne ziema,,https://www.instagram.com/p/CR1C9aYD044/?utm_medium=twitter,2,1419982110576807946,,,,en,"Melbourne, Victoria",false,,0,,,"<a href=""http://instagram.com"" rel=""nofollow"">Instagram</a>","#StreetArt and the #YarraRiver on today's #socialdistancing walk with @jbpooket around #Richmond and #collingwood 😎🚶 #Melbourne #IloveMelbourne #ziema @ Richmond, Victoria https://t.co/NbFRB2Bo0i",https://twitter.com/selga55/status/1419982110576807946,Fri Apr 10 05:42:16 +0000 2009,30171168,false,Long term trade union official & finance sector professional. Political and other views are my own. Calling out idiots since 2009.,11570,7569,7354,98,"iPhone: -27.480835,153.030392",Chris Barrett 🐯 🇱🇻,selga55,63156,,,false
"-4.309626,55.852472",Tue Jul 27 08:33:14 +0000 2021,,,http://news.sky.com/story/covid-19-linked-to-substantial-drop-in-intelligence-new-research-finds-12364433,0,1419938920553455620,,,,en,"Glasgow, Scotland",false,,0,,,"<a href=""http://oysttyer.github.io/oysttyer/"" rel=""nofollow"">oysttyer</a>","💾 ⓈⓀⓎ ⓉⒺⒸⒽ COVID-19 linked to 'substantial' drop in intelligence, new research finds - https://t.co/ss7a6SuqHP",https://twitter.com/_cirrus_minor_/status/1419938920553455620,Sat Sep 12 16:02:12 +0000 2009,73672052,false,"Most days  i'm a bot who resides in a Raspberry Pi Model B, cron  and #!/bin/bash are my best pals. Every other Saturday i  frequent the Penny Arcade. #watp",586,943,1326,175,"46.869100,103.848242",OnFileNotWanted,_cirrus_minor_,400302,,http://cirrusuk.wordpress.com,false
"151.20797,-33.86751",Tue Jul 27 07:13:18 +0000 2021,malatang Lockdown,,https://www.instagram.com/p/CR0mLEorfzaJKb96ZyVAwTK10wkjddRTt7MgJU0/?utm_medium=twitter,0,1419918805048963072,,,,en,"Sydney, New South Wales",false,,0,,,"<a href=""http://instagram.com"" rel=""nofollow"">Instagram</a>","Wow #malatang with no seats 😂🙈 #Lockdown @ Sydney, Australia https://t.co/jUzXQTMQns",https://twitter.com/stefssite/status/1419918805048963072,Sat Dec 08 12:24:19 +0000 2012,997073821,false,"🇦🇺🦘Sydney Web Designer & Site Improvability Engineer @siterooau 🎉 👨‍💻
📩 hi@ https://t.co/v7YfiBIWwt 👋  #AusOpen #EDM",5353,710,3575,207,"Sydney, Australia",Stefan Caliaro,stefssite,28145,,https://siteroo.design/,false
"-118.2445,34.0564",Tue Jul 27 11:43:44 +0000 2021,,,https://www.instagram.com/p/CR1FHu4BE2D/?utm_medium=twitter,0,1419986860504453131,,,,en,"Los Angeles, CA",false,,1,,,"<a href=""http://instagram.com"" rel=""nofollow"">Instagram</a>","Covid is good and father is evil.. 

@TheNotoriousMMA @ Los Angeles, California https://t.co/Dl3uTxI5JN",https://twitter.com/MMAUNCENSORED1/status/1419986860504453131,Sun Apr 26 17:52:27 +0000 2015,3208678505,false,MMA  24/7 https://t.co/Wdrjgaeviu  https://t.co/SHSIXMK12v Instagram Verified,1500,2826,715,14,"Florida, USA",MMA UNCENSORED ™️,MMAUNCENSORED1,14831,,https://linktr.ee/mmauncensored,false
"-0.60332655,54.472714",Tue Jul 27 11:39:04 +0000 2021,allaboutthelove allaboutthefamily,,https://www.instagram.com/p/CR1ElibjFhU/?utm_medium=twitter,0,1419985687068217347,,,,en,"Whitby, England",false,,0,,,"<a href=""http://instagram.com"" rel=""nofollow"">Instagram</a>","The silver lining of coming out of isolated lockdown is you get these beauties back in my world....
#allaboutthelove
#allaboutthefamily @ The Penny Hedge Pub &amp; Hotel https://t.co/hpljzIlpmv",https://twitter.com/Sanchez_SouLove/status/1419985687068217347,Thu Dec 30 21:11:07 +0000 2010,232326198,false,"Lives with the best things in life: Love, Liverpool F.C. & Soul Music. So many good ways to be bad; So many bad ways to be good. ...Keep on keepin' on...",3202,697,2215,29,Between Up North & SE London.,Peter John Holloway,Sanchez_SouLove,15475,,,false
"-122.438569,37.764425",Tue Jul 27 17:48:31 +0000 2021,,,https://www.instagram.com/p/CR1u3eXBrrzINSpvgqhhP7vCKvBtGIZXWszM-U0/?utm_medium=twitter,0,1420078661550678018,,,,en,"San Francisco, CA",false,,0,,,"<a href=""http://instagram.com"" rel=""nofollow"">Instagram</a>",Dog day afternoon @ Corona Heights https://t.co/2G8RLgnwBX,https://twitter.com/rafaeldiazmd/status/1420078661550678018,Sun Aug 08 03:49:36 +0000 2010,175958897,false,"Trauma surgeon, sybarite, vaccine enthusiast",1222,273,900,4,"San Francisco, CA",Rafael Diaz,rafaeldiazmd,443,,,false
"2.15155,41.39472",Tue Jul 27 19:50:11 +0000 2021,aljazeera COVID,,http://tinyurl.com/yjfszuaa,0,1420109282373251082,,,,en,"Barcelona, España",false,,0,,,"<a href=""https://tapbots.com/tweetbot/"" rel=""nofollow"">Twitter for iPhone 12 Pro Max </a>",#aljazeera Vaccinated should wear masks indoors in US #COVID hotspots: CDC https://t.co/ne5mOArVnY,https://twitter.com/pidybi/status/1420109282373251082,Sat Mar 30 17:25:49 +0000 2013,1316862031,false,🤷‍♂️,219,569,590,250,Poland 🌍👈,𝔓𝔦𝔬𝔱𝔯,pidybi,633666,,,false
"-0.13608912,51.50413561",Tue Jul 27 15:35:09 +0000 2021,,,http://dlvr.it/S4WqG6,0,1420045097748492289,,,,en,"London, England",false,,0,,,"<a href=""https://dlvrit.com/"" rel=""nofollow"">dlvr.it</a>","NHS Scotland accused of 'appropriating' rainbow during Covid by LGBTQ+ campaigners: And it's feared it could undermine new pride badges set to identify medical staff whom gay, lesbian, bisexual and transgender people can feel ... https://t.co/XsZ84hswLP",https://twitter.com/StigmabaseO/status/1420045097748492289,Thu Apr 29 13:56:48 +0000 2010,138418838,false,Americas — United Kingdom  | Keeping up-to-date on global exclusion — Stigmabase is a canadian internet non-profit Initiative. Founded in 2010,0,4144,3743,262,Americas | United Kingdom,Stigmabase | ORG,StigmabaseO,1828456,,https://www.stigmabase.org/,false
"-83.399749,40.949133",Tue Jul 27 18:01:58 +0000 2021,,,https://twitter.com/Neurofourier/status/1420036671706484748,1,1420082046572113934,,,,en,"Carey, OH",false,1420036671706484748,0,,,"<a href=""https://onloft.com/tweetlogix"" rel=""nofollow"">Tweetlogix</a>",So the masks were more effective than the experimental vaccine?? 🤔🤔🤔 https://t.co/vmAMtuBGRQ,https://twitter.com/Evan_Almightee/status/1420082046572113934,Sat Mar 28 17:58:39 +0000 2009,27275016,false,"Long on #Bitcoin, Long on Land 🗺 , Long on #CyberSecurity 👨🏽‍💻",10695,1314,2075,39,Decentralized ,Married to The ‘Coin 🪙 🥷🏽 ☂️,Evan_Almightee,123207,,,false
"-73.56726563,45.63697547",Tue Jul 27 18:12:11 +0000 2021,,,http://dlvr.it/S4XGZR,0,1420084617676132355,,,,en,"Montréal, Québec",false,,1,,,"<a href=""https://dlvrit.com/"" rel=""nofollow"">dlvr.it</a>",Fighting Stigma — Ways to address mental health stigma in the Asian community: Ways to address mental health stigma in the Asian community. Social worker &amp; psychotherapist Vera Cheng shares ways to overcome shame and ... https://t.co/YNcKlyGidq,https://twitter.com/stigmabase/status/1420084617676132355,Wed Sep 01 21:06:16 +0000 2010,185789961,false,Dedicated to Education | Keeping up-to-date on global exclusion — Serving the truth — Stigmabase is a canadian internet non-profit Initiative. Founded in 2010,0,962,689,71,Worldwide,STIGMABASE | EDU,stigmabase,820351,,https://www.stigmabase.org/,false
"-83.400334,40.949371",Tue Jul 27 14:58:39 +0000 2021,,,,0,1420035914747846667,,,,en,"Carey, OH",,,0,,,"<a href=""https://onloft.com/tweetlogix"" rel=""nofollow"">Tweetlogix</a>",Hanging out in Japan during the pandemic don’t seem like fun. I would be trying to come home too.,https://twitter.com/Evan_Almightee/status/1420035914747846667,Sat Mar 28 17:58:39 +0000 2009,27275016,false,"Long on #Bitcoin, Long on Land 🗺 , Long on #CyberSecurity 👨🏽‍💻",10695,1314,2075,39,Decentralized ,Married to The ‘Coin 🪙 🥷🏽 ☂️,Evan_Almightee,123207,,,false
"-80.3848,43.1955",Tue Jul 27 19:33:58 +0000 2021,reunitedwithfriends friends covid_19 dinnerwiththegirls grimsbygirls bighair curlyhair,,https://www.instagram.com/p/CR1676TnnwP/?utm_medium=twitter,2,1420105200132624387,,,,en,"Brant, Ontario",false,,0,,,"<a href=""http://instagram.com"" rel=""nofollow"">Instagram</a>","So excited to be going out with friends I haven’t seen in over a year and a half; big hair and all …….. so need my hair done

#reunitedwithfriends #friends #covid_19 #dinnerwiththegirls #grimsbygirls #bighair #curlyhair https://t.co/CiowNtIXKR",https://twitter.com/vickigergely/status/1420105200132624387,Wed Jun 13 22:59:39 +0000 2012,607625624,false,"I am a full time Realtor in Paris and surrounding areas, along with Niagara which is where I’m from.",43,157,303,1,"Paris, ON",Vicki Gergely,vickigergely,884,,http://www.Redlineproperties.ca,false
"85.3195,27.6544",Tue Jul 27 16:16:04 +0000 2021,,,https://youtu.be/ZjmTsy0upxI https://www.instagram.com/p/CR1kSjQneFJ/?utm_medium=twitter,0,1420055397365428225,,,,en,Nepal,false,,0,,,"<a href=""http://instagram.com"" rel=""nofollow"">Instagram</a>","https://t.co/NvpS3wQP8P 
👆👆👆
New video out let's enjoy the video guy's Plz Go fast and give your love and support 
It's my New series of Kathmandu Nepal after 2nd lockdown 
🙏🙏 @ Nagdaha, Dhapakhel https://t.co/qTqY3mHM9L",https://twitter.com/Shravan83891452/status/1420055397365428225,Wed Feb 07 16:00:10 +0000 2018,961268356966854656,false,"don't give your remote control in other's hand, because no one insult or hurt you without your permission. This is golden key of happiness as well of success",1891,45,133,0,"New Delhi, India",skm_backpacker,Shravan83891452,336,,https://www.youtube.com/channel/UCiFY2fVA4c8EKXJxBs1YOdQ,false
"73.68259511,24.57827693",Tue Jul 27 16:24:19 +0000 2021,,,https://www.instagram.com/p/CR1lNzTp4Wq/?utm_medium=twitter,0,1420057471167746051,,,,en,"उदयपुर, भारत",false,,0,,,"<a href=""http://instagram.com"" rel=""nofollow"">Instagram</a>","Book your relaxing staycation or 'Work from Home' stay at Rosie's Retreat Udaipur 🤗
Airbnb Superhost 23 times in a row 🥳
@airbnb @ Rosie's Retreat. Udaipur. https://t.co/j7kz5RuXrd",https://twitter.com/rosiesretreats/status/1420057471167746051,Wed May 25 15:24:16 +0000 2011,305054685,false,"Rosie's Retreat, Udaipur.
The Magic Cottage, Praid, Transylvania, Romania.
Airbnb Superhost 26 times in a row.",3288,2178,4958,12,India and Transylvania.,Rosie Cornwallis,rosiesretreats,14483,,http://www.udaipur-homestay.com,false
"25.25061399,35.31098325",Tue Jul 27 14:56:07 +0000 2021,,,https://www.instagram.com/p/CR1bIskNDNq/?utm_medium=twitter,0,1420035276534165509,,,,en,"Γούβες, Ελλάς",false,,0,,,"<a href=""http://instagram.com"" rel=""nofollow"">Instagram</a>","When the view from the waterpark is this good, you know there is little to worry about. 
If covid has some positives, it's the lack of crowds in places usually filled to the brim with tourists. https://t.co/FHF0pBLewV",https://twitter.com/WithStevie/status/1420035276534165509,Thu Jun 29 01:24:43 +0000 2017,880235549499568129,false,"Living with c-PTSD, EUPD/BPD, Depression, Anxiety, accompanied by mental and physical health issues.",72,35,134,0,"Salford, England",Living With Stevie,WithStevie,335,,https://livingwithstevie.co.uk/,false
"-96.9418,33.1579",Tue Jul 27 14:45:46 +0000 2021,workfromhome rescuedogsofinstagram,,https://www.instagram.com/p/CR1Z9CgreSdiIJnbG_1TPEXLuF-ZZZvSfZTJ-o0/?utm_medium=twitter,0,1420032673016332289,,,,en,"Little Elm, TX",false,,0,,,"<a href=""http://instagram.com"" rel=""nofollow"">Instagram</a>","USA vs. AUS 🇺🇸🇦🇺⚽️ @olympics @tokyo2020 #workfromhome #rescuedogsofinstagram @ Little Elm, Texas https://t.co/YfWAsen4XF",https://twitter.com/AmberSke11/status/1420032673016332289,Sat Oct 29 23:56:05 +0000 2011,401050508,false,LMT / Grammy Winner for Best Artist In The Shower / Weight-Lifter / https://t.co/iTRjX3DdX8 💜,253,92,155,0,"Texas, USA",Amber Bullock,AmberSke11,722,,https://www.instagram.com/amberskyebullock,false
"-76.97189039,38.92370605",Tue Jul 27 17:48:12 +0000 2021,,,https://twitter.com/mkhammer/status/1420070652023918598,1,1420078584127885315,,,,en,"Washington, DC",false,1420070652023918598,0,,,"<a href=""http://tapbots.com/tweetbot"" rel=""nofollow"">Tweetbot for iΟS</a>",Seriously. https://t.co/w3shHEfuug,https://twitter.com/Alexa_MRo/status/1420078584127885315,Sun Mar 21 18:40:57 +0000 2010,125111405,false,"Lawyer. Eppur si muove. Views are my own, not my employer's.",6250,553,3873,7,"Washington, DC",Alexandra R.,Alexa_MRo,17405,,,false
"-73.47935661,45.6677507",Tue Jul 27 17:57:05 +0000 2021,,,http://dlvr.it/S4XCtt,0,1420080818664267776,,,,en,"Varennes, Québec",false,,0,,,"<a href=""https://dlvrit.com/"" rel=""nofollow"">dlvr.it</a>","Fighting Stigma : Video: Decision on vaccines for under-18s, wedding guests and water rescue: The consent of a guardian will be required for a child to receive the shot, with ... It comes as Ireland's vaccine registration portal opened today for… https://t.co/LhmgEDOL1T",https://twitter.com/StigmabaseN/status/1420080818664267776,Wed Sep 15 15:55:47 +0000 2010,191092262,false,Ireland — Scotland — Inuit —  Svenska  | Keeping up-to-date on global exclusion — Stigmabase is a canadian internet non-profit Initiative,0,1611,1297,110,Ireland | Scotland | Inuit | Skandinavien,Stigmabase | NORDIC,StigmabaseN,951949,,https://www.stigmabase.org/,false
"-0.99609,53.21285",Tue Jul 27 15:30:05 +0000 2021,TeamDL,,https://www.instagram.com/p/CR1fBkoDMLZ/?utm_medium=twitter,0,1420043822877315073,,,,en,"Ollerton, England",false,,0,,,"<a href=""http://instagram.com"" rel=""nofollow"">Instagram</a>","I'm WEARING Masks .... EVERYWHERE I go !!! 

#TeamDL 

Reposted from @realdlhughley @ Working From Home https://t.co/nJWitVnegW",https://twitter.com/PrEciOuS_ArI/status/1420043822877315073,Sat May 02 23:43:37 +0000 2009,37311806,false,"Praise the Lord, with ALL your Heart, Mind, and Soul !!
#MeToo #VoteBlue  
#DallasCowboys #GoBigRed #NCSU #LeBronJames",5741,232,2590,0,South Carolina,Angela M. Artis,PrEciOuS_ArI,36321,,,false
