coordinates,created_at,hashtags,media,urls,favorite_count,id,in_reply_to_screen_name,in_reply_to_status_id,in_reply_to_user_id,lang,place,possibly_sensitive,quote_id,retweet_count,retweet_id,retweet_screen_name,source,text,tweet_url,user_created_at,user_id,user_default_profile_image,user_description,user_favourites_count,user_followers_count,user_friends_count,user_listed_count,user_location,user_name,user_screen_name,user_statuses_count,user_time_zone,user_urls,user_verified
"-87.6050958,41.89186335",Tue Jul 27 11:26:33 +0000 2021,,,https://bit.ly/3y3LZ9k,0,1419982535661031425,,,,en,"Chicago, IL",false,,0,,,"<a href=""https://dlvrit.com/"" rel=""nofollow"">dlvr.it</a>","Pandemic redux: No, your workers aren’t coming back to the office https://t.co/c6GU95xfe0",https://twitter.com/jaloola/status/1419982535661031425,Wed Mar 26 16:47:18 +0000 2008,14227402,false,"IT Manager in Chicago, IL at Jaloola Inc.",317,18073,21082,179,"Chicago, IL",Allen Zhu,jaloola,18570,,http://about.me/jaloola,false
"100.57854118,13.88125262",Tue Jul 27 06:43:26 +0000 2021,COVID19,,https://www.instagram.com/p/CR0iwXhht_u/?utm_medium=twitter,0,1419911289611210759,,,,en,"ตลาดบางเขน, ประเทศไทย",true,,0,,,"<a href=""http://instagram.com"" rel=""nofollow"">Instagram</a>","Dad &amp; The Sinopharm COVID-19 vaccine 
first dose. 🙏🏻💛
#COVID19 @ ราชวิทยาลัยจุฬาภรณ์ Chulabhorn Royal Academy https://t.co/4pkdf6JbUP",https://twitter.com/CHERA_SANWA/status/1419911289611210759,Tue Sep 27 05:06:27 +0000 2011,380750583,false,A #2 pencil and a dream can take you anywhere. Credit :Joyce A. Myers,1204,63,412,0,"Bangkok, Thailand",CHERA,CHERA_SANWA,6521,,,false
"46.861947,24.761335",Tue Jul 27 11:42:33 +0000 2021,,,https://www.swarmapp.com/c/eRI2tj4oPBE,0,1419986564302659587,,,,en,"الرياض, المملكة العربية السعودية",false,,0,,,"<a href=""https://www.swarmapp.com"" rel=""nofollow"">Foursquare Swarm</a>",I'm at NGHA COVID-19 Vaccination Center in Riyadh https://t.co/ReGiCC4YU2,https://twitter.com/yarasuliman55/status/1419986564302659587,Mon May 18 13:56:03 +0000 2020,1262381372431269895,false,"I’m that kind of person who keeps letters and birthday cards, tickets from trains, parks or museums.",14357,1896,511,1,Riyadh,Yara,yarasuliman55,19412,,,false
"101.69160556,3.16804444",Tue Jul 27 05:59:14 +0000 2021,AstraZenecca SimpanSiniBuatCerita Covid19 DudukRumahSepanjangTahun KerajaanGagal,,https://www.instagram.com/p/CR0dsqEDR-2DkzHDEYWgtFmFy_6M6EcTriwP140/?utm_medium=twitter,0,1419900165490724867,,,,en,"Bandar Kuala Lumpur, Wilayah Persekutuan Kuala Lumpur",false,,0,,,"<a href=""http://instagram.com"" rel=""nofollow"">Instagram</a>","Vaccinated. 2021.
1st dose 25 may.
2nd dose 27 July. 
#AstraZenecca #SimpanSiniBuatCerita #Covid19 #DudukRumahSepanjangTahun #KerajaanGagal @ Putra World Trade Centre https://t.co/oqxvY1PnLO",https://twitter.com/Ku_Luqmann/status/1419900165490724867,Fri Nov 30 17:18:19 +0000 2012,980861628,false,Don’t take life too seriously. Chill Chill Have Fun.,6471,710,604,6,"Ampang , selangor",Cik Man,Ku_Luqmann,55402,,,false
"-117.96619839,33.78998443",Tue Jul 27 10:26:48 +0000 2021,,,https://www.instagram.com/p/CR08UWqrAqK/?utm_medium=twitter,0,1419967501723742208,,,,en,"Garden Grove, CA",false,,0,,,"<a href=""http://instagram.com"" rel=""nofollow"">Instagram</a>","First day back since before the pandemic. Still very scary …because working out… is tiring. 😅 @ 24 Hour Fitness - Garden Grove, CA https://t.co/SB0eZWNmTI",https://twitter.com/uyvu/status/1419967501723742208,Thu Apr 02 18:45:51 +0000 2009,28393711,false,,7,84,0,1,"California, Anaheim",Uy Vu,uyvu,1231,,http://uyvu.com,false
"100.53938207,13.80314935",Tue Jul 27 08:26:12 +0000 2021,central vaccination center bangkok thailand readandweep reality covid19 ɢᴇᴛᴠᴀᴄᴄɪɴᴀᴛᴇᴅ,,https://www.instagram.com/p/CR0ug6uHVAx/?utm_medium=twitter,0,1419937149340819464,,,,en,"จตุจักร, ประเทศไทย",false,,0,,,"<a href=""http://instagram.com"" rel=""nofollow"">Instagram</a>",#central #vaccination #center #bangkok #thailand pumping the people through as the city finally runs out of hospital beds. The sad stories are slightly overwhelming #readandweep #reality #covid19 #ɢᴇᴛᴠᴀᴄᴄɪɴᴀᴛᴇᴅ https://t.co/0IZCyN8ZpF,https://twitter.com/martinjcowling/status/1419937149340819464,Fri Sep 18 11:31:50 +0000 2009,75257855,false,"Better, safer World is my passion. What are yours? Energy, public health, travel, faith, work, NGOs & hiking excite me. Poverty & Climate change not exciting.",221099,2947,2856,305,Global traveller,Martin J,martinjcowling,143806,,http://boardingarea.com/wildabouttravel/,false
"-4.259,55.858",Tue Jul 27 12:23:51 +0000 2021,bronan bosscat topcat diabeticcats instacat meow paws whitestripe blackandwhitecats catsofinstagram scottishcats ilovemycat catmum workingfromhome glasgowbloggers,,https://www.instagram.com/p/CR1JtilrwTx/?utm_medium=twitter,0,1419996955384635392,,,,en,"Glasgow, Scotland",false,,1,,,"<a href=""http://instagram.com"" rel=""nofollow"">Instagram</a>","Hey! Pet me! #bronan #bosscat #topcat #diabeticcats #instacat #meow #paws #whitestripe #blackandwhitecats #catsofinstagram #scottishcats #ilovemycat #catmum #workingfromhome #glasgowbloggers @ Glasgow, United Kingdom https://t.co/rop5a0FonD",https://twitter.com/wee_frumpy/status/1419996955384635392,Wed Apr 02 16:26:09 +0000 2008,14284689,false,left wing bleeding heart vegan. she/her.writer&plus size blogger.still trying to change the world. what's a girl to do? somethinginthewayshemoves.blog@gmail.com,85340,647,853,55,"glasgow,scotland",ly,wee_frumpy,76715,,http://www.somethinginthewayshemoves.wordpress.com,false
"-90.97839,31.98114",Tue Jul 27 10:54:18 +0000 2021,,,https://www.instagram.com/p/CR0_d4rsErz/?utm_medium=twitter,0,1419974422950289413,,,,en,"Mississippi, USA",false,,0,,,"<a href=""http://instagram.com"" rel=""nofollow"">Instagram</a>","Join us August 7, 2021 from 9:00 A.M. - 12:00 P.M. for FUN, FOOD, and GAMES! MASKS ARE REQUIRED! Social distancing will be practiced! @ The Parsonage https://t.co/Tz1sbEr7NL",https://twitter.com/newcomeandsee26/status/1419974422950289413,Fri Oct 24 23:51:00 +0000 2014,2843056097,false,"“Loving people, Teaching the Word, Reaching the world.”",556,74,236,0,"Port Gibson, MS",New Come and See Church,newcomeandsee26,3261,,http://www.newcomeandsee.org,false
"-96.8234539,33.1504152",Tue Jul 27 05:44:28 +0000 2021,coverings flow facemob covid_19 professionals phalonmcknight freshairclub,,https://www.instagram.com/p/CR0b-OBph-C/?utm_medium=twitter,0,1419896447575625734,,,,en,"Frisco, TX",false,,0,,,"<a href=""http://instagram.com"" rel=""nofollow"">Instagram</a>",Flow face mask #coverings #flow #facemob #covid_19 #professionals #phalonmcknight #freshairclub @ Frisco / Dallas - Texas https://t.co/GPpQUomxyZ,https://twitter.com/PHALONMCKNIGHT/status/1419896447575625734,Wed Apr 01 20:31:15 +0000 2009,28187963,false,💈The Barber Phalon Mcknight Frisco Tx 📳469.463.0347🤳 Appointments only!!!,20,355,291,5,"Frisco, TX",Phalon Mcknight,PHALONMCKNIGHT,1334,,https://www.phalonmcknight.com,false
"-5.9811754,54.5538696",Tue Jul 27 10:32:22 +0000 2021,Newry,,http://newrytimes.com/2021/07/27/ni-attitudes-to-saving-money-transformed-by-pandemic-newry-times/,0,1419968902298230790,,,,en,"Belfast, Northern Ireland",false,,0,,,"<a href=""https://www.hootsuite.com"" rel=""nofollow"">Hootsuite Inc.</a>","The COVID-19 pandemic has heralded something of a transformation in Northern Ireland’s attitude to saving money, new research suggests.

Read more &gt;&gt; https://t.co/5jTUeMnQ2u

#Newry",https://twitter.com/NewryTimes/status/1419968902298230790,Fri Nov 18 02:18:13 +0000 2011,415228549,false,Latest news in #Newry and Mourne: https://t.co/BLqm8IajQ3,269,6559,4062,51,Newry,Newry Times,NewryTimes,17293,,http://www.newrytimes.com,false
"-0.00712412,51.54278433",Tue Jul 27 08:38:07 +0000 2021,dodgerdog ᴠᴀᴄᴄɪɴᴇssᴀᴠᴇʟɪᴠᴇs,,https://www.instagram.com/p/CR0v4crFb49/?utm_medium=twitter,1,1419940151099330561,,,,en,"Stratford, London",false,,0,,,"<a href=""http://instagram.com"" rel=""nofollow"">Instagram</a>",The floors cool at the vaccine centre #dodgerdog #ᴠᴀᴄᴄɪɴᴇssᴀᴠᴇʟɪᴠᴇs @ Wagamamas Westfield Shopping Centre https://t.co/zJNcTnDeCt,https://twitter.com/i_dodger/status/1419940151099330561,Fri Mar 26 12:52:01 +0000 2021,1375430257466048518,false,Dodgers on a mission to educate & influence children to be kind to all!,100,60,104,0,"London, England",ILoveDodgerDog,i_dodger,519,,http://www.dodgerdog.co.uk,false
"151.20797,-33.86751",Tue Jul 27 04:34:16 +0000 2021,seafarers sealife,,https://www.instagram.com/p/CR0T-SwFp6w/?utm_medium=twitter,1,1419878781079023624,,,,en,"Sydney, New South Wales",false,,0,,,"<a href=""http://instagram.com"" rel=""nofollow"">Instagram</a>","115 Days without Shoreleave.
2nd Contract during Pandemic..
Bye Bye Sydney..
#seafarers #sealife @ Sydney, Australia https://t.co/um7iZDIBbt",https://twitter.com/mansoorsaeedpk/status/1419878781079023624,Wed Nov 07 16:43:01 +0000 2012,932440710,false,"Ship Captain, #MerchantNavy #Seafarer Re tweets are not endorsement.",10682,1246,2077,5,karachi,M. Mansoor Saeed,mansoorsaeedpk,19885,,,false
"-0.1094,51.5141",Tue Jul 27 04:38:06 +0000 2021,dub reggaecartoon reggae reggaecartoon sociallyglobal realdeal covid19 rwvvoiceofthevoiceless,,https://www.instagram.com/p/CR0UX9UI9fy/?utm_medium=twitter,0,1419879746620559363,,,,en,"City of London, London",false,,0,,,"<a href=""http://instagram.com"" rel=""nofollow"">Instagram</a>","#dub #reggaecartoon #reggae #reggaecartoon #sociallyglobal #realdeal #covid19 #rwvvoiceofthevoiceless @ London, United Kingdom https://t.co/k8AWYyyF8x",https://twitter.com/permissiontd/status/1419879746620559363,Wed Oct 31 07:20:38 +0000 2012,916341343,false,"Digital resetter and lover of Shaking Stevens AND Richard Madeley and much more. 

Also brain injury survivor",969,62,340,1,"London, England",permissiontd,permissiontd,413,,,false
"2.15199,41.39477",Tue Jul 27 13:34:41 +0000 2021,Japanese COVID,,http://rt.com/news/530363-pm-suga-covid-cases-rate/,0,1420014783689023492,,,,en,"Barcelona, España",false,,0,,,"<a href=""https://tapbots.com/tweetbot/"" rel=""nofollow"">Twitter for iPhone 12 Pro Max </a>",#Japanese PM Suga says record number of #COVID cases not a problem for the Olympics... https://t.co/h27hesM4NS,https://twitter.com/pidybi/status/1420014783689023492,Sat Mar 30 17:25:49 +0000 2013,1316862031,false,🤷‍♂️,219,569,590,250,Poland 🌍👈,𝔓𝔦𝔬𝔱𝔯,pidybi,633666,,,false
"-73.47935661,45.6677507",Tue Jul 27 10:54:02 +0000 2021,,,http://dlvr.it/S4Vxbf,0,1419974354432000009,,,,en,"Varennes, Québec",false,,0,,,"<a href=""https://dlvrit.com/"" rel=""nofollow"">dlvr.it</a>","Fighting Stigma : LIVE Irish news today as Met Eireann forecast thunderstorms, teen dies in tragedy and vaccine boost: He was airlifted to Children's Health Ireland at Crumlin Hospital with serious but non-life-threatening injuries. The dog, which is… https://t.co/Rtm3NhsHEa",https://twitter.com/StigmabaseN/status/1419974354432000009,Wed Sep 15 15:55:47 +0000 2010,191092262,false,Ireland — Scotland — Inuit —  Svenska  | Keeping up-to-date on global exclusion — Stigmabase is a canadian internet non-profit Initiative,0,1611,1297,110,Ireland | Scotland | Inuit | Skandinavien,Stigmabase | NORDIC,StigmabaseN,951949,,https://www.stigmabase.org/,false
"-122.41280081,37.77100926",Tue Jul 27 07:34:09 +0000 2021,,,https://www.instagram.com/p/CR0oTf2gEVe/?utm_medium=twitter,0,1419924052307812352,,,,en,"San Francisco, CA",false,,0,,,"<a href=""http://instagram.com"" rel=""nofollow"">Instagram</a>",Hooray! We’re back! Check ya out at our very first live post pandemic show @dnalounge and visit the Hot 🔥 @hubba_hubba_revue door babes @shakeygibsonsf @rasavitalia 7/26/21 @ DNA Lounge https://t.co/YD4Pj4hri3,https://twitter.com/RasaVitalia/status/1419924052307812352,Thu Jun 24 04:44:26 +0000 2010,158989486,false,Famous Award Winning Pro Hot Performing Artist Entertainer🎉❤Support! https://t.co/LBQL2PKjxN ⭐️ https://t.co/w0fBNnB9UL ⭐️ Live yr best life!,3811,1454,2730,36,,Rasa Vitalia!,RasaVitalia,15859,,http://www.RasaVitalia.com,false
"143.86222,-37.5366",Tue Jul 27 10:10:42 +0000 2021,tuesday walkies exercise isolation lockdown version5 lockdownv6,,https://www.instagram.com/p/CR06ec7rWlL/?utm_medium=twitter,0,1419963449384316929,,,,en,"Ballarat, Victoria",false,,0,,,"<a href=""http://instagram.com"" rel=""nofollow"">Instagram</a>",#tuesday #walkies last #exercise and #isolation for #lockdown #version5 hope this path doesn't end up at #lockdownv6.0 @ Ballarat Cemetery https://t.co/xANRdCNX51,https://twitter.com/daveada77/status/1419963449384316929,Mon Sep 29 13:11:09 +0000 2014,2791614701,false,,2545,68,390,38,,david,daveada77,2699,,,false
"-117.868184,33.601926",Tue Jul 27 06:24:43 +0000 2021,,,https://www.instagram.com/p/CR0gnPmsIvT/?utm_medium=twitter,0,1419906580036964383,,,,en,"Newport Beach, CA",false,,0,,,"<a href=""http://instagram.com"" rel=""nofollow"">Instagram</a>",Just posted a photo @ Corona del Mar https://t.co/3VdfDeMquZ,https://twitter.com/jasonpcorcoran/status/1419906580036964383,Fri Aug 27 01:58:20 +0000 2010,183464276,false,Daily Vibes,152,31,64,0,"Newport Beach, CA",Jason Corcoran,jasonpcorcoran,408,,,false
"-118.4026,33.8873",Tue Jul 27 05:27:36 +0000 2021,,,https://www.instagram.com/p/CR0aE7Hpvzi/?utm_medium=twitter,0,1419892206366707713,,,,en,"Manhattan Beach, CA",false,,0,,,"<a href=""http://instagram.com"" rel=""nofollow"">Instagram</a>","Facebook poster -- the Vaccinated blaming the unvaxxed for covid variant. @ Manhattan Beach, California https://t.co/aQsCiIIHTl",https://twitter.com/ALTMONEYFUND/status/1419892206366707713,Sat Aug 31 23:01:27 +0000 2013,1717002582,false,JOHN CHALEKSON --ALT MONEY FUND LP -- #Crypto #Currency/#SILVER #Hedge #Fund: https://t.co/94Ex48cCfw https://t.co/NXPVUfgbkA  tel (888) 8-HEDGE-FUND,2205,1172,4972,13,info@altmoneyfund.com,THE SILVER VIGILANTE ™️ ⭐⭐⭐⭐⭐,ALTMONEYFUND,17368,,https://www.facebook.com/realjohnchalekson,false
"151.20797,-33.86751",Tue Jul 27 10:55:56 +0000 2021,thankgodfortheknob,,https://www.instagram.com/p/CR0_pwWnFq7/?utm_medium=twitter,1,1419974833002016772,,,,en,"Sydney, New South Wales",true,,0,,,"<a href=""http://instagram.com"" rel=""nofollow"">Instagram</a>","Another 4 weeks of lockdown?! At least we have plenty of salami! 🙏🇮🇹😍 #thankgodfortheknob @ Sydney, Australia https://t.co/tkkc5S3ThB",https://twitter.com/GavinMorrisMUA/status/1419974833002016772,Tue Sep 10 02:15:20 +0000 2013,1850037840,false,📅 Keep up-to-date with GG 👑 Talent Manager & Promoter 🍝 Foodie 🍷 Wine Lover 🎟 Get tix for @sydneydragqueen events:,194,192,109,8,"Sydney, Australia",Gavin Morris,GavinMorrisMUA,2172,,https://sydneydragqueen.com.au,false
"-118.12067,33.8818399",Tue Jul 27 06:57:22 +0000 2021,,,https://www.instagram.com/p/CR0kWeMLfNwjiPI8PQVzoHXLsUlGLNy_TOdtxE0/?utm_medium=twitter,1,1419914794845589507,,,,en,"Bellflower, CA",false,,0,,,"<a href=""http://instagram.com"" rel=""nofollow"">Instagram</a>","Today was a great first day of coming back to work at Living Waters after being away from the ministry for so long during covid!
Praise God for His love and kindness! https://t.co/3kk2F8lnE1",https://twitter.com/JediNathan10/status/1419914794845589507,Sun Nov 06 23:43:35 +0000 2016,795411335148208128,false,Christian. Volunteer of @livingwaterspub. Retail trainee of @goodwillsocal. Instagram: @jedinathan007. TikTok: @jedinathan007. No DMs for money.,71166,1898,3324,14,"Eastvale, CA",Nathan Snow,JediNathan10,22140,,,false
"28.04426568,-26.17683528",Tue Jul 27 07:55:04 +0000 2021,,,http://dlvr.it/S4VRBp,0,1419929317522378754,,,,en,"Johannesburg, South Africa",false,,0,,,"<a href=""https://dlvrit.com/"" rel=""nofollow"">dlvr.it</a>","Lamu herbalists demand PPEs, training from ministry: The likes of Covid, HIV, polio and the rest have proved challenging for our members to handle as they are highly infectious. Our appeal is for the ministry ... View article... https://t.co/SKZfpEVTVY",https://twitter.com/StigmabaseO/status/1419929317522378754,Thu Apr 29 13:56:48 +0000 2010,138418838,false,Americas — United Kingdom  | Keeping up-to-date on global exclusion — Stigmabase is a canadian internet non-profit Initiative. Founded in 2010,0,4144,3743,262,Americas | United Kingdom,Stigmabase | ORG,StigmabaseO,1828455,,https://www.stigmabase.org/,false
"151.20797,-33.86751",Tue Jul 27 07:57:27 +0000 2021,,,https://www.instagram.com/p/CR0rOZ_HMM4/?utm_medium=twitter,0,1419929913377890324,,,,en,"Sydney, New South Wales",false,,0,,,"<a href=""http://instagram.com"" rel=""nofollow"">Instagram</a>",Fab Sydney based online plant store @captainmonstera specialises in beautiful potted plants 🌱 delivered straight to your door. Such a lovely way to brighten up your home or someone’s day especially during lockdown 🌿 https://t.co/wI2hkjmMmT,https://twitter.com/myfabdesign/status/1419929913377890324,Sat Feb 26 07:16:50 +0000 2011,257828174,false,interiors photography design fashion music fun sparkle,27,31,82,4,Sydney,suzanne ☆,myfabdesign,1178,,http://myfabulousdesign.net,false
"139.77,35.68",Tue Jul 27 11:57:14 +0000 2021,tokyoolympics2020 tokyo historymatters,,https://www.instagram.com/p/CR1GqmHsS1FMlMwTXu_vuFL0ZlHvJt7veMWSS40/?utm_medium=twitter,1,1419990259996168201,,,,en,東京 中央区,false,,0,,,"<a href=""http://instagram.com"" rel=""nofollow"">Instagram</a>","A night to remember.A history not to be forgotten.The precious moment amidst of covid in Tokyo.
#tokyoolympics2020 #tokyo #historymatters @ Tokyo, Japan https://t.co/DK0vVpRSnv",https://twitter.com/candyjavier26/status/1419990259996168201,Sun Sep 09 12:43:33 +0000 2012,813061447,false,"jux me.I AM WHO I AM.Just being ME. BRAGGING RIGHTS: Dont judge the book by ITS cover. #cjs A passionate photographer,live streamer,blogger",52231,829,280,183,"tokyo,japan",candyjsakai🇯🇵,candyjavier26,18601,,http://youpic.com/CandySakai,false
"-73.86164554,40.75794666",Tue Jul 27 04:55:57 +0000 2021,flowers flowers rosé flowerstagram nyc newyork_instagram,,http://www.Nyflowers.net https://www.instagram.com/p/CR0Wc-SjEDt/?utm_medium=twitter,0,1419884238195863582,,,,en,"Queens, NY",true,,0,,,"<a href=""http://instagram.com"" rel=""nofollow"">Instagram</a>","Get Same-Day Flower Delivery in Corona, New York. 107-07 Northern Blvd, Corona NY 11369, (718) 639-3222 
https://t.co/76tnjW0YNd #flowers🌸 #flowers #rosé #flowerstagram #nyc  #newyork_instagram❤️ @ New York Flowers https://t.co/Eavo37UIqP",https://twitter.com/nyflowers1/status/1419884238195863582,Wed Mar 06 01:24:38 +0000 2013,1245011851,false,"107-07 Northern Blvd, Corona NY 11369, (718) 639-3222 New York Flowers, is your real local florist serving NY, since 1994 https://t.co/QDRj9sJWIf",5,347,1484,7, 107-07 northern Blvd  ,New York Flowers,nyflowers1,11837,,http://www.nyflowers.net,false
"28.04426568,-26.17683528",Tue Jul 27 05:55:05 +0000 2021,,,http://dlvr.it/S4V9Lz,0,1419899119573688322,,,,en,"Johannesburg, South Africa",false,,1,,,"<a href=""https://dlvrit.com/"" rel=""nofollow"">dlvr.it</a>",COVID-19 weighs down Zimbabwe's TB fight:  gains from the Global Fund's efforts to fight HIV and Aids and tuberculosis ( TB) are on a downward spiral due to the COVID-19 pandemic ... View article... https://t.co/qqaGV17VK9,https://twitter.com/StigmabaseO/status/1419899119573688322,Thu Apr 29 13:56:48 +0000 2010,138418838,false,Americas — United Kingdom  | Keeping up-to-date on global exclusion — Stigmabase is a canadian internet non-profit Initiative. Founded in 2010,0,4144,3743,262,Americas | United Kingdom,Stigmabase | ORG,StigmabaseO,1828455,,https://www.stigmabase.org/,false
"120.836,15.3206",Tue Jul 27 05:50:18 +0000 2021,janssencovid19vaccine,,https://www.instagram.com/p/CR0crKNB8Or8F_49FfYW5QlpS6VGip0RgZB1q00/?utm_medium=twitter,0,1419897915645038593,,,,en,"San Antonio, Rehiyon ng Gitnang Luzon",false,,0,,,"<a href=""http://instagram.com"" rel=""nofollow"">Instagram</a>","Encouraging people to take vaccine especially persons with comorbidities like me! ❣️
I got vaccinated today! 🥰 Thank you for the strength, Lord! 🙏
#janssencovid19vaccine https://t.co/9HA876N7zl",https://twitter.com/SuperJustlean/status/1419897915645038593,Fri Jan 18 05:51:47 +0000 2013,1100128308,false,A survivor. 💪,1111,317,306,0,,J U S T,SuperJustlean,15421,,http://www.facebook.com/justlean.suarez#http://,false
"-73.56725453,45.75975883",Tue Jul 27 07:11:06 +0000 2021,,,http://dlvr.it/S4VL9l,0,1419918252650622978,,,,en,"Mascouche, Québec",false,,0,,,"<a href=""https://dlvrit.com/"" rel=""nofollow"">dlvr.it</a>","Fighting Stigma: I'd pay for a different vaccine, says ex-health minister Jim Wells: Mr Wells said he was ""surprised"" by this move and is calling for the government to allow Covaxin to be given in Northern Ireland. He said it is a wholly ... https://t.co/mOoCSNaam1",https://twitter.com/StigmabaseN/status/1419918252650622978,Wed Sep 15 15:55:47 +0000 2010,191092262,false,Ireland — Scotland — Inuit —  Svenska  | Keeping up-to-date on global exclusion — Stigmabase is a canadian internet non-profit Initiative,0,1611,1297,110,Ireland | Scotland | Inuit | Skandinavien,Stigmabase | NORDIC,StigmabaseN,951949,,https://www.stigmabase.org/,false
"-121.57053318,37.00748198",Tue Jul 27 08:17:04 +0000 2021,,https://twitter.com/1stChiroGilroy/status/1419934851436744706/photo/1,http://dlvr.it/S4VVLL,0,1419934851436744706,,,,en,"Gilroy, CA",false,,0,,,"<a href=""https://dlvrit.com/"" rel=""nofollow"">dlvr.it</a>","The burden of proof is on Big Pharma to prove that covid ""science"" is legitimate rather than fraudulent https://t.co/pFhCxkFj03 https://t.co/RnMq7xtTwD",https://twitter.com/1stChiroGilroy/status/1419934851436744706,Tue Aug 16 22:53:21 +0000 2016,765682887899226112,false,"Dr. Sam @ First Chiropractic in Gilroy, CA! 25+ Years of Back Pain Relief Expertise! Pls Call for Appts: (408) 848-6222 - 7461 Eigleberry St. Gilroy, CA 95020",8,20,42,1,"Gilroy, CA",Sam Nijmeh,1stChiroGilroy,3224,,http://FirstChiropractic.co,false
"103.32608,3.819113",Tue Jul 27 04:32:31 +0000 2021,sayasudahdivaksin teamsinovac toherdimmunity betterlatethannever covid19vacccine,,https://www.instagram.com/p/CR0TxetJoUV/?utm_medium=twitter,0,1419878341528727578,,,,en,"Kuala Kuantan, Pahang",false,,0,,,"<a href=""http://instagram.com"" rel=""nofollow"">Instagram</a>",Alhamdulillah done 1st dose of Covid19 vaccination under PIKAS 😇🤙💉🧪 #sayasudahdivaksin #teamsinovac #toherdimmunity #betterlatethannever #covid19vacccine @ Sultan Ahmad Shah International Convention Center https://t.co/nbDy7WRuhw,https://twitter.com/AfiqZaid/status/1419878341528727578,Sun Jan 10 04:30:31 +0000 2010,103478354,false,An engineer by profession. Currently living in Kuantan.,27374,254,244,13,Klang (Home) / Kuantan (Work),Afiq Zaid,AfiqZaid,31095,,http://www.facebook.com/muhammad.afiq.mohd.zaid,false
"-2.36132,51.38503",Tue Jul 27 11:05:55 +0000 2021,workbuddies catsofinstagram catlife workingfromhome,,https://www.instagram.com/p/CR1Ay9KFvkH/?utm_medium=twitter,0,1419977346552111104,,,,en,"Bath, England",false,,0,,,"<a href=""http://instagram.com"" rel=""nofollow"">Instagram</a>","When both cats decide my desk is the place to be - leave room for me!

#workbuddies #catsofinstagram #catlife #workingfromhome @ Bath, Somerset https://t.co/q9VCKK7StM",https://twitter.com/SarahDicko91/status/1419977346552111104,Tue Oct 19 10:02:02 +0000 2010,204721093,false,"Colourful, creative and ambitious marketer and Captain of Bath Rugby Ladies 2's - unleash your inner warrior!",178,128,401,5,"Bath, England",Sarah Dickinson,SarahDicko91,355,,http://sarahdickinson.tumblr.com,false
"102.25988571,2.23366237",Tue Jul 27 14:27:08 +0000 2021,vaccinationday LindungDiriLindungSemua kitajagakita herdimmunity,,https://www.instagram.com/p/CR1X0W5qFnz/?utm_medium=twitter,0,1420027982677221389,,,,en,"Batu Berendam, Melaka",false,,0,,,"<a href=""http://instagram.com"" rel=""nofollow"">Instagram</a>","All black on vaccination day 🖤
#vaccinationday #LindungDiriLindungSemua #kitajagakita #herdimmunity @ Infineon Technologies Melaka https://t.co/NzVjsmbPBc",https://twitter.com/FadhilahMn/status/1420027982677221389,Tue Nov 18 13:37:18 +0000 2008,17463896,false,There is an end to all things no matter how much we want to hold on to them • Occasionally speak at @talktalklah • ig; fadhilahmn,1208,867,382,9,Melaka,Fadhilah Mn,FadhilahMn,111193,,http://www.dillasm.com,false
"-0.17988195,51.562662",Tue Jul 27 07:39:30 +0000 2021,morningcommute olympics tired triathlon sports covid19 coronavirus London,,https://www.instagram.com/p/CR0oDSzlVTc/?utm_medium=twitter,0,1419925396607410210,,,,en,"Camden Town, London",false,,0,,,"<a href=""http://instagram.com"" rel=""nofollow"">Instagram</a>","Who else watched the women’s triathlon? Feeling tired this morning… 

#morningcommute #olympics #tired #triathlon #sports #covid19 #coronavirus #London @ Hampstead, United Kingdom https://t.co/MvEvweWbTu",https://twitter.com/beecee/status/1419925396607410210,Thu Apr 24 08:00:38 +0000 2008,14508711,false,A cautionary tale. Former Writer on 06:37 train to Maidstone. Award winning romcom author. Head of Storytelling at W2O. Will write for gig tickets and/or boots,25089,2909,2995,142,London/Tumblr,Brigid Coady 🌈,beecee,81608,,http://www.brigidcoady.com,false
