coordinates,created_at,hashtags,media,urls,favorite_count,id,in_reply_to_screen_name,in_reply_to_status_id,in_reply_to_user_id,lang,place,possibly_sensitive,quote_id,retweet_count,retweet_id,retweet_screen_name,source,text,tweet_url,user_created_at,user_id,user_default_profile_image,user_description,user_favourites_count,user_followers_count,user_friends_count,user_listed_count,user_location,user_name,user_screen_name,user_statuses_count,user_time_zone,user_urls,user_verified
"77,21",Tue Jul 27 17:00:45 +0000 2021,Delta worst world,,https://www.instagram.com/p/CR1pZ4xH_V0/?utm_medium=twitter,0,1420066642072068099,,,,en,"महाराष्ट्र, भारत",false,,0,,,"<a href=""http://instagram.com"" rel=""nofollow"">Instagram</a>","#Delta Death toll risen
#worst covid varient
#world is going to face @ India https://t.co/AH7rKOYa0P",https://twitter.com/Visionforhope1/status/1420066642072068099,Wed Dec 02 08:54:09 +0000 2020,1334058077792862211,false,"Empowering community Voices
Media/News/Digital Media.
A platform to give voice to the ones who are denied their voices & uplift  marginalized communities.",1021,302,1802,1,NewDelhi,visionforhope,Visionforhope1,4486,,https://visionforhope628652883.wordpress.com/,false
"13.1199934,52.381905",Tue Jul 27 15:22:33 +0000 2021,nowplaying FifthHarmony Wittenberge Brandenburg GER,,,0,1420041929199337474,,,,en,"Potsdam, Deutschland",,,0,,,"<a href=""http://www.bbradio.de"" rel=""nofollow"">BB RADIO Music App</a>",#nowplaying #FifthHarmony ~ Fifth Harmony | Work From Home ||| BB RADIO - In #Wittenberge #Brandenburg #GER auf 104.3,https://twitter.com/_BB_RADIO_MUSIC/status/1420041929199337474,Tue Jun 29 10:26:00 +0000 2010,160874621,false,BB RADIO is one of the leading radio stations in Berlin and Brandenburg in Germany.,2,2586,1711,176,"Germany, Potsdam",BB RADIO Playlist,_BB_RADIO_MUSIC,995611,,http://www.bbradio.de,false
"2.1546,41.3917",Tue Jul 27 17:14:21 +0000 2021,RT COVID,,http://youtube.com/watch?v=HdAE3TW0Bqs,0,1420070065790148612,,,,en,"Barcelona, España",false,,0,,,"<a href=""https://tapbots.com/tweetbot/"" rel=""nofollow"">Twitter for iPhone 12 Pro Max </a>","#RT France greenlights mandatory #COVID pass for public places, travelling https://t.co/CTjT9nrnEh",https://twitter.com/pidybi/status/1420070065790148612,Sat Mar 30 17:25:49 +0000 2013,1316862031,false,🤷‍♂️,219,569,590,250,Poland 🌍👈,𝔓𝔦𝔬𝔱𝔯,pidybi,633666,,,false
"144.9661,-37.8156",Tue Jul 27 15:33:24 +0000 2021,byst streetartmelbourne cartoon is melbournelove orca panda blm covid_19 smearcampaign awesome soyfish,,https://www.instagram.com/p/CR1faFUFRMk/?utm_medium=twitter,0,1420044660953788418,,,,en,"Melbourne, Victoria",false,,0,,,"<a href=""http://instagram.com"" rel=""nofollow"">Instagram</a>","Lockdown productivity 
#byst #streetartmelbourne #cartoon #is #melbournelove #orca #panda #blm #covid_19 #smearcampaign #awesome #soyfish @ Melbourne, Victoria, Australia https://t.co/mGMzNW76Uv",https://twitter.com/ThorntonSime/status/1420044660953788418,Fri Jan 16 03:37:44 +0000 2015,2985069895,false,"My ink is my blood....funny stuff.
also home of BYST CARTOONS #BYST",820,102,473,1,"Melbourne, Victoria",BYST Sime Thornton,ThorntonSime,2378,,,false
"-82.61138889,28.05277778",Tue Jul 27 16:05:18 +0000 2021,workingfromhome work dogs smallbusiness smallisthenewbig creative goldenretriever,,https://www.instagram.com/p/CR1jDqzs41q/?utm_medium=twitter,1,1420052688583106574,,,,en,"Westchase, FL",false,,0,,,"<a href=""http://instagram.com"" rel=""nofollow"">Instagram</a>",Sometimes we all hit delays getting to work. This one set us back about 30 minutes until the nap ran it’s course. #workingfromhome #work #dogs #smallbusiness #smallisthenewbig #creative #goldenretriever https://t.co/zRrU2RwW3M,https://twitter.com/EraserFarm/status/1420052688583106574,Tue Sep 03 21:19:39 +0000 2013,1726706677,false,"We’re a small, full service strategic, creative advertising agency, insight firm kind of thingamajig and that’s the way we like it. Instagram: eraserfarm",3875,298,369,23,"Tampa, FL",EraserFarm,EraserFarm,2321,,http://eraserfarm.com,false
"-73.56725453,45.75975883",Tue Jul 27 20:12:09 +0000 2021,,,http://dlvr.it/S4XZyH,0,1420114809593294850,,,,en,"Mascouche, Québec",false,,0,,,"<a href=""https://dlvrit.com/"" rel=""nofollow"">dlvr.it</a>","Fighting Stigma: Factbox: Latest on the worldwide spread of the coronavirus: Ireland became the latest European Union member state to commit to ... 20 million doses of vaccines to be delivered this year, Health Minister Carla ... https://t.co/UMcz9oLnZa",https://twitter.com/StigmabaseN/status/1420114809593294850,Wed Sep 15 15:55:47 +0000 2010,191092262,false,Ireland — Scotland — Inuit —  Svenska  | Keeping up-to-date on global exclusion — Stigmabase is a canadian internet non-profit Initiative,0,1611,1297,110,Ireland | Scotland | Inuit | Skandinavien,Stigmabase | NORDIC,StigmabaseN,951949,,https://www.stigmabase.org/,false
"-95.364578,29.744736",Tue Jul 27 16:39:32 +0000 2021,,,https://twitter.com/GotYaNiko/status/1420059693171552260,6,1420061303197024262,,,,en,"Houston, TX",false,1420059693171552260,10,,,"<a href=""https://onloft.com/tweetlogix"" rel=""nofollow"">Tweetlogix</a>",Why is Future included? 😂😂😂😂😂 https://t.co/NxuxoZklij,https://twitter.com/WinkWestwood/status/1420061303197024262,Sun Mar 06 01:14:54 +0000 2011,261469386,false,Content Creator • Video Producer • #VeteransForKaepernick,837,9640,6160,72,"Houston, TX",🐻+🍯=❤️,WinkWestwood,458719,,,false
"-0.55543017,51.32054552",Tue Jul 27 18:37:42 +0000 2021,,,https://www.instagram.com/p/CR10fqqqt_w/?utm_medium=twitter,8,1420091039877144576,,,,en,"Woking, South East",false,,0,,,"<a href=""http://instagram.com"" rel=""nofollow"">Instagram</a>",Power couple. 🦁 I can’t thank you enough for making 10 days of Corona isolation feel.. fun?!😂🖤 @ The Herbert Wells - Wetherspoons https://t.co/PRGE2hfBzi,https://twitter.com/dxyle/status/1420091039877144576,Sun Jan 20 23:45:21 +0000 2013,1107599149,false,• 🇮🇪🇮🇹 • leo ☼ leo ☾ leo ➚ • ENFP-T 2w3 •,41818,120329,107935,132,London,Molly Doyle ❀✿,dxyle,32671,,http://instagram.com/mooolllsss_,false
"31.047,-17.8294",Tue Jul 27 18:02:39 +0000 2021,weareonecallaway maskupzimbabwe,,https://www.instagram.com/p/CR1wez1q7dT/?utm_medium=twitter,1,1420082220069494790,,,,en,"Harare, Zimbabwe",false,,2,,,"<a href=""http://instagram.com"" rel=""nofollow"">Instagram</a>","Our job is to make sure your home, school and work space is free and safe from Covid. Get in touch with us for all your disinfection needs and services.
#weareonecallaway 
#maskupzimbabwe @ Harare, Zimbabwe https://t.co/483b1Loxs7",https://twitter.com/TersusIndustryz/status/1420082220069494790,Sun Jul 11 11:57:20 +0000 2021,1414192024153174017,false,We provide Cleaning and Sanitizing services to ensure a virus free and bio secure environment within the home and work space.,22,37,194,0,,Tersus Industries (Pvt Ltd),TersusIndustryz,28,,,false
"-117.868184,33.601926",Tue Jul 27 15:57:04 +0000 2021,,,https://www.instagram.com/p/CR1iHP6saPH/?utm_medium=twitter,0,1420050616232161283,,,,en,"Newport Beach, CA",false,,0,,,"<a href=""http://instagram.com"" rel=""nofollow"">Instagram</a>",Just posted a photo @ Corona del Mar https://t.co/b6mtQ0AZAG,https://twitter.com/jasonpcorcoran/status/1420050616232161283,Fri Aug 27 01:58:20 +0000 2010,183464276,false,Daily Vibes,152,31,64,0,"Newport Beach, CA",Jason Corcoran,jasonpcorcoran,408,,,false
"-8.472175,51.900995",Tue Jul 27 15:44:25 +0000 2021,yestonew comedy boxing mma vaccine,,https://www.instagram.com/p/CR1ghIlJvq1/?utm_medium=twitter,1,1420047432268886024,,,,en,"Cork, Ireland",false,,0,,,"<a href=""http://instagram.com"" rel=""nofollow"">Instagram</a>","Said yes to my second jab. Fantastic experience! #yestonew #comedy #boxing #mma #vaccine @ Cork, Ireland https://t.co/1Vuxw3FiB3",https://twitter.com/yestonew/status/1420047432268886024,Wed Aug 26 22:15:09 +0000 2015,3451320376,false,American living in Ireland. Married to a Cork woman so spend my time saying yes to new on Leeside and sometimes further afield. My motto? Yes to New,162,243,1005,0,"Cork, Ireland",P. Emmett,yestonew,1079,,http://www.yestonew.com,false
"-0.12485951,51.50538967",Tue Jul 27 17:03:34 +0000 2021,COVID19,,http://dlvr.it/S4X4Np,0,1420067348413927435,,,,en,"London, England",false,,1,,,"<a href=""https://dlvrit.com/"" rel=""nofollow"">dlvr.it</a>","#COVID19 vaccine tech, agreement signed between companies from Japan and Vietnam https://t.co/WCdrEr0q65",https://twitter.com/BritishHeraldUK/status/1420067348413927435,Wed Feb 17 17:49:42 +0000 2010,115123902,false,Where Britain Meets the World® | The Official handle of #britishherald,344,133893,588,283,"London, United Kingdom",British Herald,BritishHeraldUK,57066,,http://www.britishherald.com,false
"2.15303,41.39199",Tue Jul 27 19:38:51 +0000 2021,Moderna COVID vaccine,,http://rt.com/news/530406-moderna-covid-vaccine-delivery-disruption/,0,1420106427851370496,,,,en,"Barcelona, España",false,,0,,,"<a href=""https://tapbots.com/tweetbot/"" rel=""nofollow"">Twitter for iPhone 12 Pro Max </a>",#Moderna warns of #COVID - 19 #vaccine delivery delays for customers... https://t.co/l6TmDAg89p,https://twitter.com/pidybi/status/1420106427851370496,Sat Mar 30 17:25:49 +0000 2013,1316862031,false,🤷‍♂️,219,569,590,250,Poland 🌍👈,𝔓𝔦𝔬𝔱𝔯,pidybi,633666,,,false
"-73.56725453,45.75975883",Tue Jul 27 15:11:14 +0000 2021,,,http://dlvr.it/S4Wl94,0,1420039080985776132,,,,en,"Mascouche, Québec",false,,0,,,"<a href=""https://dlvrit.com/"" rel=""nofollow"">dlvr.it</a>",Fighting Stigma: Ireland to offer coronavirus jabs to children aged 12 to 15: Irish health chief pledges to inoculate teens 'promptly' as pubs reopen to vaccinated adults with unvaccinated kids. ISRAEL-HEALTH-VIRUS-VACCINE. https://t.co/GcTHS4vLl2,https://twitter.com/StigmabaseN/status/1420039080985776132,Wed Sep 15 15:55:47 +0000 2010,191092262,false,Ireland — Scotland — Inuit —  Svenska  | Keeping up-to-date on global exclusion — Stigmabase is a canadian internet non-profit Initiative,0,1611,1297,110,Ireland | Scotland | Inuit | Skandinavien,Stigmabase | NORDIC,StigmabaseN,951949,,https://www.stigmabase.org/,false
"-117.566,33.8753",Tue Jul 27 19:32:14 +0000 2021,,,https://www.instagram.com/p/CR16uyXCGe9/?utm_medium=twitter,0,1420104763119648770,,,,en,"Corona, CA",true,,0,,,"<a href=""http://instagram.com"" rel=""nofollow"">Instagram</a>","Just posted a photo @ Corona, California https://t.co/5w6KCpZkD9",https://twitter.com/CarloandSeb/status/1420104763119648770,Mon Dec 04 14:14:43 +0000 2017,937686608945360896,false,please watch our new YT videos https://t.co/nIcj78KiUo … please consider subscribing and like our videos!,2786,31,736,0,"California, USA",Carlo and Seb Youtube Channel,CarloandSeb,2765,,https://www.youtube.com/carloseb,false
"2.15436,41.39543",Tue Jul 27 15:52:12 +0000 2021,aljazeera COVID,,http://aljazeera.com/program/between-us/2021/7/27/covid-in-india-on-the-second-wave,0,1420049388408279043,,,,en,"Barcelona, España",false,,0,,,"<a href=""https://tapbots.com/tweetbot/"" rel=""nofollow"">Twitter for iPhone 12 Pro Max </a>",#aljazeera #COVID in India: On the Second Wave https://t.co/SGVQq9nNq0,https://twitter.com/pidybi/status/1420049388408279043,Sat Mar 30 17:25:49 +0000 2013,1316862031,false,🤷‍♂️,219,569,590,250,Poland 🌍👈,𝔓𝔦𝔬𝔱𝔯,pidybi,633666,,,false
"-121.494,38.5816",Tue Jul 27 15:45:23 +0000 2021,,,https://www.latimes.com/california/story/2021-07-26/newsom-calls-out-the-unvaccinated-blasts-tucker-carlson-for-covid-19-misinformation,0,1420047675249106945,,,,en,"Sacramento, CA",false,,0,,,"<a href=""https://help.twitter.com/en/using-twitter/how-to-tweet#source-labels"" rel=""nofollow"">heapevents.info</a>","Newsom Calls Out The Unvaccinated Blasts Tucker Carlson For Covid Misinformation ☝ 😐 
 https://t.co/OeLkwMEewX",https://twitter.com/heapevents/status/1420047675249106945,Sat Jan 09 15:58:46 +0000 2021,1347935690332495877,false,just heap of US events,0,7,25,1,,heapevents.info,heapevents,21254,,https://www.heapevents.info/,false
"-73.47935661,45.6677507",Tue Jul 27 19:57:03 +0000 2021,,,http://dlvr.it/S4XXhL,0,1420111008626929666,,,,en,"Varennes, Québec",false,,0,,,"<a href=""https://dlvrit.com/"" rel=""nofollow"">dlvr.it</a>","Fighting Stigma : Coronavirus Northern Ireland: Three deaths and 1473 cases reported: It is not known which hospital the baby is receiving treatment in, nor any other details about the child. Health Minister Robin Swann said it would not be ... https://t.co/zK9ivYqjmB",https://twitter.com/StigmabaseN/status/1420111008626929666,Wed Sep 15 15:55:47 +0000 2010,191092262,false,Ireland — Scotland — Inuit —  Svenska  | Keeping up-to-date on global exclusion — Stigmabase is a canadian internet non-profit Initiative,0,1611,1297,110,Ireland | Scotland | Inuit | Skandinavien,Stigmabase | NORDIC,StigmabaseN,951949,,https://www.stigmabase.org/,false
"28.06045532,-26.21659308",Tue Jul 27 19:13:02 +0000 2021,,,http://dlvr.it/S4XQpJ,0,1420099933256908801,,,,en,"Johannesburg, South Africa",false,,1,,,"<a href=""https://dlvrit.com/"" rel=""nofollow"">dlvr.it</a>","HIVNR — Moderna to Use mRNA Technology Against Flu, HIV, and Cancer: ... rising from obscurity to giving the world the second vaccine against the coronavirus; now it will weaponize the same mRNA technology against HIV, ... View article... https://t.co/stuLFcHoru",https://twitter.com/StigmabaseN/status/1420099933256908801,Wed Sep 15 15:55:47 +0000 2010,191092262,false,Ireland — Scotland — Inuit —  Svenska  | Keeping up-to-date on global exclusion — Stigmabase is a canadian internet non-profit Initiative,0,1611,1297,110,Ireland | Scotland | Inuit | Skandinavien,Stigmabase | NORDIC,StigmabaseN,951949,,https://www.stigmabase.org/,false
"-95.365091,29.745204",Tue Jul 27 16:41:54 +0000 2021,,,https://twitter.com/PrinceyPls/status/1419872111540248576,0,1420061897358024707,,,,en,"Houston, TX",false,1419872111540248576,1,,,"<a href=""https://onloft.com/tweetlogix"" rel=""nofollow"">Tweetlogix</a>",Whoever has access to the digital ticket purchases’ list has the roll call of who was there https://t.co/xf1QxHdhel,https://twitter.com/WinkWestwood/status/1420061897358024707,Sun Mar 06 01:14:54 +0000 2011,261469386,false,Content Creator • Video Producer • #VeteransForKaepernick,837,9640,6160,72,"Houston, TX",🐻+🍯=❤️,WinkWestwood,458719,,,false
"-76.9818141,38.9253314",Tue Jul 27 16:30:16 +0000 2021,TrinityDC VaxxChampion family covid19 vaccine VaxxChampion togetherwecanovercome vaccinate sarscov1 vaccinate vaccineswork,https://twitter.com/TrinityDC/status/1420058971038158855/photo/1,https://www.vaccines.gov/,2,1420058971038158855,,,,en,"Washington, DC",false,,3,,,"<a href=""https://www.hootsuite.com"" rel=""nofollow"">Hootsuite Inc.</a>","#TrinityDC Senior Emely Fortiz is a #VaxxChampion because she loves her #family. If you need to set up a #covid19 #vaccine appointment, and be a #VaxxChampion like Emely, visit https://t.co/xEUbVyfS9O . #togetherwecanovercome #vaccinate #sarscov1 #vaccinate #vaccineswork https://t.co/i5Gcwm7mdE",https://twitter.com/TrinityDC/status/1420058971038158855,Mon Apr 06 15:48:58 +0000 2009,29226311,false,"A private liberal arts university in the nation's Capital, Trinity educates women and men across the lifespan in undergraduate and graduate degree programs.",3798,2787,1600,87,"Washington, DC",Trinity Washington U,TrinityDC,31001,,https://linktr.ee/TrinityDC,false
"-113.8,52.2667",Tue Jul 27 17:25:56 +0000 2021,,,https://www.instagram.com/p/CR1sSERreZ-T0UfWmUfbBWS2R3pH-bY0aj1Nxk0/?utm_medium=twitter,0,1420072980122583041,,,,en,"Red Deer, Alberta",false,,0,,,"<a href=""http://instagram.com"" rel=""nofollow"">Instagram</a>","1st time on a public bus since before the pandemic and the new bus route changes. So far so good. @ Red Deer, Alberta https://t.co/llv12JTTNR",https://twitter.com/AlbertaGirlTara/status/1420072980122583041,Tue Mar 24 18:15:33 +0000 2009,26288685,false,"A women who loves learning, reading, horror movies, and the paranormal just to name a few of my favorite things.",10776,249,1824,0,"Red Deer, Alberta",Tara (She/Her),AlbertaGirlTara,4943,,,false
"-80.1335,25.8138",Tue Jul 27 17:47:35 +0000 2021,,,https://www.instagram.com/p/CR1uv5tF_tq/?utm_medium=twitter,0,1420078425264607236,,,,en,"Miami Beach, FL",true,,0,,,"<a href=""http://instagram.com"" rel=""nofollow"">Instagram</a>","TACO 🌮 TUESDAYS 📶📶CLICK THE LINK IN MY BIO TO CONNECT TO THE STATION 24/7 🔥🔥🔥🔥PLEASE BE SAFE AND WEAR A MASK 😷 @ Miami Beach, Florida https://t.co/mFPsJYC6j1",https://twitter.com/DJPRIMETIME_305/status/1420078425264607236,Sat Jan 16 01:22:39 +0000 2010,105323765,false,Mr On The Grind Himself Hit Me Up 786-262-2476 Primetimelive@gmail.com https://t.co/XBgnaRcqhT THESTREETSFM is on Mixlr https://t.co/Xew1Sx6fAw,30,4874,4747,15,305 MIAMI,PRIMEZOE,DJPRIMETIME_305,14952,,https://SONYMUSIC.COM,false
"109.1882,12.2411",Tue Jul 27 22:43:46 +0000 2021,onestopshopping,,https://www.instagram.com/p/CR2QqH9tqgwu_cjhCV6G3q6Cg5PGMlkcUsXdAU0/?utm_medium=twitter,0,1420152964266737664,,,,en,"Khánh Hòa, Việt Nam",false,,0,,,"<a href=""http://instagram.com"" rel=""nofollow"">Instagram</a>","During lockdown we get vouchers to go shopping once every four days... If the shop keeps your voucher, you're done for the day. #onestopshopping @ Nha Trang https://t.co/aR6y0vIOTQ",https://twitter.com/SunnyJ_Tarot/status/1420152964266737664,Sat Oct 05 13:57:39 +0000 2013,1937761291,false,"Tarot Reader & Eclectic wanderer soaking up solace in the sun. I'm a retired teacher, sun worshipin, love generatin human https://t.co/YGr6ZKeFG0",5132,2948,2509,82,earth,SunnyJ Shores,SunnyJ_Tarot,62508,,https://www.SunnyJTarot.com,false
"120.9327,14.7988",Wed Jul 28 04:19:33 +0000 2021,wfh wfhlife wfhsetup,,https://www.instagram.com/p/CR23FhoFWX-/?utm_medium=twitter,0,1420237465340850176,,,,en,"Bocaue, Rehiyon ng Gitnang Luzon",false,,0,,,"<a href=""http://instagram.com"" rel=""nofollow"">Instagram</a>","Lafang while emailing in jammies 🤫
Perks of #wfh ❤️
#wfhlife #wfhsetup @ Bocaue, Bulacan https://t.co/4DhQW9DhSc",https://twitter.com/pearlyjeanne/status/1420237465340850176,Tue Feb 10 05:14:41 +0000 2009,20493450,false,"Weird gal, Designer , Automotive Mechanic student, Real Estate Salesperson
https://t.co/1ifMP5QLOy",43,89,318,3,"ÜT: 14.5496543,121.0583876",pearlyjeanne,pearlyjeanne,1090,,http://facebook.com/pearlyjeanne,false
"-117.566,33.8753",Wed Jul 28 02:58:13 +0000 2021,,,https://www.instagram.com/p/CR2tTXMABDL/?utm_medium=twitter,0,1420216996977946628,,,,en,"Corona, CA",false,,0,,,"<a href=""http://instagram.com"" rel=""nofollow"">Instagram</a>","Just posted a video @ Corona, California https://t.co/7K4H2oDaat",https://twitter.com/bigjawn13/status/1420216996977946628,Sat May 07 19:24:09 +0000 2011,294783678,false,I'm just a nobody with a whole lot of talent.... 🌎 🇲🇽🇺🇸 click the link in my bio to hear my music on any music platforms of your choosing,7060,1154,1446,15,"Corona, ca.",Big Legion,bigjawn13,46756,,https://fanlink.to/BigLegion,false
"36.821945,-1.292066",Tue Jul 27 21:13:56 +0000 2021,Newsnight,,https://www.reddit.com/r/Kenya/comments/osv9wg/,0,1420130355961552896,,,,en,"Nairobi, Kenya",true,,0,,,"<a href=""https://twitter.com/hermoand"" rel=""nofollow"">Kenyans On Reddit</a>","✦ [ #Newsnight ]

Covid 19 vaccines(Astrazeneca or Janssen)

https://t.co/qXUzPXB1gE",https://twitter.com/KenyansOnReddit/status/1420130355961552896,Sun Jun 07 11:55:21 +0000 2020,1269598733878079488,false,"Come join your fellow Kenyans™ on Reddit 👉 https://t.co/jgE8q6ov1E 

- #TopReply
- #rKenyaModLog
- #RemovedByMods
- #DeletedByAuthor
- #rKenyaVideo",794,254,17,3,Nairobi,Kenyans On Reddit 🇰🇪,KenyansOnReddit,44880,,https://reddit.com/r/kenya,false
"-73.56725453,45.75975883",Tue Jul 27 23:11:08 +0000 2021,,,http://dlvr.it/S4Y0wH,0,1420159853234819072,,,,en,"Mascouche, Québec",false,,0,,,"<a href=""https://dlvrit.com/"" rel=""nofollow"">dlvr.it</a>","Fighting Stigma: Department to issue blanket vaccine guidelines to schools: Health and safety in the reopening of schools must remain ""paramount"", ... to Michael Gillespie, general secretary of the Teachers' Union of Ireland. https://t.co/eEMp2cGkjD",https://twitter.com/StigmabaseN/status/1420159853234819072,Wed Sep 15 15:55:47 +0000 2010,191092262,false,Ireland — Scotland — Inuit —  Svenska  | Keeping up-to-date on global exclusion — Stigmabase is a canadian internet non-profit Initiative,0,1611,1297,110,Ireland | Scotland | Inuit | Skandinavien,Stigmabase | NORDIC,StigmabaseN,951949,,https://www.stigmabase.org/,false
"100.65507813,13.86200131",Wed Jul 28 04:03:11 +0000 2021,,,http://dlvr.it/S4YWFK,0,1420233347058470920,,,,en,"ท่าแร้ง, ประเทศไทย",false,,0,,,"<a href=""https://dlvrit.com/"" rel=""nofollow"">dlvr.it</a>",HKNR — Pandemic-driven hunger is making the world more unequal: Asia and Africa are home to the majority of people in the world who are food ... interviewed in Goshen City said they received any government aid. View article... https://t.co/UGxlS0yRCj,https://twitter.com/StigmabaseU/status/1420233347058470920,Tue Oct 26 15:04:54 +0000 2010,208056970,false,Asia — भारत  — Türkçe — Čeština — ελληνικά | Keeping up-to-date on global exclusion — Stigmabase is a canadian internet non-profit Initiative,0,2528,2405,117,WORLDWIDE,Stigmabase | UN,StigmabaseU,1606915,,https://www.stigmabase.org/,false
"-110.97004,32.2222",Wed Jul 28 00:02:26 +0000 2021,cobratucson cobraarcadebar tucson wearamask food drinks tucsonaz,,https://www.instagram.com/p/CR2ZqOCBKCH/?utm_medium=twitter,0,1420172759360024577,,,,en,"Tucson, AZ",false,,0,,,"<a href=""http://instagram.com"" rel=""nofollow"">Instagram</a>",Are you ready to play? 🐍We’re OPEN! 🙌🏽💥🍺 Happy Hour till 7pm! 🙌🏽 Come grab some dranks &amp; play some games!! ❤️ Thank you for supporting local! #cobratucson #cobraarcadebar #tucson #wearamask #food #drinks #tucsonaz https://t.co/q7bNEIEP7A,https://twitter.com/CobraTucson/status/1420172759360024577,Mon Jul 16 00:32:02 +0000 2018,1018654453539299328,false,"Cobra Arcade Bar located in Downtown Tucson! 
21+ | Tues-Sun | 4pm-2am | NO COVER ever!",96,402,950,1,"Tucson, AZ",Cobra Tucson,CobraTucson,1811,,http://www.cobraarcadebar.com,false
"-118.33150864,34.10142871",Tue Jul 27 23:24:14 +0000 2021,Covid Weed photooftheday strains hybrid stativa indica,,https://www.instagram.com/p/CR2VSblMNOk/?utm_medium=twitter,1,1420163147558658050,,,,en,"Los Angeles, CA",false,,0,,,"<a href=""http://instagram.com"" rel=""nofollow"">Instagram</a>","Im not sure 😕 of who has more new strains #Covid or #Weed 😷 
.
They have Covid Hybrid, Covid Stativa, and Covid Indica ... I mean damn 
.
.
#photooftheday #strains #hybrid #stativa #indica @ Hollywood, California https://t.co/5xmoKzvWvM",https://twitter.com/slimmgoodie310/status/1420163147558658050,Tue Mar 23 00:00:47 +0000 2010,125486053,false,"🔥BRAND NEW MUSIC ☆ Pull Up ☆~ OUT NOW‼️Go Download & Stream🦅
IG: @OfficialSlimmGoodie
@missyelliott Followed 10/22/21 💯
https://t.co/LqltLV5uoe",14189,1943,577,70,Outter Space ,TheReal Slimm Goodie,slimmgoodie310,43672,,https://open.spotify.com/album/69dpI0mwXjffW3J0ddFIpd?si=8ZgAV5ieQv-7JzV6LPBxuQ&utm_source=copy-link,false
"88.59372351,24.36402136",Tue Jul 27 20:19:49 +0000 2021,,,https://www.instagram.com/p/CR2ALwxLTkT/?utm_medium=twitter,1,1420116738507685889,,,,en,"Rajshahi, Bangladesh",false,,0,,,"<a href=""http://instagram.com"" rel=""nofollow"">Instagram</a>","Please, wear a mask and stay safe! @ Dorgapara Rajshahi Sador https://t.co/Xt7OwLzbH7",https://twitter.com/nirobkhan71/status/1420116738507685889,Thu Dec 17 10:02:43 +0000 2020,1339511176963584000,false,"😍তার চোখে👀চোখ রেখে কথা 

😉বলতেই লজ্জা🙊লাগে

💑হ্যাঁ এটাই সম্মানজনক😊ভালোবাসা👌",179,1,31,0,"Rajshahi, Bangladesh",𝑁𝑖𝑟𝑜𝑏 𝑘ℎ𝑎𝑛,nirobkhan71,77,,,false
"-73.56725453,45.75975883",Tue Jul 27 22:12:11 +0000 2021,,,http://dlvr.it/S4XtrH,0,1420145017939632128,,,,en,"Mascouche, Québec",false,,0,,,"<a href=""https://dlvrit.com/"" rel=""nofollow"">dlvr.it</a>",Fighting Stigma: Ireland to vaccinate teens as Delta concerns linger: Health minister Stephen Donnelly said children would be offered mRNA vaccines produced by Pfizer/BioNTech and Moderna which have been ... https://t.co/JgmMHDwfBQ,https://twitter.com/StigmabaseN/status/1420145017939632128,Wed Sep 15 15:55:47 +0000 2010,191092262,false,Ireland — Scotland — Inuit —  Svenska  | Keeping up-to-date on global exclusion — Stigmabase is a canadian internet non-profit Initiative,0,1611,1297,110,Ireland | Scotland | Inuit | Skandinavien,Stigmabase | NORDIC,StigmabaseN,951949,,https://www.stigmabase.org/,false
