coordinates,created_at,hashtags,media,urls,favorite_count,id,in_reply_to_screen_name,in_reply_to_status_id,in_reply_to_user_id,lang,place,possibly_sensitive,quote_id,retweet_count,retweet_id,retweet_screen_name,source,text,tweet_url,user_created_at,user_id,user_default_profile_image,user_description,user_favourites_count,user_followers_count,user_friends_count,user_listed_count,user_location,user_name,user_screen_name,user_statuses_count,user_time_zone,user_urls,user_verified
"-157.85599,21.2992",Sun Apr 11 06:22:08 +0000 2021,,,https://www.instagram.com/p/CNg_Qs-JXTbMeGQWuvc9CkewGtc6XRpcTnFAjA0/?igshid=18s74nhhzs83s,1,1381130424680783873,,,,en,"Honolulu, HI",false,,0,,,"<a href=""http://instagram.com"" rel=""nofollow"">Instagram</a>","An ordeal trying to get food and drink tonight.  Turned away from Henry Louie, turned away from Side Street Inn, Harbor Pub was closed.  Ended up at Asahi Café, and beers here.  Covid rules😠 https://t.co/wPL7t593dx",https://twitter.com/TobySettle/status/1381130424680783873,Thu Jun 23 03:54:15 +0000 2016,745827279368916992,false,"“Every great cause begins as a movement, becomes a business, and eventually degenerates into a racket.”………Eric Hoffer",939,19,126,0,"Honolulu, HI",Toby Settle,TobySettle,829,,,false
"77.22217788,28.63213091",Sun Apr 11 09:13:04 +0000 2021,Nifty Sipgrab UnitingPeopleWithThePossibilities,,http://dlvr.it/RxQlp8,0,1381173443601735684,,,,en,"नई दिल्ली, भारत",false,,0,,,"<a href=""https://dlvrit.com/"" rel=""nofollow"">dlvr.it</a>",Shivraj Singh Chouhan rules out possibility of lockdown in Madhya Pradesh https://t.co/XvZ3hMIMk1 #Nifty #Sipgrab #UnitingPeopleWithThePossibilities,https://twitter.com/sipgrab/status/1381173443601735684,Tue Feb 28 12:12:15 +0000 2017,836549573048848384,false,Wealth management firm| Option Trading Expert | Option Strategy maker| 360° financial planner | compelete range of financial products | Market buzz updater!!,272,267,94,2,"Bengaluru, India",SipGrab,sipgrab,43338,,http://www.Sipgrab.com,false
"18.4999,-33.8128",Sun Apr 11 09:47:59 +0000 2021,NTC Run workout Sunday,,https://www.instagram.com/p/CNhW0UEpQ2lzk3aNy8Ci0mmlyj-Uc2d9T9MQ8k0/?igshid=7fohwav586r0,0,1381182230035316737,,,,en,"Milnerton, South Africa",false,,0,,,"<a href=""http://instagram.com"" rel=""nofollow"">Instagram</a>","Tryna shake off the extra 3kg picked up between lockdown level 3 and level 1 #NTC Endurance #Run #workout #Sunday @ Parklands, Cape Town https://t.co/S1FiTkYpFX",https://twitter.com/wilsonbennie/status/1381182230035316737,Tue Apr 21 14:29:25 +0000 2009,33919471,false,Supernumerary,1581,307,682,22,South Africa,Mr B,wilsonbennie,5791,,https://twitter.com/#!/wilsonbennie,false
"-86.0126114,40.0462685",Sun Apr 11 11:58:49 +0000 2021,paris ivemissedyou eiffeltower francophile seine loganvillagemall feelslikehome pandemic sucks airplane brocante iloveyou iloveparis myheart moncoeur,,https://www.instagram.com/p/CNhlyvCByG-/?igshid=c5f2xezzmp53,0,1381215154575118340,,,,en,"Noblesville, IN",false,,0,,,"<a href=""http://instagram.com"" rel=""nofollow"">Instagram</a>",Heading back to Paris this evening. #paris #ivemissedyou #eiffeltower #francophile #seine #loganvillagemall #feelslikehome #pandemic #sucks #airplane #brocante #🇫🇷 #iloveyou #iloveparis #myheart #moncoeur #❤️ https://t.co/hl0MNkZBq8,https://twitter.com/kimdegualle/status/1381215154575118340,Tue Jul 07 02:51:35 +0000 2009,54426067,false,Travel is my life and affords me the opportunity to find treasures for my shop. Find My French Brocante on Facebook. 977 Logan St. Noblesville IN,53,71,87,1,"Noblesville, IN",kim evasic,kimdegualle,2136,,http://www.officiallyanantique.com,false
"77.22217788,28.63213091",Sun Apr 11 08:42:34 +0000 2021,Nifty Sipgrab UnitingPeopleWithThePossibilities,,http://dlvr.it/RxQj1f,0,1381165769178804224,,,,en,"नई दिल्ली, भारत",false,,0,,,"<a href=""https://dlvrit.com/"" rel=""nofollow"">dlvr.it</a>",COVID-19 wreaking havoc on Indian lives due to Modi govt's policies: Congress https://t.co/gErpLsEkrY #Nifty #Sipgrab #UnitingPeopleWithThePossibilities,https://twitter.com/sipgrab/status/1381165769178804224,Tue Feb 28 12:12:15 +0000 2017,836549573048848384,false,Wealth management firm| Option Trading Expert | Option Strategy maker| 360° financial planner | compelete range of financial products | Market buzz updater!!,272,267,94,2,"Bengaluru, India",SipGrab,sipgrab,43338,,http://www.Sipgrab.com,false
"-73.56725453,45.75975883",Sun Apr 11 12:06:37 +0000 2021,,,http://dlvr.it/RxR7HQ,0,1381217119065403392,,,,en,"Mascouche, Québec",false,,0,,,"<a href=""https://dlvrit.com/"" rel=""nofollow"">dlvr.it</a>","Fighting Stigma: Ireland expects 4 million Covid vaccine doses by June: Meanwhile, national health service chief executive Paul Reid said there are over 11,000 staff to administer vaccinations across the country. ""We are well ... https://t.co/UNuX8w98P9",https://twitter.com/StigmabaseN/status/1381217119065403392,Wed Sep 15 15:55:47 +0000 2010,191092262,false,Ireland — Scotland — Inuit —  Svenska  | Keeping up-to-date on global exclusion — Stigmabase is a canadian internet non-profit Initiative,0,1611,1297,110,Ireland | Scotland | Inuit | Skandinavien,Stigmabase | NORDIC,StigmabaseN,951942,,https://www.stigmabase.org/,false
"73.85893822,18.49938932",Sun Apr 11 10:45:47 +0000 2021,,,https://www.instagram.com/p/CNhdb6RLh8E/?igshid=1t3hafgn4eqm7,0,1381196777865498625,,,,en,"Pune, India",false,,0,,,"<a href=""http://instagram.com"" rel=""nofollow"">Instagram</a>",*COVID CARE CENTER 🏥 IN PUNE* @ Pune City https://t.co/wt0diESMaQ,https://twitter.com/Jagdishthakare8/status/1381196777865498625,Sat Apr 29 02:25:48 +0000 2017,858145262614831104,false,"I am social Media Marketer,
RSS activist, 
Volunteer in Raje pratisthan, 
Social worker",413,137,1712,2,"Pune, India",Jagdish thakare,Jagdishthakare8,447,,http://www.digitaljagdish.com,false
"74.8526001,12.86803728",Sun Apr 11 11:04:05 +0000 2021,,,https://www.instagram.com/p/CNhfhzdJ-d4/?igshid=1q8zwmvv6guyu,1,1381201381655121921,,,,en,"मैंगलोर, भारत",false,,0,,,"<a href=""http://instagram.com"" rel=""nofollow"">Instagram</a>","It is Not Corona &amp; Night Curfew,
It is Migrant Curfew ,
Workers Migrate from growth of the Towns &amp; from business,
Don't kill the Towns and Economy in Migrant Curfew @ Mangalore, Karnataka, India https://t.co/eIEr2110Pv",https://twitter.com/APallataru/status/1381201381655121921,Mon Aug 17 07:55:42 +0000 2020,1295267957350649856,false,"@Artificial_Mark
@APallataru",1903,19,394,2,"Mangalore, India",VICTIM'S PAINS,APallataru,2371,,https://www.sunniya.com/,false
"121.02550283,14.68694392",Sun Apr 11 07:03:10 +0000 2021,vaccine,,https://www.instagram.com/p/CNhD9SvhQWS/?igshid=1x404jc2r2dhp,0,1381140752391155713,,,,en,"Lungsod ng Quezon, Pambansang Punong Rehiyon",false,,0,,,"<a href=""http://instagram.com"" rel=""nofollow"">Instagram</a>","Tax payer money at work
#vaccine @ Placido Del Mundo Elementary https://t.co/4tlsaNc4G1",https://twitter.com/jowiscope/status/1381140752391155713,Fri Apr 10 10:53:12 +0000 2009,30197004,false,"Tech Writer, Pilot, and Freelance Coach",54,273,343,14,"Bulacan, Central Luzon",Jowi Morales,jowiscope,6179,,http://www.makeuseof.com/author/jowi-morales,false
"100.494,13.7522",Sun Apr 11 10:42:18 +0000 2021,happyweekendeveryone ponybeestories ponybeestagram stayhome staysafe happyweekend,,https://www.instagram.com/p/CNhdCOZpsSp/?igshid=1sosg558wgdtq,0,1381195899888676867,,,,en,"พระบรมมหาราชวัง, ประเทศไทย",false,,0,,,"<a href=""http://instagram.com"" rel=""nofollow"">Instagram</a>","Yes...it's raining all day long...Please staying home ... staying safe from Covid-19  #happyweekendeveryone #ponybeestories #ponybeestagram #stayhome #staysafe #happyweekend @ Bangkok, Thailand https://t.co/8dj8GsI7z1",https://twitter.com/PonyBStories/status/1381195899888676867,Sat Dec 10 08:13:24 +0000 2011,433200335,false,"Travel blogger, Enjoyed to see the World and love to travel 🏖
FB:น้องหมีตะลอนทัวร์🐻Siamtop10❤IG: Ponybeestories79🎵|Clubhouse:ponybee3659",148,23,32,2,"Bangkok, Thailand ",♬• Ponybeestories •♬42🎏,PonyBStories,1496,,https://Ponybeestories.wordpress.com/,false
"-100.983,25.4333",Sun Apr 11 05:37:23 +0000 2021,Saltillo Coahuila Mexico HomeTown HomeSweetHome COVID19Mexico COVID19 Coronavirus Quarantine QuarantineMexico Cuarentena CuarentenaMexico QuedateEnCasa StayAtHome,,https://www.instagram.com/p/CNg6JIilUEh/?igshid=zdarzffo7gg2,0,1381119166573252611,,,,en,"Saltillo, Coahuila de Zaragoza",false,,0,,,"<a href=""http://instagram.com"" rel=""nofollow"">Instagram</a>","Quarantine Day 378: Still Missing You...
.
#Saltillo #Coahuila #Mexico #HomeTown #HomeSweetHome #COVID19Mexico #COVID19 #Coronavirus #Quarantine #QuarantineMexico #Cuarentena #CuarentenaMexico #QuedateEnCasa #StayAtHome https://t.co/piJ8cHcL3B",https://twitter.com/RedMapleExLT/status/1381119166573252611,Sun Apr 14 13:33:11 +0000 2013,1351877840,false,🍁Red Maple co-founder 💊💉🥫Quality Management System & Food Safety consultant 🧟‍♀️🚀🧛🏻‍♂️ Sci-fi & Horror enthusiast 📬redmaple@redmaple.com.mx,44631,2095,639,181,"Saltillo, Coahuila de Zaragoza",Red Maple,RedMapleExLT,156705,,http://www.redmaple.com.mx,false
"-2.12657,53.25609",Sun Apr 11 11:18:40 +0000 2021,Macclesfield sunrise morning tree spring sky clouds day sun fresh covid,,https://www.instagram.com/p/CNhhMfBscvw/?igshid=1hly5dmjcwifn,1,1381205050287079424,,,,en,"Macclesfield, England",false,,1,,,"<a href=""http://instagram.com"" rel=""nofollow"">Instagram</a>",No place like #Macclesfield #sunrise #morning #tree #spring #sky #clouds #day #sun #fresh #covid #2021 @ Macclesfield https://t.co/TbuWqM3AhD,https://twitter.com/Destex69/status/1381205050287079424,Wed May 11 17:49:11 +0000 2011,296959601,false,Artist/photographer. BA Textiles and surface pattern,573,85,198,4,"Cheshire, England",Michele Campbell,Destex69,6120,,http://www.behance.net/michelerose69,false
"120.9711,14.4177",Sun Apr 11 04:35:42 +0000 2021,travelthainow2019 lykaglobal lykagems lykans,,https://www.instagram.com/p/CNgzFPxh6gd/?igshid=1xsol78ic5je8,0,1381103642598576128,,,,en,"Bacoor, Rehiyon ng CALABARZON",false,,0,,,"<a href=""http://instagram.com"" rel=""nofollow"">Instagram</a>","Lockdown food...😉
#travelthainow2019 
#lykaglobal 
#lykagems 
#lykans @ Bacoor, Cavite https://t.co/ACQOPHVGWO",https://twitter.com/mariakireii/status/1381103642598576128,Sat Feb 13 02:12:10 +0000 2010,113791562,false,,36,91,67,0,Philippines,Julio Gomez,mariakireii,3882,,,false
"110.366643,-7.799243",Sun Apr 11 08:43:44 +0000 2021,,,https://www.instagram.com/p/CNhPd4Dp-qu/?igshid=1ksvg5pb62ig,0,1381166062733955074,,,,en,"Gondomanan, Indonesia",false,,0,,,"<a href=""http://instagram.com"" rel=""nofollow"">Instagram</a>","Have a nice day!
Don't forget to wear your mask ❗ @ Yogyakarta https://t.co/P0jmnWPfWE",https://twitter.com/kimnatalia39/status/1381166062733955074,Sat Mar 10 13:39:10 +0000 2012,520404010,false,"Follow me ,, i'll follback ..",74,342,328,0,"Yogyakarta, Indonesia",Dea Natalia,kimnatalia39,552,,,false
"-73.56725453,45.75975883",Sun Apr 11 08:08:35 +0000 2021,,,http://dlvr.it/RxQdb0,0,1381157213469732869,,,,en,"Mascouche, Québec",false,,0,,,"<a href=""https://dlvrit.com/"" rel=""nofollow"">dlvr.it</a>","Fighting Stigma: Barristers working for health panels are 'frontline workers', says HSE: Frontline healthcare workers are among the few groups currently eligible to be vaccinated but ... Barristers, board directors and administrative staff working for… https://t.co/DKelhjQekh",https://twitter.com/StigmabaseN/status/1381157213469732869,Wed Sep 15 15:55:47 +0000 2010,191092262,false,Ireland — Scotland — Inuit —  Svenska  | Keeping up-to-date on global exclusion — Stigmabase is a canadian internet non-profit Initiative,0,1611,1297,110,Ireland | Scotland | Inuit | Skandinavien,Stigmabase | NORDIC,StigmabaseN,951942,,https://www.stigmabase.org/,false
"-2.94445793,53.51718735",Sun Apr 11 10:55:02 +0000 2021,picoftheday sundayrunday,,https://www.instagram.com/p/CNhefcMFuH3IvmAGZv56g4f8To7xyt8n5ibsro0/?igshid=ayjfjhcxrwao,1,1381199102784966657,,,,en,"Maghull, England",false,,0,,,"<a href=""http://instagram.com"" rel=""nofollow"">Instagram</a>",Shorter run today but least I got out there and burnt some more lockdown pounds #picoftheday #sundayrunday🏃 @ Maghull https://t.co/RtAeUH5mki,https://twitter.com/colin_neil_show/status/1381199102784966657,Sat Jan 15 16:03:19 +0000 2011,238614102,false,"Social commentary without judgement. LiverpoolFC YNWA, Sport, Travel, Dr Who, Star Trek, Stanger Things, Eurovision, R2 Popmaster winner, Geek. Views own.",17981,772,989,28,Liverpool ,TheColin&NeilShow,colin_neil_show,17525,,,false
"77.22217788,28.63213091",Sun Apr 11 07:03:12 +0000 2021,Nifty Sipgrab UnitingPeopleWithThePossibilities,,http://dlvr.it/RxQPfW,0,1381140759869419524,,,,en,"नई दिल्ली, भारत",false,,0,,,"<a href=""https://dlvrit.com/"" rel=""nofollow"">dlvr.it</a>","COVID situation in Delhi 'very serious', people shouldn't go out unless urgent: CM Arvind Kejriwal https://t.co/8h8asS1CSW #Nifty #Sipgrab #UnitingPeopleWithThePossibilities",https://twitter.com/sipgrab/status/1381140759869419524,Tue Feb 28 12:12:15 +0000 2017,836549573048848384,false,Wealth management firm| Option Trading Expert | Option Strategy maker| 360° financial planner | compelete range of financial products | Market buzz updater!!,272,267,94,2,"Bengaluru, India",SipGrab,sipgrab,43338,,http://www.Sipgrab.com,false
"-68.79734556,44.80148315",Sun Apr 11 11:58:12 +0000 2021,,,https://twitter.com/bangordailynews/status/1381208894920396805,1,1381214999771762688,,,,en,"Bangor, ME",false,1381208894920396805,0,,,"<a href=""http://tapbots.com/tweetbot"" rel=""nofollow"">Tweetbot for iΟS</a>","See,I told you so! https://t.co/y6i5K2tJrY",https://twitter.com/snappity/status/1381214999771762688,Mon Feb 04 16:19:44 +0000 2008,13053992,false,"Instructional Technologist in Higher Ed; teacher, geek, mama, wife, Mainer, Grand Laker by birth, Bangor City Councilor, lifelong learner. Views are my own.",6641,1714,988,93,"Bangor, ME",gretchen 💉 vaxed AND masked 💉schaefer,snappity,51742,,,false
"2.154007,41.390205",Sun Apr 11 10:15:13 +0000 2021,aljazeera,,https://www.aljazeera.com/news/2021/4/11/chinese-vaccines-effectiveness-low-official-admits,0,1381189085319020554,,,,en,"Barcelona, España",false,,0,,,"<a href=""https://tapbots.com/tweetbot/"" rel=""nofollow"">Twitter for iPhone 12 Pro Max </a>",#aljazeera Chinese vaccines effectiveness... https://t.co/A067fqaemF,https://twitter.com/pidybi/status/1381189085319020554,Sat Mar 30 17:25:49 +0000 2013,1316862031,false,🤷‍♂️,219,569,590,250,Poland 🌍👈,𝔓𝔦𝔬𝔱𝔯,pidybi,633666,,,false
"-4.629734,54.08989",Sun Apr 11 08:01:31 +0000 2021,coronavirus iom coronaupdate,,https://netc.im/Covid-19,0,1381155436078960644,,,,en,"Ballasalla, Isle of Man",false,,0,,,"<a href=""http://www.netcetera.co.uk"" rel=""nofollow"">IOM</a>","Coronavirus Daily Update: As at 10 Apr 2021, in the Isle of Man there have been 1574 confirmed cases. #coronavirus #iom #coronaupdate https://t.co/WNfsczfk7J",https://twitter.com/iom/status/1381155436078960644,Mon Aug 27 14:51:27 +0000 2007,8463142,false,Local news for the Isle of Man - brought to you by Netcetera Managed Hosting,6,4427,1305,70,Isle of Man,Isle of Man,iom,36021,,https://netcetera.uk,false
"-81.4462933,28.47004962",Sun Apr 11 12:06:36 +0000 2021,GodzillaVsKong KingKong TeamKong,,https://www.instagram.com/p/CNhmrk-Bh3K/?igshid=1vju0yntxsbif,0,1381217113919078400,,,,en,"Orlando, FL",false,,0,,,"<a href=""http://instagram.com"" rel=""nofollow"">Instagram</a>",The year without going to the 🎥 is finally over. My first movie back since lockdown had to be #GodzillaVsKong. Nothing like seeing my big boy #KingKong on the big screen. #TeamKong ❤ @ Cinemark Orlando and XD https://t.co/K6Ox3O8iDM,https://twitter.com/ajpratsfactor/status/1381217113919078400,Fri Dec 27 01:16:25 +0000 2013,2263567826,false,"An artistic creator skilled in the fields of design, entertainment, enrichment and entrepreneurship.",1699,96,459,4,"Orlando, Fl",Aj Prats,ajpratsfactor,2406,,http://theajpratsfactor.wix.com/ajprats,false
"-73.56725453,45.75975883",Sun Apr 11 09:08:04 +0000 2021,,,http://dlvr.it/RxQlNs,0,1381172186270998530,,,,en,"Mascouche, Québec",false,,0,,,"<a href=""https://dlvrit.com/"" rel=""nofollow"">dlvr.it</a>","Fighting Stigma: HSE confident of staffing levels for vaccine centres ahead of age-based rollout: HEALTH OFFICIALS ARE confident that staffing levels for mass vaccination ... The health service estimates it will need between 2,500 and 5,000 ... Head of… https://t.co/NW9RqtO8j7",https://twitter.com/StigmabaseN/status/1381172186270998530,Wed Sep 15 15:55:47 +0000 2010,191092262,false,Ireland — Scotland — Inuit —  Svenska  | Keeping up-to-date on global exclusion — Stigmabase is a canadian internet non-profit Initiative,0,1611,1297,110,Ireland | Scotland | Inuit | Skandinavien,Stigmabase | NORDIC,StigmabaseN,951942,,https://www.stigmabase.org/,false
"77.60342187,12.9355363",Sun Apr 11 11:05:33 +0000 2021,Nifty Sipgrab UnitingPeopleWithThePossibilities,,http://dlvr.it/RxR0ZX,0,1381201752163110918,,,,en,"Bengaluru South, India",false,,0,,,"<a href=""https://dlvrit.com/"" rel=""nofollow"">dlvr.it</a>",ETMarkets Investors' Guide: Will bank stocks be the biggest casualty of Covid 2.0? https://t.co/KLyBvQTiI9 #Nifty #Sipgrab #UnitingPeopleWithThePossibilities,https://twitter.com/sipgrab/status/1381201752163110918,Tue Feb 28 12:12:15 +0000 2017,836549573048848384,false,Wealth management firm| Option Trading Expert | Option Strategy maker| 360° financial planner | compelete range of financial products | Market buzz updater!!,272,267,94,2,"Bengaluru, India",SipGrab,sipgrab,43338,,http://www.Sipgrab.com,false
"-2.4567456,53.1033545",Sun Apr 11 11:04:48 +0000 2021,,,https://www.instagram.com/p/CNhfnENsk39/?igshid=bmfir3m03hqs,0,1381201562249408515,,,,en,"Crewe, England",false,,0,,,"<a href=""http://instagram.com"" rel=""nofollow"">Instagram</a>",First vaccine done 😛 @ Leighton Hospital https://t.co/RrzttBD82S,https://twitter.com/MrPhiloBrit/status/1381201562249408515,Mon Sep 28 16:05:59 +0000 2015,3805240467,true,,1260,164,443,2,,PhilosophicalBrit,MrPhiloBrit,310,,,false
"72.85711352,19.07656422",Sun Apr 11 07:46:40 +0000 2021,,,https://www.instagram.com/p/CNhI7_5n9IU/?igshid=154q9d7n9mnfh,0,1381151699507810304,,,,en,"मुंबई, भारत",false,,0,,,"<a href=""http://instagram.com"" rel=""nofollow"">Instagram</a>","3 Things can give 99.9% safety from Covid-19*

Contact for Insurance - 8433708273 @ Santacruz East, Mumbai (Suburban) https://t.co/giv1WOzhyb",https://twitter.com/aamol172/status/1381151699507810304,Sun Mar 06 17:02:09 +0000 2011,261759475,false,Dreamer And Achiever.,846,23,58,0,"Mumbai, India",Aamol Jadhav,aamol172,2960,,,false
"120.455894,17.605518",Sun Apr 11 05:20:09 +0000 2021,,,https://www.instagram.com/p/CNg4FrRnjWW/?igshid=1kr0zt1wf9c23,0,1381114829625118721,,,,en,"Bantay, Rehiyon ng Ilokos",false,,0,,,"<a href=""http://instagram.com"" rel=""nofollow"">Instagram</a>","With my friends in NBI.
It was before the pandemic.
Sana matapos na ang COVID-19 😊 @ Mt. Caniaw, Bantay, Ilocos Sur https://t.co/M9KYZRPsNu",https://twitter.com/thekenyongf/status/1381114829625118721,Mon Nov 30 08:53:21 +0000 2020,1333333238241116161,false,yow!,61,1533,69,1,,Kenyong,thekenyongf,922,,http://youtube.com/kenyongetc,false
"-73.9519391,40.69923325",Sun Apr 11 12:08:14 +0000 2021,AboutLastNight ImAWholeVibe SpentAllDayWithBAE,,https://www.instagram.com/p/CNhm3hoJoL2/?igshid=s8mxth28yhtp,0,1381217524012961796,,,,en,"Brooklyn, NY",false,,0,,,"<a href=""http://instagram.com"" rel=""nofollow"">Instagram</a>","You Could Walk Away, But You Know That’s Foolish🌹♥️
 #AboutLastNight💋 #ImAWholeVibe😉 #SpentAllDayWithBAE😍 @ Quarantine NYC https://t.co/L8X6VMIbBY",https://twitter.com/SAlexanderia/status/1381217524012961796,Thu May 16 15:56:43 +0000 2013,1433446729,false,32🦋| Shaiden’s Mom👩‍👦| Isaiah’s Girl♥️| Future Family Lawyer⚖️ | QCC‘22 ➡️ John Jay’24📚| Travel Enthusiast✈️ | Forever Evolving…🫶🏾,41264,2577,4695,36,"Manhattan, NY",Shanaya Shantel Maxwell,SAlexanderia,269250,,http://instagram.com/blueballerinaaa,false
"-157.83913851,21.28559056",Sun Apr 11 07:16:56 +0000 2021,,,https://www.instagram.com/p/CNhFiCkDdpb/?igshid=1kw5j3uovzkwu,0,1381144216894496769,,,,en,"Honolulu, HI",false,,0,,,"<a href=""http://instagram.com"" rel=""nofollow"">Instagram</a>",completed quarantine calls for lobster 🦞. @ Red Lobster https://t.co/FliEJPYrWw,https://twitter.com/joshxangee/status/1381144216894496769,Sun Jan 31 03:09:00 +0000 2010,110028750,false,Smile like a monkey with a new banana.,69,278,331,35,"Honolulu, HI",angelita francisco,joshxangee,3569,,,false
"72.9097582,19.00117717",Sun Apr 11 05:20:33 +0000 2021,Sipgrab UnitingPeopleWithThePossibilities,,http://dlvr.it/RxQMtK,0,1381114927587282946,,,,en,"मुंबई, भारत",false,,0,,,"<a href=""https://dlvrit.com/"" rel=""nofollow"">dlvr.it</a>",Tokyo Olympic organisers to secure 300 hotel rooms for athletes with COVID-19-Kyodo https://t.co/EHHEqLnTkv #Sipgrab #UnitingPeopleWithThePossibilities,https://twitter.com/sipgrab/status/1381114927587282946,Tue Feb 28 12:12:15 +0000 2017,836549573048848384,false,Wealth management firm| Option Trading Expert | Option Strategy maker| 360° financial planner | compelete range of financial products | Market buzz updater!!,272,267,94,2,"Bengaluru, India",SipGrab,sipgrab,43338,,http://www.Sipgrab.com,false
"-74.20647674,40.7177179",Sun Apr 11 09:53:49 +0000 2021,,,https://www.instagram.com/p/CNhXe-EHCSY/?igshid=xnguny7cc92m,0,1381183697110597633,,,,en,"Newark, NJ",false,,0,,,"<a href=""http://instagram.com"" rel=""nofollow"">Instagram</a>",23 years old and my social media profiles are still friedch1ck3n :/ shoutout to my gorgeous friends for making my SECOND lockdown birthday not awful ! @ I Was Born On My Birthday https://t.co/uGSmFj2b76,https://twitter.com/FRIEDCH1CK3N/status/1381183697110597633,Thu Jul 23 15:15:54 +0000 2009,59492092,false,top in the streets 😈👅💦 bottom in the sheets 😇☺️🥰 | 23 | COYS💙🤍,18462,698,659,10,"KFC, Belfast, Liverpool",k80🍗,FRIEDCH1CK3N,57730,,http://www.instagram.com/FRIEDCH1CK3N,false
"77.08213265,28.60965195",Sun Apr 11 09:10:34 +0000 2021,,,https://www.instagram.com/p/CNhSiV5J6PW/?igshid=qwgyfh0saeyp,0,1381172813067776001,,,,en,"नई दिल्ली, भारत",false,,0,,,"<a href=""http://instagram.com"" rel=""nofollow"">Instagram</a>",Taking Oxford AstraZeneca covishield vaccine 1st doze 🙏 @ Dada Dev Hospital https://t.co/U4Ex9WNyS6,https://twitter.com/somnath0304/status/1381172813067776001,Thu Dec 31 10:55:57 +0000 2009,100743280,false,Somnath0304,1085,340,539,2,New Delhi,SOM +91-9911117909 CEM,somnath0304,544,,,false
"-79.3872,43.648",Sun Apr 11 11:09:32 +0000 2021,,,https://www.instagram.com/p/CNhgJq_pAes/?igshid=ldecd343h0l9,1,1381202753393979394,,,,en,"Toronto, Ontario",false,,0,,,"<a href=""http://instagram.com"" rel=""nofollow"">Instagram</a>","Nature seems to be blooming and full of life despite COVID wave-3 ! Love the blossoms in the backyard ! @ Toronto, Ontario https://t.co/979r9Lj1aC",https://twitter.com/TheSaaSGuy/status/1381202753393979394,Tue Jul 29 02:21:32 +0000 2008,15640917,false,"B2B Engineering markets w/ Kaizen attitude to grow @LogibecCanada Ex Dapasoft,Calian,Exinda,QuickPlayMedia, BSMWireless. ❤ #FCBlive ⚽",703,2397,1409,170,"ÜT: 43.6373035,-79.4219055",Jijesh Devan,TheSaaSGuy,17005,,,false
"-73.47935661,45.6677507",Sun Apr 11 09:08:03 +0000 2021,,,http://dlvr.it/RxQlL9,0,1381172181351112712,,,,en,"Varennes, Québec",false,,0,,,"<a href=""https://dlvrit.com/"" rel=""nofollow"">dlvr.it</a>","Fighting Stigma : 'I hate that she had to do it alone' — Emer O'Neill recalls discrimination her mother faced as a ...: Ireland is familiar with Emer O'Neill's story, having to face racism in her own hometown of Bray and wanting to shield her children… https://t.co/hTiUHWD4m1",https://twitter.com/StigmabaseN/status/1381172181351112712,Wed Sep 15 15:55:47 +0000 2010,191092262,false,Ireland — Scotland — Inuit —  Svenska  | Keeping up-to-date on global exclusion — Stigmabase is a canadian internet non-profit Initiative,0,1611,1297,110,Ireland | Scotland | Inuit | Skandinavien,Stigmabase | NORDIC,StigmabaseN,951942,,https://www.stigmabase.org/,false
"-64.10452034,10.44556394",Sun Apr 11 04:40:22 +0000 2021,UnAñoAtras Megadeth KillingIsMyBusiness AndBusinessIsGood StayAtHome,,https://www.instagram.com/p/CNgznZqBs2Q/?igshid=1k79fmbjfc7hn,2,1381104816269705219,,,,en,"Sucre, Venezuela",false,,1,,,"<a href=""http://instagram.com"" rel=""nofollow"">Instagram</a>",#UnAñoAtras Abril 2020 - Abril 2021 ... Killing Is My Business ... And Business Is Good! #Megadeth #KillingIsMyBusiness ... #AndBusinessIsGood #StayAtHome  🤭🤪😎😸✊🏼🔪🧨🚬🗡️💣🔫👾 en Cumana Edo. Sucre https://t.co/pCLMxrFJvc,https://twitter.com/giordycova013/status/1381104816269705219,Thu May 06 13:48:07 +0000 2010,140835233,false,Abogado. Mi Instagram: http://t.co/htCKE6fOCO,53685,14327,15623,32,"Cumaná, Estado Sucre",Giordy Cova,giordycova013,101964,,https://www.facebook.com/giordyl.cova,false
