coordinates,created_at,hashtags,media,urls,favorite_count,id,in_reply_to_screen_name,in_reply_to_status_id,in_reply_to_user_id,lang,place,possibly_sensitive,quote_id,retweet_count,retweet_id,retweet_screen_name,source,text,tweet_url,user_created_at,user_id,user_default_profile_image,user_description,user_favourites_count,user_followers_count,user_friends_count,user_listed_count,user_location,user_name,user_screen_name,user_statuses_count,user_time_zone,user_urls,user_verified
"-2.73915523,54.32386016",Sun Apr 11 15:27:22 +0000 2021,WhistleDance danceOutside Kendal StayLocal over50 Cumbria lockdown,,https://www.instagram.com/p/CNh9koNFU45/?igshid=1syur0qkbud3k,0,1381267637385183233,,,,en,"Kendal, England",false,,0,,,"<a href=""http://instagram.com"" rel=""nofollow"">Instagram</a>",#WhistleDance 184 in Fletcher Park #danceOutside #Kendal #StayLocal #over50 #Cumbria #lockdown @ Fletcher Park Kendal https://t.co/gPAXPLAaLl,https://twitter.com/LakesSingleMum/status/1381267637385183233,Tue Mar 10 20:22:05 +0000 2009,23647445,false,"Slow runner, teacher, mum - is there time for anything else? Oh maybe a bit of YouTube...",3986,4649,5114,182,cumbria,Becky Willoughby,LakesSingleMum,114327,,http://www.lakesmum.co.uk,false
"-2,54",Sun Apr 11 17:21:38 +0000 2021,LockDownOver CountryLiving Oxford,,https://www.instagram.com/p/CNiKvAEn1PA/?igshid=rimnv1c47xy1,0,1381296394384867331,,,,en,"Yorkshire and The Humber, England",false,,0,,,"<a href=""http://instagram.com"" rel=""nofollow"">Instagram</a>","Walked around Rose Lane to enjoy the day before lockdown’s over 🌸

#LockDownOver
#CountryLiving
#Oxford @ United Kingdom https://t.co/7mRTWvwyB2",https://twitter.com/theredlippie/status/1381296394384867331,Tue May 31 19:17:57 +0000 2011,308645692,false,,250,356,754,60,"England, United Kingdom",J O L L Y  M O L Y,theredlippie,12507,,http://www.theredlippieadventures.com,false
"72.8132093,21.18820316",Sun Apr 11 17:07:51 +0000 2021,,,https://www.instagram.com/p/CNiJFjoFNsF/?igshid=10svp3rwuonl2,0,1381292927754895365,,,,en,"सूरत, भारत",false,,0,,,"<a href=""http://instagram.com"" rel=""nofollow"">Instagram</a>",Corona warrior @ Mittal Enterprise https://t.co/D3BOMCcCRk,https://twitter.com/jchgfbhavikshah/status/1381292927754895365,Sat May 04 12:09:04 +0000 2013,1402156844,false,SURAT,2014,205,1324,0,surat,SURATISMYDREAMCITY Bhavik Shah,jchgfbhavikshah,583,,http://suratismydreamcity.in,false
"-0.77622837,53.39361924",Sun Apr 11 16:45:02 +0000 2021,,,https://www.businesslincolnshire.com/news/five-ways-you-can-support-local-businesses-after-lockdown/,0,1381287185723297798,,,,en,"Gainsborough, England",false,,0,,,"<a href=""https://www.hootsuite.com"" rel=""nofollow"">Hootsuite Inc.</a>","Five ways you can support local businesses after lockdown | News and Blogs | Business Lincolnshire 

https://t.co/qJewKxSeOh
@BusinessLincs",https://twitter.com/ViveLeSocialism/status/1381287185723297798,Wed Jul 19 21:17:10 +0000 2017,887783395635417088,false,♿️ Activist and member of @UKlabour @gmb_union @prospectunion @disabilitylab. Support @votesat16 and @electoralreform #NHS💙 #HeForShe #BLM✊🏿 #GoingForItDN,9511,1600,4991,3,United Kingdom,"Michael, Socialist🌹Vive la résistance✊🏻✊🏻",ViveLeSocialism,40345,,https://www.amazon.co.uk/dp/B0851LKD86/ref=cm_sw_r_tw_dp_U_x_uJtvEbCA30QDH,false
"-0.13608912,51.50413561",Sun Apr 11 17:05:33 +0000 2021,,,http://dlvr.it/RxRqMZ,0,1381292348424945666,,,,en,"London, England",false,,1,,,"<a href=""https://dlvrit.com/"" rel=""nofollow"">dlvr.it</a>","From Fire Island to Palm Springs, Hope for a Great Gay Summer of '21—But 'Hope Doesn't Pay the ...: England's coronavirus restrictions will be eased further on Monday, with pubs and restaurants allowed to serve customers outdoors. Hairdressers will ... https://t.co/61VTxe5EJo",https://twitter.com/StigmabaseO/status/1381292348424945666,Thu Apr 29 13:56:48 +0000 2010,138418838,false,Americas — United Kingdom  | Keeping up-to-date on global exclusion — Stigmabase is a canadian internet non-profit Initiative. Founded in 2010,0,4144,3743,262,Americas | United Kingdom,Stigmabase | ORG,StigmabaseO,1828444,,https://www.stigmabase.org/,false
"-122.7123501,45.3738009",Sun Apr 11 18:00:35 +0000 2021,,,https://www.instagram.com/p/CNiPMWalmbH/?igshid=1t21ynjza5hyc,1,1381306196179648513,,,,en,"Stafford, OR",false,,0,,,"<a href=""http://instagram.com"" rel=""nofollow"">Instagram</a>",Communion Covid-style @ Rolling Hills Community Church https://t.co/K2ASWFfGEM,https://twitter.com/helmsjulie/status/1381306196179648513,Thu Apr 09 00:09:00 +0000 2009,29863270,false,Walking one day at a time with Jesus.,2656,48,97,6,Oregon,Julie Helms,helmsjulie,1642,,,false
"-97.7475,30.2677",Sun Apr 11 19:13:00 +0000 2021,,,https://www.instagram.com/p/CNiXe4jhKsy/?igshid=14s85vbxtwrbv,0,1381324422200590338,,,,en,"Austin, TX",false,,0,,,"<a href=""http://instagram.com"" rel=""nofollow"">Instagram</a>","Two nerds met during a pandemic 6 months ago. This weekend we left the apartment to go out for the first time. Te quiero mucho, mi amor. 🖤 @ Austin, Texas https://t.co/cltZn2TyNf",https://twitter.com/Marillas_35/status/1381324422200590338,Mon May 20 03:07:43 +0000 2013,1442726888,false,Gamer. Photographer. Cosplayer.,48,35,245,0,,Maria Villacorta,Marillas_35,634,,https://www.etsy.com/shop/RdntDwnEvrytngAgency?ref=hdr_shop_menu,false
"-76.86713004,39.21434223",Sun Apr 11 19:00:45 +0000 2021,,,,6,1381321340553207812,,,,en,"Maryland, USA",,,0,,,"<a href=""https://www.hootsuite.com"" rel=""nofollow"">Hootsuite Inc.</a>",Are you closer to some of your friends &amp; family since COVID? Staying home did this for me. I also stayed home a lot when newly widowed but the difference this time was that all stayed home.,https://twitter.com/ConnectionsHope/status/1381321340553207812,Wed Feb 01 14:56:58 +0000 2017,826806553818779649,false,"Widow (before her time!), bringing hope to all those who have lost a loved one. Hope is on the way. you are not alone. https://t.co/wNlij0TpZQ",16325,4909,2208,31,"Washington, DC",Rachel G Greenberg,ConnectionsHope,18010,,https://www.facebook.com/connectionshope/,false
"-117.16091615,32.71402723",Sun Apr 11 18:33:32 +0000 2021,,,https://www.instagram.com/p/CNiS9udLvSc/?igshid=an6ftk6f1ms1,0,1381314490222972934,,,,en,"San Diego, CA",false,,0,,,"<a href=""http://instagram.com"" rel=""nofollow"">Instagram</a>","Quarantine Riding S02E21 - ""People Bowling and People Dodging"" @ Downtown San Diego https://t.co/IFSYM89C4h",https://twitter.com/snelson89/status/1381314490222972934,Wed Oct 13 16:59:03 +0000 2010,202257366,false,,1623,64,323,34,,Shane Nelson,snelson89,61138,,,false
"-68.79766377,44.80187988",Sun Apr 11 19:01:50 +0000 2021,,,https://www.census.gov/data-tools/demo/hhp/#/?measures=GVR&mapPeriodSelector=23&barChartPeriodSelector=23,0,1381321612692238342,Danman11011,1381298292319997957,42173153,en,"Bangor, ME",false,,0,,,"<a href=""http://tapbots.com/tweetbot"" rel=""nofollow"">Tweetbot for iΟS</a>",@Danman11011 80% of Mainers have said they will get the vaccine. https://t.co/8RZlTPf8h3 anecdotally even my most anti-vax contacts are getting it or have gotten it.,https://twitter.com/snappity/status/1381321612692238342,Mon Feb 04 16:19:44 +0000 2008,13053992,false,"Instructional Technologist in Higher Ed; teacher, geek, mama, wife, Mainer, Grand Laker by birth, Bangor City Councilor, lifelong learner. Views are my own.",6641,1714,988,93,"Bangor, ME",gretchen 💉 vaxed AND masked 💉schaefer,snappity,51742,,,false
"36.821945,-1.292066",Sun Apr 11 18:42:24 +0000 2021,,,https://www.reddit.com/r/Kenya/comments/mowijc/,0,1381316722653806598,,,,en,"Nairobi, Kenya",true,,0,,,"<a href=""https://twitter.com/hermoand"" rel=""nofollow"">Kenyans On Reddit</a>","✦ [ Pogba ]

I have a car and lots of free time, what's the ultimate road trip in this lockdown?

https://t.co/P2R0vV9MjF",https://twitter.com/KenyansOnReddit/status/1381316722653806598,Sun Jun 07 11:55:21 +0000 2020,1269598733878079488,false,"Come join your fellow Kenyans™ on Reddit 👉 https://t.co/jgE8q6ov1E 

- #TopReply
- #rKenyaModLog
- #RemovedByMods
- #DeletedByAuthor
- #rKenyaVideo",794,254,17,3,Nairobi,Kenyans On Reddit 🇰🇪,KenyansOnReddit,44877,,https://reddit.com/r/kenya,false
"77.22217788,28.63213091",Sun Apr 11 18:06:04 +0000 2021,Nifty Sipgrab UnitingPeopleWithThePossibilities,,http://dlvr.it/RxRxmH,0,1381307575262568448,,,,en,"नई दिल्ली, भारत",false,,0,,,"<a href=""https://dlvrit.com/"" rel=""nofollow"">dlvr.it</a>",Gujarat HC initiates suo motu PIL on COVID-19 'health emergency' in state https://t.co/ZzRUCeIFW1 #Nifty #Sipgrab #UnitingPeopleWithThePossibilities,https://twitter.com/sipgrab/status/1381307575262568448,Tue Feb 28 12:12:15 +0000 2017,836549573048848384,false,Wealth management firm| Option Trading Expert | Option Strategy maker| 360° financial planner | compelete range of financial products | Market buzz updater!!,272,267,94,2,"Bengaluru, India",SipGrab,sipgrab,43338,,http://www.Sipgrab.com,false
"-0.065,53.552",Sun Apr 11 20:00:52 +0000 2021,potraitphotographylincolnshire photographylincolnshire photographygrimsby,,https://www.instagram.com/p/CNic9SbpI0F/?igshid=15lrm62t07pgh,0,1381336468648570887,,,,en,"Grimsby, England",false,,0,,,"<a href=""http://instagram.com"" rel=""nofollow"">Instagram</a>",The journey starts here.  The first steps towards normality as lockdown eases. Special thanks to the George family. Beautiful people.  #potraitphotographylincolnshire #photographylincolnshire #photographygrimsby https://t.co/apHfHc6cWY,https://twitter.com/SGreenwoodUK/status/1381336468648570887,Thu Jan 20 22:14:49 +0000 2011,240853422,false,"Magician, Photographer, Vocalist, Musician and Actor",10,144,161,1,Cleethorpes,Steven Greenwood,SGreenwoodUK,803,,http://www.stevengreenwood.co.uk,false
"77.60032028,12.95268745",Sun Apr 11 18:36:05 +0000 2021,Nifty Sipgrab UnitingPeopleWithThePossibilities,,http://dlvr.it/RxS0lt,0,1381315130273632259,,,,en,"Bengaluru South, India",false,,0,,,"<a href=""https://dlvrit.com/"" rel=""nofollow"">dlvr.it</a>",IPL 2021: Once again tepid viewership on Disney Hotstar due to COVID curbs https://t.co/6hPhxvKsRO #Nifty #Sipgrab #UnitingPeopleWithThePossibilities,https://twitter.com/sipgrab/status/1381315130273632259,Tue Feb 28 12:12:15 +0000 2017,836549573048848384,false,Wealth management firm| Option Trading Expert | Option Strategy maker| 360° financial planner | compelete range of financial products | Market buzz updater!!,272,267,94,2,"Bengaluru, India",SipGrab,sipgrab,43338,,http://www.Sipgrab.com,false
"-81.25,42.9833",Sun Apr 11 19:25:27 +0000 2021,covid_19 covid history,,https://www.instagram.com/p/CNiY6BonTer/?igshid=1lb9bq9y7dxa7,0,1381327555580530695,,,,en,"London, Ontario",false,,0,,,"<a href=""http://instagram.com"" rel=""nofollow"">Instagram</a>","In 100 years, today will be history.
#covid_19 #covid #history @ London, Ontario https://t.co/ht3xoFF2pa",https://twitter.com/Dan_ONeail/status/1381327555580530695,Sun Dec 27 22:59:26 +0000 2009,99802405,false,Political Thespian. Public Speaker. #lndont #cdnpoli,12493,765,1274,76,Canada,Daniel O'Neail,Dan_ONeail,42939,,https://ecospective.wordpress.com/,false
"72.8764,19.0627",Sun Apr 11 17:40:28 +0000 2021,covid quarantinelife lockdowndiaries guitarcover masterofpuppets videooftheday,,https://www.instagram.com/p/CNiMSjuFWuo/?igshid=p8yyrlu9p51p,0,1381301135043100676,,,,en,"मुंबई, भारत",false,,0,,,"<a href=""http://instagram.com"" rel=""nofollow"">Instagram</a>","After a bout with #covid 🦠, feels good to let loose 🎸🤘🏻

#quarantinelife #lockdowndiaries #guitarcover @metallica #masterofpuppets #videooftheday 

🎸👉🏻 @officialibanezguitars @ Mumbai, Maharashtra https://t.co/1qHgODrnHi",https://twitter.com/Petrolhead_AC/status/1381301135043100676,Wed Nov 17 12:08:02 +0000 2010,216669729,false,"An amalgamation of a marketeer, a musician, a petrolhead and a foodie...Some say!",1252,179,309,31,Mumbai,Ananjan Chaudhuri,Petrolhead_AC,2085,,http://www.highwayandbeyond.com,false
"-115.1319961,36.07139224",Sun Apr 11 19:41:28 +0000 2021,kangamooplay vegaskids,,https://www.instagram.com/p/CNiavMphiL0/?igshid=nudvkw5t10qb,0,1381331584553349120,,,,en,"Paradise, NV",false,,0,,,"<a href=""http://instagram.com"" rel=""nofollow"">Instagram</a>",COME PLAY INDOORS! ▪️Temperature checks▪️10yrs+ older must wear Face Masks ▪️Adults: Please maintain 6’ social distancing ▪️OPEN MON-FRI 9AM-7PM ▪️ OPEN SAT-SUN 9AM-5PM #kangamooplay #vegaskids https://t.co/RvaE2fxSG6,https://twitter.com/kangamooplay/status/1381331584553349120,Tue Jun 30 01:28:00 +0000 2015,3260589566,false,"VEGAS MEGA Children's Indoor Playground, Slides, Trampolines, Parents' Lounge Free Massage Chairs Healthy Cafe, Check out our website for hours!",1073,1287,3106,19,1525 East Sunset Road ,Kangamoo Indoor Play,kangamooplay,3518,,http://www.kangamooplay.com,false
"-89.155,45.14416667",Sun Apr 11 17:33:21 +0000 2021,,,https://www.instagram.com/p/CNiMExss6iItJgsjzf6LN0bPxxhzZb72RNGABA0/?igshid=1uj08lexyy92z,0,1381299343492255746,,,,en,"Antigo, WI",false,,0,,,"<a href=""http://instagram.com"" rel=""nofollow"">Instagram</a>","Melanie and I scheduled our COVID-19 vaccines. @ Antigo, Wisconsin https://t.co/Yci72L5iIi",https://twitter.com/howitzer_1977/status/1381299343492255746,Mon Nov 18 20:32:18 +0000 2019,1196526492148289536,false,Fun-loving guy just living the life,1048,56,246,0,"Antigo, WI",Handy Man,howitzer_1977,1113,,,false
"-121.57053318,37.00748198",Sun Apr 11 19:39:05 +0000 2021,,https://twitter.com/1stChiroGilroy/status/1381330984986009601/photo/1,http://dlvr.it/RxS8BT,0,1381330984986009601,,,,en,"Gilroy, CA",false,,0,,,"<a href=""https://dlvrit.com/"" rel=""nofollow"">dlvr.it</a>",Vaccine Passports were the secret plan behind the totalitarian lockdowns all along https://t.co/yQcLfE9lep https://t.co/UHLeFp1pDn,https://twitter.com/1stChiroGilroy/status/1381330984986009601,Tue Aug 16 22:53:21 +0000 2016,765682887899226112,false,"Dr. Sam @ First Chiropractic in Gilroy, CA! 25+ Years of Back Pain Relief Expertise! Pls Call for Appts: (408) 848-6222 - 7461 Eigleberry St. Gilroy, CA 95020",8,20,42,1,"Gilroy, CA",Sam Nijmeh,1stChiroGilroy,3223,,http://FirstChiropractic.co,false
"-6.26174338,53.34411666",Sun Apr 11 18:35:03 +0000 2021,,https://twitter.com/RebelDublin/status/1381314872105869312/photo/1,http://dlvr.it/RxS0Yw,0,1381314872105869312,,,,en,"Dublin City, Ireland",false,,0,,,"<a href=""https://dlvrit.com/"" rel=""nofollow"">dlvr.it</a>",Woman who travelled from Israel to Ireland permitted to leave mandatory hotel quarantine: Israel has been removed from countries on the mandatory hotel quarantine list. https://t.co/Jmi6u4mBRg https://t.co/D279zj2tmv,https://twitter.com/RebelDublin/status/1381314872105869312,Tue Feb 23 15:00:23 +0000 2016,702145987217899520,false,"Discover all about our beloved Dublin from Ireland's history to tourist attractions... humorously.
Use the Hashtag #RebelDublin",34,276,53,14,"Dublin City, Ireland",Rebel Dublin,RebelDublin,8601,,http://rebeldublin.ie,false
"16.89005462,51.28791776",Sun Apr 11 19:04:01 +0000 2021,vaccine password 5G,,https://www.instagram.com/p/CNiWdAJrKaZ/?igshid=1tviufobkomao,2,1381322161277788167,,,,en,"Oborniki Śląskie, Polska",false,,0,,,"<a href=""http://instagram.com"" rel=""nofollow"">Instagram</a>",Remember not to publish the lot of your #vaccine! This is the #password for the #5G hot spot in the chip!😂🤣😂 w: Oborniki Śląskie gmina https://t.co/qFNQ9f3h79,https://twitter.com/MacWyznawca/status/1381322161277788167,Sun Jul 03 08:24:33 +0000 2011,328389316,false,"Apple user since 1991 😉 Subiektywne o technologiach i reszcie życia. #Rower, psy, #HomeKit, programowanie #iOS, #macOS. #mikrokontrolery #Clang  @LuON_PL",72264,3112,666,149,Osolin,Jaromir Kopp,MacWyznawca,69576,,https://luon.me,false
"-3.01898745,51.57730006",Sun Apr 11 17:32:20 +0000 2021,,,https://www.instagram.com/p/CNiL9cVBMfD/?igshid=c2kp2d66uyp7,0,1381299086448586753,,,,en,"Newport, Wales",false,,0,,,"<a href=""http://instagram.com"" rel=""nofollow"">Instagram</a>","Hours away... see you at reception Ladies 🤍

Wow seems so surreal returning to our clients! *previous Covid restrictions still apply @ Beau Belle https://t.co/gjfEHiFAI1",https://twitter.com/beaubellesalon/status/1381299086448586753,Sun Jul 03 10:37:11 +0000 2011,328428548,false,,162,186,104,7,"Newport, Wales",Beau Belle,beaubellesalon,3042,,,false
"39.150318,21.670473",Sun Apr 11 19:02:02 +0000 2021,,,https://www.swarmapp.com/c/f3Wid2GWSUr,0,1381321663510417424,,,,en,"جدة, المملكة العربية السعودية",false,,0,,,"<a href=""http://foursquare.com"" rel=""nofollow"">Foursquare</a>","💉 (@ COVID-19 Vaccine Center in Jeddah, Makkah w/ @s_ammari) https://t.co/YFIZkSRK42",https://twitter.com/_iFno/status/1381321663510417424,Sat Jul 31 00:49:16 +0000 2010,172941827,false,مكاوية ، اتحادية ، مدريدية ، مزاجية جداً ، وألطف مما تتوقع ، أحاول دائماً أن أترك أثراً طيباً في هذه الحياة ♥️ @_iFno .: Instagram,826,1084,920,10,Makkah Al Mukarramah,Āғиәи 🐯♈️♥️',_iFno,78812,,https://iFnosha.sarahah.com,false
"-122.7756216,45.5064511",Sun Apr 11 18:05:35 +0000 2021,,https://twitter.com/EarlPdxPearl/status/1381307454072385536/photo/1,http://dlvr.it/RxRxfS,0,1381307454072385536,,,,en,"West Slope, OR",false,,1,,,"<a href=""https://dlvrit.com/"" rel=""nofollow"">dlvr.it</a>",40% of Marines Decline Covid ‘Vaccine’ As Globalists Go Berserk https://t.co/7JJcw7HaUc https://t.co/3n8ZiwZuv0,https://twitter.com/EarlPdxPearl/status/1381307454072385536,Wed Aug 12 02:52:34 +0000 2009,64914137,false,"Oregon Republican Christian Conservative focused on truth about Left Wing Radical @RepBlumenauer ,   #Trump Supporter.  #DrainTheSwamp",27,18708,22446,353,"Portland, OR",Earl Pearl,EarlPdxPearl,49318,,http://www.judicialwatch.org/,false
"-77.04722222,38.80472222",Sun Apr 11 18:37:58 +0000 2021,,,https://www.instagram.com/p/CNiTeSnFlDR/?igshid=8i50kcvo66pw,0,1381315604532056066,,,,en,"Alexandria, VA",false,,0,,,"<a href=""http://instagram.com"" rel=""nofollow"">Instagram</a>","Just got my J&amp;J COVID-19 vaccine. One and Done! @ Alexandria, Virginia https://t.co/Z9SywcBJh7",https://twitter.com/KellyDuBose/status/1381315604532056066,Fri Sep 18 15:40:45 +0000 2009,75310043,false,"I am beholden to none! Okay, well, maybe my dog & 2 cats...",35537,180,490,8,NoVA / DC,Kelly DuBose,KellyDuBose,4631,,,false
"-80.07093294,43.25497286",Sun Apr 11 18:13:02 +0000 2021,,,https://www.instagram.com/p/CNiQnr9H3xYJdsKKAdpjRi6Ba1GJxUnpIVt_6A0/?igshid=phb6xbi2vkce,0,1381309331644297217,,,,en,"Hamilton, Ontario",false,,0,,,"<a href=""http://instagram.com"" rel=""nofollow"">Instagram</a>",Love’n the new COVID Flag Sticks @copetownwoods @ Copetown Woods Golf Club https://t.co/GuhorKI3e7,https://twitter.com/BlinkhornEric/status/1381309331644297217,Fri Feb 01 01:01:39 +0000 2019,1091139480294174720,false,Professional Accountant #CPA; #BlueJays and #Blackhawks fan; #Golf; and crazy about my #Cats.,4210,55,555,0,"Dundas, Ontario",Eric Blinkhorn,BlinkhornEric,556,,,false
"-119.45396,49.87675",Sun Apr 11 18:21:28 +0000 2021,vaccine vaxxed vax provax provaxxer pfizer pfizervacine theendisinsight,,https://www.instagram.com/p/CNiRlQMLZyN/?igshid=1i34n1m3cc1ev,1,1381311450866667524,,,,en,"Kelowna, British Columbia",false,,0,,,"<a href=""http://instagram.com"" rel=""nofollow"">Instagram</a>",Woohoo!  Just got my first dose of the Pfizer vaccine!  I can get my second dose in August.  #vaccine #vaxxed💉 #vax #provax #provaxxer #pfizer #pfizervacine #theendisinsight @ Trinity Church Kelowna https://t.co/6V7AkvpYie,https://twitter.com/trikucian/status/1381311450866667524,Sat Apr 30 08:48:11 +0000 2011,290446107,false,"Software developer, amatuer author, and tae kwon do enthusiast.",4107,391,930,23,Kelowna,Jessica 🍁,trikucian,4310,,,false
"-2,54",Sun Apr 11 17:38:33 +0000 2021,covid_19 hopeforthefuture everythingitsgonnabealright thanksnhs,,https://www.instagram.com/p/CNiMrBSn9NdroRYYq3lGAQEqRlP_kPBlyi_rJ00/?igshid=vixp9gwy8odt,0,1381300651720896513,,,,en,"Yorkshire and The Humber, England",false,,0,,,"<a href=""http://instagram.com"" rel=""nofollow"">Instagram</a>","I’ve had my #covid_19 vaccination 💉 @astrazeneca 
#hopeforthefuture #everythingitsgonnabealright #thanksnhs❤️🇬🇧 @ United Kingdom https://t.co/KuL7LA23rt",https://twitter.com/cafdec/status/1381300651720896513,Sun Dec 06 04:30:45 +0000 2009,94933993,false,Sou Portugues a viver no Reino Unido desde 2000,371,74,491,6,"Soham, Cambridgeshire, UK",Carlos de Carvalho,cafdec,11188,,,false
"-2.50153743,52.63162952",Sun Apr 11 18:59:05 +0000 2021,,,https://j.mp/3dDfYLC,0,1381320917800808448,,,,en,"Ironbridge, England",false,,0,,,"<a href=""https://dlvrit.com/"" rel=""nofollow"">dlvr.it</a>",Covid-19 in the UK: How many coronavirus cases are there in your area? https://t.co/CHZhSuqnQI,https://twitter.com/DailySHROPSHIRE/status/1381320917800808448,Sun May 06 13:29:20 +0000 2012,572628941,false,"All of the latest news, sport, and updates from the county of Shropshire (or Salop), UK",24,4573,1063,78,"Shropshire (Salop), UK",SHROPSHIRE,DailySHROPSHIRE,49947,,https://twitter.com/dailyshropshire,false
"77.22217788,28.63213091",Sun Apr 11 17:44:05 +0000 2021,Nifty Sipgrab UnitingPeopleWithThePossibilities,,http://dlvr.it/RxRvRj,0,1381302043491540993,,,,en,"नई दिल्ली, भारत",false,,0,,,"<a href=""https://dlvrit.com/"" rel=""nofollow"">dlvr.it</a>",Govt will be forced to go for strict measures if people do not follow COVID protocols: Rajasthan CM https://t.co/aUca5ytmje #Nifty #Sipgrab #UnitingPeopleWithThePossibilities,https://twitter.com/sipgrab/status/1381302043491540993,Tue Feb 28 12:12:15 +0000 2017,836549573048848384,false,Wealth management firm| Option Trading Expert | Option Strategy maker| 360° financial planner | compelete range of financial products | Market buzz updater!!,272,267,94,2,"Bengaluru, India",SipGrab,sipgrab,43338,,http://www.Sipgrab.com,false
"-79.32946,43.83",Sun Apr 11 19:51:55 +0000 2021,,,https://www.instagram.com/p/CNib70wBiUd/?igshid=5qghmf6gogxu,0,1381334217192169474,,,,en,"Markham, Ontario",false,,0,,,"<a href=""http://instagram.com"" rel=""nofollow"">Instagram</a>",Got my vaccine 💉 today! Good to go! @ Baby Car Seat Installers https://t.co/O7PL8eXWy1,https://twitter.com/BabyCSI/status/1381334217192169474,Thu Feb 24 08:02:30 +0000 2011,256884965,false,"#CarSeatChecks, mobile #CarSeatInstalltions in #Toronto #GTA. #ChildPassengerSafety #CERTIFIED #CPST #FreeCarSeatAdvice Call 416.882.4248",1990,1277,1322,44,Greater Toronto Area,BabyCarSeatInstaller,BabyCSI,10858,,http://www.carseatinstallers.com,false
"-0.07939436,51.47496745",Sun Apr 11 17:58:28 +0000 2021,,,https://www.instagram.com/p/CNiO80lLT6N/?igshid=1fdwgpsch7wzo,0,1381305663469592589,,,,en,"Camberwell, London",false,,0,,,"<a href=""http://instagram.com"" rel=""nofollow"">Instagram</a>","Arrived London 2days ago, on my way to quarantine! Masks on hand back immediately after pic😷😅❤️ @ London, Unιted Kingdom https://t.co/7e4jDjze5I",https://twitter.com/sp_shagari/status/1381305663469592589,Wed Aug 08 05:40:24 +0000 2012,744524796,false,Kasim...Medical Doctor...advocate of justice and good health to the world. Active politician too ofcourse. There's taste of everything here,13,741,240,0,London UK,Espee Shagari (Dr. Kasim Umar),sp_shagari,480,,,false
"-95.9924,36.1502",Sun Apr 11 19:31:58 +0000 2021,nationalpetday,,https://www.instagram.com/p/CNiZpscDbGR/?igshid=xm3nh9jni8iz,1,1381329195750592517,,,,en,"Tulsa, OK",false,,0,,,"<a href=""http://instagram.com"" rel=""nofollow"">Instagram</a>","Miss Amy with her Covid haircut. I am not a groomer and thank the gods for that. Good thing she cant speak or she would totally Karen my cut job. 
I do have more pets so be prepared for some pictures!
#nationalpetday https://t.co/kosh5USw0h",https://twitter.com/RebelOtakuchan/status/1381329195750592517,Fri Apr 04 03:22:43 +0000 2008,14299461,false,"Pro LGBTQ, Pro Choice, Feminist, Cat Loving, Neo Pagan, Fat, Hetro, CIS girl who doesn't have time for your 💩.  (She/Her)",17671,191,550,10,Oklahoma,reвylreвyl 💙🏳️‍🌈💉,RebelOtakuchan,35428,,,false
"-79.7164011,43.7742911",Sun Apr 11 19:07:07 +0000 2021,India NEWS,,http://dlvr.it/RxS3rz,0,1381322939929260036,,,,en,"Brampton, Ontario",false,,1,,,"<a href=""https://dlvrit.com/"" rel=""nofollow"">dlvr.it</a>","Quarantine for travelers without -ve report in Chhattisgarh: Chhatisgarh Chief Minister Bhupesh Baghel has sent senior officials to Hyderabad and Maharashtra to ensure smooth supply of Remdesivir, a key anti-viral drug in the fight against… https://t.co/gWhengixRb #India #NEWS",https://twitter.com/Weeklyvoice/status/1381322939929260036,Tue Mar 30 17:43:21 +0000 2010,127943720,false,Most Trusted News in North America’s South Asian Communities Since 1997,172,494,299,11,Toronto,Weekly Voice,Weeklyvoice,37078,,http://www.Weeklyvoice.com,false
