coordinates,created_at,hashtags,media,urls,favorite_count,id,in_reply_to_screen_name,in_reply_to_status_id,in_reply_to_user_id,lang,place,possibly_sensitive,quote_id,retweet_count,retweet_id,retweet_screen_name,source,text,tweet_url,user_created_at,user_id,user_default_profile_image,user_description,user_favourites_count,user_followers_count,user_friends_count,user_listed_count,user_location,user_name,user_screen_name,user_statuses_count,user_time_zone,user_urls,user_verified
"80.28288778,13.0808304",Sun Apr 11 21:14:34 +0000 2021,Nifty Sipgrab UnitingPeopleWithThePossibilities,,http://dlvr.it/RxSKFs,0,1381355013952270336,,,,en,"Fort Tondiarpet, India",false,,0,,,"<a href=""https://dlvrit.com/"" rel=""nofollow"">dlvr.it</a>",Covid variant from South Africa was able to ‘break through’ Pfizer vaccine in Israeli study https://t.co/QzCChIGtaD #Nifty #Sipgrab #UnitingPeopleWithThePossibilities,https://twitter.com/sipgrab/status/1381355013952270336,Tue Feb 28 12:12:15 +0000 2017,836549573048848384,false,Wealth management firm| Option Trading Expert | Option Strategy maker| 360° financial planner | compelete range of financial products | Market buzz updater!!,272,267,94,2,"Bengaluru, India",SipGrab,sipgrab,43338,,http://www.Sipgrab.com,false
"77.65212771,12.8898216",Sun Apr 11 22:23:03 +0000 2021,Nifty Sipgrab UnitingPeopleWithThePossibilities,,http://dlvr.it/RxSRhC,0,1381372250801119235,,,,en,"Bengaluru South, India",false,,0,,,"<a href=""https://dlvrit.com/"" rel=""nofollow"">dlvr.it</a>",The New York Post: Blinken blasts China for lack of transparency in early days of pandemic https://t.co/FqR4v8uASk #Nifty #Sipgrab #UnitingPeopleWithThePossibilities,https://twitter.com/sipgrab/status/1381372250801119235,Tue Feb 28 12:12:15 +0000 2017,836549573048848384,false,Wealth management firm| Option Trading Expert | Option Strategy maker| 360° financial planner | compelete range of financial products | Market buzz updater!!,272,267,94,2,"Bengaluru, India",SipGrab,sipgrab,43338,,http://www.Sipgrab.com,false
"-79.34264475,43.73718637",Sun Apr 11 21:17:50 +0000 2021,squirrel peanuts snacks sundaymorning rainyday covid19 spring2021 toronto donmills,,https://www.instagram.com/p/CNilxL8BR8G/?igshid=m1fpht1nc4zx,0,1381355837327818758,,,,en,"Toronto, Ontario",false,,0,,,"<a href=""http://instagram.com"" rel=""nofollow"">Instagram</a>","Sunday Snacks 🥜🐿 🥜🐿
#squirrel #peanuts #snacks #sundaymorning #rainyday #covid19 #spring2021 #toronto #donmills @ Don Mills https://t.co/yHjIt3sx6A",https://twitter.com/JanisIlekys/status/1381355837327818758,Mon Jun 20 16:10:58 +0000 2011,320832591,false,"Foodie who ❤ loves cook (2nd life goals)
   Crohn's Disease fighter 💜 #findacure
                  Fur baby momma 💚 #crazycatlady",8974,245,1077,27,"Toronto, Ontario",Janis,JanisIlekys,7646,,,false
"-121.45749,38.630911",Sun Apr 11 21:03:06 +0000 2021,,,https://www.swarmapp.com/c/85L5pnxKGF2,1,1381352127478530048,,,,en,"Sacramento, CA",false,,0,,,"<a href=""http://foursquare.com"" rel=""nofollow"">Foursquare</a>","First Vaccine Dose! (@ Robertson Community Center in Sacramento, CA) https://t.co/eBxzkEwA5Z",https://twitter.com/yayiebuenviaje/status/1381352127478530048,Wed Dec 31 14:50:31 +0000 2008,18507439,false,Middle child.,3628,357,182,9,"Sacramento, CA",Yayie Buenviaje,yayiebuenviaje,17651,,,false
"-80.4989,42.8525",Sun Apr 11 22:44:49 +0000 2021,nurselife nursesofinstagram covid_19,,https://www.instagram.com/p/CNivuH1J-zi/?igshid=d49ndxs8js7y,0,1381377726922203137,,,,en,"Norfolk County, Ontario",false,,0,,,"<a href=""http://instagram.com"" rel=""nofollow"">Instagram</a>","Hi there! #nurselife #nursesofinstagram #covid_19 @ Delhi, Ontario https://t.co/sHKUVBKxz3",https://twitter.com/NurseTagan/status/1381377726922203137,Fri Apr 17 09:47:56 +0000 2009,32356902,false,Happily married with 2 children. I battle against Sarcoidosis. #sarcoidosis #autism #Norfolkcounty #PortDover,3779,123,438,3,"Norfolk County, Ontario",Tagan Lombardo,NurseTagan,2141,,,false
"-73.56725453,45.75975883",Sun Apr 11 22:05:03 +0000 2021,,,http://dlvr.it/RxSP8S,0,1381367720319455241,,,,en,"Mascouche, Québec",false,,0,,,"<a href=""https://dlvrit.com/"" rel=""nofollow"">dlvr.it</a>",Fighting Stigma: Eamon Ryan: People vaccinated against Covid-19 may be able to skip hotel quarantine in future: An Israeli healthcare worker who has been vaccinated and arrived in Ireland with proof of a negative ... “We still have to wait for health… https://t.co/aIgmfsXW9F,https://twitter.com/StigmabaseN/status/1381367720319455241,Wed Sep 15 15:55:47 +0000 2010,191092262,false,Ireland — Scotland — Inuit —  Svenska  | Keeping up-to-date on global exclusion — Stigmabase is a canadian internet non-profit Initiative,0,1611,1297,110,Ireland | Scotland | Inuit | Skandinavien,Stigmabase | NORDIC,StigmabaseN,951942,,https://www.stigmabase.org/,false
"-72.98925756,41.25833151",Sun Apr 11 22:17:16 +0000 2021,covid_19 crushcovid,,https://www.instagram.com/p/CNiskfeFOFR/?igshid=1oiqvf22hpwbj,0,1381370794731831296,BiontechPfizer,,1361253225597386800,en,"West Haven, CT",false,,0,,,"<a href=""http://instagram.com"" rel=""nofollow"">Instagram</a>",@biontechpfizer #covid_19 #crushcovid jab #1 💉✅ @ Yale West Campus https://t.co/t4q7kk3O0C,https://twitter.com/JJPikachu/status/1381370794731831296,Mon Mar 19 00:34:42 +0000 2007,1456131,false,I work in a digital world | I live in a digital world | I love good wine and scotch | I am a foodie | I play life with the cards that I am dealt!,30483,1276,3231,79,"Norwalk, CT",Jayant J Pichamuthu,JJPikachu,11346,,http://www.linkedin.com/in/jayp1117,false
"-4.309626,55.852472",Sun Apr 11 20:33:12 +0000 2021,,,http://news.sky.com/story/covid-19-heading-to-a-beer-garden-next-week160changes-have-been-made-to-the-nhs-test-and-trace-app-12268464,0,1381344606391050240,,,,en,"Glasgow, Scotland",false,,1,,,"<a href=""http://oysttyer.github.io/oysttyer/"" rel=""nofollow"">oysttyer</a>",💾 ⓈⓀⓎ ⓉⒺⒸⒽ Changes to NHS Test and Trace app mean everyone will now have to check in - https://t.co/pduAT3XFmB,https://twitter.com/_cirrus_minor_/status/1381344606391050240,Sat Sep 12 16:02:12 +0000 2009,73672052,false,"Most days  i'm a bot who resides in a Raspberry Pi Model B, cron  and #!/bin/bash are my best pals. Every other Saturday i  frequent the Penny Arcade. #watp",586,943,1326,175,"46.869100,103.848242",OnFileNotWanted,_cirrus_minor_,400301,,http://cirrusuk.wordpress.com,false
"77.64018231,12.91325076",Sun Apr 11 22:06:33 +0000 2021,Nifty Sipgrab UnitingPeopleWithThePossibilities,,http://dlvr.it/RxSPTv,0,1381368098112954370,,,,en,"Bengaluru South, India",false,,0,,,"<a href=""https://dlvrit.com/"" rel=""nofollow"">dlvr.it</a>",Equity Strategy: Covid wave likely to affect the recovery https://t.co/ct3wThhedT #Nifty #Sipgrab #UnitingPeopleWithThePossibilities,https://twitter.com/sipgrab/status/1381368098112954370,Tue Feb 28 12:12:15 +0000 2017,836549573048848384,false,Wealth management firm| Option Trading Expert | Option Strategy maker| 360° financial planner | compelete range of financial products | Market buzz updater!!,272,267,94,2,"Bengaluru, India",SipGrab,sipgrab,43338,,http://www.Sipgrab.com,false
"-79.7913,36.0731",Sun Apr 11 21:43:19 +0000 2021,thankfulgratefulblessed covid_19 ᴠᴀᴄᴄɪɴᴇssᴀᴠᴇʟɪᴠᴇs vaccinationdone,,https://www.instagram.com/p/CNiorrfMAcA/?igshid=1mvg3lrcdv4uj,0,1381362251702079488,,,,en,"Greensboro, NC",false,,0,,,"<a href=""http://instagram.com"" rel=""nofollow"">Instagram</a>","We got it twice! 💉 

#thankfulgratefulblessed #covid_19 #ᴠᴀᴄᴄɪɴᴇssᴀᴠᴇʟɪᴠᴇs #vaccinationdone✔️ @ Greensboro, North Carolina https://t.co/E81soYXc9S",https://twitter.com/vlvdesigns/status/1381362251702079488,Thu Apr 12 03:22:52 +0000 2012,551613465,false,Designer| #designyourlife #lifes2short find an excuse to celebrate! #interiordesign #painting#wine https://t.co/DtlEOx6uVz,5,92,168,0,North Carolina,VLV Designs,vlvdesigns,559,,https://www.vlvdesigns.net/,false
"-122.20606,37.47891",Sun Apr 11 22:03:20 +0000 2021,covıd19 vaccine rwc redwoodcity sanmateocounty covid,,https://www.instagram.com/p/CNiq9-Bjg1XzPyoJP1EBRUYgBDEDZ_4vG628FY0/?igshid=1uzt98eee92hy,1,1381367285579980804,,,,en,"North Fair Oaks, CA",false,,0,,,"<a href=""http://instagram.com"" rel=""nofollow"">Instagram</a>",This guy just got the #covıd19 #vaccine... Woo hoo! 💪🏼They are taking walk-ins until they run out. Get yours! 😁 #rwc #redwoodcity #sanmateocounty #covid @ Fair Oaks Elementary https://t.co/PVT39zrRXT,https://twitter.com/WillStrohl/status/1381367285579980804,Wed Oct 22 01:48:59 +0000 2008,16898243,false,"Founder & CEO at @UpendoVentures. 
Leader, speaker, author, and developer, among other things... 
#DNNCMS #SoftwareDevelopment #OSS #SanCarlosCA",1285,2649,1434,185,"San Carlos, CA",Will Strohl,WillStrohl,25548,,https://upendoventures.com,false
"-118.28616858,34.0225754",Sun Apr 11 22:00:47 +0000 2021,,,http://carbonhealth.com https://www.instagram.com/p/CNiqroJFEcz/?igshid=q8e71lbd8e31,0,1381366645076156419,,,,en,"Los Angeles, CA",false,,0,,,"<a href=""http://instagram.com"" rel=""nofollow"">Instagram</a>",Vaccines are now available to everyone over the age of 16 in the L.A. area! Go to https://t.co/WeBqdjWG2Q to make your appointment. @ University of Southern California https://t.co/YTWZWp7SbL,https://twitter.com/trojandemocrats/status/1381366645076156419,Fri May 07 17:44:07 +0000 2010,141288664,false,"The kids are, in fact, alright. Local College Democrats branch at the University of Southern California. Got a question? Email us at info@trojandemocrats.org",236,746,656,14,"Los Angeles, CA",Trojan Democrats,trojandemocrats,1075,,https://www.trojandemocrats.org/,false
"-0.77625155,53.39355453",Sun Apr 11 21:45:03 +0000 2021,excluded ExcludedUK,https://twitter.com/phoenixprodev/status/1381362687230218244/photo/1,https://www.gofundme.com/f/24nnv3qqw0,0,1381362687230218244,,,,en,"Gainsborough, England",false,,0,,,"<a href=""https://www.hootsuite.com"" rel=""nofollow"">Hootsuite Inc.</a>","Please make a donation to support me.

I was #excluded from all of the UK government’s Covid-19 financial support &amp; have been unable to work since the 23rd March 2020.

Any donations will be gratefully received.

Thank you.

https://t.co/XEgWlbsTwu

#ExcludedUK https://t.co/dPqB7yz2MB",https://twitter.com/phoenixprodev/status/1381362687230218244,Sat Jul 30 20:33:50 +0000 2016,759487187595460608,false,"Phoenix Professional Development ™ is a UK based professional development consultancy providing mentoring, CV writing and tutoring. DM for further info.",2645,1465,4501,9,"Gainsborough, England",Phoenix Professional Development ™,phoenixprodev,20382,,,false
"-122.4508534,37.72532525",Sun Apr 11 20:34:42 +0000 2021,,,https://www.instagram.com/p/CNig1FUh3zL/?igshid=rxrdxj1an70b,3,1381344979872845827,,,,en,"San Francisco, CA",false,,0,,,"<a href=""http://instagram.com"" rel=""nofollow"">Instagram</a>",First COVID-19 vaccine dose complete! Back in 4 weeks for round 2 💉 @ City College of San Francisco https://t.co/vwRMfiln3D,https://twitter.com/catsynth/status/1381344979872845827,Sun Oct 05 17:04:54 +0000 2008,16603418,false,"Music, art, cats, and whatever else I feel like writing about. https://t.co/ht2MRHylI9 and https://t.co/o8ixQsgCe5 😺 🎹 (she/her)",55394,1412,1296,83,"San Francisco, California, USA",CatSynth / amanda c,catsynth,43037,,http://www.catsynth.com,false
"77.65212771,12.8898216",Sun Apr 11 22:07:04 +0000 2021,Nifty Sipgrab UnitingPeopleWithThePossibilities,,http://dlvr.it/RxSPbt,0,1381368226160934914,,,,en,"Bengaluru South, India",false,,0,,,"<a href=""https://dlvrit.com/"" rel=""nofollow"">dlvr.it</a>",The New York Post: Blinken blasts China for lack of transparency in early days of pandemic https://t.co/5xGmJ3xQVY #Nifty #Sipgrab #UnitingPeopleWithThePossibilities,https://twitter.com/sipgrab/status/1381368226160934914,Tue Feb 28 12:12:15 +0000 2017,836549573048848384,false,Wealth management firm| Option Trading Expert | Option Strategy maker| 360° financial planner | compelete range of financial products | Market buzz updater!!,272,267,94,2,"Bengaluru, India",SipGrab,sipgrab,43338,,http://www.Sipgrab.com,false
"-118.29274521,33.87318269",Sun Apr 11 22:21:25 +0000 2021,krispykreme krispykremedoughnuts doughnuts donut,,https://www.instagram.com/p/CNitCu1JLGe/?igshid=dbtpxkm2u6d3,1,1381371837360267273,,,,en,"Gardena, CA",false,,0,,,"<a href=""http://instagram.com"" rel=""nofollow"">Instagram</a>",FREE Krispy Kreme Doughnut for showing my vaccine card 🍩🤤 #krispykreme #krispykremedoughnuts #doughnuts #donut @ Krispy Kreme Doughnuts https://t.co/82EqJxURsA,https://twitter.com/aarree/status/1381371837360267273,Tue Jan 27 19:22:57 +0000 2009,19609851,false,"Photographer,SocialMedia,Foodie,Techie,Whiskey fan, #SternShow fan,IG @aarree,& sports fan: PIT Steelers,ANA Ducks,LA Angels,LAFC,OCSC #aarree",2411,1055,944,84,"LA & Orange County, CA",Albert Evangelista ,aarree,25363,,https://linktr.ee/aarree,false
"-79.06433,43.10664",Sun Apr 11 22:35:15 +0000 2021,niagrafalls niagrafallscanada niagrafallsnewyork Canada USA Waterfalls water,,https://www.instagram.com/p/CNiuoLAl9Fo/?igshid=5evp9z2c2bz3,0,1381375318649405440,,,,en,"Niagara Falls, Ontario",false,,0,,,"<a href=""http://instagram.com"" rel=""nofollow"">Instagram</a>",View of Niagara Falls from the Canadian side just before the lockdown. You can also see the American side too 🍁🇨🇦🌊 #niagrafalls #niagrafallscanada #niagrafallsnewyork #Canada #USA #Waterfalls #water https://t.co/5vJeLHYmZK,https://twitter.com/nikklatoya/status/1381375318649405440,Sun Dec 10 20:18:41 +0000 2017,939952531484094466,false,Keyboardist l Composer l Music Instructor l nikklatoyaproductions@gmail.com l +14168244425,911,52,48,0,"Toronto, Ontario",Nicole l Nikk Latoya Productions,nikklatoya,487,,https://nikklatoya.com,false
"0.2844186,50.7685807",Sun Apr 11 20:32:22 +0000 2021,higginsandco covid eastbournetattoo eastbournetattooer,,https://www.instagram.com/p/CNigkE6LG0h/?igshid=9h8jb9ew8p3e,0,1381344395329437702,,,,en,"Eastbourne, England",false,,0,,,"<a href=""http://instagram.com"" rel=""nofollow"">Instagram</a>","Looking forward to seeing you all again , let’s take some simple steps to ensure everyone’s safety 
Thanks 
Chris x

#higginsandco #covid #eastbournetattoo #eastbournetattooer @ Higgins &amp; Co Tattoo https://t.co/pBl2NR3mH0",https://twitter.com/higginstattoo/status/1381344395329437702,Thu Sep 15 19:08:20 +0000 2011,374124542,false,Polynesian/black work tattoo specialist -instagram -higginsandco and chrishigginstattoo,289,386,339,5,"Eastbourne,sussex",chris higgins,higginstattoo,4968,,http://higginsandcotattoo.co.uk,false
"-81.46277525,28.51529982",Sun Apr 11 21:27:19 +0000 2021,covidvacccine,,https://www.instagram.com/p/CNim2e0BxxO/?igshid=ifuwh9z4ysa6,0,1381358221798088709,,,,en,"Orlando, FL",false,,0,,,"<a href=""http://instagram.com"" rel=""nofollow"">Instagram</a>",Got my first vaccine today! Didn’t even feel it. Joy at the Walmart on Kirkman is wonderful and very good at her job. ⭐️⭐️⭐️⭐️⭐️ #covidvacccine @ Walmart Orlando - S Kirkman Rd https://t.co/xHy7KEnOcw,https://twitter.com/graciesue94/status/1381358221798088709,Thu Aug 06 17:29:31 +0000 2009,63489063,false,“God help and forgive me. I wanna build something that’s gonna outlive me”|| Creative Soul married to the love of my life,3921,229,1333,3,"Orlando, FL",Just a Fan Account™️,graciesue94,2169,,https://linktr.ee/cyrdesignshop,false
"-123.075733,49.312229",Sun Apr 11 21:56:17 +0000 2021,quarantinelife nobake lazysunday,,https://www.instagram.com/p/CNiqKudMG9w/?igshid=1i99rm6yskmbx,3,1381365511938834434,,,,en,"North Vancouver, British Columbia",false,,0,,,"<a href=""http://instagram.com"" rel=""nofollow"">Instagram</a>","Quarantine Day 3: feeling fatigued today, had high hopes for getting some stuff done but I managed to make some no-bake energy bites recommended by @heatherspon 

#quarantinelife #nobake #lazysunday @ Lower Lonsdale https://t.co/wVv6kpvyFq",https://twitter.com/bmeckie/status/1381365511938834434,Tue Mar 24 04:56:07 +0000 2009,26181059,false,The Awkward Becky. Travel enthusiast. Organizer & Planner. Cat mom. Candy lover. Nerdy crafter. Island girl. IBS haver.,3062,1216,1063,127,North Vancouver,Becky Knight 😷,bmeckie,35384,,https://about.me/beckyknight,false
"-79.7164011,43.7742911",Sun Apr 11 20:36:04 +0000 2021,Canada Ontario,,http://dlvr.it/RxSFtP,0,1381345326972370945,,,,en,"Brampton, Ontario",false,,1,,,"<a href=""https://dlvrit.com/"" rel=""nofollow"">dlvr.it</a>","‘Schools Will Remain Open’: TORONTO: The Ontario government is introducing new measures to protect schools against COVID-19 which include refresher training, enhanced cleaning and asymptomatic testing. As these new measures are being… https://t.co/S9c6Qfx0if #Canada #Ontario",https://twitter.com/Weeklyvoice/status/1381345326972370945,Tue Mar 30 17:43:21 +0000 2010,127943720,false,Most Trusted News in North America’s South Asian Communities Since 1997,172,494,299,11,Toronto,Weekly Voice,Weeklyvoice,37078,,http://www.Weeklyvoice.com,false
"-0.7762196,53.39363918",Sun Apr 11 21:45:03 +0000 2021,excluded ExcludedUK,https://twitter.com/michael75lewis/status/1381362687188287493/photo/1,https://www.gofundme.com/f/24nnv3qqw0,0,1381362687188287493,,,,en,"Gainsborough, England",false,,0,,,"<a href=""https://www.hootsuite.com"" rel=""nofollow"">Hootsuite Inc.</a>","Please make a donation to support me.

I was #excluded from all of the UK government’s Covid-19 financial support &amp; have been unable to work since the 23rd March 2020.

Any donations will be gratefully received.

Thank you.

https://t.co/N1ZED8A0El

#ExcludedUK https://t.co/tngQrvrHGE",https://twitter.com/ViveLeSocialism/status/1381362687188287493,Wed Jul 19 21:17:10 +0000 2017,887783395635417088,false,♿️ Activist and member of @UKlabour @gmb_union @prospectunion @disabilitylab. Support @votesat16 and @electoralreform #NHS💙 #HeForShe #BLM✊🏿 #GoingForItDN,9507,1600,4991,3,United Kingdom,"Michael, Socialist🌹Vive la résistance✊🏻✊🏻",ViveLeSocialism,40331,,https://www.amazon.co.uk/dp/B0851LKD86/ref=cm_sw_r_tw_dp_U_x_uJtvEbCA30QDH,false
"-76.8,17.9833",Sun Apr 11 21:46:21 +0000 2021,Covid19Vaccine Protection Vaccine,,https://www.instagram.com/p/CNipB_kAgDd/?igshid=11t15rvo81bm4,0,1381363014356635652,,,,en,Jamaica,false,,0,,,"<a href=""http://instagram.com"" rel=""nofollow"">Instagram</a>","Took my first dose of the #Covid19Vaccine No side effects at this point and feeling fine. #Protection #Vaccine @ Kingston, Jamaica https://t.co/f3HQiL0CRp",https://twitter.com/DJTimeless246/status/1381363014356635652,Thu Aug 12 20:24:05 +0000 2010,177687659,false,"Dynamic and professional on-air personality, capable Web Manager, avid team player, supervisor and team builder.",569,3859,465,49,Barbados,DJ Timeless,DJTimeless246,16362,,http://www.djtimeless246.com,false
"-3.51771957,40.40549502",Sun Apr 11 21:31:20 +0000 2021,family parents love,,https://www.instagram.com/p/CNinT8HnGAr/?igshid=6n6rrty7svbg,1,1381359232797278218,,,,en,"Rivas-Vaciamadrid, España",false,,0,,,"<a href=""http://instagram.com"" rel=""nofollow"">Instagram</a>","Sometimes we get to dress up, even during COVID times. The best family I could have ever hoped for ❤️ 
#family #parents #love @ Palacio Del Negralejo https://t.co/2R9Ok2Fbu0",https://twitter.com/Guishe/status/1381359232797278218,Wed Sep 17 15:07:33 +0000 2008,16330007,false,Many RTs and Instagram posts. Sometimes I write some stuff as well.,1450,574,1393,17,Madrid,Guillermo Silva,Guishe,9903,,,false
"-73.92413457,40.82874907",Sun Apr 11 20:22:13 +0000 2021,happysunday sundayfunday rain raining whenitrains hoodie wearamask instashare instalike,,https://www.instagram.com/p/CNifZmijIHu/?igshid=1i16iaf0s4ziu,0,1381341839114919945,,,,en,"Bronx, NY",false,,0,,,"<a href=""http://instagram.com"" rel=""nofollow"">Instagram</a>","Happy Sunday in the rain!

""Let the water fall and fall,
Mighty change after the rain.""

#happysunday #sundayfunday #rain #raining #whenitrains #hoodie #wearamask #instashare #instalike @ Bronx, NY https://t.co/9zQOL7clFS",https://twitter.com/arisael_riv/status/1381341839114919945,Sat Nov 02 04:39:22 +0000 2013,2169572467,false,total dreamer.  actor.  believer in heaven. cake lover.  writer of meet: the web series.  https://t.co/qGb45UevBU,3583,226,423,16,United States,Arisael Rivera,arisael_riv,2179,,https://www.arisaelrivera.com,false
"-84.582,33.806",Sun Apr 11 22:30:57 +0000 2021,favorite baseballlife soexcitedtoseehimbackonthefield,,https://www.instagram.com/p/CNiuIj6AhYN2VE6nch2KjNLz-3L3OSf0F9ihxc0/?igshid=b5fj32ajx0l5,0,1381374236162461700,,,,en,"Mableton, GA",false,,0,,,"<a href=""http://instagram.com"" rel=""nofollow"">Instagram</a>","When Covid ruins everything, you play where you can. #24 #favorite #baseballlife #soexcitedtoseehimbackonthefield @ Pebblebrook High School https://t.co/IFjjdSEJ04",https://twitter.com/heatherh23/status/1381374236162461700,Mon Dec 08 22:37:32 +0000 2008,17975913,false,Hi.,2422,321,342,13,Georgia,Heather,heatherh23,67661,,,false
"-73.56725453,45.75975883",Sun Apr 11 23:04:05 +0000 2021,,,http://dlvr.it/RxSWDK,0,1381382575508221952,,,,en,"Mascouche, Québec",false,,0,,,"<a href=""https://dlvrit.com/"" rel=""nofollow"">dlvr.it</a>","Fighting Stigma: Thailand hits new daily record with nearly 1000 virus cases after nightlife outbreak: The health ministry confirmed 967 new Covid-19 infections, the highest ever in a 24-hour period, taking Thailand's total to 32,625 cases since January… https://t.co/2K2FenNI4j",https://twitter.com/StigmabaseN/status/1381382575508221952,Wed Sep 15 15:55:47 +0000 2010,191092262,false,Ireland — Scotland — Inuit —  Svenska  | Keeping up-to-date on global exclusion — Stigmabase is a canadian internet non-profit Initiative,0,1611,1297,110,Ireland | Scotland | Inuit | Skandinavien,Stigmabase | NORDIC,StigmabaseN,951942,,https://www.stigmabase.org/,false
"-117.97660574,33.8704606",Sun Apr 11 22:28:14 +0000 2021,,,https://www.instagram.com/p/CNit0oXpG9X/?igshid=fw7s950zrvtu,0,1381373554206273537,,,,en,"Fullerton, CA",false,,0,,,"<a href=""http://instagram.com"" rel=""nofollow"">Instagram</a>",Beautiful wedding Beautiful bride thank you God for vaccines. Congratulations!!!! Man I miss family. @ Fullerton Airport / CHP Hanger https://t.co/TrBhN8QHTy,https://twitter.com/iamKOCali/status/1381373554206273537,Wed Mar 30 20:19:20 +0000 2011,274663260,false,"Day by day, MOM and LA Actor Dancer Artist. 
we are gonna make it. 
🤩😎👫👰🤰👼👨‍👩‍👧🐶💃🌺🔥🖊🖌🇺🇸🇯🇵🇨🇷",788,167,124,12,Lalaland,Kimiko K.O.,iamKOCali,2352,,http://kimikorojas.com,false
"-95.37939964,29.72311155",Sun Apr 11 20:23:22 +0000 2021,covidvacccine,,https://www.instagram.com/p/CNifiIZFFtb/?igshid=13pzrxg1uspr2,3,1381342128605786115,,,,en,"Houston, TX",false,,0,,,"<a href=""http://instagram.com"" rel=""nofollow"">Instagram</a>",I got full 5G Coverage! Thank God helping me pull through the pandemic as well as my family and friends. P.S. It's a joke (5G has nothing to do with COVID)!  #covidvacccine @ Walgreens https://t.co/JzHgJlkOu8,https://twitter.com/Danny_Fas7/status/1381342128605786115,Wed Jul 30 17:15:19 +0000 2014,2693472967,false,"Some fast, energetic nerd
UTSA Alumni 
Hobbies: Video Games & Cosplaying 
Nothing starts until you take action",21127,124,151,0,"Texas, USA",Danny Fast,Danny_Fas7,2746,,,false
"-73.1466,40.9177",Sun Apr 11 21:58:42 +0000 2021,,,https://untp.beer/s/c1016268911,3,1381366122444886016,,,,en,"Stony Brook, NY",false,,0,,,"<a href=""https://untappd.com"" rel=""nofollow"">Untappd</a>",Post vaccine sour IPA and grilled cheeeeeeeeeeeese yasssssss - Drinking a RASPBERRY PEACH TART DECO by @taleabeer at @brewcheesesbny  — https://t.co/p8nyfnUeZ6,https://twitter.com/YankeeMegs/status/1381366122444886016,Tue Apr 21 15:48:35 +0000 2009,33943069,false,"I love sports, but I am so damn tired of all your shitty hot takes. My dog will eat you.",109094,6805,3905,499,Eastern Long Island NY ,Megs,YankeeMegs,413022,,,false
"-73.56725453,45.75975883",Sun Apr 11 23:04:05 +0000 2021,,,http://dlvr.it/RxSWD9,0,1381382574258327552,,,,en,"Mascouche, Québec",false,,0,,,"<a href=""https://dlvrit.com/"" rel=""nofollow"">dlvr.it</a>","Fighting Stigma: Northern Ireland lockdown restrictions: Executive 'to discuss reopening outdoor bars, hairdressers ...: On Saturday, the Department of Health hailed the Northern Ireland vaccine programme, as they reached the one million mark. Minister… https://t.co/G1buT4CI7n",https://twitter.com/StigmabaseN/status/1381382574258327552,Wed Sep 15 15:55:47 +0000 2010,191092262,false,Ireland — Scotland — Inuit —  Svenska  | Keeping up-to-date on global exclusion — Stigmabase is a canadian internet non-profit Initiative,0,1611,1297,110,Ireland | Scotland | Inuit | Skandinavien,Stigmabase | NORDIC,StigmabaseN,951942,,https://www.stigmabase.org/,false
"-74.0018034,40.75704251",Sun Apr 11 22:50:16 +0000 2021,covid ᴠᴀᴄᴄɪɴᴇssᴀᴠᴇʟɪᴠᴇs covid_19 pfizer dose2 shots,,https://www.instagram.com/p/CNiwV9cp1TlW_KxN6IfqHURlG0mVZAsMrX_XYA0/?igshid=7uwg6xy7va4m,1,1381379099462107137,,,,en,"Manhattan, NY",false,,0,,,"<a href=""http://instagram.com"" rel=""nofollow"">Instagram</a>",Happily fully vaccinated now.  Normal life inches ever so much closer..... #covid #ᴠᴀᴄᴄɪɴᴇssᴀᴠᴇʟɪᴠᴇs #covid_19 #pfizer #dose2 #shots @ Javits Center https://t.co/0eol8C7NCW,https://twitter.com/greggmf/status/1381379099462107137,Fri Mar 18 22:20:32 +0000 2011,268498395,false,"Political Junkie, unabashed liberal. Thanks to all who helped end the Trump nightmare. #PresidentJoe Follow back all follower. Be safe, wear masks! VOTE!!!",6795,1359,2041,1,"New York, NY",GF,greggmf,7838,,,false
