coordinates,created_at,hashtags,media,urls,favorite_count,id,in_reply_to_screen_name,in_reply_to_status_id,in_reply_to_user_id,lang,place,possibly_sensitive,quote_id,retweet_count,retweet_id,retweet_screen_name,source,text,tweet_url,user_created_at,user_id,user_default_profile_image,user_description,user_favourites_count,user_followers_count,user_friends_count,user_listed_count,user_location,user_name,user_screen_name,user_statuses_count,user_time_zone,user_urls,user_verified
"-2.68575298,53.7065149",Sun Apr 11 14:35:25 +0000 2021,lockdownhair longfringe headband nike nikeworldtour imakethislookgood,,https://www.instagram.com/p/CNh3toFgLy1/?igshid=io1s50kwr31v,2,1381254563907391490,,,,en,"North West, England",false,,0,,,"<a href=""http://instagram.com"" rel=""nofollow"">Instagram</a>","Fair to say that lockdown has not been kind to my hair. So much that desperate measure had to be taken...

#lockdownhair #longfringe #headband #nike #nikeworldtour #imakethislookgood @ Farington, Lancashire https://t.co/ZF1Hm2O55t",https://twitter.com/RUNCMD23/status/1381254563907391490,Sat Feb 12 04:57:31 +0000 2011,250967957,false,"Used to live in the Middle East but now moved back to the UK. Love F1, LFC, all Chicago sports teams but especially the White Sox",1535,199,714,7,"Walton-le-Dale, England",Colin Dowding,RUNCMD23,14299,,,false
"-6.29974854,53.34245877",Sun Apr 11 14:35:27 +0000 2021,imma sundaystrolls lastdayof5km brownies,,https://www.instagram.com/p/CNh3uAdHeWU/?igshid=1th0i2onkw7t2,0,1381254573378134026,,,,en,"Dublin City, Ireland",false,,0,,,"<a href=""http://instagram.com"" rel=""nofollow"">Instagram</a>",Stick a fork 🍴in me I'm done with lockdown!!! @immaireland #imma #sundaystrolls #lastdayof5km #brownies @ IMMA - Irish Museum of Modern Art https://t.co/Z33qH3WNLs,https://twitter.com/lyndseyjohnson_/status/1381254573378134026,Thu Apr 23 22:07:16 +0000 2009,34747119,false,Librarian @tcdlibrary,18459,198,871,3,"Dublin City, Ireland",lyndsey johnson 🇮🇪🌍✈,lyndseyjohnson_,3448,,,false
"-118.48817,34.06326",Sun Apr 11 12:38:22 +0000 2021,JoanCrawford ManFromUNCLE KarateKillers,,https://www.instagram.com/p/CNhqUVVH9BB/?igshid=1at9cwwfpq6u3,0,1381225106920325122,,,,en,"Los Angeles, CA",false,,0,,,"<a href=""http://instagram.com"" rel=""nofollow"">Instagram</a>","A year after and still raging, this pandemic is sucking the sanity out of me. Tomorrow is a Monday.

A Ms. #JoanCrawford movie for every mood. #ManFromUNCLE #KarateKillers @ Joan Crawford &amp; Douglas Fairbanks Jr https://t.co/S1m48kt9iS",https://twitter.com/astroantiquity/status/1381225106920325122,Fri May 08 01:55:28 +0000 2009,38578547,false,"Instead of committing suicide, people go to work. - Thomas Bernhard",35294,702,2407,18,Manila,J G,astroantiquity,67143,,http://Instagram.com/astroantiquity,false
"-122.90157802,49.25158741",Sun Apr 11 14:51:48 +0000 2021,,,https://www.instagram.com/p/CNh5lnpsfH7/?igshid=1cd6bnpkppbp7,0,1381258688833404928,,,,en,"Burnaby, British Columbia",false,,0,,,"<a href=""http://instagram.com"" rel=""nofollow"">Instagram</a>","Happy Sunday 😎 open today for a couple of hours, doors at 12 noon. COVID guidelines apply. 2 customers max at a time. Masks are required. Hand sanitizer on site. @ Music MadHouse Records https://t.co/E6mGHWVakH",https://twitter.com/RSnopek/status/1381258688833404928,Thu Sep 08 05:25:46 +0000 2011,369927769,false,,1535,835,806,34,"Vancouver, BC, Canada",MusicMadHouseRecords,RSnopek,7342,,http://www.facebook.com/#!/pages/Music-MadHouse-Records/7753177115,false
"-115.1319961,36.07139224",Sun Apr 11 14:55:40 +0000 2021,kangamooplay vegaskids,,https://www.instagram.com/p/CNh6BzLB_J-/?igshid=u2gcehwl9dr3,0,1381259660053901313,,,,en,"Paradise, NV",false,,0,,,"<a href=""http://instagram.com"" rel=""nofollow"">Instagram</a>",COME PLAY INDOORS! ▪️Temperature checks▪️10yrs+ older must wear Face Masks ▪️Adults: Please maintain 6’ social distancing ▪️OPEN MON-FRI 9AM-7PM ▪️ OPEN SAT-SUN 9AM-5PM #kangamooplay #vegaskids https://t.co/eoIss0blsg,https://twitter.com/kangamooplay/status/1381259660053901313,Tue Jun 30 01:28:00 +0000 2015,3260589566,false,"VEGAS MEGA Children's Indoor Playground, Slides, Trampolines, Parents' Lounge Free Massage Chairs Healthy Cafe, Check out our website for hours!",1073,1287,3106,19,1525 East Sunset Road ,Kangamoo Indoor Play,kangamooplay,3518,,http://www.kangamooplay.com,false
"-0.1094,51.5141",Sun Apr 11 14:32:15 +0000 2021,EP5 thescenicroute bananas,,https://www.instagram.com/p/CNh3WYdBi1z/?igshid=lgcqpivrf3v2,0,1381253766696083456,,,,en,"City of London, London",false,,0,,,"<a href=""http://instagram.com"" rel=""nofollow"">Instagram</a>","""I hand corona but the flu is nothing new, yeh, see this music i put sweat and blood into, yeh!!"" 🚀🚀🚀 #EP5 #thescenicroute #bananas #🍌🍌🍌 DROP A ""🍌"" EMOJI in the comments if your ready. 
📸@samividelmedia https://t.co/SJ26XEFkpf",https://twitter.com/siah_thagod/status/1381253766696083456,Thu Dec 31 02:44:54 +0000 2009,100659565,false,RECORDING ARTIST bookings & info: flotionpictures@outlook.com,418,1767,1109,34,LDN CTY,SIAH THA' GOD,siah_thagod,6778,,https://youtube.com/c/SIAHTHAGOD,false
"-6.24086738,53.34416169",Sun Apr 11 13:33:11 +0000 2021,,,https://www.instagram.com/p/CNhwlyZDjVd/?igshid=xchkpdtx2axo,1,1381238903072567301,,,,en,"Dublin City, Ireland",false,,0,,,"<a href=""http://instagram.com"" rel=""nofollow"">Instagram</a>","European Champions Cup &amp; Challenge Cup rugby, @womenssixnations and some tasty eggs!

Lockdown Level 5...continued @ Grand Canal Dock https://t.co/pdqHE4lWlb",https://twitter.com/SpaceClinics/status/1381238903072567301,Fri Jan 30 21:09:43 +0000 2009,19788746,false,"Currently IRFU physio in Dublin, excited for https://t.co/ST1g651rC3 online! 
Previously SPACE Feb 14th '05- 31st '20 
Views My Own (obs)",8034,2144,3263,33,"Edinburgh, Haymarket",Space Clinics,SpaceClinics,6542,,https://projectphysio.net,false
"-74.00589108,40.71270142",Sun Apr 11 15:04:33 +0000 2021,mood dianearbus portrait blackandwhite lockdown endoflockdown,,https://www.instagram.com/p/CNh7C6nAS-9/?igshid=1b2crzk1fs0t9,0,1381261895655641092,,,,en,"Manhattan, NY",false,,0,,,"<a href=""http://instagram.com"" rel=""nofollow"">Instagram</a>","#mood G E T  R E A D Y  G I R L S !
.
Pubs and restaurants open tomorrow! 🤩 
.
Diane Arbus, ‘Three Female Impersonators,’ NYC, 1962 🤍
.
.
.
#dianearbus #portrait #blackandwhite #lockdown #endoflockdown 🙏🏻 https://t.co/2oqc6orS5h",https://twitter.com/KarlPlewka/status/1381261895655641092,Tue Jan 26 15:21:05 +0000 2010,108631749,false,Fashion Stylist,770,1568,532,29,London,Karl Plewka,KarlPlewka,9368,,,false
"-71.8187,41.3748",Sun Apr 11 12:57:51 +0000 2021,,,https://www.instagram.com/p/CNhsi1AAvguyZv-KJjSmLTWNUuV2S8YC3-lOss0/?igshid=1x1tiw64ly09k,0,1381230011865251841,,,,en,"Westerly, RI",false,,0,,,"<a href=""http://instagram.com"" rel=""nofollow"">Instagram</a>","Happy 15th birthday to the next man of the house.  You're growing up so fast.  Sorry for the Covid-19 lack of a party, but we will make up for it on the trails and at the lakes. @bannon974 https://t.co/skTMSLv3Qg",https://twitter.com/dbannonjr/status/1381230011865251841,Fri Feb 11 03:37:22 +0000 2011,250453793,false,,226,68,273,1,"Westerly, RI",David Bannon,dbannonjr,857,,,false
"-73.56725453,45.75975883",Sun Apr 11 13:07:07 +0000 2021,,,http://dlvr.it/RxRFnC,0,1381232344728662017,,,,en,"Mascouche, Québec",false,,0,,,"<a href=""https://dlvrit.com/"" rel=""nofollow"">dlvr.it</a>","Fighting Stigma: France extends gap between Covid-19 vaccine shots: Although France's top health authority advised a six-week period between the two shots in January in order to stretch supplies, the government at the ... https://t.co/VtGr9LWV8W",https://twitter.com/StigmabaseN/status/1381232344728662017,Wed Sep 15 15:55:47 +0000 2010,191092262,false,Ireland — Scotland — Inuit —  Svenska  | Keeping up-to-date on global exclusion — Stigmabase is a canadian internet non-profit Initiative,0,1611,1297,110,Ireland | Scotland | Inuit | Skandinavien,Stigmabase | NORDIC,StigmabaseN,951942,,https://www.stigmabase.org/,false
"2.1683,41.3894",Sun Apr 11 13:28:31 +0000 2021,BCN baby fatherandson prowddad deserted airport barcelona barcelonaairport,,https://www.instagram.com/p/CNhwDpgB9Fe/?igshid=1rrik144sga6a,0,1381237729351065602,,,,en,"Barcelona, España",false,,0,,,"<a href=""http://instagram.com"" rel=""nofollow"">Instagram</a>","Travelling during a pandemic. #BCN #baby #fatherandson #prowddad #deserted #airport #barcelona #barcelonaairport @ Barcelona, Spain https://t.co/SBihPxxQfp",https://twitter.com/bernhardstange/status/1381237729351065602,Sun Apr 11 07:32:58 +0000 2010,131764734,false,,1113,71,221,0,"München, Bayern",Bernhard Stange,bernhardstange,751,,,false
"-3.0447,53.815",Sun Apr 11 13:58:16 +0000 2021,springtime sunshine sunnysunday peaceandquiet peaceful brew teatime lockdown lockdown2021,,https://www.instagram.com/p/CNhzdkaguLW/?igshid=joo4k195s9y0,0,1381245215684591622,,,,en,"South Shore, England",false,,0,,,"<a href=""http://instagram.com"" rel=""nofollow"">Instagram</a>",Sitting in the garden enjoying a brew and a bit of peace and quiet #springtime #sunshine #sunnysunday #peaceandquiet #peaceful #brew #teatime #lockdown #lockdown2021 @ Blackpool https://t.co/00Qra1zDEI,https://twitter.com/TeacupandBIRD/status/1381245215684591622,Thu Oct 13 11:50:59 +0000 2016,786534694632484868,false,"I am just a girl with a shed ... a Vintage Tea Shed and winner of the Budget Shed category of Shed of the Year 2019

Teacup&BIRD in the The Regent, Blackpool",1621,129,0,12,"Blackpool, England",Teacup&BIRD (The Vintage Tea Shed),TeacupandBIRD,3314,,,false
"-115.1319961,36.07139224",Sun Apr 11 14:57:39 +0000 2021,kangamooplay vegaskids,,https://www.instagram.com/p/CNh6QcrBFq-/?igshid=p52qtl8shj8b,0,1381260159469678598,,,,en,"Paradise, NV",false,,0,,,"<a href=""http://instagram.com"" rel=""nofollow"">Instagram</a>",COME PLAY INDOORS! ▪️Temperature checks▪️10yrs+ older must wear Face Masks ▪️Adults: Please maintain 6’ social distancing ▪️OPEN MON-FRI 9AM-7PM ▪️ OPEN SAT-SUN 9AM-5PM #kangamooplay #vegaskids https://t.co/idFVfEz30d,https://twitter.com/kangamooplay/status/1381260159469678598,Tue Jun 30 01:28:00 +0000 2015,3260589566,false,"VEGAS MEGA Children's Indoor Playground, Slides, Trampolines, Parents' Lounge Free Massage Chairs Healthy Cafe, Check out our website for hours!",1073,1287,3106,19,1525 East Sunset Road ,Kangamoo Indoor Play,kangamooplay,3518,,http://www.kangamooplay.com,false
"-6.27207756,53.37241615",Sun Apr 11 12:58:16 +0000 2021,,,https://www.instagram.com/p/CNhsmDgpzED/?igshid=52pfsg2hvapy,5,1381230117326712833,,,,en,"Dublin City, Ireland",false,,0,,,"<a href=""http://instagram.com"" rel=""nofollow"">Instagram</a>",We couldn't go into any of the glass houses because of covid but we still enjoyed some lovely blooms 🌷 @ National Botanic Gardens of Ireland https://t.co/8TXGSK9b5z,https://twitter.com/beaglehaus/status/1381230117326712833,Fri Dec 04 05:51:09 +0000 2009,94497768,false,"Sounders, Soccer, Travel, Prosecco,  formerly from Seattle, currently making a new life in Ireland. Get vaccinated. Wear a damn mask.

She/Her",74187,701,299,25,"Dublin City, Ireland",Kelly Weiler,beaglehaus,47700,,,false
"-111.074249,45.6706102",Sun Apr 11 12:59:03 +0000 2021,,,http://dlvr.it/RxRDCQ,22,1381230314601635846,,,,en,"Bozeman, MT",false,,0,,,"<a href=""https://dlvrit.com/"" rel=""nofollow"">dlvr.it</a>",AP:  Blackfeet Nation reopens after strict pandemic closures https://t.co/I4c8TvzYPQ,https://twitter.com/bozchron/status/1381230314601635846,Wed Mar 04 00:33:58 +0000 2009,22707076,false,The official Twitter feed for the Bozeman Daily Chronicle.,92,21688,1279,468,"Bozeman, Montana",Bozeman Daily Chronicle,bozchron,104273,,http://bozemandailychronicle.com/,false
"-81.9825,26.6396",Sun Apr 11 13:21:14 +0000 2021,thankfulfordad,,https://www.instagram.com/p/CNhu5y4Hveu/?igshid=qgr3d4ndykn6,14,1381235897882972165,,,,en,"Cape Coral, FL",false,,1,,,"<a href=""http://instagram.com"" rel=""nofollow"">Instagram</a>","My Dad is winning his monthlong bout with this pandemic. It’s a blessing to be here with him now. He’s getting better day by day. #thankfulfordad @ Cape Coral, Florida https://t.co/FFG7f9rvHl",https://twitter.com/DarrinGray2020/status/1381235897882972165,Mon Jun 08 15:06:16 +0000 2009,45584066,false,Leading purposeful sports media mission projects #Faith #Fatherhood #Philanthropy Authored ‘The Jersey Effect’ with foreword by Tony Dungy,32220,25286,17897,285,"Indianapolis, IN ",Darrin Gray,DarrinGray2020,16696,,http://DarrinGray.com,false
"77.597645,12.971117",Sun Apr 11 13:19:56 +0000 2021,squad_life_04 stylish stayhome sexeducation style sexystyle yum uñas fuckers,,https://www.instagram.com/p/CNhvEoHhZkf/?igshid=3xd153horgak,0,1381235571058733057,,,,en,"बैंगलुरु, भारत",false,,0,,,"<a href=""http://instagram.com"" rel=""nofollow"">Instagram</a>","Fuck every single person that took advantage of your kindness and mistook it for weakness.......
#squad_life_04
#stylish
#stayhome #sexeducation #style #sexystyle #yum #uñas #fuckers @ Bangalore, India https://t.co/Wtm159bzrw",https://twitter.com/aman_sharieff/status/1381235571058733057,Sat Feb 27 20:23:02 +0000 2021,1365759297754308612,false,,55,1,6,0,,Sharieff aman,aman_sharieff,25,,,false
"-0.020143,51.415137",Sun Apr 11 14:01:45 +0000 2021,,,https://www.instagram.com/p/CNhz28zHzZ6/?igshid=272jrauwbwot,1,1381246091417559042,,,,en,"Bromley, London",false,,0,,,"<a href=""http://instagram.com"" rel=""nofollow"">Instagram</a>",Only one week to go and we will be back in London for our first fair since lockdown with @so_last_century the venue is Beckenham Place Mansion @beckenhamplace Sunday 18th April @ Beckenham Place Park https://t.co/0nbi84tqbV,https://twitter.com/jamsironwork/status/1381246091417559042,Thu Sep 06 20:08:24 +0000 2012,807511464,false,"j.a.m.s. ironwork restore, upcycle, modify genuine vintage items to produce unique custom industrial feature lights and furniture. Instagram @jamsironwork",73,333,408,14,"South Newton, England",Jams ironwork,jamsironwork,521,,http://www.jamsironwork.co.uk,false
"76.77006228,30.75445451",Sun Apr 11 14:05:32 +0000 2021,thoughtoftheday bestquote stayhome stayhomestaysafe covidbehavior covidvacccine covidguidelibes,,https://www.instagram.com/p/CNh0SqBrqRQ/?igshid=1cjvps9tiwl1m,0,1381247045386797057,,,,en,"Chandigarh, India",false,,0,,,"<a href=""http://instagram.com"" rel=""nofollow"">Instagram</a>","Best quote I have ever seen ❣️

#thoughtoftheday #bestquote #stayhome #stayhomestaysafe #covidbehavior #covidvacccine #covidguidelibes @ Dr Ashima Goel’s Parisa SKIN Cosmetic &amp; LASER Centre https://t.co/In6ukkjpgj",https://twitter.com/PARISAskinLASER/status/1381247045386797057,Sun May 03 06:25:20 +0000 2009,37378371,false,"DR ASHIMA GOEL, CONSULTANT DERMATOLOGIST AND DERMATOLASER SURGEON at PARISA SKIN COSMETIC AND LASER CENTRE",1,48,26,2,CHANDIGARHINDIA,Dr Ashima Goel,PARISAskinLASER,2411,,http://www.parisadermatology.com,false
"-77.46131,37.54745",Sun Apr 11 13:43:56 +0000 2021,,,https://www.instagram.com/p/CNhx0lKFpng/?igshid=1loo2j5oo4ie4,0,1381241607572357125,,,,en,"Richmond, VA",false,,0,,,"<a href=""http://instagram.com"" rel=""nofollow"">Instagram</a>","Good Morning RVA...
Enjoy your coffee☕Get a Haircut💈 Get out in the beauty weather 🌤Wear your mask!!😷 Repeat!! @ Refuge For Men https://t.co/fnQYYzO2bA",https://twitter.com/refugeformen/status/1381241607572357125,Tue Jun 01 17:10:29 +0000 2010,150722774,false,Full service barbershop & salon in RVA. ⏰Mon-Fri 9-8pm|Sat 8-6pm |Sun 11-4pm 👨‍🎓Student Discounts  🐶Pet Friendly! Book here https://t.co/9KUbGc4ioN or walk in!,49,85,137,9,1607 Main St Richmond VA 23220,Refugeformen,refugeformen,1192,,http://refugeformen.com,false
"-116.9715,46.37691",Sun Apr 11 13:40:34 +0000 2021,sunrise photography photogeniusbrisbane photographyeveryday,,https://www.instagram.com/p/CNhxb-EBkVU/?igshid=4103z61qifwz,0,1381240760444596226,,,,en,"Lewiston, ID",false,,0,,,"<a href=""http://instagram.com"" rel=""nofollow"">Instagram</a>",This is a Sunrise I got this morning on my way home from work. #sunrise #photography #photogeniusbrisbane #photographyeveryday @ A&amp;B Foods https://t.co/Gezr1Tsl0W,https://twitter.com/DShorb/status/1381240760444596226,Fri Mar 23 21:44:12 +0000 2012,534743200,false,"Writer, photographer, #Neurodiverse , pro #LGBTQIA+. Support Trans Youth.",30078,4211,4594,167,"Lewiston, ID",David Shorb,DShorb,193877,,https://www.dshorb.com,false
"101.51649356,3.07353803",Sun Apr 11 14:04:07 +0000 2021,,https://twitter.com/Media_Selangor/status/1381246688715624448/photo/1,https://selangorjournal.my/2021/04/sarawak-will-consider-scrapping-14-day-quarantine-if-situation-improves/?utm_source=dlvr.it&utm_medium=twitter,0,1381246688715624448,,,,en,"Bandar Petaling Jaya, Selangor",false,,2,,,"<a href=""https://dlvrit.com/"" rel=""nofollow"">dlvr.it</a>",Selangor Journal | Sarawak will consider scrapping 14-day quarantine if situation improves https://t.co/UrdULrZCZY https://t.co/IxvH5A8kew,https://twitter.com/Media_Selangor/status/1381246688715624448,Thu Mar 31 15:04:18 +0000 2011,275057058,false,Segar. Semasa. Selangor. Kami sampaikan berita mutakhir dan perkembangan negeri di SelangorTV dan Selangorkini.,1774,51190,276,154,Shah Alam,Media Selangor,Media_Selangor,226236,,http://www.selangorkini.my,false
"-74.0794,4.5997",Sun Apr 11 13:51:43 +0000 2021,Bogota quarantine,,https://www.instagram.com/p/CNhytgEJhtl/?igshid=1gxttm0jk0j7k,2,1381243569873297411,,,,en,"Bogotá, D.C., Colombia",false,,1,,,"<a href=""http://instagram.com"" rel=""nofollow"">Instagram</a>","While those of us with pets are permitted to walk them during the lockdown, some resourceful neighbours have taken to exercising their collie on their flat roof. #Bogota #quarantine @ Bogotá, Colombia https://t.co/owQZRywPev",https://twitter.com/CasaAmarilla/status/1381243569873297411,Thu May 14 19:48:34 +0000 2009,40071672,false,"@ColombiaCalling podcast https://t.co/dWzhknmdiG, journo, hotelier. Opinions my own. PhD #watfordfc",80821,7008,6635,269,"Mompos and Bogota, Colombia",Richard McColl,CasaAmarilla,83308,,http://www.richardmccoll.com,false
"28.18866491,-25.861502",Sun Apr 11 12:41:42 +0000 2021,,,https://www.instagram.com/p/CNhqs3lMeNg/?igshid=1iiwqyyiq42mv,0,1381225949308538882,,,,en,"Centurion, South Africa",false,,0,,,"<a href=""http://instagram.com"" rel=""nofollow"">Instagram</a>","ZeeBro TheBossManDj Entertainment Satisfaction guaranteed.
Strictly Deep House Lockdown Sundays
See you there. @ Centurion Shisanyama https://t.co/vnkFooRYKg",https://twitter.com/zeebrosboss/status/1381225949308538882,Tue Jan 17 10:58:01 +0000 2012,466397618,false,"Dj/Sound Engineer Since 1999
Food,Beverage and Entertainment.",48,361,479,3,"ÜT: -25.8605465,28.1937353",ZeeBro TheBossManDj,zeebrosboss,1381,,,false
"-1.69704,53.67525",Sun Apr 11 14:45:38 +0000 2021,,,https://www.instagram.com/p/CNh44fjl6Sq/?igshid=1rhkom7av14ix,6,1381257136001454086,,,,en,"Mirfield, England",false,,2,,,"<a href=""http://instagram.com"" rel=""nofollow"">Instagram</a>",247 people ran a covid-safe fell race here today. This trod is all that remains. Well organised @nickyspinks x @ Mirfield https://t.co/sJzMOFw1mp,https://twitter.com/EdaleSkyline/status/1381257136001454086,Mon Jun 27 21:53:59 +0000 2011,325189325,false,Former RO Edale Skyline fell race. PBS specialist. PA/intern/house elf for @adventuresynd   never vote tory,4264,1166,776,20,"Sheffield, England",Ian Fitz,EdaleSkyline,9473,,http://www.dpfr.org.uk/pages/3,false
"-73.56725453,45.75975883",Sun Apr 11 14:05:34 +0000 2021,,,http://dlvr.it/RxRP3C,0,1381247051413921794,,,,en,"Mascouche, Québec",false,,0,,,"<a href=""https://dlvrit.com/"" rel=""nofollow"">dlvr.it</a>","Fighting Stigma: Minister Stephen Donnelly gives update on return to normal ahead of first lockdown restrictions ...: And speaking on Sunday afternoon, the Minister for Health has given an update on Ireland's ""pathway out of this pandemic"" after ""a very… https://t.co/j73v4J5pK2",https://twitter.com/StigmabaseN/status/1381247051413921794,Wed Sep 15 15:55:47 +0000 2010,191092262,false,Ireland — Scotland — Inuit —  Svenska  | Keeping up-to-date on global exclusion — Stigmabase is a canadian internet non-profit Initiative,0,1611,1297,110,Ireland | Scotland | Inuit | Skandinavien,Stigmabase | NORDIC,StigmabaseN,951942,,https://www.stigmabase.org/,false
"-0.07939436,51.47496745",Sun Apr 11 15:00:39 +0000 2021,,,https://www.instagram.com/p/CNh6mjnnB5N/?igshid=1vydz3zh2olb4,0,1381260916566671363,,,,en,"Camberwell, London",false,,0,,,"<a href=""http://instagram.com"" rel=""nofollow"">Instagram</a>","Throwback I missed London, fuck Covid 19 🖕🏼. Wish you all a smoky Sunday 🔥💨 @ London, Unιted Kingdom https://t.co/zPhiJWTivy",https://twitter.com/ziad_nohra/status/1381260916566671363,Tue Nov 08 17:59:02 +0000 2011,407890483,false,"📍Athens | Paris | Beirut 
▪Fᴏᴜɴᴅᴇʀ & CEO ᴀᴛ SHS Gʀᴏᴜp ᴏғ Cᴏᴍᴘᴀɴɪᴇs...         
▪Cigar Aficionado & BOTL...  
▪✋🏻🔞+ ᗝᑎᒪƳ... https://t.co/qTIKmYGZTS…",669,106,75,5,"Kifisia, Greece",ⓏⒾⒶⒹ ⓃⓄⒽⓇⒶ 🇱🇧🇨🇦,ziad_nohra,981,,http://www.nargile.gr,false
"-3.16696373,55.8866272",Sun Apr 11 13:29:49 +0000 2021,,,,0,1381238055856713732,iQFilmmaker,1381236457537437697,216083095,en,"Straiton, Scotland",,,0,,,"<a href=""http://tapbots.com/tweetbot"" rel=""nofollow"">Tweetbot for iΟS</a>",@iQFilmmaker I had mine quite short before lockdown last year. Not had it cut since. We we went on holiday hen daub at sea opened in July and not had time since. Past my shoulders now from a number 4.,https://twitter.com/Johnmhunt/status/1381238055856713732,Fri Dec 05 18:53:28 +0000 2008,17904528,false,"Computer geek, iPhone/iPad bore, cyclist, electric vehicle driver, former programmer, cyborg, Vulcan, gadget lover, Dundonian, father of noisy children.",875,165,287,5,Edinburgh,John M Hunt,Johnmhunt,5897,,,false
"120.92376977,13.87920694",Sun Apr 11 13:30:42 +0000 2021,,,https://www.instagram.com/p/CNhwRxYJ3De/?igshid=nee3zdkxutg5,0,1381238280155369473,,,,en,"Taal, Rehiyon ng CALABARZON",false,,0,,,"<a href=""http://instagram.com"" rel=""nofollow"">Instagram</a>",NEW WORK FROM HOME @ Hanswey - Bridal and Events Shop https://t.co/xJnIDZbC5C,https://twitter.com/hansweybridal/status/1381238280155369473,Fri Oct 28 14:49:40 +0000 2011,400120918,false,"Hanswey Bridal Shop are making of  Ready to Wear (RTW) and Made to Order products in TAAL, Batangas. For faster Transactions you may Call at 0975-2719470",44,18,103,0,"TAAL, Batangas",Hanswey Bridal and Event Management,hansweybridal,2282,,https://www.facebook.com/Hansweybridalshop/,false
"-81.32806152,48.47593351",Sun Apr 11 14:51:35 +0000 2021,,https://twitter.com/TimminsToday/status/1381258632545767426/photo/1,https://www.timminstoday.com/local-news/ontario-reports-4456-new-covid-cases-sunday-3621992?utm_source=dlvr.it&utm_medium=twitter,0,1381258632545767426,,,,en,"Timmins, Ontario",false,,0,,,"<a href=""https://dlvrit.com/"" rel=""nofollow"">dlvr.it</a>","Ontario reports 4,456 new COVID cases Sunday https://t.co/ZPH1aJWTQN https://t.co/ldTLzAHK7q",https://twitter.com/TimminsToday/status/1381258632545767426,Thu Oct 18 02:36:23 +0000 2012,887966294,false,We are an online local news source for Timmins and Northern Ontario.,19,1894,296,18,"Timmins, Ontario",TimminsToday.com,TimminsToday,33116,,http://www.timminstoday.com,false
"-73.56725453,45.75975883",Sun Apr 11 14:05:33 +0000 2021,,,http://dlvr.it/RxRP2W,0,1381247049987858433,,,,en,"Mascouche, Québec",false,,0,,,"<a href=""https://dlvrit.com/"" rel=""nofollow"">dlvr.it</a>","Fighting Stigma: Ireland to impose mandatory quarantine on travelers from 16 countries, regions: DUBLIN, April 11 (Xinhua) -- People arriving in Ireland from the United ... quarantine if they can meet the other public health requirements of Ireland. https://t.co/cJtgxG9S1L",https://twitter.com/StigmabaseN/status/1381247049987858433,Wed Sep 15 15:55:47 +0000 2010,191092262,false,Ireland — Scotland — Inuit —  Svenska  | Keeping up-to-date on global exclusion — Stigmabase is a canadian internet non-profit Initiative,0,1611,1297,110,Ireland | Scotland | Inuit | Skandinavien,Stigmabase | NORDIC,StigmabaseN,951942,,https://www.stigmabase.org/,false
"72.9097582,19.00117717",Sun Apr 11 14:14:05 +0000 2021,Sipgrab UnitingPeopleWithThePossibilities,,http://dlvr.it/RxRQ7R,0,1381249196313825287,,,,en,"मुंबई, भारत",false,,0,,,"<a href=""https://dlvrit.com/"" rel=""nofollow"">dlvr.it</a>",India bans exports of Remdesivir drug as new COVID-19 cases hit another record https://t.co/E0uHH6WaVi #Sipgrab #UnitingPeopleWithThePossibilities,https://twitter.com/sipgrab/status/1381249196313825287,Tue Feb 28 12:12:15 +0000 2017,836549573048848384,false,Wealth management firm| Option Trading Expert | Option Strategy maker| 360° financial planner | compelete range of financial products | Market buzz updater!!,272,267,94,2,"Bengaluru, India",SipGrab,sipgrab,43338,,http://www.Sipgrab.com,false
