coordinates,created_at,hashtags,media,urls,favorite_count,id,in_reply_to_screen_name,in_reply_to_status_id,in_reply_to_user_id,lang,place,possibly_sensitive,quote_id,retweet_count,retweet_id,retweet_screen_name,source,text,tweet_url,user_created_at,user_id,user_default_profile_image,user_description,user_favourites_count,user_followers_count,user_friends_count,user_listed_count,user_location,user_name,user_screen_name,user_statuses_count,user_time_zone,user_urls,user_verified
"-84.33619,33.92621",Wed Dec 22 15:12:57 +0000 2021,goodmorning staysafe getvaccienated maskon covid protectyourself,,https://www.instagram.com/p/CXyitmxOBcS/?utm_medium=twitter,0,1473672915098996746,,,,en,"Dunwoody, GA",false,,0,,,"<a href=""http://instagram.com"" rel=""nofollow"">Instagram</a>","My daily schedule 💃🏽💃🏽 &amp; with lasted developments 😷 #goodmorning #staysafe #getvaccienated #maskon #covid #protectyourself @ Dunwoody, Georgia https://t.co/qx67Gp6iY6",https://twitter.com/cougaent/status/1473672915098996746,Wed Mar 04 21:52:50 +0000 2009,22840959,false,Sundays “Brunch & Munch” KING OF DIAMONDS ATL & COUGA new r/b group,752,4145,3051,150,"Dunwoody, GA",COUGA ENTERTAINMENT,cougaent,80345,,,false
"-122.675,45.5236111",Wed Dec 22 15:08:36 +0000 2021,,https://twitter.com/LionStiglitz/status/1473671821517987841/photo/1,http://dlvr.it/SFs15s,0,1473671821517987841,,,,en,"Portland, OR",false,,0,,,"<a href=""https://dlvrit.com/"" rel=""nofollow"">dlvr.it</a>",Germany and Portugal announce nightclub closures in new Covid restrictions: Rules are being ramped-up across Europe… https://t.co/VUc8kgNvlb https://t.co/np7jvVfxim,https://twitter.com/LionStiglitz/status/1473671821517987841,Mon Oct 10 19:22:05 +0000 2011,388449512,false,Marketing and Dj. #Amsterdam NL,784,2957,2583,23,,Leon Stiglitz,LionStiglitz,17600,,,false
"-73.6197588,45.51950705",Wed Dec 22 09:56:37 +0000 2021,,https://twitter.com/stigmabase/status/1473593307057967105/photo/1,http://dlvr.it/SFr7CJ,1,1473593307057967105,,,,en,"Montréal, Québec",false,,2,,,"<a href=""https://dlvrit.com/"" rel=""nofollow"">dlvr.it</a>","TW : Dr Robert Young: Shocking Results for CoV Vaccine Ingredients &amp; the Path of Destruction They Cause...: ...in delivering medications that could help treat disorders like Parkinson’s and Alzheimer’s Diseases, according to Peter Searson, the inaugural… https://t.co/yPYaP2u2f4 https://t.co/1VEWdGR6nQ",https://twitter.com/stigmabase/status/1473593307057967105,Wed Sep 01 21:06:16 +0000 2010,185789961,false,Dedicated to Education | Keeping up-to-date on global exclusion — Serving the truth — Stigmabase is a canadian internet non-profit Initiative. Founded in 2010,0,963,689,71,Worldwide,STIGMABASE | EDU,stigmabase,820501,,https://www.stigmabase.org/,false
"3.32525,50.92024",Wed Dec 22 08:45:28 +0000 2021,wearetheroadcrew tourlife vaccinationdone anticovid letmedomyjob,,https://www.instagram.com/p/CXx2XenoN8Z/?utm_medium=twitter,0,1473575405227589636,,,,en,"Oostrozebeke, België",false,,0,,,"<a href=""http://instagram.com"" rel=""nofollow"">Instagram</a>","Got my booster today, when will you go for your vaccine? Don’t be an ass and vaccinate ! Its the only way i get to keep doing my job ! #wearetheroadcrew #tourlife #vaccinationdone✔️ #anticovid #letmedomyjob https://t.co/IxIKa1Twgf",https://twitter.com/Soundguybe/status/1473575405227589636,Thu Jul 09 12:01:46 +0000 2009,55215380,false,"Easy going, hard working, self employed. CEO for Total World Domination, where we do full production, crew, transport, backline for any event you have",13,91,117,4,Belgium - Flanders,Dieter Heavy-D Bossaerts,Soundguybe,1094,,http://www.totalworlddomination.eu,false
"26.09802246,44.42652286",Wed Dec 22 05:11:33 +0000 2021,,,http://www.theregister.co.uk https://go.theregister.com/feed/www.theregister.com/2021/12/22/ellume_home_covid_test_cracked/?utm_source=dlvr.it&utm_medium=twitter,0,1473521567929823233,,,,en,"Bucureşti, România",false,,0,,,"<a href=""https://dlvrit.com/"" rel=""nofollow"">dlvr.it</a>",[https://t.co/xp1mTmWOmy] Of course a Bluetooth-using home COVID test was cracked to fake results https://t.co/NpF9zWJomA,https://twitter.com/zauw_/status/1473521567929823233,Mon Jul 16 13:41:24 +0000 2012,636979598,false,Informații de securitate și actualizări | https://t.co/6QhYT37mLq | EC23 92F2 EDE7 4488 680DA 3CF5F 2B475 6ED87 3D23 | Actualizat la fiecare 15 minute,0,54,0,25,"Bucureşti, România",Zauw.,zauw_,21490,,http://info.cern.ch,false
"-116.51141654,33.82687328",Wed Dec 22 05:37:50 +0000 2021,booster vaccine moderna palmsprings california,,https://www.instagram.com/p/CXxg5a6ribb/?utm_medium=twitter,0,1473528184142454789,,,,en,"Palm Springs, CA",false,,0,,,"<a href=""http://instagram.com"" rel=""nofollow"">Instagram</a>","Got me a booster 💕🥰
.
.
.
.
#booster #vaccine #moderna #palmsprings #california @ Desert Oasis Healthcare https://t.co/bcFTUMxF6v",https://twitter.com/karenthrallinc/status/1473528184142454789,Sun May 10 21:49:32 +0000 2015,3191436590,false,Provoking the heart of business.,59,783,29,16,"Palm Springs, CA",Karen Thrall,karenthrallinc,1052,,http://www.karenthrall.com,false
"-75.98965494,40.3585427",Wed Dec 22 15:14:18 +0000 2021,MSawareness TysabriInfusion,,https://www.instagram.com/p/CXyi3kpuMBQ/?utm_medium=twitter,0,1473673257710723072,,,,en,"Spring Ridge, PA",false,,0,,,"<a href=""http://instagram.com"" rel=""nofollow"">Instagram</a>","My room with a view for my monthly infusion.  Had to postpone it two weeks when Dave tested positive for COVID.
#MSawareness #TysabriInfusion @ Arthritis And Osteoarthritis Center https://t.co/Yosie801C5",https://twitter.com/RochelleMaus/status/1473673257710723072,Fri Feb 27 03:26:28 +0000 2009,22101836,false,,1094,128,204,4,"Reading, PA",Rochelle Maus,RochelleMaus,3166,,,false
"-73.692001,40.6819",Wed Dec 22 12:43:52 +0000 2021,SouthernStateParkway,,http://511ny.org/EventDetails/TRANSCOM/ORI241812409,0,1473635396521283591,,,,en,"North Valley Stream, NY",false,,0,,,"<a href=""https://511ny.org"" rel=""nofollow"">NYRegions</a>",Incident on #SouthernStateParkway EB from Exit 15 - North Corona Avenue to Exit 17S - Hempstead Avenue https://t.co/Ha6cBfVEAR,https://twitter.com/511nyLongIsland/status/1473635396521283591,Thu Jun 25 18:45:29 +0000 2009,50729679,false,Traffic & transit updates for the Long Island area provided by New York State 511. Visit the website for more feeds.,0,2049,0,115,Long Island,511NY - Long Island,511nyLongIsland,366252,,http://twitter.511ny.org/,false
"-78.02738942,34.21621622",Wed Dec 22 14:42:43 +0000 2021,,,https://www.nature.com/articles/d41586-021-03829-0,0,1473665307050975238,,,,en,"Leland, NC",false,,0,,,"<a href=""http://www.tweetcaster.com"" rel=""nofollow"">TweetCaster for Android</a>","Worrisome, I'm hopeful it's going to be a milder condition but I'm just not sure...

Omicron overpowers key COVID antibody treatments in early tests - https://t.co/DlrHTpCPUO",https://twitter.com/DrJFamPhysn/status/1473665307050975238,Fri Aug 26 16:11:11 +0000 2011,362561191,false,"Family physician with a subspecialty certification in Adolescent Medicine. In office & virtual - high quality, cost-effective healthcare for whole family.",2,46,41,1,"Leland, North Carolina USA",Robert R Johnson Jr,DrJFamPhysn,1405,,http://www.wilmingtonhealth.com,false
"-118.2445,34.0564",Wed Dec 22 17:15:23 +0000 2021,,,https://www.instagram.com/p/CXywucEJ4sF/?utm_medium=twitter,0,1473703729501196298,,,,en,"Los Angeles, CA",false,,0,,,"<a href=""http://instagram.com"" rel=""nofollow"">Instagram</a>","😇 A lil’ holiday humor to brighten up your timeline. In all seriousness, stay safe this holiday season. There’s a lot of craziness going on in the world. Wear your mask and if you’re not feeling 100% stay home. https://t.co/IX1L4rP2HV",https://twitter.com/DamarisTheCEO/status/1473703729501196298,Wed Mar 25 21:10:51 +0000 2009,26592597,false,"Brand Creative Manager, Superpreneur, Fem-Philanthropist",593,5216,590,105,"Los Angeles, CA",BIG CEO ENERGY,DamarisTheCEO,18381,,http://DamarisTheCEO.com,false
"-76.771408,39.16138",Wed Dec 22 17:22:48 +0000 2021,,,https://twitter.com/WSJ/status/1473705127022407692,0,1473705593080852486,,,,en,"Jessup, MD",false,1473705127022407692,0,,,"<a href=""https://onloft.com/tweetlogix"" rel=""nofollow"">Tweetlogix</a>",Finally https://t.co/LItlN1rNPp,https://twitter.com/thisisdking/status/1473705593080852486,Tue Apr 14 11:09:24 +0000 2009,31099398,false,"IG:@thisdking85

Regional Truck Driver. Sports Gambler. Big Titty Lover. Henny Drinker. I Also Have A Reese Cup Addiction.",488,745,695,11,West Baltimore ,My DM’S Broke,thisisdking,104609,,,false
"-84.51140545,33.93200992",Wed Dec 22 16:54:18 +0000 2021,thedistinguishedgentleman americangangster journeywithjarard,,https://www.instagram.com/p/CXyuT6MrgIL/?utm_medium=twitter,0,1473698423161462792,,,,en,"Marietta, GA",false,,0,,,"<a href=""http://instagram.com"" rel=""nofollow"">Instagram</a>","Covid test results show completely NEGATIVE and cleared for take-off! Be safe though, these Covid streets ain’t playin wit nobody! #thedistinguishedgentleman #americangangster #journeywithjarard https://t.co/BAtKy6d2tx",https://twitter.com/Jarard_J/status/1473698423161462792,Mon Dec 01 19:54:28 +0000 2008,17787234,false,ATL Radio Personality #microphonefiend #meteorologist #drummer #allpurpose #lildrummerboyz #oneMIConeLOVE #Jx3forever,1736,3282,615,55,Atlanta Georgia,Jarard J,Jarard_J,25362,,http://facebook.com/jarardjonyourradio,false
"18.44123434,-33.92632593",Wed Dec 22 15:36:33 +0000 2021,,,http://dlvr.it/SFs54v,0,1473678854116020239,,,,en,"Cape Town, South Africa",false,,0,,,"<a href=""https://dlvrit.com/"" rel=""nofollow"">dlvr.it</a>","📰 In the News | Ramaphosa in 'good spirits' while recovering from COVID, echoes call to get jab https://t.co/ZTRNkBrsPx ... | @capeNews",https://twitter.com/CapeTown/status/1473678854116020239,Sat Sep 22 06:08:16 +0000 2007,9027872,false,Curated Cape Town since 2007 | Fiercely Independent | Conversational @iAmnotMany - Entrepreneur & Digital Content Strategist - Limited Promos🕯⁽ᴰᵉᵉ⁾,13086,367074,53388,1025,"Cape Town, South Africa",Cape Town 🌩️,CapeTown,96769,,https://linktr.ee/capetown,false
"-78.02738942,34.21621622",Wed Dec 22 17:54:25 +0000 2021,,,https://www.dailymail.co.uk/news/article-10335105/Army-announce-developed-single-vaccine-protects-variants-COVID-SARS.html,0,1473713551999131656,,,,en,"Leland, NC",false,,0,,,"<a href=""http://www.tweetcaster.com"" rel=""nofollow"">TweetCaster for Android</a>","Exciting, great news from Walter Reed.  We need more and better options going forward.

Army to announce it has developed a single vaccine that protects from ALL variants of COVID and SARS | Daily Mail Online - https://t.co/VLxYBO8z8C",https://twitter.com/DrJFamPhysn/status/1473713551999131656,Fri Aug 26 16:11:11 +0000 2011,362561191,false,"Family physician with a subspecialty certification in Adolescent Medicine. In office & virtual - high quality, cost-effective healthcare for whole family.",2,46,41,1,"Leland, North Carolina USA",Robert R Johnson Jr,DrJFamPhysn,1405,,http://www.wilmingtonhealth.com,false
"-78.4781,38.0323",Wed Dec 22 16:50:57 +0000 2021,herdimmunity,,https://www.instagram.com/p/CXyt6s_D3od/?utm_medium=twitter,0,1473697577187131394,,,,en,"Charlottesville, VA",false,,0,,,"<a href=""http://instagram.com"" rel=""nofollow"">Instagram</a>","Get vaxed. That's is...that's the gram. #herdimmunity @ Charlottesville, Virginia https://t.co/dA3RydPtID",https://twitter.com/cvillevachris/status/1473697577187131394,Tue Sep 20 19:12:08 +0000 2016,778310794966605824,false,,5703,48,229,0,,ChrisinVA,cvillevachris,6749,,,false
"-0.14277499,51.4974672",Wed Dec 22 17:31:24 +0000 2021,,,https://www.instagram.com/p/CXyyjejITHh/?utm_medium=twitter,0,1473707760047079430,,,,en,"London, England",false,,0,,,"<a href=""http://instagram.com"" rel=""nofollow"">Instagram</a>","Well if this was the last time I wouldn't mind. 

Lockdown around the corner but we're ready for it.

More life and more success as always. @ Flight Club Victoria https://t.co/4mGUz3lkKG",https://twitter.com/K1st__/status/1473707760047079430,Fri Apr 02 23:14:50 +0000 2010,129018565,false,"Instagram: @K_1st_ 
Send Beats to tinyompsmusic@hotmail.co.uk   https://t.co/ZMTboWvI0B",104,191,116,2,"London,uk Brixton",THE WEEKEND OUT NOW!!!,K1st__,4906,,https://open.spotify.com/track/2nOtD9GMPqvPB7SSoibv1k?si=AR-UHeF2SFKNDtcUzt_c7g,false
"-79.7164011,43.7742911",Wed Dec 22 17:14:03 +0000 2021,Covid19 Health Lifestyle,,http://dlvr.it/SFsNSx,0,1473703391633326095,,,,en,"Brampton, Ontario",false,,1,,,"<a href=""https://dlvrit.com/"" rel=""nofollow"">dlvr.it</a>","Oxford-AstraZeneca begins work on vaccine to target Omicron: Faced with a vaccine evading Omicron variant, Oxford university and AstraZeneca announced that they have begun the work to develop a Covid shot that specifically… https://t.co/k6jWq3d7ZI #Covid19 #Health #Lifestyle",https://twitter.com/Weeklyvoice/status/1473703391633326095,Tue Mar 30 17:43:21 +0000 2010,127943720,false,Most Trusted News in North America’s South Asian Communities Since 1997,172,494,299,11,Toronto,Weekly Voice,Weeklyvoice,37110,,http://www.Weeklyvoice.com,false
"-77.6612,39.9373",Wed Dec 22 16:46:19 +0000 2021,,,https://www.instagram.com/p/CXytZhRrn7V/?utm_medium=twitter,1,1473696413473292289,,,,en,"Chambersburg, PA",false,,1,,,"<a href=""http://instagram.com"" rel=""nofollow"">Instagram</a>","This is Franklin County PA with nearly 800 positive Covid-19 tests.  Wear masks and stay safe so we all have happy holidays. @ Chambersburg, Pennsylvania https://t.co/4TBRXjao6A",https://twitter.com/fishinchbgpa/status/1473696413473292289,Thu Mar 12 18:19:25 +0000 2009,23998067,false,"Katie’s mom.  as blue as you can get … love being kind, theatre, reading … opinions my own 😎 doctors and advanced practice providers deserve respect.  Pisces",5673,147,432,6,"Chambersburg, PA",Maribeth Fish,fishinchbgpa,4370,,,false
"-83.8885181,36.03705423",Wed Dec 22 16:43:12 +0000 2021,vaccine pfizer covidvacccine,,https://www.instagram.com/p/CXytCr_rxvp/?utm_medium=twitter,0,1473695628085665795,,,,en,"Knoxville, TN",false,,0,,,"<a href=""http://instagram.com"" rel=""nofollow"">Instagram</a>","Boosted! Plus, I went to the CVS Pharmacy in Target and got a $5 coupon. Score! #vaccine #pfizer #covidvacccine @ Target Store Knoxville-North https://t.co/TVTGCAiPLW",https://twitter.com/kcs_resourcery/status/1473695628085665795,Fri Oct 30 19:21:45 +0000 2015,4077284009,false,"Covering Knox County's instructional resource needs, advocating for teachers and students, saving the world. Ask me about the union!💻📚🏫👩‍🏫👨‍🏫✊",357,210,300,3,"Knoxville, TN",Joe Sumter,kcs_resourcery,125,,http://knoxschools.org,false
"-110.30588,24.14365",Wed Dec 22 17:48:18 +0000 2021,,,https://www.instagram.com/jcomeauictx/p/CXy0fh6phOX/?utm_medium=twitter,0,1473712012488323074,,,,en,"La Paz, Baja California Sur",false,,0,,,"<a href=""http://instagram.com"" rel=""nofollow"">Instagram</a>",First post-covid workout. 2 sets of 100 reps on the lift chair. @ El Molinito Malecón de La Paz BCS https://t.co/eQia2pNWEc,https://twitter.com/jcomeau_ictx/status/1473712012488323074,Thu Sep 24 00:33:18 +0000 2009,76805882,false,"nomadic hunter-gatherer, agorist, panarchist, love beautiful women and fine beers #TGDN RT!=endorsement https://t.co/9CEYM5DJ61",18672,1173,1766,36,desert or coast,John (jc) Comeau,jcomeau_ictx,6962,,http://jc.unternet.net/,false
"4.8525,52.37917",Wed Dec 22 16:01:08 +0000 2021,bolo coronaproof staysafe staystrong covid PublicSpace,,https://www.instagram.com/p/CXyoOqAM1DI/?utm_medium=twitter,1,1473685043931459587,,,,en,"Amsterdam, Nederland",false,,0,,,"<a href=""http://instagram.com"" rel=""nofollow"">Instagram</a>","war memorial #bolo - the sitting woman - completely #coronaproof 
#staysafe #staystrong #covid #PublicSpace @ Bos en Lommerweg https://t.co/FMNfPCVRsi",https://twitter.com/LxdeJong/status/1473685043931459587,Fri Jun 05 20:22:07 +0000 2009,44985784,false,Placemaker @ https://t.co/7rj3JJJccU | Urban Innovator @ https://t.co/Zqbczi2Zcq | Regenwachter @ https://t.co/Lz8WPHB77r | #BottomUp  #CommunityBuilding #Stadmaker |,4552,853,879,56,Amsterdam,Lex de Jong 莱克斯,LxdeJong,14195,,http://instagram.com/UrbanboostNL,false
"110.55853111,-7.61858667",Wed Dec 22 15:58:14 +0000 2021,,,https://www.instagram.com/p/CXyn5W0ps8w/?utm_medium=twitter,1,1473684311362752512,,,,en,"Jatinom, Indonesia",false,,0,,,"<a href=""http://instagram.com"" rel=""nofollow"">Instagram</a>","In the midst of this covid pandemic we must be able to help each other. If we can give them food, provide provisions for their current health.
get well world

memory March 2021 @ Malioboro, Yogyakarta https://t.co/E0U0l7hnQI",https://twitter.com/PotterIndra/status/1473684311362752512,Mon Apr 14 07:43:32 +0000 2014,2443514695,false,"Aku tak akan menyerah sebelum aku berhasil.
Kalau kamu bisa kenapa saya tidak. ambil positifnya dan Majulah terus. sampai mimpimu terwujud",184,112,277,7,Indonesia,PotterIndra,PotterIndra,2435,,https://www.youtube.com/c/cariduit,false
"-77.0253638,38.9394698",Wed Dec 22 17:15:02 +0000 2021,Lockdown,,https://www.reddit.com/r/ADHD/comments/rlllkf/how_do_you_study/,0,1473703639378272264,,,,en,"Washington, DC",false,,0,,,"<a href=""https://www.hootsuite.com"" rel=""nofollow"">Hootsuite Inc.</a>","How do you study, learn, grow, retain info, etc... as you age? Are you out of practice? Are there new, better methods worth trying now that you have more time for such pursuits?

With another #Lockdown looming, I'm looking to try. 

 https://t.co/wHCZjzzJxb",https://twitter.com/Joseph_Santoro/status/1473703639378272264,Sat Jan 17 21:10:13 +0000 2009,19123904,false,"Neuro PhD, #Innovator, #Technologist, #Startup Angel, Fmr White House/OFA Honcho | #Politics #Data #Adventure | StartingBloc & Fulbright | @DMVstartup @Forbes",170394,18370,20267,2363,"Washington, DC 20009",Dr. Joseph Santoro 🇺🇲🇺🇦🇺🇳🇪🇺,Joseph_Santoro,179079,,http://linkedin.com/in/josephsantoro,false
"-122.707,45.4696",Wed Dec 22 17:30:25 +0000 2021,,,https://pamplinmedia.com/pt/9-news/531462-425107-jail-deputy-guilty-ofstealing-covid-19-vaccination-cards,0,1473707509567340554,,,,en,"Portland, OR",false,,0,,,"<a href=""https://help.twitter.com/en/using-twitter/how-to-tweet#source-labels"" rel=""nofollow"">heapevents.info</a>","News Jail Deputy Guilty Ofstealing Covid Vaccination Cards ☝ 😕 
 https://t.co/ll2hJR0tDc",https://twitter.com/heapevents/status/1473707509567340554,Sat Jan 09 15:58:46 +0000 2021,1347935690332495877,false,just heap of US events,0,7,25,1,,heapevents.info,heapevents,21302,,https://www.heapevents.info/,false
"-3.040425,51.702315",Wed Dec 22 18:18:33 +0000 2021,covid19 omicron torfaen,,https://www.instagram.com/p/CXy39KBLv-g/?utm_medium=twitter,0,1473719625909248021,,,,en,"Pontypool, Wales",false,,0,,,"<a href=""http://instagram.com"" rel=""nofollow"">Instagram</a>","Rule changes in Wales from 26th December

📷 @bbcwalesnews 

#covid19 #omicron

We’ll update you with what information we can get in due course #torfaen

Indoor restrictions of 30 people maximum https://t.co/TvRgrup5m7",https://twitter.com/TVAWales/status/1473719625909248021,Mon Apr 08 11:36:00 +0000 2013,1336417790,false,We provide help and advice to #thirdsector organisations in #Torfaen for #funding #Volunteering #support #WordFromTheThird Account monitored Mon-Fri 9-5,1789,1238,713,17,"Torfaen, South Wales",TVAWales,TVAWales,11559,,https://www.tvawales.org.uk,false
"-83.27315,42.35717",Wed Dec 22 17:33:34 +0000 2021,christmas polska,,https://www.instagram.com/p/CXyyzpDFIZj/?utm_medium=twitter,0,1473708302093758469,,,,en,"Redford, MI",false,,0,,,"<a href=""http://instagram.com"" rel=""nofollow"">Instagram</a>",Big line at Joyview for kielbasa and prime rib but everyone social distancing and behaving. Love this market #christmas #polska @ Joyview MEAT Market https://t.co/u61zP5ULie,https://twitter.com/mastruman/status/1473708302093758469,Sun Mar 22 21:07:57 +0000 2009,25880635,false,"Freep Now Director at The Detroit Free Press. Executive producer of ""On the Line"" and ""We Lived It"" podcasts.  Music lover. Reach me: mstruman@freepress.com",7040,2362,622,132,Detroit,Maryann Struman,mastruman,23248,,,true
"-81.717,27.8333",Wed Dec 22 17:45:35 +0000 2021,,,https://news.yahoo.com/covid-cases-increase-whale-calves-051249946.html,0,1473711330154713095,,,,en,"Florida, USA",false,,0,,,"<a href=""https://help.twitter.com/en/using-twitter/how-to-tweet#source-labels"" rel=""nofollow"">heapevents.info</a>","Covid Cases Increase Whale Calves ☝ 😐 
 https://t.co/GWDc3HuAUu",https://twitter.com/heapevents/status/1473711330154713095,Sat Jan 09 15:58:46 +0000 2021,1347935690332495877,false,just heap of US events,0,7,25,1,,heapevents.info,heapevents,21302,,https://www.heapevents.info/,false
"-76.72470678,39.15781883",Wed Dec 22 19:30:10 +0000 2021,,,https://www.swarmapp.com/c/0cdbrpUHHyT,0,1473737649395539970,,,,en,"Severn, MD",false,,0,,,"<a href=""http://foursquare.com"" rel=""nofollow"">Foursquare</a>","Left home, drove all the way to the mall, battled for a parking space and braved crowds of holiday shoppers…just for free rapid COVID tests. (@ Arundel Mills in Hanover, MD) https://t.co/Pbb9gyxzOA",https://twitter.com/OffThe_Record/status/1473737649395539970,Mon Jul 20 18:36:34 +0000 2009,58550794,false,"News Release Whisperer | Chronic Code Switcher | Man About Town | Higher ED #PR Guy | Aging B-Boy | Thrones Junkie
#PublicRelations #BlackTwitter",2481,2413,759,298,Baltimore / DC Region,Mr. Jones,OffThe_Record,58757,,https://www.instagram.com/gotta.love.jones/,false
"-122.7756216,45.5064511",Wed Dec 22 16:43:34 +0000 2021,,https://twitter.com/EarlPdxPearl/status/1473695722180591616/photo/1,http://dlvr.it/SFsHdy,1,1473695722180591616,,,,en,"West Slope, OR",false,,1,,,"<a href=""https://dlvrit.com/"" rel=""nofollow"">dlvr.it</a>",BREAKING: US Army Develops New Soccer Ball-Shaped Protein With 24 Faces To Treat All COVID Variants https://t.co/eZobG8wQ3Z https://t.co/KUxtW5k7fk,https://twitter.com/EarlPdxPearl/status/1473695722180591616,Wed Aug 12 02:52:34 +0000 2009,64914137,false,"Oregon Republican Christian Conservative focused on truth about Left Wing Radical @RepBlumenauer ,   #Trump Supporter.  #DrainTheSwamp",27,18705,22444,353,"Portland, OR",Earl Pearl,EarlPdxPearl,49325,,http://www.judicialwatch.org/,false
"-117.566,33.8753",Wed Dec 22 18:38:42 +0000 2021,,,https://www.instagram.com/p/CXy6Qj2P45b/?utm_medium=twitter,0,1473724695560306692,,,,en,"Corona, CA",false,,0,,,"<a href=""http://instagram.com"" rel=""nofollow"">Instagram</a>","Just posted a photo @ Corona, California https://t.co/6c2zrUzM55",https://twitter.com/masterbrow_s/status/1473724695560306692,Tue Feb 26 07:37:25 +0000 2019,1100298774105083909,false,"𝙈𝙞𝙘𝙧𝙤𝙗𝙡𝙖𝙙𝙞𝙣𝙜 & 𝙇𝙖𝙨𝙝𝙚𝙨 🍒
Certified Beauty Angel
💖 𝙇𝘼𝙏𝙄𝙉𝘼. 🔥
I wil 𝘽𝙤𝙤𝙨𝙩 your 𝘾𝙤𝙣𝙛𝙞𝙙𝙚𝙣𝙘𝙚
 with #Microblading 💖",23,132,899,0,"Fountain Valley, CA",MASTER BROWS,masterbrow_s,235,,http://www.masterbrows.biz,false
"-74.963902,39.94193",Wed Dec 22 17:00:30 +0000 2021,,,https://www.swarmapp.com/c/cSuBS1iISfi,0,1473699981303459843,,,,en,"Moorestown, NJ",false,,0,,,"<a href=""http://foursquare.com"" rel=""nofollow"">Foursquare</a>","I'm at Burlington County Covid-19 Mega-Site in Moorestown, NJ https://t.co/i0BNA9CDeO",https://twitter.com/T3DOGS/status/1473699981303459843,Sat Apr 16 16:08:16 +0000 2011,283112151,false,Living the Dream (especially when the Hokies win)!!,2111,697,2556,19,South Jersey,T3Dogs,T3DOGS,35485,,,false
"-100,40",Wed Dec 22 17:44:54 +0000 2021,,,https://www.instagram.com/carey_ingram/p/CXy0GkprNX8/?utm_medium=twitter,0,1473711154065297418,,,,en,"Kansas, USA",false,,0,,,"<a href=""http://instagram.com"" rel=""nofollow"">Instagram</a>","(CNN) -  UPDATE 

The US Food and Drug Administration on Wednesday authorized Pfizer's antiviral pill, Paxlovid, to treat Covid-19 in high-risk individuals age 12 and older who weigh at least 88 pounds. https://t.co/lkuRkuu6ai",https://twitter.com/kmacadon7/status/1473711154065297418,Fri Jan 28 00:24:58 +0000 2011,243871318,false,"Entrepreneur and Business Owner, I believe in self development and branding yourself!",54,693,1532,14,,Carey Ingram,kmacadon7,2425,,http://Www.buildingwealthsolutions.info,false
"-123.09873612,49.37216142",Wed Dec 22 16:33:29 +0000 2021,snow pandemic,,https://www.instagram.com/p/CXyr7fhJ_Fm/?utm_medium=twitter,0,1473693183456464916,,,,en,"North Vancouver, British Columbia",false,,0,,,"<a href=""http://instagram.com"" rel=""nofollow"">Instagram</a>",Neither the #snow nor the #pandemic stopped people from having lots of fun. @ Grouse Mountain-The Peak of Vancouver https://t.co/NtHyGfzgUl,https://twitter.com/goodboyanush/status/1473693183456464916,Thu Jun 16 06:45:49 +0000 2011,318272761,false,"Interested in solving problems. Popularly - Deep Learning, Computer Vision, RL. Opinions (if anyone is even interested in mine) are my own.",428,440,348,4,"Vancouver, BC","StayHome, StaySafe. Take Care of MentalHealth.",goodboyanush,1256,,https://goodboyanush.github.io/,false
