coordinates,created_at,hashtags,media,urls,favorite_count,id,in_reply_to_screen_name,in_reply_to_status_id,in_reply_to_user_id,lang,place,possibly_sensitive,quote_id,retweet_count,retweet_id,retweet_screen_name,source,text,tweet_url,user_created_at,user_id,user_default_profile_image,user_description,user_favourites_count,user_followers_count,user_friends_count,user_listed_count,user_location,user_name,user_screen_name,user_statuses_count,user_time_zone,user_urls,user_verified
"2.15572,41.3942",Wed Dec 22 21:22:26 +0000 2021,Pfizers COVID engadget,,http://engadget.com/fda-pfizer-covid-antiviral-pill-paxlovid-205104688.html,0,1473765901715611662,,,,en,"Barcelona, España",false,,0,,,"<a href=""https://tapbots.com/tweetbot/"" rel=""nofollow"">Twitter for iPhone 12 Pro Max </a>",FDA authorizes #Pfizers #COVID antiviral pill for people... https://t.co/PWncnNxUit #engadget,https://twitter.com/pidybi/status/1473765901715611662,Sat Mar 30 17:25:49 +0000 2013,1316862031,false,🤷‍♂️,219,569,590,250,Poland 🌍👈,𝔓𝔦𝔬𝔱𝔯,pidybi,633666,,,false
"-84.42188263,33.73150474",Wed Dec 22 20:33:15 +0000 2021,,,https://www.instagram.com/p/CXzHXjJP-af/?utm_medium=twitter,0,1473753520922845201,,,,en,"Atlanta, GA",false,,0,,,"<a href=""http://instagram.com"" rel=""nofollow"">Instagram</a>",Unfortunately due to a private event and to keep everyone safe with the rising number of covid cases there will be no Why You Wednesdays this week.....See you guys on the 29th!!! @ Best End Brewing Co. https://t.co/rO5dGDLX8z,https://twitter.com/futureofthecity/status/1473753520922845201,Tue Jul 07 04:17:33 +0000 2009,54447276,false,The dopest motherf***** you know!!!! #TheTransition2 out now!! #Spotify #AppleMusic #GooglePlay #Tidal etc....,2323,3836,3555,20,"atlanta, ga",That Boy Ren,futureofthecity,12957,,https://tidal.com/track/140172384,false
"4.372559,50.819818",Wed Dec 22 22:34:15 +0000 2021,Divine_Cosmic_n_Covidious_War,,,0,1473783972287164422,,,,en,"Brussel, België",,,2,,,"<a href=""http://noonlib.com"" rel=""nofollow"">هدى البيان</a>","And behind this is wisdom from Allaah so the worlds may know the One behind the global war of corona is the same One behind the cosmic war; that is Allaah.
Imam Nasser Mohammed Al-Yamani
11-12-2021
9
#Divine_Cosmic_n_Covidious_War
 Omicron
N%D&amp;ms",https://twitter.com/ahmaadramzy/status/1473783972287164422,Sat Oct 16 13:41:59 +0000 2021,1449369980617768963,false,افتح  صنبور العلم,14,76,21,0,الارض,ahmaadramzy,ahmaadramzy,2522,,,false
"-113.5016,53.5415",Wed Dec 22 21:24:11 +0000 2021,,,https://www.instagram.com/p/CXzNMnOPypZ/?utm_medium=twitter,0,1473766340989276160,,,,en,"Edmonton, Alberta",false,,0,,,"<a href=""http://instagram.com"" rel=""nofollow"">Instagram</a>","No.3 Covid Vaccine. Mission accomplished. @ Edmonton, Alberta https://t.co/HCWxhMJtgV",https://twitter.com/e_de_mercato/status/1473766340989276160,Sun Mar 04 21:22:32 +0000 2012,514781204,false,Concert Pianist - Composer - Orchestra Conductor - Alberta Symphony Orchestra Music Director,458,474,1449,7,"Edmonton, AB, Canada ",Emilio De Mercato,e_de_mercato,782,,http://www.albertasymphony.com,false
"-77.5817439,35.2640291",Wed Dec 22 20:36:23 +0000 2021,,,https://www.neusenews.com/index/2021/12/22/lenoir-county-purchases-30000-of-ppe-with-arp-funds,0,1473754311293292544,,,,en,"Kinston, NC",false,,0,,,"<a href=""http://www.squarespace.com"" rel=""nofollow"">Squarespace</a>","Lenoir County purchases $30,000 of PPE with ARP funds  https://t.co/IdZLeQijVV",https://twitter.com/NeuseNews/status/1473754311293292544,Tue Apr 10 03:18:40 +0000 2018,983544768285298688,false,"Hyper-local news with no pop-ups, no AP news and no online subscription fees. No kidding! Subscribe (for free) to our Neuse Newsletter delivered daily at 7 am.",375,1363,95,7,"Kinston, NC",Neuse News,NeuseNews,9235,,https://linktr.ee/neusenews,false
"-95.35544171,29.93571549",Wed Dec 22 19:42:29 +0000 2021,,,https://www.swarmapp.com/c/cXy0a6qd0SO,0,1473740746691911685,,,,en,"Houston, TX",false,,0,,,"<a href=""http://foursquare.com"" rel=""nofollow"">Foursquare</a>","Covid testing (@ M B Sonny Donaldson Annex in Aldine, TX) https://t.co/EjSv8wqcKc",https://twitter.com/levidoc07/status/1473740746691911685,Mon Mar 21 23:00:14 +0000 2011,270065227,false,"Wife, mother, 27 years SPED Educator! Living and loving life despite the challenges I sometimes bring to it! Proud member of Delta Sigma Theta Sorority, Inc!",6957,452,1318,12,houston,"krista levi glover, Ed.D.",levidoc07,17905,,,false
"-118.2445,34.0564",Wed Dec 22 21:39:05 +0000 2021,,,https://www.instagram.com/p/CXzO5vXPTtC/?utm_medium=twitter,0,1473770089740709889,,,,en,"Los Angeles, CA",false,,0,,,"<a href=""http://instagram.com"" rel=""nofollow"">Instagram</a>",Just posted a photo @ In Quarantine https://t.co/2VdbMeNZfh,https://twitter.com/SarahLightman/status/1473770089740709889,Wed Mar 26 07:08:45 +0000 2014,2412197826,false,🎶 LA | Nashville Recording Artist 💚 Advocate for Mental Health #BLM 📩sync + inquiries - Email mgmt @iambrandonjay Come find my music!,1718,717,249,20,Los Angeles,Sarah Lightman She/Her,SarahLightman,3235,,https://fanlink.to/SarahLightman,false
"-97.5488431,35.6197505",Wed Dec 22 22:12:05 +0000 2021,,,https://flourishrx.com/feel-better-blog/flourish-changes-hours-of-operations-due-to-covid-19-97ytj-ljs3j-8rg3b,0,1473778394563510272,,,,en,"Oklahoma City, OK",false,,0,,,"<a href=""http://www.squarespace.com"" rel=""nofollow"">Squarespace</a>",Flourish Will Be Closed December 24th &amp;amp; 25th  https://t.co/lq5LtNL4oV,https://twitter.com/FlourishRx/status/1473778394563510272,Wed Feb 11 18:06:21 +0000 2009,20607263,false,Flourish Compounding Pharmacy and Nutrition Center - We Help You Feel Well Faster!,3,354,613,11,"Oklahoma City, OK, U.S.A.",Flourish Pharmacy,FlourishRx,1322,,http://www.flourishrx.com,false
"-79.7164011,43.7742911",Wed Dec 22 19:43:33 +0000 2021,Covid19 Health Lifestyle,,http://dlvr.it/SFsnjD,1,1473741017421647880,,,,en,"Brampton, Ontario",false,,1,,,"<a href=""https://dlvrit.com/"" rel=""nofollow"">dlvr.it</a>","Omicron to dominate Europe soon, booster dose important defence: WHO: Omicron will dominate European countries within weeks, pushing an already stretched health system further to the brink, said head of the European office of… https://t.co/2FZVkNZbsD #Covid19 #Health #Lifestyle",https://twitter.com/Weeklyvoice/status/1473741017421647880,Tue Mar 30 17:43:21 +0000 2010,127943720,false,Most Trusted News in North America’s South Asian Communities Since 1997,172,494,299,11,Toronto,Weekly Voice,Weeklyvoice,37110,,http://www.Weeklyvoice.com,false
"-78.02738942,34.21621622",Wed Dec 22 20:33:29 +0000 2021,,,https://apnews.com/article/coronavirus-pandemic-pfizer-medication-f5f65e7e61d6aa9c7dfa193053e8878a,0,1473753579911630860,,,,en,"Leland, NC",false,,0,,,"<a href=""http://www.tweetcaster.com"" rel=""nofollow"">TweetCaster for Android</a>","More good news... It might be available for patients by this coming weekend...

Pfizer pill becomes 1st US-authorized home COVID treatment | AP News - https://t.co/DajwuzEraA",https://twitter.com/DrJFamPhysn/status/1473753579911630860,Fri Aug 26 16:11:11 +0000 2011,362561191,false,"Family physician with a subspecialty certification in Adolescent Medicine. In office & virtual - high quality, cost-effective healthcare for whole family.",2,46,41,1,"Leland, North Carolina USA",Robert R Johnson Jr,DrJFamPhysn,1405,,http://www.wilmingtonhealth.com,false
"-75.303163,40.607254",Wed Dec 22 21:51:48 +0000 2021,,,,0,1473773290745663488,roseroyse23,1473770545531469828,198380977,en,"Bethlehem, PA",,,0,,,"<a href=""https://onloft.com/tweetlogix"" rel=""nofollow"">Tweetlogix</a>",@roseroyse23 How about people that might have COVID but can’t afford to miss work because it’s no break for most bills right now. Shit is about to get outta control.,https://twitter.com/thisisdking/status/1473773290745663488,Tue Apr 14 11:09:24 +0000 2009,31099398,false,"IG:@thisdking85

Regional Truck Driver. Sports Gambler. Big Titty Lover. Henny Drinker. I Also Have A Reese Cup Addiction.",488,745,695,11,West Baltimore ,My DM’S Broke,thisisdking,104609,,,false
"-122.66681324,45.55213754",Wed Dec 22 20:16:13 +0000 2021,,,https://www.swarmapp.com/c/hnCqDTsK97r,0,1473749237544464393,,,,en,"Portland, OR",false,,0,,,"<a href=""http://foursquare.com"" rel=""nofollow"">Foursquare</a>","COVID booster has me feeling 🥱🥱😴 (@ Either/Or in Portland, OR) https://t.co/4K1Vt3crGe",https://twitter.com/WeslowskiB/status/1473749237544464393,Sun Apr 24 23:56:09 +0000 2011,287425629,false,"📸💁🏼‍♂️ @weslowskib on instagram 🐶🐶 Cinnamon & Kodiak 👬👨‍❤️‍👨 @christhenbarnes 🏡📍 Kenton, North PDX 🐔🤙🏻 @uofsc c/o 2012 #gamecocks",6982,120,366,23,"Portland, OR",Bobby Weslowski,WeslowskiB,15001,,http://weslowskib.com,false
"-74.0007613,40.7207559",Wed Dec 22 21:08:39 +0000 2021,,,https://www.encmoments.com/home/kktn3mdbth29c34-lht4j-ka2jd-dw965-jnzb8-w2lnm-y6xdn-63t4x-zb6m3-cs6tg-76dbb-9hcef-4gt3w,0,1473762430811611152,,,,en,"Manhattan, NY",false,,0,,,"<a href=""http://www.squarespace.com"" rel=""nofollow"">Squarespace</a>",The Lenoir County COVID-19 Update (Dec. 22)  https://t.co/eEN0t2ywIa,https://twitter.com/JuniousSmithIII/status/1473762430811611152,Sat Aug 20 17:21:51 +0000 2011,358882289,false,"Jack of all trades, master of a couple. Nine Dime born and raised, Quarter Deuce living.  Founder of ENC Moments. Writer at The Wake Weekly.",2171,2738,527,32,North Carolina,JS3,JuniousSmithIII,43240,,http://encmoments.com,false
"-74.87442329,40.16475986",Wed Dec 22 20:55:06 +0000 2021,johnsonandjohnson moderna mixandmatch vaccine booster flushot,,https://www.instagram.com/p/CXzJ3i5OqCL/?utm_medium=twitter,0,1473759021391921175,,,,en,"Levittown, PA",true,,0,,,"<a href=""http://instagram.com"" rel=""nofollow"">Instagram</a>","Started with J&amp;J and now I’m boosted with Moderna and the flu shot. Stay healthy everyone 😷 ❤️

#johnsonandjohnson #moderna #mixandmatch #vaccine #booster #flushot @ Walgreens https://t.co/1yGCoOc5bj",https://twitter.com/PAPA_MALLY/status/1473759021391921175,Sun Nov 07 02:21:22 +0000 2010,212793101,false,#215 ✌️ #Moroccan #Irish #English ☕️ @papa_mally #papamally,4863,260,247,69,"Shelter Island, NY",PAPAMALLYMAL,PAPA_MALLY,14781,,https://soundcloud.com/papa_mally/anna-wintour-in-the-midnight-hour-8,false
"-118.2445,34.0564",Wed Dec 22 20:36:21 +0000 2021,,,https://www.instagram.com/p/CXzHuVNP8pq/?utm_medium=twitter,0,1473754302472761345,,,,en,"Los Angeles, CA",false,,0,,,"<a href=""http://instagram.com"" rel=""nofollow"">Instagram</a>","This is the face of COVID… even though I still got it, I’m so grateful to be FULLY vaccinated. To think of how much worse it could be for me if I wasn’t, makes me shudder to think… @ Los Angeles, California https://t.co/yjqbr1iKAk",https://twitter.com/ExiledfromNY/status/1473754302472761345,Sun Oct 25 08:50:58 +0000 2009,85042057,false,"Perpetually searching for the Jets

https://t.co/MG2gmjnozF",1070,383,1803,3,"Los Angeles, Ca",BBBBeni,ExiledfromNY,957,,http://www.youtube.com/benitoborjas,false
"-82.1986,34.6932",Wed Dec 22 22:27:18 +0000 2021,2022trifecta spartan trifecta,,https://www.instagram.com/p/CXzUa47LIg2/?utm_medium=twitter,0,1473782224927535111,,,,en,"Fountain Inn, SC",false,,0,,,"<a href=""http://instagram.com"" rel=""nofollow"">Instagram</a>","I'm ready to start training for my #2022trifecta after breaking my ankle 2 years ago and then covid I'm beyond ready to conquer this goal!

#spartan #trifecta @ Fountain Inn, South Carolina https://t.co/YNxgBy3EsC",https://twitter.com/hairt8/status/1473782224927535111,Sat Oct 29 03:02:54 +0000 2011,400474893,false,"I am a graduate of the Art Institute of Charleston studying Interior Design. I have a wonderful family and a great fieance, Joey! I love my friends and family",362,84,260,12,"Greenville, SC",Tiffany Hair,hairt8,2413,,http://tiffanylavende5.wix.com/lavender-interiors,false
"-112.92709,53.80345",Wed Dec 22 21:34:54 +0000 2021,covid covidvacccine vaccinationdone ᴠᴀᴄᴄɪɴᴇssᴀᴠᴇʟɪᴠᴇs bruderheim alberta,,https://www.instagram.com/p/CXzObN0vyM_/?utm_medium=twitter,1,1473769038371344389,,,,en,"Bruderheim, Alberta",false,,0,,,"<a href=""http://instagram.com"" rel=""nofollow"">Instagram</a>",3rd shot DONE! #covid #covidvacccine #vaccinationdone✔️ #ᴠᴀᴄᴄɪɴᴇssᴀᴠᴇʟɪᴠᴇs #bruderheim #alberta @ Bruderheim Pharmacy https://t.co/EI2UYWQndH,https://twitter.com/PaulPluggedIn/status/1473769038371344389,Sun May 08 22:49:38 +0000 2011,295387713,false,"Dad of 3 young men, husband of a warrior woman, radio veteran, sports junkie and lover of the left wing. It's my opinion, don't get pissy if u don't like it",1049,1059,202,33,"Bruderheim, Alberta",Paul Plugged In,PaulPluggedIn,22851,,,false
"-6.22884035,53.3743812",Wed Dec 22 22:04:50 +0000 2021,,,https://www.instagram.com/p/CXzR2Xlsxup/?utm_medium=twitter,2,1473776570078666752,,,,en,"Dublin City, Ireland",false,,1,,,"<a href=""http://instagram.com"" rel=""nofollow"">Instagram</a>",The annual married v singles football game is down for midday this Sunday !  Bar open from 12 to discuss tactics! (Full covid procedures in place). @ St. Vincents GAA Club Marino https://t.co/eZjuwtQk0i,https://twitter.com/StVincentsGAA1/status/1473776570078666752,Tue May 01 13:41:27 +0000 2012,568216288,false,"Founded Marino 1931 All-Ireland SFC 1976, 2008 & 2014; Dublin & Leinster SFC 2016; Dublin SCC 2015-2017; Dublin & Leinster SCC 2019",45149,8694,1107,35,"Dublin, Ireland",StVincentsGAA,StVincentsGAA1,27921,,http://www.stvincentsgaa.ie/,false
"-118.00951516,33.896798",Wed Dec 22 21:17:20 +0000 2021,yamagicofchristmas seasonoflight,,https://www.instagram.com/p/CXzMaX2P6Z9/?utm_medium=twitter,1,1473764615523819522,,,,en,"La Mirada, CA",false,,0,,,"<a href=""http://instagram.com"" rel=""nofollow"">Instagram</a>","Three delays, two rebookings, and one lost luggage all to get to my first theatre experience since COVID started. Could not ask for a better show to go to! #yamagicofchristmas #seasonoflight https://t.co/KjvuYLCbfK",https://twitter.com/alto_angel_/status/1473764615523819522,Tue Nov 06 04:33:07 +0000 2018,1059664954708570112,false,Just a Broadway nerd halfway stuck in her emo phase in a million fandoms,3554,15,407,0,,Wendy 🎶🎭🌹,alto_angel_,429,,,false
"4.372559,50.819818",Wed Dec 22 22:35:15 +0000 2021,Divine_Cosmic_n_Covidious_War,,,1,1473784226793373705,,,,en,"Brussel, België",,,2,,,"<a href=""http://noonlib.com"" rel=""nofollow"">هدى البيان</a>","the One behind the global war of corona is the same One behind the cosmic war; that is Allaah no God but Him, Lord of the kingdoms of both the heavens and the earth.
Imam Nasser Mohammed Al-Yamani
11-12-2021
10
#Divine_Cosmic_n_Covidious_War
 Omicron
/KQdoi",https://twitter.com/MiiTg9qoofErgRU/status/1473784226793373705,Sat Mar 27 17:19:05 +0000 2021,1375859693667680262,false,احب القراءه,62,107,23,0,,النسر,MiiTg9qoofErgRU,2325,,,false
"-122.38679409,47.57050358",Wed Dec 22 21:02:43 +0000 2021,,,https://www.instagram.com/p/CXzKvZkPP_l/?utm_medium=twitter,0,1473760936716488704,,,,en,"Seattle, WA",false,,0,,,"<a href=""http://instagram.com"" rel=""nofollow"">Instagram</a>","Caught a nasty bug, hacking up a storm. Stay safe out there. Home test negative on Covid! Honey taking care of me 🙂 @ West Seattle https://t.co/8esmMgo3UU",https://twitter.com/rickyrichard/status/1473760936716488704,Wed Apr 16 00:15:15 +0000 2008,14402776,false,"Master craftsman, entrepreneur, hobby winemaker, enjoying life with my family and the outdoors. Instagram: riverview_const_services",1450,595,1915,12,"Seattle, WA",Ricky Richard,rickyrichard,1905,,http://www.riverviewcs.co,false
"106.7341599,-6.2636323",Wed Dec 22 23:16:04 +0000 2021,,,,0,1473794498270404608,worldnews24eu,1473765523997564941,1438124003013636000,en,Kalimangso Street,,,0,,,"<a href=""http://twitter.com/download/android"" rel=""nofollow"">Twitter for Android</a>","@worldnews24eu In contrast to polio vaccines and others.

Omicron must be very smart viruses, indeed.

6:15 AM Thu, December 23, 2021",https://twitter.com/donaldsitompul1/status/1473794498270404608,Mon Apr 29 18:14:16 +0000 2019,1122927090901192705,false,Male. Asylum seeker. Scholarship ambush victim. @sitompul_donald is my prev tweet. Threema: VSNY232D https://t.co/aW4OuZ4mgM: @sitompul_donald,883,96,177,0,"Kalimangso gg Halim 97, 15222 ",Donald Sitompul,donaldsitompul1,9562,,http://sitompulquest.wordpress.com,false
"-74.0007613,40.7207559",Thu Dec 23 03:24:39 +0000 2021,,,https://www.welcometo7220.com/football/nn3z35kdxlnzmfzf9shmk1iqjn54wj,1,1473857055316447232,,,,en,"Manhattan, NY",false,,0,,,"<a href=""http://www.squarespace.com"" rel=""nofollow"">Squarespace</a>",Mountain West Relaxes Hard-Line Apporach on Covid Cancellations  https://t.co/3vz4diqPAe,https://twitter.com/TracyRingolsby/status/1473857055316447232,Thu Mar 25 17:51:06 +0000 2010,126380866,false,"2005  J.G. Taylor Spink Award.
Covering baseball https://t.co/EBpWR1EqTl, Wyoming athletics https://t.co/1DtRzGsEbg. 
Insider KFBC & KOA.",327,17408,975,678,"Cheyenne, Wy",Tracy Ringolsby,TracyRingolsby,71786,,http://insidetheseams.com,true
"-73.47935661,45.6677507",Thu Dec 23 00:54:06 +0000 2021,,,http://dlvr.it/SFtQJf,0,1473819167463641090,,,,en,"Varennes, Québec",false,,0,,,"<a href=""https://dlvrit.com/"" rel=""nofollow"">dlvr.it</a>","Fighting Stigma : Omicron: Promising data on the variant but the NHS could still be overwhelmed — iNews: Either Boris Johnson is wrong, or the leaders of Northern Ireland, Wales and Scotland are. A child receives a dose of the Pfizer/BioNTech vaccine ... https://t.co/nZxtTK20TT",https://twitter.com/StigmabaseN/status/1473819167463641090,Wed Sep 15 15:55:47 +0000 2010,191092262,false,Ireland — Scotland — Inuit —  Svenska  | Keeping up-to-date on global exclusion — Stigmabase is a canadian internet non-profit Initiative,0,1610,1297,111,Ireland | Scotland | Inuit | Skandinavien,Stigmabase | NORDIC,StigmabaseN,952258,,https://www.stigmabase.org/,false
"-73.692001,40.6819",Thu Dec 23 02:25:49 +0000 2021,SouthernStateParkway,,http://511ny.org/EventDetails/TRANSCOM/ORI241823909,0,1473842249964347402,,,,en,"North Valley Stream, NY",false,,0,,,"<a href=""https://511ny.org"" rel=""nofollow"">NYRegions</a>",Construction on #SouthernStateParkway EB from Exit 15 - North Corona Avenue to Exit 20N - Baldwin Road https://t.co/gsB89YgEc1,https://twitter.com/511nyLongIsland/status/1473842249964347402,Thu Jun 25 18:45:29 +0000 2009,50729679,false,Traffic & transit updates for the Long Island area provided by New York State 511. Visit the website for more feeds.,0,2049,0,115,Long Island,511NY - Long Island,511nyLongIsland,366252,,http://twitter.511ny.org/,false
"144.97178442,-37.80477536",Thu Dec 23 00:48:11 +0000 2021,Covid BoosterShot Pfizer,,https://www.instagram.com/p/CXzki42veLE/?utm_medium=twitter,0,1473817679530106880,,,,en,"Melbourne, Victoria",false,,0,,,"<a href=""http://instagram.com"" rel=""nofollow"">Instagram</a>","Oh she’s a grand ole building, the site of our first national parliament &amp; first home of our federation #Covid #BoosterShot #Pfizer @ Royal Exhibition Building https://t.co/DVWj0ZubWz",https://twitter.com/LittleTedOnBed/status/1473817679530106880,Wed Apr 11 01:28:27 +0000 2012,550595851,false,"Wise Old Teddy, SciFi fan, Comedy buff, Intellectual, Confidant, Tear absorbent, likes having adventures and the Worlds Best Cuddler!",24996,419,1124,8,"Williamstown, Australia",Little Ted On Bed,LittleTedOnBed,6336,,https://www.facebook.com/LittleTedOnBed,false
"-122.295,47.66437",Wed Dec 22 23:28:07 +0000 2021,,,https://www.instagram.com/p/CXzbYW9PGaL/?utm_medium=twitter,0,1473797527975587842,,,,en,"Seattle, WA",false,,0,,,"<a href=""http://instagram.com"" rel=""nofollow"">Instagram</a>","First time ever waiting in a line for COVID-19 testing. Worried I was half an hour early. Now, will be five minutes past my appointment time by the time I get to the actual test. @ IMA Softball  Fields https://t.co/g2d6G0QVEY",https://twitter.com/counsellour/status/1473797527975587842,Fri Jun 05 10:55:53 +0000 2009,44867825,false,Cleric. Consultant. Counsellour at large.,21127,217,443,4,"Seattle, WA",James Do Hung LEE 🏳️‍🌈🍂,counsellour,7255,,https://www.facebook.com/counsellour,false
"-117.202,33.5696",Thu Dec 23 03:04:37 +0000 2021,,,https://www.instagram.com/p/CXz0JtxKTgiqvw4A7lS_ekhvaDaPkpoDjU41Ic0/?utm_medium=twitter,0,1473852012362145803,,,,en,"Murrieta, CA",false,,0,,,"<a href=""http://instagram.com"" rel=""nofollow"">Instagram</a>","This was a tough few days for Dylan. One sick young man,this was right b4 the Covid 19. Dad was home sick as well. Thank you @kaiserPermanente
Murrieta his doctor was right on top of things https://t.co/voWuQcAfhR",https://twitter.com/kbears11/status/1473852012362145803,Sun Apr 19 23:02:54 +0000 2009,33334845,false,,5042,89,236,2,"California, USA",karen l vail,kbears11,4625,,,false
"142.50319108,-37.12262449",Wed Dec 22 22:59:04 +0000 2021,AROUNDANDABOUTTRAVEL GRAMPIANS VTIC,,https://www.aroundandabout.com.au/grampians-halls-gap/ https://www.instagram.com/p/CXzYDdbve2L/?utm_medium=twitter,0,1473790217094053897,,,,en,"Halls Gap, Victoria",false,,0,,,"<a href=""http://instagram.com"" rel=""nofollow"">Instagram</a>","First tour to the Grampians since lockdown. 
Wonderful morning
#AROUNDANDABOUTTRAVEL 
#GRAMPIANS 
#VTIC 

https://t.co/dhF78nyHqg @ Boroka Lookout https://t.co/VV0xVsMiDQ",https://twitter.com/Aroundandabout1/status/1473790217094053897,Tue Jan 19 03:24:23 +0000 2010,106298973,false,Around And About Travel,9,61,155,0,"Melbourne, Australia",Walter Edgar,Aroundandabout1,550,,http://www.aroundandabout.com.au,false
"-4.309626,55.852472",Thu Dec 23 03:29:07 +0000 2021,Glasgow,,https://www.glasgowtimes.co.uk/news/19802618.man-allegedly-coronavirus-symptoms-failed-tell-police-officer-later-tested-positive/?ref=rss,0,1473858178400104455,,,,en,"Glasgow, Scotland",false,,1,,,"<a href=""http://oysttyer.github.io/oysttyer/"" rel=""nofollow"">oysttyer</a>",#Glasgow Man who allegedly had coronavirus symptoms failed to tell police officer who later tested positive 📰: https://t.co/Fm1Yez8RYH,https://twitter.com/_cirrus_minor_/status/1473858178400104455,Sat Sep 12 16:02:12 +0000 2009,73672052,false,"Most days  i'm a bot who resides in a Raspberry Pi Model B, cron  and #!/bin/bash are my best pals. Every other Saturday i  frequent the Penny Arcade. #watp",586,943,1325,175,"46.869100,103.848242",OnFileNotWanted,_cirrus_minor_,400329,,http://cirrusuk.wordpress.com,false
"-87.84667432,42.6240836",Wed Dec 22 23:36:14 +0000 2021,,,https://www.swarmapp.com/c/dFmlzEiCkcS,0,1473799573692952584,,,,en,"Kenosha, WI",false,,0,,,"<a href=""http://foursquare.com"" rel=""nofollow"">Foursquare</a>","Sadie’s covid booster (at @Walgreens in Kenosha, WI) https://t.co/4DWVzJjvxN",https://twitter.com/Shirley_Perez/status/1473799573692952584,Tue Mar 10 02:55:45 +0000 2009,23547475,false,"Chuck Taylor Addict. Extensive collection of offensive tees. Coffee hater! Mom to 3 girls, Umma to Rhiannon & Tessa. Feminist, Atheist, Spread 💚 & be kind!",118782,452,2030,20,Kenosha Wisconsin,Shirley Tutor-Perez,Shirley_Perez,88549,,,false
"-77.099,38.9833",Thu Dec 23 03:12:25 +0000 2021,mentalhealth mindset wellness selfcarehelp therapy telehealth health bethesda washingtondc dmv productivity anxiety covid_19 covid19anxiety healthandwellness,,https://www.instagram.com/p/CXz1DRDMRmz/?utm_medium=twitter,1,1473853978035298304,,,,en,"Bethesda, MD",false,,1,,,"<a href=""http://instagram.com"" rel=""nofollow"">Instagram</a>",Take care of your mental health. #mentalhealth #mindset #wellness #selfcarehelp #therapy #telehealth #health #bethesda #washingtondc #dmv #productivity #anxiety #covid_19 #covid19anxiety #healthandwellness https://t.co/xUvW10w6Lt,https://twitter.com/HellerPsych/status/1473853978035298304,Sun Oct 14 01:09:29 +0000 2012,879043830,false,"A boutique private practice in Bethesda, MD that provides therapy and testing services to children, adolescents, and adults for a wide variety of issues.",22,403,730,16,"Bethesda, Maryland",Heller Psychology,HellerPsych,2480,,http://www.hellerpsychologygroup.com,false
"-73.56725453,45.75975883",Thu Dec 23 00:54:07 +0000 2021,,,http://dlvr.it/SFtQL6,0,1473819172916248577,,,,en,"Mascouche, Québec",false,,0,,,"<a href=""https://dlvrit.com/"" rel=""nofollow"">dlvr.it</a>",Fighting Stigma: 'No country can boost its way out of the pandemic' – World Health Organisation — Irish Examiner: WHO's director-general Dr Tedros Adhanom Ghebreyesu also warned that it is wrong for any nation to think that boosters alone can guarantee… https://t.co/62F9adKDIJ,https://twitter.com/StigmabaseN/status/1473819172916248577,Wed Sep 15 15:55:47 +0000 2010,191092262,false,Ireland — Scotland — Inuit —  Svenska  | Keeping up-to-date on global exclusion — Stigmabase is a canadian internet non-profit Initiative,0,1610,1297,111,Ireland | Scotland | Inuit | Skandinavien,Stigmabase | NORDIC,StigmabaseN,952258,,https://www.stigmabase.org/,false
