coordinates,created_at,hashtags,media,urls,favorite_count,id,in_reply_to_screen_name,in_reply_to_status_id,in_reply_to_user_id,lang,place,possibly_sensitive,quote_id,retweet_count,retweet_id,retweet_screen_name,source,text,tweet_url,user_created_at,user_id,user_default_profile_image,user_description,user_favourites_count,user_followers_count,user_friends_count,user_listed_count,user_location,user_name,user_screen_name,user_statuses_count,user_time_zone,user_urls,user_verified
"-0.12485951,51.50538967",Wed Dec 22 07:12:03 +0000 2021,France lockdown vaccinerules,,http://dlvr.it/SFqm35,0,1473551892374429700,,,,en,"London, England",false,,1,,,"<a href=""https://dlvrit.com/"" rel=""nofollow"">dlvr.it</a>",#France seeks to avoid a #lockdown with tougher #vaccinerules https://t.co/Y4XVIrTOW8,https://twitter.com/BritishHeraldUK/status/1473551892374429700,Wed Feb 17 17:49:42 +0000 2010,115123902,false,Where Britain Meets the World® | The Official handle of #britishherald,350,133884,607,283,"London, United Kingdom",British Herald,BritishHeraldUK,57106,,http://www.britishherald.com,false
"-76.691881,39.291163",Wed Dec 22 13:38:31 +0000 2021,,,https://twitter.com/BuffaloBills/status/1473647592928169991,1,1473649150294216718,,,,en,"Baltimore, MD",false,1473647592928169991,1,,,"<a href=""https://onloft.com/tweetlogix"" rel=""nofollow"">Tweetlogix</a>",The Bills fan base bout to be in shambles. https://t.co/YhIcaJIaYL,https://twitter.com/thisisdking/status/1473649150294216718,Tue Apr 14 11:09:24 +0000 2009,31099398,false,"IG:@thisdking85

Regional Truck Driver. Sports Gambler. Big Titty Lover. Henny Drinker. I Also Have A Reese Cup Addiction.",488,745,695,11,West Baltimore ,My DM’S Broke,thisisdking,104609,,,false
"-73.692001,40.6819",Wed Dec 22 13:45:04 +0000 2021,SouthernStateParkway,,,0,1473650801105149953,,,,en,"North Valley Stream, NY",,,0,,,"<a href=""https://511ny.org"" rel=""nofollow"">NYRegions</a>",Cleared: Incident on #SouthernStateParkway EB from Exit 15 - North Corona Avenue to Exit 17S - Hempstead Avenue,https://twitter.com/511nyLongIsland/status/1473650801105149953,Thu Jun 25 18:45:29 +0000 2009,50729679,false,Traffic & transit updates for the Long Island area provided by New York State 511. Visit the website for more feeds.,0,2049,0,115,Long Island,511NY - Long Island,511nyLongIsland,366252,,http://twitter.511ny.org/,false
"-0.065,51.875",Wed Dec 22 15:21:22 +0000 2021,,,https://www.instagram.com/p/CXyjrVmNA2s/?utm_medium=twitter,0,1473675035340595206,,,,en,"Dane End, East",false,,0,,,"<a href=""http://instagram.com"" rel=""nofollow"">Instagram</a>",Surprise care package from my work daughters to ease the Covid isolation blues. Thanks @annacm95 @aj_comedygal Love you both 🥰🥰 @ Dane End https://t.co/KVJpSVsLXn,https://twitter.com/DaneEndDame/status/1473675035340595206,Fri Nov 13 19:32:01 +0000 2009,89774240,false,"Mother, midwife, cook and cake baker",5855,55,208,0,,Olga Oseman,DaneEndDame,1180,,,false
"147.33269443,-42.88477323",Wed Dec 22 05:41:24 +0000 2021,ferry maskup hobart,,https://www.instagram.com/p/CXxhTf7BOPD/?utm_medium=twitter,1,1473529081358696449,,,,en,"Hobart, Tasmania",false,,0,,,"<a href=""http://instagram.com"" rel=""nofollow"">Instagram</a>","Cyclist-Terrorist COVID chic.

#ferry #maskup #hobart @ Brooke Street Pier https://t.co/DUBO0gO7M5",https://twitter.com/Kris_McCracken/status/1473529081358696449,Sun Dec 30 21:48:38 +0000 2007,11668722,false,"Just because I am mad all the time doesn't make me ""Always angry"". I am trying to do better.

Opinions are my own (or recycled from far smarter people).",7402,82,164,4,"Hobart, Tasmania",Kris McCracken,Kris_McCracken,8397,,,false
"-89.3876,43.0797",Wed Dec 22 13:30:35 +0000 2021,,,https://www.hngnews.com/waunakee_tribune/news/covid-19/article_001795e7-6080-5b64-91bb-5c41d8f78d57.html,0,1473647156821205000,,,,en,"Wisconsin, USA",false,,0,,,"<a href=""https://help.twitter.com/en/using-twitter/how-to-tweet#source-labels"" rel=""nofollow"">heapevents.info</a>","Covid ☝ 😐 
 https://t.co/REBWDMaoJ6",https://twitter.com/heapevents/status/1473647156821205000,Sat Jan 09 15:58:46 +0000 2021,1347935690332495877,false,just heap of US events,0,7,25,1,,heapevents.info,heapevents,21302,,https://www.heapevents.info/,false
"-6.23870154,53.33276367",Wed Dec 22 15:29:42 +0000 2021,,,,0,1473677131221774343,fogaratigh,1473675714893340677,1339584626671513600,en,"Dublin City, Ireland",,,0,,,"<a href=""http://tapbots.com/tweetbot"" rel=""nofollow"">Tweetbot for iΟS</a>","@fogaratigh All vaccines in use in Ireland have EMA conditional marketing authorisation. That means they’re approved, though the approval is time limited and requires renewing.",https://twitter.com/rsynnott/status/1473677131221774343,Thu Mar 15 16:06:06 +0000 2007,1231031,false,"🏳️‍🌈 Tech-debtor. Social Justice Warlock. he/him. No transphobes, please. @rsynnott@mastodon.online",1441,684,995,25,"Dublin, Ireland",Robert Synnott,rsynnott,22463,,http://myblog.rsynnott.com/,false
"39.120104,21.630101",Wed Dec 22 10:44:32 +0000 2021,,,https://www.swarmapp.com/c/31Enf5Mzqn9,0,1473605369410854918,,,,en,"جدة, المملكة العربية السعودية",false,,0,,,"<a href=""http://foursquare.com"" rel=""nofollow"">Foursquare</a>","I'm at Alborg Laboratories Covid-19 Test Drive Thru in Jeddah, Makkah https://t.co/9rmBxvXWSD",https://twitter.com/Aimansyahran/status/1473605369410854918,Sun Aug 30 21:21:09 +0000 2009,70217393,false,Graphic Designer 🖥 Chef 👨🏻‍🍳 Bowler 🎳,9929,276,1545,4,,Aiman Syahran #16,Aimansyahran,12731,,,false
"-1.5994,53.743",Wed Dec 22 08:34:18 +0000 2021,squirrel garden workfromhome highlightoftheday,,https://www.instagram.com/triathlon_paul/p/CXx1F7ts1s_/?utm_medium=twitter,2,1473572593231929352,,,,en,"Gildersome, England",false,,0,,,"<a href=""http://instagram.com"" rel=""nofollow"">Instagram</a>","Geoff has arrived in my garden. Nuts aplenty Geoff, tuck in. I have a family of these cuties that frequent my garden, I’ve named them all Geoff. #squirrel #garden #workfromhome #highlightoftheday https://t.co/Xo77s2bEz0",https://twitter.com/RamblingVlogger/status/1473572593231929352,Thu Apr 02 05:05:15 +0000 2009,28286118,false,"YouTuber, British Triathlon Coach, Triathlon England Vice Chair Yorkshire, GoTri Ambassador, founder Morley Run Club & Tri Club, Anxiety Sufferer. +day job.",4600,404,165,10,"Live in Leeds, born in Hull",The Rambling Vlogger 🇬🇧,RamblingVlogger,5198,,http://www.youtube.com/theramblingvlogger,false
"-82.1313419,27.0597269",Wed Dec 22 14:59:18 +0000 2021,,,,0,1473669481595650052,SalSports,1473667778594938880,69109217,en,"Punta Gorda, FL",,,0,,,"<a href=""http://www.tweetcaster.com"" rel=""nofollow"">TweetCaster for Android</a>","@SalSports Since the COVID shots provide no immunity, then by definition they are not vaccines......so it's not a vaccine mandate, it's a ""health supplement"" mandate at best",https://twitter.com/M0rocco19/status/1473669481595650052,Sat Jun 25 04:14:43 +0000 2011,323623652,false,#BillsMafia,26,22,55,1,"North Port, FL",Mo,M0rocco19,6898,,,false
"32.65746955,0.59521038",Wed Dec 22 05:45:32 +0000 2021,,,https://www.instagram.com/p/CXxhx1trVsv/?utm_medium=twitter,0,1473530121025830912,,,,en,"Luwero, Uganda",false,,0,,,"<a href=""http://instagram.com"" rel=""nofollow"">Instagram</a>",50 MPs return with COVID from Tanzania - @dailymonitorug @ Ham Royal Enterprise &amp;  Auto Spare Parts https://t.co/2GVsCrxTrR,https://twitter.com/HAMROYAL1/status/1473530121025830912,Fri Feb 28 02:03:41 +0000 2020,1233211074176061441,false,Ham Royal Enterprises,41,150,851,0,"Kampala, Uganda",HAM SB4 (My Random Thoughts),HAMROYAL1,666,,,false
"116.52099609,40.01709786",Wed Dec 22 05:03:09 +0000 2021,,,http://dlvr.it/SFqXBz,0,1473519456756244480,,,,en,"北京, 中华人民共和国",false,,1,,,"<a href=""https://dlvrit.com/"" rel=""nofollow"">dlvr.it</a>","ZHNR — Chinese city suspends school amid Covid-19 outbreak: The double danger of a Covid-19 outbreak and deadly haemorrhagic fever cases has prompted the northwestern Chinese city of Xian to suspend school ...  

View article... https://t.co/7FodYMlYzl",https://twitter.com/StigmabaseU/status/1473519456756244480,Tue Oct 26 15:04:54 +0000 2010,208056970,false,Asia — भारत  — Türkçe — Čeština — ελληνικά | Keeping up-to-date on global exclusion — Stigmabase is a canadian internet non-profit Initiative,0,2528,2405,117,WORLDWIDE,Stigmabase | UN,StigmabaseU,1607149,,https://www.stigmabase.org/,false
"133.68232727,-32.12074612",Wed Dec 22 04:59:04 +0000 2021,,https://twitter.com/wcsentinel/status/1473518428656783360/photo/1,https://www.portlincolntimes.com.au/story/7560334/update-covid-case-in-port-lincoln/?src=rss,0,1473518428656783360,,,,en,"Ceduna, South Australia",false,,0,,,"<a href=""https://dlvrit.com/"" rel=""nofollow"">dlvr.it</a>",UPDATE: COVID case in Port Lincoln https://t.co/gdbUFi5B7t https://t.co/4JDMLVKM6F,https://twitter.com/wcsentinel/status/1473518428656783360,Sun Feb 15 02:58:28 +0000 2009,20888940,false,"West Coast Sentinel covers local news on South Australia's Eyre Peninsula for areas including Ceduna, Streaky Bay, Kimba, Kyancutta, Wudinna & Elliston",10,690,112,24,"Ceduna, South Australia",West Coast Sentinel,wcsentinel,8122,,http://www.westcoastsentinel.com.au,false
"-6.23870154,53.33276367",Wed Dec 22 12:05:57 +0000 2021,,,https://twitter.com/COVID19DataIE/status/1473617317124882439,6,1473625857893806082,,,,en,"Dublin City, Ireland",false,1473617317124882439,0,,,"<a href=""http://tapbots.com/tweetbot"" rel=""nofollow"">Tweetbot for iΟS</a>",I’ll take my good news where I can these days. This is the lowest it’s been since mid November. https://t.co/FbgKGnMudA,https://twitter.com/rsynnott/status/1473625857893806082,Thu Mar 15 16:06:06 +0000 2007,1231031,false,"🏳️‍🌈 Tech-debtor. Social Justice Warlock. he/him. No transphobes, please. @rsynnott@mastodon.online",1441,684,995,25,"Dublin, Ireland",Robert Synnott,rsynnott,22463,,http://myblog.rsynnott.com/,false
"-73.897929,40.878642",Wed Dec 22 14:26:24 +0000 2021,,,https://www.instagram.com/p/CXydYsNrzAo/?utm_medium=twitter,0,1473661202559488001,,,,en,"Bronx, NY",false,,0,,,"<a href=""http://instagram.com"" rel=""nofollow"">Instagram</a>",COVID testing in the BX this morning. Easily 150 people in line at 9:15am. The trucks are…up there somewhere. 🤦‍♂️ @ Kingsbridge https://t.co/1Y44740ohC,https://twitter.com/JimmyLudwigNYC/status/1473661202559488001,Tue May 08 13:28:38 +0000 2012,574474976,false,"Actor, Teacher, Runner; UP to NYC & back again. Head of @NorthernMichU BFA Acting Program! @HappyHourGuys, @UMich Alum. Hubs @KBDubsNYC, Dad to #JustJake",37927,1554,292,77,"Bronx, NY",James Ludwig,JimmyLudwigNYC,64861,,https://linktr.ee/jimmyludwignyc,true
"-77.01181561,38.99218087",Wed Dec 22 15:20:03 +0000 2021,,,http://ow.ly/20X030s4OQR,73,1473674703374065668,,,,en,"Silver Spring, MD",false,,13,,,"<a href=""https://www.hootsuite.com"" rel=""nofollow"">Hootsuite Inc.</a>","this year scientists in MoCo
1) got a Covid vaccine approved in 34 countries
2) found a potential cure for AIDS
and now 3) created a second vaccine effective against all Covid and SARS variants
we should be so lucky to live here!
https://t.co/ZZc5doXTgl",https://twitter.com/justupthepike/status/1473674703374065668,Tue Aug 26 16:48:20 +0000 2008,15999017,false,"(mostly) MD housing policy @ggwash; also ice cream, pit bulls, and emo. just out here getting cuter. he/they. COMING SOON: @montgomerymall2",64221,13128,1875,314,silver spring,dan reed 🦀🏳️‍🌈👋🏾,justupthepike,26440,,https://linktr.ee/justupthepike,true
"-84.268461,33.756907",Wed Dec 22 13:22:09 +0000 2021,,,,0,1473645031420538883,,,,en,"Avondale Estates, GA",,,0,,,"<a href=""https://onloft.com/tweetlogix"" rel=""nofollow"">Tweetlogix</a>",You really can’t find no Covid place with availability 😭,https://twitter.com/auntieashh/status/1473645031420538883,Sun Apr 10 13:56:21 +0000 2011,280030979,false,no.,11670,1392,352,13,,✨,auntieashh,199140,,,false
"115.74663462,-32.05332353",Wed Dec 22 05:45:05 +0000 2021,twelveandahalf,,https://www.instagram.com/p/CXxhuf8v2UE/?utm_medium=twitter,0,1473530007712641029,,,,en,"Perth, Western Australia",false,,0,,,"<a href=""http://instagram.com"" rel=""nofollow"">Instagram</a>",Christmas is coming for all my clients in 2021 with @garyvee book #twelveandahalf. Next lockdown is done! @ Jennifer Castle Fremantle Real Estate https://t.co/t0El8qtG16,https://twitter.com/JenniferCastle_/status/1473530007712641029,Tue Nov 19 04:38:32 +0000 2013,2202488354,false,I help people realise their dreams and goals through the acquisition and sale of real estate. I make your home irresistible with un-real estate marketing!,57,28,49,3,,Jennifer Castle,JenniferCastle_,2324,,,false
"-119.746,36.17",Wed Dec 22 15:01:23 +0000 2021,,,https://www.cbsnews.com/news/spacex-covid-outbreak-los-angeles-omicron/,0,1473670007171301380,,,,en,"California, USA",false,,0,,,"<a href=""https://help.twitter.com/en/using-twitter/how-to-tweet#source-labels"" rel=""nofollow"">heapevents.info</a>","Spacex Covid Outbreak Los Angeles Omicron ☝ 😐 
 https://t.co/OmR6vqyQA6",https://twitter.com/heapevents/status/1473670007171301380,Sat Jan 09 15:58:46 +0000 2021,1347935690332495877,false,just heap of US events,0,7,25,1,,heapevents.info,heapevents,21302,,https://www.heapevents.info/,false
"121.01324365,14.5205194",Wed Dec 22 08:25:40 +0000 2021,,,https://www.instagram.com/p/CXx0GvQh1G8vcSd8AeGbCCNw3D8v5OExCF31DY0/?utm_medium=twitter,0,1473570420024655874,,,,en,"Lungsod ng Pasay, Pambansang Punong Rehiyon",false,,0,,,"<a href=""http://instagram.com"" rel=""nofollow"">Instagram</a>",1st domestic travel since the start of the pandemic :) @ Ninoy Aquino International Airport Terminal 3 https://t.co/xYbtz0oGOr,https://twitter.com/beloncio/status/1473570420024655874,Wed Apr 15 06:07:39 +0000 2009,31354249,false,"Electronics Engineer. PECE, PMP. Aspiring Photographer. Aspiring dog parent. (Aspiring) Marathoner. Running after God's own heart.",439,54,87,0,Philippines,Ariel Beloncio,beloncio,6967,,http://www.facebook.com/arielx,false
"-0.12485951,51.50538967",Wed Dec 22 05:04:12 +0000 2021,,,http://dlvr.it/SFqXKQ,0,1473519721337155586,,,,en,"London, England",false,,1,,,"<a href=""https://dlvrit.com/"" rel=""nofollow"">dlvr.it</a>",Omicron casts a new shadow over economy’s pandemic recovery https://t.co/Mt7qJtY8BD,https://twitter.com/BritishHeraldUK/status/1473519721337155586,Wed Feb 17 17:49:42 +0000 2010,115123902,false,Where Britain Meets the World® | The Official handle of #britishherald,350,133884,607,283,"London, United Kingdom",British Herald,BritishHeraldUK,57106,,http://www.britishherald.com,false
"-122.53111111,38.36444444",Wed Dec 22 06:07:45 +0000 2021,,,https://www.instagram.com/p/CXxkUj7LMyJ/?utm_medium=twitter,22,1473535711311761408,,,,en,"Glen Ellen, CA",false,,0,,,"<a href=""http://instagram.com"" rel=""nofollow"">Instagram</a>","Moments before I informed my sister that I will be living in her mountainside guest cabin for the remainder of the pandemic. @ Glen Ellen, California https://t.co/fWq4NMhHfL",https://twitter.com/HartHanson/status/1473535711311761408,Mon Mar 16 16:57:08 +0000 2009,24724698,false,I created some TV shows. And I wrote a book.,19950,110497,2937,2236,California,Hart Hanson,HartHanson,72153,,https://instagram.com/hartdhanson/,true
"77.19102783,28.5974128",Wed Dec 22 13:04:08 +0000 2021,,,http://dlvr.it/SFrdNK,0,1473640498124312578,,,,en,"नई दिल्ली, भारत",false,,1,,,"<a href=""https://dlvrit.com/"" rel=""nofollow"">dlvr.it</a>","INNR — Can hybrid and remote work models provide opportunities to address women's participation ...: A July 2020 McKinsey study found that female job loss rates due to COVID-19 ... In India, owing to preventative lockdowns, remote and hybrid work ...  

… https://t.co/Z324ngqy6t",https://twitter.com/StigmabaseA/status/1473640498124312578,Sat May 29 17:26:03 +0000 2010,149585330,false,Australia - New Zealand — 日本語  — 中国 — 한국말 |  Keeping up-to-date on global exclusion — Stigmabase is a canadian internet non-profit Initiative. Founded in 2010.,0,2908,1275,139,Asia | Australia - Pacific,Stigmabase | ASIA,StigmabaseA,1550447,,https://www.stigmabase.org/,false
"-73.47935661,45.6677507",Wed Dec 22 12:53:36 +0000 2021,,,http://dlvr.it/SFrbyg,0,1473637846472749057,,,,en,"Varennes, Québec",false,,0,,,"<a href=""https://dlvrit.com/"" rel=""nofollow"">dlvr.it</a>","Fighting Stigma : Parents of premature baby born during lockdown preparing for special Christmas — The Independent: ... with their son Robert 'Robbie' Johnston at their home in Ballyclare, Northern Ireland (Liam McBurney/PA). A couple whose first child… https://t.co/SPOv3MNTEJ",https://twitter.com/StigmabaseN/status/1473637846472749057,Wed Sep 15 15:55:47 +0000 2010,191092262,false,Ireland — Scotland — Inuit —  Svenska  | Keeping up-to-date on global exclusion — Stigmabase is a canadian internet non-profit Initiative,0,1610,1297,111,Ireland | Scotland | Inuit | Skandinavien,Stigmabase | NORDIC,StigmabaseN,952258,,https://www.stigmabase.org/,false
"7.20299088,62.7468747",Wed Dec 22 12:20:04 +0000 2021,,,https://khub.net/documents/135939561/430986542/Effectiveness+of+COVID-19+vaccines+against+Omicron+variant+of+concern.pdf/f423c9f4-91cb-0274-c8c5-70e8fad50074,1,1473629408254701578,james_clark,1473604962131197952,9672332,en,"Molde, Norge",false,,0,,,"<a href=""https://tapbots.com/software/tweetbot/mac"" rel=""nofollow"">Tweetbot for Mac</a>","@james_clark Never seen data for 2xAZ + AZ booster, but AZ effect against omicron does not seem good.

This paper suggests an 2xAZ + mRNA booster work very well (table on last page)

https://t.co/efgUm9lBY8",https://twitter.com/larsga/status/1473629408254701578,Sat Apr 12 14:32:05 +0000 2008,14369057,false,"Author, speaker, and researcher of farmhouse ale. Norwegian tweets @larsga_no",7110,2863,447,94,"Oslo, Norway",Lars Marius Garshol,larsga,16671,,https://www.garshol.priv.no,false
"76.41611519,30.33500501",Wed Dec 22 14:00:59 +0000 2021,,,https://patialapolitics.com/8-new-covid-case-reported-in-patiala/ https://www.instagram.com/p/CXyaehEBYwH/?utm_medium=twitter,0,1473654805608517641,,,,en,"पटियाला, भारत",true,,0,,,"<a href=""http://instagram.com"" rel=""nofollow"">Instagram</a>","*8 new Covid case reported in Patiala*

https://t.co/PEPv9in6g8 @ Patiala Politics https://t.co/KpAUdS3Pur",https://twitter.com/patialapolitics/status/1473654805608517641,Tue Jun 14 07:20:13 +0000 2016,742617624886935553,false,Patiala Politics will give update about Patiala city,14,701,469,3,"पटियाला, भारत",Patiala Politics,patialapolitics,31592,,http://www.patialapolitics.com,false
"-9.45935702,51.56286925",Wed Dec 22 13:21:19 +0000 2021,,,https://www.instagram.com/p/CXyV75cqh_8/?utm_medium=twitter,4,1473644824637194242,,,,en,"Cork, Ireland",false,,1,,,"<a href=""http://instagram.com"" rel=""nofollow"">Instagram</a>",Covid 19 Antigen Tests 3.99 @ Camiers of Ballydehob https://t.co/nvS1yVj5Qc,https://twitter.com/IvanCamier/status/1473644824637194242,Tue Jun 07 01:31:11 +0000 2011,312380853,false,"Owner/Propieter of the the last service station en-route to Mizen Head, we sell TOP Fuels and have a fully stocked shop full of your household and grocery needs",3,97,67,1,Ballydehob. West Cork,Camiers Ballydehob,IvanCamier,141,,,false
"-1.07269049,51.26858274",Wed Dec 22 07:51:02 +0000 2021,,,https://www.securitymagazine.com/articles/96779-how-cyber-underwriters-can-better-respond-to-the-current-cyber-pandemic?utm_source=dlvr.it&utm_medium=twitter,0,1473561706341158915,,,,en,"Basingstoke, England",false,,0,,,"<a href=""https://dlvrit.com/"" rel=""nofollow"">dlvr.it</a>","With cybercrime on the rise, below are a few ways that underwriters can provide more comprehensive cyber insurance. https://t.co/V6C4yGm5Xy",https://twitter.com/nevans1984/status/1473561706341158915,Mon Feb 01 14:59:15 +0000 2010,110437198,false,"Cybersecurity activist! Shouting loud about the worlds Cyber crimes, but also the more positive things in a working life.",53,89,273,10,"51.461729,-1.014563",Nick Evans,nevans1984,2903,,https://www.linkedin.com/in/nicholasjevans/,false
"-84.6514,37.669",Wed Dec 22 15:15:25 +0000 2021,,,https://www.charlestonchronicle.net/2020/07/15/coronavirus-opens-a-pandoras-box-of-scams/,0,1473673536388616200,,,,en,"Kentucky, USA",false,,0,,,"<a href=""https://help.twitter.com/en/using-twitter/how-to-tweet#source-labels"" rel=""nofollow"">heapevents.info</a>","Coronavirus Opens A Pandoras Box Of Scams ☝ 😐 
 https://t.co/reTVu4hXSy",https://twitter.com/heapevents/status/1473673536388616200,Sat Jan 09 15:58:46 +0000 2021,1347935690332495877,false,just heap of US events,0,7,25,1,,heapevents.info,heapevents,21302,,https://www.heapevents.info/,false
"116.52099609,40.01709786",Wed Dec 22 07:10:04 +0000 2021,,,http://dlvr.it/SFqlnD,1,1473551394829320194,,,,en,"北京, 中华人民共和国",false,,1,,,"<a href=""https://dlvrit.com/"" rel=""nofollow"">dlvr.it</a>","ZHNR — Chinese city suspends school amid Covid-19 outbreak and deadly haemorrhagic fever cases: Xian in Shaanxi province reported 21 Covid-19 cases and one asymptomatic patient on Sunday, bringing the total number of infections in this wave ...  

… https://t.co/kapNvg6HyK",https://twitter.com/StigmabaseU/status/1473551394829320194,Tue Oct 26 15:04:54 +0000 2010,208056970,false,Asia — भारत  — Türkçe — Čeština — ελληνικά | Keeping up-to-date on global exclusion — Stigmabase is a canadian internet non-profit Initiative,0,2528,2405,117,WORLDWIDE,Stigmabase | UN,StigmabaseU,1607149,,https://www.stigmabase.org/,false
"-0.50521,50.81019",Wed Dec 22 09:35:04 +0000 2021,,,https://www.instagram.com/p/CXx8CnxKL2g/?utm_medium=twitter,1,1473587886268338176,,,,en,"Littlehampton, England",false,,0,,,"<a href=""http://instagram.com"" rel=""nofollow"">Instagram</a>","I love being able to come home from a hard nights work in the mornings to be greeted by this adorable face 😍😍 Love you Reggie 💙💙 @ Rustington, West Sussex https://t.co/PstY1MWsEQ",https://twitter.com/TheRedSeagull92/status/1473587886268338176,Mon Aug 15 22:32:21 +0000 2011,355802867,false,"Father to Reggie👶🏻, Fiancè to @SparklySeagull, North Stand #BHAFC Supporter💙, @AlbionObsessed Co-Host🎙, Gamer🎮 & Wrestling Fan🤼‍♂️",29705,1222,2020,23,"Littlehampton, England",Dan,TheRedSeagull92,57716,,http://instagram.com/TheRedSeagull92,false
"-2.36527356,53.75590384",Wed Dec 22 07:44:32 +0000 2021,,,http://dlvr.it/SFqqWc,0,1473560068377354240,,,,en,"Accrington, England",false,,0,,,"<a href=""https://dlvrit.com/"" rel=""nofollow"">dlvr.it</a>","2021 Neologisms: These are alternate meanings for common words during this time of Covid. 1. Coffee (noun), The person on whom one coughs. 2. Flabbergasted (adjective), Appalled over how much weight you gained. 3. Abdicate (verb), To give up all hope of… https://t.co/xUlcH36EfZ",https://twitter.com/accyweb/status/1473560068377354240,Mon Oct 06 13:46:56 +0000 2008,16613744,false,Accrington Web on Twitter.,44,4325,3661,29,"Accrington, Lancashire, UK",accyweb,accyweb,5000,,http://www.accringtonweb.com,false
"-76.691881,39.291163",Wed Dec 22 13:41:02 +0000 2021,,,https://twitter.com/RyanatMGH/status/1473646659070484482,0,1473649785601146893,,,,en,"Baltimore, MD",false,1473646659070484482,0,,,"<a href=""https://onloft.com/tweetlogix"" rel=""nofollow"">Tweetlogix</a>",Wild. https://t.co/wDbdVUD6cu,https://twitter.com/thisisdking/status/1473649785601146893,Tue Apr 14 11:09:24 +0000 2009,31099398,false,"IG:@thisdking85

Regional Truck Driver. Sports Gambler. Big Titty Lover. Henny Drinker. I Also Have A Reese Cup Addiction.",488,745,695,11,West Baltimore ,My DM’S Broke,thisisdking,104609,,,false
"-78.02738942,34.21621622",Wed Dec 22 14:41:21 +0000 2021,,,https://www.cnn.com/2021/12/21/politics/fauci-covid-isolation-period-omicron-cnntv/index.html,0,1473664965307416581,,,,en,"Leland, NC",false,,0,,,"<a href=""http://www.tweetcaster.com"" rel=""nofollow"">TweetCaster for Android</a>","Some good, smart news from Dr F.  I would probably disagree with testing of asymptomatic folks on general principle....

Fauci says reducing the recommended Covid isolation period for the fully vaccinated is being considered - CNNPolitics - https://t.co/4LfTvHm2TW",https://twitter.com/DrJFamPhysn/status/1473664965307416581,Fri Aug 26 16:11:11 +0000 2011,362561191,false,"Family physician with a subspecialty certification in Adolescent Medicine. In office & virtual - high quality, cost-effective healthcare for whole family.",2,46,41,1,"Leland, North Carolina USA",Robert R Johnson Jr,DrJFamPhysn,1405,,http://www.wilmingtonhealth.com,false
"145.16321905,-37.95330079",Wed Dec 22 11:15:14 +0000 2021,perksracing,,https://www.instagram.com/tv/CXyHcmGp_2R/?utm_medium=twitter,1,1473613093494218762,,,,en,"Melbourne, Victoria",false,,0,,,"<a href=""http://instagram.com"" rel=""nofollow"">Instagram</a>","Posted @withregram • @perksracing 💰 💰 💰 

Corona Lad salutes for Perks Racing today at Sandown in a $50,000 race. Couldn’t be happier with the way he’s racing!

#perksracing @ Sandown Racecourse https://t.co/4M5CBOeziv",https://twitter.com/dunn_racing/status/1473613093494218762,Fri Jan 17 00:25:11 +0000 2014,2286965536,false,"Trainer, Retired Jumps Jockey, Breaking In, Pre-training, Ready 2 Race prep.",2457,1466,863,9,Cranbourne Training Complex,Nathan Dunn Racing,dunn_racing,3620,,http://www.nathandunn.com.au,false
