coordinates,created_at,hashtags,media,urls,favorite_count,id,in_reply_to_screen_name,in_reply_to_status_id,in_reply_to_user_id,lang,place,possibly_sensitive,quote_id,retweet_count,retweet_id,retweet_screen_name,source,text,tweet_url,user_created_at,user_id,user_default_profile_image,user_description,user_favourites_count,user_followers_count,user_friends_count,user_listed_count,user_location,user_name,user_screen_name,user_statuses_count,user_time_zone,user_urls,user_verified
"23.71863009,37.98300171",Sat Dec 04 09:22:13 +0000 2021,,,https://twitter.com/dianalizia/status/1466990273578295298,2,1467061672011575303,,,,en,"Αττική, Ελλάς",false,1466990273578295298,0,,,"<a href=""http://tapbots.com/tweetbot"" rel=""nofollow"">Tweetbot for iΟS</a>","“a deep mistrust in local and international institutions”

That’s the real problem! Forget anti-vaxing, forget anti-masking, THIS IS THE REAL PLAGUE. Cure this and your pandemic is under control in no time.

Will you? No, of course not. https://t.co/iz8IsgQjLh",https://twitter.com/photisss/status/1467061672011575303,Sun May 18 20:49:11 +0000 2008,14824425,false,"Flemish by birth, European by choice, Greek by desire. Partially Crete, Greece, εν μέρει Ρηνανία-Παλατινάτο",1590,622,124,72,Iraklio GR - Έρμηςκαϊλ ΓΕ,photis,photisss,33358,,http://www.oriste.com/,false
"4.8982,52.3769",Sat Dec 04 08:33:04 +0000 2021,,,https://www.instagram.com/p/CXDepHfM0P1bk50Pz3MHhKv1oy0p7kAxihntz80/?utm_medium=twitter,0,1467049300643307524,,,,en,"Amsterdam, Nederland",false,,0,,,"<a href=""http://instagram.com"" rel=""nofollow"">Instagram</a>","Release day from my COVID isolation. Bit misty. Can't wait to get out for a nice long walk! @ Amsterdam, Netherlands https://t.co/Zjb11m8eps",https://twitter.com/MJFBennett/status/1467049300643307524,Sun Oct 09 09:48:50 +0000 2011,387585384,false,Fan of rum. Part time ninja.,14118,271,1651,6,"Leeds, England",Mark Bennett,MJFBennett,6100,,,false
"-79.4523813,43.7143142",Sat Dec 04 11:12:04 +0000 2021,,,,0,1467089315780075523,,,,en,"Toronto, Ontario",,,0,,,"<a href=""http://ijg.me"" rel=""nofollow"">ijg</a>","Alarm (single Source) [North York]
Lawrence Avenue
b/w Corona Street / Dufferin Street
Dispatched: 04/12/21 @ 06:02 EST
[Stn: 132] DistChief-13 Pumper-132 Pumper-145
General Area:",https://twitter.com/tofireN/status/1467089315780075523,Sat Dec 27 16:07:14 +0000 2008,18409843,false,@tofiren - Toronto Fire North Command Active Incidents - In Emergency call #911.  Brought to you by @ijg,0,4340,7,109,,Toronto Fire North,tofireN,378106,,https://iaingrant.com,false
"-111.074249,45.6706102",Sat Dec 04 17:33:32 +0000 2021,,,http://dlvr.it/SDlg6V,6,1467185315584495617,,,,en,"Bozeman, MT",false,,0,,,"<a href=""https://dlvrit.com/"" rel=""nofollow"">dlvr.it</a>","AP:  COVID-19 cases, hospitalizations declining in Montana https://t.co/xfhoulORee",https://twitter.com/bozchron/status/1467185315584495617,Wed Mar 04 00:33:58 +0000 2009,22707076,false,The official Twitter feed for the Bozeman Daily Chronicle.,92,21691,1279,468,"Bozeman, Montana",Bozeman Daily Chronicle,bozchron,104285,,http://bozemandailychronicle.com/,false
"-73.56726563,45.63697547",Sat Dec 04 07:35:10 +0000 2021,,,http://dlvr.it/SDkTQh,0,1467034729207664644,,,,en,"Montréal, Québec",false,,1,,,"<a href=""https://dlvrit.com/"" rel=""nofollow"">dlvr.it</a>","Fighting Stigma : AIDS, vaccine mandates, inflation and more — Newsday: Eliminate stigma about HIV/AIDS Dec. 1 commemorated World AIDS Day, and this year's theme is global solidarity and shared responsibility [""Report: ... https://t.co/JuJIY7cvT4",https://twitter.com/stigmabase/status/1467034729207664644,Wed Sep 01 21:06:16 +0000 2010,185789961,false,Dedicated to Education | Keeping up-to-date on global exclusion — Serving the truth — Stigmabase is a canadian internet non-profit Initiative. Founded in 2010,0,963,689,71,Worldwide,STIGMABASE | EDU,stigmabase,820501,,https://www.stigmabase.org/,false
"-6.3594233,54.1846712",Sat Dec 04 16:05:02 +0000 2021,Newry,,http://newrytimes.com/2021/12/02/covid-christmas-a-huge-dilemma-for-lonely-older-people-newry-times/,2,1467163040965664773,,,,en,"Newry, Northern Ireland",false,,0,,,"<a href=""https://www.hootsuite.com"" rel=""nofollow"">Hootsuite Inc.</a>","After last year’s Lockdown Christmas, a survey by Age NI reveals that spending Christmas with friends and family is more important than ever before for older people. 

Read more &gt;&gt; https://t.co/0bAc9OntdK

#Newry",https://twitter.com/NewryTimes/status/1467163040965664773,Fri Nov 18 02:18:13 +0000 2011,415228549,false,Latest news in #Newry and Mourne: https://t.co/BLqm8IajQ3,269,6558,4061,51,Newry,Newry Times,NewryTimes,17300,,http://www.newrytimes.com,false
"-6.3594221,54.1846718",Sat Dec 04 14:05:02 +0000 2021,Newry,,http://newrytimes.com/2021/12/02/trusts-open-series-of-vaccination-booster-clinics-newry-times/,0,1467132843562315789,,,,en,"Newry, Northern Ireland",false,,0,,,"<a href=""https://www.hootsuite.com"" rel=""nofollow"">Hootsuite Inc.</a>","Health Minister Robin Swann has confirmed a major expansion of NI’s COVID-19 vaccination programme to help meet current and forthcoming demand for booster doses.

Read more &gt;&gt; https://t.co/yrh3bQiyYX

#Newry",https://twitter.com/NewryTimes/status/1467132843562315789,Fri Nov 18 02:18:13 +0000 2011,415228549,false,Latest news in #Newry and Mourne: https://t.co/BLqm8IajQ3,269,6558,4061,51,Newry,Newry Times,NewryTimes,17300,,http://www.newrytimes.com,false
"-0.7594,52.0406",Sat Dec 04 13:23:54 +0000 2021,quarantine marriotthotel scandalous finedining ukgovernment,,https://www.instagram.com/p/CXD_7R3sEcefVoNOI7oWvOc5SolOTIMyLpuP840/?utm_medium=twitter,0,1467122492946870283,,,,en,"Milton Keynes, England",false,,0,,,"<a href=""http://instagram.com"" rel=""nofollow"">Instagram</a>","The delights of life in a quarantine hotel!  
Day 1, lunch - rubber macaroni cheese 😞
#quarantine #marriotthotel #scandalous #finedining #ukgovernment @ Milton Keynes https://t.co/lKfMyDnA7r",https://twitter.com/purplepenny17/status/1467122492946870283,Thu Oct 28 13:47:39 +0000 2010,209084862,false,,22,24,54,0,,Penelope James,purplepenny17,298,,,false
"11.50445185,3.86544698",Sat Dec 04 11:34:40 +0000 2021,,,https://www.instagram.com/p/CXDzbIFOQy9/?utm_medium=twitter,1,1467095003868672000,,,,en,"Centre, Cameroon",false,,0,,,"<a href=""http://instagram.com"" rel=""nofollow"">Instagram</a>",COVID Vaccination Drive at ASOY this morning.  Members of our community and their families and friends received boosters or first shots.  Huge thank you to the Ministry of Health for making this possible. https://t.co/ZHgbAFliXD,https://twitter.com/ASOYCameroon/status/1467095003868672000,Wed Dec 14 10:44:04 +0000 2016,808985903196672000,false,"American School of Yaounde ensures students will achieve academic success, develop critical thinking skills, & become responsible, compassionate global citizens",4,136,97,4,"Yaoundé, Cameroon",ASOY,ASOYCameroon,170,,http://www.asoy.org/,false
"-77.86973123,34.23423423",Sat Dec 04 14:25:54 +0000 2021,,,https://finance.yahoo.com/news/guess-who-pays-for-all-those-millions-of-covid-vaccines-105713330.html,0,1467138094835154949,,,,en,"Kings Grant, NC",false,,0,,,"<a href=""http://www.tweetcaster.com"" rel=""nofollow"">TweetCaster for Android</a>","A fascinating deep dive into costs of vaccinations.  A new business model in the pharmaceutical industry.

Guess who pays for all those millions of COVID-19 vaccines - https://t.co/yyE90Jlbmh",https://twitter.com/DrJFamPhysn/status/1467138094835154949,Fri Aug 26 16:11:11 +0000 2011,362561191,false,"Family physician with a subspecialty certification in Adolescent Medicine. In office & virtual - high quality, cost-effective healthcare for whole family.",2,46,41,1,"Leland, North Carolina USA",Robert R Johnson Jr,DrJFamPhysn,1405,,http://www.wilmingtonhealth.com,false
"101.4989392,3.06471149",Sat Dec 04 11:20:14 +0000 2021,,,https://www.instagram.com/p/CXDxxeujtxS/?utm_medium=twitter,3,1467091370074681354,,,,en,"Bandar Petaling Jaya, Selangor",false,,0,,,"<a href=""http://instagram.com"" rel=""nofollow"">Instagram</a>","Finally graduated! 🎓👩🏻‍🎓🌻
.

((i still blame covid for not being able to attend a normal convocation ceremony blergh)) @ Dewan Agong Tuanku Canselor (Datc) Uitm, Shah Alam https://t.co/Lu3iA131yu",https://twitter.com/nurizzhanani/status/1467091370074681354,Sun Jan 02 08:28:42 +0000 2011,233103170,false,"be a lady, but also a bit*h if necessary",34539,568,611,1,,Nur Izz Hanani,nurizzhanani,52271,,https://linktr.ee/nurizzhanani,false
"-73.6197588,45.51950705",Sat Dec 04 09:37:09 +0000 2021,,,http://dlvr.it/SDkjRw,1,1467065429369655302,,,,en,"Montréal, Québec",false,,0,,,"<a href=""https://dlvrit.com/"" rel=""nofollow"">dlvr.it</a>","TW : Build on HIV investments for future pandemic preparedness: ...dedicated HIV services in many settings. HIV is still driven primarily through stigma, discrimination and social inequities, which we have battled for almost four decades. We have yet to… https://t.co/lU2XoSsQQc",https://twitter.com/stigmabase/status/1467065429369655302,Wed Sep 01 21:06:16 +0000 2010,185789961,false,Dedicated to Education | Keeping up-to-date on global exclusion — Serving the truth — Stigmabase is a canadian internet non-profit Initiative. Founded in 2010,0,963,689,71,Worldwide,STIGMABASE | EDU,stigmabase,820501,,https://www.stigmabase.org/,false
"-2.58333,51.45",Sat Dec 04 10:23:44 +0000 2021,christmasshopping glitterysocks ofcourse wearamask,,https://www.instagram.com/p/CXDrTk8M0O_/?utm_medium=twitter,0,1467077149689630722,,,,en,"Bristol, England",false,,0,,,"<a href=""http://instagram.com"" rel=""nofollow"">Instagram</a>","#christmasshopping in my #glitterysocks #ofcourse #wearamask😷 @ Bristol, United Kingdom https://t.co/P9r40qsDFN",https://twitter.com/squeegiluigi/status/1467077149689630722,Sat Oct 27 13:44:40 +0000 2012,908148482,false,"Mama mia pericoloso! Who said: 'One person can make a difference and every person should try'? Well, I am saying it right here, right now.",3155,102,787,3,,Louise Kearney,squeegiluigi,4074,,,false
"-73.6197588,45.51950705",Sat Dec 04 15:37:08 +0000 2021,,https://twitter.com/stigmabase/status/1467156020610801667/photo/1,http://dlvr.it/SDlQj4,0,1467156020610801667,,,,en,"Montréal, Québec",false,,0,,,"<a href=""https://dlvrit.com/"" rel=""nofollow"">dlvr.it</a>","TW : 1-Tok Kaunselin Helpim Lain: ...60%. The escalation in violence has been triggered by COVID-19 restrictions, social impacts, stigma and misinformation about the virus and vaccination.Kinime said the helpline also acts as an entry point in terms of… https://t.co/PBEFfzPX7i https://t.co/8ZZqQ29BUj",https://twitter.com/stigmabase/status/1467156020610801667,Wed Sep 01 21:06:16 +0000 2010,185789961,false,Dedicated to Education | Keeping up-to-date on global exclusion — Serving the truth — Stigmabase is a canadian internet non-profit Initiative. Founded in 2010,0,963,689,71,Worldwide,STIGMABASE | EDU,stigmabase,820501,,https://www.stigmabase.org/,false
"-106.051,48.8209",Sat Dec 04 14:45:38 +0000 2021,,,https://www.belgrade-news.com/news/state_regional/sidney-health-workers-protest-mandate/article_64a42ecf-5e61-5097-b0d9-142bfde4bd0c.html,0,1467143058487754759,,,,en,"Montana, USA",false,,0,,,"<a href=""https://help.twitter.com/en/using-twitter/how-to-tweet#source-labels"" rel=""nofollow"">heapevents.info</a>","Sidney Health Workers Protest Mandate ☝ 😐 
 https://t.co/EsVpFpKY8f",https://twitter.com/heapevents/status/1467143058487754759,Sat Jan 09 15:58:46 +0000 2021,1347935690332495877,false,just heap of US events,0,7,25,1,,heapevents.info,heapevents,21301,,https://www.heapevents.info/,false
"-79.7164011,43.7742911",Sat Dec 04 12:13:03 +0000 2021,Canada canada covid19,,http://dlvr.it/SDl0h6,0,1467104663610613763,,,,en,"Brampton, Ontario",false,,1,,,"<a href=""https://dlvrit.com/"" rel=""nofollow"">dlvr.it</a>","The Canadian Government funds early learning and child care centres: GATINEAU, QC, Dec. 3, 2021 /CNW/ – Parents and guardians of children with disabilities have always faced unique challenges in finding quality, affordable and… https://t.co/cYDg5pLIAU #Canada #canada #covid19",https://twitter.com/Weeklyvoice/status/1467104663610613763,Tue Mar 30 17:43:21 +0000 2010,127943720,false,Most Trusted News in North America’s South Asian Communities Since 1997,172,494,299,11,Toronto,Weekly Voice,Weeklyvoice,37110,,http://www.Weeklyvoice.com,false
"0.57787,50.85711",Sat Dec 04 12:53:42 +0000 2021,lockdown NaturePhotography morning trees lake,,https://www.instagram.com/p/CXD8dzJoc-L/?utm_medium=twitter,0,1467114889693077509,,,,en,"Hastings, England",false,,0,,,"<a href=""http://instagram.com"" rel=""nofollow"">Instagram</a>","Beautiful morning whilst the world was in #lockdown #NaturePhotography #morning #trees #lake @ Hastings, East Sussex https://t.co/Pcp5lug3Ep",https://twitter.com/Yasmine43853381/status/1467114889693077509,Sat Nov 13 14:55:03 +0000 2021,1459535093358280705,false,"£2 per photo, cheaper than chips. https://t.co/Jf74XYYFKB
 If an image can make smile then that snap was worth taking.",619,171,490,0,"South East, England",Yazz_photoskoop,Yasmine43853381,408,,http://photoskoop.picfair.com,false
"-1.08919937,52.66934368",Sat Dec 04 12:18:05 +0000 2021,bundle8 lipsandlashes,,https://www.instagram.com/p/CXD3mqjstbl/?utm_medium=twitter,0,1467105930022207491,,,,en,"Leicester, England",false,,0,,,"<a href=""http://instagram.com"" rel=""nofollow"">Instagram</a>","Thought it was time to stop looking like covid scarecrow 🙈
Washed and dried my hair and with some amazing  products I look more human…. Want to know what I’ve used drop me a message ☺️

#bundle8 #lipsandlashes https://t.co/YfL1KHIIC0",https://twitter.com/Domino1973L/status/1467105930022207491,Thu Jun 24 14:34:23 +0000 2010,159125551,false,"Founder of Lips 👄 & Lashes ☺️changing lives, saving lashes 💫",20295,551,483,8,"Leicester, England",Laura West,Domino1973L,36537,,https://www.youniqueproducts.com/lauraloucom/business#.WqPGU3-nzYV,false
"-104.786094,38.834301",Sat Dec 04 18:22:57 +0000 2021,,,https://www.swarmapp.com/c/kHntnnpvpmQ,0,1467197749405884421,,,,en,"Colorado Springs, CO",false,,0,,,"<a href=""http://foursquare.com"" rel=""nofollow"">Foursquare</a>","Got my booster! 💉 (@ COVID-19 Vaccination Clinic in Colorado Springs, CO) https://t.co/v9LZ6RUrYU",https://twitter.com/Mzchibious/status/1467197749405884421,Sun May 03 02:10:15 +0000 2009,37339436,false,"Documentarian, WordPress fan, troubleshooter, and problem solver. She/Her",72750,203,744,9,,Christi N,Mzchibious,5744,,http://cnickerson.com,false
"-116.15723499,34.09700173",Sat Dec 04 13:18:18 +0000 2021,kidswhoclimb girlswhoclimb homeschool,,https://www.instagram.com/p/CXD_SShFmFH/?utm_medium=twitter,0,1467121080544468996,,,,en,"California, USA",false,,0,,,"<a href=""http://instagram.com"" rel=""nofollow"">Instagram</a>","It was about 80 degrees at climbing class. December? What December? #kidswhoclimb #girlswhoclimb #homeschool @ Indian Cove Campground, Joshua Tree National Park https://t.co/k3xfZogSvp",https://twitter.com/vanalama/status/1467121080544468996,Wed May 13 21:45:58 +0000 2009,39844895,false,"SAG-AFTRA Actor, improviser, writer, filmmaker, comedian, creator of The Mexican Revelation, co-founder/producer of the Hi-Desert Fringe. Instagram: @vanalama",11660,1080,1457,19,"Yucca Valley, CA",Ann Van Haney,vanalama,3115,,https://www.youtube.com/channel/UCCgC-TpEDg3P0GU5kbkrOTQ,false
"-83.38,42.66",Sat Dec 04 14:48:14 +0000 2021,nomoregunviolence schoolgunviolence gunviolenceawareness,,https://www.instagram.com/davemejiaslaw/p/CXEJk66Le_J/?utm_medium=twitter,0,1467143715936428033,,,,en,"Waterford, MI",false,,0,,,"<a href=""http://instagram.com"" rel=""nofollow"">Instagram</a>","Hey science and COVID denying conspiracy theorists…what are you doing to fight these school closures? #nomoregunviolence #schoolgunviolence #gunviolenceawareness @ Oakland County, Michigan https://t.co/mLl8fd7ol6",https://twitter.com/davemejias/status/1467143715936428033,Mon Dec 15 02:25:45 +0000 2008,18128245,false,David Mejias is a Long Island Family Law & Personal Injury Legal Professional.,86,2201,295,3,"New York, NY",David Mejias,davemejias,518,,https://davidmejiasattorney.com/,false
"11.04168726,59.94809676",Sat Dec 04 15:02:07 +0000 2021,,,,2,1467147210164998147,FromKinToCover,1466955106977521668,1358327653,en,"Rælingen, Norge",,,0,,,"<a href=""https://tapbots.com/software/tweetbot/mac"" rel=""nofollow"">Tweetbot for Mac</a>","@FromKinToCover @walshrac @GANyborg No. Covid has low “dispersion factor”, meaning that most people infect 0 others, some 1-2, and a very few 50+.

R is the average, so R for omicron can still be anything from 4 to 30.

What this really tells us is that vaccines don’t protect you from being infected by omicron.",https://twitter.com/larsga/status/1467147210164998147,Sat Apr 12 14:32:05 +0000 2008,14369057,false,"Author, speaker, and researcher of farmhouse ale. Norwegian tweets @larsga_no",7110,2863,447,94,"Oslo, Norway",Lars Marius Garshol,larsga,16671,,https://www.garshol.priv.no,false
"-0.31428,51.41696",Sat Dec 04 09:44:42 +0000 2021,,,https://www.instagram.com/p/CXDm1l_KLrU/?utm_medium=twitter,0,1467067329645142016,,,,en,"Richmond, London",false,,0,,,"<a href=""http://instagram.com"" rel=""nofollow"">Instagram</a>",Waiting for 15 minutes after my booster coronavirus injection @ Hampton Wick Surgery https://t.co/3T52FlcsBd,https://twitter.com/osusuki/status/1467067329645142016,Mon Nov 26 15:13:26 +0000 2007,10614902,false,Technical Architect,17062,186,494,10,London,Scotty,osusuki,11385,,http://osusuki.wordpress.com,false
"-122.187682,47.77112",Sat Dec 04 16:22:01 +0000 2021,,https://twitter.com/chilumba/status/1467167317415055371/photo/1,https://www.swarmapp.com/c/2Tl0kaV1MVA,3,1467167317415055371,,,,en,"Bothell, WA",false,,0,,,"<a href=""http://foursquare.com"" rel=""nofollow"">Foursquare</a>","Second shot in the bag! Kids complete their Covid vaccinations! (@ Allegro Pediatrics Bothell - @allegropeds in Bothell, WA) https://t.co/7uXfD0EQpO https://t.co/cXhRJXsSvo",https://twitter.com/chilumba/status/1467167317415055371,Sun Mar 08 17:12:26 +0000 2009,23328291,false,"Software / Product @Microsoft.
Passion for Tech, Big Data, Smooth User Experiences.
Avid Runner; Loves Food & Travel; Soccer #ManUtd; Whisky taster #Scotch.🇿🇲",1189,560,1439,22,"Redmond, Washington",Chilumba Mubashi,chilumba,5888,,https://about.me/chilumba,false
"-96.8055857,32.7892021",Sat Dec 04 15:09:09 +0000 2021,lfg,,https://www.instagram.com/p/CXEL-JEFnvE/?utm_medium=twitter,0,1467148976944259074,,,,en,"Dallas, TX",false,,0,,,"<a href=""http://instagram.com"" rel=""nofollow"">Instagram</a>",This team though 🔥 amazing night celebrating the @idr_inc Dallas office yesterday!!!  They have fought so hard this year rebuilding from COVID and just finished the year with a record breaking month!  Look out 2022 #lfg https://t.co/NHB1U0XwUX,https://twitter.com/willymayzhayes/status/1467148976944259074,Fri Jan 21 19:16:46 +0000 2011,241224255,false,staffing exec in dallas | dada to brooks + hubs to whit | team idr | cowboys + vols fanatic,26,123,145,0,"dallas, tx",Will Hayes,willymayzhayes,324,,,false
"120.98190769,14.53517822",Sat Dec 04 14:13:44 +0000 2021,,,https://www.instagram.com/p/CXEFoRPhdyM/?utm_medium=twitter,0,1467135034591256578,,,,en,"Lungsod ng Pasay, Pambansang Punong Rehiyon",false,,0,,,"<a href=""http://instagram.com"" rel=""nofollow"">Instagram</a>","Happy birthday, my moon, WorldWide Handsome @jin_bighitentertainment 💜
Thank you for keeping me sane since the pandemic started. I love you more than I love tofu 🥺 https://t.co/db03KOCcEK",https://twitter.com/kalyarchivido/status/1467135034591256578,Tue Mar 15 14:58:30 +0000 2011,266630087,false,immer hungrig,493,279,336,1,Philippines,Lyka Archivido,kalyarchivido,3504,,,false
"-117.551455,33.843014",Sat Dec 04 10:08:28 +0000 2021,jobs,,http://joburl.ws/15885779,0,1467073310768914434,,,,en,"Corona, CA",false,,0,,,"<a href=""http://www.boxwoodtech.com"" rel=""nofollow"">CareerCenter</a>","Now Hiring: Service Technician | Greystar: Corona, California | https://t.co/sftXLohIAr #jobs",https://twitter.com/ApartmentCareer/status/1467073310768914434,Thu Feb 12 22:13:26 +0000 2009,20725246,false,http://t.co/FOOaDppy is the leading website for researching and finding jobs in the Apartment industry.  We host the largest network of industry career sites.,435,4084,3895,59,"HQ in Dallas, Texas",ApartmentCareers.Com,ApartmentCareer,63231,,http://www.apartmentcareers.com,false
"-79.7505875,39.9139748",Sat Dec 04 17:04:06 +0000 2021,,,https://untp.beer/s/c1105517198,3,1467177905730031618,,,,en,"Uniontown, PA",false,,0,,,"<a href=""https://untappd.com"" rel=""nofollow"">Untappd</a>",Cheers 🍻 - Drinking a Corona Extra by @GrupoModelo_MX @ Don Patron Mexican Restaurant  — https://t.co/7ZzVTvrVCc,https://twitter.com/AMSTechGuy/status/1467177905730031618,Mon May 25 11:35:10 +0000 2015,3297658671,false,36 | Alarm Tech | Tech Guy | Whovian | Slytherclaw | Pittsburgh Sports | Disney | Craft Beer | HHN | Universal | Horror | Music | Movies | Foodie,238227,2013,3937,9,"Pennsylvania, USA",Bryan Rose,AMSTechGuy,57150,,,false
"-79.7164011,43.7742911",Sat Dec 04 13:14:02 +0000 2021,Canada Covid19 Featured Health canada,,http://dlvr.it/SDl7Cq,0,1467120007259713537,,,,en,"Brampton, Ontario",false,,1,,,"<a href=""https://dlvrit.com/"" rel=""nofollow"">dlvr.it</a>","Canada’s COVID-19 Pandemic daily update: QUÉBEC CITY, Dec. 4, 2021 /CNW/ – The most recent data on the evolution of COVID-19, in the last 24 hours, in Québec show: 1,355 new cases, bringing the total number of… https://t.co/DvbhEqb0iu #Canada #Covid19 #Featured #Health #canada",https://twitter.com/Weeklyvoice/status/1467120007259713537,Tue Mar 30 17:43:21 +0000 2010,127943720,false,Most Trusted News in North America’s South Asian Communities Since 1997,172,494,299,11,Toronto,Weekly Voice,Weeklyvoice,37110,,http://www.Weeklyvoice.com,false
"-122.1394165,37.4391713",Sat Dec 04 06:48:02 +0000 2021,,,http://dlvr.it/SDkPP8,0,1467022869183950848,,,,en,"Palo Alto, CA",false,,0,,,"<a href=""https://dlvrit.com/"" rel=""nofollow"">dlvr.it</a>",Trainee police officer banned for stalking ex-boyfriend - BBC News: 4Why Indian-born CEOs dominate Silicon Valley. 5Italian tries to dodge Covid jab using fake arm. 6Bolsonaro investigated for vaccine and Aids ... https://t.co/1R4TEdLmC7,https://twitter.com/Fcs_______/status/1467022869183950848,Wed Sep 29 13:21:23 +0000 2010,196586285,false,,9,259,49,43,San Francisco Bay Area,François C,Fcs_______,109159,,,false
"-79.4523813,43.7143142",Sat Dec 04 11:12:04 +0000 2021,,,,0,1467089314899234819,,,,en,"Toronto, Ontario",,,0,,,"<a href=""http://ijg.me"" rel=""nofollow"">ijg</a>","Alarm (single Source) [North York]
Lawrence Avenue
b/w Corona Street / Dufferin Street
Dispatched: 04/12/21 @ 06:02 EST
[Stn: 132] DistChief-13 Pumper-132 Pumper-145
General Area:",https://twitter.com/tofire/status/1467089314899234819,Sat Sep 13 11:34:22 +0000 2008,16270679,false,@tofire - Toronto Fire Active Incidents - In Emergency call #911.  Brought to you by @ijg,0,12658,9,323,,Toronto Fire,tofire,1715966,,https://iaingrant.com,false
"106.7342418,-6.2636826",Sat Dec 04 10:41:33 +0000 2021,thefts ghosts,https://twitter.com/donaldsitompul1/status/1467081634046300163/photo/1,,0,1467081634046300163,,,,en,Kalimangso Street,false,,0,,,"<a href=""http://twitter.com/download/android"" rel=""nofollow"">Twitter for Android</a>","Bed time now.

No thinking mode.  Thieves!

Happy lockdown.  Stay alert.

5:39 PM Sat, December 04, 2021
#thefts #ghosts https://t.co/SGvyDva7EN",https://twitter.com/donaldsitompul1/status/1467081634046300163,Mon Apr 29 18:14:16 +0000 2019,1122927090901192705,false,Male. Asylum seeker. Scholarship ambush victim. @sitompul_donald is my prev tweet. Threema: VSNY232D https://t.co/aW4OuZ4mgM: @sitompul_donald,883,96,177,0,"Kalimangso gg Halim 97, 15222 ",Donald Sitompul,donaldsitompul1,9562,,http://sitompulquest.wordpress.com,false
"-1.50408192,53.82710476",Sat Dec 04 11:40:35 +0000 2021,COVID Poetry Covid Isolation,,https://www.instagram.com/p/CXD0Gl-MvCQ7sW3yJVJiSfuDNwaC0aMEedhT7k0/?utm_medium=twitter,0,1467096490627809290,,,,en,"Leeds, England",false,,1,,,"<a href=""http://instagram.com"" rel=""nofollow"">Instagram</a>","So, I wrote a poem about #COVID Whaddya think? 😷 #Poetry #Covid #Isolation @ Oakwood, Leeds https://t.co/pbiU7kCfES",https://twitter.com/Woodster44/status/1467096490627809290,Tue Jul 13 08:50:07 +0000 2010,166089991,false,"Wife, Mummy & Nurse on a break to raise my 3 girls. Volunteer and Organiser of Oakwood Luncheon Club",26074,684,1593,54,"Leeds, England",Kim Wood,Woodster44,26703,,,false
"-74.01254277,40.70887267",Sat Dec 04 05:52:02 +0000 2021,CryptoNews,,http://dlvr.it/SDkJh7,0,1467008777631141889,,,,en,"Manhattan, NY",false,,0,,,"<a href=""https://dlvrit.com/"" rel=""nofollow"">dlvr.it</a>","Bitcoin Price Analysis: After Friday’s Bloodbath, is the Selloff Over?: Just as Bitcoin began exhibiting early optimistic developments of restoration, concern of a new variant of COVID-19 despatched international shares sharply decrease,… https://t.co/HGrotoXrVs #CryptoNews",https://twitter.com/InsiderDefi/status/1467008777631141889,Mon Nov 08 19:55:22 +0000 2021,1457798838509613056,false,"Insider Crypto News for Investors. Breaking BTC, ETH, XRP, SOL, Altcoin, NFT & Metaverse News. Curated Influencer videos and Market sentiment.",5,95,66,7,"Manhattan, NY",Insider DeFi,InsiderDefi,4311,,http://insiderdefi.com,false
