coordinates,created_at,hashtags,media,urls,favorite_count,id,in_reply_to_screen_name,in_reply_to_status_id,in_reply_to_user_id,lang,place,possibly_sensitive,quote_id,retweet_count,retweet_id,retweet_screen_name,source,text,tweet_url,user_created_at,user_id,user_default_profile_image,user_description,user_favourites_count,user_followers_count,user_friends_count,user_listed_count,user_location,user_name,user_screen_name,user_statuses_count,user_time_zone,user_urls,user_verified
"30.3443565,59.9297295",Tue Apr 26 15:17:01 +0000 2022,,,https://untp.beer/s/c1152238147,0,1518972424636743681,,,,en,"Санкт-Петербург, Россия",false,,0,,,"<a href=""https://untappd.com"" rel=""nofollow"">Untappd</a>",Drinking a Lockdown by Dreamteam Brew @ Smoke BBQ — https://t.co/XVcUD1PMMk,https://twitter.com/mictianspb/status/1518972424636743681,Fri Nov 20 06:00:43 +0000 2009,91281392,false,,13,80,163,8,Saint-Petersburg,Dmitry Matveev,mictianspb,4376,,http://mictian.su,false
"8.53081415,12.01828665",Tue Apr 26 18:27:54 +0000 2022,,,https://www.instagram.com/p/Cc0wYwKogMs/?igshid=YTgzYjQ4ZTY=,0,1519020462633803776,,,,en,"Kano, Nigeria",false,,0,,,"<a href=""http://instagram.com"" rel=""nofollow"">Instagram</a>","Excerpts from Sunday Worship Service: On Assignment to Your Marriage Work

Lord, arise for every home and destroy the end time spirit working against it, In Jesus Christ’s Almighty Name!

@steagracekano https://t.co/rJ0g2ueNxe",https://twitter.com/steagracekano/status/1519020462633803776,Sun Jul 21 14:36:44 +0000 2019,1152950538918604808,false,We are raised to preach the #Gospel of #Grace through the word of Faith for the total liberation of man and to ensure their entrance into #Heaven through same.,165,48,0,1,"10 Middle Road, S/Gari, Kano.",Strongtower Evangelical Assembly,steagracekano,459,,http://instagram.com/SteaGraceKano,false
"133.67888627,-25.14999213",Tue Apr 26 01:58:14 +0000 2022,,https://twitter.com/DailyNews79/status/1518771404690231296/photo/1,http://lasthour.hipeople.biz/SPF0y1,0,1518771404690231296,,,,en,"Ghan, Northern Territory",false,,0,,,"<a href=""https://dlvrit.com/"" rel=""nofollow"">dlvr.it</a>",COVID in WA: Twelve virus cases on Coral Discoverer cruise docked in Broome - PerthNow https://t.co/LJwQ46uvbN https://t.co/iJNMc91dre,https://twitter.com/DailyNews79/status/1518771404690231296,Wed Feb 09 07:43:20 +0000 2022,1491316688549253120,false,"Ours is just a small press release, it's not spam.
Subscribe to our comunity https://t.co/upst403dGf",10,61,537,0,Italy,DailyNews 🇮🇹,DailyNews79,159876,,https://hipeople.biz,false
"-117.6518326,33.8503342",Tue Apr 26 17:07:57 +0000 2022,earthquake,,https://earthquake.usgs.gov/earthquakes/eventpage/ci40246400,4,1519000342012309505,,,,en,"California, USA",false,,2,,,"<a href=""http://everyearthquake.com"" rel=""nofollow"">everyEarthquake</a>","USGS reports a M2.27 earthquake, 8km WSW of Corona, CA on 4/26/22 @ 17:04:29 UTC https://t.co/8YUiL8JWYq #earthquake",https://twitter.com/everyEarthquake/status/1519000342012309505,Thu May 09 05:36:42 +0000 2013,1414684496,false,Tweeting every earthquake occurrence reported by USGS.  Built and maintained by David Barkman aka @cybler.,15,27092,1,410,Earth,Every Earthquake,everyEarthquake,722791,,http://everyearthquake.com,false
"103.93852274,1.39701211",Tue Apr 26 15:01:06 +0000 2022,,https://twitter.com/DailyNews79/status/1518968418619125761/photo/1,http://lasthour.hipeople.biz/SPGy4R,0,1518968418619125761,,,,en,新加坡,false,,0,,,"<a href=""https://dlvrit.com/"" rel=""nofollow"">dlvr.it</a>","Group size limits, safe distancing requirements lifted in schools as Covid-19 measures eased: MOE - TODAY https://t.co/n45lJLRrPr https://t.co/e7uVB3CFxJ",https://twitter.com/DailyNews79/status/1518968418619125761,Wed Feb 09 07:43:20 +0000 2022,1491316688549253120,false,"Ours is just a small press release, it's not spam.
Subscribe to our comunity https://t.co/upst403dGf",10,61,537,0,Italy,DailyNews 🇮🇹,DailyNews79,159876,,https://hipeople.biz,false
"-117.6539993,33.850666",Tue Apr 26 22:29:58 +0000 2022,earthquake,,https://earthquake.usgs.gov/earthquakes/eventpage/ci40246624,2,1519081376766734415,,,,en,"California, USA",false,,1,,,"<a href=""http://everyearthquake.com"" rel=""nofollow"">everyEarthquake</a>","USGS reports a M1.87 earthquake, 8km WSW of Corona, CA on 4/26/22 @ 22:26:40 UTC https://t.co/0I71D4q81M #earthquake",https://twitter.com/everyEarthquake/status/1519081376766734415,Thu May 09 05:36:42 +0000 2013,1414684496,false,Tweeting every earthquake occurrence reported by USGS.  Built and maintained by David Barkman aka @cybler.,15,27092,1,410,Earth,Every Earthquake,everyEarthquake,722791,,http://everyearthquake.com,false
"-117.88284453,33.80017431",Tue Apr 26 01:43:25 +0000 2022,goangels nice mlb ilovebaseball,,https://www.instagram.com/p/Ccy9b9il_3y/?igshid=YTgzYjQ4ZTY=,0,1518767673156513792,,,,en,"Anaheim, CA",false,,0,,,"<a href=""http://instagram.com"" rel=""nofollow"">Instagram</a>",#goangels My first game since the beginning of the pandemic!  #nice seats #mlb #ilovebaseball @ Angel Stadium of Anaheim https://t.co/z4TR1h9sIB,https://twitter.com/jkneez/status/1518767673156513792,Sat Feb 28 20:58:40 +0000 2009,22294703,false,,1802,24,176,0,,Jkneecan,jkneez,1554,,,false
"-0.19756,51.36119",Tue Apr 26 08:49:39 +0000 2022,GardenTherapy nose covidnose gardeninspiration,,https://www.instagram.com/p/CczuNWgI3-5/?igshid=YTgzYjQ4ZTY=,1,1518874939645992960,,,,en,"Sutton, London",false,,0,,,"<a href=""http://instagram.com"" rel=""nofollow"">Instagram</a>","#GardenTherapy🌿🪴🌺😻 … day 4 at home🏡 … 
So the thing with covid (BA.2 mutation) is my #nose … It can’t smell diddly 🫣😜 however feeling ok 👍🏾 #covidnose #gardeninspiration🍃💚 @ Sutton, London https://t.co/NSB3ycWgGU",https://twitter.com/DollieHenry/status/1518874939645992960,Mon Aug 08 20:04:29 +0000 2011,351105229,false,"Choreographer | Theatre Director | Educator | JAZZ Artist and founder of BOP JAZZ THEATRE COMPANY ... follow me @BOPJAZZUK  ... Love, light & all things Jazz!!",2367,1576,1813,33,London,Dollie Henry,DollieHenry,13252,,http://www.bop.org.uk,false
"-4.309626,55.852472",Tue Apr 26 09:28:49 +0000 2022,Glasgow,,https://www.glasgowtimes.co.uk/news/20084336.man-kicked-off-cops-removed-lockdown-party-glasgow/?ref=rss,0,1518884795287281666,,,,en,"Glasgow, Scotland",false,,0,,,"<a href=""http://oysttyer.github.io/oysttyer/"" rel=""nofollow"">oysttyer</a>",#Glasgow Man kicked off at cops after being removed from lockdown party in Glasgow 📰: https://t.co/5I0q3xupu7,https://twitter.com/_cirrus_minor_/status/1518884795287281666,Sat Sep 12 16:02:12 +0000 2009,73672052,false,"Most days  i'm a bot who resides in a Raspberry Pi Model B, cron  and #!/bin/bash are my best pals. Every other Saturday i  frequent the Penny Arcade. #watp",586,943,1324,175,"46.869100,103.848242",OnFileNotWanted,_cirrus_minor_,400348,,http://cirrusuk.wordpress.com,false
"-102.37011181,57.78559004",Tue Apr 26 06:17:46 +0000 2022,News,https://twitter.com/DailyNews79/status/1518836718371098624/photo/1,http://lasthour.hipeople.biz/SPFSlY,0,1518836718371098624,,,,en,"Division No. 18, Unorganized, Saskatchewan",false,,0,,,"<a href=""https://dlvrit.com/"" rel=""nofollow"">dlvr.it</a>",#News Today’s coronavirus news: Federal government calls inquiry into use of Emergencies Act - Toronto Star https://t.co/w0CFal6nZc https://t.co/U0uWJ7oQ28,https://twitter.com/DailyNews79/status/1518836718371098624,Wed Feb 09 07:43:20 +0000 2022,1491316688549253120,false,"Ours is just a small press release, it's not spam.
Subscribe to our comunity https://t.co/upst403dGf",10,61,537,0,Italy,DailyNews 🇮🇹,DailyNews79,159876,,https://hipeople.biz,false
"-87.34,36.55",Tue Apr 26 16:40:15 +0000 2022,,https://twitter.com/nonplayablekyle/status/1518993369825005568/photo/1,,2,1518993369825005568,,,,en,"Clarksville, TN",false,,0,,,"<a href=""http://www.samruston.co.uk"" rel=""nofollow"">Flamingo for Android</a>",I didn't replaced the glasses I lost at the start of lockdown https://t.co/R8Z1RWxp88,https://twitter.com/nonplayablekyle/status/1518993369825005568,Fri Jun 20 23:54:50 +0000 2008,15185612,false,"Tabletop DM and trash media aficionado. Habitually blocks accounts with random numbers or crypto-themed avatars, sorry. Owlbear icon by a good friend",34113,222,264,20,"Clarksville, TN",Nonplayable,nonplayablekyle,38692,,http://nonplayablekyle.itch.io,false
"-86.7837,36.1651",Tue Apr 26 20:28:53 +0000 2022,,,https://www.instagram.com/p/Cc0-PEPJ4qZ/?igshid=YTgzYjQ4ZTY=,0,1519050908604284930,,,,en,"Nashville, TN",false,,0,,,"<a href=""http://instagram.com"" rel=""nofollow"">Instagram</a>","One week from today! The Absurd returns to @thecobranashville stage and it’s gonna be the sickest show since Covid. @ Nashville, Tennessee https://t.co/kG4h7sMSd0",https://twitter.com/theabsurdband/status/1519050908604284930,Wed Jul 22 00:06:09 +0000 2015,3386565695,false,The best rock band in America. Period. Our pronouns: This Fuckin' Guy / Those assholes 🎵 NEW SINGLE “CRASH TEAM BONG RIPS” OUT NOW 🎵 on Bent Knee Records,617,290,501,21,"Los Angeles, CA",The Absurd,theabsurdband,2609,,https://linktr.ee/theabsurdband,false
"-81.96187882,33.47101547",Tue Apr 26 15:22:48 +0000 2022,,,https://www.instagram.com/p/Cc0bNIHOBga/?igshid=YTgzYjQ4ZTY=,0,1518973880529915904,,,,en,"Augusta, GA",false,,0,,,"<a href=""http://instagram.com"" rel=""nofollow"">Instagram</a>","Commissioner John Clarke is back and 35 pounds lighter after a bout with pneumonia. Clarke said his 02 dipped to 81% and he spent three days in critical care unit. @ Augusta, Georgia Government https://t.co/OVIGOb5UQy",https://twitter.com/reportr1/status/1518973880529915904,Sat May 24 15:19:25 +0000 2008,14891750,false,Staff writer for The Augusta Chronicle.,973,3219,2929,83,"Augusta, GA",Susan McCord,reportr1,15408,,https://www.augustachronicle.com/staff/3804305001/susan-mccord/,true
"36.83822399,-1.43408992",Tue Apr 26 23:46:10 +0000 2022,,,http://lasthour.hipeople.biz/SPJGGs,0,1519100556983238656,,,,en,"Rift Valley, Kenya",false,,0,,,"<a href=""https://dlvrit.com/"" rel=""nofollow"">dlvr.it</a>",IMRF Dialogue Series: Promoting inclusive societies and ensuring the inclusion of migrants in COVID-19 response and recovery - World Health Organization https://t.co/Y723FUhpWh,https://twitter.com/DailyNews79/status/1519100556983238656,Wed Feb 09 07:43:20 +0000 2022,1491316688549253120,false,"Ours is just a small press release, it's not spam.
Subscribe to our comunity https://t.co/upst403dGf",10,61,537,0,Italy,DailyNews 🇮🇹,DailyNews79,159876,,https://hipeople.biz,false
"-84.46284088,39.30881211",Tue Apr 26 23:07:07 +0000 2022,,,https://www.instagram.com/p/Cc1QV_TOjBl/?igshid=YTgzYjQ4ZTY=,0,1519090729817153537,,,,en,"West Chester, OH",false,,0,,,"<a href=""http://instagram.com"" rel=""nofollow"">Instagram</a>","Keeping it real!
Don’t get complacent! COVID among other things is still alive! @ Ohio Ambulance https://t.co/Bzl13FmmVi",https://twitter.com/OhioAmbulance/status/1519090729817153537,Tue Aug 08 03:45:34 +0000 2017,894766510614364160,false,"Ohio Ambulance is Family owned and operated, providing emergency and non-emergency medical care and transport to our patrons in Cleveland and Cincinnati Ohio.",21,102,237,1,"Cleveland, Cincinnati, Ohio",Ohio Ambulance,OhioAmbulance,1479,,http://ohioambulance.com,false
"174.83102918,-41.13461659",Tue Apr 26 22:31:46 +0000 2022,,,https://www.instagram.com/p/Cc1MTBpB1Jp/?igshid=YTgzYjQ4ZTY=,0,1519081831706112000,,,,en,"Porirua City, New Zealand",false,,0,,,"<a href=""http://instagram.com"" rel=""nofollow"">Instagram</a>","CLOSED 28/04

Due to Covid-19 related staff shortages, our Raiha Street store will be closed tomorrow. 

We will be back to business as usual from Friday onwards ⚽️ @ Football Central https://t.co/h1Sm2yzGoi",https://twitter.com/footycentralnz/status/1519081831706112000,Mon Nov 05 05:26:55 +0000 2012,926928530,false,Football Central - a specialist football retail store with a 'treasure trove' of football equipment & merchandise born out of a love of the beautiful game!,224,447,329,2,"Wellington, New Zealand",footycentralnz,footycentralnz,565,,http://www.footballcentral.co.nz,false
"-6.37055916,53.32630323",Wed Apr 27 00:09:03 +0000 2022,,https://twitter.com/DailyNews79/status/1519106314571374592/photo/1,http://lasthour.hipeople.biz/SPJJRq,0,1519106314571374592,,,,en,"South Dublin, Ireland",false,,0,,,"<a href=""https://dlvrit.com/"" rel=""nofollow"">dlvr.it</a>",Ireland's Covid dead: Sister recalls 'amazing energy' of man who built houses for charity - The Irish Times https://t.co/vSqSLqKYUP https://t.co/zpG3WGeohH,https://twitter.com/DailyNews79/status/1519106314571374592,Wed Feb 09 07:43:20 +0000 2022,1491316688549253120,false,"Ours is just a small press release, it's not spam.
Subscribe to our comunity https://t.co/upst403dGf",10,61,537,0,Italy,DailyNews 🇮🇹,DailyNews79,159876,,https://hipeople.biz,false
"-81.2470002,42.98266",Tue Apr 26 23:56:19 +0000 2022,LdnOntBike,,https://www.londonbicyclecafe.com/news/2022/4/26/were-open-covid-19-update,8,1519103107745165312,,,,en,"London, Ontario",false,,1,,,"<a href=""http://www.squarespace.com"" rel=""nofollow"">Squarespace</a>",WE'RE OPEN - Covid-19 Update  https://t.co/XCmbUJ6r7y  #LdnOntBike,https://twitter.com/LdnOntBikeCafe/status/1519103107745165312,Wed Feb 08 17:14:37 +0000 2017,829377907726438403,false,"We bring the world's best E-Bikes, Cargo Bikes & City Bikes to #LdnOnt (Treaty 6). 226-289-2670. CO2 @ Mauna Loa = 422 ppm",51968,4818,3516,62,"355 Clarence Street, London ON",London Bicycle Café,LdnOntBikeCafe,64739,,http://www.londonbicyclecafe.com,false
"-82.44547069,43.02702703",Wed Apr 27 01:17:08 +0000 2022,maddow lawrence politics MSNBC CNN,,https://twitter.com/cnn/status/1519073885165133824,2,1519123447414239236,,,,en,"Sarnia, Ontario",true,1519073885165133824,0,,,"<a href=""http://www.tweetcaster.com"" rel=""nofollow"">TweetCaster for Android</a>",RT @KeithOlbermann: Somebody else who held back the truth until after the book was published. A definition of the greed of our times: https://t.co/1St0vSFnEq #maddow #lawrence #politics #MSNBC #CNN,https://twitter.com/PortCityPisces/status/1519123447414239236,Sun Feb 22 18:25:34 +0000 2009,21584887,false,"painter, graphic artist, progressive dem",18607,1821,2349,187,southeastern michigan,PortCityPisces,PortCityPisces,227632,,https://twitter.com,false
"-117.4973,33.89591",Tue Apr 26 23:45:44 +0000 2022,Corona LAtraffic,,http://bit.ly/10F395r,0,1519100447948165122,,,,en,"Riverside, CA",false,,0,,,"<a href=""http://www.sigalert.com/Map.asp?region=Greater+Los+Angeles"" rel=""nofollow"">TTN LA traffic</a>","Crash in center divider in #Corona on CA-91 EB at Pierce St/Riverwalk Pkwy (Eastbound Only), stopped traffic back to Auto Ctr Dr/Serfas Clb Dr #LAtraffic https://t.co/e2e6MWkOvI",https://twitter.com/TotalTrafficLA/status/1519100447948165122,Wed Aug 12 21:43:18 +0000 2009,65171105,false,Providing you #LIVE #traffic updates for your #SoCal drive! Got a tip? Dial #250 and use the keyword “So Cal Traffic”,302,18794,621,687,Southern California,Total Traffic LA,TotalTrafficLA,294330,,https://www.ttwnetwork.com/,false
"-123.12316786,49.3158291",Tue Apr 26 23:04:36 +0000 2022,,,http://dlvr.it/SPJBSG,0,1519090094468075520,,,,en,"North Vancouver, British Columbia",false,,0,,,"<a href=""https://dlvrit.com/"" rel=""nofollow"">dlvr.it</a>","AMGMT — Prostate cancer rising in Black America: Yet according to government data, Black Americans are generally at higher risk for heart diseases, stroke, cancer, asthma, influenza and pneumonia ...  

View article... https://t.co/QWICGL9gjq",https://twitter.com/StigmabaseE/status/1519090094468075520,Fri Sep 03 15:34:08 +0000 2010,186478529,false,Español - Português | Keeping up-to-date on global exclusion — Stigmabase is a canadian internet non-profit Initiative,0,1968,857,151,Las Américas | España,Stigmabase | ES,StigmabaseE,1037526,,https://www.stigmabase.org/,false
"-76.0975,39.5483",Wed Apr 27 00:24:51 +0000 2022,,,https://www.instagram.com/p/Cc1ZPZ2LHrM/?igshid=YTgzYjQ4ZTY=,1,1519110291132493824,,,,en,"Havre de Grace, MD",false,,1,,,"<a href=""http://instagram.com"" rel=""nofollow"">Instagram</a>","Working from home: a story... @ Havre de Grace, Maryland https://t.co/SCx6ONMUSf",https://twitter.com/RCThoughtfulMom/status/1519110291132493824,Tue Mar 09 05:16:05 +0000 2010,121334279,false,"Partnered, mothering, health providing, opinionated, coffee-loving student of life.",8846,416,973,27,"Maryland, USA",Rebekah Costello,RCThoughtfulMom,11834,,,false
"-83.0507,42.3368",Tue Apr 26 23:23:27 +0000 2022,monique covidsucks wearamask goodfriends,,https://www.instagram.com/p/Cc1SNgcLQOsupGH2HkqL54dxJvCU2dziPrWRaM0/?igshid=YTgzYjQ4ZTY=,0,1519094836682313728,,,,en,"Detroit, MI",false,,0,,,"<a href=""http://instagram.com"" rel=""nofollow"">Instagram</a>","Finally caught us but shout out to good friends #monique @caryn_rose for supplies #covidsucks👎 #wearamask #goodfriends @ Detroit, Michigan https://t.co/CxOfGJBGYy",https://twitter.com/fishon914/status/1519094836682313728,Tue Apr 30 09:48:49 +0000 2013,1391643078,false,the truth is out there your are just looking in the wrong places !,1709,112,345,1,Everywhere,JAM,fishon914,3054,,,false
"-118.137694,34.19445",Tue Apr 26 23:34:25 +0000 2022,,,https://www.instagram.com/p/Cc1TdzGvoYG/?igshid=YTgzYjQ4ZTY=,2,1519097597633335296,,,,en,"Altadena, CA",false,,0,,,"<a href=""http://instagram.com"" rel=""nofollow"">Instagram</a>",THIS is the kind of think I do when I’m sick in bed after getting my 2nd Covid booster… @ Altadena https://t.co/BbKnpKim0q,https://twitter.com/JACKIEBEAT/status/1519097597633335296,Fri Apr 03 23:27:25 +0000 2009,28684544,false,https://t.co/o5ZCsEW30g,18176,33591,2084,368,"Hollywood, California",Jackie Beat,JACKIEBEAT,39819,,,false
"172.21001302,-42.53376215",Wed Apr 27 00:07:04 +0000 2022,,https://twitter.com/DailyNews79/status/1519105815709315073/photo/1,http://lasthour.hipeople.biz/SPJJBH,0,1519105815709315073,,,,en,"Hurunui District, New Zealand",false,,0,,,"<a href=""https://dlvrit.com/"" rel=""nofollow"">dlvr.it</a>","Buying a house sight unseen, from thousands of kilometres away, during a pandemic - Stuff https://t.co/Y2AFrBmQtX https://t.co/azVYJuxS8O",https://twitter.com/DailyNews79/status/1519105815709315073,Wed Feb 09 07:43:20 +0000 2022,1491316688549253120,false,"Ours is just a small press release, it's not spam.
Subscribe to our comunity https://t.co/upst403dGf",10,61,537,0,Italy,DailyNews 🇮🇹,DailyNews79,159876,,https://hipeople.biz,false
"-83.0507,42.3368",Tue Apr 26 23:17:32 +0000 2022,monique thanks covidsucks wearamask,,https://www.instagram.com/p/Cc1RiIbPnMX3rgrbjkdKTidEmBJHYdsH-nReu40/?igshid=YTgzYjQ4ZTY=,0,1519093347197100033,,,,en,"Detroit, MI",false,,0,,,"<a href=""http://instagram.com"" rel=""nofollow"">Instagram</a>","When the COVID train shows up - shout out to good friends for supplies @caryn_rose #monique #thanks #covidsucks👎 #wearamask😷 @ Detroit, Michigan https://t.co/kzL0AJp7sM",https://twitter.com/fishon914/status/1519093347197100033,Tue Apr 30 09:48:49 +0000 2013,1391643078,false,the truth is out there your are just looking in the wrong places !,1709,112,345,1,Everywhere,JAM,fishon914,3054,,,false
"-118.1938,33.7692",Wed Apr 27 00:52:56 +0000 2022,health fitness fitspo fitafterforty fitafter40,,https://www.instagram.com/p/Cc1cc36pJud/?igshid=YTgzYjQ4ZTY=,3,1519117356198514692,,,,en,"Long Beach, CA",false,,2,,,"<a href=""http://instagram.com"" rel=""nofollow"">Instagram</a>","The magic of Covid
..
Some doors closed but many more opened. 
..
Find your blessings during difficult times 
..
..
#health #fitness #fitspo #fitafterforty #fitafter40 @ Long Beach, California https://t.co/ku4cM547wP",https://twitter.com/SharonPolsky/status/1519117356198514692,Wed Jun 22 06:21:46 +0000 2011,321835949,false,Proud owner of UNLEASHED and Accountability/Weight Loss Coach. I've dedicated most of my adult life to helping women become happier and healthier.,25,1728,406,24,California,Sharon Polsky - Fitness Expert,SharonPolsky,23663,,http://www.unleashed-fitness.com,false
"-74.00589108,40.71270142",Wed Apr 27 00:38:09 +0000 2022,wearamask covidtimes mad shotoniphone ny1pic,,https://www.instagram.com/p/Cc1awi4OkPV/?igshid=YTgzYjQ4ZTY=,0,1519113638036090880,,,,en,"Manhattan, NY",false,,0,,,"<a href=""http://instagram.com"" rel=""nofollow"">Instagram</a>","Wear a mask. #wearamask #covidtimes #mad #shotoniphone #ny1pic @ New York City, N.Y. https://t.co/h9mAVKanfP",https://twitter.com/RobOrdonez/status/1519113638036090880,Mon Oct 11 00:28:07 +0000 2010,201065768,false,Roberto Ordonez is a Fashion Photographer and Designer.Also a SAG-AFTRA Actor and a Fashionista living in NYC.Born in México City.,1295,866,1986,101,"New York, NY",Roberto Ordonez,RobOrdonez,16951,,http://www.RobertOrdonez.YolaSite.com,false
"-80.07418,26.46437",Tue Apr 26 23:24:19 +0000 2022,,,http://GCRosarioGroup.com/careers https://www.instagram.com/p/Cc1ST_Ls0EE/?igshid=YTgzYjQ4ZTY=,1,1519095057101512705,,,,en,"Delray Beach, FL",false,,1,,,"<a href=""http://instagram.com"" rel=""nofollow"">Instagram</a>","VISIT: https://t.co/6Ax7BBUIF3

1. Work from home
2. Uncapped potential
3. No financial investment
4. Four day work week

Let’s talk about it. @ Delray Beach, Florida https://t.co/gbompwXc79",https://twitter.com/glrosario_/status/1519095057101512705,Wed Jan 21 21:17:54 +0000 2009,19308590,false,Christian🙏🏼 God 1st 🇺🇸🇵🇷 Husband. Dad. Dog Lover. Bible Based Consultant. Speaker. Writer. 2 Timothy 1:7 ✝️ #glrosario #GeorgeTheRealtor #GeorgeTheSpeaker,33602,10323,11337,78,New York City,"George L. Rosario, CONSULTANT®",glrosario_,40866,,https://linktr.ee/glrosario,false
