coordinates,created_at,hashtags,media,urls,favorite_count,id,in_reply_to_screen_name,in_reply_to_status_id,in_reply_to_user_id,lang,place,possibly_sensitive,quote_id,retweet_count,retweet_id,retweet_screen_name,source,text,tweet_url,user_created_at,user_id,user_default_profile_image,user_description,user_favourites_count,user_followers_count,user_friends_count,user_listed_count,user_location,user_name,user_screen_name,user_statuses_count,user_time_zone,user_urls,user_verified
"-80.20469066,26.6401355",Tue Apr 26 01:28:24 +0000 2022,kidsfashion goon goonsquad,,https://www.instagram.com/p/Ccy7tzrsIuF/?igshid=YTgzYjQ4ZTY=,1,1518763894344654850,,,,en,"Wellington, FL",false,,0,,,"<a href=""http://instagram.com"" rel=""nofollow"">Instagram</a>","While pumping Gas this kid just having fun in his Covid Outfit 😆.  Would you be scared?

#kidsfashion 
#goon 
#goonsquad @ Marathon https://t.co/Okr3XAfSEa",https://twitter.com/KELLENKASH/status/1518763894344654850,Tue Jun 05 21:34:49 +0000 2012,600442042,false,"Serial Entrepreneur
Fixer°Consultant°SportsAgent°
Biz Mgr @AfrDiasporaNews
Host🎙️@GameDiversified
BUY📚@londonandsydney 
https://t.co/zDuNVcyq0Y",2133,892,1298,49,"Palm Beach Gardens, FL",KELLEN KASH,KELLENKASH,10245,,http://COLEMANPRFIRM.COM,false
"-71.0598,42.3584",Tue Apr 26 18:15:28 +0000 2022,,,https://abcnews.go.com/Health/millions-covid-19-shots-set-waste-vaccine-rollout/story?id=84111412,0,1519017333687209984,,,,en,"Boston, MA",false,,0,,,"<a href=""https://help.twitter.com/en/using-twitter/how-to-tweet#source-labels"" rel=""nofollow"">heapevents.info</a>","Millions Covid Shots Set Waste Vaccine Rollout ☝ 😕 
 https://t.co/2EZVCGm4pH",https://twitter.com/heapevents/status/1519017333687209984,Sat Jan 09 15:58:46 +0000 2021,1347935690332495877,false,just heap of US events,0,7,25,1,,heapevents.info,heapevents,21354,,https://www.heapevents.info/,false
"172.18839406,-42.68687554",Tue Apr 26 02:07:03 +0000 2022,,https://twitter.com/DailyNews79/status/1518773620629073920/photo/1,http://lasthour.hipeople.biz/SPF1mD,0,1518773620629073920,,,,en,"Hurunui District, New Zealand",false,,0,,,"<a href=""https://dlvrit.com/"" rel=""nofollow"">dlvr.it</a>",Lockdown hits dairy - Rural News Group https://t.co/Y23qD9KT1e https://t.co/ijUX3IPtlB,https://twitter.com/DailyNews79/status/1518773620629073920,Wed Feb 09 07:43:20 +0000 2022,1491316688549253120,false,"Ours is just a small press release, it's not spam.
Subscribe to our comunity https://t.co/upst403dGf",10,61,537,0,Italy,DailyNews 🇮🇹,DailyNews79,159876,,https://hipeople.biz,false
"-73.94373166,40.95968628",Tue Apr 26 20:17:03 +0000 2022,,,,2,1519047931063582720,,,,en,"Closter, NJ",,,0,,,"<a href=""http://tapbots.com/tweetbot"" rel=""nofollow"">Tweetbot for iΟS</a>","My wife and I avoided COVId for over 2 years by being careful, but it finally got is last week. And boy oh boy did we get sick. I’ve never been this sick as an adult. And this is is a weaker variant after three Pfizer shots.

Get vaccinated and stay masked. This is serious shit.",https://twitter.com/TheDanAbrams/status/1519047931063582720,Wed Jun 25 06:23:54 +0000 2008,15228286,false,Reaktorian @reaktornow. Soon to be father of Sam.,690,2890,2268,31,"Closter, NJ",Dan Abrams,TheDanAbrams,1163,,,false
"121.43251179,31.19547045",Tue Apr 26 13:46:40 +0000 2022,tacotuesday shanghai shanghaichina china lockdown,,https://www.instagram.com/p/Cc0QM9ur5vi/?igshid=YTgzYjQ4ZTY=,0,1518949686480101377,,,,en,"上海, 中华人民共和国",false,,0,,,"<a href=""http://instagram.com"" rel=""nofollow"">Instagram</a>","Another Taco Tuesday spent locked down 

🚫 🌮🚫🌮🚫

#tacotuesday 
#shanghai
#shanghaichina
#china
#lockdown @ Xujiahui, Shanghai, China https://t.co/NWDYEX32re",https://twitter.com/mrbsyer/status/1518949686480101377,Thu Oct 14 01:20:06 +0000 2010,202434301,false,Teaching; traveling; keeping it real.,5261,785,877,14,"Minhang, Shanghai",Brett Syer,mrbsyer,1244,,,false
"140.38648841,35.75928811",Tue Apr 26 07:25:41 +0000 2022,,,https://www.instagram.com/p/Cczkmscvo9Q/?igshid=YTgzYjQ4ZTY=,0,1518853807597367296,,,,en,千葉 成田市,false,,0,,,"<a href=""http://instagram.com"" rel=""nofollow"">Instagram</a>","And Sitting 🪑 in Tokyo waiting on my COVID test results.  On a positive note 📝 they don’t swab your nose 👃 in the airport.  You spit 💦into a tube to for the test. @ Tokyo Narita, Departure Gate 44 https://t.co/DqNyLSGYqD",https://twitter.com/DarthTonka1979/status/1518853807597367296,Mon Oct 19 18:09:05 +0000 2015,3996218651,false,Dang On! Dang On! I’m one gee golly swell Sailor!,3139,195,3189,1,"Sasebo-shi, Nagasaki",Keith C Tomlinson,DarthTonka1979,798,,,false
"145.59171273,-38.19415618",Tue Apr 26 07:29:20 +0000 2022,,,https://www.instagram.com/p/CczlBh6JpwP/?igshid=YTgzYjQ4ZTY=,2,1518854728381259778,,,,en,"Bayles, Victoria",false,,0,,,"<a href=""http://instagram.com"" rel=""nofollow"">Instagram</a>",Corona Lad in his fancy new rug from @ruguphorsewear 👌 @ Yannathan Lodge https://t.co/XF9fVhgLpu,https://twitter.com/dunn_racing/status/1518854728381259778,Fri Jan 17 00:25:11 +0000 2014,2286965536,false,"Trainer, Retired Jumps Jockey, Breaking In, Pre-training, Ready 2 Race prep.",2457,1467,863,9,Cranbourne Training Complex,Nathan Dunn Racing,dunn_racing,3620,,http://www.nathandunn.com.au,false
"-75.694102,45.431349",Tue Apr 26 17:13:45 +0000 2022,covid19 pandemic ottawacanada bywardmarketottawa indianfood freedom summer bywardmarketbia,,https://www.instagram.com/p/CBewOU0F88S/?igshid=YTgzYjQ4ZTY=,0,1519001798299766789,,,,en,"Ottawa, Ontario",false,,0,,,"<a href=""http://instagram.com"" rel=""nofollow"">Instagram</a>","We open and ready to serve..!
#covid19 #pandemic #ottawacanada #bywardmarketottawa #indianfood #freedom #summer #bywardmarketbia @ ByWard Market https://t.co/7b5GaShuAS",https://twitter.com/ShafaliOttawa/status/1519001798299766789,Sat Nov 28 23:55:25 +0000 2009,93285334,false,"Shafali serves fresh, flavourful, & exotic East Indian cuisine with the perfect combination between a traditional & modern menu.",397,495,1108,20,Ottawa ON,Shafali,ShafaliOttawa,976,,http://www.shafali.com,false
"-75.69231988,39.78197047",Tue Apr 26 07:52:32 +0000 2022,,,http://dlvr.it/SPFh0S,0,1518860565170429953,,,,en,"Hockessin, DE",false,,0,,,"<a href=""https://dlvrit.com/"" rel=""nofollow"">dlvr.it</a>",Foxconn factories near Shanghai cease operations over COVID-19 cases https://t.co/DWAhLVaAAd,https://twitter.com/igor_os777/status/1518860565170429953,Tue Jan 02 02:13:57 +0000 2018,948014469044678656,false,"Experienced #Unix and #Linux #SysAdmin with over twenty years background in Systems Analysis, Problem Resolution, Application Support, and Process #Automation.",33038,10977,9962,114,"Delaware, USA",Igor Os,igor_os777,16233,,https://igoros.com,false
"-4.27887384,55.83140488",Tue Apr 26 08:43:47 +0000 2022,,,https://www.instagram.com/p/CcztiWXqADe/?igshid=YTgzYjQ4ZTY=,0,1518873462340825089,,,,en,"Glasgow, Scotland",false,,0,,,"<a href=""http://instagram.com"" rel=""nofollow"">Instagram</a>","From KS fulfillment to table in 24h!

Got Planet Unknown to the table last night at the Southside Board Game Group! I did not win... @ The Corona Bar &amp; Kitchen https://t.co/tyMxVY5xqp",https://twitter.com/MrHinsh/status/1518873462340825089,Mon Jun 25 12:36:46 +0000 2007,7067852,false,"Husband of @jessbaezc, father, Owner @nkdAgility, trainer @Scrumdotorg and @mvpaward in @GitHub & @AzureDevOps, International Speaker, & into #BoardGames!",5335,2802,1863,216,Worldwide Traveler,Martin Hinshelwood 🏴󠁧󠁢󠁳󠁣󠁴󠁿 🇪🇺 🇲🇽,MrHinsh,21040,,http://nkdagility.com/blog,false
"-93.39112,48.61003",Tue Apr 26 16:43:49 +0000 2022,norwestanimalclinic Dexter dexterandkeiko,,https://www.instagram.com/p/Cc0keiWORw5/?igshid=YTgzYjQ4ZTY=,1,1518994268177768449,,,,en,"Fort Frances, Ontario",false,,0,,,"<a href=""http://instagram.com"" rel=""nofollow"">Instagram</a>","Dexter is feeling a little rough. He got his Lyme vaccine earlier.  The folks at #norwestanimalclinic are wonderful! #Dexter #dexterandkeiko @ Fort Frances, Ontario https://t.co/HiQqabvBqi",https://twitter.com/clio343/status/1518994268177768449,Fri May 14 17:20:03 +0000 2010,143876169,false,Blue Jays fan who loves to curl. Proud Mom. Cats and dogs. Northwestern Ontario is home.,47715,594,1286,29,"Fort Frances, Ontario",Christine Denby 🍁🇨🇦,clio343,22752,,,false
"-78.02738942,34.21621622",Tue Apr 26 20:26:26 +0000 2022,,,https://www.cnbc.com/amp/2022/04/26/at-least-58percent-of-us-population-has-natural-antibodies-from-previous-covid-infection-cdc-says.html,0,1519050289923473410,,,,en,"Hightsville, NC",false,,0,,,"<a href=""http://www.tweetcaster.com"" rel=""nofollow"">TweetCaster for Android</a>","Good news ...  Maybe we are on the other side.

At least 58% of U.S. population has natural antibodies from previous Covid infection, CDC says -  https://t.co/QTEqIUkBzD",https://twitter.com/DrJFamPhysn/status/1519050289923473410,Fri Aug 26 16:11:11 +0000 2011,362561191,false,"Family physician with a subspecialty certification in Adolescent Medicine. In office & virtual - high quality, cost-effective healthcare for whole family.",2,46,41,1,"Leland, North Carolina USA",Robert R Johnson Jr,DrJFamPhysn,1408,,http://www.wilmingtonhealth.com,false
"-118.194216,33.770742",Tue Apr 26 01:46:51 +0000 2022,WFH Poolside dtlb,https://twitter.com/mssdarling/status/1518768536063287298/photo/1,https://www.swarmapp.com/c/40v3tAbzFnK,0,1518768536063287298,,,,en,"Long Beach, CA",false,,0,,,"<a href=""http://foursquare.com"" rel=""nofollow"">Foursquare</a>","#WFH #Poolside ☀️☀️ #dtlb (@ Poolside At Sofi in Long Beach, CA) https://t.co/UMlwMFwf91 https://t.co/UrBewbqWy5",https://twitter.com/mssdarling/status/1518768536063287298,Mon Apr 13 22:52:47 +0000 2009,30983396,false,Page Turner; Reading is Fundamental! A little bit of Honey with a whole lot of Kick! Favorite Flower: Red Anthurium ♐️ CashApp $missdailey,48340,730,507,165,Everywhere You Want to Be,♐️💖Soft & Wet 💖♐️,mssdarling,140423,,,false
"-0.61838,51.18395",Tue Apr 26 16:17:45 +0000 2022,godalming,,https://www.instagram.com/p/Cc0hfZ2oYSQ/?igshid=YTgzYjQ4ZTY=,0,1518987708718206977,,,,en,"Godalming, England",true,,0,,,"<a href=""http://instagram.com"" rel=""nofollow"">Instagram</a>",Perfect evening and views for the walk home from work #godalming @ Godalming https://t.co/VKEbk5JyN1,https://twitter.com/Lottieoflondon/status/1518987708718206977,Fri Feb 20 14:29:54 +0000 2009,21400189,false,"Bespoke jewellery designer, blogger of polymer clay, geek of most things, mother of two & mad cat lover! Oh & I love to run",1070,976,567,175,London,Clare Lewis,Lottieoflondon,22191,,http://www.lottieoflondon.co.uk,false
"-104.7812654,38.8560908",Tue Apr 26 15:22:16 +0000 2022,,,https://bit.ly/38mwyB9,0,1518973743497838592,,,,en,"Colorado Springs, CO",false,,0,,,"<a href=""https://www.careerarc.com"" rel=""nofollow"">CareerArc 2.0</a>","Pikes Peak Center - Genesis Heal... introduced universal COVID-19 vaccinations for all employees, care partners and onsite vendors because the welfare of our patients, residents, families and employees should always guide our decisions. Join our team! https://t.co/8EGacm9yKj",https://twitter.com/GenesisCareers/status/1518973743497838592,Wed Apr 22 17:55:53 +0000 2009,34343262,false,"Our employees are the vital link between us, our patients and residents! We care deeply! Follow us on Social. #GenesisCareers",36,1405,324,16,Nationwide,Genesis Careers,GenesisCareers,4286,,http://www.genesiscareers.jobs,false
"-111.99871701,60.1439082",Tue Apr 26 19:41:09 +0000 2022,News,https://twitter.com/DailyNews79/status/1519038892879405056/photo/1,http://lasthour.hipeople.biz/SPHl6w,0,1519038892879405056,,,,en,"Region 5, Unorganized, Northwest Territories",false,,0,,,"<a href=""https://dlvrit.com/"" rel=""nofollow"">dlvr.it</a>",#News Opinion | Complaints about illegal fireworks in Toronto exploded during the pandemic. The solution may be more fireworks - Toronto Star https://t.co/ERxZaYBtEM https://t.co/9Cq2B91IiV,https://twitter.com/DailyNews79/status/1519038892879405056,Wed Feb 09 07:43:20 +0000 2022,1491316688549253120,false,"Ours is just a small press release, it's not spam.
Subscribe to our comunity https://t.co/upst403dGf",10,61,537,0,Italy,DailyNews 🇮🇹,DailyNews79,159876,,https://hipeople.biz,false
"-117.6539993,33.850666",Tue Apr 26 22:30:01 +0000 2022,,,http://eqbot.com/Amv http://eqbot.com/AmJ,5,1519081391324991488,,,,en,"California, USA",false,,1,,,"<a href=""http://eqbot.com/"" rel=""nofollow"">EQBot</a>","A 1.9 magnitude earthquake occurred 4.97mi WSW of Corona, CA. Details: https://t.co/sqrbJwHfyX Map: https://t.co/5QrLGeIgLs",https://twitter.com/earthquakesLA/status/1519081391324991488,Sun May 03 23:42:14 +0000 2009,37534994,false,I am a robot that tells you about earthquakes in Los Angeles as they happen. Built by @billsnitzer. Data is from the USGS. Get prepared: http://t.co/VtCEbuw6KH,0,423637,6,1875,"Los Angeles, CA",LA QuakeBot,earthquakesLA,24810,,http://eqbot.com/,false
"101.67171434,3.13602009",Tue Apr 26 03:41:44 +0000 2022,,,https://www.instagram.com/p/CczK-IyhgL9/?igshid=YTgzYjQ4ZTY=,0,1518797448415780864,,,,en,"Kuala Lumpur, Wilayah Persekutuan Kuala Lumpur",false,,0,,,"<a href=""http://instagram.com"" rel=""nofollow"">Instagram</a>",Focus Group Discussion (FGD): ‘Assessing Organizational Resources for Post Pandemic Resiliency and Employees’ Well-Being’ 25 April 2022. @ Institut Masa Depan Malaysia https://t.co/iT3UQbdKah,https://twitter.com/azrilmohdamin/status/1518797448415780864,Sun Apr 17 06:59:48 +0000 2011,283406645,false,"Lawyer | Chairman & Founder, CENTHRA | CEO, Institut Masa Depan Malaysia",2254,832,154,16,"Geneva, Switzerland","Azril Mohd Amin, Esq",azrilmohdamin,3315,,http://www.azrilmohdamin.com,false
"-122.3308,47.6046",Tue Apr 26 06:55:56 +0000 2022,,,https://www.instagram.com/p/CczhMtzuY7H/?igshid=YTgzYjQ4ZTY=,0,1518846319787339777,,,,en,"Seattle, WA",false,,0,,,"<a href=""http://instagram.com"" rel=""nofollow"">Instagram</a>","My allergies are so bad @phillydefranco just made me take my first Covid test. Let me tell you; I WAS CONVINCED I HAD IT after that swab. That was a long 15 minutes. @ Seattle, Washington https://t.co/8JpLTlN6jl",https://twitter.com/MissCaroline/status/1518846319787339777,Tue Oct 02 20:23:46 +0000 2007,9213042,false,Sagittarius. Anglophile. Gay man in a woman's body. Sanity Assassin. Cats!! She/Her/That Fucking Bitch MPLS - LA - SEA 🦑 #ImStillWithHer #NastyWoman,38466,1381,4821,35,"Seattle, WA",Miss Caroline,MissCaroline,20895,,http://about.me/misscaroline,false
"79.86726123,23.31625371",Tue Apr 26 10:42:35 +0000 2022,COVID,https://twitter.com/DailyNews79/status/1518903360518168576/photo/1,http://lasthour.hipeople.biz/SPG8Gk,0,1518903360518168576,,,,en,"पाटन, भारत",false,,0,,,"<a href=""https://dlvrit.com/"" rel=""nofollow"">dlvr.it</a>","#COVID DCGI grants emergency use authorisation to Corbevax for those aged 5-12, Covaxin for 6-12 age group, Zyco - Times of India https://t.co/d3BGkDK4Tf https://t.co/C3B32NKBYe",https://twitter.com/DailyNews79/status/1518903360518168576,Wed Feb 09 07:43:20 +0000 2022,1491316688549253120,false,"Ours is just a small press release, it's not spam.
Subscribe to our comunity https://t.co/upst403dGf",10,61,537,0,Italy,DailyNews 🇮🇹,DailyNews79,159876,,https://hipeople.biz,false
"-111.99871701,60.1439082",Tue Apr 26 01:42:17 +0000 2022,,https://twitter.com/DailyNews79/status/1518767389235499008/photo/1,http://CBC.ca http://lasthour.hipeople.biz/SPDzcl,0,1518767389235499008,,,,en,"Region 5, Unorganized, Northwest Territories",false,,0,,,"<a href=""https://dlvrit.com/"" rel=""nofollow"">dlvr.it</a>","COVID infections driving up Winnipeg emergency wait times, WRHA CEO says - https://t.co/fX2ROo0Hvh https://t.co/dnAtB3bOyJ https://t.co/RGkdFaHclf",https://twitter.com/DailyNews79/status/1518767389235499008,Wed Feb 09 07:43:20 +0000 2022,1491316688549253120,false,"Ours is just a small press release, it's not spam.
Subscribe to our comunity https://t.co/upst403dGf",10,61,537,0,Italy,DailyNews 🇮🇹,DailyNews79,159876,,https://hipeople.biz,false
"13.1199934,52.381905",Tue Apr 26 03:07:21 +0000 2022,nowplaying FifthHarmony bbradio hits,,,1,1518788796048883712,,,,en,"Potsdam, Deutschland",,,0,,,"<a href=""http://www.bbradio.de"" rel=""nofollow"">BB RADIO Music App</a>",#nowplaying #FifthHarmony ~ Fifth Harmony | Work From Home ||| #bbradio plays the #hits,https://twitter.com/_BB_RADIO_MUSIC/status/1518788796048883712,Tue Jun 29 10:26:00 +0000 2010,160874621,false,BB RADIO is one of the leading radio stations in Berlin and Brandenburg in Germany.,2,2588,1711,177,"Germany, Potsdam",BB RADIO Playlist,_BB_RADIO_MUSIC,996205,,http://www.bbradio.de,false
"136.96694444,35.17",Tue Apr 26 09:24:14 +0000 2022,blendedlearning speakingexaminers covid chubu A2Key B1Preliminary,,https://www.instagram.com/p/CczyK_hpwow/?igshid=YTgzYjQ4ZTY=,1,1518883642784681984,,,,en,愛知 名古屋市 千種区,false,,0,,,"<a href=""http://instagram.com"" rel=""nofollow"">Instagram</a>","#blendedlearning today = new #speakingexaminers buddying-up with experienced, &amp; #covid careful exam delivery properly demonstrated. Well done #chubu #A2Key #B1Preliminary team! Standards at max satisfactory!! https://t.co/R2TOXSgtp2",https://twitter.com/oyajimbo/status/1518883642784681984,Fri Dec 11 10:54:58 +0000 2009,96103979,false,"English School & Cambridge English Centre owner in Japan; examiner trainer & FT teacher. EdTech, my Canon & the odd pint while shouting at the rugby/cricket",6045,2947,3620,183,"iPhone: 36.232773,137.976120",Jim George,oyajimbo,27585,,http://about.me/Jim_George,false
"-1.49602085,52.4480355",Tue Apr 26 09:28:50 +0000 2022,everydayisadevelopmentday matsgroup,,https://www.instagram.com/p/CczysM5Kfpg/?igshid=YTgzYjQ4ZTY=,0,1518884801129979904,,,,en,"Coventry, England",false,,0,,,"<a href=""http://instagram.com"" rel=""nofollow"">Instagram</a>",MATS group conference final after 2 years delay due to covid 🤢#everydayisadevelopmentday #matsgroup @ Coventry Building Society Arena https://t.co/fKFgbO5IhV,https://twitter.com/Chuggsie/status/1518884801129979904,Sun Dec 12 16:59:57 +0000 2010,225861009,false,CEO of POD Training and Consultancy and Team Manager at Plymouth Albion RFC,48,183,231,1,Plymouth,Gareth Jones,Chuggsie,782,,http://www.podtraining.co.uk,false
"103.8545049,1.28680578",Tue Apr 26 15:22:07 +0000 2022,,,https://www.instagram.com/p/Cc0bIQ9B1UmFvY5dmUwwbvZvgmZy9NnfC_4_BA0/?igshid=YTgzYjQ4ZTY=,0,1518973708332843009,,,,en,新加坡,false,,0,,,"<a href=""http://instagram.com"" rel=""nofollow"">Instagram</a>","Singapore has announced a major easing of its remaining Covid-19 rules wef 26 April 2022. @ Singapore, Singapore https://t.co/QOZ5h9JwFr",https://twitter.com/ridzuwanmj/status/1518973708332843009,Tue Oct 18 11:34:53 +0000 2016,788342583856467968,false,,228,13,71,0,Singapore,Mohamed Ridzuwan,ridzuwanmj,850,,,false
"103.93852274,1.39701211",Tue Apr 26 06:24:16 +0000 2022,,,http://lasthour.hipeople.biz/SPFTZf,0,1518838350827843584,,,,en,新加坡,false,,0,,,"<a href=""https://dlvrit.com/"" rel=""nofollow"">dlvr.it</a>","Singapore CPI Rises to 10-Year High on War, Covid Disruptions - Bloomberg https://t.co/QzUSwj28Dn",https://twitter.com/DailyNews79/status/1518838350827843584,Wed Feb 09 07:43:20 +0000 2022,1491316688549253120,false,"Ours is just a small press release, it's not spam.
Subscribe to our comunity https://t.co/upst403dGf",10,61,537,0,Italy,DailyNews 🇮🇹,DailyNews79,159876,,https://hipeople.biz,false
"103.9175963,1.37138652",Tue Apr 26 06:19:09 +0000 2022,,https://twitter.com/DailyNews79/status/1518837065466609664/photo/1,http://lasthour.hipeople.biz/SPFT0c,0,1518837065466609664,,,,en,"东区, 新加坡",false,,0,,,"<a href=""https://dlvrit.com/"" rel=""nofollow"">dlvr.it</a>",COMMENT: Singapore finally gets its Covid ‘happy day’ - Yahoo Singapore News https://t.co/EGJxuxsUQJ https://t.co/ArGh76XSbU,https://twitter.com/DailyNews79/status/1518837065466609664,Wed Feb 09 07:43:20 +0000 2022,1491316688549253120,false,"Ours is just a small press release, it's not spam.
Subscribe to our comunity https://t.co/upst403dGf",10,61,537,0,Italy,DailyNews 🇮🇹,DailyNews79,159876,,https://hipeople.biz,false
"-118.35967862,34.08393866",Tue Apr 26 17:39:41 +0000 2022,,,https://www.instagram.com/p/Cc0q3tiJe6z/?igshid=YTgzYjQ4ZTY=,1,1519008326478184450,,,,en,"Los Angeles, CA",false,,0,,,"<a href=""http://instagram.com"" rel=""nofollow"">Instagram</a>",Love During the Age of Covid. @ Anthony Meindl's Actor Workshop https://t.co/6gypBmy5nF,https://twitter.com/AnthonyMeindl/status/1519008326478184450,Tue Jul 21 04:46:18 +0000 2009,58707391,false,Helping creators to get out of their heads. Artistic Director of Anthony Meindl's Actor Workshop. @AMAWStudios #AtLeftBrainTurnRight #BookTheFingJob  #AMAW,7589,12724,261,272,LA/NY/ATL/Toronto/London/Vancouver/Sydney/SantaFe,ANTHONY MEINDL,AnthonyMeindl,34984,,http://www.anthonymeindl.com,false
"79.98121977,14.44768831",Tue Apr 26 11:08:22 +0000 2022,,,https://www.instagram.com/p/Ccz-FaNp7cf/?igshid=YTgzYjQ4ZTY=,0,1518909846929743872,,,,en,"Nellore, India",false,,1,,,"<a href=""http://instagram.com"" rel=""nofollow"">Instagram</a>","Degree and PG students, are you ready the set the fields on fire? The biggest annual sports meet is back after a long gap after covid. 
 Sign up for sports day now.  🔥🔥 🔥 @ Rao's Educational Institutions- Nellore https://t.co/DZHXIFaMcI",https://twitter.com/Raosinstitution/status/1518909846929743872,Mon Oct 22 11:35:15 +0000 2018,1054335368835694593,false,"We started as a small coaching center in the year 1983, Rao's Educational Society progressed step-by-step thereafter.",5,64,1,0,"Nellore, India",Rao's educational Institutions,Raosinstitution,567,,http://www.raosinstitutions.com,false
"-75.1638,39.9523",Tue Apr 26 15:15:29 +0000 2022,,,https://medicalxpress.com/news/2022-04-dogs-orange-slices-latest-covid.html,0,1518972038932803585,,,,en,"Philadelphia, PA",false,,0,,,"<a href=""https://help.twitter.com/en/using-twitter/how-to-tweet#source-labels"" rel=""nofollow"">heapevents.info</a>","Dogs Orange Slices Latest Covid ☝ 🙂 
 https://t.co/DN3qHAFOhO",https://twitter.com/heapevents/status/1518972038932803585,Sat Jan 09 15:58:46 +0000 2021,1347935690332495877,false,just heap of US events,0,7,25,1,,heapevents.info,heapevents,21354,,https://www.heapevents.info/,false
"-123.13695335,49.17390562",Tue Apr 26 18:29:43 +0000 2022,boardmeeting RCD,,https://www.instagram.com/p/Cc0wmPnPMKh/?igshid=YTgzYjQ4ZTY=,2,1519020918336544774,,,,en,"Richmond, British Columbia",false,,0,,,"<a href=""http://instagram.com"" rel=""nofollow"">Instagram</a>","Hybrid format of #boardmeeting @richmond_rcd is taking place at the #RCD and on Zoom, thank you for their good works, persistently over the pandemic and beyond @ Richmond Centre for Disability https://t.co/hczWPuUnq5",https://twitter.com/RCD_Richmond/status/1519020918336544774,Tue Jun 16 02:49:52 +0000 2009,47522514,false,Richmond Centre for Disability is a non-profit organization that provides resources and empowers people with disabilities to participate in the community.,3555,657,357,39,"Richmond/Vancouver, BC",Richmond Centre for Disability (RCD),RCD_Richmond,4268,,https://www.rcdrichmond.org/,false
"-122.44545958,37.78181908",Tue Apr 26 18:26:12 +0000 2022,,,https://www.swarmapp.com/c/5eS6xcXwyAI,0,1519020033078349824,,,,en,"San Francisco, CA",false,,0,,,"<a href=""http://foursquare.com"" rel=""nofollow"">Foursquare</a>","2nd Covid Booster (@ City Center in San Francisco, CA) https://t.co/rbzht2ibHm",https://twitter.com/vlee317/status/1519020033078349824,Thu Jul 30 07:34:52 +0000 2009,61423720,false,日本語を勉強している。 椎名林檎が大好きです。,27746,265,932,47,サンフランシスコ,ビクター　リー,vlee317,34487,,http://www.flickr.com/photos/victor_lee/,false
"-79.7164011,43.7742911",Tue Apr 26 20:37:02 +0000 2022,Cricket Sports,,http://dlvr.it/SPHsys,0,1519052959744544768,,,,en,"Brampton, Ontario",false,,1,,,"<a href=""https://dlvrit.com/"" rel=""nofollow"">dlvr.it</a>","IPL 2022, PBKS vs CSK: Rishi Dhawan’s face shield catches everyone’s attention https://t.co/BOoQhjxKd6 #Cricket #Sports",https://twitter.com/Weeklyvoice/status/1519052959744544768,Tue Mar 30 17:43:21 +0000 2010,127943720,false,Most Trusted News in North America’s South Asian Communities Since 1997,172,495,299,11,Toronto,Weekly Voice,Weeklyvoice,37140,,http://www.Weeklyvoice.com,false
"-96.7836,32.7668",Tue Apr 26 21:45:27 +0000 2022,,,https://www.pressreleasepoint.com/omicron-prompted-spike-covid-cases-pregnant-women-fewer-hospitalizations,0,1519070174372147205,,,,en,"Dallas, TX",false,,0,,,"<a href=""https://help.twitter.com/en/using-twitter/how-to-tweet#source-labels"" rel=""nofollow"">heapevents.info</a>","Omicron Prompted Spike Covid Cases Pregnant Women Fewer Hospitalizations ☝ 🙂 
 https://t.co/kphwWyWBCH",https://twitter.com/heapevents/status/1519070174372147205,Sat Jan 09 15:58:46 +0000 2021,1347935690332495877,false,just heap of US events,0,7,25,1,,heapevents.info,heapevents,21354,,https://www.heapevents.info/,false
