coordinates,created_at,hashtags,media,urls,favorite_count,id,in_reply_to_screen_name,in_reply_to_status_id,in_reply_to_user_id,lang,place,possibly_sensitive,quote_id,retweet_count,retweet_id,retweet_screen_name,source,text,tweet_url,user_created_at,user_id,user_default_profile_image,user_description,user_favourites_count,user_followers_count,user_friends_count,user_listed_count,user_location,user_name,user_screen_name,user_statuses_count,user_time_zone,user_urls,user_verified
"7.39359405,9.07701855",Tue Apr 26 10:37:33 +0000 2022,,https://twitter.com/DailyNews79/status/1518902093796438016/photo/1,http://lasthour.hipeople.biz/SPG7X0,0,1518902093796438016,,,,en,"Abuja, Nigeria",false,,0,,,"<a href=""https://dlvrit.com/"" rel=""nofollow"">dlvr.it</a>",Beijing expands mass testing as lockdown fears grow - Guardian Nigeria https://t.co/VVdxvAVvJv https://t.co/NgndbT5dns,https://twitter.com/DailyNews79/status/1518902093796438016,Wed Feb 09 07:43:20 +0000 2022,1491316688549253120,false,"Ours is just a small press release, it's not spam.
Subscribe to our comunity https://t.co/upst403dGf",10,61,537,0,Italy,DailyNews 🇮🇹,DailyNews79,159876,,https://hipeople.biz,false
"-117.6518326,33.8503342",Tue Apr 26 17:08:01 +0000 2022,,,http://eqbot.com/Am4 http://eqbot.com/AmT,3,1519000357560479745,,,,en,"California, USA",false,,2,,,"<a href=""http://eqbot.com/"" rel=""nofollow"">EQBot</a>","A 2.3 magnitude earthquake occurred 4.97mi WSW of Corona, CA. Details: https://t.co/plWpb8ArF1 Map: https://t.co/Ricf1oF6E0",https://twitter.com/earthquakesLA/status/1519000357560479745,Sun May 03 23:42:14 +0000 2009,37534994,false,I am a robot that tells you about earthquakes in Los Angeles as they happen. Built by @billsnitzer. Data is from the USGS. Get prepared: http://t.co/VtCEbuw6KH,0,423637,6,1875,"Los Angeles, CA",LA QuakeBot,earthquakesLA,24810,,http://eqbot.com/,false
"-117.652,33.85",Tue Apr 26 17:07:04 +0000 2022,earthquake Corona,,http://www.earthquaketrack.com/quakes/2022-04-26-17-04-29-utc-2-3-8,4,1519000118577434626,,,,en,"California, USA",false,,0,,,"<a href=""http://earthquaketrack.com"" rel=""nofollow"">EarthquakeTrack.com</a>","2.3 magnitude #earthquake. 5 mi from #Corona, CA, United States https://t.co/5LmmmJq9qq",https://twitter.com/quakesLA/status/1519000118577434626,Wed Jul 25 05:35:57 +0000 2012,715541250,false,Southern California earthquake alerts based on USGS data.   2.5 magnitude and higher in Los Angeles and Southern California.,0,49437,14,291,Los Angeles,Southern CA Quakes,quakesLA,54204,,http://earthquaketrack.com/v/la,false
"120.98282,14.537383",Tue Apr 26 04:09:27 +0000 2022,,,https://www.swarmapp.com/c/jQg6KwfGIoY,0,1518804422796750849,,,,en,"Lungsod ng Pasay, Pambansang Punong Rehiyon",false,,0,,,"<a href=""http://foursquare.com"" rel=""nofollow"">Foursquare</a>","Kudos for the fast transaction. Yellow passport achieved! (@ Bureau Of Quarantine in Pasay City, Metro Manila) https://t.co/oEY4pCTaRJ",https://twitter.com/bythebheej/status/1518804422796750849,Sun Aug 23 18:41:44 +0000 2009,68206254,false,Always be grateful 🙏🏼 pay it forward ♎️,3924,574,2521,12,,Bheej,bythebheej,7819,,,false
"-1.80341797,52.41786685",Tue Apr 26 14:00:32 +0000 2022,Jobibo JobsInBirmingham BirminghamLiveJobs,,http://dlvr.it/SPGm1x,0,1518953177562853381,,,,en,"Solihull, England",false,,0,,,"<a href=""https://dlvrit.com/"" rel=""nofollow"">dlvr.it</a>",Business Analyst / Project Manager (work from home) - Birmingham https://t.co/Hq4dWrt6aM - Click to apply #Jobibo #JobsInBirmingham #BirminghamLiveJobs,https://twitter.com/BhamLiveJobs/status/1518953177562853381,Wed Apr 13 11:19:27 +0000 2022,1514201558619242497,false,Jobs In Birmingham live updates - Be the first to hear of jobs in Birmingham. Search all jobs in Birmingham here - https://t.co/whotHw1EmY,0,0,1,0,"Birmingham, England",Birmingham Live Jobs,BhamLiveJobs,995,,https://www.jobibo.co.uk/location/birmingham/,false
"-75.69453838,45.41995212",Tue Apr 26 17:07:03 +0000 2022,Ottawa Canada news,,http://CTVnews.ca http://dlvr.it/SPHKrX,0,1519000114458546176,,,,en,"Ottawa, Ontario",false,,1,,,"<a href=""https://dlvrit.com/"" rel=""nofollow"">dlvr.it</a>",https://t.co/ksrs7ITfCb Ottawa → Two new COVID-19 deaths reported in Ottawa Tuesday https://t.co/Sv1efv7WSk @OttawaNewsPulse 📰 #Ottawa #Canada #news,https://twitter.com/OttawaNewsPulse/status/1519000114458546176,Sun Feb 20 22:00:05 +0000 2022,1495518597426393092,false,"#Ottawa city news: society, culture 🎭, business 📊, and politics.",1899,175,787,3,"Ottawa, Ontario",🇨🇦 Ottawa News Pulse,OttawaNewsPulse,10091,,https://twitter.com/OttawaNewsPulse,false
"-122.419,37.7749",Tue Apr 26 16:45:27 +0000 2022,,,https://www.capradio.org/articles/2022/04/25/california-coronavirus-updates-april-2022/,0,1518994679727116290,,,,en,"San Francisco, CA",false,,0,,,"<a href=""https://help.twitter.com/en/using-twitter/how-to-tweet#source-labels"" rel=""nofollow"">heapevents.info</a>","California Coronavirus Updates April ☝ 😐 
 https://t.co/tK7GA5V3ZY",https://twitter.com/heapevents/status/1518994679727116290,Sat Jan 09 15:58:46 +0000 2021,1347935690332495877,false,just heap of US events,0,7,25,1,,heapevents.info,heapevents,21354,,https://www.heapevents.info/,false
"-81.3075614,28.43088316",Tue Apr 26 20:37:34 +0000 2022,wearamask voteblue,https://twitter.com/heartsandroses9/status/1519053090544099333/photo/1,https://www.swarmapp.com/c/jzDIEFpmWo4,0,1519053090544099333,,,,en,"Orlando, FL",false,,0,,,"<a href=""http://foursquare.com"" rel=""nofollow"">Foursquare</a>","#wearamask #voteblue (@ Orlando International Airport - @mco in Orlando, FL) https://t.co/fj1RWyJt3X https://t.co/mtrhNtUfVm",https://twitter.com/heartsandroses9/status/1519053090544099333,Fri Jun 01 14:02:16 +0000 2012,596487575,false,Random Chatter. #voteblue,239906,1448,2463,43,"New York, NY",just Me,heartsandroses9,215904,,,false
"-1.80341797,52.41786685",Tue Apr 26 12:53:03 +0000 2022,Jobibo JobsInBirmingham BirminghamLiveJobs,,http://dlvr.it/SPGY0s,0,1518936194389712896,,,,en,"Solihull, England",false,,0,,,"<a href=""https://dlvrit.com/"" rel=""nofollow"">dlvr.it</a>","Communications Manager/Lead (working from home) - Birmingham - £40,000 to £42,500 https://t.co/oJU5azSB6U - Click to apply #Jobibo #JobsInBirmingham #BirminghamLiveJobs",https://twitter.com/BhamLiveJobs/status/1518936194389712896,Wed Apr 13 11:19:27 +0000 2022,1514201558619242497,false,Jobs In Birmingham live updates - Be the first to hear of jobs in Birmingham. Search all jobs in Birmingham here - https://t.co/whotHw1EmY,0,0,1,0,"Birmingham, England",Birmingham Live Jobs,BhamLiveJobs,995,,https://www.jobibo.co.uk/location/birmingham/,false
"-85.29211,35.04902",Tue Apr 26 12:40:14 +0000 2022,GetYourDamnShots,,https://www.instagram.com/p/Cc0Imc0rujB/?igshid=YTgzYjQ4ZTY=,1,1518932967153885185,,,,en,"Chattanooga, TN",false,,0,,,"<a href=""http://instagram.com"" rel=""nofollow"">Instagram</a>",Second COVID booster and a My Little Pony bandaid. #GetYourDamnShots @ Hamilton County Health Department https://t.co/MwqLcE1ruT,https://twitter.com/topher_k/status/1518932967153885185,Thu May 15 03:15:48 +0000 2008,14781181,false,"Explorer, Explainer, Learner, @chattahooligan Flag Czar (@ChattanoogaFC), Trainer of RPG players and GMs",9180,351,789,5,"Chattanooga, TN, USA",Topher Kersting,topher_k,1380,,,false
"-81.717,27.8333",Tue Apr 26 13:15:47 +0000 2022,,,https://www.nytimes.com/2022/04/25/opinion/masks-covid-ban.html,0,1518941914891964416,,,,en,"Florida, USA",false,,0,,,"<a href=""https://help.twitter.com/en/using-twitter/how-to-tweet#source-labels"" rel=""nofollow"">heapevents.info</a>","Masks Covid Ban ☝ 😐 
 https://t.co/y16wmkebvl",https://twitter.com/heapevents/status/1518941914891964416,Sat Jan 09 15:58:46 +0000 2021,1347935690332495877,false,just heap of US events,0,7,25,1,,heapevents.info,heapevents,21354,,https://www.heapevents.info/,false
"120.61772583,16.40170859",Tue Apr 26 14:07:07 +0000 2022,wfh perks blessed greatful out thankful bpo work,,https://www.instagram.com/p/Cc0Si2YFdSu/?igshid=YTgzYjQ4ZTY=,0,1518954831741952004,,,,en,"Lungsod ng Baguio, Administratibong Rehiyon ng Cordillera",false,,0,,,"<a href=""http://instagram.com"" rel=""nofollow"">Instagram</a>","Work. Werk. Wurk.

#wfh #perks #blessed #greatful #out #thankful #bpo #work @ The Forest Lodge at Camp John Hay https://t.co/0Se3OAVAgn",https://twitter.com/mhaeymie/status/1518954831741952004,Wed Oct 01 03:02:57 +0000 2014,2836044036,false,Hold on to what makes you HAPPY ✊,1188,51,68,0,Baguio City,Charlene Ghie,mhaeymie,1832,,,false
"-111.99871701,60.1439082",Tue Apr 26 01:42:15 +0000 2022,,https://twitter.com/DailyNews79/status/1518767380364595201/photo/1,http://CBC.ca http://lasthour.hipeople.biz/SPDzck,0,1518767380364595201,,,,en,"Region 5, Unorganized, Northwest Territories",false,,0,,,"<a href=""https://dlvrit.com/"" rel=""nofollow"">dlvr.it</a>","Winnipeg Blue Bombers, Valour FC fans won't need COVID vaccine cards as of May 1 - https://t.co/fX2ROo0Hvh https://t.co/Z2ddg158q2 https://t.co/n88M82yT7K",https://twitter.com/DailyNews79/status/1518767380364595201,Wed Feb 09 07:43:20 +0000 2022,1491316688549253120,false,"Ours is just a small press release, it's not spam.
Subscribe to our comunity https://t.co/upst403dGf",10,61,537,0,Italy,DailyNews 🇮🇹,DailyNews79,159876,,https://hipeople.biz,false
"-78.02738942,34.21621622",Tue Apr 26 13:01:51 +0000 2022,,,https://www.forbes.com/sites/roberthart/2022/04/25/unvaccinated-people-increase-risk-of-covid-infection-among-vaccinated-study-finds/amp/,0,1518938406977474560,,,,en,"Leland, NC",false,,0,,,"<a href=""http://www.tweetcaster.com"" rel=""nofollow"">TweetCaster for Android</a>","This is based on a computer model.  I find that computer modeling will give you the result you're looking for rather than the truth of the situation.

Unvaccinated People Increase Risk Of Covid Infection Among Vaccinated, Study Finds -  https://t.co/mEiWRC1m5k",https://twitter.com/DrJFamPhysn/status/1518938406977474560,Fri Aug 26 16:11:11 +0000 2011,362561191,false,"Family physician with a subspecialty certification in Adolescent Medicine. In office & virtual - high quality, cost-effective healthcare for whole family.",2,46,41,1,"Leland, North Carolina USA",Robert R Johnson Jr,DrJFamPhysn,1408,,http://www.wilmingtonhealth.com,false
"-116.5279,33.8443",Tue Apr 26 21:39:54 +0000 2022,COVID19 StaySafe,,https://www.instagram.com/p/Cc1GXIev8fx/?igshid=YTgzYjQ4ZTY=,0,1519068779296305157,,,,en,"Palm Springs, CA",false,,0,,,"<a href=""http://instagram.com"" rel=""nofollow"">Instagram</a>","#COVID19 #StaySafe @ Palm Springs, California https://t.co/yuRshhoB8c",https://twitter.com/Vic_Stone1/status/1519068779296305157,Fri Feb 01 02:43:01 +0000 2013,1138511886,false,"#BeKind Actor.Activist. Writer.Caregiver.1part Gandhi,1part Mother Theresa,1part Mae West & 6parts abs &U got me.Making World Better Place 4Ever #LGBT De native",7535,14047,15419,145,"Los Angeles/Palm Springs, Ca",Victor Bryan Stone,Vic_Stone1,129084,,https://vicstoneblog.wordpress.com/,false
"79.80464061,22.36196392",Tue Apr 26 06:23:14 +0000 2022,,https://twitter.com/DailyNews79/status/1518838093360492544/photo/1,http://lasthour.hipeople.biz/SPFTXL,0,1518838093360492544,,,,en,"मध्य प्रदेश, भारत",false,,0,,,"<a href=""https://dlvrit.com/"" rel=""nofollow"">dlvr.it</a>",Philippines starts rollout of second booster dose against COVID-19 - Arab News https://t.co/kQqAhn96d1 https://t.co/U8GRe8nmWi,https://twitter.com/DailyNews79/status/1518838093360492544,Wed Feb 09 07:43:20 +0000 2022,1491316688549253120,false,"Ours is just a small press release, it's not spam.
Subscribe to our comunity https://t.co/upst403dGf",10,61,537,0,Italy,DailyNews 🇮🇹,DailyNews79,159876,,https://hipeople.biz,false
"79.45691613,22.90707891",Tue Apr 26 10:44:24 +0000 2022,,https://twitter.com/DailyNews79/status/1518903817915404288/photo/1,http://lasthour.hipeople.biz/SPG8VP,0,1518903817915404288,,,,en,"मध्य प्रदेश, भारत",false,,0,,,"<a href=""https://dlvrit.com/"" rel=""nofollow"">dlvr.it</a>","COVID-19 vaccine: DGCI grants EUA to Covaxin, Zy-CoV-D for children between 6-12 yrs - Business Today https://t.co/82PETvcndt https://t.co/aSMFN66uLS",https://twitter.com/DailyNews79/status/1518903817915404288,Wed Feb 09 07:43:20 +0000 2022,1491316688549253120,false,"Ours is just a small press release, it's not spam.
Subscribe to our comunity https://t.co/upst403dGf",10,61,537,0,Italy,DailyNews 🇮🇹,DailyNews79,159876,,https://hipeople.biz,false
"-117.654,33.851",Tue Apr 26 22:30:04 +0000 2022,earthquake Corona,,http://www.earthquaketrack.com/quakes/2022-04-26-22-26-40-utc-1-9-9,4,1519081403664662528,,,,en,"California, USA",false,,0,,,"<a href=""http://earthquaketrack.com"" rel=""nofollow"">EarthquakeTrack.com</a>","1.9 magnitude #earthquake. 9 km from #Corona, CA, United States https://t.co/lNFuFosDDQ",https://twitter.com/QuakesToday/status/1519081403664662528,Fri Aug 26 14:57:52 +0000 2011,362523555,false,Worldwide earthquake alerts based on USGS data.  1.5 magnitude and higher.,0,204529,10,1353,,Earthquake Alerts,QuakesToday,429170,,http://earthquaketrack.com,false
"-73.7874,40.9149",Tue Apr 26 12:25:26 +0000 2022,Covid,,https://www.instagram.com/p/Cc0G6LirEnI/?igshid=YTgzYjQ4ZTY=,0,1518929242641346560,,,,en,"New Rochelle, NY",false,,0,,,"<a href=""http://instagram.com"" rel=""nofollow"">Instagram</a>","My wife has #Covid and she has bubbled herself in our living room. I’m pretty sure her bubbling technique isn’t air tight. @ New Rochelle, New York https://t.co/0cc5hvxMsV",https://twitter.com/TheJoeMatarese/status/1518929242641346560,Thu Dec 18 15:24:42 +0000 2008,18216605,false,#Comedian Text My Cell To Say Hi 951-298-9899 Podcast/ Remember When Tour Dates/ Book Joe For Your Next Event👇👇👇👇 👇 👇 👇 👇 👇 👇 👇 👇,930,14389,200,164,"New Rochelle, NY",Joe Matarese,TheJoeMatarese,12453,,https://linktr.ee/TheJoeMatarese,true
"-74.9697707,39.7172152",Tue Apr 26 16:33:51 +0000 2022,luckycharms nausea diarrhea vomiting,,https://iwaspoisoned.com/i/j3LWAyN,0,1518991757840687104,,,,en,"Williamstown, NJ",false,,0,,,"<a href=""https://iwaspoisoned.com"" rel=""nofollow"">IWPTweets</a>","Lucky Charms - Winslow Township, New Jersey - I ate lucky charmed and was sick for 3 days puking and diarrhea. I’m thought I had covid or the flu it was so bad.
I dont keep my food... Food Poisoning https://t.co/nwJyk6tX1U #luckycharms #nausea #diarrhea #vomiting",https://twitter.com/iwaspoisoned_/status/1518991757840687104,Fri Oct 20 02:12:41 +0000 2017,921197448885886977,false,Got food poisoning? Report it now at https://t.co/uqaqt4dYM1 . The #1 consumer led food poisoning reporting platform in the world.,199,699,3,2,,Iwaspoisoned.com,iwaspoisoned_,92681,,https://iwaspoisoned.com,false
"28.18652096,-25.8098423",Tue Apr 26 15:30:23 +0000 2022,,,https://www.instagram.com/p/Cc0cEvRsMVA/?igshid=YTgzYjQ4ZTY=,1,1518975788325945344,,,,en,"Centurion, South Africa",true,,0,,,"<a href=""http://instagram.com"" rel=""nofollow"">Instagram</a>",Handover Ceremony for United Nations Development Programme (UNDP) Automotive Training and Re-Skilling in the Post-COVID Economic Recovery for Vulnerable Youth and Women in South Africa Project at Centurion Campus https://t.co/fJt0CyxH2B,https://twitter.com/TSC_TVET/status/1518975788325945344,Thu Nov 29 13:42:22 +0000 2012,978376046,false,"Official twitter account of Tshwane South TVET College, a Public TVET College in South Africa. We offer  Nated courses and NCV as well as Skills programmes.",34,2036,478,6,"Pretoria, South Africa",Tshwane South TVET College,TSC_TVET,886,,http://www.tsc.edu.za,false
"-117.654,33.851",Tue Apr 26 22:30:04 +0000 2022,earthquake CA,,http://www.earthquaketrack.com/quakes/2022-04-26-22-26-40-utc-1-9-9,1,1519081402830000128,,,,en,"California, USA",false,,0,,,"<a href=""http://earthquaketrack.com"" rel=""nofollow"">EarthquakeTrack.com</a>","1.9 magnitude #earthquake. 5 mi from Corona, #CA, United States https://t.co/5y1TYiq4aX",https://twitter.com/quakesLA/status/1519081402830000128,Wed Jul 25 05:35:57 +0000 2012,715541250,false,Southern California earthquake alerts based on USGS data.   2.5 magnitude and higher in Los Angeles and Southern California.,0,49437,14,291,Los Angeles,Southern CA Quakes,quakesLA,54204,,http://earthquaketrack.com/v/la,false
"-75.69814758,45.41948635",Tue Apr 26 14:13:03 +0000 2022,Ottawa ottnews news,,http://dlvr.it/SPGpSq http://CapitalCurrent.ca,0,1518956324297400321,,,,en,"Ottawa, Ontario",false,,1,,,"<a href=""https://dlvrit.com/"" rel=""nofollow"">dlvr.it</a>","Driven by nostalgia and pandemic angst, vinyl thrives in the digital age — could CDs be next? https://t.co/XAQec1QBwC https://t.co/F4YwyFfktd → #Ottawa #ottnews #news",https://twitter.com/OttawaNewsPulse/status/1518956324297400321,Sun Feb 20 22:00:05 +0000 2022,1495518597426393092,false,"#Ottawa city news: society, culture 🎭, business 📊, and politics.",1899,175,787,3,"Ottawa, Ontario",🇨🇦 Ottawa News Pulse,OttawaNewsPulse,10091,,https://twitter.com/OttawaNewsPulse,false
"-81.0442,34.0006",Tue Apr 26 03:42:26 +0000 2022,,,https://www.instagram.com/p/CczLDiEM8ux/?igshid=YTgzYjQ4ZTY=,0,1518797626535145472,,,,en,"South Carolina, USA",false,,0,,,"<a href=""http://instagram.com"" rel=""nofollow"">Instagram</a>","First hair cut in 6 months and the biggest chop since covid shut down America. @ Columbia, South Carolina https://t.co/XieoP4xyyv",https://twitter.com/mr_frye/status/1518797626535145472,Thu Oct 14 16:59:31 +0000 2010,202706181,false,he/him 🏳️‍🌈,12912,247,476,9,"South Carolina, USA",BAD ミッチ,mr_frye,5638,,http://electric-forest.blogspot.com,false
"77.19102783,28.5974128",Tue Apr 26 14:09:34 +0000 2022,,,http://dlvr.it/SPGnl7,0,1518955448208031745,,,,en,"नई दिल्ली, भारत",false,,0,,,"<a href=""https://dlvrit.com/"" rel=""nofollow"">dlvr.it</a>","INNR — Women less likely to recover from long Covid-19: UK study: More than two-thirds of people hospitalized with Covid-19 still suffer symptoms a year later, UK researchers have said. Women and obese people are ...  

View article... https://t.co/nXYyWVXcGo",https://twitter.com/StigmabaseA/status/1518955448208031745,Sat May 29 17:26:03 +0000 2010,149585330,false,Australia - New Zealand — 日本語  — 中国 — 한국말 |  Keeping up-to-date on global exclusion — Stigmabase is a canadian internet non-profit Initiative. Founded in 2010.,0,2908,1275,139,Asia | Australia - Pacific,Stigmabase | ASIA,StigmabaseA,1550650,,https://www.stigmabase.org/,false
"13.1199934,52.381905",Tue Apr 26 02:55:14 +0000 2022,nowplaying FifthHarmony Bayern Unterfranken DAB,,,0,1518785747641417731,,,,en,"Potsdam, Deutschland",,,0,,,"<a href=""http://www.radioteddy.de"" rel=""nofollow"">Radio Teddy Music App</a>",#nowplaying #FifthHarmony ~ Fifth Harmony | Work From Home ||| Radio TEDDY - In #Bayern #Unterfranken #DAB auf Kanal 10A,https://twitter.com/RadioTeddyMusic/status/1518785747641417731,Wed Jun 30 11:49:58 +0000 2010,161262801,false,Das Kinderradio für die ganze Familie. Macht Spaß! Macht schlau!,0,1073,145,115,"Potsdam, Germany, Europe",Radio TEDDY Playlist,RadioTeddyMusic,1053411,,http://www.radioteddy.de,false
"116.53377595,40.09732927",Tue Apr 26 04:49:28 +0000 2022,,,https://www.instagram.com/p/CczSugPOWDs/?igshid=YTgzYjQ4ZTY=,2,1518814494671183877,,,,en,"北京, 中华人民共和国",false,,0,,,"<a href=""http://instagram.com"" rel=""nofollow"">Instagram</a>",Another one cancelled due to covid…..!!! See you soon when the covid situation becomes better… Stay tuned…!!! @ Shunyi District Beijing https://t.co/rl3BE9OTfi,https://twitter.com/mjdadj09/status/1518814494671183877,Wed May 09 22:56:24 +0000 2012,575743030,false,"The sky is just the beginning..... Master's Graduate, Qualified Teacher, Qualified Surveying and Mapping Engineer, International All genre Dj.....",1360,524,463,0,"Gaborone,Botswana",MJ🇧🇼🇨🇳,mjdadj09,2252,,,false
"-82.643675,27.844334",Tue Apr 26 02:31:17 +0000 2022,,,https://apli.us/b00R,0,1518779719998713859,,,,en,"St Petersburg, FL",false,,0,,,"<a href=""http://www.recruitology.com"" rel=""nofollow"">Recruitology</a>","This job might be a great fit for you: Coder/Specialist - 100% Remote | Covid 19 Vaccine Not Required Sign-on Bonus Ava https://t.co/bsgwvXByz3 St. Petersburg, FL",https://twitter.com/NWJS_jobs/status/1518779719998713859,Thu Feb 28 23:58:33 +0000 2019,1101270461986496512,false,Find local jobs now.,0,503,23,2,,Nationwide Job Search,NWJS_jobs,419011,,https://www.nationwidejobsearch.com,false
"4.88649984,52.40412074",Tue Apr 26 08:19:40 +0000 2022,homeoffice boatlife sailinglife workfromhome,,https://www.instagram.com/p/CczqyKyMpbi/?igshid=YTgzYjQ4ZTY=,1,1518867395527712768,,,,en,"Amsterdam, Nederland",false,,0,,,"<a href=""http://instagram.com"" rel=""nofollow"">Instagram</a>",Our #homeoffice this week #boatlife #sailinglife #workfromhome @ Amsterdam Marina https://t.co/y36suhVTQT,https://twitter.com/elsboerhof/status/1518867395527712768,Thu Sep 23 18:48:44 +0000 2010,194226095,false,"Impact investor and managing partner at Goodwell Investments. Loves sailing, skiing, running, walking the dog and AFC Ajax.",6913,1490,1240,75,"Kockengen, The Netherlands",Els Boerhof,elsboerhof,1153,,http://www.goodwell.nl,false
"15,61",Tue Apr 26 16:56:02 +0000 2022,music tour wincentdrumsticks sabiancymbals nickeforsberg nickeforsbergdrums jesuschrüslersupercar rocklivet,,https://www.instagram.com/p/Cc0l4E5sNGz/?igshid=YTgzYjQ4ZTY=,2,1518997342640381952,,,,en,"Rättvik, Sverige",false,,0,,,"<a href=""http://instagram.com"" rel=""nofollow"">Instagram</a>",After over 2 years of Covid 19 pandemic I miss touring and this kind of situation.  📸 by @nyltongrillo #music #tour #wincentdrumsticks #sabiancymbals #nickeforsberg #nickeforsbergdrums #jesuschrüslersupercar #rocklivet https://t.co/7pWninf31Y,https://twitter.com/nickeforsberg/status/1518997342640381952,Sun Aug 19 19:30:02 +0000 2007,8290602,false,Digital Creator @grandpublic and Drummer in @jcssthlm,123,244,220,7,"Jönköping, Sverige",NICKE FORSBERG,nickeforsberg,3830,,https://nickeforsberg.me,false
"-119.746,36.17",Tue Apr 26 21:15:34 +0000 2022,,,https://apnews.com/article/covid-business-health-california-pandemics-dd46ec5a5ccaa2781f869b4daf614e87,0,1519062656245772291,,,,en,"California, USA",false,,0,,,"<a href=""https://help.twitter.com/en/using-twitter/how-to-tweet#source-labels"" rel=""nofollow"">heapevents.info</a>","Covid Business Health California Pandemics ☝ 😐 
 https://t.co/KekWFkXeVr",https://twitter.com/heapevents/status/1519062656245772291,Sat Jan 09 15:58:46 +0000 2021,1347935690332495877,false,just heap of US events,0,7,25,1,,heapevents.info,heapevents,21354,,https://www.heapevents.info/,false
"-75.70226746,45.41660442",Tue Apr 26 17:02:05 +0000 2022,Ottawa ottnews news,,http://OttawaCitizen.com http://dlvr.it/SPHJvV,0,1518998862400155648,,,,en,"Ottawa, Ontario",false,,1,,,"<a href=""https://dlvrit.com/"" rel=""nofollow"">dlvr.it</a>","https://t.co/hYFjNNzLX4 → COVID-19: What you need to know on Tuesday, April 26 https://t.co/Y5Iz44DlED @OttawaNewsPulse 📰 #Ottawa #ottnews #news",https://twitter.com/OttawaNewsPulse/status/1518998862400155648,Sun Feb 20 22:00:05 +0000 2022,1495518597426393092,false,"#Ottawa city news: society, culture 🎭, business 📊, and politics.",1899,175,787,3,"Ottawa, Ontario",🇨🇦 Ottawa News Pulse,OttawaNewsPulse,10091,,https://twitter.com/OttawaNewsPulse,false
"-111.8349363,41.7101909",Tue Apr 26 11:07:33 +0000 2022,,https://twitter.com/OsoTaxService/status/1518909642989924353/photo/1,http://www.OsoTax.com,0,1518909642989924353,,,,en,"Logan, UT",false,,0,,,"<a href=""https://dlvrit.com/"" rel=""nofollow"">dlvr.it</a>","https://t.co/j63MD2MZVU The pandemic has led to increased working from home for some who formerly commuted to central city offices, and a new study says that could hurt city tax revenues. OSO TAX SERVICE https://t.co/bB6v4yhM5V",https://twitter.com/OsoTaxService/status/1518909642989924353,Thu Jun 11 13:01:05 +0000 2009,46380873,false,"Oso Tax Service
Business and personal taxes  Bookkeeping 
Income Tax Preparation
https://t.co/0hNKzBIN1Q",97,86,327,1,"Utah, USA",Oso Tax Service,OsoTaxService,4873,,http://www.OsoTax.com/mobile,false
"36.821945,-1.292066",Tue Apr 26 16:27:55 +0000 2022,,,https://www.reddit.com/r/Kenya/comments/ucg74c/,0,1518990267260547078,,,,en,"Nairobi, Kenya",true,,0,,,"<a href=""https://twitter.com/hermoand"" rel=""nofollow"">Kenyans On Reddit</a>","✦ [ azimio in us ] ● Ask r/kenya

Best internet company for working from home?

https://t.co/vWOM5k6vlL",https://twitter.com/KenyansOnReddit/status/1518990267260547078,Sun Jun 07 11:55:21 +0000 2020,1269598733878079488,false,"Come join your fellow Kenyans™ on Reddit 👉 https://t.co/jgE8q6ov1E 

- #TopReply
- #rKenyaModLog
- #RemovedByMods
- #DeletedByAuthor
- #rKenyaVideo",796,254,17,3,Nairobi,Kenyans On Reddit 🇰🇪,KenyansOnReddit,45072,,https://reddit.com/r/kenya,false
"134.40665674,-25.07496212",Tue Apr 26 01:43:05 +0000 2022,coronavirus covid19 china beijing testing,https://twitter.com/DailyNews79/status/1518767591224795137/photo/1,http://lasthour.hipeople.biz/SPDzkM,0,1518767591224795137,,,,en,"Ghan, Northern Territory",false,,0,,,"<a href=""https://dlvrit.com/"" rel=""nofollow"">dlvr.it</a>",#coronavirus #covid19 #china #beijing #testing Beijing begins mass-testing residents as COVID-19 outbreak emerges in Chaoyang district - ABC News https://t.co/DRHzwohY4y https://t.co/0vgCjCc01V,https://twitter.com/DailyNews79/status/1518767591224795137,Wed Feb 09 07:43:20 +0000 2022,1491316688549253120,false,"Ours is just a small press release, it's not spam.
Subscribe to our comunity https://t.co/upst403dGf",10,61,537,0,Italy,DailyNews 🇮🇹,DailyNews79,159876,,https://hipeople.biz,false
