coordinates,created_at,hashtags,media,urls,favorite_count,id,in_reply_to_screen_name,in_reply_to_status_id,in_reply_to_user_id,lang,place,possibly_sensitive,quote_id,retweet_count,retweet_id,retweet_screen_name,source,text,tweet_url,user_created_at,user_id,user_default_profile_image,user_description,user_favourites_count,user_followers_count,user_friends_count,user_listed_count,user_location,user_name,user_screen_name,user_statuses_count,user_time_zone,user_urls,user_verified
"130.82094994,-0.42259564",Sun Apr 17 22:47:15 +0000 2022,,,https://visa-online.imigrasi.go.id/ https://www.instagram.com/p/CceC6jbPNaL/?igshid=YTgzYjQ4ZTY=,0,1515824237310877700,,,,en,"Papua Barat, Indonesia",false,,0,,,"<a href=""http://instagram.com"" rel=""nofollow"">Instagram</a>","Indonesia is fully open and quarantine free 🛩🏝🤿🐠🐟🦈Check out the latests updates for entering Indonesia... 
https://t.co/aCXTaV9wno @ RAJA AMPAT - The Last Paradise https://t.co/Yvoqagf9yE",https://twitter.com/CalicoCharters/status/1515824237310877700,Sat Apr 04 03:13:33 +0000 2015,3138383185,false,"Unforgettable Liveaboard Adventures diving,exploring,cruising Raja Ampat, Komodo, Alor, The Maluku, The Banda Sea, The Forgotten Islands & throughout Indonesia.",4,141,177,3,,Calico Jack Charters,CalicoCharters,446,,http://www.calicojackcharters.com,false
"-121.57053318,37.00748198",Sun Apr 17 23:36:33 +0000 2022,,https://twitter.com/1stChiroGilroy/status/1515836643915182083/photo/1,http://dlvr.it/SNlXTR,0,1515836643915182083,,,,en,"Gilroy, CA",false,,0,,,"<a href=""https://dlvrit.com/"" rel=""nofollow"">dlvr.it</a>","Shanghai descends into hellscape as COVID lockdown triggers martial law, arrests and suicides https://t.co/hv4F7bWQ7S https://t.co/UwLUS4PfGR",https://twitter.com/1stChiroGilroy/status/1515836643915182083,Tue Aug 16 22:53:21 +0000 2016,765682887899226112,false,"Dr. Sam @ First Chiropractic in Gilroy, CA! 25+ Years of Back Pain Relief Expertise! Pls Call for Appts: (408) 848-6222 - 7461 Eigleberry St. Gilroy, CA 95020",8,19,42,1,"Gilroy, CA",Sam Nijmeh,1stChiroGilroy,3228,,http://FirstChiropractic.co,false
"103.851,1.3062",Sun Apr 17 09:27:21 +0000 2022,FishBriyani Bajji,,https://www.instagram.com/p/CccnX9fPzmyl-NlatrFNWqUiC3wi6OKvF5ixow0/?igshid=YTgzYjQ4ZTY=,1,1515622936878759942,,,,en,"中区, 新加坡",false,,0,,,"<a href=""http://instagram.com"" rel=""nofollow"">Instagram</a>",Too emotional now 🥲. Had both of these today  after two years &amp; two months. Last had them in Feb 2020 a couple of weeks before the pandemic 😅 #FishBriyani #Bajji @ Tekka Centre https://t.co/189v1eqTGm,https://twitter.com/i_am_s90/status/1515622936878759942,Wed Jun 16 06:53:41 +0000 2010,156184185,false,It’s just the beginning…,2216,360,1572,9,"Johor Bahru, Johor",Thiruselvan 🏴,i_am_s90,25058,,,false
"120.63231,13.83318",Sun Apr 17 15:06:29 +0000 2022,,,https://www.instagram.com/p/CcdOLwtvtgR/?igshid=YTgzYjQ4ZTY=,1,1515708281783611396,,,,en,"Calatagan, Rehiyon ng CALABARZON",false,,0,,,"<a href=""http://instagram.com"" rel=""nofollow"">Instagram</a>",I somehow survived this pandemic. @ Calatagan Batangas - Floating Cottage https://t.co/nvyI8ERi3Q,https://twitter.com/alvindakis/status/1515708281783611396,Thu Jun 17 08:13:54 +0000 2010,156567504,false,"(He/Him) Gender, SOGIE, Diversity & Inclusion Consultant | Sexual Health Nurse | Social Scientist | Certified L&D Professional",9529,2095,850,36,"Manila, Philippines","Alvin Dakis, MHSS, RN, CLDP 🌏",alvindakis,48882,,http://www.ADGenderPh.com,false
"78.85962812,22.67779849",Sun Apr 17 01:36:15 +0000 2022,wfh wfa flyhomes nobroker meesho,https://twitter.com/DailyNews79/status/1515504377733083138/photo/1,http://lasthour.hipeople.biz/SNjX2G,0,1515504377733083138,,,,en,"मध्य प्रदेश, भारत",false,,0,,,"<a href=""https://dlvrit.com/"" rel=""nofollow"">dlvr.it</a>",#wfh #wfa #flyhomes #nobroker #meesho Some companies are embracing work from anywhere and seeing results - Economic Times https://t.co/fleAbGYOBm https://t.co/lMdP4DWkjK,https://twitter.com/DailyNews79/status/1515504377733083138,Wed Feb 09 07:43:20 +0000 2022,1491316688549253120,false,"Ours is just a small press release, it's not spam.
Subscribe to our comunity https://t.co/upst403dGf",10,61,537,0,Italy,DailyNews 🇮🇹,DailyNews79,159876,,https://hipeople.biz,false
"-1.5732939,54.7762794",Sun Apr 17 14:55:02 +0000 2022,,,https://untp.beer/s/c1149390814,0,1515705399772598275,,,,en,"Durham, England",false,,0,,,"<a href=""https://untappd.com"" rel=""nofollow"">Untappd</a>",Drinking a Corona Extra by @GrupoModelo_MX @ The Boathouse — https://t.co/vZgah2cxAF,https://twitter.com/GadgiesNCL/status/1515705399772598275,Sun Jul 01 17:56:00 +0000 2018,1013481359216693248,false,"Two Gadgies in the Newcastle area, spreading love on what’s good on the beer scene. @mattsteanson & @philallen316",366,256,412,0,"Newcastle Upon Tyne, England",Gadgies NCL 🍻,GadgiesNCL,865,,,false
