coordinates,created_at,hashtags,media,urls,favorite_count,id,in_reply_to_screen_name,in_reply_to_status_id,in_reply_to_user_id,lang,place,possibly_sensitive,quote_id,retweet_count,retweet_id,retweet_screen_name,source,text,tweet_url,user_created_at,user_id,user_default_profile_image,user_description,user_favourites_count,user_followers_count,user_friends_count,user_listed_count,user_location,user_name,user_screen_name,user_statuses_count,user_time_zone,user_urls,user_verified
"151.2037022,-33.8637451",Mon May 16 23:51:26 +0000 2022,,,https://www.fxcorp.com.au/blog/2022/5/17/china-macro-data-reveals-impact-of-zero-covid-policy,0,1526349637564698627,,,,en,"Sydney, New South Wales",false,,0,,,"<a href=""http://www.squarespace.com"" rel=""nofollow"">Squarespace</a>",China Macro Data Reveals Impact of Zero-Covid Policy  https://t.co/PV8sTwsP3M,https://twitter.com/FX_Corp/status/1526349637564698627,Mon Mar 31 23:51:56 +0000 2014,2421213462,false,"Currency news from our Currency Strategy Team.....RTs not endorsements, views do not constitute advice",6,60,341,0,"Sydney, New South Wales",FX Corp,FX_Corp,1318,,http://www.fxcorp.com.au,false
"-75.06897268,40.16216216",Mon May 16 14:26:28 +0000 2022,PASen PAGov PAvote votePA,,https://twitter.com/adambonin/status/1526170573520478208,1,1526207457697095680,,,,en,PHILADELPHIA,false,1526170573520478208,0,,,"<a href=""http://www.tweetcaster.com"" rel=""nofollow"">TweetCaster for Android</a>","What happens if you get sick tomorrow morning? Or you test positive for covid in the next 24 hours? Or your car won't start? In PA, you can still vote by emergency absentee ballot and this is how. #PASen #PAGov #PAvote #votePA https://t.co/gZCM58lAyR",https://twitter.com/PhillyPartTwo/status/1526207457697095680,Mon Jan 25 21:49:08 +0000 2010,108416118,false,"Writer, marketer, broadcaster, Philadelphian, Orangeman, liberal.
TV, music, grammar judger.
PHL SYR ALB ICT CHI DC BOS
@apartmentguide @rentdotcom @visitphilly",22746,1016,678,76,PA Congressional District 04,Michael MPH 🇺🇸 ✌🏼,PhillyPartTwo,91156,,https://www.instagram.com/phillyparttwo,false
"-117.6555,33.8446667",Mon May 16 18:04:52 +0000 2022,earthquake,,https://earthquake.usgs.gov/earthquakes/eventpage/ci40020407,2,1526262421609922561,,,,en,"California, USA",false,,1,,,"<a href=""http://everyearthquake.com"" rel=""nofollow"">everyEarthquake</a>","USGS reports a M1.17 earthquake, 9km WSW of Corona, CA on 5/16/22 @ 18:00:39 UTC https://t.co/f1zJIFnjIG #earthquake",https://twitter.com/everyEarthquake/status/1526262421609922561,Thu May 09 05:36:42 +0000 2013,1414684496,false,Tweeting every earthquake occurrence reported by USGS.  Built and maintained by David Barkman aka @cybler.,15,27092,1,410,Earth,Every Earthquake,everyEarthquake,722791,,http://everyearthquake.com,false
"-117.50696576,33.81249245",Mon May 16 20:00:42 +0000 2022,,,https://www.instagram.com/p/Cdoa6A7vuzp/?igshid=YTgzYjQ4ZTY=,0,1526291572299640840,,,,en,"Corona, CA",false,,0,,,"<a href=""http://instagram.com"" rel=""nofollow"">Instagram</a>","@baco2lagos the place to be

Lunch menu 11am-3pm

Happy Hour 2-6pm Mon - Sunday

Brunch 10am-2pm Sat-Sunday

Live DJ Monday - Sunday

Dinner reservations call
+1 951-603-3029
2795 Cabot Dr STE 180, Corona, CA 92883 https://t.co/JolMiREOue",https://twitter.com/MRHURRICANE_NW/status/1526291572299640840,Fri Jan 26 19:48:03 +0000 2018,956977052913037313,false,"951 is the code Riverside is Home & INLAND EMPIRE is the landscape 
NEW WEST ASSOCIATION is the lable, HYPE MAN, MANAGER, PROMOTION & MORE",1414,50,366,0,"Riverside, CA",MR.HURRICANE/NW!!,MRHURRICANE_NW,2097,,https://linktr.ee/Mrhurricane,false
"100.48073931,13.83760249",Mon May 16 04:40:02 +0000 2022,newera fucktheworld,,https://www.instagram.com/p/Cdmxi29v9Sb/?igshid=YTgzYjQ4ZTY=,0,1526059878971842561,,,,en,"บางศรีเมือง, ประเทศไทย",false,,0,,,"<a href=""http://instagram.com"" rel=""nofollow"">Instagram</a>","Extremely excited to fire up again after Fuckin Covid 🔥
I'm ready  to be back and do what I love most. 
DJ Spacemonkey 
#newera 
#fucktheworld @ Austin &amp; Daddy Studio https://t.co/KmU7Raxk77",https://twitter.com/SpacemonkeyDJay/status/1526059878971842561,Fri Mar 18 12:04:07 +0000 2011,268249962,false,Champion Thailand DJ Spin 2002 & 2005 .. DJ & Music Director Consultant for Bacardi ( Thailand ). Resident DJ at Fullmoon Party Tommy Resort ( Koh Phangan )Demo,21,86,228,4,,DJ Spacemonkey,SpacemonkeyDJay,1823,,,false
"-117.566,33.8753",Mon May 16 23:50:53 +0000 2022,,,https://www.instagram.com/p/Cdo1P5lpoE9/?igshid=YTgzYjQ4ZTY=,0,1526349500364775425,,,,en,"Corona, CA",false,,0,,,"<a href=""http://instagram.com"" rel=""nofollow"">Instagram</a>","Just posted a photo @ Corona, California https://t.co/oODz94WBcJ",https://twitter.com/jschugardt/status/1526349500364775425,Tue Jan 18 18:08:27 +0000 2011,239903669,false,"NLP Practitioner, Reiki Master & Life and Success Coach Instagram@jessicaschugardt",413,46,146,4,"California, USA",Jessica Schugardt,jschugardt,514,,http://www.jessicaschugardt.com,false
"-75.6110381,38.6412256",Mon May 16 15:45:50 +0000 2022,,,https://bit.ly/3LkHflo,0,1526227431429787648,,,,en,"Seaford, DE",false,,0,,,"<a href=""https://www.careerarc.com"" rel=""nofollow"">CareerArc 2.0</a>","Lofland Park Center - Genesis He... introduced universal COVID-19 vaccinations for all employees, care partners and onsite vendors because the welfare of our patients, residents, families and employees should always guide our decisions. Join our team! https://t.co/PfKakDoLUT",https://twitter.com/GenesisCareers/status/1526227431429787648,Wed Apr 22 17:55:53 +0000 2009,34343262,false,"Our employees are the vital link between us, our patients and residents! We care deeply! Follow us on Social. #GenesisCareers",36,1405,324,16,Nationwide,Genesis Careers,GenesisCareers,4286,,http://www.genesiscareers.jobs,false
"-84.28492948,33.95835301",Mon May 16 12:10:02 +0000 2022,digitalbanking creditunions digitalfirst,,http://ow.ly/vCtY50J8s7V,0,1526173124374446080,,,,en,"Sandy Springs, GA",false,,0,,,"<a href=""https://www.hootsuite.com"" rel=""nofollow"">Hootsuite Inc.</a>","NCR Digital Banking President Doug Brown told Karen Webster that about 15% of the population, he said, came into the proverbial fold during the pandemic and embraced digital banking — and they haven’t gone away.  #digitalbanking #creditunions #digitalfirst https://t.co/DjtShi7llL",https://twitter.com/jcharanis/status/1526173124374446080,Mon Feb 16 13:42:06 +0000 2009,20985471,false,"I share insights, banking tech, life notes as a salesman, geek, American, runner, backpacker, Phi Sig, UMDTerp, & dad https://t.co/OieCdeI97d",1589,465,385,91,"Atlanta, GA",Jcharanis,jcharanis,6134,,http://charanis.com,false
"-73.9839786,40.7442841",Mon May 16 21:52:18 +0000 2022,BeerMenus,,https://www.beermenus.com/places/4862-tavern29?b_id=512&utm_content=beer-512&utm_medium=serving-share&utm_source=twitter,0,1526319658562895872,,,,en,"Manhattan, NY",false,,0,,,"<a href=""https://www.beermenus.com"" rel=""nofollow"">BeerMenus </a>",Corona bottles now available. https://t.co/okL8ZcJc5y @Grupo_Modelo #BeerMenus,https://twitter.com/Tavern29/status/1526319658562895872,Mon Jul 02 03:33:21 +0000 2012,624323111,false,30 + craft beers | Unique Cocktails | 2 floors + Rooftop Beer Garden | Private Events | Catering | Delivery,1058,1783,4916,70,47 East 29th Street New York,Tavern29,Tavern29,4007,,http://www.tavern29.com,false
"-73.86041,40.85664",Mon May 16 14:55:30 +0000 2022,,,https://www.instagram.com/p/Cdn3-lbunIs/?igshid=YTgzYjQ4ZTY=,1,1526214763964944389,,,,en,"Bronx, NY",false,,0,,,"<a href=""http://instagram.com"" rel=""nofollow"">Instagram</a>",Good morning. There's a vaccine bus outside of Bronx house until 4:30 today. Nyc health and hospitals. They  have Pfizer and boosters @ Bronx House https://t.co/uCgO8jseEw,https://twitter.com/PelhamParkwayBX/status/1526214763964944389,Fri Dec 01 17:21:06 +0000 2017,936646348157399041,false,Pelham Parkway located on the North East of the Bronx. We  are a volunteer group that cares and advocates for our Parkway,411,85,34,0,"Pelham Parkway, Bronx",FRIENDS  PELHAM PARK,PelhamParkwayBX,1374,,https://www.facebook.com/FriendsofPelhamParkway/,false
"-1.15015,52.95344",Mon May 16 14:30:25 +0000 2022,PeregrineFalcons,https://twitter.com/NottsFalconcam/status/1526208455324880896/photo/1,,0,1526208455324880896,,,,en,"Nottingham, England",false,,0,,,"<a href=""http://betterthanlife.co.uk/wp"" rel=""nofollow"">falconcam</a>","Day 13 - 15:30, Detected: Interesting_uncoveredEggs (20°C, scattered clouds, Wind: ModerateBreeze 6.7m/s SSE) - ""I think we are safe from COVID19 up here.  Just..."" -   #PeregrineFalcons https://t.co/a5vd2OB99L",https://twitter.com/NottsFalconcam/status/1526208455324880896,Sat Feb 18 19:19:55 +0000 2012,496246862,false,"#TwitterBot - Playing with #MLnet via public streams to categorise.  Tweets and clips automagically. 🐤🐤
 https://t.co/tjdkK2O0Vq",453,524,40,4,Nottingham,NottsFalconcam,NottsFalconcam,7255,,,false
"121.45919868,25.06619882",Mon May 16 02:45:24 +0000 2022,positive covid_19 ihavecovid19 asiansick nowfeelbetter taiwancovid19 may maysick,,https://www.instagram.com/p/CdmkbVrvexi/?igshid=YTgzYjQ4ZTY=,0,1526031031509438464,,,,en,"新北市, 台灣",false,,0,,,"<a href=""http://instagram.com"" rel=""nofollow"">Instagram</a>",last week #positive #covid_19 #ihavecovid19 #asiansick #nowfeelbetter #taiwancovid19 #may #maysick #20220503 @ Wugong 3rd Rd https://t.co/EGrICJROV1,https://twitter.com/smilehumanbeing/status/1526031031509438464,Sun Aug 25 11:06:04 +0000 2013,1698926035,false,I am from Taiwan🇹🇼 I learn English,2426,992,395,5,Taiwan,Chi-Cheng Huang,smilehumanbeing,1704,,https://www.linkedin.com/in/smilehumanbeing/,false
"-79.7164011,43.7742911",Mon May 16 18:03:03 +0000 2022,Health canada covid health nurses,,http://dlvr.it/SQTVhn,0,1526261962341879808,,,,en,"Brampton, Ontario",false,,1,,,"<a href=""https://dlvrit.com/"" rel=""nofollow"">dlvr.it</a>","Physicians, nurses offer solutions to immediately address health human… https://t.co/pdVzVa3VMf #Health #canada #covid #health #nurses",https://twitter.com/Weeklyvoice/status/1526261962341879808,Tue Mar 30 17:43:21 +0000 2010,127943720,false,Most Trusted News in North America’s South Asian Communities Since 1997,172,495,299,11,Toronto,Weekly Voice,Weeklyvoice,37140,,http://www.Weeklyvoice.com,false
"-74.0590973,40.6045685",Mon May 16 15:47:12 +0000 2022,RufFlOveApprOved RufFlOvers,,https://www.instagram.com/p/Cdn95RKrJaS/?igshid=YTgzYjQ4ZTY=,0,1526227775299936258,,,,en,"Staten Island, NY",false,,0,,,"<a href=""http://instagram.com"" rel=""nofollow"">Instagram</a>",❤️ #RufFlOveApprOved ❤️ I still have Covid🦠🥺😢🤬🤯😮‍💨😷😱😖 🐾 #RufFlOvers 4Ever 🐶❤️ @ RufF lOve dOg traiNIng https://t.co/qqJCkswfNV,https://twitter.com/RufFlOveDogTrNg/status/1526227775299936258,Mon Oct 24 06:21:03 +0000 2011,397076458,false,Unleash your dog's unwanted behaviors and lOve them to a balanced life.,14956,202,216,9,"NYC, USA",Alice Marino,RufFlOveDogTrNg,7596,,http://www.rufflovedogtraining.com,false
"-118.33926558,34.11207992",Mon May 16 15:33:16 +0000 2022,,,https://www.instagram.com/p/Cdn8TScuOFM/?igshid=YTgzYjQ4ZTY=,0,1526224269268504576,,,,en,"Los Angeles, CA",false,,0,,,"<a href=""http://instagram.com"" rel=""nofollow"">Instagram</a>","Pre COVID shoot inside the Hollywood bowl. It was pretty interesting just walking around in there. I had no idea it was part of the park and recs dpt. Go Figure.
.
.
Talent:  @lizmoxen @ Hollywood Bowl https://t.co/dNxNu9EGYv",https://twitter.com/hf_photo_/status/1526224269268504576,Thu Apr 07 00:34:46 +0000 2022,1511864991271436288,false,LA #portraitphotographer retoucher and visual artist,290,9,18,0,"Los Angeles, CA",Henry_finch_photo,hf_photo_,101,,http://henryfinchphoto.com,false
"-77.4605399,38.3031837",Mon May 16 16:18:25 +0000 2022,,,https://bit.ly/3NgLnnV,0,1526235631935815680,,,,en,"Fredericksburg, VA",false,,0,,,"<a href=""https://www.careerarc.com"" rel=""nofollow"">CareerArc 2.0</a>","Woodmont Health Care Center - Ge... introduced universal COVID-19 vaccinations for all employees, care partners and onsite vendors because the welfare of our patients, residents, families and employees should always guide our decisions. Join our team! https://t.co/Vg2Bp2kP4q",https://twitter.com/GenesisCareers/status/1526235631935815680,Wed Apr 22 17:55:53 +0000 2009,34343262,false,"Our employees are the vital link between us, our patients and residents! We care deeply! Follow us on Social. #GenesisCareers",36,1405,324,16,Nationwide,Genesis Careers,GenesisCareers,4286,,http://www.genesiscareers.jobs,false
"-76.7543474,37.3408897",Mon May 16 18:57:40 +0000 2022,elffieselfie gasprices timetogetahooptie,,https://www.instagram.com/p/CdoTsWZvmt4/?igshid=YTgzYjQ4ZTY=,0,1526275710247223297,,,,en,"Virginia, USA",false,,0,,,"<a href=""http://instagram.com"" rel=""nofollow"">Instagram</a>","Where are the stimulus checks to pay for gas??

Can the school just have a 2 week lockdown and keep the kids there, it would be like a great sleepover. 

#elffieselfie #gasprices #timetogetahooptie @ Wawa https://t.co/L1OcTmA03b",https://twitter.com/elffie_lachance/status/1526275710247223297,Fri Jan 04 03:04:10 +0000 2013,1059401143,false,,69,109,89,26,,Elffie LaChance,elffie_lachance,10551,,http://www.elffiewithyounique.com,false
"-73.6197588,45.51950705",Mon May 16 16:42:05 +0000 2022,,https://twitter.com/stigmabase/status/1526241589638508547/photo/1,http://dlvr.it/SQTH11,0,1526241589638508547,,,,en,"Montréal, Québec",false,,0,,,"<a href=""https://dlvrit.com/"" rel=""nofollow"">dlvr.it</a>",TW : Calling time on the use of war metaphors in covid-19: Health organisations are beginning to recognise the resulting social stigma of covid. 9 The stigma of covid may perpetuate... J Gen Intern Med2009;24:1101-8. 10.1007/s11606-009-1068-8↵Social… https://t.co/Yl6A39FW4k https://t.co/OyGDvmKRER,https://twitter.com/stigmabase/status/1526241589638508547,Wed Sep 01 21:06:16 +0000 2010,185789961,false,Dedicated to Education | Keeping up-to-date on global exclusion — Serving the truth — Stigmabase is a canadian internet non-profit Initiative. Founded in 2010,0,963,689,71,Worldwide,STIGMABASE | EDU,stigmabase,820626,,https://www.stigmabase.org/,false
"-122.259,37.87",Mon May 16 14:34:21 +0000 2022,ucberkeley campanile,,https://www.instagram.com/p/Cdn1jzFp4m9/?igshid=YTgzYjQ4ZTY=,1,1526209442617905152,,,,en,"Berkeley, CA",false,,0,,,"<a href=""http://instagram.com"" rel=""nofollow"">Instagram</a>","Circa way before Covid-19. 

This is #ucberkeley our #campanile

💛🐻💙

Congrats to all Grads! May you use your degree to make our country, our world a better place! A place we all keep fighting for…🧧🌟🇺🇸💫🧧 https://t.co/UCcPgp5XYU",https://twitter.com/peilanku/status/1526209442617905152,Wed Mar 21 20:47:32 +0000 2012,532631532,false,Teaching Artist: Dance & Art | Choreographer/Director  | Comedian | Podcaster | Writer,1787,2377,2655,47,,Pei-Lan Ku,peilanku,5558,,https://medium.com/@orchid.ku/pei-lan-ku-75324fcbfe95,false
"-73.841264,40.743055",Mon May 16 21:29:11 +0000 2022,Dawgs 2022grads gradstudents undergrad,,https://www.instagram.com/p/CdolCCuLnEz/?igshid=YTgzYjQ4ZTY=,6,1526313839121289219,,,,en,"Queens, NY",false,,1,,,"<a href=""http://instagram.com"" rel=""nofollow"">Instagram</a>",ICYMI: 👨‍🎓 📸 from todays @paceuniversity  graduation #Dawgs #2022grads #gradstudents #undergrad @ Flushing Meadows-Corona Park https://t.co/QMMhNfP8GY,https://twitter.com/PaceLacrosse/status/1526313839121289219,Wed Aug 07 20:18:54 +0000 2013,1653818041,false,Welcome to the Official Twitter of Pace Lacrosse 2015 ECAC Champions. 2017 NCAA Tournament #PaceLax #PaceAthletics #GoPace Instagram PaceUnivLax,8674,1878,509,17,Pace University,🅿️ace Lacrosse,PaceLacrosse,4843,,https://linktr.ee/paceunivlax,false
"-90.66676,47.65012",Mon May 16 01:33:59 +0000 2022,thisis35 lutsen hikingwhileblack,,https://www.instagram.com/p/CdmcQHysA9sWL9CNZ_s5ptBhT7q6oCFNdad-Oc0/?igshid=YTgzYjQ4ZTY=,1,1526013056353968129,,,,en,"Minnesota, USA",false,,0,,,"<a href=""http://instagram.com"" rel=""nofollow"">Instagram</a>","We had a beautiful time in the dome home. Even though we ended with covid, we hiked 5 miles before it really hit. #thisis35 #lutsen #hikingwhileblack @ Lutsen, Minnesota https://t.co/AQxPqD0Nyq",https://twitter.com/JoyDolo/status/1526013056353968129,Sun Mar 03 14:29:01 +0000 2013,1239045277,false,"I'm an Actor, Improvisor, and teacher in Saint Paul, MN",882,605,519,19,St. Paul,Joy Dolo,JoyDolo,1310,,,false
"-110.9708,32.219",Mon May 16 22:00:11 +0000 2022,,,https://www.instagram.com/p/CdoolFsv45e/?igshid=YTgzYjQ4ZTY=,3,1526321640962985985,,,,en,"Tucson, AZ",true,,0,,,"<a href=""http://instagram.com"" rel=""nofollow"">Instagram</a>","Look! Take advantage of these sites offering FREE Covid 19 testing! @ Tucson, Arizona https://t.co/7mrUhRj0Df",https://twitter.com/mavivalcar/status/1526321640962985985,Thu Sep 27 15:34:37 +0000 2012,849460993,false,Post are my own!,1440,55,364,2,Tucson AZ,Maria Vianey Valdez-Cardenas,mavivalcar,2242,,http://www.unitedheartsaz.org,false
"-122.419,37.7793",Mon May 16 06:47:40 +0000 2022,,,https://www.instagram.com/p/CdnAJzKp-SE/?igshid=YTgzYjQ4ZTY=,1,1526092000017141761,,,,en,"San Francisco, CA",false,,0,,,"<a href=""http://instagram.com"" rel=""nofollow"">Instagram</a>","So yep  that was the 5th show in 8 days on my return to the USA trip done and dusted. Pre-departure covid test tomorrow morning then back home to Aotearoa New Zealand. @ San Francisco, California https://t.co/7DcYAoEvSS",https://twitter.com/craiggunn/status/1526092000017141761,Fri Dec 18 11:07:09 +0000 2009,97642890,false,"I like Punk Rock music, cricket and going places. Singer of @thestungrenades
Sober, Triple-jabbed. 👍",57233,392,800,15,"New Plymouth, New Zealand",Craig Gunn,craiggunn,6176,,https://twitter.com/thestungrenades,false
"16.41560835,48.1739745",Mon May 16 11:45:02 +0000 2022,corona covid19 covid,,https://www.vienna.at/covid-19-als-brandbeschleuniger-fuer-vorerkrankungen/7433041?utm_source=dlvr.it&utm_medium=twitter,0,1526166835292360704,,,,en,"Wien, Österreich",false,,0,,,"<a href=""https://dlvrit.com/"" rel=""nofollow"">dlvr.it</a>",🇦🇹 Covid-19 als https://t.co/WN49UGrXLa #corona #covid19 #covid,https://twitter.com/covid_watch/status/1526166835292360704,Wed Mar 18 16:28:15 +0000 2020,1240313872927653892,false,"Covid-19 Ticker für AT 🇦🇹, operated by @50n1cb00m | Quelle: @echobot | #Covid19at | Disclaimer: Links spiegeln nicht (zwingend) unseren Standpunkt wider.",223,213,143,9,Austria,Covid-19 Ö-Watch,covid_watch,33814,,https://sonicboom.agency/,false
"18.38978071,-33.91531777",Mon May 16 07:26:03 +0000 2022,,,https://www.instagram.com/p/CdnEivrjeZI/?igshid=YTgzYjQ4ZTY=,0,1526101657175478272,,,,en,"Cape Town, South Africa",false,,0,,,"<a href=""http://instagram.com"" rel=""nofollow"">Instagram</a>","Wonderful morning at @expressoshow as part of the panel talking life post pandemic. 

I also got to meet @robinbankslive whom I just adore!!! @ Expresso Show (SABC3) https://t.co/0iH1GCFaxC",https://twitter.com/LuciaDramat/status/1526101657175478272,Wed Jun 17 07:37:20 +0000 2009,47890248,false,"Life Strategist, Radio Presenter, Entrepreneur, Motivational Speaker, Life Coach, Strategise Your OUTSTANDING Life Courses &Workshop.",639,275,370,7,South Africa,Lucia Dramat,LuciaDramat,1362,,http://luciadramat.com,false
"-121.73773,36.48274",Mon May 16 23:11:02 +0000 2022,getboosted ɢᴇᴛᴠᴀᴄᴄɪɴᴀᴛᴇᴅ,,https://www.instagram.com/p/CdowsICpPxi/?igshid=YTgzYjQ4ZTY=,1,1526339471494500355,,,,en,"Carmel Valley Village, CA",false,,1,,,"<a href=""http://instagram.com"" rel=""nofollow"">Instagram</a>","4th Covid Shot - Fully Vaxed and Boosted - ✅  #getboosted #ɢᴇᴛᴠᴀᴄᴄɪɴᴀᴛᴇᴅ @ Carmel Valley, California https://t.co/KulCg4GiTI",https://twitter.com/grapelive/status/1526339471494500355,Thu Aug 20 15:31:41 +0000 2009,67343155,false,"wine professional, wine blogger, soccer fan, former motorsport historian & foodie on the Monterey Bay blogging about wine & travel at https://t.co/4cuglYEMVl",265646,2227,3557,84,"Carmel, CA",Kerry Winslow,grapelive,53005,,http://www.grapelive.com,false
"46.400848,30.985133",Mon May 16 14:24:26 +0000 2022,الريح_المصفر YellowishWind,,,1,1526206946830954496,,,,en,Iraq,,,3,,,"<a href=""http://noonlib.com"" rel=""nofollow"">ملقيات +</a>","owing to Allaah's firm plan of COVID- who is still suffering from the agonies of death, 
Imam Mahdi Nasser Mohammed Al-Yamani
02-Shawwal-1443AH
03-May-2022AD
8
#الريح_المصفر
#YellowishWind
 
jo=lA0",https://twitter.com/6soltansoltan/status/1526206946830954496,Sun Apr 03 19:34:33 +0000 2022,1510702231779266568,false,والذين ءآمنوا أشد حباً لله,1,317,493,0,,Soltan Soltan 6,6soltansoltan,749,,,false
"121.5,31.2",Mon May 16 18:09:14 +0000 2022,shanghailockdown2022 shanghai lockdown,,https://www.instagram.com/p/CdoOJpws_Jp/?igshid=YTgzYjQ4ZTY=,0,1526263521931141127,,,,en,"上海, 中华人民共和国",false,,0,,,"<a href=""http://instagram.com"" rel=""nofollow"">Instagram</a>","First lockdown birthday hopefully also the last #shanghailockdown2022 #shanghai #lockdown @ Shanghai, China https://t.co/f3nypBHz8D",https://twitter.com/wo_ai/status/1526263521931141127,Sun Apr 12 06:06:04 +0000 2009,30612441,false,Brit living in China for over 2 decades,1659,217,220,9,Shanghai,Peter Lee,wo_ai,3351,,,false
"-117.5664384,33.8752935",Mon May 16 16:54:20 +0000 2022,psych psychjobs,,,0,1526244672737116160,,,,en,"Corona, CA",,,0,,,"<a href=""https://www.careerarc.com"" rel=""nofollow"">CareerArc 2.0</a>","Career tip for landing jobs like ""Adult Psychiatry Full Time Opportunity"" in Corona, CA. Go on informational interviews. The best way to get a meeting with a hiring manager is to ask for an informational meeting. #psych #psychjobs",https://twitter.com/tmj_CA_psych/status/1526244672737116160,Mon Mar 28 22:27:37 +0000 2011,273653124,false,Follow this account for geo-targeted Physician-Psychiatry job tweets in California Non-Metro. Need help? Tweet us at @CareerArc!,0,116,55,19,California,California Psych,tmj_CA_psych,417,,http://bit.ly/2KfOfkG,false
"-82.7637127,28.0780718",Mon May 16 21:11:49 +0000 2022,PalmHarbor SocialSciences,,,0,1526309470405394432,,,,en,"Palm Harbor, FL",,,0,,,"<a href=""https://www.careerarc.com"" rel=""nofollow"">CareerArc 2.0</a>","Want to work at Empath Health? We're hiring in #PalmHarbor, FL! Click the link in our bio for details on this job and more: Social Worker - Yellow Team #SocialSciences",https://twitter.com/tmj_usa_socsci/status/1526309470405394432,Thu Nov 26 05:47:30 +0000 2009,92694193,false,Follow this account for geo-targeted Social Sciences job tweets in USA. Need help? Tweet us at @CareerArc!,0,314,70,265,USA,TMJ-USA SocSci Jobs,tmj_usa_socsci,1006,,http://bit.ly/2KdThxS,false
"-87.6050958,41.89186335",Mon May 16 03:29:02 +0000 2022,,,https://bit.ly/3PrPShE,0,1526042011626708992,,,,en,"Chicago, IL",false,,0,,,"<a href=""https://dlvrit.com/"" rel=""nofollow"">dlvr.it</a>",Apple shows how work-from-home is here to stay https://t.co/wdxfJJUEJu,https://twitter.com/jaloola/status/1526042011626708992,Wed Mar 26 16:47:18 +0000 2008,14227402,false,"IT Manager in Chicago, IL at Jaloola Inc.",317,18072,21081,179,"Chicago, IL",Allen Zhu,jaloola,18570,,http://about.me/jaloola,false
"13.1199934,52.381905",Mon May 16 05:51:24 +0000 2022,nowplaying FifthHarmony Perleberg Brandenburg GER,,,1,1526077837681340416,,,,en,"Potsdam, Deutschland",,,0,,,"<a href=""http://www.bbradio.de"" rel=""nofollow"">BB RADIO Music App</a>",#nowplaying #FifthHarmony ~ Fifth Harmony | Work From Home ||| BB RADIO - In #Perleberg #Brandenburg #GER auf 104.3,https://twitter.com/_BB_RADIO_MUSIC/status/1526077837681340416,Tue Jun 29 10:26:00 +0000 2010,160874621,false,BB RADIO is one of the leading radio stations in Berlin and Brandenburg in Germany.,2,2588,1711,177,"Germany, Potsdam",BB RADIO Playlist,_BB_RADIO_MUSIC,996209,,http://www.bbradio.de,false
"16.41560835,48.1739745",Mon May 16 12:18:39 +0000 2022,covid covid19 corona,,https://www.vol.at/covid-19-als-brandbeschleuniger-fuer-vorerkrankungen/7433041?utm_source=dlvr.it&utm_medium=twitter,0,1526175292695277573,,,,en,"Wien, Österreich",false,,0,,,"<a href=""https://dlvrit.com/"" rel=""nofollow"">dlvr.it</a>",🇦🇹 Covid-19 als https://t.co/OAKkVGMcLw #covid #covid19 #corona,https://twitter.com/covid_watch/status/1526175292695277573,Wed Mar 18 16:28:15 +0000 2020,1240313872927653892,false,"Covid-19 Ticker für AT 🇦🇹, operated by @50n1cb00m | Quelle: @echobot | #Covid19at | Disclaimer: Links spiegeln nicht (zwingend) unseren Standpunkt wider.",223,213,143,9,Austria,Covid-19 Ö-Watch,covid_watch,33814,,https://sonicboom.agency/,false
"-2.40340558,54.93181424",Mon May 16 11:13:22 +0000 2022,,https://twitter.com/DailyNews79/status/1526158863900110848/photo/1,http://lasthour.hipeople.biz/SQSFJQ,0,1526158863900110848,,,,en,"North East, England",false,,0,,,"<a href=""https://dlvrit.com/"" rel=""nofollow"">dlvr.it</a>","Rise of acute hepatitis among kids: Find out what is causing it, symptoms to note and all about the role of vaccines - Times of India https://t.co/Ff6NBIqEjl https://t.co/U9HupLiRHR",https://twitter.com/DailyNews79/status/1526158863900110848,Wed Feb 09 07:43:20 +0000 2022,1491316688549253120,false,"Ours is just a small press release, it's not spam.
Subscribe to our comunity https://t.co/upst403dGf",10,61,537,0,Italy,DailyNews 🇮🇹,DailyNews79,159876,,https://hipeople.biz,false
