coordinates,created_at,hashtags,media,urls,favorite_count,id,in_reply_to_screen_name,in_reply_to_status_id,in_reply_to_user_id,lang,place,possibly_sensitive,quote_id,retweet_count,retweet_id,retweet_screen_name,source,text,tweet_url,user_created_at,user_id,user_default_profile_image,user_description,user_favourites_count,user_followers_count,user_friends_count,user_listed_count,user_location,user_name,user_screen_name,user_statuses_count,user_time_zone,user_urls,user_verified
"145.767,-16.9167",Wed Jan 12 01:26:19 +0000 2022,qld batman isolife covid_19,,https://www.instagram.com/p/CYnIztTpfVZRVXd4FPTDzk12RNMmqaJGV_YjG80/?utm_medium=twitter,0,1481075032763817987,,,,en,"Cairns, Queensland",true,,0,,,"<a href=""http://instagram.com"" rel=""nofollow"">Instagram</a>","#qld #batman #isolife #covid_19 @ Cairns, Queensland, Australia https://t.co/m3BgV8ehCj",https://twitter.com/jp0171/status/1481075032763817987,Thu Sep 27 10:41:13 +0000 2012,849045235,false,I follow back :),664,14,67,0,,James Power,jp0171,391,,,false
"-80.3911,27.6418",Wed Jan 12 00:40:18 +0000 2022,cancelled covid,,https://www.instagram.com/p/CYnDimdr7iz/?utm_medium=twitter,2,1481063450638008323,,,,en,"Vero Beach, FL",false,,0,,,"<a href=""http://instagram.com"" rel=""nofollow"">Instagram</a>","Fire pit. Vero. #cancelled #covid @ Vero Beach, Florida https://t.co/Y4oK3wQkTv",https://twitter.com/Hunter_Foster/status/1481063450638008323,Mon Mar 23 17:20:58 +0000 2009,26044398,false,"Director, Actor, writer, activist. Seeker of truth.",1184,11906,3104,101,NYC,Hunter Foster,Hunter_Foster,7804,,http://Hunterfosterofficial.com,true
"144.9661,-37.8156",Wed Jan 12 01:57:17 +0000 2022,covidtimes covid melbourne australia bourkestreet bourkestreetmall tram,,https://www.instagram.com/p/CYnMSkyL2NV/?utm_medium=twitter,0,1481082823834537990,,,,en,"Melbourne, Victoria",false,,0,,,"<a href=""http://instagram.com"" rel=""nofollow"">Instagram</a>","Wandering around the city centre of Melbourne 🏬 quiet little spot🚶‍♂️

A little devoid of activity here on the Bourke Street mall🚊

#covidtimes #covid #melbourne #australia #bourkestreet #bourkestreetmall #tram 🚊💚👍 https://t.co/lIaFbY7GY6",https://twitter.com/aussiebeachut/status/1481082823834537990,Fri Apr 24 03:03:00 +0000 2009,34826366,false,Broadcast Journalist/News Producer - Cairns .. all opinions are mine .. some shared,27540,693,4443,43,"Cairns, Queensland, Australia",Matthew Carden,aussiebeachut,25682,,http://www.youtube.com/user/aussiebeachut0,false
"-121.00976252,37.65112138",Tue Jan 11 23:44:47 +0000 2022,,,https://www.instagram.com/p/CYm9L5Lv04d/?utm_medium=twitter,0,1481049479436554240,,,,en,"Modesto, CA",false,,0,,,"<a href=""http://instagram.com"" rel=""nofollow"">Instagram</a>","N95 on my face, emotional support checkered vans on my feet, @prescoffeetea lavender latte in my hand, Hold the Sun by @maya_hawke in my ears, dreams and goals and manifestations in my soul. happy 2022. 🤍 https://t.co/gPpu3yHL1f",https://twitter.com/waywardandwine/status/1481049479436554240,Sat Dec 24 20:29:38 +0000 2016,812757144768348162,false,"wayward daughter, art maker, fanfic connoisseur, resilient little thing #goodtrouble 🌈c🌈 she/her",132353,1167,546,17,California,olivia #waywardforever,waywardandwine,91880,,https://www.redbubble.com/people/olivialettering,false
"-83.6334245,42.2356384",Wed Jan 12 01:27:52 +0000 2022,,,https://twitter.com/TaraCopp/status/1481045908523470848,0,1481075421001261058,,,,en,"Ypsilanti, MI",false,1481045908523470848,1,,,"<a href=""http://klinkerapps.com"" rel=""nofollow"">Talon Android</a>","""2022, could you define madness for me? ... OK, thanks, I hate it. https://t.co/9ksqMZQ0Lg",https://twitter.com/AaronFown/status/1481075421001261058,Sun Jun 21 17:56:26 +0000 2009,49377911,false,"Author, AgSci/Tech, Mr. Smiley, Videographer, Remote Pilot in Command, Exodiplomat, Wizard. He/Him but you can call me Shirley if you want.",25443,378,992,21,Ypsilanti ,Aaron of Ypsi 🌏🌈🌈🌍,AaronFown,15923,,http://amzn.com/B092VPSQ1V,false
"-80.91835917,44.60228023",Wed Jan 12 03:04:52 +0000 2022,repost,,https://www.instagram.com/p/CYnUFepNUHo/?utm_medium=twitter,0,1481099833146548225,,,,en,"Owen Sound, Ontario",false,,0,,,"<a href=""http://instagram.com"" rel=""nofollow"">Instagram</a>",#repost • @markostland Work from home and now thanks to @osfitness24 I can also work out from home !! Thanks Josh @ Owen Sound Fitness &amp; Training https://t.co/kY2RtCCBSf,https://twitter.com/OSFitness24/status/1481099833146548225,Tue Apr 10 23:33:17 +0000 2012,550613763,false,Memberships from $42/month. Owen Sound’s Best gym voted by YOU 3 Years Running and we are 24/7/365 open to our amazing members!,215,370,585,7,3225 East Bayshore Road. OS.,Owen Sound Fitness,OSFitness24,2387,,http://www.owensoundfitness.ca,false
"-123.12316786,49.3158291",Wed Jan 12 02:12:05 +0000 2022,,,http://dlvr.it/SGyJnj,0,1481086549693325314,,,,en,"North Vancouver, British Columbia",false,,1,,,"<a href=""https://dlvrit.com/"" rel=""nofollow"">dlvr.it</a>","AMGMT — Omicron no different than other COVID-19 strains in exposing inequities in Worcester: Dr. Matilde Castiel, the city's commissioner of health and human services, told the board Monday that Latinos represent 25% of the city's population ...  

… https://t.co/etYshKLF7n",https://twitter.com/StigmabaseE/status/1481086549693325314,Fri Sep 03 15:34:08 +0000 2010,186478529,false,Español - Português | Keeping up-to-date on global exclusion — Stigmabase is a canadian internet non-profit Initiative,0,1969,857,151,Las Américas | España,Stigmabase | ES,StigmabaseE,1037274,,https://www.stigmabase.org/,false
"-73.47935661,45.6677507",Wed Jan 12 02:37:35 +0000 2022,,,http://dlvr.it/SGyLpR,1,1481092969386020866,,,,en,"Varennes, Québec",false,,0,,,"<a href=""https://dlvrit.com/"" rel=""nofollow"">dlvr.it</a>",Fighting Stigma : Colman Noctor: Responding to the fourth wave of anxiety in our young people — Irish Examiner: A common displaced obsessive worry I have witnessed since the pandemic is a fear of vomiting. The child's brain tells them that in order not… https://t.co/PotpqAjVHR,https://twitter.com/StigmabaseN/status/1481092969386020866,Wed Sep 15 15:55:47 +0000 2010,191092262,false,Ireland — Scotland — Inuit —  Svenska  | Keeping up-to-date on global exclusion — Stigmabase is a canadian internet non-profit Initiative,0,1610,1297,111,Ireland | Scotland | Inuit | Skandinavien,Stigmabase | NORDIC,StigmabaseN,952258,,https://www.stigmabase.org/,false
"-111.07427917,45.67070719",Wed Jan 12 01:11:03 +0000 2022,,,http://dlvr.it/SGyCQd,1,1481071189946941440,,,,en,"Bozeman, MT",false,,2,,,"<a href=""https://dlvrit.com/"" rel=""nofollow"">dlvr.it</a>",Health officials eye worrying spike in COVID-19 cases https://t.co/omVnRH5PmI,https://twitter.com/bozchron/status/1481071189946941440,Wed Mar 04 00:33:58 +0000 2009,22707076,false,The official Twitter feed for the Bozeman Daily Chronicle.,92,21691,1279,468,"Bozeman, Montana",Bozeman Daily Chronicle,bozchron,104285,,http://bozemandailychronicle.com/,false
"-121.75584075,36.76845774",Wed Jan 12 00:57:23 +0000 2022,REPOST,,https://www.instagram.com/p/CYnFd68gi-o/?utm_medium=twitter,0,1481067751015915523,,,,en,"Castroville, CA",false,,0,,,"<a href=""http://instagram.com"" rel=""nofollow"">Instagram</a>","A cough has been detected...
#REPOST @ready2stream with @get__repost__app   COVID-19: I’m over it! Stay safe everybody! @ Wherever I May Roam https://t.co/SpOmmcnWEa",https://twitter.com/Lakramdod/status/1481067751015915523,Tue Jun 23 04:47:18 +0000 2009,49887786,false,"Optometric/Ophthalmic Technician
Mostly an all around nice guy...mostly. Fan of all things Lakers, Rams, Dodgers & Avalanche.",228,835,2846,9,"Monterey Bay Area, California",Paul Morales,Lakramdod,3521,,http://www.facebook.com/people/Thomas-Paul-Morales/1512707714,false
"-79.7164011,43.7742911",Wed Jan 12 02:26:02 +0000 2022,Cricket Sports,,http://dlvr.it/SGyKyw,0,1481090062376792064,,,,en,"Brampton, Ontario",false,,1,,,"<a href=""https://dlvrit.com/"" rel=""nofollow"">dlvr.it</a>",COVID UPDATE: Second ODI between West Indies and Ireland postponed https://t.co/UmM3ne6JIi #Cricket #Sports,https://twitter.com/Weeklyvoice/status/1481090062376792064,Tue Mar 30 17:43:21 +0000 2010,127943720,false,Most Trusted News in North America’s South Asian Communities Since 1997,172,494,299,11,Toronto,Weekly Voice,Weeklyvoice,37110,,http://www.Weeklyvoice.com,false
"-0.13608912,51.50413561",Wed Jan 12 04:21:06 +0000 2022,,,http://dlvr.it/SGyW59,0,1481119016588484613,,,,en,"London, England",false,,1,,,"<a href=""https://dlvrit.com/"" rel=""nofollow"">dlvr.it</a>",Covid now killing less Brits than during a bad flu season shows analysis - Euro Weekly News: UK: Historic gay sex convictions to be pardoned · News. Anti-gay laws in the UK resulted in many men receiving convictions for gay sex but now all of ... https://t.co/cRzhobaLmj,https://twitter.com/StigmabaseO/status/1481119016588484613,Thu Apr 29 13:56:48 +0000 2010,138418838,false,Americas — United Kingdom  | Keeping up-to-date on global exclusion — Stigmabase is a canadian internet non-profit Initiative. Founded in 2010,0,4143,3742,262,Americas | United Kingdom,Stigmabase | ORG,StigmabaseO,1828882,,https://www.stigmabase.org/,false
"-77.03678133,38.89459749",Wed Jan 12 03:08:33 +0000 2022,,,https://www.instagram.com/p/CULEbq6p3sa/?utm_medium=twitter,0,1481100759529787394,,,,en,"Washington, DC",false,,0,,,"<a href=""http://instagram.com"" rel=""nofollow"">Instagram</a>",Updates Information About COVID-19 @ USA https://t.co/s3qB6T2MIb,https://twitter.com/AfricanDaddi/status/1481100759529787394,Mon Oct 12 12:30:56 +0000 2020,1315630889104281600,false,Fashion 🏪 USA (African Daddi) Involved In The Sells Of A Variety Of Top Products Ranging From The Latest 👗👕Shoes👟👠 💍👜🕶⌚️.👉Link In 👇👇Bio For Discounts,141,171,1719,0,"Houston, TX",African Daddi🇨🇲🇺🇸,AfricanDaddi,444,,http://www.africandaddi.com,false
"121.01278302,14.55005522",Tue Jan 11 23:20:23 +0000 2022,radicallove letlenilead,,https://www.instagram.com/p/CYm6ZP4B289/?utm_medium=twitter,0,1481043340326055936,,,,en,"Lungsod ng Makati, Pambansang Punong Rehiyon",false,,0,,,"<a href=""http://instagram.com"" rel=""nofollow"">Instagram</a>","669 Days of Quarantine - ON MY YOGA MAT: In the surge of omicron, we should be PINK in health. Be strong! #radicallove #letlenilead @ Avida Towers San Lorenzo https://t.co/nxSkbWPjYX",https://twitter.com/rollyremitar/status/1481043340326055936,Mon Sep 14 05:22:22 +0000 2009,74081290,false,,51,14,39,1,Makati,Rolly Ceniza Remitar,rollyremitar,234,,,false
"-122.470952,37.752043",Wed Jan 12 01:18:40 +0000 2022,,,https://www.instagram.com/modernishfather/p/CYnH7kJlVad/?utm_medium=twitter,0,1481073106793861122,,,,en,"San Francisco, CA",false,,0,,,"<a href=""http://instagram.com"" rel=""nofollow"">Instagram</a>",COVID…still bringing families together. @ Golden Gate Heights https://t.co/BdKzo6lcpl,https://twitter.com/modernishfather/status/1481073106793861122,Fri Jun 06 15:06:11 +0000 2008,15030165,false,"Occasionally snarky Fightin' Texas Aggie living in SF. Tweets are mostly baseball (#SFGiants/#Astros), history, Simpsons refs, and sci-fi, plus lame dad humor.",310,639,697,88,"San Francisco, CA",Nicholas Roznovsky 🇺🇦,modernishfather,56399,,http://about.me/modernishfather,false
"-77.0422,38.899",Tue Jan 11 22:30:24 +0000 2022,,,http://www.dailynews.lk/2022/01/11/features/269888/poverty-pandemic,0,1481030763336413186,,,,en,"Washington, DC",false,,0,,,"<a href=""https://help.twitter.com/en/using-twitter/how-to-tweet#source-labels"" rel=""nofollow"">heapevents.info</a>","Poverty Pandemic ☝ 😐 
 https://t.co/IcmXL0UpOW",https://twitter.com/heapevents/status/1481030763336413186,Sat Jan 09 15:58:46 +0000 2021,1347935690332495877,false,just heap of US events,0,7,25,1,,heapevents.info,heapevents,21302,,https://www.heapevents.info/,false
"-76.614,39.2944",Tue Jan 11 22:01:27 +0000 2022,Tuesday tttt TellTheTruthTuesday TellTheTruth TheTruth Truth Vaccine Unvaccinated Vaccinated Booster Rule Decisions,,https://www.instagram.com/p/CYmxW1Flws1/?utm_medium=twitter,0,1481023477419229191,,,,en,"Baltimore, MD",false,,0,,,"<a href=""http://instagram.com"" rel=""nofollow"">Instagram</a>","🤔😒
#Tuesday #tttt #TellTheTruthTuesday #TellTheTruth #TheTruth #Truth #Vaccine #Unvaccinated #Vaccinated #Booster #Rule #Decisions #2022 @ Baltimore, Maryland https://t.co/YnEh0ipB1L",https://twitter.com/DugarBop/status/1481023477419229191,Thu Sep 01 05:07:12 +0000 2011,365878017,false,Same Shit Different Toilet U Know How It Is,4049,73,117,0,"Bodymore, Murdaland",D. Foote,DugarBop,6980,,,false
"-73.95,40.65",Wed Jan 12 03:28:45 +0000 2022,filibuster,,https://www.instagram.com/p/CYnW0bHsdQn/?utm_medium=twitter,0,1481105845081489414,,,,en,"Brooklyn, NY",false,,0,,,"<a href=""http://instagram.com"" rel=""nofollow"">Instagram</a>","Pre-Covid demonstration to END. THE. #filibuster!!!!💥💥💥🚨🚨🚨🚨💥💥🚨🚨🚨 @ Brooklyn, New York https://t.co/BMEdW7zSMf",https://twitter.com/JanineNichols1/status/1481105845081489414,Wed Feb 22 17:40:50 +0000 2012,499978701,false,"In no order: artist, activist, writer, music maker & producer. Creator of live shows w beloved Hal Willner. OG #SNL Music Coord. OG Prog Dir Arts@StAnns. #BLM",52018,590,1198,12,"Brooklyn, NY",Janine Nichols ✍🏻✂️🎼☮️🇺🇦,JanineNichols1,33535,,http://www.mtopp.org,false
"-120.60404692,35.13477736",Wed Jan 12 02:08:20 +0000 2022,,,https://www.instagram.com/ag_uprising/p/CYnNnUhlA54/?utm_medium=twitter,0,1481085608554602500,,,,en,"Arroyo Grande, CA",false,,0,,,"<a href=""http://instagram.com"" rel=""nofollow"">Instagram</a>","Due to rising COVID numbers in the 5 Cities, our church leadership has asked us to pause our youth meetings for 2 weeks. We hope to see you all back on January 25! @ Hope Church Central Coast https://t.co/RQqGZlxmch",https://twitter.com/AG_Uprising/status/1481085608554602500,Thu Jan 27 19:15:06 +0000 2011,243760832,false,Let's be a movement of God's love instead of people's condemnation. Romans 8:1,162,112,133,3,"Arroyo Grande, CA",Uprising,AG_Uprising,1186,,http://www.hopechurchcentralcoast.com,false
"-76.691881,39.291166",Wed Jan 12 00:20:44 +0000 2022,,,https://twitter.com/AP/status/1481056928231006209,2,1481058526411857922,,,,en,"Baltimore, MD",false,1481056928231006209,0,,,"<a href=""https://onloft.com/tweetlogix"" rel=""nofollow"">Tweetlogix</a>",Come to any Giant in Baltimore. https://t.co/n9EE6RT10b,https://twitter.com/thisisdking/status/1481058526411857922,Tue Apr 14 11:09:24 +0000 2009,31099398,false,"IG:@thisdking85

Regional Truck Driver. Sports Gambler. Big Titty Lover. Henny Drinker. I Also Have A Reese Cup Addiction.",488,745,695,11,West Baltimore ,My DM’S Broke,thisisdking,104609,,,false
"-79.3872,43.648",Tue Jan 11 23:22:11 +0000 2022,aowtv aceofwandsband indiemusic dreamrock lockdown,,https://www.instagram.com/p/CYm6mZhvM0x/?utm_medium=twitter,0,1481043792006455296,,,,en,"Toronto, Ontario",false,,0,,,"<a href=""http://instagram.com"" rel=""nofollow"">Instagram</a>","Tomorrow night we have a brand new episode of AOWtv - join us as we explore doorways of all kinds. #aowtv #aceofwandsband #indiemusic #dreamrock #lockdown @ Toronto, Ontario https://t.co/ySV9adSW0L",https://twitter.com/jodeyeknight/status/1481043792006455296,Sun Oct 28 05:46:32 +0000 2012,909599232,false,,619,170,401,7,,Jody Brumell,jodeyeknight,1727,,,false
"-0.13608912,51.50413561",Wed Jan 12 01:21:36 +0000 2022,,,http://dlvr.it/SGyDQ5,0,1481073845465280512,,,,en,"London, England",false,,1,,,"<a href=""https://dlvrit.com/"" rel=""nofollow"">dlvr.it</a>","Brigitte Macron 'received phone call saying her husband was with a gay lover', documentary ...: U.K. · Latest headlines The Queen Royals Prince Andrew Prince Harry Meghan Markle World News Covid-19 Most read · News · Latest Headlines Covid-19 Joe ... https://t.co/rlUAjVJrtD",https://twitter.com/StigmabaseO/status/1481073845465280512,Thu Apr 29 13:56:48 +0000 2010,138418838,false,Americas — United Kingdom  | Keeping up-to-date on global exclusion — Stigmabase is a canadian internet non-profit Initiative. Founded in 2010,0,4143,3742,262,Americas | United Kingdom,Stigmabase | ORG,StigmabaseO,1828882,,https://www.stigmabase.org/,false
"13.1199934,52.381905",Wed Jan 12 04:21:56 +0000 2022,nowplaying FifthHarmony Oberbayern Schwaben DAB,,,0,1481119228321280004,,,,en,"Potsdam, Deutschland",,,0,,,"<a href=""http://www.radioteddy.de"" rel=""nofollow"">Radio Teddy Music App</a>",#nowplaying #FifthHarmony ~ Fifth Harmony | Work From Home ||| Radio TEDDY - In #Oberbayern #Schwaben #DAB auf Kanal 10A,https://twitter.com/RadioTeddyMusic/status/1481119228321280004,Wed Jun 30 11:49:58 +0000 2010,161262801,false,Das Kinderradio für die ganze Familie. Macht Spaß! Macht schlau!,0,1073,145,114,"Potsdam, Germany, Europe",Radio TEDDY Playlist,RadioTeddyMusic,1053143,,http://www.radioteddy.de,false
"-73.56725453,45.75975883",Tue Jan 11 22:40:06 +0000 2022,,,http://dlvr.it/SGxvwD,0,1481033203410374658,,,,en,"Mascouche, Québec",false,,0,,,"<a href=""https://dlvrit.com/"" rel=""nofollow"">dlvr.it</a>",Fighting Stigma: Reaching out to communities hesitant about vaccines — Irish Examiner: One in three unvaccinated patients in ICU had no underlying health condition compared to almost everyone (97%) of the vaccinated population. Average ... https://t.co/XMdqYlA9gl,https://twitter.com/StigmabaseN/status/1481033203410374658,Wed Sep 15 15:55:47 +0000 2010,191092262,false,Ireland — Scotland — Inuit —  Svenska  | Keeping up-to-date on global exclusion — Stigmabase is a canadian internet non-profit Initiative,0,1610,1297,111,Ireland | Scotland | Inuit | Skandinavien,Stigmabase | NORDIC,StigmabaseN,952258,,https://www.stigmabase.org/,false
"-0.13608912,51.50413561",Wed Jan 12 04:21:08 +0000 2022,,,http://dlvr.it/SGyW7B,0,1481119027678388225,,,,en,"London, England",false,,0,,,"<a href=""https://dlvrit.com/"" rel=""nofollow"">dlvr.it</a>",Hundreds of pandemic fines issued in same week of Downing Street party: Anti-gay laws in the UK resulted in many men receiving convictions for gay sex but now all of that is about to change with... Spain finalising a ... https://t.co/iX9XCV63ow,https://twitter.com/StigmabaseO/status/1481119027678388225,Thu Apr 29 13:56:48 +0000 2010,138418838,false,Americas — United Kingdom  | Keeping up-to-date on global exclusion — Stigmabase is a canadian internet non-profit Initiative. Founded in 2010,0,4143,3742,262,Americas | United Kingdom,Stigmabase | ORG,StigmabaseO,1828882,,https://www.stigmabase.org/,false
"-121.4764,38.572463",Tue Jan 11 22:35:24 +0000 2022,,,https://www.instagram.com/p/CYm1P2yPFWp/?utm_medium=twitter,0,1481032020969115659,,,,en,"Sacramento, CA",false,,0,,,"<a href=""http://instagram.com"" rel=""nofollow"">Instagram</a>","FUKC! BEYOND GUTTED- it’s starting again, FML and the pandemic… gigs needed for soul maintenance - it’s required… FUKC! @ Midtown https://t.co/gnBpnOtg2O",https://twitter.com/phlthy01/status/1481032020969115659,Thu Apr 02 00:54:19 +0000 2009,28242024,false,“Heathen. Bartender. Glorious Bastard. Music Nerd. Accidental Protagonist. Damn Fool. Enfant Terrible. Phlthy01...”,1272,115,420,3,"Sacramento, CA",phillip.montes.jr.,phlthy01,8383,,,false
"-73.6197588,45.51950705",Tue Jan 11 22:01:33 +0000 2022,,https://twitter.com/stigmabase/status/1481023501205381121/photo/1,http://dlvr.it/SGxqKK,0,1481023501205381121,,,,en,"Montréal, Québec",false,,0,,,"<a href=""https://dlvrit.com/"" rel=""nofollow"">dlvr.it</a>",TW : Outlook of 2022 for the healthcare sector: ...around mental health. People are more open to holding conversations around it and social stigma is reduced.The overwhelming patient footfall at hospitals took a toll on healthcare workers. They… https://t.co/bMYQFEBn9W https://t.co/o5bgsIL0Rw,https://twitter.com/stigmabase/status/1481023501205381121,Wed Sep 01 21:06:16 +0000 2010,185789961,false,Dedicated to Education | Keeping up-to-date on global exclusion — Serving the truth — Stigmabase is a canadian internet non-profit Initiative. Founded in 2010,0,963,689,71,Worldwide,STIGMABASE | EDU,stigmabase,820501,,https://www.stigmabase.org/,false
"-73.98366822,40.76081647",Wed Jan 12 03:47:59 +0000 2022,onthesubway subwaysistas nyc subwaysisters goodevening newyorkcity beforecorona wearamask brooklyn broadway newyorkcitylife subwaycreatures winterinthecity,,https://www.instagram.com/leighruddy/p/CYnZBOQLTsP/?utm_medium=twitter,2,1481110683152388097,,,,en,"Manhattan, NY",false,,0,,,"<a href=""http://instagram.com"" rel=""nofollow"">Instagram</a>",#onthesubway #subwaysistas #nyc #subwaysisters #goodevening #newyorkcity #beforecorona #wearamask #brooklyn #broadway #newyorkcitylife #subwaycreatures #winterinthecity @ New York City https://t.co/Wz3s7eVz8m,https://twitter.com/LeighRuddy/status/1481110683152388097,Thu Apr 19 23:53:39 +0000 2012,558163732,false,Marywood University Alumna 👩‍🎓. Coldplay Lover,105163,580,1205,7,"Scranton, PA",Leigh Ruddy 🌙☀️👽,LeighRuddy,17536,,,false
"-122.675,45.5236111",Wed Jan 12 03:30:33 +0000 2022,,https://twitter.com/BlogThisLink/status/1481106296715689984/photo/1,https://bit.ly/3GpFe5V,0,1481106296715689984,,,,en,"Portland, OR",false,,0,,,"<a href=""https://dlvrit.com/"" rel=""nofollow"">dlvr.it</a>",Covid Patients Being Transferred to “Quarantine Camps” in Australia; 3 Teens Escape https://t.co/ZStPxufUuN https://t.co/katADcLgDD,https://twitter.com/BlogThisLink/status/1481106296715689984,Sun May 23 18:29:41 +0000 2010,147285889,false,"#Movies, #Videos, #TVShows, #News, #Gossip, #Entertainment, #Games, #Crime, #Music,",465,2168,1669,25,,BlogThisLink.com,BlogThisLink,701,,http://www.BlogThisLink.com,false
"151.1990999,-33.9061",Wed Jan 12 01:49:50 +0000 2022,,,https://www.instagram.com/p/CYnLfySvsXc/?utm_medium=twitter,0,1481080952537464833,,,,en,"Sydney, New South Wales",false,,0,,,"<a href=""http://instagram.com"" rel=""nofollow"">Instagram</a>","More pieces from my wardrobe.
Covid kilos have won....
Well, on the skirt at least.
My Sweetie top I've had for 25+ years...
I'm a bit old for it now ha ha 😂
The floaty ""kimono"" has travelled the world.
.
. https://t.co/N7S3mGephg",https://twitter.com/recycologyy/status/1481080952537464833,Mon Feb 14 03:23:56 +0000 2011,251921371,false,"Recycology Vintage shop at 17 Bourke Rd, Alexandria Open 7 days 10-6 with Vintage, retro & modern fashion. Weekday markets in Sydney, Vintage Fairs NSW and VIC.",18,263,32,45,"17 Bourke RdAlexandria, Sydney",Recycology,recycologyy,11690,,http://www.etsy.com/shop/recycology,false
"-0.99609,53.21285",Wed Jan 12 00:44:37 +0000 2022,,,https://www.instagram.com/p/CYnECPqr6WC/?utm_medium=twitter,0,1481064539215077383,,,,en,"Ollerton, England",false,,0,,,"<a href=""http://instagram.com"" rel=""nofollow"">Instagram</a>","OOh what a beautiful
Life
I am grateful for my
Family, friends, clients

Everyone in my life
I am grateful  for you @ Working From Home https://t.co/TeUACVldrE",https://twitter.com/chobbs424/status/1481064539215077383,Sat Oct 25 20:02:04 +0000 2014,2877247718,false,"I like to travel,Mindset ,Family Time, Coach on Marketing Strategy's, #homebusiness, Use Social Media for free leads, Lead gen, Sales  https://t.co/9jQ1vcotTL",1275,1850,1787,185,Washington,Christie Hobbs,chobbs424,12440,,http://bit.ly/2JUzx29,false
"-86.8282089,20.9888401",Tue Jan 11 23:56:08 +0000 2022,,,https://untp.beer/s/c1119671568,0,1481052338882293760,,,,en,"Benito Juárez, Quintana Roo",false,,0,,,"<a href=""https://untappd.com"" rel=""nofollow"">Untappd</a>",Drinking a Corona Extra by @GrupoModelo_MX at @palaceresorts — https://t.co/FGbFkkQ3Pc,https://twitter.com/hops_traveler/status/1481052338882293760,Sun Oct 08 17:22:24 +0000 2017,917077731736739841,false,Travel the world and drink beer. This is what I do and stories from the road This is my pilgrimage of the hops,352,557,523,2,"Longmont, CO",Hops Traveler,hops_traveler,2775,,http://hopstraveler.blog,false
"-73.98227,40.7500799",Tue Jan 11 21:52:37 +0000 2022,fineandrarenyc happy2022 Livemusic newyorkmusic edwinvazquezmúsica,,https://www.instagram.com/p/CYmwWVApa4-/?utm_medium=twitter,0,1481021252655624195,,,,en,"Manhattan, NY",false,,0,,,"<a href=""http://instagram.com"" rel=""nofollow"">Instagram</a>","@edwinvazquezmusica LIVE @fineandrarenyc FRIDAY 1/14/2022 5:30-8:30PM
🎶
WITH @suzyviolin 🎻
Chito Rosario percussion
All Covid mandates required

#fineandrarenyc #happy2022💥 #Livemusic #newyorkmusic #edwinvazquezmúsica https://t.co/Wsa5uDHEHi",https://twitter.com/EdwinVazquezmus/status/1481021252655624195,Thu Nov 26 20:55:57 +0000 2009,92833741,false,"Edwin is a singer, composer, songwriter, guitarist, Artist, Vocal Mouth brass percussionist and Actor. Faith CD on iTunes & coming soon new album Spanglish.",273,1074,1296,15,New York,Edwin Vazquez,EdwinVazquezmus,7951,,http://www.edwinvazquez.com,false
"-82.5617,35.59493",Wed Jan 12 03:06:24 +0000 2022,,,https://www.instagram.com/p/CYnUQrwrnpH/?utm_medium=twitter,0,1481100219362287616,,,,en,"Asheville, NC",false,,0,,,"<a href=""http://instagram.com"" rel=""nofollow"">Instagram</a>","Slinging your drinks every Tuesday night @ohenrysasheville | 9pm-2am
🔥$6 any liquor | $3 wine by the glass🔥
💃$2 Highland Cold Mtn. | Bell's Porter | Corona Light💃 @ OHenrys Asheville https://t.co/1XnZrTDVJH",https://twitter.com/DJRexxStep/status/1481100219362287616,Wed Jan 22 17:33:22 +0000 2020,1220036699385946114,false,"Resident DJ:
Scandals Nightclub | Banks Ave. | Pack's  Tavern-Asheville, NC      
Timberfell Lodge-Baileyton, TN
Tribal, Vocal & Tech House, Bass & Breaks",9,26,20,0,"Asheville, NC",RexxStep,DJRexxStep,53,,http://Facebook.com/mixedtraxx,false
