coordinates,created_at,hashtags,media,urls,favorite_count,id,in_reply_to_screen_name,in_reply_to_status_id,in_reply_to_user_id,lang,place,possibly_sensitive,quote_id,retweet_count,retweet_id,retweet_screen_name,source,text,tweet_url,user_created_at,user_id,user_default_profile_image,user_description,user_favourites_count,user_followers_count,user_friends_count,user_listed_count,user_location,user_name,user_screen_name,user_statuses_count,user_time_zone,user_urls,user_verified
"-79.59362715,-2.12880849",Thu Jan 06 02:40:57 +0000 2022,Covid19,,https://www.instagram.com/p/CYX0lENMS4E/?utm_medium=twitter,0,1478919487235760128,,,,en,"Milagro, Ecuador",false,,0,,,"<a href=""http://instagram.com"" rel=""nofollow"">Instagram</a>",#Covid19 en Milagrocity https://t.co/57o7fNz6jL,https://twitter.com/mrangel1979/status/1478919487235760128,Fri Sep 16 15:47:16 +0000 2016,776809685429149696,false,Gerente de Serconavi S.A. empresa dedicada al Diseño y construcción de todo tipo de embarcaciones. Soy Geek y un  Coleccionista y lector de Comics...,108,221,467,6,Ecuador,Marlon Rangel G.,mrangel1979,9730,,https://www.facebook.com/serconavi/,false
"-122.3958528,37.7929728",Thu Jan 06 02:31:18 +0000 2022,,,http://dlvr.it/SGcJ2G,0,1478917057550848001,,,,en,"San Francisco, CA",false,,0,,,"<a href=""https://dlvrit.com/"" rel=""nofollow"">dlvr.it</a>",San Francisco:: ‘Running On Skeleton Staff’ – Bay Area Small Businesses Struggle To Stay Open During COVID-19 Omicron Surge https://t.co/8Ca29Xph0e,https://twitter.com/SHH_SMS/status/1478917057550848001,Mon Feb 20 21:11:02 +0000 2017,833786060836442115,false,"Helping individuals and small businesses find success online since 2009. Photographer, Videography, Web Design and Hosting Social Media Strategy",11,306,259,2,"San Francisco , US, 94110",SHH Social Media Services,SHH_SMS,33999,,http://www.shhsms.com,false
"-72.69125827,41.75184652",Wed Jan 05 23:08:13 +0000 2022,,,http://www.wrtcfm.com https://www.instagram.com/djblayne/p/CYXcO0lhazT/?utm_medium=twitter,0,1478865949730213894,,,,en,"Hartford, CT",false,,0,,,"<a href=""http://instagram.com"" rel=""nofollow"">Instagram</a>","If Covid shuts down your party this Saturday, I’ve got your fix right here starting at 8pm EST, 1am GMT at https://t.co/z3xV6P6mIY. @ WRTC 89.3 FM Radio https://t.co/ZjOTHO6FKo",https://twitter.com/Blayneashmore/status/1478865949730213894,Sun Apr 21 09:39:21 +0000 2013,1369133784,false,"DJ Blayne is a mobile Soulful House Music DJ/Producer with 13 years of live performance, FM broadcast and internet radio experience",40,255,150,1,"Meriden, CT","Feeling It!!! Entertainment, LLC",Blayneashmore,3446,,http://www.djblayne.com,false
"-79.32344,43.671707",Wed Jan 05 22:38:30 +0000 2022,Covid,,https://www.swarmapp.com/c/6ww0kmSVY1U,0,1478858471835639810,,,,en,"Toronto, Ontario",false,,0,,,"<a href=""http://foursquare.com"" rel=""nofollow"">Foursquare</a>","3rd #Covid shot 🤯 (@ Care Plus Medical Centre in Toronto, Ontario) https://t.co/3JPbRlF4b0",https://twitter.com/Oasisantonio/status/1478858471835639810,Sat Jan 03 23:46:32 +0000 2009,18590112,false,"MCP | MCT | MCTS | Casual photographer | I’m real, and I hope some of my followers are too | 50% idk, 50% idc. | ig: Oasisantonio  🇲🇽~🇨🇦",30849,2683,872,208,"Toronto, Ontario",Oasisantonio,Oasisantonio,216055,,https://linktr.ee/Oasisantonio,false
"-122.3958528,37.7929728",Wed Jan 05 23:31:12 +0000 2022,,,http://dlvr.it/SGc0Bh,0,1478871737106272258,,,,en,"San Francisco, CA",false,,0,,,"<a href=""https://dlvrit.com/"" rel=""nofollow"">dlvr.it</a>",San Francisco:: COVID Surge: Nonprofit Reports Outbreaks at 2 San Francisco Homeless Shelters https://t.co/mULijVod95,https://twitter.com/SHH_SMS/status/1478871737106272258,Mon Feb 20 21:11:02 +0000 2017,833786060836442115,false,"Helping individuals and small businesses find success online since 2009. Photographer, Videography, Web Design and Hosting Social Media Strategy",11,306,259,2,"San Francisco , US, 94110",SHH Social Media Services,SHH_SMS,33999,,http://www.shhsms.com,false
"-118.2445,34.0564",Wed Jan 05 22:49:35 +0000 2022,lgbt lgbtq transgender,,https://www.instagram.com/p/CYXaGUWPxRp/?utm_medium=twitter,0,1478861264327778304,,,,en,"Los Angeles, CA",false,,0,,,"<a href=""http://instagram.com"" rel=""nofollow"">Instagram</a>","8 days with Covid omicron, not looking like this right now 😂. #lgbt #lgbtq #transgender @ Los Angeles, California https://t.co/shCs3G92yW",https://twitter.com/DemonacoPaula/status/1478861264327778304,Wed Jul 01 22:34:23 +0000 2009,52875299,false,Model/actress performer.,43,56,114,0,Los Angeles,Paula DeMonaco,DemonacoPaula,200,,http://www.facebook.com/victoria.demonaco,false
"-76.347406,39.550223",Wed Jan 05 22:22:59 +0000 2022,,,,0,1478854567198707713,,,,en,"Bel Air, MD",,,0,,,"<a href=""https://onloft.com/tweetlogix"" rel=""nofollow"">Tweetlogix</a>",👈🏾 RT @HealWithKasey: Has anyone on Twitter somehow managed to not catch Covid yet????,https://twitter.com/HimOverThere90/status/1478854567198707713,Sat Aug 14 22:50:00 +0000 2010,178493621,false,,4234,2888,853,140,D(M)V,c.a.m.,HimOverThere90,123252,,,false
"-117.6426,33.88427",Wed Jan 05 23:20:44 +0000 2022,Corona LAtraffic,,http://bit.ly/10F395r,0,1478869101946810368,,,,en,"California, USA",false,,0,,,"<a href=""http://www.sigalert.com/Map.asp?region=Greater+Los+Angeles"" rel=""nofollow"">TTN LA traffic</a>","!! sigalert !! crash - eastbound 91 connector blocked. in #Corona on CA-71 SB at CA-91, stopped traffic back to CA-83/Butterfield Ranch Rd #LAtraffic https://t.co/e2e6MWkOvI",https://twitter.com/TotalTrafficLA/status/1478869101946810368,Wed Aug 12 21:43:18 +0000 2009,65171105,false,Providing you #LIVE #traffic updates for your #SoCal drive! Got a tip? Dial #250 and use the keyword “So Cal Traffic”,301,18778,610,688,Southern California,Total Traffic LA,TotalTrafficLA,294251,,https://www.ttwnetwork.com/,false
"-95.69323547,29.10192054",Thu Jan 06 00:26:03 +0000 2022,claritychangeseverything visionframing,,https://www.instagram.com/p/CYXlHJaMbms/?utm_medium=twitter,1,1478885536899248130,,,,en,"Texas, USA",false,,0,,,"<a href=""http://instagram.com"" rel=""nofollow"">Instagram</a>",And we’re off!  Started our Vision Framing in person and online (thanks COVID) at New Shores today.  This is going to fun!! #claritychangeseverything #visionframing @auxanoconsulting @ New Shores Church https://t.co/z6Eee4g2Pj,https://twitter.com/kvincent66/status/1478885536899248130,Wed May 07 14:29:40 +0000 2014,2482217274,false,"Christ Follower, Husband, Dad and Senior Lead Navigator/@AUXANO",540,132,74,1,"Nashville, TN",kent vincent,kvincent66,763,,http://www.AUXANO.com,false
"-117.5215,33.88469",Thu Jan 06 02:00:43 +0000 2022,Corona LAtraffic,,http://bit.ly/10F395r,0,1478909361934286850,,,,en,"Corona, CA",false,,0,,,"<a href=""http://www.sigalert.com/Map.asp?region=Greater+Los+Angeles"" rel=""nofollow"">TTN LA traffic</a>",Crash - middle lanes. in #Corona on 91 (SR-91 Riverside Fwy) EB at Mckinley St #LAtraffic https://t.co/e2e6MWkOvI,https://twitter.com/TotalTrafficLA/status/1478909361934286850,Wed Aug 12 21:43:18 +0000 2009,65171105,false,Providing you #LIVE #traffic updates for your #SoCal drive! Got a tip? Dial #250 and use the keyword “So Cal Traffic”,301,18778,610,688,Southern California,Total Traffic LA,TotalTrafficLA,294251,,https://www.ttwnetwork.com/,false
"-73.7323,40.73182",Wed Jan 05 21:59:12 +0000 2022,,,https://www.instagram.com/ps18pta/p/CYXUVcivj6g/?utm_medium=twitter,1,1478848582576787457,,,,en,"Queens, NY",false,,0,,,"<a href=""http://instagram.com"" rel=""nofollow"">Instagram</a>","⛔️ Letter if your child is EXPOSED to COVID ⛔️ 
 
🔹Test on the day you receive the test kit 
🔹Take the second test on the FIFTH day after exposure. 

🟡FOLLOW ALL INSTRUCTIONS FROM THIS LETTER 🟡 @ Public School 18 https://t.co/Nnq73x2pOV",https://twitter.com/PS18_PTA/status/1478848582576787457,Wed Nov 18 21:34:13 +0000 2020,1329176062077579270,false,,37,22,32,0,,PS 18 PTA,PS18_PTA,147,,,false
"-76.97193263,38.92373644",Thu Jan 06 00:20:05 +0000 2022,,,https://twitter.com/jbarro/status/1478869315017392134,4,1478884036353347586,,,,en,"Washington, DC",false,1478869315017392134,0,,,"<a href=""http://tapbots.com/tweetbot"" rel=""nofollow"">Tweetbot for iΟS</a>","My future MIL works at a UPS warehouse. She’s higher risk due to age. When everyone was Zooming from home &amp; ordering essentials online so they didn’t have to go to the store? Those packages got there only bc people like her never stopped going to work. 

Teachers can go to work. https://t.co/fZcURFcCGc",https://twitter.com/Alexa_MRo/status/1478884036353347586,Sun Mar 21 18:40:57 +0000 2010,125111405,false,"Lawyer. Eppur si muove. Views are my own, not my employer's.",6256,551,3875,7,"Washington, DC",Alexandra R.,Alexa_MRo,17423,,,false
"-79.7164011,43.7742911",Wed Jan 05 21:39:34 +0000 2022,Football Sports,,http://dlvr.it/SGblsm,0,1478843640600350720,,,,en,"Brampton, Ontario",false,,1,,,"<a href=""https://dlvrit.com/"" rel=""nofollow"">dlvr.it</a>",Italian Serie A to resume despite Covid surge https://t.co/bGnBUWpcVY #Football #Sports,https://twitter.com/Weeklyvoice/status/1478843640600350720,Tue Mar 30 17:43:21 +0000 2010,127943720,false,Most Trusted News in North America’s South Asian Communities Since 1997,172,494,299,11,Toronto,Weekly Voice,Weeklyvoice,37110,,http://www.Weeklyvoice.com,false
"-79.3872,43.648",Thu Jan 06 03:17:32 +0000 2022,whimsicalart watercolor painting illustration art,,https://www.instagram.com/p/CYX4xCLttUH/?utm_medium=twitter,1,1478928694219444224,,,,en,"Toronto, Ontario",false,,0,,,"<a href=""http://instagram.com"" rel=""nofollow"">Instagram</a>","-a royal procession-
-an outing-
Somewhat in spirit with the past two years’ serial arrival of new Corona family members?🤔
#whimsicalart #watercolor #painting #illustration #art @ Toronto, Ontario https://t.co/Djk6PhBzlK",https://twitter.com/rose_tingyi/status/1478928694219444224,Wed Jan 27 22:33:07 +0000 2010,109078602,false,"artist, illustrator, doodler; Ravenclaw, museum lover, classical music addict; sinologist, art historian, grad student UofT | Instagram: rose.tingyiliu",118,88,72,5,Toronto,Rose Liu,rose_tingyi,740,,http://rosemakesart.wixsite.com/rose,false
"-122.31149,37.91562",Thu Jan 06 01:21:37 +0000 2022,,,https://www.instagram.com/p/CYXrf6EJetF/?utm_medium=twitter,0,1478899522600419336,,,,en,"Richmond, CA",false,,0,,,"<a href=""http://instagram.com"" rel=""nofollow"">Instagram</a>",With the recent COVID surge I felt like reposting this gem from March of 2020. @ El Cerrito https://t.co/Bk17BnxY4g,https://twitter.com/quietkaos/status/1478899522600419336,Fri Jul 27 04:37:32 +0000 2007,7753152,false,Panda doesn't like strangers.,23,141,279,6,"iPhone: 41.935436,-87.701286",quietkaos,quietkaos,4988,,,false
"-84.3889,33.7566",Thu Jan 06 03:39:24 +0000 2022,,,https://www.instagram.com/p/CYX7RAMAMbX/?utm_medium=twitter,0,1478934195523121153,,,,en,"Atlanta, GA",false,,0,,,"<a href=""http://instagram.com"" rel=""nofollow"">Instagram</a>","At least wear a mask.... @ Atlanta, Georgia https://t.co/9Ka3mCWSdv",https://twitter.com/Purpose_Builder/status/1478934195523121153,Tue May 17 18:43:39 +0000 2011,300418572,false,"Pastor Willie Mays is a dynamic, cutting edge preacher with a word that heals, delivers, and makes free. Pastors one of the fastest growing churches in area.",8443,1012,1661,31,"Douglasville, GA",Willie Mays,Purpose_Builder,6260,,http://www.nolimitscc.org,false
"77.1778564,28.6712303",Wed Jan 05 23:38:39 +0000 2022,workfromhome lovemywork passion videoediting imac workmode fun desksetup,,https://www.instagram.com/p/CYXftyMhfDU/?utm_medium=twitter,0,1478873612144812032,,,,en,"नई दिल्ली, भारत",false,,0,,,"<a href=""http://instagram.com"" rel=""nofollow"">Instagram</a>","As long as I have my computer and coffee, I can work from anywhere.

#workfromhome #lovemywork #passion #videoediting #imac #workmode #fun #desksetup #2022 @ East Delhi, Delhi, India https://t.co/PGFO3svbdn",https://twitter.com/ErKamran/status/1478873612144812032,Wed Oct 31 10:42:12 +0000 2012,916614626,false,"Sound Engineer, Actor, Model, Artist",27,42,69,0,Delhi,Er Kamran Khan,ErKamran,322,,,false
"-98.64897,29.40138",Wed Jan 05 23:37:06 +0000 2022,,,https://www.instagram.com/p/CYXfiiIMgdw/?utm_medium=twitter,0,1478873219436326916,,,,en,"San Antonio, TX",false,,0,,,"<a href=""http://instagram.com"" rel=""nofollow"">Instagram</a>","Free covid Testing no appointment needed, no insurance required. 5pm to 8pm @ Creation Tattoo Company https://t.co/fEZuyEdOsV",https://twitter.com/jdherrera5/status/1478873219436326916,Fri Jan 04 07:52:22 +0000 2013,1059843734,false,,217,77,110,0,"San Antonio, Texas",Joseph David Herrera,jdherrera5,458,,,false
"-73.6197588,45.51950705",Thu Jan 06 00:56:05 +0000 2022,,https://twitter.com/stigmabase/status/1478893095110406146/photo/1,http://dlvr.it/SGc8KR,0,1478893095110406146,,,,en,"Montréal, Québec",false,,0,,,"<a href=""https://dlvrit.com/"" rel=""nofollow"">dlvr.it</a>","TW : Singapore’s 2021 GDP is growing faster than a decade by Reuters: While analysts expect the economy to continue to grow, they warned that the Omicron coronavirus variant could become a drag if social exclusion rules are tightened again.The city-state… https://t.co/2KCbQ0N6P9 https://t.co/70bcATFT7I",https://twitter.com/stigmabase/status/1478893095110406146,Wed Sep 01 21:06:16 +0000 2010,185789961,false,Dedicated to Education | Keeping up-to-date on global exclusion — Serving the truth — Stigmabase is a canadian internet non-profit Initiative. Founded in 2010,0,963,689,71,Worldwide,STIGMABASE | EDU,stigmabase,820501,,https://www.stigmabase.org/,false
"121.01535125,14.55176809",Wed Jan 05 22:41:49 +0000 2022,,,https://www.instagram.com/p/CYXZNm4ha7R/?utm_medium=twitter,0,1478859307450081299,,,,en,"Lungsod ng Makati, Pambansang Punong Rehiyon",false,,0,,,"<a href=""http://instagram.com"" rel=""nofollow"">Instagram</a>","My companion throughout my quarantine @ Makati City, Manila, Philippines https://t.co/rbqSeXY0QN",https://twitter.com/bunnymaguilar/status/1478859307450081299,Sat Feb 21 04:19:07 +0000 2009,21462863,false,,118,538,151,1,Manila and London,D'Artagnan Aguilar,bunnymaguilar,14741,,,false
"-73.56725453,45.75975883",Wed Jan 05 22:04:12 +0000 2022,,,http://dlvr.it/SGbpWf,0,1478849840855465986,,,,en,"Mascouche, Québec",false,,0,,,"<a href=""https://dlvrit.com/"" rel=""nofollow"">dlvr.it</a>","Fighting Stigma: 'GET JABBED': Campaign launched as research shows low vaccine take—up among Irish in Britain: The data on the Irish community's lower vaccine rates has been sourced from the OpenSAFELY, a software platform analysing electronic health… https://t.co/9T87UmkzFt",https://twitter.com/StigmabaseN/status/1478849840855465986,Wed Sep 15 15:55:47 +0000 2010,191092262,false,Ireland — Scotland — Inuit —  Svenska  | Keeping up-to-date on global exclusion — Stigmabase is a canadian internet non-profit Initiative,0,1610,1297,111,Ireland | Scotland | Inuit | Skandinavien,Stigmabase | NORDIC,StigmabaseN,952258,,https://www.stigmabase.org/,false
"-95.63821,29.60036",Thu Jan 06 03:32:28 +0000 2022,covid_19 idpa overitalready getvaxxed,,https://www.instagram.com/p/CYX6eVgAIlQ/?utm_medium=twitter,0,1478932452987092998,,,,en,"Sugar Land, TX",false,,0,,,"<a href=""http://instagram.com"" rel=""nofollow"">Instagram</a>",#covid_19 #idpa #overitalready #getvaxxed @ Kindred Hospital Sugar Land https://t.co/69VP3KBIsf,https://twitter.com/MCastroCalzada/status/1478932452987092998,Wed Sep 17 16:47:08 +0000 2008,16332194,false,"She/Her/Ella, Mom, Wife, Sister, Latina, ID/Wound & HBO #PA (Tweets≠Med Advice), Progressive, 1stGen Amer, 🏳️‍🌈Ally, 🤘🏼TexasEx 🏈 Fan, Wine & Bourbon Lover.",6472,192,1223,9,"Houston, Texas",Perrin & Aviendha’s Mom 🇺🇸🇦🇷🇨🇱,MCastroCalzada,8651,,http://www.casacalzada.com,false
"-73.9675,40.7779",Wed Jan 05 22:58:24 +0000 2022,wfh socialdistance workfromhome foxweather pandemiclife swipe bts,,https://www.instagram.com/p/CYXbG6br1iw/?utm_medium=twitter,41,1478863480061140996,,,,en,"Manhattan, NY",false,,4,,,"<a href=""http://instagram.com"" rel=""nofollow"">Instagram</a>","First day of working from home, any advice from #wfh army… I’d love to hear your tips, tricks, and hacks! @foxweather #socialdistance #workfromhome #foxweather #pandemiclife #swipe #bts @ Manhattan, New York https://t.co/l3eYfxCfqv",https://twitter.com/amyfreeze/status/1478863480061140996,Fri Nov 04 01:59:19 +0000 2011,404532969,false,6X Emmy Winner ⚡️ America’s Weather Team 💫 FOX Weather,22328,136461,30299,667,New York City,Amy Freeze,amyfreeze,37391,,http://www.foxweather.com,true
"-93.1596462,45.1559632",Thu Jan 06 01:36:21 +0000 2022,,,,1,1478903229324877825,kelownagurl,1478894504342024195,14299897,en,"Blaine, MN",,,0,,,"<a href=""http://klinkerapps.com"" rel=""nofollow"">Talon Android</a>",@kelownagurl Covid is a no-good playboy. A deceiver. It is different things to different people. It just wants to spread.,https://twitter.com/RoyBoy21/status/1478903229324877825,Thu Feb 26 21:51:50 +0000 2009,22067825,false,"267 lbs of Minnesota Dynamite, Mamma's Boy, proud father of Cassie & Jake, Catholic, smart-aleck, MN sports fan. #ScottJa'Mamas #RollCobbs.",7081,466,1670,20,"Circletucky, MN",CLOWNS-me-JOKERS,RoyBoy21,28137,,http://ronnieroy.blogspot.com,false
"-52.85,47.6333",Thu Jan 06 00:55:26 +0000 2022,winetime wineisfamily,,https://www.instagram.com/p/CYXogQQMjCI/?utm_medium=twitter,0,1478892933768040455,,,,en,"Portugal Cove-St. Philip's, Newfoundland and Labrador",false,,0,,,"<a href=""http://instagram.com"" rel=""nofollow"">Instagram</a>","Especially after this covid riddled holiday season 😂😂#winetime #wineisfamily @ Portugal Cove, Newfoundland and Labrador https://t.co/Vk8Jyz2X2q",https://twitter.com/kristatrask/status/1478892933768040455,Tue May 05 00:55:29 +0000 2009,37813016,false,"Century 21 Seller's Choice Real Estate Agent, Buying/Selling in St. John's and beyond - 709-746-3380. krista.trask@century21.ca",1111,675,1600,10,,Krista Trask,kristatrask,6402,,,false
"133.68232727,-32.12074612",Thu Jan 06 00:40:36 +0000 2022,,https://twitter.com/wcsentinel/status/1478889198794928128/photo/1,https://www.portlincolntimes.com.au/story/7571114/covid-impact-felt-on-eyre-peninsula/?src=rss,0,1478889198794928128,,,,en,"Ceduna, South Australia",false,,0,,,"<a href=""https://dlvrit.com/"" rel=""nofollow"">dlvr.it</a>",COVID impact felt on Eyre Peninsula https://t.co/YYfMb38INc https://t.co/R6j2MOxDwf,https://twitter.com/wcsentinel/status/1478889198794928128,Sun Feb 15 02:58:28 +0000 2009,20888940,false,"West Coast Sentinel covers local news on South Australia's Eyre Peninsula for areas including Ceduna, Streaky Bay, Kimba, Kyancutta, Wudinna & Elliston",10,690,112,24,"Ceduna, South Australia",West Coast Sentinel,wcsentinel,8122,,http://www.westcoastsentinel.com.au,false
"-82.5777,27.4882",Wed Jan 05 23:22:27 +0000 2022,covid_19 test omicron vaccinationdone getthefreakingvaccineyouidiot staysafe stayalive ᴠᴀᴄᴄɪɴᴇssᴀᴠᴇʟɪᴠᴇs,,https://www.instagram.com/p/CYXd3BmArDM/?utm_medium=twitter,0,1478869534492827650,,,,en,"Bradenton, FL",false,,0,,,"<a href=""http://instagram.com"" rel=""nofollow"">Instagram</a>","When you have covid but your husband is still waiting for his tests results! #covid_19 #test #omicron #vaccinationdone✔️ #getthefreakingvaccineyouidiot #staysafe #stayalive #ᴠᴀᴄᴄɪɴᴇssᴀᴠᴇʟɪᴠᴇs @ Bradenton, Florida https://t.co/gNM3Ym6une",https://twitter.com/ClauditaMcKay/status/1478869534492827650,Mon Feb 02 19:56:12 +0000 2009,19926621,false,Actriz Autodidacta Cantante Aficionada Soñadora Profesional,66,94,113,0,All over the World,Claudita Mc Kay,ClauditaMcKay,3777,,,false
"-79.7164011,43.7742911",Thu Jan 06 02:07:33 +0000 2022,ArtAndCulture Books Lifestyle,,http://dlvr.it/SGcGB0,0,1478911081988833280,,,,en,"Brampton, Ontario",false,,1,,,"<a href=""https://dlvrit.com/"" rel=""nofollow"">dlvr.it</a>",Covid Blues: World Book Fair 2022 postponed https://t.co/QxYZhSYeVS #ArtAndCulture #Books #Lifestyle,https://twitter.com/Weeklyvoice/status/1478911081988833280,Tue Mar 30 17:43:21 +0000 2010,127943720,false,Most Trusted News in North America’s South Asian Communities Since 1997,172,494,299,11,Toronto,Weekly Voice,Weeklyvoice,37110,,http://www.Weeklyvoice.com,false
"-100,40",Wed Jan 05 23:36:40 +0000 2022,covid_19 booster fullyvaccinated,,https://www.instagram.com/p/CYXffNWpsV-/?utm_medium=twitter,0,1478873109839110144,,,,en,"Kansas, USA",false,,0,,,"<a href=""http://instagram.com"" rel=""nofollow"">Instagram</a>",#covid_19 #booster #fullyvaccinated @ United States https://t.co/o7oO9kMURk,https://twitter.com/NicholeShirell/status/1478873109839110144,Sat Aug 19 00:59:54 +0000 2017,898711083246071808,false,Author-Poet Publisher Spoken Words Recording Artist - #Amplification - BLM EP Listen: https://t.co/JptyTrxktB,1764,766,808,4,"Birmingham, AL",Nichole Shirell,NicholeShirell,4039,,https://www.nicholeshirell.com/book-online,false
"-117.6426,33.88427",Wed Jan 05 23:50:43 +0000 2022,Corona LAtraffic,,http://bit.ly/10F395r,0,1478876647206141955,,,,en,"California, USA",false,,0,,,"<a href=""http://www.sigalert.com/Map.asp?region=Greater+Los+Angeles"" rel=""nofollow"">TTN LA traffic</a>","Crash - eastbound 91 connector blocked. in #Corona on CA-71 SB at CA-91, stopped traffic back to CA-83/Butterfield Ranch Rd #LAtraffic https://t.co/e2e6MWkOvI",https://twitter.com/TotalTrafficLA/status/1478876647206141955,Wed Aug 12 21:43:18 +0000 2009,65171105,false,Providing you #LIVE #traffic updates for your #SoCal drive! Got a tip? Dial #250 and use the keyword “So Cal Traffic”,301,18778,610,688,Southern California,Total Traffic LA,TotalTrafficLA,294251,,https://www.ttwnetwork.com/,false
"-79.086964,35.82218",Thu Jan 06 01:53:38 +0000 2022,501pharmacy molnupiravir indypharmacy wegotit visitveranda briarchapel covid,,https://www.instagram.com/p/CYXvKXbLQqp/?utm_medium=twitter,0,1478907577945710595,,,,en,"North Carolina, USA",false,,0,,,"<a href=""http://instagram.com"" rel=""nofollow"">Instagram</a>","Yup, 501 Pharmacy also has Molnupiravir in stock for eligible COVID positive patients. #501pharmacy #molnupiravir #indypharmacy #wegotit #visitveranda #briarchapel #covid @ 501 Pharmacy https://t.co/CTKsgPA25Q",https://twitter.com/501_Pharmacy/status/1478907577945710595,Sun Feb 28 05:52:40 +0000 2016,703820088399429640,false,,482,191,118,3,,501 Pharmacy,501_Pharmacy,2350,,,false
"-117.5277,33.82925",Thu Jan 06 02:40:43 +0000 2022,Corona LAtraffic,,http://bit.ly/10F395r,0,1478919428226101252,,,,en,"El Cerrito, CA",false,,0,,,"<a href=""http://www.sigalert.com/Map.asp?region=Greater+Los+Angeles"" rel=""nofollow"">TTN LA traffic</a>","Crash - center divider. in #Corona on I-15 SB at EL Cerrito Rd, stopped traffic back to Ontario Ave #LAtraffic https://t.co/e2e6MWkOvI",https://twitter.com/TotalTrafficLA/status/1478919428226101252,Wed Aug 12 21:43:18 +0000 2009,65171105,false,Providing you #LIVE #traffic updates for your #SoCal drive! Got a tip? Dial #250 and use the keyword “So Cal Traffic”,301,18778,610,688,Southern California,Total Traffic LA,TotalTrafficLA,294251,,https://www.ttwnetwork.com/,false
"-73.95126522,40.71979449",Wed Jan 05 23:50:17 +0000 2022,workingfromhome brooklyncooks,,https://www.instagram.com/p/CYXhDBzPx-b/?utm_medium=twitter,2,1478876539584397316,,,,en,"Brooklyn, NY",false,,0,,,"<a href=""http://instagram.com"" rel=""nofollow"">Instagram</a>","Tonight's dinner Ribollita - braised Tuscan chicken, tomatoes, white beans, heirloom carrots, onions, kale. #workingfromhome has its benefits! #brooklyncooks @ McCarren Park https://t.co/KbX3ruThXs",https://twitter.com/antoinette_b/status/1478876539584397316,Sun Jan 04 21:40:59 +0000 2009,18612414,false,"Editor-in-Chief, StarChefs, Rising Stars magazine & International Chefs Congress. 
Insatiable appetite for all things culinary, reporting live from my tastings!",137,10999,706,440,"ÜT: 40.755935,-73.973225",Antoinette_StarChefs,antoinette_b,13032,,http://www.starchefs.com,false
"-80.0673,26.7799",Thu Jan 06 02:12:13 +0000 2022,,,https://www.instagram.com/p/CYXxSlLshYQ/?utm_medium=twitter,0,1478912256448544770,,,,en,"Riviera Beach, FL",false,,0,,,"<a href=""http://instagram.com"" rel=""nofollow"">Instagram</a>","Attention! Just posted! THE MLK PARADE IN RIVIERA BEACH HAS BEEN CANCELLED! DUE TO A SPIKE IN COVID19 OUTBREAKS IN PALM BEACH COUNTY! TO RISKY TO THE COMMUNITY! @ Riviera Beach, Florida https://t.co/MzxNCTLl0b",https://twitter.com/dancehallme/status/1478912256448544770,Fri Jun 04 02:32:31 +0000 2010,151717701,false,Couture Fashion Designer-RAGGAMUFFIN STYLES,518,78,221,6,South Florida,Angela Williamson-Stringer,dancehallme,2185,,http://vipreadyraggamuffin.com,false
"123.892,10.3111",Thu Jan 06 03:20:52 +0000 2022,,,https://www.instagram.com/p/CYX5JZ5pKAF/?utm_medium=twitter,0,1478929534196011009,,,,en,"Lungsod ng Cebu, Rehiyon ng Gitnang Visayas",false,,0,,,"<a href=""http://instagram.com"" rel=""nofollow"">Instagram</a>",Eng Eng Eeennnggg.. Face Shield Returns. 😕 @ Cebu City https://t.co/TdC0tNWpOY,https://twitter.com/enggul/status/1478929534196011009,Mon Apr 18 16:27:52 +0000 2011,284096922,false,love your enemies.,23,161,252,3,Singapore,Engelbert,enggul,5056,,,false
