coordinates,created_at,hashtags,media,urls,favorite_count,id,in_reply_to_screen_name,in_reply_to_status_id,in_reply_to_user_id,lang,place,possibly_sensitive,quote_id,retweet_count,retweet_id,retweet_screen_name,source,text,tweet_url,user_created_at,user_id,user_default_profile_image,user_description,user_favourites_count,user_followers_count,user_friends_count,user_listed_count,user_location,user_name,user_screen_name,user_statuses_count,user_time_zone,user_urls,user_verified
"1.2977,52.6292",Tue Jan 11 13:41:36 +0000 2022,workingfromhome wfh,,https://www.instagram.com/p/CYl4KLij_y3/?utm_medium=twitter,0,1480897685196615680,,,,en,"Norwich, England",false,,0,,,"<a href=""http://instagram.com"" rel=""nofollow"">Instagram</a>","Day 401 of working from home. I  only have to do that 213 more times then I can claim my pension! #workingfromhome #wfh @ Norwich, Norfolk https://t.co/ymigqDVjFn",https://twitter.com/RealDavidHardy/status/1480897685196615680,Thu Jan 07 01:38:36 +0000 2010,102540275,false,Writer/photographer/Gorleston & Liverpool FC/guitarist/Status Quo fan/Comic Genius/sex god https://t.co/HlS6ovpJa0 https://t.co/m3NfhJlnU5,619,307,652,12,Norwich,David Hardy ❤19❤ 💚📝📷⚽🎸🎭,RealDavidHardy,15625,,http://www.davidhardy.bravesites.com,false
"-3.01284198,53.35033206",Tue Jan 11 08:05:39 +0000 2022,covid_19 negative,,https://www.instagram.com/p/CYlRtZ5NV_k/?utm_medium=twitter,0,1480813138484342785,,,,en,"Birkenhead, England",false,,0,,,"<a href=""http://instagram.com"" rel=""nofollow"">Instagram</a>",Freedom day! #covid_19 #negative @ Bebington https://t.co/VYqxiJzTVF,https://twitter.com/Dan_EFC1878/status/1480813138484342785,Tue Feb 03 17:07:15 +0000 2015,3014749701,false,Download the Everton News app. https://t.co/7b7QPPtRRa,1804,1605,1157,7,Merseyside,Dan EFC 1878,Dan_EFC1878,6379,,http://AppStore.com/EFCNews,false
"73.69949,24.58782",Tue Jan 11 14:10:36 +0000 2022,apnamlsu apna_mlsu mlsu udaipur udaipurnews udaipurtimes udaipurcity lockdown cororna omicron covid_19,,https://www.instagram.com/p/CYl7ehlJgMT/?utm_medium=twitter,5,1480904984552165378,,,,en,"उदयपुर, भारत",false,,0,,,"<a href=""http://instagram.com"" rel=""nofollow"">Instagram</a>",#apnamlsu #apna_mlsu #mlsu #udaipur #udaipurnews #udaipurtimes #udaipurcity #lockdown #cororna #omicron #covid_19 @ Udaipur - The City of Lakes https://t.co/a0m3V4WYVy,https://twitter.com/apnamlsu/status/1480904984552165378,Tue Mar 31 09:07:20 +0000 2020,1244914109490933760,false,"Official Twitter handle of MLSU Udaipur
                                      Hon'ble Vice Chancellor Prof. Amarika Singh Ji",2785,1330,4,0,Mohanlal Sukhadia University,Mohanlal Sukhadia University,apnamlsu,2804,,https://apnamlsu123.page.link/Instagram,false
"-76.691881,39.291166",Tue Jan 11 05:56:26 +0000 2022,,,,0,1480780622620733447,Raeology_,1480779804194521090,35979992,en,"Baltimore, MD",,,0,,,"<a href=""https://onloft.com/tweetlogix"" rel=""nofollow"">Tweetlogix</a>",@Raeology_ Yeah…. COVID took away Safeway &amp; Wal-Mart (24 hours),https://twitter.com/thisisdking/status/1480780622620733447,Tue Apr 14 11:09:24 +0000 2009,31099398,false,"IG:@thisdking85

Regional Truck Driver. Sports Gambler. Big Titty Lover. Henny Drinker. I Also Have A Reese Cup Addiction.",488,745,695,11,West Baltimore ,My DM’S Broke,thisisdking,104609,,,false
"-6.24327711,53.36001999",Tue Jan 11 06:23:05 +0000 2022,,,http://dlvr.it/SGvCSY,0,1480787329664970754,,,,en,"Dublin City, Ireland",false,,1,,,"<a href=""https://dlvrit.com/"" rel=""nofollow"">dlvr.it</a>","IED — Unvaccinated 'gambling' with their health, NI expert says: Northern Ireland's Chief Medical Officer has urged those who have not yet had their Covid-19 booster jab that they are gambling unnecessarily with ...  

View article... https://t.co/ewIrG8BwUh",https://twitter.com/StigmabaseN/status/1480787329664970754,Wed Sep 15 15:55:47 +0000 2010,191092262,false,Ireland — Scotland — Inuit —  Svenska  | Keeping up-to-date on global exclusion — Stigmabase is a canadian internet non-profit Initiative,0,1610,1297,111,Ireland | Scotland | Inuit | Skandinavien,Stigmabase | NORDIC,StigmabaseN,952258,,https://www.stigmabase.org/,false
"-77.0253813,38.939459",Tue Jan 11 12:15:02 +0000 2022,BidensAmerica Covid Democrats Midterms,,https://www.washingtonpost.com/health/2022/01/10/covid-hospitalized-omicron/,0,1480875900245884930,,,,en,"Washington, DC",false,,0,,,"<a href=""https://www.hootsuite.com"" rel=""nofollow"">Hootsuite Inc.</a>","#BidensAmerica poised to break record 142,000 #Covid-19 hospitalizations, and that's definitely going to cost #Democrats in the #Midterms!

 https://t.co/a5Z09Kqf4t",https://twitter.com/Joseph_Santoro/status/1480875900245884930,Sat Jan 17 21:10:13 +0000 2009,19123904,false,"Neuro PhD, #Innovator, #Technologist, #Startup Angel, Fmr White House/OFA Honcho | #Politics #Data #Adventure | StartingBloc & Fulbright | @DMVstartup @Forbes",170394,18370,20267,2363,"Washington, DC 20009",Dr. Joseph Santoro 🇺🇲🇺🇦🇺🇳🇪🇺,Joseph_Santoro,179079,,http://linkedin.com/in/josephsantoro,false
"-109.64904785,23.0700982",Tue Jan 11 04:36:30 +0000 2022,moonhalo halo moon corona,,https://www.instagram.com/p/CYk5xpEr3Mv/?utm_medium=twitter,0,1480760504410947586,,,,en,"Los Cabos, Baja California Sur",false,,0,,,"<a href=""http://instagram.com"" rel=""nofollow"">Instagram</a>","First time to see a #moonhalo #halo #moon (#corona but the good kind) @ Zadún, a Ritz-Carlton Reserve https://t.co/COMY0CYofk",https://twitter.com/edaychampagne/status/1480760504410947586,Fri Jan 23 20:36:34 +0000 2009,19412412,false,Eat. Drink. Travel. Tanya Spaulding and David Shea @Shea_Inc experience the world.,731,115,99,13,Minneapolis,Everyday Champagne,edaychampagne,664,,http://www.everydaychampagne.com,false
"-118.4940387,34.0205767",Tue Jan 11 08:17:44 +0000 2022,,,https://www.meridian-counseling.com/blog/2022/1/11/6-ways-to-help-isolated-seniors-while-social-distancing,1,1480816181145739266,,,,en,"Santa Monica, CA",false,,0,,,"<a href=""http://www.squarespace.com"" rel=""nofollow"">Squarespace</a>",6 Ways to Help Isolated Seniors While Social Distancing  https://t.co/06RnGO1M7V,https://twitter.com/meridiancouns/status/1480816181145739266,Wed Feb 09 00:00:43 +0000 2011,249402820,false,"The ones who are crazy enough to change the world, are the ones that do. ❤️",126,104,43,10,"Santa Monica, CA",Sandra Kushnir,meridiancouns,554,,http://www.meridian-counseling.com,false
"-79.7164011,43.7742911",Tue Jan 11 06:04:03 +0000 2022,Olympics Sports,,http://dlvr.it/SGv9Ps,0,1480782538347974659,,,,en,"Brampton, Ontario",false,,1,,,"<a href=""https://dlvrit.com/"" rel=""nofollow"">dlvr.it</a>",WHO says Beijing Winter Olympics anti-Covid-19 plan looks strong https://t.co/E6pYrbjRMk #Olympics #Sports,https://twitter.com/Weeklyvoice/status/1480782538347974659,Tue Mar 30 17:43:21 +0000 2010,127943720,false,Most Trusted News in North America’s South Asian Communities Since 1997,172,494,299,11,Toronto,Weekly Voice,Weeklyvoice,37110,,http://www.Weeklyvoice.com,false
"-80.26295,25.74924",Tue Jan 11 13:43:46 +0000 2022,patience creativecatering faretoremember reopeningsoon,,https://www.instagram.com/p/CYl4Z3oLWFR/?utm_medium=twitter,0,1480898229717938176,,,,en,"Coral Gables, FL",false,,0,,,"<a href=""http://instagram.com"" rel=""nofollow"">Instagram</a>","As we patiently wait for Corona to get under control, be sure we are working on coming up with different and interesting station to use at your next event! #patience #creativecatering #faretoremember #reopeningsoon https://t.co/NedMhzeVx9",https://twitter.com/farecatersarah/status/1480898229717938176,Sat Jul 28 11:07:48 +0000 2012,721978566,false,"Owner of Fare to Remember Catering, Culinary institute of America and FIU Grad, Married with One Delightful Son Jacob",25,104,120,0,Miami Florida,Sarah Davidoff,farecatersarah,869,,,false
"-117.566,33.8753",Tue Jan 11 09:06:27 +0000 2022,,,https://www.instagram.com/p/CYlYq3mrIUP/?utm_medium=twitter,0,1480828439158562816,,,,en,"Corona, CA",false,,0,,,"<a href=""http://instagram.com"" rel=""nofollow"">Instagram</a>","This was one of the worst/Best Buy’s of my life…. No regrets though @ Corona, California https://t.co/3fEYPCAHbC",https://twitter.com/FadedxFantom/status/1480828439158562816,Sat Nov 16 09:19:25 +0000 2013,2197418497,false,21 years young,2916,417,95,4,CA,Dustin Z Peak,FadedxFantom,1449,,https://www.youtube.com/channel/UC0uJr-vuBI0x_jm-wg7-qPA,false
"77.597645,12.971117",Tue Jan 11 11:01:46 +0000 2022,omicron covidsucks wfh lockdown,,https://www.instagram.com/p/CYll3b0vIjS/?utm_medium=twitter,1,1480857463507361793,,,,en,"बैंगलुरु, भारत",false,,0,,,"<a href=""http://instagram.com"" rel=""nofollow"">Instagram</a>","#omicron can close our office. Not our will to help a cancer patient. 

Office shall remain closed. But you can cut the hair and keep it preserved till we start again. 

DM for instructions. 

#covidsucks #wfh #lockdown https://t.co/OrGVvvU8kr",https://twitter.com/blrhairdonation/status/1480857463507361793,Wed Jan 15 02:40:04 +0000 2020,1217275177282629632,false,"OFFICIAL PAGE 🎗️
We accept donations from all over INDIA 
We make wigs for women and children with hair loss.
DM to donate.",30,37,14,0,"Bengaluru, India",Bangalore Hair Donation,blrhairdonation,605,,,false
"-78.6235392,42.92608",Tue Jan 11 14:15:02 +0000 2022,COVID MadeinUSA StoptheSpread,https://twitter.com/MDSAssociatesIn/status/1480906100622909441/photo/1,http://ow.ly/HMto50HrNne,0,1480906100622909441,,,,en,"New York, USA",false,,0,,,"<a href=""https://www.hootsuite.com"" rel=""nofollow"">Hootsuite Inc.</a>","Now available - hard to find CareStart™ #COVID-19 Rapid Antigen Home Tests. #MadeinUSA, test to return to work or school and help #StoptheSpread. https://t.co/lx2HDRY2GD https://t.co/FjwAodSQ5L",https://twitter.com/MDSAssociatesIn/status/1480906100622909441,Fri Apr 20 13:48:59 +0000 2012,558649664,false,,21,115,276,0,,MDS Associates Inc.,MDSAssociatesIn,1045,,,false
"-90.19780211,38.65136378",Tue Jan 11 12:32:56 +0000 2022,,,https://www.instagram.com/p/CYlwTPQrmzn/?utm_medium=twitter,25,1480880403804299272,,,,en,"St Louis, MO",false,,0,,,"<a href=""http://instagram.com"" rel=""nofollow"">Instagram</a>",Tuesday morning post Covid time to make the bunnies me @ Crown Candy Kitchen https://t.co/V4RAx27bHa,https://twitter.com/kzieff/status/1480880403804299272,Sun Dec 14 14:19:24 +0000 2008,18116688,false,cancer survivor Cuban cigar lover Anejo Tequila drinking vodka loving hard working madly loving @smkzieff and dog and cat person,94163,8613,7666,116,jiggling the handle,Andy Karandzieff,kzieff,75935,,http://crowncandykitchen.com,false
"77,21",Tue Jan 11 08:59:39 +0000 2022,covid peoplecanbegood humanity,,https://www.instagram.com/p/CYlX5EqBhfr/?utm_medium=twitter,0,1480826731086979077,,,,en,"महाराष्ट्र, भारत",false,,0,,,"<a href=""http://instagram.com"" rel=""nofollow"">Instagram</a>","Things which still many may be facing...
#covid #peoplecanbegood #humanity @ India https://t.co/jxMbaaafyD",https://twitter.com/GyaanNation/status/1480826731086979077,Thu Oct 08 07:27:31 +0000 2020,1314105043952398336,false,"Sharing life experience and trying to motivate people 
& bring smile by small stories
#Contentwriting
#Indianblogging
#storyteller
#motivating #inspiring #life",36,3,35,0,India,GYAAN NATION,GyaanNation,60,,http://simpligyaan.wordpress.com,false
"-73.47935661,45.6677507",Tue Jan 11 08:41:03 +0000 2022,,,http://dlvr.it/SGvW8r,0,1480822048863637505,,,,en,"Varennes, Québec",false,,0,,,"<a href=""https://dlvrit.com/"" rel=""nofollow"">dlvr.it</a>",Fighting Stigma : Connecticut officials say federal funds are needed for child care — WSHU: The money would be used to deal with a child care staffing crisis created by the pandemic. https://t.co/ayxxYeqNk3,https://twitter.com/StigmabaseN/status/1480822048863637505,Wed Sep 15 15:55:47 +0000 2010,191092262,false,Ireland — Scotland — Inuit —  Svenska  | Keeping up-to-date on global exclusion — Stigmabase is a canadian internet non-profit Initiative,0,1610,1297,111,Ireland | Scotland | Inuit | Skandinavien,Stigmabase | NORDIC,StigmabaseN,952258,,https://www.stigmabase.org/,false
"-73.6197588,45.51950705",Tue Jan 11 13:00:09 +0000 2022,,https://twitter.com/stigmabase/status/1480887253249388545/photo/1,http://dlvr.it/SGwFH0,0,1480887253249388545,,,,en,"Montréal, Québec",false,,0,,,"<a href=""https://dlvrit.com/"" rel=""nofollow"">dlvr.it</a>",TW : Seeking a Sex-Positive Therapist? Here Are the 12 Questions You Should Ask Them: The assumption that sex workers are sex trafficking victims or “broken” is far from true. The mental health issues with sex work are related to the social stigma they… https://t.co/e7IltgR4cA https://t.co/K3qNta8vCc,https://twitter.com/stigmabase/status/1480887253249388545,Wed Sep 01 21:06:16 +0000 2010,185789961,false,Dedicated to Education | Keeping up-to-date on global exclusion — Serving the truth — Stigmabase is a canadian internet non-profit Initiative. Founded in 2010,0,963,689,71,Worldwide,STIGMABASE | EDU,stigmabase,820501,,https://www.stigmabase.org/,false
"77.19102783,28.5974128",Tue Jan 11 13:03:07 +0000 2022,,,http://dlvr.it/SGwFyc,0,1480888001475448835,,,,en,"नई दिल्ली, भारत",false,,1,,,"<a href=""https://dlvrit.com/"" rel=""nofollow"">dlvr.it</a>","INNR — India begins new vaccine phase in COVID-19 fight, 'precautionary doses' for frontline ...: A health worker prepares to inoculate a women with a dose of the Covishield ... Dr VK Paul, the head of India's COVID-19 task force, had said, ...  

… https://t.co/Xu2RFk6SIT",https://twitter.com/StigmabaseA/status/1480888001475448835,Sat May 29 17:26:03 +0000 2010,149585330,false,Australia - New Zealand — 日本語  — 中国 — 한국말 |  Keeping up-to-date on global exclusion — Stigmabase is a canadian internet non-profit Initiative. Founded in 2010.,0,2908,1275,139,Asia | Australia - Pacific,Stigmabase | ASIA,StigmabaseA,1550447,,https://www.stigmabase.org/,false
"-0.12485951,51.50538967",Tue Jan 11 10:07:03 +0000 2022,Slovakia,,http://dlvr.it/SGvkdL,0,1480843690281082880,,,,en,"London, England",false,,1,,,"<a href=""https://dlvrit.com/"" rel=""nofollow"">dlvr.it</a>",#Slovakia eases COVID measures as omicron surge yet to hit https://t.co/fZZNdRIS3p,https://twitter.com/BritishHeraldUK/status/1480843690281082880,Wed Feb 17 17:49:42 +0000 2010,115123902,false,Where Britain Meets the World® | The Official handle of #britishherald,350,133883,607,283,"London, United Kingdom",British Herald,BritishHeraldUK,57106,,http://www.britishherald.com,false
"114.158,22.2826",Tue Jan 11 10:44:28 +0000 2022,covid19 quarantine,,https://www.instagram.com/p/CYlj1kMDJj1/?utm_medium=twitter,0,1480853106401312769,,,,en,"中西區, 香港",false,,0,,,"<a href=""http://instagram.com"" rel=""nofollow"">Instagram</a>","Quarantine for close contacts shortened to 14 days. No tracking bracelets upon release but one test required on 19th day. 21-day quarantine remains in place for travelers to Hong Kong.
#covid19 #quarantine @ Hongkong https://t.co/OHi1j45GHz",https://twitter.com/MelissaGecolea/status/1480853106401312769,Wed Aug 10 00:56:19 +0000 2011,352002960,false,"Hong Kong-based broadcast journalist, TCK. All views are my own.",274,1419,288,39,Hong Kong,Melissa Gecolea,MelissaGecolea,1617,,,false
"77.19102783,28.5974128",Tue Jan 11 14:05:06 +0000 2022,,,http://dlvr.it/SGwS9F,0,1480903600062689284,,,,en,"नई दिल्ली, भारत",false,,0,,,"<a href=""https://dlvrit.com/"" rel=""nofollow"">dlvr.it</a>","INNR — Pregnant women, disabled employees exempted from office amid Covid rise: However, they will be required to remain available and work from home. All officials and staff living in the containment zones will also be exempted ...  

View article... https://t.co/fGVKFZ9ZMq",https://twitter.com/StigmabaseA/status/1480903600062689284,Sat May 29 17:26:03 +0000 2010,149585330,false,Australia - New Zealand — 日本語  — 中国 — 한국말 |  Keeping up-to-date on global exclusion — Stigmabase is a canadian internet non-profit Initiative. Founded in 2010.,0,2908,1275,139,Asia | Australia - Pacific,Stigmabase | ASIA,StigmabaseA,1550447,,https://www.stigmabase.org/,false
"-0.1769472,51.3572864",Tue Jan 11 11:00:37 +0000 2022,health fitness HR happiness mentalhealth mindfulness wellness productivity wellbeing workplace business success leadership safety,https://twitter.com/AnthonyLSavage/status/1480857174054256641/photo/1,http://ow.ly/PKsM50HmzbQ,1,1480857174054256641,,,,en,"Sutton, London",false,,1,,,"<a href=""https://www.hootsuite.com"" rel=""nofollow"">Hootsuite Inc.</a>","Covid: Next few days crucial for the NHS, says health boss
https://t.co/p5O5CTuM1Q
#health #fitness #HR #happiness #mentalhealth #mindfulness #wellness #productivity #wellbeing #workplace #business #success #leadership #safety https://t.co/E2zUvzuEju",https://twitter.com/AnthonyLSavage/status/1480857174054256641,Tue Nov 20 16:31:58 +0000 2012,960767672,false,Occupational Mental Health & Wellbeing Entrepreneur Medical Services Manager @Sparta_Health Absence Rehabilitation Benefits Fitness Engagement Human Resources,4,319,649,5,"London, England",Anthony Savage,AnthonyLSavage,1864,,http://www.linkedin.com/in/anthonysavage,false
"-6.24327711,53.36001999",Tue Jan 11 06:23:04 +0000 2022,,,http://dlvr.it/SGvCRY,0,1480787324128555008,,,,en,"Dublin City, Ireland",false,,1,,,"<a href=""https://dlvrit.com/"" rel=""nofollow"">dlvr.it</a>","IED — Self-isolation could be scrapped for close contacts under new EU advice ...: Close contacts of people who test positive for Covid-19 may no longer have to isolate if they have had a booster jab, under EU advice being ...  

View article... https://t.co/QQQ5G5yR8P",https://twitter.com/StigmabaseN/status/1480787324128555008,Wed Sep 15 15:55:47 +0000 2010,191092262,false,Ireland — Scotland — Inuit —  Svenska  | Keeping up-to-date on global exclusion — Stigmabase is a canadian internet non-profit Initiative,0,1610,1297,111,Ireland | Scotland | Inuit | Skandinavien,Stigmabase | NORDIC,StigmabaseN,952258,,https://www.stigmabase.org/,false
"21.008562,52.232415",Tue Jan 11 06:44:22 +0000 2022,Business CES fastcompany,,http://fastcompany.com/90711737/ces-2022-pandemic-attendance,0,1480792684516229121,,,,en,"Warszawa, Polska",false,,0,,,"<a href=""https://tapbots.com/tweetbot/"" rel=""nofollow"">Twitter for iPhone 12 Pro Max </a>",#Business What it was like to cover a very uncrowded #CES during a... https://t.co/t5kc6Hw05Q #fastcompany,https://twitter.com/pidybi/status/1480792684516229121,Sat Mar 30 17:25:49 +0000 2013,1316862031,false,🤷‍♂️,219,569,590,250,Poland 🌍👈,𝔓𝔦𝔬𝔱𝔯,pidybi,633666,,,false
"-78.57391298,26.54250414",Tue Jan 11 13:47:24 +0000 2022,,,https://www.instagram.com/p/CYl40dEreinLJdm98VFPkaiO8aKHdzmHShi5yg0/?utm_medium=twitter,0,1480899143891517440,,,,en,Bahamas,false,,0,,,"<a href=""http://instagram.com"" rel=""nofollow"">Instagram</a>",Might be cloudy here today but it’s still a beautiful sunrise - time to visit (lots of Covid free space)! @ Banana Bay https://t.co/mauxWPE4oj,https://twitter.com/noshoesgal/status/1480899143891517440,Mon Mar 23 14:22:06 +0000 2009,26009081,false,"Owner of Barefoot Marketing , Barefoot Location, Grand Bahama News and 242newsbahamas in The Bahamas.",412,748,955,8,Bahamas,Sarah Picot-Kirkby,noshoesgal,1792,,http://barefootmarketing.net/,false
"-123.11743,49.2687",Tue Jan 11 05:04:19 +0000 2022,bekind covid,,https://www.instagram.com/p/CYk89amLY0S/?utm_medium=twitter,1,1480767506751148036,,,,en,"Vancouver, British Columbia",true,,0,,,"<a href=""http://instagram.com"" rel=""nofollow"">Instagram</a>",Be kind to everyone during this difficult time ❤️#bekind #covid @ Peoplebiz Consulting Inc https://t.co/FLNNgyRIGr,https://twitter.com/kristisearle/status/1480767506751148036,Wed Apr 15 16:39:45 +0000 2009,31450065,false,Human Resources Business Strategist for people powered success!,598,367,867,20,"Vancouver, BC, CAN",Kristi Searle,kristisearle,4278,,http://www.peoplebiz.ca,false
"50.18703833,26.18027775",Tue Jan 11 11:13:58 +0000 2022,,,https://www.instagram.com/p/CYlnQwdgpwXcr0G28xOalXj4iIJ7DnCOtVhmG40/?utm_medium=twitter,0,1480860531586129921,,,,en,"العزيزية, المملكة العربية السعودية",false,,0,,,"<a href=""http://instagram.com"" rel=""nofollow"">Instagram</a>","Alhamdulillah… I can still work from home from anywhere… Demma opposition can’t get rastaman down cos Babylon system going DOWN… Rastafari ever liveth ever irie 🎶🎼🎵 @ Aziziya, Al Khobar KSA https://t.co/Xs9CYuX4St",https://twitter.com/samiai/status/1480860531586129921,Mon Jul 13 01:29:11 +0000 2009,56248674,false,"USA Ambassador's Distinguished Scholar| Professor of Intellectual Property Law | Faculty member, PMU College of Law, Al Khobar🇸🇦 @PMU_SA صامويل ساميية أندروز",2070,620,3627,8,"Al Khobar, Kingdom of Saudi Arabia","Samuel Samiai Andrews, SJD",samiai,3178,,https://scholar.google.com/citations?user=1b93h_8AAAAJ&hl=en,false
"-84.368823,33.846156",Tue Jan 11 14:10:08 +0000 2022,,,,0,1480904864842633220,,,,en,"Atlanta, GA",,,0,,,"<a href=""https://onloft.com/tweetlogix"" rel=""nofollow"">Tweetlogix</a>",I am so over this place. Their Covid precautions are nonexistent 😵‍💫,https://twitter.com/auntieashh/status/1480904864842633220,Sun Apr 10 13:56:21 +0000 2011,280030979,false,no.,11670,1393,352,13,,✨,auntieashh,199141,,,false
"-122.026252,36.97205",Tue Jan 11 11:27:48 +0000 2022,rogueandwolf gothicstyle goth gothicromance plaguedoctor plaguedoctormask pandemic apocalypse,,https://www.instagram.com/p/CYlo2Kerdb_/?utm_medium=twitter,0,1480864013240176640,,,,en,"Santa Cruz, CA",false,,0,,,"<a href=""http://instagram.com"" rel=""nofollow"">Instagram</a>","Hi! Use link in bio when ordering from Rogue + Wolf!  ➡️➡️➡️➡️➡️
AND PROMO CODE RWNEWYR22 for a discount. 
Cheers! #rogueandwolf #gothicstyle #goth #gothicromance #plaguedoctor #plaguedoctormask #pandemic #apocalypse https://t.co/1amFCvOQXK",https://twitter.com/cakencastor/status/1480864013240176640,Thu Aug 28 23:49:47 +0000 2014,2777360126,false,"Artist/Model, Gemini Vegetarian🐾🍰",6099,408,1369,17,Santa Cruz CA,Aurora Cake Bunny,cakencastor,6662,,https://onlyfans.com/beauxfeetart,false
"-2.96181216,54.4316894",Tue Jan 11 12:55:04 +0000 2022,,,https://www.instagram.com/p/CYly1MogbBx/?utm_medium=twitter,0,1480885976444645377,,,,en,"Ambleside, England",false,,0,,,"<a href=""http://instagram.com"" rel=""nofollow"">Instagram</a>","Cannot recommend @kystyamble enough

After one birthday and two mothers days in lockdown and working, I was due a special meal and this delivered on all scores 

Fantastic food and service 

🐝🐝🐝 @ Kysty https://t.co/waKrTsNFoh",https://twitter.com/Beescountrykit/status/1480885976444645377,Thu Dec 11 16:07:16 +0000 2014,2915735867,false,"A cabin on Chorley covered market selling hot and hearty lunches drinks, homemade cakes and our unique range of store products. 5 star hygiene. Call 07966097153",1128,1423,1467,28,"Chorley, Lancashire ",Bees Country Kitchen,Beescountrykit,17499,,,false
"86.60744,26.12969",Tue Jan 11 08:53:31 +0000 2022,indiafightscorona,,https://www.instagram.com/p/CYlXMCzvdkY/?utm_medium=twitter,0,1480825188182740994,,,,en,"बिहार, भारत",false,,0,,,"<a href=""http://instagram.com"" rel=""nofollow"">Instagram</a>","As India continues its fight against Corona, more than 10 lakh precautionary doses administered to healthcare workers and 60+ senior citizens with co-morbidities on the first day.

#indiafightscorona @ Supaul :: सुपौल https://t.co/SV5v5ALvnx",https://twitter.com/jansevipoltical/status/1480825188182740994,Thu Sep 09 01:10:00 +0000 2021,1435772289799258115,false,Political,1,2,20,0,"Patna, India",Virendra jansevi,jansevipoltical,422,,https://youtube.com/shorts/ic5Bfznf_sE?feature=share,false
"-0.09769393,51.52015281",Tue Jan 11 13:03:01 +0000 2022,styledbyme menswear mensstyle mensfashion city suits tailoring smart dapper work wfh,,https://www.instagram.com/p/CYlzvkKtfLR/?utm_medium=twitter,4,1480887976242475009,,,,en,"City of London, London",false,,0,,,"<a href=""http://instagram.com"" rel=""nofollow"">Instagram</a>","The very handsome @axel_hermann #styledbyme
•
Photographed by @philipsinden at the brutalist Barbican
Produced by @lifeoflinford
•
#menswear #mensstyle #mensfashion #city #suits #tailoring #smart #dapper #work #wfh https://t.co/H1zTBkQ4NA",https://twitter.com/KennyHoStylist/status/1480887976242475009,Fri Mar 04 22:36:39 +0000 2011,260935718,false,Creative & Fashion Director of ARTICLE magazine (@TheArticleMag & https://t.co/qLDdWvliNN) A SGI Buddhist & a cat lover. Instagram: @KennyHoStylist,4052,2622,561,50,London,Kenny Ho,KennyHoStylist,15006,,http://www.KennyHoStylist.com,false
"-100,40",Tue Jan 11 12:54:17 +0000 2022,,,https://www.instagram.com/p/CYlyvgQjQfj/?utm_medium=twitter,0,1480885775378128900,,,,en,"Kansas, USA",false,,0,,,"<a href=""http://instagram.com"" rel=""nofollow"">Instagram</a>","Covid cases surging again , may God help us. @ United States https://t.co/MInAMkeSju",https://twitter.com/k90channel/status/1480885775378128900,Thu Oct 13 10:43:37 +0000 2011,390026478,false,"Host K90channel News & Job Interview Tips on YouTube. 
How to videos.
Motivational Speaker.
Philanthropist.
Subscribe on YouTube.
📺Watch New Episode.",37,17,93,0,London,kunle Ologun (Steve),k90channel,1139,,http://www.youtube.com/channel/UC9EZPjrhfB3OMndDvvDkzWQ?view_as=subscriber,false
