coordinates,created_at,hashtags,media,urls,favorite_count,id,in_reply_to_screen_name,in_reply_to_status_id,in_reply_to_user_id,lang,place,possibly_sensitive,quote_id,retweet_count,retweet_id,retweet_screen_name,source,text,tweet_url,user_created_at,user_id,user_default_profile_image,user_description,user_favourites_count,user_followers_count,user_friends_count,user_listed_count,user_location,user_name,user_screen_name,user_statuses_count,user_time_zone,user_urls,user_verified
"-77.5820908,35.262204",Wed Jan 05 11:25:10 +0000 2022,,,https://www.neusenews.com/index/2022/1/5/greene-correctional-offender-dies-after-testing-positive-for-covid-19,0,1478689022851624963,,,,en,"Kinston, NC",false,,0,,,"<a href=""http://www.squarespace.com"" rel=""nofollow"">Squarespace</a>",Greene Correctional Offender Dies after Testing Positive for COVID-19  https://t.co/kzv97R431D,https://twitter.com/NeuseNews/status/1478689022851624963,Tue Apr 10 03:18:40 +0000 2018,983544768285298688,false,"Hyper-local news with no pop-ups, no AP news and no online subscription fees. No kidding! Subscribe (for free) to our Neuse Newsletter delivered daily at 7 am.",375,1363,95,7,"Kinston, NC",Neuse News,NeuseNews,9235,,https://linktr.ee/neusenews,false
"-0.10226432,51.57558519",Wed Jan 05 08:06:36 +0000 2022,,https://twitter.com/MusicNewsWeb/status/1478639051133493250/photo/1,http://Music-News.com http://dlvr.it/SGYWHc,4,1478639051133493250,,,,en,"Tottenham, London",false,,3,,,"<a href=""https://dlvrit.com/"" rel=""nofollow"">dlvr.it</a>",https://t.co/cGbkkwFHAS Wolf Alice postpone UK tour due to rise in COVID-19 cases https://t.co/Gr1DRheFdo https://t.co/lFSrneQHUU,https://twitter.com/MusicNewsWeb/status/1478639051133493250,Tue Mar 31 10:32:34 +0000 2009,27847155,false,"https://t.co/zDtI3JDr0v features #news, #reviews, #gigs, #interviews, #competitions, latest releases & #gossip. #musicnews https://t.co/2atsooDt52",23174,59056,43369,526,London,Music-News.com,MusicNewsWeb,126274,,https://www.facebook.com/musicnewsweb,false
"76.41611519,30.33500501",Wed Jan 05 09:41:15 +0000 2022,,,https://patialapolitics.com/patiala-dc-sandeep-hans-tested-covid-positive https://www.instagram.com/p/CYV_4Z8hjtA/?utm_medium=twitter,0,1478662869747216389,,,,en,"पटियाला, भारत",true,,0,,,"<a href=""http://instagram.com"" rel=""nofollow"">Instagram</a>","Patiala DC Sandeep Hans tested Covid Positive🔴👇

https://t.co/T06xipXQPa @ Patiala Politics https://t.co/NycnXen4Z6",https://twitter.com/patialapolitics/status/1478662869747216389,Tue Jun 14 07:20:13 +0000 2016,742617624886935553,false,Patiala Politics will give update about Patiala city,14,701,469,3,"पटियाला, भारत",Patiala Politics,patialapolitics,31592,,http://www.patialapolitics.com,false
"103.78,1.43",Wed Jan 05 11:32:52 +0000 2022,,,https://www.channelnewsasia.com/singapore/singapore-may-tighten-covid-19-measures-if-spread-amplified-unnecessary-risks-lawrence-wong-2416736?cid=internal_sharetool_androidphone_05012022_cna,0,1478690960720625668,,,,en,"北区, 新加坡",true,,0,,,"<a href=""http://www.samruston.co.uk"" rel=""nofollow"">Flamingo for Android</a>","Let me paraphrase: CNY restrictions coming soon
 https://t.co/AMAcgLWdxi",https://twitter.com/ecownomics/status/1478690960720625668,Wed Sep 02 04:11:39 +0000 2009,70879081,false,You have 2 cows. You sell them to me and buy my bull.,567,436,542,3,Singapore,Yello yello dirty fello,ecownomics,37355,,,false
"-0.12485951,51.50538967",Wed Jan 05 08:50:03 +0000 2022,SethMeyers COVID19,,http://dlvr.it/SGYcCY,2,1478649988833968133,,,,en,"London, England",false,,1,,,"<a href=""https://dlvrit.com/"" rel=""nofollow"">dlvr.it</a>","TV host #SethMeyers contracts #COVID19, show dark this week https://t.co/hOqOCOmC3f",https://twitter.com/BritishHeraldUK/status/1478649988833968133,Wed Feb 17 17:49:42 +0000 2010,115123902,false,Where Britain Meets the World® | The Official handle of #britishherald,350,133883,607,283,"London, United Kingdom",British Herald,BritishHeraldUK,57106,,http://www.britishherald.com,false
"76.70649,30.6927",Wed Jan 05 11:02:01 +0000 2022,PanchkulaUpdate COVID Panchkula ChandigarhHelpline,,https://www.instagram.com/p/CYWJIDLv_lR/?utm_medium=twitter,0,1478683197672243203,,,,en,"मोहाली, भारत",false,,0,,,"<a href=""http://instagram.com"" rel=""nofollow"">Instagram</a>","#PanchkulaUpdate 

171 #COVID cases reported in #Panchkula today 

Join #ChandigarhHelpline ☑️ for latest updates @ Chandigarh Helpline https://t.co/XXcI86YFiK",https://twitter.com/chd_helpline/status/1478683197672243203,Sat Oct 26 18:22:41 +0000 2013,2154651406,false,"The Page will share the local news from Chandigarh City.
The content is copied from the Social Media.
Help Others ��",315,260,100,0,"Chandigarh, India",Chandigarh Helpline,chd_helpline,3145,,https://www.facebook.com/chdhelpline/,false
"55.284111,25.220532",Wed Jan 05 13:46:39 +0000 2022,,,https://www.swarmapp.com/c/b1vWLqCmvfl,0,1478724627476189185,,,,en,"دبي, الامارات العربية المتحدة",false,,0,,,"<a href=""http://foursquare.com"" rel=""nofollow"">Foursquare</a>",I'm at Covid-19 DHA Vaccination Center in Dubai https://t.co/k0IS7QHDze,https://twitter.com/yoxefalfonso/status/1478724627476189185,Sun May 09 12:32:38 +0000 2010,141926662,false,"What you want is what you won’t get, and what you don’t want is what you will get | ig• #snapchat yoxefalfonso | 1 of the 15M",4209,1759,271,9,"Dubai, United Arab Emirates",YOXEF,yoxefalfonso,57421,,,false
"-73.56726563,45.63697547",Wed Jan 05 09:05:03 +0000 2022,,,http://BelfastTelegraph.co.uk http://dlvr.it/SGYf1G,0,1478653761195184128,,,,en,"Montréal, Québec",false,,1,,,"<a href=""https://dlvrit.com/"" rel=""nofollow"">dlvr.it</a>","Fighting Stigma : More than ever before, it really is 'OK not to be OK' — https://t.co/eb8gWzsYz7: For the last decade, the conversation on reducing the stigma around mental health has come a long way. A benefit of the pandemic has been an ... https://t.co/ftUJUvmPE6",https://twitter.com/stigmabase/status/1478653761195184128,Wed Sep 01 21:06:16 +0000 2010,185789961,false,Dedicated to Education | Keeping up-to-date on global exclusion — Serving the truth — Stigmabase is a canadian internet non-profit Initiative. Founded in 2010,0,963,689,71,Worldwide,STIGMABASE | EDU,stigmabase,820501,,https://www.stigmabase.org/,false
"116.52099609,40.01709786",Wed Jan 05 07:11:11 +0000 2022,,,http://dlvr.it/SGYPBw,0,1478625107404681218,,,,en,"北京, 中华人民共和国",false,,1,,,"<a href=""https://dlvrit.com/"" rel=""nofollow"">dlvr.it</a>","ZHNR — In locked down Chinese city, some complain food hard to get: Residents of the Chinese city of Xi'an are straining under a strict coronavirus lockdown, with some complaining of difficulties ...  

View article... https://t.co/GRscFpkiyL",https://twitter.com/StigmabaseU/status/1478625107404681218,Tue Oct 26 15:04:54 +0000 2010,208056970,false,Asia — भारत  — Türkçe — Čeština — ελληνικά | Keeping up-to-date on global exclusion — Stigmabase is a canadian internet non-profit Initiative,0,2528,2405,117,WORLDWIDE,Stigmabase | UN,StigmabaseU,1607149,,https://www.stigmabase.org/,false
"-6.26174338,53.34411666",Wed Jan 05 11:23:05 +0000 2022,,https://twitter.com/RebelDublin/status/1478688499888885762/photo/1,http://dlvr.it/SGZ0f9,0,1478688499888885762,,,,en,"Dublin City, Ireland",false,,1,,,"<a href=""https://dlvrit.com/"" rel=""nofollow"">dlvr.it</a>","The Best &amp; Worst Science Fiction During The Pandemic Lockdown: Two years later, and here we are. More restrictions are in place, pubs are closing early, off-licence alcohol prices just 

Read more » 

The post The Best &amp; Worst Science Fiction During The… https://t.co/m8C4jEbxSf https://t.co/JawrfZsFJ3",https://twitter.com/RebelDublin/status/1478688499888885762,Tue Feb 23 15:00:23 +0000 2016,702145987217899520,false,"Discover all about our beloved Dublin from Ireland's history to tourist attractions... humorously.
Use the Hashtag #RebelDublin",34,276,53,14,"Dublin City, Ireland",Rebel Dublin,RebelDublin,8601,,http://rebeldublin.ie,false
"100.65507813,13.86200131",Wed Jan 05 09:17:05 +0000 2022,,,http://dlvr.it/SGYgP8,0,1478656791290384384,,,,en,"ท่าแร้ง, ประเทศไทย",false,,1,,,"<a href=""https://dlvrit.com/"" rel=""nofollow"">dlvr.it</a>","HKNR — Hong Kong vaccine bubble roll-out for restaurants, leisure venues and schools ...: Hong Kong's plan to bar those who have not been vaccinated against Covid-19 from all restaurants, leisure venues and schools will be postponed ...  

View… https://t.co/kj6X6hxKPp",https://twitter.com/StigmabaseU/status/1478656791290384384,Tue Oct 26 15:04:54 +0000 2010,208056970,false,Asia — भारत  — Türkçe — Čeština — ελληνικά | Keeping up-to-date on global exclusion — Stigmabase is a canadian internet non-profit Initiative,0,2528,2405,117,WORLDWIDE,Stigmabase | UN,StigmabaseU,1607149,,https://www.stigmabase.org/,false
"126.44268036,37.46368606",Wed Jan 05 05:18:45 +0000 2022,StreetDanceGirlsFighter,,https://www.instagram.com/p/CYVh10bvkGp/?utm_medium=twitter,1,1478596810168049664,,,,en,대한민국 옹진군,false,,0,,,"<a href=""http://instagram.com"" rel=""nofollow"">Instagram</a>","RM ig story update 
Namjoon Instagram 22.01.05

🐨: I missed the live broadcast I’ll watch it tomorrow for sure damn…
Everyone you all worked hard. Thanks to you guys, my quarantine was fun #StreetDanceGirlsFighter https://t.co/58OL9zGQX8",https://twitter.com/Nanoraonanika/status/1478596810168049664,Tue Jan 07 18:05:42 +0000 2020,1214608884549091328,false,love your life,13991,18,68,0,India,BTS_PURPLE_UNIVERSE,Nanoraonanika,931,,,false
"36.821945,-1.292066",Wed Jan 05 07:40:42 +0000 2022,,,,0,1478632532379844608,KenyansOnReddit,1478632531335553027,1269598733878079500,en,"Nairobi, Kenya",,,0,,,"<a href=""https://twitter.com/hermoand"" rel=""nofollow"">Kenyans On Reddit</a>","to pay for the corruption cases properly, given the most affected lot is the workforce that comprises youth in this country, socially and economically by the pandemic. PPEs were to be procured in the heat of 2019 and 2020 but the procurement - [3/10]",https://twitter.com/KenyansOnReddit/status/1478632532379844608,Sun Jun 07 11:55:21 +0000 2020,1269598733878079488,false,"Come join your fellow Kenyans™ on Reddit 👉 https://t.co/jgE8q6ov1E 

- #TopReply
- #rKenyaModLog
- #RemovedByMods
- #DeletedByAuthor
- #rKenyaVideo",796,254,17,3,Nairobi,Kenyans On Reddit 🇰🇪,KenyansOnReddit,44993,,https://reddit.com/r/kenya,false
"81.5625,7.01366793",Wed Jan 05 07:47:48 +0000 2022,,,https://www.instagram.com/p/CYVy5Tboeqo/?utm_medium=twitter,0,1478634320524984320,,,,en,Sri Lanka,false,,0,,,"<a href=""http://instagram.com"" rel=""nofollow"">Instagram</a>","This! Our first review after the two year tyranny of Covid! Team effort duly rewarded. @ TANGAROA, THE TEAK HOUSE https://t.co/hW4vyoSMf1",https://twitter.com/teakhouse/status/1478634320524984320,Mon Apr 20 16:05:34 +0000 2009,33562707,false,One of Sri Lanka's South Coast’s most romantic and serene villa hideaways,0,46,44,0,"Tangalle, Sri Lanka",The Teak House,teakhouse,128,,http://www.teak-house-tangalle.co.uk,false
"-90.070864,29.948479",Wed Jan 05 10:53:59 +0000 2022,,,https://www.instagram.com/p/CYWIKLDA9bB/?utm_medium=twitter,0,1478681176835559424,,,,en,"New Orleans, LA",false,,0,,,"<a href=""http://instagram.com"" rel=""nofollow"">Instagram</a>","Profiting from the vaccine @ New Orleans, Louisiana https://t.co/hKnQdCxAtg",https://twitter.com/hookdahustla/status/1478681176835559424,Thu Dec 03 11:51:22 +0000 2015,4360945223,false,,259,78,533,1,"New Orleans, LA",Kevin Hookfin,hookdahustla,4789,,,false
"-122.1982489,47.3929453",Wed Jan 05 05:02:09 +0000 2022,,,https://twitter.com/NidalAllis/status/1478066535172390921,2,1478592634356592647,,,,en,"East Hill-Meridian, WA",false,1478066535172390921,0,,,"<a href=""http://klinkerapps.com"" rel=""nofollow"">Talon Android</a>","Hells, just to be sure, I'd agree to a MONTH of true lockdown if it would truly end this pandemic.  https://t.co/gvF7ifEkOs",https://twitter.com/SDWolf/status/1478592634356592647,Sun Mar 29 19:54:55 +0000 2009,27490542,false,"A greymuzzle wolf therian/furry in the Seattle area. Optician, Casual Gamer, STEM Enthusiast, Trekker, Progressive, Nerd. Cis/Gay/Male, He/Him, 🔞, #BLM & #ACAB",69356,709,371,83,"Kent, WA, USA",Shadow D. Wolf θΔ 🏳️‍🌈🐺 (💉x3),SDWolf,167039,,http://shadow.lupinesystems.net/,false
"-77.0250174,38.91688188",Wed Jan 05 12:00:22 +0000 2022,,,https://www.instagram.com/p/CYWPzYmufZv/?utm_medium=twitter,0,1478697881850630145,,,,en,"Washington, DC",false,,0,,,"<a href=""http://instagram.com"" rel=""nofollow"">Instagram</a>","Celebrating @dcwannahaveakiki’s grand opening weekend with @insta_mitch82. Congrats to @kjfedak_dc! Opening a brand new establishment during a worldwide pandemic is not an easy feat. Ya done good, kid. 👏🏼 @ Kiki https://t.co/i8egZnithg",https://twitter.com/HoekedOnPhonics/status/1478697881850630145,Fri Feb 27 16:22:03 +0000 2009,22156288,false,"Formerly: @Eventbrite, @TheDemocrats, @ORDems, @BarackObama & @OFA | Now at the sometimes incongruous intersection of political consulting & teaching yoga",13482,869,4984,17,"Washington, D.C.",Alex Hoekstra,HoekedOnPhonics,5966,,,false
"116.52099609,40.01709786",Wed Jan 05 08:13:10 +0000 2022,,,http://dlvr.it/SGYX3Y,0,1478640704091947009,,,,en,"北京, 中华人民共和国",false,,1,,,"<a href=""https://dlvrit.com/"" rel=""nofollow"">dlvr.it</a>","ZHNR — Over 100,000 hospitalized with COVID-19 in U.S. for 1st time in 4 months: States are also reporting surges in the number of children hospitalized, and official data last week showed that pediatric hospital admissions ...  

View article... https://t.co/xY3ZRRHqSS",https://twitter.com/StigmabaseU/status/1478640704091947009,Tue Oct 26 15:04:54 +0000 2010,208056970,false,Asia — भारत  — Türkçe — Čeština — ελληνικά | Keeping up-to-date on global exclusion — Stigmabase is a canadian internet non-profit Initiative,0,2528,2405,117,WORLDWIDE,Stigmabase | UN,StigmabaseU,1607149,,https://www.stigmabase.org/,false
"39.150318,21.670473",Wed Jan 05 13:01:14 +0000 2022,,,https://www.swarmapp.com/c/hmmEYvz7VBq,0,1478713198891126785,,,,en,"جدة, المملكة العربية السعودية",false,,0,,,"<a href=""https://www.swarmapp.com"" rel=""nofollow"">Foursquare Swarm</a>","I'm at COVID-19 Vaccine Center in Jeddah, Makkah https://t.co/fqXvsj15jj",https://twitter.com/505usernotfound/status/1478713198891126785,Thu Jun 16 15:28:58 +0000 2016,743465397685465088,false,i read the news here,5428,322,60,4,Jeddah,A,505usernotfound,21324,,,false
"-99.68322055,31.168839",Wed Jan 05 14:30:21 +0000 2022,,,https://natstat.com/nhl/transactions,0,1478735626388262918,,,,en,"Texas, USA",false,,0,,,"<a href=""https://natstat.com"" rel=""nofollow"">National Statistical TS</a>","➡️ BUFFALO SABRES — Placed Fs Anders Bjork, Peyton Krebs and Alex Tuch in the COVID-19 protocol.
https://t.co/IMCRjwOfMt",https://twitter.com/NationalStat/status/1478735626388262918,Fri Oct 24 02:23:04 +0000 2008,16941578,false,"25 data services for basketball, baseball, hockey and soccer. Web, API, spreadsheets. Since 2007. Starting at $9.99/month: https://t.co/9TMlJ72P1U Contact: https://t.co/WbAFZKxX30",2647,5035,5550,164,"Houston, TX",National Statistical,NationalStat,71957,,https://natstat.com,false
"-103.1965,34.4191",Wed Jan 05 13:41:18 +0000 2022,,,https://www.instagram.com/p/CYWbWo3LERw/?utm_medium=twitter,0,1478723282979495938,,,,en,"Clovis, NM",false,,0,,,"<a href=""http://instagram.com"" rel=""nofollow"">Instagram</a>","Just curious...
Are we having cold and flu season in 2022 or has COVID postponed it again? @ Clovis, New Mexico https://t.co/ubyqTylfA7",https://twitter.com/LoveDrNutt/status/1478723282979495938,Fri Jun 29 23:30:55 +0000 2012,622327874,false,"Clinical consultant, best selling author on relationships, motivational speaker and country boy.  Husband and father, family first.",1013,258,154,24,"Clovis, NM","Justin Nutt, LCSW",LoveDrNutt,3021,,http://www.arktherapy.org,false
"-73.6197588,45.51950705",Wed Jan 05 12:57:07 +0000 2022,,,http://dlvr.it/SGZGMg,0,1478712164076515330,,,,en,"Montréal, Québec",false,,0,,,"<a href=""https://dlvrit.com/"" rel=""nofollow"">dlvr.it</a>","TW : 2021 Top Ten (Real) Conspiracies: ...Passports has nothing to do with your health and everything to do with exclusion, discrimination, and social control. Vaccines themselves were only a means to corral the population into a Vaccine Passport trap… https://t.co/LH0GfxDSXo",https://twitter.com/stigmabase/status/1478712164076515330,Wed Sep 01 21:06:16 +0000 2010,185789961,false,Dedicated to Education | Keeping up-to-date on global exclusion — Serving the truth — Stigmabase is a canadian internet non-profit Initiative. Founded in 2010,0,963,689,71,Worldwide,STIGMABASE | EDU,stigmabase,820501,,https://www.stigmabase.org/,false
"-74.0647,40.7114",Wed Jan 05 15:18:47 +0000 2022,covid LVNews NJRealtor NJRealtors newjerseyrealtor wednesday,,https://www.instagram.com/p/CYWmgw5laPa/?utm_medium=twitter,1,1478747813408391168,,,,en,"Jersey City, NJ",false,,0,,,"<a href=""http://instagram.com"" rel=""nofollow"">Instagram</a>","That’s a shame 😄
#covid #LVNews #NJRealtor #NJRealtors #newjerseyrealtor #wednesday @ Jersey City, New Jersey https://t.co/XtMBAAqCw6",https://twitter.com/OurRealtorLV/status/1478747813408391168,Sat May 14 01:24:30 +0000 2016,731294079766630400,false,"Realtor Associate with Homes By Preferred Realty, located at 453 Central Ave Jersey City NJ 07307. Need to buy, sell, or lease? Call (201) 653-3948",11650,196,560,8,"Jersey City, NJ",Luis Villacres®,OurRealtorLV,4134,,https://www.realtor.com/realestateagents/Luis-Villacres_Jersey-City_NJ_2977964_74208141#/,false
"-73.56726563,45.63697547",Wed Jan 05 10:03:34 +0000 2022,,,http://dlvr.it/SGYnFr,0,1478668487065178113,,,,en,"Montréal, Québec",false,,1,,,"<a href=""https://dlvrit.com/"" rel=""nofollow"">dlvr.it</a>","Fighting Stigma : CNN's Chris Cillizza: Omicron Removed the 'Stigma' of Coronavirus Infection — Breitbart: CNN political reporter Chris Cillizza believes the omicron variant has ushered in a new era of the coronavirus pandemic, relegating the “stigma” ... https://t.co/UmzgIKrpM1",https://twitter.com/stigmabase/status/1478668487065178113,Wed Sep 01 21:06:16 +0000 2010,185789961,false,Dedicated to Education | Keeping up-to-date on global exclusion — Serving the truth — Stigmabase is a canadian internet non-profit Initiative. Founded in 2010,0,963,689,71,Worldwide,STIGMABASE | EDU,stigmabase,820501,,https://www.stigmabase.org/,false
"151.21416016,-33.81345207",Wed Jan 05 05:02:33 +0000 2022,,,http://dlvr.it/SGY8nv,0,1478592732717215744,,,,en,"Sydney, New South Wales",false,,0,,,"<a href=""https://dlvrit.com/"" rel=""nofollow"">dlvr.it</a>","AZNR — Blood on their hands': Vulnerable communities fall victim to COVID-19: “I think it's just disgusting what's been going on in Australia. “The Aboriginal people believe it, and so do people in Papua New Guinea, ...  

View article... https://t.co/rolKtIUwp1",https://twitter.com/StigmabaseO/status/1478592732717215744,Thu Apr 29 13:56:48 +0000 2010,138418838,false,Americas — United Kingdom  | Keeping up-to-date on global exclusion — Stigmabase is a canadian internet non-profit Initiative. Founded in 2010,0,4143,3742,262,Americas | United Kingdom,Stigmabase | ORG,StigmabaseO,1828882,,https://www.stigmabase.org/,false
"-4.629734,54.08989",Wed Jan 05 09:02:09 +0000 2022,coronavirus iom coronaupdate,,https://netc.im/Covid-19,0,1478653031965204481,,,,en,"Ballasalla, Isle of Man",false,,0,,,"<a href=""http://www.netcetera.co.uk"" rel=""nofollow"">IOM</a>","Coronavirus Daily Update: As at 04 Jan 2022, in the Isle of Man there have been 16975 confirmed cases. #coronavirus #iom #coronaupdate https://t.co/WNfsczfk7J",https://twitter.com/iom/status/1478653031965204481,Mon Aug 27 14:51:27 +0000 2007,8463142,false,Local news for the Isle of Man - brought to you by Netcetera Managed Hosting,6,4427,1304,70,Isle of Man,Isle of Man,iom,36022,,https://netcetera.uk,false
"-78.54611111,35.38222222",Wed Jan 05 13:57:03 +0000 2022,,,https://www.instagram.com/p/CYWdI_mOSaA/?utm_medium=twitter,0,1478727246936485893,,,,en,"Benson, NC",false,,0,,,"<a href=""http://instagram.com"" rel=""nofollow"">Instagram</a>","Welcome Back Students!!! 

Parents this is just a reminder that BMS Semester 1 Awards will be next Friday Jan. 14th,2022 !
Times are specific to grade level! 

Please make sure if you attend that you wear a mask! https://t.co/yUABWsepVJ",https://twitter.com/benson_middle/status/1478727246936485893,Wed Jun 29 17:10:21 +0000 2016,748201955256864768,false,Official Twitter page of the Benson Middle School Phantoms!,2616,504,641,5,"Benson, NC",BensonMiddleSchool,benson_middle,2374,,,false
"13.1199934,52.381905",Wed Jan 05 14:43:56 +0000 2022,nowplaying FifthHarmony Prenzlau Brandenburg GER,,,0,1478739043089367050,,,,en,"Potsdam, Deutschland",,,0,,,"<a href=""http://www.bbradio.de"" rel=""nofollow"">BB RADIO Music App</a>",#nowplaying #FifthHarmony ~ Fifth Harmony | Work From Home ||| BB RADIO - In #Prenzlau #Brandenburg #GER auf 102.1,https://twitter.com/_BB_RADIO_MUSIC/status/1478739043089367050,Tue Jun 29 10:26:00 +0000 2010,160874621,false,BB RADIO is one of the leading radio stations in Berlin and Brandenburg in Germany.,2,2587,1711,176,"Germany, Potsdam",BB RADIO Playlist,_BB_RADIO_MUSIC,995963,,http://www.bbradio.de,false
"-0.17988195,51.562662",Wed Jan 05 11:46:34 +0000 2022,morningcommute onwednesdaywesmashthepatriarchy stillonholiday sorting walking covid19 coronavirus London,,https://www.instagram.com/p/CYWNZ_UBTLm/?utm_medium=twitter,1,1478694408686088196,,,,en,"Camden Town, London",false,,0,,,"<a href=""http://instagram.com"" rel=""nofollow"">Instagram</a>","Yes I am still smashing the patriarchy!

#morningcommute #onwednesdaywesmashthepatriarchy #stillonholiday #sorting #walking #covid19 #coronavirus #London @ Hampstead, United Kingdom https://t.co/YDhmWDF9SG",https://twitter.com/beecee/status/1478694408686088196,Thu Apr 24 08:00:38 +0000 2008,14508711,false,A cautionary tale. Former Writer on 06:37 train to Maidstone. Award winning romcom author. Head of Storytelling at W2O. Will write for gig tickets and/or boots,25092,2909,2996,142,London/Tumblr,Brigid Coady 🌈,beecee,81608,,http://www.brigidcoady.com,false
"-63.58387,44.65104",Wed Jan 05 14:17:23 +0000 2022,safetyfirst choices besafe ourdecision florist orderinline neville,,https://www.instagram.com/p/CYWfeuQLGEa/?utm_medium=twitter,3,1478732361487556611,,,,en,"Halifax, Nova Scotia",false,,1,,,"<a href=""http://instagram.com"" rel=""nofollow"">Instagram</a>","We do not have Covid, and we certainly don’t want it either.  #safetyfirst #choices #besafe #ourdecision #florist #orderinline @givelovingly #neville @ My Mother's Bloomers https://t.co/JBPLPKYfTJ",https://twitter.com/levelneville/status/1478732361487556611,Sat May 16 14:50:12 +0000 2009,40475478,false,Writer/Speaker/Floral Designer/Floral Judge...Owner of My Mother's Bloomers in Halifax since 1992. https://t.co/CX3VkSG7iX,2343,1443,612,23,"Halifax, Nova Scotia",Neville at Bloomers,levelneville,6631,,http://www.mymothersbloomers.com,false
"-1.98527913,50.71538734",Wed Jan 05 06:18:34 +0000 2022,,https://twitter.com/clarehicksPE/status/1478611862727974914/photo/1,http://dlvr.it/SGYHmg,0,1478611862727974914,,,,en,"Poole, England",false,,0,,,"<a href=""https://dlvrit.com/"" rel=""nofollow"">dlvr.it</a>","Covid: Exams need to be Covid-safe and fair, union says https://t.co/zADlF2upKc Via @bbceducation https://t.co/VXAcgLuJ4t",https://twitter.com/clarehicksPE/status/1478611862727974914,Thu Jan 05 10:55:45 +0000 2012,455659658,false,Head of Sixth Form | Leadership | Teaching & Learning | Curriculum | Quality | Strategic Management | Raising Achievement | Partnerships | Pastoral | NQT Mentor,953,1621,559,127,"Poole, England",Clare Hicks,clarehicksPE,21206,,,false
"76.41611519,30.33500501",Wed Jan 05 12:40:53 +0000 2022,,,https://patialapolitics.com/covid-blastnear-600-case-in-patiala-5-january/ https://www.instagram.com/p/CYWUcLRhA3m/?utm_medium=twitter,0,1478708078799470595,,,,en,"पटियाला, भारत",true,,0,,,"<a href=""http://instagram.com"" rel=""nofollow"">Instagram</a>","Covid Blast:Near 600 case in Patiala 5 January🔴👇

https://t.co/RjTwmC6XxN @ Patiala Politics https://t.co/W7I5Q3gueu",https://twitter.com/patialapolitics/status/1478708078799470595,Tue Jun 14 07:20:13 +0000 2016,742617624886935553,false,Patiala Politics will give update about Patiala city,14,701,469,3,"पटियाला, भारत",Patiala Politics,patialapolitics,31592,,http://www.patialapolitics.com,false
"116.52099609,40.01709786",Wed Jan 05 09:17:15 +0000 2022,,,http://dlvr.it/SGYgZB,0,1478656830179995649,,,,en,"北京, 中华人民共和国",false,,1,,,"<a href=""https://dlvrit.com/"" rel=""nofollow"">dlvr.it</a>","ZHNR — How China's 'zero COVID' pursuit is stoking anger, public shaming: How China's 'zero COVID' pursuit is stoking anger, public shaming ... goal,"" said Wang Yaqiu, senior China researcher at Human Rights Watch (HRW).  

View article... https://t.co/qIfW1uRG2R",https://twitter.com/StigmabaseU/status/1478656830179995649,Tue Oct 26 15:04:54 +0000 2010,208056970,false,Asia — भारत  — Türkçe — Čeština — ελληνικά | Keeping up-to-date on global exclusion — Stigmabase is a canadian internet non-profit Initiative,0,2528,2405,117,WORLDWIDE,Stigmabase | UN,StigmabaseU,1607149,,https://www.stigmabase.org/,false
