coordinates,created_at,hashtags,media,urls,favorite_count,id,in_reply_to_screen_name,in_reply_to_status_id,in_reply_to_user_id,lang,place,possibly_sensitive,quote_id,retweet_count,retweet_id,retweet_screen_name,source,text,tweet_url,user_created_at,user_id,user_default_profile_image,user_description,user_favourites_count,user_followers_count,user_friends_count,user_listed_count,user_location,user_name,user_screen_name,user_statuses_count,user_time_zone,user_urls,user_verified
"-117.868184,33.601926",Tue Jan 11 05:04:44 +0000 2022,,,https://www.instagram.com/mitchellmaldo/p/CYk9AZNr9Bw/?utm_medium=twitter,0,1480767609465450497,,,,en,"Newport Beach, CA",false,,0,,,"<a href=""http://instagram.com"" rel=""nofollow"">Instagram</a>",beach day with the bambinos. @ Corona del Mar https://t.co/6VGhkkp3K7,https://twitter.com/MitchellMaldo/status/1480767609465450497,Sat Jul 02 21:58:56 +0000 2011,328179995,false,Husband. Father. Producer. (@housebelow) Musician. (@theneverclaim ) Coffee lover.           || lead a quiet life and work with your hands ||,583,871,979,18,"Boise, ID",Matchell,MitchellMaldo,8434,,http://housebelowproductions.com,false
"-73.56725453,45.75975883",Tue Jan 11 11:42:12 +0000 2022,,,http://BelfastTelegraph.co.uk http://dlvr.it/SGw1Jv,0,1480867636896354304,,,,en,"Mascouche, Québec",false,,0,,,"<a href=""https://dlvrit.com/"" rel=""nofollow"">dlvr.it</a>","Fighting Stigma: Mandatory vaccines could face constitutional challenge – legal expert — https://t.co/RpoY1xBrmG: However, such a move could face huge challenges as the Constitution protects bodily integrity and autonomy and medical decision making. The… https://t.co/68INAVkSzg",https://twitter.com/StigmabaseN/status/1480867636896354304,Wed Sep 15 15:55:47 +0000 2010,191092262,false,Ireland — Scotland — Inuit —  Svenska  | Keeping up-to-date on global exclusion — Stigmabase is a canadian internet non-profit Initiative,0,1610,1297,111,Ireland | Scotland | Inuit | Skandinavien,Stigmabase | NORDIC,StigmabaseN,952258,,https://www.stigmabase.org/,false
"46.613463,24.715637",Tue Jan 11 14:25:31 +0000 2022,,,https://www.swarmapp.com/c/dDkDjl1Nogd,0,1480908738919866369,,,,en,"الرياض, المملكة العربية السعودية",false,,0,,,"<a href=""http://foursquare.com"" rel=""nofollow"">Foursquare</a>",I'm at KKUH Covid-19 Drive-Thru Screening Program in Riyadh https://t.co/Wz6dNzjNwj,https://twitter.com/SFT_150/status/1480908738919866369,Fri Jun 01 00:17:43 +0000 2012,596036160,false,اللهم اتم علينا امورنا بكل خير♥️,487,164,232,6,Riyadh,SFT,SFT_150,10122,,,false
"-4.629734,54.08989",Tue Jan 11 09:01:56 +0000 2022,coronavirus iom coronaupdate,,https://netc.im/Covid-19,0,1480827305295552512,,,,en,"Ballasalla, Isle of Man",false,,0,,,"<a href=""http://www.netcetera.co.uk"" rel=""nofollow"">IOM</a>","Coronavirus Daily Update: As at 10 Jan 2022, in the Isle of Man there have been 18701 confirmed cases. #coronavirus #iom #coronaupdate https://t.co/WNfsczfk7J",https://twitter.com/iom/status/1480827305295552512,Mon Aug 27 14:51:27 +0000 2007,8463142,false,Local news for the Isle of Man - brought to you by Netcetera Managed Hosting,6,4427,1304,70,Isle of Man,Isle of Man,iom,36022,,https://netcetera.uk,false
"-80.7312945,43.1449674",Tue Jan 11 05:00:49 +0000 2022,,,https://gocamp.pro/day-camp-pod/from-the-mouth-of-babes,0,1480766626836402181,,,,en,"Woodstock, Ontario",false,,0,,,"<a href=""http://www.squarespace.com"" rel=""nofollow"">Squarespace</a>",From the Mouth of Babes - The Pandemic Camp Counsellor Experience - with Ashley Whittington and Justin Pritikin - The Day Camp Pod #66  https://t.co/KtdtUQl2n2,https://twitter.com/gocamppro/status/1480766626836402181,Sat Jun 27 16:28:50 +0000 2009,51481782,false,Go Camp Pro exists to be the BEST possible resource to the camp community so that they can help make summer camp a priority for EVERY family.,791,3676,2520,330,"Ontario, Canada",GoCampPro,gocamppro,14947,,http://gocamp.pro,false
"-0.12485951,51.50538967",Tue Jan 11 06:14:03 +0000 2022,Omicronspikes Mexicanpresident,,http://dlvr.it/SGvBPH,0,1480785056884953091,,,,en,"London, England",false,,1,,,"<a href=""https://dlvrit.com/"" rel=""nofollow"">dlvr.it</a>","#Omicronspikes, #Mexicanpresident calls it “a little COVID” https://t.co/hepatcNtFW",https://twitter.com/BritishHeraldUK/status/1480785056884953091,Wed Feb 17 17:49:42 +0000 2010,115123902,false,Where Britain Meets the World® | The Official handle of #britishherald,350,133883,607,283,"London, United Kingdom",British Herald,BritishHeraldUK,57106,,http://www.britishherald.com,false
"21.008537,52.232312",Tue Jan 11 17:41:42 +0000 2022,Business vaccine fastcompany,,http://tinyurl.com/y6oes96f,0,1480958108939833347,,,,en,"Warszawa, Polska",false,,0,,,"<a href=""https://tapbots.com/tweetbot/"" rel=""nofollow"">Twitter for iPhone 12 Pro Max </a>",#Business United Airlines just shared 1 statistic that proves #vaccine mandates save lives https://t.co/W2bEIWQTJ1 #fastcompany,https://twitter.com/pidybi/status/1480958108939833347,Sat Mar 30 17:25:49 +0000 2013,1316862031,false,🤷‍♂️,219,569,590,250,Poland 🌍👈,𝔓𝔦𝔬𝔱𝔯,pidybi,633666,,,false
"-89.5160742,34.3737247",Tue Jan 11 17:29:10 +0000 2022,eatlikeyoumeanit wearamask getvaxxed getboostered,,https://www.instagram.com/p/CYmSMoCuWgN/?utm_medium=twitter,0,1480954952054943750,,,,en,"Oxford, MS",false,,0,,,"<a href=""http://instagram.com"" rel=""nofollow"">Instagram</a>",Got lunch? #eatlikeyoumeanit #wearamask😷 please. #getvaxxed #getboostered @ The New Oxford Canteen https://t.co/ivVgJ9xZlx,https://twitter.com/chefcorbinevans/status/1480954952054943750,Wed Apr 30 02:55:48 +0000 2008,14595086,false,Comfort the disturbed. Disturb the comfortable.,31043,652,590,20,"Oxford, MS",corbin evans,chefcorbinevans,10770,,http://www.oxfordcanteen.com,false
"-0.99609,53.21285",Tue Jan 11 19:58:30 +0000 2022,,,https://www.instagram.com/p/CYmjR8_JJMK/?utm_medium=twitter,0,1480992533547466752,,,,en,"Ollerton, England",false,,0,,,"<a href=""http://instagram.com"" rel=""nofollow"">Instagram</a>","Everyday is a new 
Beginning
Set your intentions 
To achieve all @ Working From Home https://t.co/k2WxIgyPpf",https://twitter.com/chobbs424/status/1480992533547466752,Sat Oct 25 20:02:04 +0000 2014,2877247718,false,"I like to travel,Mindset ,Family Time, Coach on Marketing Strategy's, #homebusiness, Use Social Media for free leads, Lead gen, Sales  https://t.co/9jQ1vcotTL",1275,1850,1787,185,Washington,Christie Hobbs,chobbs424,12440,,http://bit.ly/2JUzx29,false
"-74.0794,4.5997",Tue Jan 11 16:17:32 +0000 2022,colombiacalling podcast Colombia politics journalism covid_19,,https://www.instagram.com/p/CYmJ_99LQBv/?utm_medium=twitter,0,1480936927926931458,Emily,,764464,en,"Bogotá, D.C., Colombia",false,,0,,,"<a href=""http://instagram.com"" rel=""nofollow"">Instagram</a>","@emily.h.h and I have taken 10 questions from you the listeners of the #colombiacalling #podcast with which to kick start 2022. 

We cover #Colombia’s #politics, #journalism, #covid_19 and more. Tune in! https://t.co/laF6AZmKsk",https://twitter.com/CasaAmarilla/status/1480936927926931458,Thu May 14 19:48:34 +0000 2009,40071672,false,"@ColombiaCalling podcast https://t.co/dWzhknmdiG, journo, hotelier. Opinions my own. PhD #watfordfc",80852,7006,6635,269,"Mompos and Bogota, Colombia",Richard McColl,CasaAmarilla,83344,,http://www.richardmccoll.com,false
"21.008541,52.232419",Tue Jan 11 19:20:32 +0000 2022,China,,http://rt.com/news/545737-veritas-fauci-funded-covid/,0,1480982980889821184,,,,en,"Warszawa, Polska",false,,0,,,"<a href=""https://tapbots.com/tweetbot/"" rel=""nofollow"">Twitter for iPhone 12 Pro Max </a>",New documents allege Fauci funded gain - of - function research in #China https://t.co/I2WLsCBqJ3,https://twitter.com/pidybi/status/1480982980889821184,Sat Mar 30 17:25:49 +0000 2013,1316862031,false,🤷‍♂️,219,569,590,250,Poland 🌍👈,𝔓𝔦𝔬𝔱𝔯,pidybi,633666,,,false
"-84.5603,43.3504",Tue Jan 11 16:00:51 +0000 2022,,,https://www.detroitnews.com/story/news/local/michigan/2022/01/10/michigan-adds-44-524-covid-19-cases-56-deaths-virus-over-3-days/9156803002/,0,1480932726404526082,,,,en,"Michigan, USA",false,,0,,,"<a href=""https://help.twitter.com/en/using-twitter/how-to-tweet#source-labels"" rel=""nofollow"">heapevents.info</a>","Michigan Adds Covid Cases Deaths Virus Over Days ☝ 😐 
 https://t.co/PijUJubzvR",https://twitter.com/heapevents/status/1480932726404526082,Sat Jan 09 15:58:46 +0000 2021,1347935690332495877,false,just heap of US events,0,7,25,1,,heapevents.info,heapevents,21302,,https://www.heapevents.info/,false
"-117.566,33.8753",Tue Jan 11 19:38:56 +0000 2022,,,https://www.instagram.com/p/CYmhDXZPPN7/?utm_medium=twitter,0,1480987609795072001,,,,en,"Corona, CA",false,,0,,,"<a href=""http://instagram.com"" rel=""nofollow"">Instagram</a>","Just posted a photo @ Corona, California https://t.co/nyySclhxEu",https://twitter.com/pastoranubia22/status/1480987609795072001,Sun Sep 21 17:35:02 +0000 2014,2824658328,false,"El poder de Dios es más grande que la misma vida,Dios nos está dando una oportunidad más🥰",34,14,17,0,"505, Newhall Dr, Corona CA ",pastora nubia,pastoranubia22,480,,,false
"-74.7421,40.9859",Tue Jan 11 15:01:09 +0000 2022,,,https://1057thehawk.com/andover-nj-nursing-home-found-piling-bodies-in-2020-now-has-300-covid-cases/,0,1480917703384829957,,,,en,"Andover, NJ",false,,0,,,"<a href=""https://help.twitter.com/en/using-twitter/how-to-tweet#source-labels"" rel=""nofollow"">heapevents.info</a>","Andover Nj Nursing Home Found Piling Bodies In Now Has Covid Cases ☝ 😐 
 https://t.co/kRxpLrduaV",https://twitter.com/heapevents/status/1480917703384829957,Sat Jan 09 15:58:46 +0000 2021,1347935690332495877,false,just heap of US events,0,7,25,1,,heapevents.info,heapevents,21302,,https://www.heapevents.info/,false
"-79.65,43.6",Tue Jan 11 18:45:52 +0000 2022,covid19 covidtest rapidtest rapidtestcovid19 mississauga omnicron,,https://www.instagram.com/p/CYma-qBP_wZ/?utm_medium=twitter,0,1480974255827439624,,,,en,"Mississauga, Ontario",false,,0,,,"<a href=""http://instagram.com"" rel=""nofollow"">Instagram</a>","We have a few Rapid test kits available. First come first served!!! #covid19 #covidtest #rapidtest #rapidtestcovid19 #mississauga #omnicron $14.99 @ Mississauga, Ontario https://t.co/dhRw8jS7qQ",https://twitter.com/CarPride/status/1480974255827439624,Fri Oct 12 02:02:26 +0000 2012,874745245,false,"Car Pride Auto Spa, while-you-wait services include auto detailing & car wash with hand drying. Local customer shuttle",221,1059,1968,33,"Mississauga, L5K 1J7",Car Pride Auto Spa,CarPride,3470,,http://www.carprideautospa.com,false
"-76.614,39.2944",Tue Jan 11 21:06:00 +0000 2022,Tuesday tttt TellTheTruthTuesday TellTheTruth TheTruth Truth Vaccinated Unvaccinated Covid Covid CoronaVirus Corona TheRona Virus SpiderMan,,https://www.instagram.com/p/CYmrA9nFgp5/?utm_medium=twitter,0,1481009523758452741,,,,en,"Baltimore, MD",false,,0,,,"<a href=""http://instagram.com"" rel=""nofollow"">Instagram</a>","Got my money on the unvaccinated people
#Tuesday #tttt #TellTheTruthTuesday #TellTheTruth #TheTruth #Truth #Vaccinated #Unvaccinated #Covid #Covid-19 #CoronaVirus #Corona #TheRona #Virus #SpiderMan @ Baltimore, Maryland https://t.co/N249exkn87",https://twitter.com/DugarBop/status/1481009523758452741,Thu Sep 01 05:07:12 +0000 2011,365878017,false,Same Shit Different Toilet U Know How It Is,4049,73,117,0,"Bodymore, Murdaland",D. Foote,DugarBop,6980,,,false
"-6.5191,54.80803",Tue Jan 11 19:52:26 +0000 2022,,,https://www.instagram.com/p/CYmimM9sr-N/?utm_medium=twitter,0,1480991006640295945,,,,en,"Bellaghy, Northern Ireland",false,,0,,,"<a href=""http://instagram.com"" rel=""nofollow"">Instagram</a>",Walk in Vaccine clinic for over 18s  @bellaghypharmacy this Wednesday and Friday   11-1 and 2-5pm @ Bellaghy Pharmacy https://t.co/lhOo3chd0P,https://twitter.com/bellaghypharmac/status/1480991006640295945,Fri Nov 01 21:51:34 +0000 2013,2169133142,false,we provide a friendly and professional service for all our customersOur success lies in our truly committed workforce who will go the extra mile for everyone.,189,641,1098,4,"20 Main St,Bellaghy Bt45 8HT",Bellaghy Pharmacy,bellaghypharmac,324,,http://www.bellaghypharmacy.co.uk,false
"-118.384,34.0847",Tue Jan 11 18:18:32 +0000 2022,,,https://www.instagram.com/calibanks/p/CYmX2gBP74-/?utm_medium=twitter,1,1480967378410385408,,,,en,"West Hollywood, CA",false,,0,,,"<a href=""http://instagram.com"" rel=""nofollow"">Instagram</a>","🤭 whoops now we need a Deltacron vaccine🙄 @ West Hollywood, California https://t.co/pkPJyMBYa7",https://twitter.com/BanksLatannya/status/1480967378410385408,Sat Sep 19 14:54:34 +0000 2015,3617037685,false,Director @ United for A Better World EDU. Org,1880,19,171,0,"Los Angeles, CA",latannya banks ,BanksLatannya,3382,,,false
"-76.614,39.2944",Tue Jan 11 17:59:17 +0000 2022,Tuesday tttt TellTheTruthTuesday TellTheTruth TheTruth Truth Covid Covid CoronaVirus Corona Virus Vaccinated Vaccine Thoughts WhateverYouWant Immunity Lies,,https://www.instagram.com/p/CYmVpnjF37t/?utm_medium=twitter,0,1480962534094127106,,,,en,"Baltimore, MD",false,,0,,,"<a href=""http://instagram.com"" rel=""nofollow"">Instagram</a>","Fooled you
#Tuesday #tttt #TellTheTruthTuesday #TellTheTruth #TheTruth #Truth #Covid #Covid-19 #CoronaVirus #Corona #Virus #Vaccinated #Vaccine #Thoughts #WhateverYouWant #Immunity #Lies @ Baltimore, Maryland https://t.co/MkrvcFq3n8",https://twitter.com/DugarBop/status/1480962534094127106,Thu Sep 01 05:07:12 +0000 2011,365878017,false,Same Shit Different Toilet U Know How It Is,4049,73,117,0,"Bodymore, Murdaland",D. Foote,DugarBop,6980,,,false
"-95.54977816,29.72972973",Tue Jan 11 20:47:58 +0000 2022,,,,0,1481004984762310664,SenTedCruz,,1074480192,en,"Sharpstown, Houston",,,0,,,"<a href=""http://www.tweetcaster.com"" rel=""nofollow"">TweetCaster for Android</a>","@SenTedCruz after forcibly having to quarantine, I was not able to make rent. Now I have an eviction notice. Do something now please. I have a one year who turns two on Saturday and she does not deserve this.",https://twitter.com/TheDarthNerd/status/1481004984762310664,Sat Apr 04 17:10:42 +0000 2009,28829559,false,I will sing a dirge in your honor and wear your skin with pride.,32,102,247,6,"Houston, Tx",Ron,TheDarthNerd,2689,,,false
"74.21,31.33",Tue Jan 11 16:17:10 +0000 2022,buyonline dressesforsale shoppingforall happywinter,,https://www.instagram.com/luqmanhakeem143/p/CYmJ9cxNjPv/?utm_medium=twitter,0,1480936835262025730,,,,en,"پنجاب, پاکستان",false,,0,,,"<a href=""http://instagram.com"" rel=""nofollow"">Instagram</a>","#buyonline #dressesforsale #shoppingforall #buynow#stayhomestaysafe #happywinter @ Punjab, Pakistan https://t.co/aPvbrZHtqy",https://twitter.com/luqmanhakeem143/status/1480936835262025730,Mon Jan 03 13:37:43 +0000 2022,1477997445002977288,false,"Aoa Welcome to Fb marketing services
We provide following services Fb ads marketing and management video veiws,page likes,Grow your business with
us",3,5,7,0,,Fb Marketing services,luqmanhakeem143,93,,https://www.facebook.com/MarketingServices123/,false
"2.4766,39.5075",Tue Jan 11 16:15:16 +0000 2022,avgeek fuckcovid isolation getboosted pfizer moderna 3jabs santaponsa mallorca,,https://www.instagram.com/p/CYmJvM9oLs_51_wq5sIyltHxvJP1eXlWU_BYAE0/?utm_medium=twitter,0,1480936356507435008,,,,en,"Calvià, España",false,,0,,,"<a href=""http://instagram.com"" rel=""nofollow"">Instagram</a>","Despite being in isolation with Covid, I am enjoying the lovely sunset.  #avgeek #fuckcovid #isolation #getboosted #pfizer #moderna #3jabs #santaponsa #mallorca @ SANTA PONÇA https://t.co/DFyiFq1626",https://twitter.com/TheFrankFlyer/status/1480936356507435008,Tue May 26 18:25:03 +0000 2009,42684163,false,"Frank in name and nature. Gay, Dutch, nerdy, Apple lover, world traveller, bargain lover and aviation geek. Married to @MacPsych. Views my own.",4418,153,545,6,London,Frank 🇺🇦,TheFrankFlyer,2873,,,false
"0.008652,50.872536",Tue Jan 11 15:19:56 +0000 2022,selfisolation covid_19,,https://www.instagram.com/wolfiewolfgangcolinbell/p/CYmDZ-RKpxY/?utm_medium=twitter,0,1480922432936583171,,,,en,"Lewes, England",false,,0,,,"<a href=""http://instagram.com"" rel=""nofollow"">Instagram</a>","Coming out of self-isolation for the first time. It’s a brave new world out here. #selfisolation #covid_19 @ Lewes, East Sussex https://t.co/y2by9M9k6D",https://twitter.com/Wolfiewolfgang/status/1480922432936583171,Wed Mar 18 08:58:31 +0000 2009,25047639,false,"Colin Bell (aka wolfiewolfgang) novelist & poet. Novels, Stephen Dearsley's Summer of Love, 2013; Blue Notes, Still Frames, January 2017 (Ward Wood Publishing).",381,649,749,26,"Lewes, Sussex, England",Colin Bell,Wolfiewolfgang,5347,,http://www.wolfiewolfgang.com,false
"-0.17988195,51.562662",Tue Jan 11 20:45:21 +0000 2022,morningcommute work routine weightwatchers maths points stew wine covid19 coronavirus London,,https://www.instagram.com/p/CYmlGlqBQf3/?utm_medium=twitter,1,1481004324675330053,,,,en,"Camden Town, London",false,,0,,,"<a href=""http://instagram.com"" rel=""nofollow"">Instagram</a>","Getting back into the work routine plus doing the WW maths 

#morningcommute #work #routine #weightwatchers #maths #points #stew #wine #covid19 #coronavirus #London @ Hampstead, United Kingdom https://t.co/0WMEAt4jOZ",https://twitter.com/beecee/status/1481004324675330053,Thu Apr 24 08:00:38 +0000 2008,14508711,false,A cautionary tale. Former Writer on 06:37 train to Maidstone. Award winning romcom author. Head of Storytelling at W2O. Will write for gig tickets and/or boots,25092,2909,2996,142,London/Tumblr,Brigid Coady 🌈,beecee,81608,,http://www.brigidcoady.com,false
"-75.1428517,38.7695159",Tue Jan 11 18:02:23 +0000 2022,,https://twitter.com/Leweslibrary/status/1480963313521598468/photo/1,,0,1480963313521598468,,,,en,"Lewes, DE",false,,0,,,"<a href=""https://www.hootsuite.com"" rel=""nofollow"">Hootsuite Inc.</a>","Due to the recent surge in COVID cases, this month's French movie discussion scheduled for Fri, Jan 21 is canceled. https://t.co/wJMQEGTwiw",https://twitter.com/Leweslibrary/status/1480963313521598468,Mon Sep 21 20:11:49 +0000 2009,76128888,false,"The first town in the first state's public library and community center. Located in beautiful Lewes, Delaware.",409,1661,739,43,"ÜT: 38.694986,-75.219998",Lewes Library,Leweslibrary,2245,,https://lewes.lib.de.us/,false
"-76.691881,39.291166",Tue Jan 11 21:20:20 +0000 2022,,,https://twitter.com/tahmanbradley/status/1481003503342522375,2,1481013130637500418,,,,en,"Baltimore, MD",false,1481003503342522375,0,,,"<a href=""https://onloft.com/tweetlogix"" rel=""nofollow"">Tweetlogix</a>","Did she have to use Personal, Sick or Vacation time to get paid because us regular folk gotta NVM. https://t.co/ipACxsAk9p",https://twitter.com/thisisdking/status/1481013130637500418,Tue Apr 14 11:09:24 +0000 2009,31099398,false,"IG:@thisdking85

Regional Truck Driver. Sports Gambler. Big Titty Lover. Henny Drinker. I Also Have A Reese Cup Addiction.",488,745,695,11,West Baltimore ,My DM’S Broke,thisisdking,104609,,,false
"14.4865036,35.85288308",Tue Jan 11 17:51:03 +0000 2022,Taxi Chauffeur Malta,https://twitter.com/Cab4Now/status/1480960462166454272/photo/1,http://dlvr.it/SGx8Qb,0,1480960462166454272,,,,en,Malta,false,,1,,,"<a href=""https://dlvrit.com/"" rel=""nofollow"">dlvr.it</a>",Cabs giant Addison Lee installs partitions after tragic covid deaths of three drivers https://t.co/xvqpNNw78A #Taxi #Chauffeur #Malta https://t.co/m3qPg6RgAu,https://twitter.com/Cab4Now/status/1480960462166454272,Fri Aug 27 20:57:00 +0000 2010,183762958,false,"🇬🇧 UK & Malta's Favourite Chauffeur, Private Hire, Taxi & Minicab Website Since 2010. Free airport transfers for patrons in Malta - https://t.co/4P1DfZJSc3 | 🇲🇹",25252,10286,164,143,London,Cab4Now.com,Cab4Now,117427,,https://Cab4Now.com,false
"-3.05651665,53.78666997",Tue Jan 11 16:39:26 +0000 2022,,,https://www.instagram.com/p/CYmMSx_JQnX/?utm_medium=twitter,1,1480942436612558848,,,,en,"South Shore, England",false,,0,,,"<a href=""http://instagram.com"" rel=""nofollow"">Instagram</a>",Just posted a video @ Corona  Blackpool https://t.co/NsKs62Fhld,https://twitter.com/coronablackpool/status/1480942436612558848,Sat May 29 11:09:49 +0000 2010,149472072,false,"Our official twitter page
Pleasure Beach Blackpool. 
Deals coming up. 
Best rates: 01253 342586 Or
https://t.co/UeBRN5kL0S",3179,840,987,10,Blackpool South Beach ,Coronablackpool,coronablackpool,3762,,http://www.coronahotelblackpool.co.uk,false
"-77.0253703,38.9394594",Tue Jan 11 18:02:41 +0000 2022,,,https://thehill.com/policy/healthcare/589134-record-135m-new-covid-19-cases-recorded-in-us,0,1480963390700933123,,,,en,"Washington, DC",false,,0,,,"<a href=""https://www.hootsuite.com"" rel=""nofollow"">Hootsuite Inc.</a>","Record 1.35M new COVID-19 cases recorded in US!

 Who knew Trump would be better that this?

https://t.co/q8GuYAoLkV",https://twitter.com/Joseph_Santoro/status/1480963390700933123,Sat Jan 17 21:10:13 +0000 2009,19123904,false,"Neuro PhD, #Innovator, #Technologist, #Startup Angel, Fmr White House/OFA Honcho | #Politics #Data #Adventure | StartingBloc & Fulbright | @DMVstartup @Forbes",170394,18370,20267,2363,"Washington, DC 20009",Dr. Joseph Santoro 🇺🇲🇺🇦🇺🇳🇪🇺,Joseph_Santoro,179079,,http://linkedin.com/in/josephsantoro,false
"-2.44662071,50.71246509",Tue Jan 11 21:24:38 +0000 2022,,,https://www.swarmapp.com/c/83m1m9UT8rG,0,1481014210712723462,,,,en,"Dorchester, England",false,,0,,,"<a href=""http://foursquare.com"" rel=""nofollow"">Foursquare</a>","Blood pressure, ecg, bloods, Covid test (@ Dorset County Hospital in Dorchester, Dorset) https://t.co/mhxYHTjgpD",https://twitter.com/pixlz/status/1481014210712723462,Mon Apr 05 14:34:03 +0000 2010,129822352,false,Systems Convener. Dot Joiner. Work well together. Service Manager @Nexer_Digital & Associate Coach - Northern Value Creators. Runs @seaasaservice1 🏳️‍⚧️ally,101230,3102,509,320,Mostly online in Dorset,Sharon Dale (she/her),pixlz,41969,,http://www.21cmindset.com,false
"-6.06519233,53.13624161",Tue Jan 11 15:42:41 +0000 2022,,,https://www.swarmapp.com/c/7D2fg7VScga,5,1480928157616197633,,,,en,"Wicklow, Ireland",false,,0,,,"<a href=""http://foursquare.com"" rel=""nofollow"">Foursquare</a>","A vacunar al peque de Covid. (@ Shoreline Leisure Centre in Greystones, Co. Wicklow) https://t.co/WtoBmsDu8w",https://twitter.com/amaterasu_n/status/1480928157616197633,Mon Oct 26 14:13:15 +0000 2009,85324019,false,"Psicóloga especializada en igualdad de género, y fundadora de @6STravel. Amante de mi familia y los viajes inclusivos. Ya en Dublin!",10270,2105,1303,66,Ireland,Núria🦮🇮🇪,amaterasu_n,49675,,https://www.youtube.com/c/SixsenseTravel,false
"21.008571,52.232311",Tue Jan 11 19:31:41 +0000 2022,RT,,http://youtube.com/watch?v=qjmeJ2LxKA4,0,1480985787348959236,,,,en,"Warszawa, Polska",false,,0,,,"<a href=""https://tapbots.com/tweetbot/"" rel=""nofollow"">Twitter for iPhone 12 Pro Max </a>",#RT Evidence of UK govts 6th lockdown party emerges https://t.co/N9LVfaCsY9,https://twitter.com/pidybi/status/1480985787348959236,Sat Mar 30 17:25:49 +0000 2013,1316862031,false,🤷‍♂️,219,569,590,250,Poland 🌍👈,𝔓𝔦𝔬𝔱𝔯,pidybi,633666,,,false
"-84.540214,33.567824",Tue Jan 11 17:32:14 +0000 2022,,,https://twitter.com/triniliciousd/status/1480936327436771339,0,1480955724368908294,,,,en,"Union City, GA",true,1480936327436771339,0,,,"<a href=""https://onloft.com/tweetlogix"" rel=""nofollow"">Tweetlogix</a>",Glasses and a mask are the worst https://t.co/hMjH888kl8,https://twitter.com/StfuAndListenHo/status/1480955724368908294,Mon Jun 08 16:48:14 +0000 2009,45608512,false,I’m just here to laugh and lie.,14,2150,286,29,ATL. ,big momma 🍊,StfuAndListenHo,240835,,,false
"-116.9429502,32.79279279",Tue Jan 11 20:35:13 +0000 2022,,,https://www.theatlantic.com/health/archive/2022/01/omicron-mild-covid-pandemic-reset/621207/,0,1481001776727744512,,,,en,"El Cajon, CA",false,,0,,,"<a href=""http://www.tweetcaster.com"" rel=""nofollow"">TweetCaster for Android</a>","Omicron Is Forcing Us to Rethink Mild COVID - The Atlantic - 

https://t.co/x6gc1A9N4O",https://twitter.com/sdterp/status/1481001776727744512,Fri Jul 10 17:47:52 +0000 2009,55620779,false,"Queer, vegetarian, Atheist, veteran...and apparently The Doctor.
Life: A blip of existence bookended by eternal non-existence.
-SDTerp
Free Palestine! 🇵🇸",5004,1027,340,60,"San Diego, CA",Paul Lambert,sdterp,127272,,https://www.theguardian.com/commentisfree/2007/aug,false
"-77.443858,37.5756275",Tue Jan 11 14:34:22 +0000 2022,thegreatresignation winter lockdown wearamask vaxup,,https://www.instagram.com/p/CYl-MYhLV5B/?utm_medium=twitter,0,1480910963079467009,,,,en,"Richmond, VA",false,,0,,,"<a href=""http://instagram.com"" rel=""nofollow"">Instagram</a>","Taking time to watch how the light filters through the house during the day is my current meditation.
#thegreatresignation #winter #lockdown #wearamask #vaxup @ Northside, Richmond, Virginia https://t.co/QRQKjt3gtY",https://twitter.com/jdmchef/status/1480910963079467009,Sun Apr 25 18:07:14 +0000 2010,137069873,false,under employed chef,3305,73,117,19,RVA,James McDonald,jdmchef,4445,,,false
