coordinates,created_at,hashtags,media,urls,favorite_count,id,in_reply_to_screen_name,in_reply_to_status_id,in_reply_to_user_id,lang,place,possibly_sensitive,quote_id,retweet_count,retweet_id,retweet_screen_name,source,text,tweet_url,user_created_at,user_id,user_default_profile_image,user_description,user_favourites_count,user_followers_count,user_friends_count,user_listed_count,user_location,user_name,user_screen_name,user_statuses_count,user_time_zone,user_urls,user_verified
"-77.5817439,35.2640291",Wed Jan 05 11:14:10 +0000 2022,,,https://www.neusenews.com/index/2022/1/4/governor-cooper-and-ncdhhs-secretary-kinsley-stress-importance-of-vaccines-and-boosters-to-combat-omicron-variant,0,1478686255936417798,,,,en,"Kinston, NC",false,,0,,,"<a href=""http://www.squarespace.com"" rel=""nofollow"">Squarespace</a>",Governor Cooper and NCDHHS Secretary Kinsley stress importance of vaccines and boosters to combat Omicron variant  https://t.co/eocjeYq1Pz,https://twitter.com/NeuseNews/status/1478686255936417798,Tue Apr 10 03:18:40 +0000 2018,983544768285298688,false,"Hyper-local news with no pop-ups, no AP news and no online subscription fees. No kidding! Subscribe (for free) to our Neuse Newsletter delivered daily at 7 am.",375,1363,95,7,"Kinston, NC",Neuse News,NeuseNews,9235,,https://linktr.ee/neusenews,false
"-76.20563,36.853278",Wed Jan 05 19:51:56 +0000 2022,,,https://www.swarmapp.com/c/gqEyDafTNBP,0,1478816556108992519,,,,en,"Norfolk, VA",false,,0,,,"<a href=""https://www.swarmapp.com"" rel=""nofollow"">Foursquare Swarm</a>","Madeleine is getting the Booster (@ Military Circle Covid Vaccination Center in Norfolk, VA) https://t.co/3sE2o84JlT",https://twitter.com/RagsdaleMichael/status/1478816556108992519,Fri Sep 19 11:54:33 +0000 2014,2775680164,false,Save a life. #WearAMask. I’m #FullyVaccinated (plus Booster) and #OpenToWork. Founder of @RaggieSoft. My Governor is an Idiot,325,67,265,1,"Norfolk, VA",Michael Ragsdale,RagsdaleMichael,3967,,https://raggiesoft.com/portfolio,false
"-3.05651665,53.78666997",Wed Jan 05 16:29:52 +0000 2022,,,https://www.instagram.com/coronahotelblackpool/p/CYWubUwJ4hr/?utm_medium=twitter,0,1478765704312672258,,,,en,"South Shore, England",false,,0,,,"<a href=""http://instagram.com"" rel=""nofollow"">Instagram</a>",2021 Christmas was amazing. Why not experience it for yourself @ Corona  Blackpool https://t.co/I3PQC96wCK,https://twitter.com/coronablackpool/status/1478765704312672258,Sat May 29 11:09:49 +0000 2010,149472072,false,"Our official twitter page
Pleasure Beach Blackpool. 
Deals coming up. 
Best rates: 01253 342586 Or
https://t.co/UeBRN5kL0S",3179,840,987,10,Blackpool South Beach ,Coronablackpool,coronablackpool,3762,,http://www.coronahotelblackpool.co.uk,false
"-102.366667,23.316667",Wed Jan 05 21:28:38 +0000 2022,,,https://www.instagram.com/p/CYXQ1fvLL83/?utm_medium=twitter,0,1478840889594155010,,,,en,"Villa de Cos, Zacatecas",false,,0,,,"<a href=""http://instagram.com"" rel=""nofollow"">Instagram</a>","Cold ones come in different formats 🥶 ☀️ 

Summer year round with a cold Corona 🍻 is our preference, what about YOU?

Caban Condos Mexico @ Mexico https://t.co/8XUwgBQH4C",https://twitter.com/cabancondosmex/status/1478840889594155010,Wed Mar 21 03:10:42 +0000 2018,976295006267944960,false,Two guys from Saskatchewan #Canada 🇨🇦 Building beautiful & affordable beach properties for you in tropical paradise #Mexico 🇲🇽 parrish@cabancondosmexico.com,25512,558,272,7,"Mérida, Yucatán",Caban Condos Mexico,cabancondosmex,10666,,https://www.cabancondosmexico.com,false
"39.150318,21.670473",Wed Jan 05 16:50:59 +0000 2022,,,https://www.swarmapp.com/c/9qztc0eb1O2,0,1478771019615768577,,,,en,"جدة, المملكة العربية السعودية",false,,0,,,"<a href=""https://www.swarmapp.com"" rel=""nofollow"">Foursquare Swarm</a>","💉 (@ COVID-19 Vaccine Center in Jeddah, Makkah) https://t.co/KedDPO5m1I",https://twitter.com/ihassanovic/status/1478771019615768577,Sat Nov 02 16:02:27 +0000 2013,2165030721,false,null,4283,77,120,2,دار آل سعود,حَ,ihassanovic,11086,,,false
"-72.7622,41.5834",Wed Jan 05 17:45:40 +0000 2022,,,http://c-hit.org/2022/01/04/coronavirus-faqs-resources/,0,1478784780439330821,,,,en,"Berlin, CT",false,,0,,,"<a href=""https://help.twitter.com/en/using-twitter/how-to-tweet#source-labels"" rel=""nofollow"">heapevents.info</a>","Coronavirus Faqs Resources ☝ 😐 
 https://t.co/qwtbClOGiO",https://twitter.com/heapevents/status/1478784780439330821,Sat Jan 09 15:58:46 +0000 2021,1347935690332495877,false,just heap of US events,0,7,25,1,,heapevents.info,heapevents,21302,,https://www.heapevents.info/,false
"-115.149,36.1675",Wed Jan 05 16:26:33 +0000 2022,CES,,https://www.instagram.com/p/CYWuRJuFu8_/?utm_medium=twitter,0,1478764869889441794,,,,en,"Las Vegas, NV",false,,0,,,"<a href=""http://instagram.com"" rel=""nofollow"">Instagram</a>","Not a lot of social distancing in the scrum with Eui-son Chung, chairman of Hyundai. But fortunately everyone is vaxxed and tested negative. #CES @ Las Vegas, Nevada https://t.co/dKjVBo89qG",https://twitter.com/Autoline/status/1478764869889441794,Fri Oct 17 16:53:29 +0000 2008,16827124,false,"Your daily source for news about the global automotive industry, with host John McElroy.",1260,40375,1228,594,Detroit,Autoline,Autoline,13979,,http://autoline.tv,false
"-73.95,40.65",Wed Jan 05 20:14:44 +0000 2022,workfromhome,,https://www.instagram.com/p/CYXIYOcFKpy/?utm_medium=twitter,1,1478822292125667330,,,,en,"Brooklyn, NY",false,,0,,,"<a href=""http://instagram.com"" rel=""nofollow"">Instagram</a>","New sounds coming soon
#workfromhome @ Brooklyn, New York https://t.co/rZRfU3LwW8",https://twitter.com/smokegouda/status/1478822292125667330,Sat Feb 16 02:09:32 +0000 2013,1184369059,false,"🆙️⚡⚡💫⚡⚡🆙️
Follow my team on all platforms
@whitelotusnyc 
#𝕻1 OUT NOW",440,125,82,0,"Gotham, New York",Fonny Kennedy,smokegouda,927,,http://bio.site/kDZLd8,false
"-115.11942923,36.08546233",Wed Jan 05 20:34:42 +0000 2022,,,https://www.instagram.com/p/CYXKqi_Pt8C/?utm_medium=twitter,0,1478827318827106307,,,,en,"Paradise, NV",true,,0,,,"<a href=""http://instagram.com"" rel=""nofollow"">Instagram</a>","Landed and picked up the badge and Covid-19 test kit. Dropped in a ramen restaurant for a quick bite. And no, I’m not drinking those soju bottles. Just little beer w ramen. @ Hana Ramen https://t.co/JUGVxFr5LM",https://twitter.com/ptkim/status/1478827318827106307,Thu Oct 23 16:14:43 +0000 2008,16929502,false,Nostalgia is a dangerous form of comparison - Brene Brown. My tweets are personal opinions and do not represent any positions of my affliations.,3867,276,116,15,"Dallas, Texas, United States",🥸🤪😜,ptkim,33891,,,false
"-117.27254,32.84762",Wed Jan 05 16:52:12 +0000 2022,,,https://www.instagram.com/p/CYWxM65pNaD/?utm_medium=twitter,0,1478771325581807620,,,,en,"San Diego, CA",true,,0,,,"<a href=""http://instagram.com"" rel=""nofollow"">Instagram</a>","Happy Wednesday! 😷💛 This is a friendly reminder to please wear a mask when visiting Hi Sweetheart. We are trying our best to stay healthy, happy &amp; open for business! We appreciate your support xoxo https://t.co/6L5Yc5zmsC",https://twitter.com/HiSweetsLaJolla/status/1478771325581807620,Sun Nov 03 01:24:29 +0000 2013,2171250937,false,Hi Sweetheart! a gift boutique for all occasions! Stop in and see us at 7920 Ivanhoe in La Jolla or online at https://t.co/9vcqQ37UYN,9173,633,1039,18,la jolla,HiSweetheartBoutique,HiSweetsLaJolla,5601,,http://www.hi-sweets.com,false
"39.150318,21.670473",Wed Jan 05 18:23:09 +0000 2022,,,https://www.swarmapp.com/c/ihWwgTXPYIl,0,1478794214045622278,,,,en,"جدة, المملكة العربية السعودية",true,,0,,,"<a href=""https://www.swarmapp.com"" rel=""nofollow"">Foursquare Swarm</a>","I'm at COVID-19 Vaccine Center in Jeddah, Makkah https://t.co/sHXfn7OURy",https://twitter.com/Abduljawad_m/status/1478794214045622278,Mon Mar 26 05:39:40 +0000 2018,978144433089728512,false,ان الله يديم نعم الحامدين فالحمدلله حمداً كثيراً💙,366,1231,26,0,"Jeddah, Kingdom of Saudi Arabia",J,Abduljawad_m,1490,,https://curiouscat.me/Abduljawad_M,false
"-2,54",Wed Jan 05 15:29:50 +0000 2022,,,https://www.instagram.com/p/CYWnxX9q1V5/?utm_medium=twitter,0,1478750595800608769,,,,en,"Yorkshire and The Humber, England",false,,0,,,"<a href=""http://instagram.com"" rel=""nofollow"">Instagram</a>","With the Omicron variant of COVID-19 registering a record number of infections, chaos is once again tearing through Hollywood.
Specifically, some of the year’s top ceremonies – such as the GRAMMY Awards 2022. https://t.co/ypbAQp4tgI",https://twitter.com/BiobakuKunle/status/1478750595800608769,Mon Nov 02 17:52:43 +0000 2020,1323322059305455616,false,"WE SHOWCASE ALL TYPES OF TALENT ON OUR PLATFORM.

WE FOCUS ON MUSIC,DANCE,COMEDY ETC

Follow us on IG @kunlebiobaku",4,16,154,0,United Kingdom,Kunle Biobaku,BiobakuKunle,154,,,false
"-76.644594,39.687073",Wed Jan 05 18:03:15 +0000 2022,,,https://twitter.com/RaveenTheDream/status/1478783111508942859,0,1478789205853671431,,,,en,"Maryland, USA",false,1478783111508942859,0,,,"<a href=""https://onloft.com/tweetlogix"" rel=""nofollow"">Tweetlogix</a>",Over. https://t.co/NTqbBysr7H,https://twitter.com/thisisdking/status/1478789205853671431,Tue Apr 14 11:09:24 +0000 2009,31099398,false,"IG:@thisdking85

Regional Truck Driver. Sports Gambler. Big Titty Lover. Henny Drinker. I Also Have A Reese Cup Addiction.",488,745,695,11,West Baltimore ,My DM’S Broke,thisisdking,104609,,,false
"-82.4558,27.9473",Wed Jan 05 16:11:15 +0000 2022,Winning,,https://www.instagram.com/p/CYWsg0Cri04a2HuaFF-ebtaLLqyBNNEemOgmK80/?utm_medium=twitter,0,1478761017161273344,,,,en,"Tampa, FL",false,,0,,,"<a href=""http://instagram.com"" rel=""nofollow"">Instagram</a>","One of the beauties of working from home. I can be outside on my break soaking in some sun rays in my beautiful back yard on the golf course 😎 #Winning @ Tampa, Florida https://t.co/fepg5spP9j",https://twitter.com/jeepgirlchele/status/1478761017161273344,Fri Apr 13 19:13:07 +0000 2012,552940408,false,FLY= First Love Yourself ❤️ LIFE= Live In Full Effect,97,129,425,2,"Tampa, FL",Chelyy Chele,jeepgirlchele,5568,,,false
"151,-33.81667",Wed Jan 05 16:37:02 +0000 2022,,https://twitter.com/HidSfilmfest/status/1478767506470834177/photo/1,,1,1478767506470834177,,,,en,"Sydney, New South Wales",false,,0,,,"<a href=""https://social.zoho.com"" rel=""nofollow"">Zoho Social</a>","HIDS is proud to present ""An Orange And The Eye "". This short film was shot in the Parramatta during the COVID19 pandemic, people are frantically going about their business stocking up on toilet paper and other essentials, behaving much like ants gathering their stockpile.🤠 https://t.co/M47om2O1Mc",https://twitter.com/HidSfilmfest/status/1478767506470834177,Sun Jul 05 20:07:19 +0000 2020,1279869395431555072,false,A curated website and film festival that focuses on immigrant and refugee experience living all over the world.,61,39,161,0,"Cary, NC",HomeIsDistantShores,HidSfilmfest,314,,http://www.homeisdistantshores.com,false
"-78.9072,35.9886",Wed Jan 05 20:04:26 +0000 2022,,,https://www.instagram.com/p/CYXHM09vVAp/?utm_medium=twitter,0,1478819701668999170,,,,en,"Durham, NC",false,,0,,,"<a href=""http://instagram.com"" rel=""nofollow"">Instagram</a>","Time for a COVID test. @ncdhhs has these available on their website for free. Much easier than trying to find an appointment somewhere. @ Durham, North Carolina https://t.co/xlCYf7Uw8l",https://twitter.com/huslage/status/1478819701668999170,Tue Aug 15 00:51:36 +0000 2006,4358,false,Nerd. Dad. Nerddad. Dadnerd.,24364,2379,2891,211,"Durham, NC","Aaron ""Get a Vaccine"" Huslage",huslage,36979,,,false
"-73.97199078,40.77012069",Wed Jan 05 19:05:04 +0000 2022,TheScene firstmarathon georginamarathon,https://twitter.com/SpeeritTeam/status/1478804762904522752/photo/1,http://dlvr.it/SGbLRl,0,1478804762904522752,,,,en,"Manhattan, NY",false,,0,,,"<a href=""https://dlvrit.com/"" rel=""nofollow"">dlvr.it</a>",#TheScene #firstmarathon #georginamarathon What it’s like to run your first marathon during COVID-19 https://t.co/fM3FLzhEeK @CanadianRunning https://t.co/t2U5bUf6uJ,https://twitter.com/SpeeritTeam/status/1478804762904522752,Wed Dec 04 19:01:58 +0000 2013,2230363682,false,Empowering you to connect with likeminded #runners #athletes. We've just launched. Get the app Now: https://t.co/qCULB3PX5v,60677,6263,4505,48,"New York, NY",SPEERIT.co,SpeeritTeam,2915,,https://www.speerit.co,false
"144.9661,-37.8156",Wed Jan 05 21:19:13 +0000 2022,Adeniyiekine RealityGistWithAdeniyiEkine EvangelistAdeniyiEkine AmbassadorAdeniyiEkine,,https://www.instagram.com/p/CYXPwiUh3RJ/?utm_medium=twitter,0,1478838519959150598,,,,en,"Melbourne, Victoria",false,,0,,,"<a href=""http://instagram.com"" rel=""nofollow"">Instagram</a>","My Covid19 Test result is out this Morning and it is NEGATIVE. To God Almighty be the Glory 🙏🙏🙏#Adeniyiekine #RealityGistWithAdeniyiEkine #EvangelistAdeniyiEkine #AmbassadorAdeniyiEkine @ Melbourne, Victoria, Australia https://t.co/N9RwUCKeVV",https://twitter.com/AdeniyiEkine/status/1478838519959150598,Sun Dec 19 18:42:09 +0000 2021,1472638239341113344,false,"Ambassador for Peace, Journalist, Evangelist, Human Rights Activist, Disability Health Care Support Worker",75,5,181,0,"Victoria, Australia",Adeniyi Ekine,AdeniyiEkine,290,,https://www.australiancommunitytalents.org/about-ambassador-adeniyi-ekine,false
"-0.12485951,51.50538967",Wed Jan 05 15:23:33 +0000 2022,Omicron UK,,http://dlvr.it/SGZjYk,0,1478749015122399233,,,,en,"London, England",false,,1,,,"<a href=""https://dlvrit.com/"" rel=""nofollow"">dlvr.it</a>","In the midst of the #Omicron surge, #UK Prime Minister Boris Johnson refuses to impose another lockdown. https://t.co/7G5EhgnMpT",https://twitter.com/BritishHeraldUK/status/1478749015122399233,Wed Feb 17 17:49:42 +0000 2010,115123902,false,Where Britain Meets the World® | The Official handle of #britishherald,350,133883,607,283,"London, United Kingdom",British Herald,BritishHeraldUK,57106,,http://www.britishherald.com,false
"-122.66641,45.55029001",Wed Jan 05 20:49:39 +0000 2022,openforbusiness normalcovidhours masksrequired comesayhi,,https://www.instagram.com/p/CYXMX7aPQsS/?utm_medium=twitter,0,1478831078861422598,,,,en,"Portland, OR",false,,0,,,"<a href=""http://instagram.com"" rel=""nofollow"">Instagram</a>",Open!! Normal Covid hours. 12-5 Wed-Sun. Real masks required. Come say hi! 👋 #openforbusiness #normalcovidhours #masksrequired #comesayhi👋 @ SpielWerk Toys https://t.co/7CDhH4MVBw,https://twitter.com/spielwerktoys/status/1478831078861422598,Thu Mar 19 18:14:12 +0000 2009,25352839,false,"SpielWerk is a community toy store in Portland, Ore. Our mission is to get kids back to the werk of play. We provide simple yet rich, open-ended toys.",28,585,374,33,"Portland, OR",SpielWerk Toys,spielwerktoys,3296,,http://spielwerktoys.com,false
"-86.665657,36.1701088",Wed Jan 05 21:39:29 +0000 2022,,,https://www.instagram.com/p/CYXSE5zvPtB/?utm_medium=twitter,0,1478843620375498754,,,,en,"Nashville, TN",false,,1,,,"<a href=""http://instagram.com"" rel=""nofollow"">Instagram</a>","Due to rising COVID numbers, Roland White shows are cancelled. Until further notice. We must protect this national treasure as best we can. Thank you for understanding. @ Homegrown Taproom &amp; Kitchen https://t.co/QP79gPneB9",https://twitter.com/HomegrownNash/status/1478843620375498754,Sun Nov 03 19:45:10 +0000 2013,2166851543,false,"""Homegrown is a down-to-earth taproom with food worth tasting, bands worth hearing, and pints worth discovering."" Matt Fox, Nashville Scene",989,1293,908,32,2720 Old Lebanon Road,Homegrown Nashville,HomegrownNash,8174,,http://www.homegrownnashville.com,false
"-93.9196,45.7326",Wed Jan 05 17:30:49 +0000 2022,,,https://zeenews.india.com/world/omicron-outbreak-us-schools-and-workplaces-extend-their-holiday-break-amid-rising-covid-19-cases-2425146.html,0,1478781040462290948,,,,en,"Minnesota, USA",false,,0,,,"<a href=""https://help.twitter.com/en/using-twitter/how-to-tweet#source-labels"" rel=""nofollow"">heapevents.info</a>","Omicron Outbreak Us Schools And Workplaces Extend Their Holiday Break Amid Rising Covid Cases ☝ 😐 
 https://t.co/DSHYvpJvEt",https://twitter.com/heapevents/status/1478781040462290948,Sat Jan 09 15:58:46 +0000 2021,1347935690332495877,false,just heap of US events,0,7,25,1,,heapevents.info,heapevents,21302,,https://www.heapevents.info/,false
"-79.3872,43.648",Wed Jan 05 16:31:20 +0000 2022,,,https://www.instagram.com/p/CYWu0ErFdFE/?utm_medium=twitter,0,1478766072060952577,,,,en,"Toronto, Ontario",false,,0,,,"<a href=""http://instagram.com"" rel=""nofollow"">Instagram</a>","Better time then any to work on your online presence, your craft etc… since we in another lockdown @ Toronto, Ontario https://t.co/OXfeM7Rg79",https://twitter.com/MilianPhotos/status/1478766072060952577,Wed Mar 18 11:59:41 +0000 2009,25061087,false,Toronto Photographer,202,445,121,6,"iPhone: 0.000000,0.000000",max,MilianPhotos,24370,,http://milianphotos.com,false
"49.513804,25.333119",Wed Jan 05 17:23:57 +0000 2022,,,https://www.swarmapp.com/c/gZAvRsjVJqq,0,1478779314577551362,,,,en,"الاحساء, المملكة العربية السعودية",false,,0,,,"<a href=""http://foursquare.com"" rel=""nofollow"">Foursquare</a>","third dose (@ COVID-19 Vaccinations Center in Al Hufuf, Ash Sharqiyah) https://t.co/ymJvcm2bCn",https://twitter.com/hmiid/status/1478779314577551362,Thu Dec 09 11:56:50 +0000 2010,224602392,false,🫧🎵,634,2468,97,8,he/him/habibi,Moh'd Al Salem,hmiid,30137,,http://Instagram.com/hmid_#,false
"-73.96029,40.65828",Wed Jan 05 16:40:37 +0000 2022,whenwillthisbeover momsunite brooklynmoms patienceisavirtue,,https://www.instagram.com/p/CYWv4Hnlivb/?utm_medium=twitter,0,1478768407529070592,,,,en,"Brooklyn, NY",false,,0,,,"<a href=""http://instagram.com"" rel=""nofollow"">Instagram</a>",With Covid still spiking in numbers everywhere. I know my caretakers feel this. #whenwillthisbeover #momsunite #brooklynmoms #patienceisavirtue @ Awesome Brooklyn https://t.co/FS0hqFs5tC,https://twitter.com/Awesomebrookly/status/1478768407529070592,Mon Aug 07 20:13:24 +0000 2017,894652717263716353,false,Gifts so awesome you will want them for yourself!,54,46,97,1,"Brooklyn, NY","Awesome Brooklyn❤️👊🏽Flatbush, Brooklyn",Awesomebrookly,575,,http://www.awesomebrooklyn.com,false
"-0.12485951,51.50538967",Wed Jan 05 15:23:32 +0000 2022,COVID19 UK,,http://dlvr.it/SGZjXD,0,1478749009707601926,,,,en,"London, England",false,,1,,,"<a href=""https://dlvrit.com/"" rel=""nofollow"">dlvr.it</a>","Boosting #COVID19 every few months is not sustainable, according to a #UK science expert. https://t.co/GMn4hGgEns",https://twitter.com/BritishHeraldUK/status/1478749009707601926,Wed Feb 17 17:49:42 +0000 2010,115123902,false,Where Britain Meets the World® | The Official handle of #britishherald,350,133883,607,283,"London, United Kingdom",British Herald,BritishHeraldUK,57106,,http://www.britishherald.com,false
"-87.5010326,38.05405405",Wed Jan 05 20:48:44 +0000 2022,,,,0,1478830847952363525,HammerDAHN,,1070525447040090100,en,"Evansville, IN",,,0,,,"<a href=""http://www.tweetcaster.com"" rel=""nofollow"">TweetCaster for Android</a>",@HammerDAHN  Dont forget a few bowl games were COVID cancelled,https://twitter.com/SSchwartz67/status/1478830847952363525,Tue Feb 28 17:44:53 +0000 2012,507682988,false,"STLCards fan, Father of 4, Owner Scott Schwartz Ins Agency",341,52,197,6,"Evansville, IN",Scott Schwartz,SSchwartz67,3666,,,false
"77.5430614,13.0046692",Wed Jan 05 20:17:04 +0000 2022,,https://twitter.com/knowinfonow/status/1478822878845964288/photo/1,http://dlvr.it/SGbYN5,1,1478822878845964288,,,,en,"बैंगलुरु, भारत",false,,0,,,"<a href=""https://dlvrit.com/"" rel=""nofollow"">dlvr.it</a>","2 doses of COVID 19 vaccine must for employees working in Industries/factories, IT Industries https://t.co/D0WKJ9300a https://t.co/yPFfCVBoxG",https://twitter.com/knowinfonow/status/1478822878845964288,Sat Nov 13 17:18:11 +0000 2010,215339100,false,"https://t.co/xv8WkFymGB a financial blog in existence from past 18 years providing tax professional, Tax payers, General public useful information.",4715,93,335,0,"Bengaluru, India",Knowinfonow.com,knowinfonow,3453,,http://knowinfonow.com,false
"-117.988552,33.71129329",Wed Jan 05 20:00:27 +0000 2022,SayItAintSo,,https://www.instagram.com/p/CYXGvjOPDql/?utm_medium=twitter,0,1478818699956080641,,,,en,"Huntington Beach, CA",false,,0,,,"<a href=""http://instagram.com"" rel=""nofollow"">Instagram</a>","I Said I was Looking Forward to the Comedy Show TONIGHT, COVID Said
So Was I😳
#SayItAintSo😵‍💫 @ Dino’s Sports Bar &amp; Grill https://t.co/PIhlXyXZyH",https://twitter.com/HJohnnie/status/1478818699956080641,Mon May 02 07:00:10 +0000 2011,291561539,false,"Comedian, Writer, Theorist, Happy Husband, of Kristine don't take Life for Granted Enjoy the Now.",1161,222,328,5,,Johnnie H Flowers Jr,HJohnnie,10347,,,false
"-121.57053318,37.00748198",Wed Jan 05 19:23:33 +0000 2022,,https://twitter.com/1stChiroGilroy/status/1478809412982562817/photo/1,http://dlvr.it/SGbPRy,0,1478809412982562817,,,,en,"Gilroy, CA",false,,0,,,"<a href=""https://dlvrit.com/"" rel=""nofollow"">dlvr.it</a>",Vaccine DAMAGE now ubiquitous in Denmark as “Omicron” hospitalizations occur primarily in “fully vaccinated” https://t.co/8T8vweQy4p https://t.co/psmMt6fSvX,https://twitter.com/1stChiroGilroy/status/1478809412982562817,Tue Aug 16 22:53:21 +0000 2016,765682887899226112,false,"Dr. Sam @ First Chiropractic in Gilroy, CA! 25+ Years of Back Pain Relief Expertise! Pls Call for Appts: (408) 848-6222 - 7461 Eigleberry St. Gilroy, CA 95020",8,19,42,1,"Gilroy, CA",Sam Nijmeh,1stChiroGilroy,3226,,http://FirstChiropractic.co,false
"-0.13608912,51.50413561",Wed Jan 05 20:39:04 +0000 2022,,,http://dlvr.it/SGbc3F,0,1478828414974922752,,,,en,"London, England",false,,0,,,"<a href=""https://dlvrit.com/"" rel=""nofollow"">dlvr.it</a>","Member of neo-Nazi group charged with homophobic assault - PinkNews: ... insists Jewish people were behind 9/11, spreads COVID-19 misinformation, and is viciously opposed to LGBT+ folk and feminism. https://t.co/h15QMRX9oE",https://twitter.com/StigmabaseO/status/1478828414974922752,Thu Apr 29 13:56:48 +0000 2010,138418838,false,Americas — United Kingdom  | Keeping up-to-date on global exclusion — Stigmabase is a canadian internet non-profit Initiative. Founded in 2010,0,4143,3742,262,Americas | United Kingdom,Stigmabase | ORG,StigmabaseO,1828882,,https://www.stigmabase.org/,false
"-74.0007613,40.7207559",Wed Jan 05 16:25:33 +0000 2022,,,https://www.congressheightsontherise.com/blog/jan-6-ask-the-doctor-with-dr-yola-kids-vaccines-and-covid-variants-yn35a,0,1478764616528412683,,,,en,"Manhattan, NY",false,,1,,,"<a href=""http://www.squarespace.com"" rel=""nofollow"">Squarespace</a>","""Got questions about keeping your little ones safe?"" Jan 6 | Ask The Doctor with Dr. Yola - Kids, Vaccines and Covid Variants  https://t.co/GPsYFfVhVO",https://twitter.com/TheAdvoc8te/status/1478764616528412683,Sat Feb 21 07:27:37 +0000 2009,21469731,false,"👩🏽‍💻#DC influencer making things happen east of the river. Owner of @reSPINPR, @CHOTR_DC + #SoutheastLove❤️ For ads/consulting/press: info@respindc.com",19723,4592,3002,167,"Washington, DC",Nikki Peele - #StillMasked,TheAdvoc8te,56585,,http://www.congressheightsontherise.com,false
"-122.675,45.5236111",Wed Jan 05 20:39:20 +0000 2022,,,http://dlvr.it/SGbc4s,0,1478828481836290050,,,,en,"Portland, OR",false,,0,,,"<a href=""https://dlvrit.com/"" rel=""nofollow"">dlvr.it</a>","San Francisco:: $6 million in COVID loans went to ex-Liberian official living in Georgia, feds say https://t.co/HJJyrsegbU",https://twitter.com/SHH_SMS/status/1478828481836290050,Mon Feb 20 21:11:02 +0000 2017,833786060836442115,false,"Helping individuals and small businesses find success online since 2009. Photographer, Videography, Web Design and Hosting Social Media Strategy",11,306,259,2,"San Francisco , US, 94110",SHH Social Media Services,SHH_SMS,33999,,http://www.shhsms.com,false
"-79.7164011,43.7742911",Wed Jan 05 17:06:34 +0000 2022,Covid19 Health India Lifestyle NEWS,,http://dlvr.it/SGb1M5,0,1478774939637334021,,,,en,"Brampton, Ontario",false,,1,,,"<a href=""https://dlvrit.com/"" rel=""nofollow"">dlvr.it</a>","India’s Omicron count comes to 2,135 with 243 new cases, Maha most… https://t.co/IRKqMtp8Aj #Covid19 #Health #India #Lifestyle #NEWS",https://twitter.com/Weeklyvoice/status/1478774939637334021,Tue Mar 30 17:43:21 +0000 2010,127943720,false,Most Trusted News in North America’s South Asian Communities Since 1997,172,494,299,11,Toronto,Weekly Voice,Weeklyvoice,37110,,http://www.Weeklyvoice.com,false
"1.80874949,41.23768596",Wed Jan 05 19:55:27 +0000 2022,gaypride sitges sitgesanytime lgbt,,https://www.instagram.com/p/CYXGKy7osC9/?utm_medium=twitter,0,1478817440905805836,,,,en,"Sitges, España",false,,0,,,"<a href=""http://instagram.com"" rel=""nofollow"">Instagram</a>",Reposted from @sitges_home Dates for Gay Pride 2022 announced as 8th to 12th June. Get booking peeps as summer 2022 (hopefully back to pre-Covid normal) kicks off. #gaypride #sitges #sitgesanytime #lgbt @ Sitgeeees!! https://t.co/jKnQpY151M,https://twitter.com/JAWoltemade/status/1478817440905805836,Tue Jun 07 08:37:11 +0000 2011,312537982,false,"Sitges Bitge. Hausfrau, yet rarely home. My right breast is real, spectacular, and cancer-free since August 15, 2013. She/Her.",32677,1122,3898,45,"Sitges, Spain",Jen Woltemade,JAWoltemade,56190,,,false
