coordinates,created_at,hashtags,media,urls,favorite_count,id,in_reply_to_screen_name,in_reply_to_status_id,in_reply_to_user_id,lang,place,possibly_sensitive,quote_id,retweet_count,retweet_id,retweet_screen_name,source,text,tweet_url,user_created_at,user_id,user_default_profile_image,user_description,user_favourites_count,user_followers_count,user_friends_count,user_listed_count,user_location,user_name,user_screen_name,user_statuses_count,user_time_zone,user_urls,user_verified
"77.19102783,28.5974128",Wed Jan 05 14:08:11 +0000 2022,,,http://dlvr.it/SGZTp9,0,1478730047095652355,,,,en,"नई दिल्ली, भारत",false,,1,,,"<a href=""https://dlvrit.com/"" rel=""nofollow"">dlvr.it</a>","INNR — Covid: Centre allows work from home for 50 per cent of its staff: Persons with disabilities and pregnant women employees have been exempted from attending office, it said. 

View article... https://t.co/r4EKpN4u1w",https://twitter.com/StigmabaseA/status/1478730047095652355,Sat May 29 17:26:03 +0000 2010,149585330,false,Australia - New Zealand — 日本語  — 中国 — 한국말 |  Keeping up-to-date on global exclusion — Stigmabase is a canadian internet non-profit Initiative. Founded in 2010.,0,2908,1275,139,Asia | Australia - Pacific,Stigmabase | ASIA,StigmabaseA,1550447,,https://www.stigmabase.org/,false
"151.20797,-33.86751",Wed Jan 05 07:40:59 +0000 2022,COVID,,https://www.instagram.com/p/CYVyHjTLIuW/?utm_medium=twitter,0,1478632604626825219,,,,en,"Sydney, New South Wales",false,,0,,,"<a href=""http://instagram.com"" rel=""nofollow"">Instagram</a>","Been to 4 #COVID case locations but some like Westfield or Aldi are quite large and we were only there for a few minutes. @ Sydney, Australia https://t.co/vGsVccMNTF",https://twitter.com/stefssite/status/1478632604626825219,Sat Dec 08 12:24:19 +0000 2012,997073821,false,"🇦🇺🦘Sydney Web Designer & Site Improvability Engineer @siterooau 🎉 👨‍💻
📩 hi@ https://t.co/v7YfiBIWwt 👋  #AusOpen #EDM",5353,710,3576,207,"Sydney, Australia",Stefan Caliaro,stefssite,28147,,https://siteroo.design/,false
"77.19102783,28.5974128",Wed Jan 05 13:03:42 +0000 2022,,,http://dlvr.it/SGZHSs,0,1478713819945844737,,,,en,"नई दिल्ली, भारत",false,,1,,,"<a href=""https://dlvrit.com/"" rel=""nofollow"">dlvr.it</a>","INNR — e-healthcare takes centrestage as pandemic rages: Tech innovation in private hospitals has become more intense—dwarfing face-to-face consultations. Robotics, 5G, AI, are vital for addressing the ...  

View article... https://t.co/W5HlbX7t3c",https://twitter.com/StigmabaseA/status/1478713819945844737,Sat May 29 17:26:03 +0000 2010,149585330,false,Australia - New Zealand — 日本語  — 中国 — 한국말 |  Keeping up-to-date on global exclusion — Stigmabase is a canadian internet non-profit Initiative. Founded in 2010.,0,2908,1275,139,Asia | Australia - Pacific,Stigmabase | ASIA,StigmabaseA,1550447,,https://www.stigmabase.org/,false
"55.27416408,25.19719687",Wed Jan 05 09:33:11 +0000 2022,,,https://www.instagram.com/p/CYV-9cGvToh/?utm_medium=twitter,1,1478660842484862978,,,,en,"دبي, الامارات العربية المتحدة",false,,0,,,"<a href=""http://instagram.com"" rel=""nofollow"">Instagram</a>","Cant differentiate between Covid, Flu or a cold. Use this chart to self diagnose and take your PCR and I hope Omnicron doesn’t get you @ Burj Khalifa https://t.co/owESuE0HtR",https://twitter.com/Robbieblanco/status/1478660842484862978,Tue Feb 10 16:15:06 +0000 2009,20522758,false,"Educational Rockstar, Inspirational talker, the Teacher Socials guy, adviser, human, light warrior and these views mainly belong to the many voices in my head.",10044,2129,2302,4,"Dubai, United Arab Emirates",Mr Robert,Robbieblanco,11056,,http://www.teachersocials.com,false
"28.063184,-25.41333",Wed Jan 05 12:45:39 +0000 2022,,,https://www.instagram.com/p/CYWU-_CMaa3/?utm_medium=twitter,0,1478709276407259138,,,,en,"Mabopane, South Africa",false,,0,,,"<a href=""http://instagram.com"" rel=""nofollow"">Instagram</a>","Hence the little 🤖 called vaccine @ Winterveldt, Mabopane, Pta, https://t.co/3NKZxBPi31",https://twitter.com/billysigudla/status/1478709276407259138,Tue Oct 18 15:50:34 +0000 2011,393471260,false,"#ExecutiveEditor 
about us:https://t.co/j94H81mE20

🌐https://t.co/gK7pysLzn3",105634,3789,5003,71,"Germiston, South Africa",Billy Sigudla,billysigudla,161255,,https://siphiwebillysigudla.com/,false
"-0.70120037,52.15517085",Wed Jan 05 13:30:48 +0000 2022,,,https://www.instagram.com/p/CYWaJelojMs/?utm_medium=twitter,0,1478720638361772034,,,,en,"Olney, England",false,,0,,,"<a href=""http://instagram.com"" rel=""nofollow"">Instagram</a>",Always a fun night at Olney Jazz Club. First time back since pre covid days! @bassicinstinct Jez &amp; Nick make up The Ben Holder Quartet! 🎶👍 @ The Carlton House Club https://t.co/kjMuJBtWpb,https://twitter.com/gingerviolinguy/status/1478720638361772034,Wed Mar 02 13:07:45 +0000 2011,259716447,false,"News on my upcoming shows, and the occasional oddity :)",1571,1599,387,21,,Ben Holder - That Ginger Violin Guy,gingerviolinguy,4681,,http://www.ticketsource.co.uk/bsjazz,false
"-60.15770634,46.12612613",Wed Jan 05 12:15:09 +0000 2022,covid omicron,,,2,1478701601032486920,,,,en,"Cape Breton, Nova Scotia",,,0,,,"<a href=""http://www.tweetcaster.com"" rel=""nofollow"">TweetCaster for Android</a>",Hopefully the rapid test will come back negative. 🙏🤞#covid #omicron,https://twitter.com/ColinMacNeil1/status/1478701601032486920,Wed Apr 08 20:28:29 +0000 2009,29811703,false,Sometimes you have to lose yourself 'fore you can find anything. Canadian living on the east coast. Lover of coffee ☕ and fine adult beverages 🍺.  #RepBX,12638,2529,2485,161,"Cape Breton, Nova Scotia, CA. ",Colin MacNeil 🇨🇦🏴󠁧󠁢󠁳󠁣󠁴󠁿,ColinMacNeil1,58783,,http://beacons.ai/colinmacneil,false
"83.3861244,28.0301616",Wed Jan 05 05:48:46 +0000 2022,winter workfromhome nepal,,https://www.instagram.com/p/CYVlRa6qdg1/?utm_medium=twitter,1,1478604364000501760,,,,en,Nepal,false,,0,,,"<a href=""http://instagram.com"" rel=""nofollow"">Instagram</a>","It's either under the blanket or out in the sun
There's no between
#winter #workfromhome #nepal @ Hunga https://t.co/oBpvMESeyU",https://twitter.com/sudip_post/status/1478604364000501760,Thu Sep 06 01:59:53 +0000 2012,805836691,false,"software engineer @getsimpl


#gopher

I blog frequently, also publish them on
https://t.co/WLrWRrIpRG",5909,696,1975,9,Nepal,~/.sudiprc 🏠,sudip_post,4227,,https://sudipbhandari126.github.io/,false
"152.91599558,-27.67547805",Wed Jan 05 08:56:11 +0000 2022,,,https://www.instagram.com/p/CYV6ufTBzbG/?utm_medium=twitter,0,1478651529515175937,,,,en,"Brisbane, Queensland",false,,0,,,"<a href=""http://instagram.com"" rel=""nofollow"">Instagram</a>","Hump Day Wednesday of the 1st Working Week of 2022

1st working week as Work From Home

Covid-19 go away already @ Spring Mountain https://t.co/NJz9YV93ma",https://twitter.com/BoyetDamot/status/1478651529515175937,Thu Aug 07 10:52:06 +0000 2014,2714278430,false,"Contracts/Commercial Manager, photohobbyist, UP Diliman Civil Engineering, Ateneo MBA, Tau Alpha",94,71,99,1,"Brisbane, Queensland, Australi",Boyet Damot,BoyetDamot,336,,,false
"-84.41978006,33.63975444",Wed Jan 05 14:37:46 +0000 2022,covid,,https://www.instagram.com/p/CYWh0S6Lr35/?utm_medium=twitter,0,1478737490999656449,,,,en,"Georgia, USA",false,,0,,,"<a href=""http://instagram.com"" rel=""nofollow"">Instagram</a>",Got out of Grand Rapids Mi before a snow storm. Heading to Florida for my sons senior trip.  #covid late.   Smooth flights so far. @ Hartsfield-Jackson Atlanta International Airport https://t.co/jptgtphTBY,https://twitter.com/mattdewitt/status/1478737490999656449,Sun Apr 13 02:38:42 +0000 2008,14372466,false,anything tech or the great outdoors.,2095,208,835,19,Michigan,mattdewitt,mattdewitt,11152,,,false
"14.4865036,35.85288308",Wed Jan 05 07:15:34 +0000 2022,Taxi Chauffeur Malta,https://twitter.com/Cab4Now/status/1478626208480829441/photo/1,http://dlvr.it/SGYPdg,0,1478626208480829441,,,,en,Malta,false,,1,,,"<a href=""https://dlvrit.com/"" rel=""nofollow"">dlvr.it</a>",Son’s tribute to ‘inspiring’ taxi driver after coronavirus death https://t.co/v2xJGDRG5U #Taxi #Chauffeur #Malta https://t.co/k4OR9zMPEP,https://twitter.com/Cab4Now/status/1478626208480829441,Fri Aug 27 20:57:00 +0000 2010,183762958,false,"🇬🇧 UK & Malta's Favourite Chauffeur, Private Hire, Taxi & Minicab Website Since 2010. Free airport transfers for patrons in Malta - https://t.co/4P1DfZJSc3 | 🇲🇹",25252,10286,164,143,London,Cab4Now.com,Cab4Now,117427,,https://Cab4Now.com,false
"-0.12485951,51.50538967",Wed Jan 05 06:12:08 +0000 2022,Mexico COVID19 tourismcenters,,http://dlvr.it/SGYH43,0,1478610246905962497,,,,en,"London, England",false,,1,,,"<a href=""https://dlvrit.com/"" rel=""nofollow"">dlvr.it</a>","#Mexico #COVID19 infections up, especially at #tourismcenters https://t.co/0DQzmlhBv4",https://twitter.com/BritishHeraldUK/status/1478610246905962497,Wed Feb 17 17:49:42 +0000 2010,115123902,false,Where Britain Meets the World® | The Official handle of #britishherald,350,133883,607,283,"London, United Kingdom",British Herald,BritishHeraldUK,57106,,http://www.britishherald.com,false
"77.53972151,12.99129637",Wed Jan 05 05:12:53 +0000 2022,ihuvariant covidcrisis covid_19 staysafe wearmask omicron,,https://www.instagram.com/p/CYVhK7eplM8/?utm_medium=twitter,2,1478595337036222469,,,,en,"बैंगलुरु, भारत",false,,0,,,"<a href=""http://instagram.com"" rel=""nofollow"">Instagram</a>",Anyways Happy New Calendar Year 2022 #ihuvariant #covidcrisis #covid_19 #staysafe #wearmask #2022 #omicron @ Basaveshwara Nagar https://t.co/9rE3AdkO5K,https://twitter.com/GDusters/status/1478595337036222469,Mon Apr 27 16:59:07 +0000 2020,1254817317336186885,false,Entertainment Entertainment Entertainment,2,8,2,0,,Garage Dusters,GDusters,1032,,,false
"-92.0294,30.2139",Wed Jan 05 13:51:35 +0000 2022,coffee nighthawksatthediner,,https://www.instagram.com/p/CYWch_mL5AO0JsCZ4Vm9GG9nDzlHD6PnT7BuWM0/?utm_medium=twitter,0,1478725871439470595,,,,en,"Lafayette, LA",false,,0,,,"<a href=""http://instagram.com"" rel=""nofollow"">Instagram</a>","My favorite part of working from home is the quiet lack of hectic, rushed mornings. #coffee @tomwaits #nighthawksatthediner @ Lafayette, Louisiana https://t.co/mM1CtgDOEs",https://twitter.com/LukeSonnier/status/1478725871439470595,Thu Nov 15 04:12:08 +0000 2007,10268982,false,,321,176,95,12,"Lafayette, La",Luke Sonnier,LukeSonnier,2724,,,false
"77.19102783,28.5974128",Wed Jan 05 13:03:39 +0000 2022,,,http://dlvr.it/SGZHSX,0,1478713808654725120,,,,en,"नई दिल्ली, भारत",false,,1,,,"<a href=""https://dlvrit.com/"" rel=""nofollow"">dlvr.it</a>","INNR — What are the COVID-19 variants present in India along with Omicron and their ...: These changes are called mutations,"" explains the World Health Organization. A virus with one or more new mutations is referred to as a “variant” ...  

View… https://t.co/gdNzcvJk5m",https://twitter.com/StigmabaseA/status/1478713808654725120,Sat May 29 17:26:03 +0000 2010,149585330,false,Australia - New Zealand — 日本語  — 中国 — 한국말 |  Keeping up-to-date on global exclusion — Stigmabase is a canadian internet non-profit Initiative. Founded in 2010.,0,2908,1275,139,Asia | Australia - Pacific,Stigmabase | ASIA,StigmabaseA,1550447,,https://www.stigmabase.org/,false
"0.00526746,51.7876357",Wed Jan 05 13:45:42 +0000 2022,covid lateralflowtest hospital coronavirus outpatients,,https://www.instagram.com/p/CYWb28XtxTO/?utm_medium=twitter,0,1478724388468019205,,,,en,"Saint Margarets, East",false,,0,,,"<a href=""http://instagram.com"" rel=""nofollow"">Instagram</a>","Another visit to the hospital, another test #covid #lateralflowtest #hospital #coronavirus #outpatients @ Stanstead Abbots https://t.co/KgnvBgx4Wc",https://twitter.com/drewclayden/status/1478724388468019205,Fri May 29 18:49:21 +0000 2009,43384157,false,Married (to Carol). Father of Five Children. Grand Father to Ten. Live & works in Stanstead Abbotts. Plays Guitar. Breathes In and Out,348,65,88,2,United Kingdom,Andrew Clayden,drewclayden,858,,,false
"-74.5089,40.314",Wed Jan 05 14:15:26 +0000 2022,,,https://www.northjersey.com/story/news/coronavirus/2022/01/03/nj-covid-guidelines-governor-murphy-covid-update/9078022002/,0,1478731870405804035,,,,en,"Cranbury, NJ",false,,0,,,"<a href=""https://help.twitter.com/en/using-twitter/how-to-tweet#source-labels"" rel=""nofollow"">heapevents.info</a>","Nj Covid Guidelines Governor Murphy Covid Update ☝ 😐 
 https://t.co/0WQFmdSjZV",https://twitter.com/heapevents/status/1478731870405804035,Sat Jan 09 15:58:46 +0000 2021,1347935690332495877,false,just heap of US events,0,7,25,1,,heapevents.info,heapevents,21302,,https://www.heapevents.info/,false
"120.31658,16.632614",Wed Jan 05 05:39:39 +0000 2022,,,https://www.swarmapp.com/c/gu31TgCN7gT,1,1478602072782258178,,,,en,"Lungsod ng San Fernando, Rehiyon ng Ilokos",false,,0,,,"<a href=""http://foursquare.com"" rel=""nofollow"">Foursquare</a>","Getting boosted. (@ Lorma Medical Center Covid-19 Vaccination Site in San Fernando, Ilocos Region) https://t.co/JAOF9VaJ5C",https://twitter.com/icheb/status/1478602072782258178,Wed Sep 12 09:15:37 +0000 2007,8829492,false,INTP | probinsiyano | nerd | sci-fi/fantasy fan | IG: _icheb | he/him/siya,5893,427,1076,17,Quezon City | La Union,fredc⚫💿⚪🟣,icheb,22316,,https://www.frederickcalica.com/,false
"-80.01406108,32.78732675",Wed Jan 05 12:39:46 +0000 2022,,,https://www.instagram.com/p/CYWUT9wrG1d/?utm_medium=twitter,1,1478707797093146626,,,,en,"South Carolina, USA",false,,0,,,"<a href=""http://instagram.com"" rel=""nofollow"">Instagram</a>","Unfortunately, we had an employee test positive for Covid. We will be closed today for cleaning and to let our staff get tested. We will reopen as soon as possible. @ Early Bird Diner https://t.co/R33ygFEPIm",https://twitter.com/EarlyBirdDiner/status/1478707797093146626,Thu May 07 11:32:04 +0000 2009,38413163,false,We're the one and only Early Bird Diner located at 1644 Savannah Hwy in Charleston SC ! Open 7 days a week serving breakfast and southern favorites all day ! 🍽,183,1004,401,25,"Charleston, SC",The Early Bird Diner,EarlyBirdDiner,2050,,http://www.earlybirddiner.com,false
"-71.5342357,42.5286064",Wed Jan 05 14:00:11 +0000 2022,,,https://www.glimmerbug.com/blog/learn-how-to-create-your-own-covid-vaccination-card-holder-for-your-family,0,1478728035541131272,,,,en,"Massachusetts, USA",false,,0,,,"<a href=""http://www.squarespace.com"" rel=""nofollow"">Squarespace</a>",Learn How to Create Your Own Covid Vaccination Card Holder for Your Family  https://t.co/7ggoQLDUjs,https://twitter.com/glimmerbugart/status/1478728035541131272,Sat Mar 23 21:34:03 +0000 2013,1292546900,false,"Mixed media artist focusing on positivity, joy and love. Online mixed media art + craft classes teaching whimsical and creative projects for all levels.",18,240,356,37,"Harvard, MA",glimmerbug,glimmerbugart,4539,,http://www.glimmerbug.com,false
"13.59123828,51.03192139",Wed Jan 05 14:50:44 +0000 2022,,https://twitter.com/Superlokkus/status/1478740757792137223/photo/1,https://www.economist.com/finance-and-economics/which-economies-have-done-best-and-worst-during-the-pandemic/21806917,0,1478740757792137223,,,,en,"Dresden, Deutschland",false,,0,,,"<a href=""http://tapbots.com/tweetbot"" rel=""nofollow"">Tweetbot for iΟS</a>","„Many big European countries, however, such as Britain, Germany and Italy, have fared worse. Spain has done worst of all.“ https://t.co/EJoJgqPAuy Which economies have done best and worst during the pandemic? from TheEconomist https://t.co/gh4glxCPyi",https://twitter.com/Superlokkus/status/1478740757792137223,Thu Feb 26 10:56:36 +0000 2009,21997955,false,Politik Luftfahrt Züge Physik Informatik,349,121,48,13,Dresden Germany,Markus Klemm,Superlokkus,14109,,http://www.markusklemm.net,false
"76.9667,11",Wed Jan 05 05:08:38 +0000 2022,Nonsense kadhalkanave love dream alarm distancelove onesidedlove oneside lovers soup soupboy dreams cutecouples cuteuponnu santhosh lockdown omicron,,https://www.instagram.com/p/CYVgryHpUlM/?utm_medium=twitter,0,1478594266431692802,,,,en,"कोयम्बटूर, भारत",false,,0,,,"<a href=""http://instagram.com"" rel=""nofollow"">Instagram</a>","Kadhal kanave

Tomorrow @nonsensetamil 

#Nonsense #kadhalkanave #love #dream #alarm #distancelove #onesidedlove #oneside #lovers #soup #soupboy #dreams #cutecouples #cuteuponnu #santhosh #lockdown #omicron https://t.co/BieaPmQF2O",https://twitter.com/NonsenseTamil/status/1478594266431692802,Sun Jun 07 08:07:24 +0000 2020,1269541411625431040,false,"Non Sense is an infotainment channel aiming for more fun and entertainment. Watch, Share and Subscribe ....",10,7,1,0,coimbatore,Nonsense Tamil,NonsenseTamil,349,,https://www.youtube.com/channel/UCZK5eyA4P03KqfsF-g0bs1g/featured,false
"-0.12485951,51.50538967",Wed Jan 05 06:33:38 +0000 2022,CDC isolation quarantine,,http://dlvr.it/SGYKG9,1,1478615654898884609,,,,en,"London, England",false,,1,,,"<a href=""https://dlvrit.com/"" rel=""nofollow"">dlvr.it</a>","#CDC posts rationale for shorter #isolation, #quarantine https://t.co/8zTf5G8T41",https://twitter.com/BritishHeraldUK/status/1478615654898884609,Wed Feb 17 17:49:42 +0000 2010,115123902,false,Where Britain Meets the World® | The Official handle of #britishherald,350,133883,607,283,"London, United Kingdom",British Herald,BritishHeraldUK,57106,,http://www.britishherald.com,false
"-78.6236,35.7068",Wed Jan 05 14:14:43 +0000 2022,variegatedpinklemon,,https://www.instagram.com/gardeningsavesmylife/p/CYWfLXUrrZB/?utm_medium=twitter,5,1478731692487684101,,,,en,"Garner, NC",false,,0,,,"<a href=""http://instagram.com"" rel=""nofollow"">Instagram</a>","More lemons coming in, and our covid symptoms are almost gone. Woot! 😍🍋❤️ #variegatedpinklemon @ Garner, North Carolina https://t.co/YYJYvtbiwP",https://twitter.com/ahoychrispineda/status/1478731692487684101,Sat Nov 06 18:48:38 +0000 2010,212675564,false,"Dead inside, but caffeinated. 🥀 ♥ https://t.co/aRzJ0YZcWG ♥ https://t.co/AUJOCQRNcX #LGBTQIA+",343826,26458,30256,207,"Garner, NC",Unicorn of Love,ahoychrispineda,41950,,https://www.instagram.com/p/BAZ5HaKHfnP/,false
"114.158,22.2826",Wed Jan 05 05:42:44 +0000 2022,covid omicronvariant zerocovid,,https://www.instagram.com/p/CYVkhQ-pgQk/?utm_medium=twitter,0,1478602845578481666,,,,en,"中西區, 香港",false,,0,,,"<a href=""http://instagram.com"" rel=""nofollow"">Instagram</a>","Hong Kong's first untraceable local covid case after a several months' long zero local covid streak.
#covid #omicronvariant #zerocovid @ Hongkong https://t.co/dL7mY48V0p",https://twitter.com/MelissaGecolea/status/1478602845578481666,Wed Aug 10 00:56:19 +0000 2011,352002960,false,"Hong Kong-based broadcast journalist, TCK. All views are my own.",274,1419,288,39,Hong Kong,Melissa Gecolea,MelissaGecolea,1617,,,false
"76.41611519,30.33500501",Wed Jan 05 12:27:40 +0000 2022,,,https://patialapolitics.com/covidhelpline-numbers-for-patiala/ https://www.instagram.com/p/CYWS7Y5BSK3/?utm_medium=twitter,1,1478704750443089928,,,,en,"पटियाला, भारत",true,,0,,,"<a href=""http://instagram.com"" rel=""nofollow"">Instagram</a>","Covid:Helpline numbers for Patiala🔴👇

https://t.co/oOrG1YqOjj @ Patiala Politics https://t.co/5lw72LyvxQ",https://twitter.com/patialapolitics/status/1478704750443089928,Tue Jun 14 07:20:13 +0000 2016,742617624886935553,false,Patiala Politics will give update about Patiala city,14,701,469,3,"पटियाला, भारत",Patiala Politics,patialapolitics,31592,,http://www.patialapolitics.com,false
"126.98244019,37.54274326",Wed Jan 05 09:17:09 +0000 2022,,,http://dlvr.it/SGYgWn,0,1478656807761375232,,,,en,대한민국 용산구,false,,1,,,"<a href=""https://dlvrit.com/"" rel=""nofollow"">dlvr.it</a>","KRNR — S.Korea Court Exempts Private Schools From Vaccine Passes: A South Korean court ordered that private educational facilities, including cram schools, should be temporarily excluded from ...  

View article... https://t.co/OnN5Ks4ebR",https://twitter.com/StigmabaseU/status/1478656807761375232,Tue Oct 26 15:04:54 +0000 2010,208056970,false,Asia — भारत  — Türkçe — Čeština — ελληνικά | Keeping up-to-date on global exclusion — Stigmabase is a canadian internet non-profit Initiative,0,2528,2405,117,WORLDWIDE,Stigmabase | UN,StigmabaseU,1607149,,https://www.stigmabase.org/,false
"-0.12485951,51.50538967",Wed Jan 05 06:47:02 +0000 2022,presidentialcontenders pandemic,,http://dlvr.it/SGYLVt,1,1478619028717404161,,,,en,"London, England",false,,1,,,"<a href=""https://dlvrit.com/"" rel=""nofollow"">dlvr.it</a>",French #presidentialcontenders adapt campaign to #pandemic https://t.co/AtLSVl2bj0,https://twitter.com/BritishHeraldUK/status/1478619028717404161,Wed Feb 17 17:49:42 +0000 2010,115123902,false,Where Britain Meets the World® | The Official handle of #britishherald,350,133883,607,283,"London, United Kingdom",British Herald,BritishHeraldUK,57106,,http://www.britishherald.com,false
"-2.31310309,53.49831484",Wed Jan 05 14:13:13 +0000 2022,catsofinstagram workfromhome,,https://www.instagram.com/p/CYWfALfo6qy/?utm_medium=twitter,0,1478731315105222658,,,,en,"Salford, England",false,,0,,,"<a href=""http://instagram.com"" rel=""nofollow"">Instagram</a>",#catsofinstagram bag cat Tilda. #workfromhome perks. 😂 @ Light Oaks Park https://t.co/FuWzsD7p7f,https://twitter.com/Franholmespro/status/1478731315105222658,Fri Jun 24 11:11:24 +0000 2011,323166573,false,There is no Dana only Zool,11273,1166,3699,39,UK,Fran Roach,Franholmespro,15063,,,false
"14.4865036,35.85288308",Wed Jan 05 14:57:34 +0000 2022,Taxi Chauffeur Malta,https://twitter.com/Cab4Now/status/1478742474369613828/photo/1,http://dlvr.it/SGZcz7,0,1478742474369613828,,,,en,Malta,false,,1,,,"<a href=""https://dlvrit.com/"" rel=""nofollow"">dlvr.it</a>",‘We’re risking our life’: coronavirus takes a toll on essential workers still on the job https://t.co/16pJL67oKY #Taxi #Chauffeur #Malta https://t.co/uFq2CpjLgD,https://twitter.com/Cab4Now/status/1478742474369613828,Fri Aug 27 20:57:00 +0000 2010,183762958,false,"🇬🇧 UK & Malta's Favourite Chauffeur, Private Hire, Taxi & Minicab Website Since 2010. Free airport transfers for patrons in Malta - https://t.co/4P1DfZJSc3 | 🇲🇹",25252,10286,164,143,London,Cab4Now.com,Cab4Now,117427,,https://Cab4Now.com,false
"76.41611519,30.33500501",Wed Jan 05 09:15:43 +0000 2022,,,https://patialapolitics.com/covidall-rallies-of-punjab-congress-postponed/ https://www.instagram.com/p/CYV89Y0hSAm/?utm_medium=twitter,0,1478656443968540674,,,,en,"पटियाला, भारत",true,,0,,,"<a href=""http://instagram.com"" rel=""nofollow"">Instagram</a>","Covid:All rallies of Punjab Congress postponed🔴👇

https://t.co/yXG2rU1HVo @ Patiala Politics https://t.co/4V56XQ98hV",https://twitter.com/patialapolitics/status/1478656443968540674,Tue Jun 14 07:20:13 +0000 2016,742617624886935553,false,Patiala Politics will give update about Patiala city,14,701,469,3,"पटियाला, भारत",Patiala Politics,patialapolitics,31592,,http://www.patialapolitics.com,false
"36.821945,-1.292066",Wed Jan 05 07:40:43 +0000 2022,,,,0,1478632537773727746,KenyansOnReddit,1478632536712568834,1269598733878079500,en,"Nairobi, Kenya",,,0,,,"<a href=""https://twitter.com/hermoand"" rel=""nofollow"">Kenyans On Reddit</a>",screening at hospital entry points (I recently walked into a major hospital and didn't get screened. Literally the whole screening issue magically disappeared with vaccination). Another idea is Insurance covers should also cover COVID 19 - [8/10],https://twitter.com/KenyansOnReddit/status/1478632537773727746,Sun Jun 07 11:55:21 +0000 2020,1269598733878079488,false,"Come join your fellow Kenyans™ on Reddit 👉 https://t.co/jgE8q6ov1E 

- #TopReply
- #rKenyaModLog
- #RemovedByMods
- #DeletedByAuthor
- #rKenyaVideo",796,254,17,3,Nairobi,Kenyans On Reddit 🇰🇪,KenyansOnReddit,44993,,https://reddit.com/r/kenya,false
"121.03286034,14.60546162",Wed Jan 05 13:14:18 +0000 2022,ModernaVaccine,,https://www.instagram.com/p/CYWYRArPC4h/?utm_medium=twitter,0,1478716489347727360,,,,en,"Lungsod ng San Juan, Pambansang Punong Rehiyon",false,,0,,,"<a href=""http://instagram.com"" rel=""nofollow"">Instagram</a>","Hello Guyz 🌟🌟🌟
Done Na Mag Pa Vaccine Booster Shot 💉💉
#ModernaVaccine 😇😘😍☺😉👍👊 @ Filoil Flying V Centre https://t.co/EekRxWEDdw",https://twitter.com/iamrholly0517/status/1478716489347727360,Sat Jul 09 04:12:09 +0000 2011,332050409,false,"⏩ It's My Official Twitter Account
⏩ Freelance Talent Since 2014 (Teleserye•Movies•Indie Film•TVC)
⏩ Instagram Account (https://t.co/n9bsYVsCeZ)",108,60,242,0,,Rolly Morales,iamrholly0517,1156,,http://facebook.com/rholly17morales,false
"-82.18326746,36.5816746",Wed Jan 05 12:54:32 +0000 2022,,,https://www.instagram.com/p/CYWWADUr7kT/?utm_medium=twitter,0,1478711511434641408,,,,en,"Tennessee, USA",false,,0,,,"<a href=""http://instagram.com"" rel=""nofollow"">Instagram</a>","Wear a mask, save a life. ;) @ Tennessee High School https://t.co/Q9tT9zbdn4",https://twitter.com/rroman24201/status/1478711511434641408,Fri Sep 12 03:16:29 +0000 2014,2804834282,false,"Puerto Rican; male. Jibaro, perdio en VA/TN. Bucket list? Move, to Florida, a.s.a.p. Back, to NY, won't be bad, either.",586,7,118,0,"Middle of Nowhere, Bristol, Tn","Jibaro, perdio en TN",rroman24201,1088,,,false
